[I 2024-09-28 00:10:54,448] Trial 22 finished with value: 0.060397106574131915 and parameters: {'learning_rate': 0.01, 'batch_size': 64, 'network_type': 'RNN', 'num_layers': 1, 'num_neurons': 32, 'dropout_rate': 0.1}. Best is trial 6 with value: 0.03477203882657564.
[I 2024-09-28 00:10:58,660] Trial 23 finished with value: 0.040695460539597765 and parameters: {'learning_rate': 0.01, 'batch_size': 64, 'network_type': 'RNN', 'num_layers': 1, 'num_neurons': 32, 'dropout_rate': 0.1}. Best is trial 6 with value: 0.03477203882657564.
[I 2024-09-28 00:11:04,896] Trial 24 finished with value: 0.03813162176425644 and parameters: {'learning_rate': 0.01, 'batch_size': 32, 'network_type': 'RNN', 'num_layers': 2, 'num_neurons': 32, 'dropout_rate': 0.3}. Best is trial 6 with value: 0.03477203882657564.
[I 2024-09-28 00:11:09,346] Trial 25 finished with value: 0.04062127109674311 and parameters: {'learning_rate': 0.01, 'batch_size': 64, 'network_type': 'RNN', 'num_layers': 1, 'num_neurons': 32, 'dropout_rate': 0.1}. Best is trial 6 with value: 0.03477203882657564.
[I 2024-09-28 00:11:16,033] Trial 26 finished with value: 0.03950740242004398 and parameters: {'learning_rate': 0.01, 'batch_size': 32, 'network_type': 'RNN', 'num_layers': 2, 'num_neurons': 32, 'dropout_rate': 0.3}. Best is trial 6 with value: 0.03477203882657564.
[I 2024-09-28 00:11:20,364] Trial 27 finished with value: 0.04690089552219101 and parameters: {'learning_rate': 0.01, 'batch_size': 64, 'network_type': 'RNN', 'num_layers': 1, 'num_neurons': 16, 'dropout_rate': 0.1}. Best is trial 6 with value: 0.03477203882657564.
[I 2024-09-28 00:11:30,646] Trial 28 finished with value: 0.046297921180725135 and parameters: {'learning_rate': 0.01, 'batch_size': 64, 'network_type': 'LSTM', 'num_layers': 2, 'num_neurons': 64, 'dropout_rate': 0.3}. Best is trial 6 with value: 0.03477203882657564.
[I 2024-09-28 00:11:36,957] Trial 29 finished with value: 0.04120100879669193 and parameters: {'learning_rate': 0.01, 'batch_size': 32, 'network_type': 'GRU', 'num_layers': 1, 'num_neurons': 32, 'dropout_rate': 0.1}. Best is trial 6 with value: 0.03477203882657564.
[I 2024-09-28 00:11:43,715] Trial 30 finished with value: 0.05143723080708434 and parameters: {'learning_rate': 0.01, 'batch_size': 16, 'network_type': 'LSTM', 'num_layers': 1, 'num_neurons': 128, 'dropout_rate': 0.2}. Best is trial 6 with value: 0.03477203882657564.
[I 2024-09-28 00:11:49,209] Trial 31 finished with value: 0.036640348617847124 and parameters: {'learning_rate': 0.01, 'batch_size': 64, 'network_type': 'RNN', 'num_layers': 1, 'num_neurons': 64, 'dropout_rate': 0.1}. Best is trial 6 with value: 0.03477203882657564.
[I 2024-09-28 00:11:53,546] Trial 32 finished with value: 0.05548762978040257 and parameters: {'learning_rate': 0.01, 'batch_size': 64, 'network_type': 'RNN', 'num_layers': 1, 'num_neurons': 64, 'dropout_rate': 0.1}. Best is trial 6 with value: 0.03477203882657564.
[I 2024-09-28 00:11:57,698] Trial 33 finished with value: 0.042364253044128455 and parameters: {'learning_rate': 0.01, 'batch_size': 64, 'network_type': 'RNN', 'num_layers': 1, 'num_neurons': 64, 'dropout_rate': 0.1}. Best is trial 6 with value: 0.03477203882657564.
[I 2024-09-28 00:12:04,508] Trial 34 finished with value: 0.0344797178415152 and parameters: {'learning_rate': 0.01, 'batch_size': 64, 'network_type': 'RNN', 'num_layers': 3, 'num_neurons': 64, 'dropout_rate': 0.1}. Best is trial 34 with value: 0.0344797178415152.
[I 2024-09-28 00:12:12,519] Trial 35 finished with value: 0.03604617812083317 and parameters: {'learning_rate': 0.01, 'batch_size': 64, 'network_type': 'RNN', 'num_layers': 3, 'num_neurons': 64, 'dropout_rate': 0.1}. Best is trial 34 with value: 0.0344797178415152.
[I 2024-09-28 00:12:20,458] Trial 36 finished with value: 0.044407618669363144 and parameters: {'learning_rate': 0.01, 'batch_size': 64, 'network_type': 'RNN', 'num_layers': 3, 'num_neurons': 64, 'dropout_rate': 0.2}. Best is trial 34 with value: 0.0344797178415152.
[I 2024-09-28 00:12:35,524] Trial 37 finished with value: 0.036970185976762056 and parameters: {'learning_rate': 0.01, 'batch_size': 64, 'network_type': 'GRU', 'num_layers': 3, 'num_neurons': 64, 'dropout_rate': 0.3}. Best is trial 34 with value: 0.0344797178415152.
[I 2024-09-28 00:12:42,712] Trial 38 finished with value: 0.05174126493013826 and parameters: {'learning_rate': 0.01, 'batch_size': 16, 'network_type': 'RNN', 'num_layers': 3, 'num_neurons': 16, 'dropout_rate': 0.1}. Best is trial 34 with value: 0.0344797178415152.
[I 2024-09-28 00:12:50,814] Trial 39 finished with value: 0.03761219937984764 and parameters: {'learning_rate': 0.01, 'batch_size': 64, 'network_type': 'RNN', 'num_layers': 3, 'num_neurons': 64, 'dropout_rate': 0.2}. Best is trial 34 with value: 0.0344797178415152.
[I 2024-09-28 00:13:06,017] Trial 40 finished with value: 0.04423245760110707 and parameters: {'learning_rate': 0.01, 'batch_size': 64, 'network_type': 'GRU', 'num_layers': 3, 'num_neurons': 64, 'dropout_rate': 0.1}. Best is trial 34 with value: 0.0344797178415152.
[I 2024-09-28 00:13:13,022] Trial 41 finished with value: 0.038919134506812454 and parameters: {'learning_rate': 0.01, 'batch_size': 64, 'network_type': 'RNN', 'num_layers': 3, 'num_neurons': 64, 'dropout_rate': 0.1}. Best is trial 34 with value: 0.0344797178415152.
[I 2024-09-28 00:13:19,806] Trial 42 finished with value: 0.04349728690660921 and parameters: {'learning_rate': 0.01, 'batch_size': 64, 'network_type': 'RNN', 'num_layers': 3, 'num_neurons': 64, 'dropout_rate': 0.1}. Best is trial 34 with value: 0.0344797178415152.
[I 2024-09-28 00:13:26,785] Trial 43 finished with value: 0.0480055426084078 and parameters: {'learning_rate': 0.01, 'batch_size': 64, 'network_type': 'RNN', 'num_layers': 3, 'num_neurons': 64, 'dropout_rate': 0.1}. Best is trial 34 with value: 0.0344797178415152.
[I 2024-09-28 00:13:35,633] Trial 44 finished with value: 0.035844200207636887 and parameters: {'learning_rate': 0.01, 'batch_size': 64, 'network_type': 'RNN', 'num_layers': 3, 'num_neurons': 128, 'dropout_rate': 0.1}. Best is trial 34 with value: 0.0344797178415152.
[I 2024-09-28 00:13:49,841] Trial 45 finished with value: 0.047851135694063664 and parameters: {'learning_rate': 0.01, 'batch_size': 16, 'network_type': 'LSTM', 'num_layers': 3, 'num_neurons': 128, 'dropout_rate': 0.1}. Best is trial 34 with value: 0.0344797178415152.
[I 2024-09-28 00:13:56,473] Trial 46 finished with value: 0.041767179562495343 and parameters: {'learning_rate': 0.01, 'batch_size': 64, 'network_type': 'RNN', 'num_layers': 3, 'num_neurons': 128, 'dropout_rate': 0.1}. Best is trial 34 with value: 0.0344797178415152.
[I 2024-09-28 00:14:04,981] Trial 47 finished with value: 0.0764259234575125 and parameters: {'learning_rate': 0.01, 'batch_size': 64, 'network_type': 'RNN', 'num_layers': 3, 'num_neurons': 128, 'dropout_rate': 0.2}. Best is trial 34 with value: 0.0344797178415152.
[I 2024-09-28 00:14:12,576] Trial 48 finished with value: 0.05750458218501167 and parameters: {'learning_rate': 0.01, 'batch_size': 64, 'network_type': 'RNN', 'num_layers': 3, 'num_neurons': 128, 'dropout_rate': 0.1}. Best is trial 34 with value: 0.0344797178415152.
[I 2024-09-28 00:14:19,373] Trial 49 finished with value: 0.06055521209423361 and parameters: {'learning_rate': 0.01, 'batch_size': 64, 'network_type': 'RNN', 'num_layers': 3, 'num_neurons': 128, 'dropout_rate': 0.3}. Best is trial 34 with value: 0.0344797178415152.
[I 2024-09-28 00:14:26,544] Trial 50 finished with value: 0.05840511666811432 and parameters: {'learning_rate': 0.01, 'batch_size': 16, 'network_type': 'RNN', 'num_layers': 3, 'num_neurons': 16, 'dropout_rate': 0.1}. Best is trial 34 with value: 0.0344797178415152.
[I 2024-09-28 00:14:31,904] Trial 51 finished with value: 0.05258811396818898 and parameters: {'learning_rate': 0.01, 'batch_size': 64, 'network_type': 'RNN', 'num_layers': 2, 'num_neurons': 64, 'dropout_rate': 0.1}. Best is trial 34 with value: 0.0344797178415152.
[I 2024-09-28 00:14:39,416] Trial 52 finished with value: 0.04912333143674408 and parameters: {'learning_rate': 0.01, 'batch_size': 64, 'network_type': 'RNN', 'num_layers': 3, 'num_neurons': 64, 'dropout_rate': 0.1}. Best is trial 34 with value: 0.0344797178415152.
[I 2024-09-28 00:14:45,038] Trial 53 finished with value: 0.03973233659450828 and parameters: {'learning_rate': 0.01, 'batch_size': 64, 'network_type': 'RNN', 'num_layers': 2, 'num_neurons': 64, 'dropout_rate': 0.1}. Best is trial 34 with value: 0.0344797178415152.
[I 2024-09-28 00:14:52,603] Trial 54 finished with value: 0.03817817757679869 and parameters: {'learning_rate': 0.01, 'batch_size': 64, 'network_type': 'RNN', 'num_layers': 3, 'num_neurons': 128, 'dropout_rate': 0.1}. Best is trial 34 with value: 0.0344797178415152.
[I 2024-09-28 00:14:56,665] Trial 55 finished with value: 0.048108756138728254 and parameters: {'learning_rate': 0.01, 'batch_size': 64, 'network_type': 'RNN', 'num_layers': 1, 'num_neurons': 32, 'dropout_rate': 0.1}. Best is trial 34 with value: 0.0344797178415152.
[I 2024-09-28 00:15:05,827] Trial 56 finished with value: 0.04602513364645155 and parameters: {'learning_rate': 0.01, 'batch_size': 64, 'network_type': 'GRU', 'num_layers': 2, 'num_neurons': 64, 'dropout_rate': 0.3}. Best is trial 34 with value: 0.0344797178415152.
[I 2024-09-28 00:15:12,631] Trial 57 finished with value: 0.045080001134138875 and parameters: {'learning_rate': 0.01, 'batch_size': 64, 'network_type': 'LSTM', 'num_layers': 1, 'num_neurons': 32, 'dropout_rate': 0.1}. Best is trial 34 with value: 0.0344797178415152.
[I 2024-09-28 00:15:19,986] Trial 58 finished with value: 0.04192974435366121 and parameters: {'learning_rate': 0.01, 'batch_size': 64, 'network_type': 'RNN', 'num_layers': 3, 'num_neurons': 16, 'dropout_rate': 0.1}. Best is trial 34 with value: 0.0344797178415152.
[I 2024-09-28 00:15:23,800] Trial 59 finished with value: 0.05128662820962763 and parameters: {'learning_rate': 0.01, 'batch_size': 64, 'network_type': 'RNN', 'num_layers': 1, 'num_neurons': 32, 'dropout_rate': 0.3}. Best is trial 34 with value: 0.0344797178415152.
[I 2024-09-28 00:15:29,557] Trial 60 finished with value: 0.044076566109290526 and parameters: {'learning_rate': 0.01, 'batch_size': 64, 'network_type': 'RNN', 'num_layers': 2, 'num_neurons': 64, 'dropout_rate': 0.1}. Best is trial 34 with value: 0.0344797178415152.
[I 2024-09-28 00:15:42,023] Trial 61 finished with value: 0.039002945386446476 and parameters: {'learning_rate': 0.01, 'batch_size': 64, 'network_type': 'GRU', 'num_layers': 3, 'num_neurons': 64, 'dropout_rate': 0.3}. Best is trial 34 with value: 0.0344797178415152.
[I 2024-09-28 00:15:55,731] Trial 62 finished with value: 0.03762727260589598 and parameters: {'learning_rate': 0.01, 'batch_size': 64, 'network_type': 'GRU', 'num_layers': 3, 'num_neurons': 64, 'dropout_rate': 0.3}. Best is trial 34 with value: 0.0344797178415152.
[I 2024-09-28 00:16:09,055] Trial 63 finished with value: 0.04232724314469561 and parameters: {'learning_rate': 0.01, 'batch_size': 64, 'network_type': 'GRU', 'num_layers': 3, 'num_neurons': 64, 'dropout_rate': 0.3}. Best is trial 34 with value: 0.0344797178415152.
[I 2024-09-28 00:16:22,974] Trial 64 finished with value: 0.037946595191955604 and parameters: {'learning_rate': 0.01, 'batch_size': 64, 'network_type': 'GRU', 'num_layers': 3, 'num_neurons': 64, 'dropout_rate': 0.3}. Best is trial 34 with value: 0.0344797178415152.
[I 2024-09-28 00:16:29,502] Trial 65 finished with value: 0.04322725494091331 and parameters: {'learning_rate': 0.01, 'batch_size': 64, 'network_type': 'GRU', 'num_layers': 1, 'num_neurons': 32, 'dropout_rate': 0.3}. Best is trial 34 with value: 0.0344797178415152.
[I 2024-09-28 00:16:36,217] Trial 66 finished with value: 0.1042609303547786 and parameters: {'learning_rate': 0.01, 'batch_size': 16, 'network_type': 'RNN', 'num_layers': 3, 'num_neurons': 64, 'dropout_rate': 0.3}. Best is trial 34 with value: 0.0344797178415152.
[I 2024-09-28 00:16:45,353] Trial 67 finished with value: 0.034685207843780555 and parameters: {'learning_rate': 0.0001, 'batch_size': 64, 'network_type': 'RNN', 'num_layers': 2, 'num_neurons': 128, 'dropout_rate': 0.2}. Best is trial 34 with value: 0.0344797178415152.
[I 2024-09-28 00:16:55,390] Trial 68 finished with value: 0.034206568791316144 and parameters: {'learning_rate': 0.0001, 'batch_size': 64, 'network_type': 'RNN', 'num_layers': 2, 'num_neurons': 128, 'dropout_rate': 0.2}. Best is trial 68 with value: 0.034206568791316144.
[I 2024-09-28 00:17:03,569] Trial 69 finished with value: 0.03555831960531385 and parameters: {'learning_rate': 0.0001, 'batch_size': 32, 'network_type': 'RNN', 'num_layers': 2, 'num_neurons': 128, 'dropout_rate': 0.2}. Best is trial 68 with value: 0.034206568791316144.
[I 2024-09-28 00:17:11,621] Trial 70 finished with value: 0.03458484279192415 and parameters: {'learning_rate': 0.0001, 'batch_size': 32, 'network_type': 'RNN', 'num_layers': 2, 'num_neurons': 128, 'dropout_rate': 0.2}. Best is trial 68 with value: 0.034206568791316144.
[I 2024-09-28 00:17:19,719] Trial 71 finished with value: 0.037509129194112964 and parameters: {'learning_rate': 0.0001, 'batch_size': 32, 'network_type': 'RNN', 'num_layers': 2, 'num_neurons': 128, 'dropout_rate': 0.2}. Best is trial 68 with value: 0.034206568791316144.
[I 2024-09-28 00:17:29,687] Trial 72 finished with value: 0.034529254583212085 and parameters: {'learning_rate': 0.0001, 'batch_size': 32, 'network_type': 'RNN', 'num_layers': 2, 'num_neurons': 128, 'dropout_rate': 0.2}. Best is trial 68 with value: 0.034206568791316144.
[I 2024-09-28 00:17:39,373] Trial 73 finished with value: 0.03794149670234097 and parameters: {'learning_rate': 0.0001, 'batch_size': 32, 'network_type': 'RNN', 'num_layers': 2, 'num_neurons': 128, 'dropout_rate': 0.2}. Best is trial 68 with value: 0.034206568791316144.
[I 2024-09-28 00:17:47,103] Trial 74 finished with value: 0.034929077955392726 and parameters: {'learning_rate': 0.0001, 'batch_size': 32, 'network_type': 'RNN', 'num_layers': 2, 'num_neurons': 128, 'dropout_rate': 0.2}. Best is trial 68 with value: 0.034206568791316144.
[I 2024-09-28 00:17:54,217] Trial 75 finished with value: 0.035261859857119084 and parameters: {'learning_rate': 0.0001, 'batch_size': 32, 'network_type': 'RNN', 'num_layers': 2, 'num_neurons': 128, 'dropout_rate': 0.2}. Best is trial 68 with value: 0.034206568791316144.
[I 2024-09-28 00:18:03,546] Trial 76 finished with value: 0.033845117055452824 and parameters: {'learning_rate': 0.0001, 'batch_size': 32, 'network_type': 'RNN', 'num_layers': 2, 'num_neurons': 128, 'dropout_rate': 0.2}. Best is trial 76 with value: 0.033845117055452824.
[I 2024-09-28 00:18:11,446] Trial 77 finished with value: 0.035633430627676196 and parameters: {'learning_rate': 0.0001, 'batch_size': 32, 'network_type': 'RNN', 'num_layers': 2, 'num_neurons': 128, 'dropout_rate': 0.2}. Best is trial 76 with value: 0.033845117055452824.
[I 2024-09-28 00:18:20,863] Trial 78 finished with value: 0.06412803829633275 and parameters: {'learning_rate': 0.01, 'batch_size': 32, 'network_type': 'LSTM', 'num_layers': 2, 'num_neurons': 128, 'dropout_rate': 0.2}. Best is trial 76 with value: 0.033845117055452824.
[I 2024-09-28 00:18:26,048] Trial 79 finished with value: 0.04442962734515854 and parameters: {'learning_rate': 0.01, 'batch_size': 32, 'network_type': 'RNN', 'num_layers': 2, 'num_neurons': 128, 'dropout_rate': 0.2}. Best is trial 76 with value: 0.033845117055452824.
[I 2024-09-28 00:18:31,452] Trial 80 finished with value: 0.0496537956457872 and parameters: {'learning_rate': 0.01, 'batch_size': 32, 'network_type': 'RNN', 'num_layers': 2, 'num_neurons': 128, 'dropout_rate': 0.2}. Best is trial 76 with value: 0.033845117055452824.
[I 2024-09-28 00:18:41,244] Trial 81 finished with value: 0.034745023397299 and parameters: {'learning_rate': 0.0001, 'batch_size': 32, 'network_type': 'RNN', 'num_layers': 2, 'num_neurons': 128, 'dropout_rate': 0.2}. Best is trial 76 with value: 0.033845117055452824.
[I 2024-09-28 00:18:48,348] Trial 82 finished with value: 0.03664020351263197 and parameters: {'learning_rate': 0.0001, 'batch_size': 32, 'network_type': 'RNN', 'num_layers': 2, 'num_neurons': 128, 'dropout_rate': 0.2}. Best is trial 76 with value: 0.033845117055452824.
[I 2024-09-28 00:18:54,399] Trial 83 finished with value: 0.03852392361714289 and parameters: {'learning_rate': 0.01, 'batch_size': 32, 'network_type': 'RNN', 'num_layers': 2, 'num_neurons': 128, 'dropout_rate': 0.2}. Best is trial 76 with value: 0.033845117055452824.
[I 2024-09-28 00:18:59,621] Trial 84 finished with value: 0.038362390444828906 and parameters: {'learning_rate': 0.01, 'batch_size': 32, 'network_type': 'RNN', 'num_layers': 2, 'num_neurons': 128, 'dropout_rate': 0.2}. Best is trial 76 with value: 0.033845117055452824.
[I 2024-09-28 00:19:06,021] Trial 85 finished with value: 0.04207496419319744 and parameters: {'learning_rate': 0.01, 'batch_size': 32, 'network_type': 'RNN', 'num_layers': 2, 'num_neurons': 128, 'dropout_rate': 0.2}. Best is trial 76 with value: 0.033845117055452824.
[I 2024-09-28 00:19:11,464] Trial 86 finished with value: 0.05183850761560297 and parameters: {'learning_rate': 0.01, 'batch_size': 32, 'network_type': 'RNN', 'num_layers': 2, 'num_neurons': 128, 'dropout_rate': 0.2}. Best is trial 76 with value: 0.033845117055452824.
[I 2024-09-28 00:19:17,427] Trial 87 finished with value: 0.03473179963918835 and parameters: {'learning_rate': 0.01, 'batch_size': 32, 'network_type': 'RNN', 'num_layers': 2, 'num_neurons': 128, 'dropout_rate': 0.2}. Best is trial 76 with value: 0.033845117055452824.
[I 2024-09-28 00:19:22,981] Trial 88 finished with value: 0.03617219081291783 and parameters: {'learning_rate': 0.01, 'batch_size': 32, 'network_type': 'RNN', 'num_layers': 2, 'num_neurons': 128, 'dropout_rate': 0.2}. Best is trial 76 with value: 0.033845117055452824.
[I 2024-09-28 00:19:28,069] Trial 89 finished with value: 0.0635572944054237 and parameters: {'learning_rate': 0.01, 'batch_size': 32, 'network_type': 'RNN', 'num_layers': 2, 'num_neurons': 128, 'dropout_rate': 0.2}. Best is trial 76 with value: 0.033845117055452824.
[I 2024-09-28 00:19:33,579] Trial 90 finished with value: 0.03573916306862462 and parameters: {'learning_rate': 0.01, 'batch_size': 32, 'network_type': 'RNN', 'num_layers': 2, 'num_neurons': 128, 'dropout_rate': 0.2}. Best is trial 76 with value: 0.033845117055452824.
[I 2024-09-28 00:19:38,821] Trial 91 finished with value: 0.06484122888858504 and parameters: {'learning_rate': 0.01, 'batch_size': 32, 'network_type': 'RNN', 'num_layers': 2, 'num_neurons': 128, 'dropout_rate': 0.2}. Best is trial 76 with value: 0.033845117055452824.
[I 2024-09-28 00:19:44,655] Trial 92 finished with value: 0.03621302817418027 and parameters: {'learning_rate': 0.01, 'batch_size': 32, 'network_type': 'RNN', 'num_layers': 2, 'num_neurons': 128, 'dropout_rate': 0.2}. Best is trial 76 with value: 0.033845117055452824.
[I 2024-09-28 00:19:51,841] Trial 93 finished with value: 0.0402198980037983 and parameters: {'learning_rate': 0.01, 'batch_size': 32, 'network_type': 'RNN', 'num_layers': 2, 'num_neurons': 128, 'dropout_rate': 0.2}. Best is trial 76 with value: 0.033845117055452824.
[I 2024-09-28 00:19:57,272] Trial 94 finished with value: 0.08688557118635913 and parameters: {'learning_rate': 0.01, 'batch_size': 32, 'network_type': 'RNN', 'num_layers': 2, 'num_neurons': 128, 'dropout_rate': 0.2}. Best is trial 76 with value: 0.033845117055452824.
[I 2024-09-28 00:20:02,260] Trial 95 finished with value: 0.03670464269931502 and parameters: {'learning_rate': 0.01, 'batch_size': 32, 'network_type': 'RNN', 'num_layers': 2, 'num_neurons': 128, 'dropout_rate': 0.2}. Best is trial 76 with value: 0.033845117055452824.
[I 2024-09-28 00:20:11,360] Trial 96 finished with value: 0.03744769353132979 and parameters: {'learning_rate': 0.01, 'batch_size': 32, 'network_type': 'LSTM', 'num_layers': 2, 'num_neurons': 128, 'dropout_rate': 0.2}. Best is trial 76 with value: 0.033845117055452824.
[I 2024-09-28 00:20:16,523] Trial 97 finished with value: 0.03631672749152548 and parameters: {'learning_rate': 0.01, 'batch_size': 32, 'network_type': 'RNN', 'num_layers': 2, 'num_neurons': 128, 'dropout_rate': 0.2}. Best is trial 76 with value: 0.033845117055452824.
[I 2024-09-28 00:20:21,645] Trial 98 finished with value: 0.055179638825930105 and parameters: {'learning_rate': 0.01, 'batch_size': 32, 'network_type': 'RNN', 'num_layers': 2, 'num_neurons': 16, 'dropout_rate': 0.2}. Best is trial 76 with value: 0.033845117055452824.
[I 2024-09-28 00:20:28,331] Trial 99 finished with value: 0.04879503484872675 and parameters: {'learning_rate': 0.01, 'batch_size': 16, 'network_type': 'RNN', 'num_layers': 2, 'num_neurons': 128, 'dropout_rate': 0.2}. Best is trial 76 with value: 0.033845117055452824.
[I 2024-09-28 00:20:33,290] Trial 100 finished with value: 0.04189488480641295 and parameters: {'learning_rate': 0.01, 'batch_size': 32, 'network_type': 'RNN', 'num_layers': 2, 'num_neurons': 128, 'dropout_rate': 0.2}. Best is trial 76 with value: 0.033845117055452824.
[I 2024-09-28 00:20:41,305] Trial 101 finished with value: 0.03511513614654545 and parameters: {'learning_rate': 0.0001, 'batch_size': 32, 'network_type': 'RNN', 'num_layers': 2, 'num_neurons': 128, 'dropout_rate': 0.2}. Best is trial 76 with value: 0.033845117055452824.
[I 2024-09-28 00:20:49,131] Trial 102 finished with value: 0.03291887081586397 and parameters: {'learning_rate': 0.0001, 'batch_size': 32, 'network_type': 'RNN', 'num_layers': 2, 'num_neurons': 128, 'dropout_rate': 0.2}. Best is trial 102 with value: 0.03291887081586397.
[I 2024-09-28 00:20:54,288] Trial 103 finished with value: 0.036214193747593784 and parameters: {'learning_rate': 0.01, 'batch_size': 32, 'network_type': 'RNN', 'num_layers': 2, 'num_neurons': 128, 'dropout_rate': 0.2}. Best is trial 102 with value: 0.03291887081586397.
