[I 2024-09-28 01:01:40,758] Trial 65 finished with value: 0.03082545110914446 and parameters: {'learning_rate': 0.01, 'batch_size': 16, 'network_type': 'RNN', 'num_layers': 1, 'num_neurons': 16, 'dropout_rate': 0.1}. Best is trial 40 with value: 0.01260630162556965.
[I 2024-09-28 01:01:45,959] Trial 66 finished with value: 0.03735621282789446 and parameters: {'learning_rate': 0.01, 'batch_size': 16, 'network_type': 'RNN', 'num_layers': 1, 'num_neurons': 128, 'dropout_rate': 0.1}. Best is trial 40 with value: 0.01260630162556965.
[I 2024-09-28 01:01:50,846] Trial 67 finished with value: 0.032689977116055 and parameters: {'learning_rate': 0.01, 'batch_size': 64, 'network_type': 'RNN', 'num_layers': 1, 'num_neurons': 16, 'dropout_rate': 0.3}. Best is trial 40 with value: 0.01260630162556965.
[I 2024-09-28 01:01:58,416] Trial 68 finished with value: 0.049939203686184395 and parameters: {'learning_rate': 0.01, 'batch_size': 16, 'network_type': 'RNN', 'num_layers': 3, 'num_neurons': 16, 'dropout_rate': 0.1}. Best is trial 40 with value: 0.01260630162556965.
[I 2024-09-28 01:02:06,641] Trial 69 finished with value: 0.02365663146972658 and parameters: {'learning_rate': 0.01, 'batch_size': 16, 'network_type': 'LSTM', 'num_layers': 1, 'num_neurons': 16, 'dropout_rate': 0.1}. Best is trial 40 with value: 0.01260630162556965.
[I 2024-09-28 01:02:15,250] Trial 70 finished with value: 0.02288779460059276 and parameters: {'learning_rate': 0.01, 'batch_size': 16, 'network_type': 'RNN', 'num_layers': 2, 'num_neurons': 16, 'dropout_rate': 0.1}. Best is trial 40 with value: 0.01260630162556965.
[I 2024-09-28 01:02:25,911] Trial 71 finished with value: 0.025629806200663217 and parameters: {'learning_rate': 0.0001, 'batch_size': 16, 'network_type': 'RNN', 'num_layers': 1, 'num_neurons': 16, 'dropout_rate': 0.1}. Best is trial 40 with value: 0.01260630162556965.
[I 2024-09-28 01:02:34,750] Trial 72 finished with value: 0.01754875416225854 and parameters: {'learning_rate': 0.0001, 'batch_size': 16, 'network_type': 'RNN', 'num_layers': 1, 'num_neurons': 16, 'dropout_rate': 0.1}. Best is trial 40 with value: 0.01260630162556965.
[I 2024-09-28 01:02:39,205] Trial 73 finished with value: 0.03800235366821293 and parameters: {'learning_rate': 0.01, 'batch_size': 16, 'network_type': 'RNN', 'num_layers': 1, 'num_neurons': 16, 'dropout_rate': 0.1}. Best is trial 40 with value: 0.01260630162556965.
[I 2024-09-28 01:02:43,620] Trial 74 finished with value: 0.030782893392774832 and parameters: {'learning_rate': 0.01, 'batch_size': 16, 'network_type': 'RNN', 'num_layers': 1, 'num_neurons': 16, 'dropout_rate': 0.1}. Best is trial 40 with value: 0.01260630162556965.
[I 2024-09-28 01:02:53,722] Trial 75 finished with value: 0.014928345150417755 and parameters: {'learning_rate': 0.0001, 'batch_size': 16, 'network_type': 'RNN', 'num_layers': 1, 'num_neurons': 128, 'dropout_rate': 0.1}. Best is trial 40 with value: 0.01260630162556965.
[I 2024-09-28 01:03:00,315] Trial 76 finished with value: 0.02275101174248591 and parameters: {'learning_rate': 0.01, 'batch_size': 16, 'network_type': 'RNN', 'num_layers': 2, 'num_neurons': 128, 'dropout_rate': 0.1}. Best is trial 40 with value: 0.01260630162556965.
[I 2024-09-28 01:03:05,213] Trial 77 finished with value: 0.023155778672960023 and parameters: {'learning_rate': 0.01, 'batch_size': 16, 'network_type': 'RNN', 'num_layers': 1, 'num_neurons': 128, 'dropout_rate': 0.1}. Best is trial 40 with value: 0.01260630162556965.
[I 2024-09-28 01:03:11,478] Trial 78 finished with value: 0.040664098421732624 and parameters: {'learning_rate': 0.01, 'batch_size': 16, 'network_type': 'RNN', 'num_layers': 2, 'num_neurons': 128, 'dropout_rate': 0.3}. Best is trial 40 with value: 0.01260630162556965.
[I 2024-09-28 01:03:16,474] Trial 79 finished with value: 0.062359537336561445 and parameters: {'learning_rate': 0.01, 'batch_size': 64, 'network_type': 'RNN', 'num_layers': 1, 'num_neurons': 128, 'dropout_rate': 0.1}. Best is trial 40 with value: 0.01260630162556965.
[I 2024-09-28 01:03:21,155] Trial 80 finished with value: 0.020628887706332755 and parameters: {'learning_rate': 0.01, 'batch_size': 16, 'network_type': 'RNN', 'num_layers': 1, 'num_neurons': 128, 'dropout_rate': 0.1}. Best is trial 40 with value: 0.01260630162556965.
[I 2024-09-28 01:03:31,277] Trial 81 finished with value: 0.014943261888292043 and parameters: {'learning_rate': 0.0001, 'batch_size': 16, 'network_type': 'RNN', 'num_layers': 1, 'num_neurons': 16, 'dropout_rate': 0.1}. Best is trial 40 with value: 0.01260630162556965.
[I 2024-09-28 01:03:36,056] Trial 82 finished with value: 0.025472053315904446 and parameters: {'learning_rate': 0.01, 'batch_size': 16, 'network_type': 'RNN', 'num_layers': 1, 'num_neurons': 16, 'dropout_rate': 0.1}. Best is trial 40 with value: 0.01260630162556965.
[I 2024-09-28 01:03:40,541] Trial 83 finished with value: 0.047831053627861914 and parameters: {'learning_rate': 0.01, 'batch_size': 16, 'network_type': 'RNN', 'num_layers': 1, 'num_neurons': 16, 'dropout_rate': 0.1}. Best is trial 40 with value: 0.01260630162556965.
[I 2024-09-28 01:03:44,997] Trial 84 finished with value: 0.030272624651591022 and parameters: {'learning_rate': 0.01, 'batch_size': 16, 'network_type': 'RNN', 'num_layers': 1, 'num_neurons': 16, 'dropout_rate': 0.1}. Best is trial 40 with value: 0.01260630162556965.
[I 2024-09-28 01:03:55,515] Trial 85 finished with value: 0.019866744041442817 and parameters: {'learning_rate': 0.0001, 'batch_size': 16, 'network_type': 'RNN', 'num_layers': 2, 'num_neurons': 16, 'dropout_rate': 0.1}. Best is trial 40 with value: 0.01260630162556965.
[I 2024-09-28 01:04:01,784] Trial 86 finished with value: 0.032595391167534765 and parameters: {'learning_rate': 0.01, 'batch_size': 16, 'network_type': 'RNN', 'num_layers': 1, 'num_neurons': 16, 'dropout_rate': 0.1}. Best is trial 40 with value: 0.01260630162556965.
[I 2024-09-28 01:04:17,784] Trial 87 finished with value: 0.026177682770623118 and parameters: {'learning_rate': 0.01, 'batch_size': 16, 'network_type': 'LSTM', 'num_layers': 3, 'num_neurons': 64, 'dropout_rate': 0.1}. Best is trial 40 with value: 0.01260630162556965.
[I 2024-09-28 01:04:22,046] Trial 88 finished with value: 0.043637760904100244 and parameters: {'learning_rate': 0.01, 'batch_size': 16, 'network_type': 'RNN', 'num_layers': 1, 'num_neurons': 128, 'dropout_rate': 0.1}. Best is trial 40 with value: 0.01260630162556965.
[I 2024-09-28 01:04:28,043] Trial 89 finished with value: 0.031327375200059716 and parameters: {'learning_rate': 0.01, 'batch_size': 16, 'network_type': 'RNN', 'num_layers': 2, 'num_neurons': 16, 'dropout_rate': 0.1}. Best is trial 40 with value: 0.01260630162556965.
[I 2024-09-28 01:04:32,617] Trial 90 finished with value: 0.027965898407830172 and parameters: {'learning_rate': 0.01, 'batch_size': 16, 'network_type': 'RNN', 'num_layers': 1, 'num_neurons': 16, 'dropout_rate': 0.1}. Best is trial 40 with value: 0.01260630162556965.
[I 2024-09-28 01:04:44,572] Trial 91 finished with value: 0.02641977967156301 and parameters: {'learning_rate': 0.0001, 'batch_size': 16, 'network_type': 'RNN', 'num_layers': 1, 'num_neurons': 16, 'dropout_rate': 0.1}. Best is trial 40 with value: 0.01260630162556965.
[I 2024-09-28 01:04:50,201] Trial 92 finished with value: 0.025809008174472403 and parameters: {'learning_rate': 0.01, 'batch_size': 16, 'network_type': 'RNN', 'num_layers': 1, 'num_neurons': 16, 'dropout_rate': 0.1}. Best is trial 40 with value: 0.01260630162556965.
[I 2024-09-28 01:04:54,657] Trial 93 finished with value: 0.027628920237223346 and parameters: {'learning_rate': 0.01, 'batch_size': 16, 'network_type': 'RNN', 'num_layers': 1, 'num_neurons': 16, 'dropout_rate': 0.1}. Best is trial 40 with value: 0.01260630162556965.
[I 2024-09-28 01:04:58,971] Trial 94 finished with value: 0.03044325288136804 and parameters: {'learning_rate': 0.01, 'batch_size': 16, 'network_type': 'RNN', 'num_layers': 1, 'num_neurons': 16, 'dropout_rate': 0.1}. Best is trial 40 with value: 0.01260630162556965.
[I 2024-09-28 01:05:03,356] Trial 95 finished with value: 0.02963674905565054 and parameters: {'learning_rate': 0.01, 'batch_size': 16, 'network_type': 'RNN', 'num_layers': 1, 'num_neurons': 16, 'dropout_rate': 0.1}. Best is trial 40 with value: 0.01260630162556965.
[I 2024-09-28 01:05:13,455] Trial 96 finished with value: 0.02291908041636153 and parameters: {'learning_rate': 0.01, 'batch_size': 64, 'network_type': 'GRU', 'num_layers': 1, 'num_neurons': 16, 'dropout_rate': 0.3}. Best is trial 40 with value: 0.01260630162556965.
[I 2024-09-28 01:05:25,761] Trial 97 finished with value: 0.01398956362406414 and parameters: {'learning_rate': 0.0001, 'batch_size': 16, 'network_type': 'RNN', 'num_layers': 2, 'num_neurons': 16, 'dropout_rate': 0.1}. Best is trial 40 with value: 0.01260630162556965.
[I 2024-09-28 01:05:31,547] Trial 98 finished with value: 0.020805105527242043 and parameters: {'learning_rate': 0.01, 'batch_size': 16, 'network_type': 'RNN', 'num_layers': 2, 'num_neurons': 32, 'dropout_rate': 0.1}. Best is trial 40 with value: 0.01260630162556965.
[I 2024-09-28 01:05:37,409] Trial 99 finished with value: 0.023725534439086933 and parameters: {'learning_rate': 0.01, 'batch_size': 16, 'network_type': 'RNN', 'num_layers': 2, 'num_neurons': 16, 'dropout_rate': 0.1}. Best is trial 40 with value: 0.01260630162556965.
[I 2024-09-28 01:05:43,709] Trial 100 finished with value: 0.03417231814066573 and parameters: {'learning_rate': 0.01, 'batch_size': 16, 'network_type': 'RNN', 'num_layers': 2, 'num_neurons': 16, 'dropout_rate': 0.1}. Best is trial 40 with value: 0.01260630162556965.
[I 2024-09-28 01:05:55,588] Trial 101 finished with value: 0.014007800843980543 and parameters: {'learning_rate': 0.0001, 'batch_size': 16, 'network_type': 'RNN', 'num_layers': 2, 'num_neurons': 16, 'dropout_rate': 0.1}. Best is trial 40 with value: 0.01260630162556965.
[I 2024-09-28 01:06:06,248] Trial 102 finished with value: 0.014016645749409997 and parameters: {'learning_rate': 0.0001, 'batch_size': 16, 'network_type': 'RNN', 'num_layers': 2, 'num_neurons': 16, 'dropout_rate': 0.1}. Best is trial 40 with value: 0.01260630162556965.
[I 2024-09-28 01:06:13,074] Trial 103 finished with value: 0.017883172565036354 and parameters: {'learning_rate': 0.01, 'batch_size': 16, 'network_type': 'RNN', 'num_layers': 2, 'num_neurons': 16, 'dropout_rate': 0.1}. Best is trial 40 with value: 0.01260630162556965.
[I 2024-09-28 01:06:19,697] Trial 104 finished with value: 0.04579686631096738 and parameters: {'learning_rate': 0.01, 'batch_size': 16, 'network_type': 'RNN', 'num_layers': 2, 'num_neurons': 16, 'dropout_rate': 0.1}. Best is trial 40 with value: 0.01260630162556965.
[I 2024-09-28 01:06:26,937] Trial 105 finished with value: 0.03259778859880239 and parameters: {'learning_rate': 0.01, 'batch_size': 16, 'network_type': 'RNN', 'num_layers': 2, 'num_neurons': 16, 'dropout_rate': 0.1}. Best is trial 40 with value: 0.01260630162556965.
[I 2024-09-28 01:06:38,447] Trial 106 finished with value: 0.02144231891632082 and parameters: {'learning_rate': 0.01, 'batch_size': 16, 'network_type': 'LSTM', 'num_layers': 2, 'num_neurons': 64, 'dropout_rate': 0.1}. Best is trial 40 with value: 0.01260630162556965.
[I 2024-09-28 01:06:44,297] Trial 107 finished with value: 0.032436842812432226 and parameters: {'learning_rate': 0.01, 'batch_size': 16, 'network_type': 'RNN', 'num_layers': 2, 'num_neurons': 16, 'dropout_rate': 0.1}. Best is trial 40 with value: 0.01260630162556965.
[I 2024-09-28 01:07:13,939] Trial 108 finished with value: 0.019413170814514165 and parameters: {'learning_rate': 0.01, 'batch_size': 16, 'network_type': 'RNN', 'num_layers': 2, 'num_neurons': 16, 'dropout_rate': 0.1}. Best is trial 40 with value: 0.01260630162556965.
[I 2024-09-28 01:07:22,275] Trial 109 finished with value: 0.018163526323106558 and parameters: {'learning_rate': 0.0001, 'batch_size': 16, 'network_type': 'RNN', 'num_layers': 2, 'num_neurons': 128, 'dropout_rate': 0.1}. Best is trial 40 with value: 0.01260630162556965.
[I 2024-09-28 01:07:31,833] Trial 110 finished with value: 0.017626009517245824 and parameters: {'learning_rate': 0.01, 'batch_size': 16, 'network_type': 'GRU', 'num_layers': 2, 'num_neurons': 16, 'dropout_rate': 0.3}. Best is trial 40 with value: 0.01260630162556965.
[I 2024-09-28 01:07:42,610] Trial 111 finished with value: 0.013421412150065117 and parameters: {'learning_rate': 0.0001, 'batch_size': 16, 'network_type': 'RNN', 'num_layers': 2, 'num_neurons': 16, 'dropout_rate': 0.1}. Best is trial 40 with value: 0.01260630162556965.
[I 2024-09-28 01:07:52,649] Trial 112 finished with value: 0.01419059859381782 and parameters: {'learning_rate': 0.0001, 'batch_size': 16, 'network_type': 'RNN', 'num_layers': 2, 'num_neurons': 16, 'dropout_rate': 0.1}. Best is trial 40 with value: 0.01260630162556965.
[I 2024-09-28 01:07:57,959] Trial 113 finished with value: 0.03246732065412737 and parameters: {'learning_rate': 0.01, 'batch_size': 16, 'network_type': 'RNN', 'num_layers': 2, 'num_neurons': 16, 'dropout_rate': 0.1}. Best is trial 40 with value: 0.01260630162556965.
[I 2024-09-28 01:08:03,384] Trial 114 finished with value: 0.02036820348103843 and parameters: {'learning_rate': 0.01, 'batch_size': 16, 'network_type': 'RNN', 'num_layers': 2, 'num_neurons': 16, 'dropout_rate': 0.1}. Best is trial 40 with value: 0.01260630162556965.
[I 2024-09-28 01:08:08,609] Trial 115 finished with value: 0.03065752495659726 and parameters: {'learning_rate': 0.01, 'batch_size': 16, 'network_type': 'RNN', 'num_layers': 2, 'num_neurons': 16, 'dropout_rate': 0.1}. Best is trial 40 with value: 0.01260630162556965.
[I 2024-09-28 01:08:16,097] Trial 116 finished with value: 0.024581016858418823 and parameters: {'learning_rate': 0.01, 'batch_size': 64, 'network_type': 'RNN', 'num_layers': 2, 'num_neurons': 16, 'dropout_rate': 0.1}. Best is trial 40 with value: 0.01260630162556965.
[I 2024-09-28 01:08:21,598] Trial 117 finished with value: 0.03069335397084558 and parameters: {'learning_rate': 0.01, 'batch_size': 32, 'network_type': 'RNN', 'num_layers': 2, 'num_neurons': 16, 'dropout_rate': 0.1}. Best is trial 40 with value: 0.01260630162556965.
[I 2024-09-28 01:08:27,055] Trial 118 finished with value: 0.021147085507710814 and parameters: {'learning_rate': 0.01, 'batch_size': 16, 'network_type': 'RNN', 'num_layers': 2, 'num_neurons': 16, 'dropout_rate': 0.1}. Best is trial 40 with value: 0.01260630162556965.
[I 2024-09-28 01:08:32,469] Trial 119 finished with value: 0.020842562887403677 and parameters: {'learning_rate': 0.01, 'batch_size': 16, 'network_type': 'RNN', 'num_layers': 2, 'num_neurons': 16, 'dropout_rate': 0.1}. Best is trial 40 with value: 0.01260630162556965.
[I 2024-09-28 01:08:37,462] Trial 120 finished with value: 0.019291001001993793 and parameters: {'learning_rate': 0.01, 'batch_size': 16, 'network_type': 'RNN', 'num_layers': 2, 'num_neurons': 16, 'dropout_rate': 0.1}. Best is trial 40 with value: 0.01260630162556965.
[I 2024-09-28 01:08:48,163] Trial 121 finished with value: 0.013813715934753409 and parameters: {'learning_rate': 0.0001, 'batch_size': 16, 'network_type': 'RNN', 'num_layers': 2, 'num_neurons': 16, 'dropout_rate': 0.1}. Best is trial 40 with value: 0.01260630162556965.
[I 2024-09-28 01:08:58,004] Trial 122 finished with value: 0.01342588912116158 and parameters: {'learning_rate': 0.0001, 'batch_size': 16, 'network_type': 'RNN', 'num_layers': 2, 'num_neurons': 16, 'dropout_rate': 0.1}. Best is trial 40 with value: 0.01260630162556965.
[I 2024-09-28 01:09:02,978] Trial 123 finished with value: 0.017497815979851634 and parameters: {'learning_rate': 0.01, 'batch_size': 16, 'network_type': 'RNN', 'num_layers': 2, 'num_neurons': 16, 'dropout_rate': 0.1}. Best is trial 40 with value: 0.01260630162556965.
[I 2024-09-28 01:09:08,403] Trial 124 finished with value: 0.02384145885043676 and parameters: {'learning_rate': 0.01, 'batch_size': 16, 'network_type': 'RNN', 'num_layers': 2, 'num_neurons': 16, 'dropout_rate': 0.1}. Best is trial 40 with value: 0.01260630162556965.
[I 2024-09-28 01:09:18,043] Trial 125 finished with value: 0.01839695972866477 and parameters: {'learning_rate': 0.0001, 'batch_size': 16, 'network_type': 'RNN', 'num_layers': 2, 'num_neurons': 16, 'dropout_rate': 0.1}. Best is trial 40 with value: 0.01260630162556965.
[I 2024-09-28 01:09:25,144] Trial 126 finished with value: 0.023184496455722403 and parameters: {'learning_rate': 0.01, 'batch_size': 16, 'network_type': 'RNN', 'num_layers': 2, 'num_neurons': 16, 'dropout_rate': 0.1}. Best is trial 40 with value: 0.01260630162556965.
[I 2024-09-28 01:09:30,446] Trial 127 finished with value: 0.02182772170172795 and parameters: {'learning_rate': 0.01, 'batch_size': 16, 'network_type': 'RNN', 'num_layers': 2, 'num_neurons': 32, 'dropout_rate': 0.1}. Best is trial 40 with value: 0.01260630162556965.
[I 2024-09-28 01:09:35,416] Trial 128 finished with value: 0.016610346370273168 and parameters: {'learning_rate': 0.01, 'batch_size': 16, 'network_type': 'RNN', 'num_layers': 2, 'num_neurons': 16, 'dropout_rate': 0.1}. Best is trial 40 with value: 0.01260630162556965.
[I 2024-09-28 01:09:49,736] Trial 129 finished with value: 0.03567092386881507 and parameters: {'learning_rate': 0.0001, 'batch_size': 16, 'network_type': 'LSTM', 'num_layers': 2, 'num_neurons': 16, 'dropout_rate': 0.1}. Best is trial 40 with value: 0.01260630162556965.
[I 2024-09-28 01:09:55,217] Trial 130 finished with value: 0.01754635122087267 and parameters: {'learning_rate': 0.01, 'batch_size': 16, 'network_type': 'RNN', 'num_layers': 2, 'num_neurons': 16, 'dropout_rate': 0.2}. Best is trial 40 with value: 0.01260630162556965.
[I 2024-09-28 01:10:03,417] Trial 131 finished with value: 0.021843418439229347 and parameters: {'learning_rate': 0.01, 'batch_size': 16, 'network_type': 'RNN', 'num_layers': 3, 'num_neurons': 16, 'dropout_rate': 0.1}. Best is trial 40 with value: 0.01260630162556965.
[I 2024-09-28 01:10:08,726] Trial 132 finished with value: 0.04417135492960616 and parameters: {'learning_rate': 0.01, 'batch_size': 16, 'network_type': 'RNN', 'num_layers': 2, 'num_neurons': 16, 'dropout_rate': 0.1}. Best is trial 40 with value: 0.01260630162556965.
[I 2024-09-28 01:10:13,802] Trial 133 finished with value: 0.02562555832333037 and parameters: {'learning_rate': 0.01, 'batch_size': 16, 'network_type': 'RNN', 'num_layers': 2, 'num_neurons': 16, 'dropout_rate': 0.1}. Best is trial 40 with value: 0.01260630162556965.
[I 2024-09-28 01:10:19,294] Trial 134 finished with value: 0.01775221453772651 and parameters: {'learning_rate': 0.01, 'batch_size': 16, 'network_type': 'RNN', 'num_layers': 2, 'num_neurons': 16, 'dropout_rate': 0.1}. Best is trial 40 with value: 0.01260630162556965.
[I 2024-09-28 01:10:24,359] Trial 135 finished with value: 0.017139492034912114 and parameters: {'learning_rate': 0.01, 'batch_size': 16, 'network_type': 'RNN', 'num_layers': 2, 'num_neurons': 16, 'dropout_rate': 0.1}. Best is trial 40 with value: 0.01260630162556965.
[I 2024-09-28 01:10:29,401] Trial 136 finished with value: 0.03476807318793407 and parameters: {'learning_rate': 0.01, 'batch_size': 16, 'network_type': 'RNN', 'num_layers': 2, 'num_neurons': 16, 'dropout_rate': 0.1}. Best is trial 40 with value: 0.01260630162556965.
[I 2024-09-28 01:10:44,087] Trial 137 finished with value: 0.021910863558451312 and parameters: {'learning_rate': 0.01, 'batch_size': 32, 'network_type': 'GRU', 'num_layers': 3, 'num_neurons': 64, 'dropout_rate': 0.3}. Best is trial 40 with value: 0.01260630162556965.
[I 2024-09-28 01:10:53,945] Trial 138 finished with value: 0.013588530328538696 and parameters: {'learning_rate': 0.0001, 'batch_size': 16, 'network_type': 'RNN', 'num_layers': 2, 'num_neurons': 16, 'dropout_rate': 0.1}. Best is trial 40 with value: 0.01260630162556965.
[I 2024-09-28 01:10:58,793] Trial 139 finished with value: 0.019992257118225117 and parameters: {'learning_rate': 0.01, 'batch_size': 16, 'network_type': 'RNN', 'num_layers': 2, 'num_neurons': 16, 'dropout_rate': 0.1}. Best is trial 40 with value: 0.01260630162556965.
[I 2024-09-28 01:11:04,251] Trial 140 finished with value: 0.021464221954345743 and parameters: {'learning_rate': 0.01, 'batch_size': 64, 'network_type': 'RNN', 'num_layers': 2, 'num_neurons': 16, 'dropout_rate': 0.1}. Best is trial 40 with value: 0.01260630162556965.
[I 2024-09-28 01:11:15,896] Trial 141 finished with value: 0.01344141568077934 and parameters: {'learning_rate': 0.0001, 'batch_size': 16, 'network_type': 'RNN', 'num_layers': 2, 'num_neurons': 16, 'dropout_rate': 0.1}. Best is trial 40 with value: 0.01260630162556965.
[I 2024-09-28 01:11:25,453] Trial 142 finished with value: 0.01565385023752845 and parameters: {'learning_rate': 0.0001, 'batch_size': 16, 'network_type': 'RNN', 'num_layers': 2, 'num_neurons': 16, 'dropout_rate': 0.1}. Best is trial 40 with value: 0.01260630162556965.
[I 2024-09-28 01:11:30,466] Trial 143 finished with value: 0.04523584090338817 and parameters: {'learning_rate': 0.01, 'batch_size': 16, 'network_type': 'RNN', 'num_layers': 2, 'num_neurons': 16, 'dropout_rate': 0.1}. Best is trial 40 with value: 0.01260630162556965.
[I 2024-09-28 01:11:36,549] Trial 144 finished with value: 0.02469613975948754 and parameters: {'learning_rate': 0.01, 'batch_size': 16, 'network_type': 'RNN', 'num_layers': 2, 'num_neurons': 16, 'dropout_rate': 0.1}. Best is trial 40 with value: 0.01260630162556965.
[I 2024-09-28 01:11:42,394] Trial 145 finished with value: 0.040523259268866685 and parameters: {'learning_rate': 0.01, 'batch_size': 16, 'network_type': 'RNN', 'num_layers': 2, 'num_neurons': 16, 'dropout_rate': 0.1}. Best is trial 40 with value: 0.01260630162556965.
