[I 2024-09-27 22:21:26,380] Trial 42 finished with value: 0.02337817287445063 and parameters: {'window_size': 6, 'batch_size': 64, 'network_type': 'GRU', 'num_layers': 1, 'num_neurons': 128, 'learning_rate': 0.0001, 'dropout_rate': 0.2}. Best is trial 41 with value: 0.013343700938754624.

1/1 [==============================] - ETA: 0s
1/1 [==============================] - 0s 200ms/step
[I 2024-09-27 22:21:29,363] Trial 43 finished with value: 0.018244968520270504 and parameters: {'window_size': 6, 'batch_size': 64, 'network_type': 'GRU', 'num_layers': 1, 'num_neurons': 128, 'learning_rate': 0.01, 'dropout_rate': 0.2}. Best is trial 41 with value: 0.013343700938754624.

1/1 [==============================] - ETA: 0s
1/1 [==============================] - 0s 184ms/step
[I 2024-09-27 22:21:31,665] Trial 44 finished with value: 0.03658409351772729 and parameters: {'window_size': 6, 'batch_size': 64, 'network_type': 'RNN', 'num_layers': 1, 'num_neurons': 128, 'learning_rate': 0.01, 'dropout_rate': 0.2}. Best is trial 41 with value: 0.013343700938754624.

1/1 [==============================] - ETA: 0s
1/1 [==============================] - 0s 192ms/step
[I 2024-09-27 22:21:34,679] Trial 45 finished with value: 0.017340004073248958 and parameters: {'window_size': 6, 'batch_size': 64, 'network_type': 'GRU', 'num_layers': 1, 'num_neurons': 128, 'learning_rate': 0.01, 'dropout_rate': 0.2}. Best is trial 41 with value: 0.013343700938754624.

1/1 [==============================] - ETA: 0s
1/1 [==============================] - 0s 232ms/step
[I 2024-09-27 22:21:37,774] Trial 46 finished with value: 0.017215145958794538 and parameters: {'window_size': 6, 'batch_size': 64, 'network_type': 'GRU', 'num_layers': 1, 'num_neurons': 128, 'learning_rate': 0.01, 'dropout_rate': 0.2}. Best is trial 41 with value: 0.013343700938754624.

1/1 [==============================] - ETA: 0s
1/1 [==============================] - 0s 200ms/step
[I 2024-09-27 22:21:40,758] Trial 47 finished with value: 0.01723354223039417 and parameters: {'window_size': 6, 'batch_size': 64, 'network_type': 'GRU', 'num_layers': 1, 'num_neurons': 32, 'learning_rate': 0.01, 'dropout_rate': 0.3}. Best is trial 41 with value: 0.013343700938754624.

1/1 [==============================] - ETA: 0s
1/1 [==============================] - 0s 401ms/step
[I 2024-09-27 22:21:46,137] Trial 48 finished with value: 0.022713683552212198 and parameters: {'window_size': 6, 'batch_size': 32, 'network_type': 'RNN', 'num_layers': 3, 'num_neurons': 128, 'learning_rate': 0.01, 'dropout_rate': 0.2}. Best is trial 41 with value: 0.013343700938754624.

1/1 [==============================] - ETA: 0s
1/1 [==============================] - 0s 370ms/step
[I 2024-09-27 22:21:52,056] Trial 49 finished with value: 0.028107742829756276 and parameters: {'window_size': 4, 'batch_size': 64, 'network_type': 'GRU', 'num_layers': 2, 'num_neurons': 64, 'learning_rate': 0.01, 'dropout_rate': 0.1}. Best is trial 41 with value: 0.013343700938754624.

1/1 [==============================] - ETA: 0s
1/1 [==============================] - 0s 216ms/step
[I 2024-09-27 22:21:55,135] Trial 50 finished with value: 0.02461702452765567 and parameters: {'window_size': 6, 'batch_size': 16, 'network_type': 'GRU', 'num_layers': 1, 'num_neurons': 16, 'learning_rate': 0.01, 'dropout_rate': 0.2}. Best is trial 41 with value: 0.013343700938754624.

1/1 [==============================] - ETA: 0s
1/1 [==============================] - 0s 185ms/step
[I 2024-09-27 22:21:58,245] Trial 51 finished with value: 0.0211633506351047 and parameters: {'window_size': 6, 'batch_size': 64, 'network_type': 'GRU', 'num_layers': 1, 'num_neurons': 128, 'learning_rate': 0.01, 'dropout_rate': 0.2}. Best is trial 41 with value: 0.013343700938754624.

1/1 [==============================] - ETA: 0s
1/1 [==============================] - 0s 201ms/step
[I 2024-09-27 22:22:01,116] Trial 52 finished with value: 0.02029015583462184 and parameters: {'window_size': 6, 'batch_size': 64, 'network_type': 'GRU', 'num_layers': 1, 'num_neurons': 128, 'learning_rate': 0.01, 'dropout_rate': 0.2}. Best is trial 41 with value: 0.013343700938754624.

1/1 [==============================] - ETA: 0s
1/1 [==============================] - 0s 201ms/step
[I 2024-09-27 22:22:04,295] Trial 53 finished with value: 0.015934611744350846 and parameters: {'window_size': 6, 'batch_size': 64, 'network_type': 'GRU', 'num_layers': 1, 'num_neurons': 128, 'learning_rate': 0.01, 'dropout_rate': 0.2}. Best is trial 41 with value: 0.013343700938754624.

1/1 [==============================] - ETA: 0s
1/1 [==============================] - 0s 257ms/step
[I 2024-09-27 22:22:07,651] Trial 54 finished with value: 0.01945354504055446 and parameters: {'window_size': 6, 'batch_size': 64, 'network_type': 'GRU', 'num_layers': 1, 'num_neurons': 128, 'learning_rate': 0.01, 'dropout_rate': 0.2}. Best is trial 41 with value: 0.013343700938754624.

1/1 [==============================] - ETA: 0s
1/1 [==============================] - 0s 185ms/step
[I 2024-09-27 22:22:12,186] Trial 55 finished with value: 0.023896722263760002 and parameters: {'window_size': 6, 'batch_size': 64, 'network_type': 'LSTM', 'num_layers': 1, 'num_neurons': 128, 'learning_rate': 0.01, 'dropout_rate': 0.1}. Best is trial 41 with value: 0.013343700938754624.

1/1 [==============================] - ETA: 0s
1/1 [==============================] - 1s 918ms/step
[I 2024-09-27 22:22:20,093] Trial 56 finished with value: 0.04791616388467641 and parameters: {'window_size': 2, 'batch_size': 64, 'network_type': 'GRU', 'num_layers': 3, 'num_neurons': 128, 'learning_rate': 0.01, 'dropout_rate': 0.2}. Best is trial 41 with value: 0.013343700938754624.

1/1 [==============================] - ETA: 0s
1/1 [==============================] - 0s 417ms/step
[I 2024-09-27 22:22:25,509] Trial 57 finished with value: 0.016006144841512034 and parameters: {'window_size': 6, 'batch_size': 64, 'network_type': 'GRU', 'num_layers': 1, 'num_neurons': 32, 'learning_rate': 0.01, 'dropout_rate': 0.1}. Best is trial 41 with value: 0.013343700938754624.

1/1 [==============================] - ETA: 0s
1/1 [==============================] - 0s 338ms/step
[I 2024-09-27 22:22:33,123] Trial 58 finished with value: 0.02034043852488201 and parameters: {'window_size': 6, 'batch_size': 64, 'network_type': 'GRU', 'num_layers': 2, 'num_neurons': 128, 'learning_rate': 0.01, 'dropout_rate': 0.2}. Best is trial 41 with value: 0.013343700938754624.

1/1 [==============================] - ETA: 0s
1/1 [==============================] - 0s 170ms/step
[I 2024-09-27 22:22:35,672] Trial 59 finished with value: 0.017604625181718327 and parameters: {'window_size': 4, 'batch_size': 64, 'network_type': 'RNN', 'num_layers': 1, 'num_neurons': 128, 'learning_rate': 0.01, 'dropout_rate': 0.1}. Best is trial 41 with value: 0.013343700938754624.

1/1 [==============================] - ETA: 0s
1/1 [==============================] - 0s 198ms/step
[I 2024-09-27 22:22:38,627] Trial 60 finished with value: 0.0418644292619493 and parameters: {'window_size': 6, 'batch_size': 64, 'network_type': 'GRU', 'num_layers': 1, 'num_neurons': 128, 'learning_rate': 0.01, 'dropout_rate': 0.1}. Best is trial 41 with value: 0.013343700938754624.

1/1 [==============================] - ETA: 0s
1/1 [==============================] - 0s 216ms/step
[I 2024-09-27 22:22:41,841] Trial 61 finished with value: 0.015763249291314008 and parameters: {'window_size': 6, 'batch_size': 64, 'network_type': 'GRU', 'num_layers': 1, 'num_neurons': 128, 'learning_rate': 0.01, 'dropout_rate': 0.2}. Best is trial 41 with value: 0.013343700938754624.

1/1 [==============================] - ETA: 0s
1/1 [==============================] - 0s 216ms/step
[I 2024-09-27 22:22:44,937] Trial 62 finished with value: 0.015350255330403635 and parameters: {'window_size': 6, 'batch_size': 64, 'network_type': 'GRU', 'num_layers': 1, 'num_neurons': 128, 'learning_rate': 0.01, 'dropout_rate': 0.2}. Best is trial 41 with value: 0.013343700938754624.

1/1 [==============================] - ETA: 0s
1/1 [==============================] - 0s 189ms/step
[I 2024-09-27 22:22:47,940] Trial 63 finished with value: 0.023290362252129437 and parameters: {'window_size': 6, 'batch_size': 64, 'network_type': 'GRU', 'num_layers': 1, 'num_neurons': 128, 'learning_rate': 0.01, 'dropout_rate': 0.2}. Best is trial 41 with value: 0.013343700938754624.

1/1 [==============================] - ETA: 0s
1/1 [==============================] - 0s 187ms/step
[I 2024-09-27 22:22:50,863] Trial 64 finished with value: 0.023617512279086633 and parameters: {'window_size': 6, 'batch_size': 64, 'network_type': 'GRU', 'num_layers': 1, 'num_neurons': 128, 'learning_rate': 0.01, 'dropout_rate': 0.2}. Best is trial 41 with value: 0.013343700938754624.

1/1 [==============================] - ETA: 0s
1/1 [==============================] - 0s 198ms/step
[I 2024-09-27 22:22:53,680] Trial 65 finished with value: 0.01548370043436689 and parameters: {'window_size': 6, 'batch_size': 64, 'network_type': 'GRU', 'num_layers': 1, 'num_neurons': 128, 'learning_rate': 0.01, 'dropout_rate': 0.2}. Best is trial 41 with value: 0.013343700938754624.

1/1 [==============================] - ETA: 0s
1/1 [==============================] - 0s 470ms/step
[I 2024-09-27 22:23:00,548] Trial 66 finished with value: 0.04516435294681124 and parameters: {'window_size': 6, 'batch_size': 64, 'network_type': 'GRU', 'num_layers': 3, 'num_neurons': 16, 'learning_rate': 0.01, 'dropout_rate': 0.1}. Best is trial 41 with value: 0.013343700938754624.

1/1 [==============================] - ETA: 0s
1/1 [==============================] - 0s 201ms/step
[I 2024-09-27 22:23:03,405] Trial 67 finished with value: 0.030392010052998852 and parameters: {'window_size': 6, 'batch_size': 16, 'network_type': 'LSTM', 'num_layers': 1, 'num_neurons': 128, 'learning_rate': 0.01, 'dropout_rate': 0.3}. Best is trial 41 with value: 0.013343700938754624.

1/1 [==============================] - ETA: 0s
1/1 [==============================] - 0s 201ms/step
[I 2024-09-27 22:23:06,329] Trial 68 finished with value: 0.0398730218960689 and parameters: {'window_size': 2, 'batch_size': 32, 'network_type': 'GRU', 'num_layers': 1, 'num_neurons': 32, 'learning_rate': 0.01, 'dropout_rate': 0.2}. Best is trial 41 with value: 0.013343700938754624.

1/1 [==============================] - ETA: 0s
1/1 [==============================] - 0s 185ms/step
[I 2024-09-27 22:23:09,355] Trial 69 finished with value: 0.015926089180840375 and parameters: {'window_size': 6, 'batch_size': 64, 'network_type': 'GRU', 'num_layers': 1, 'num_neurons': 128, 'learning_rate': 0.01, 'dropout_rate': 0.1}. Best is trial 41 with value: 0.013343700938754624.

1/1 [==============================] - ETA: 0s
1/1 [==============================] - 0s 332ms/step
[I 2024-09-27 22:23:13,950] Trial 70 finished with value: 0.024381670316060373 and parameters: {'window_size': 6, 'batch_size': 64, 'network_type': 'GRU', 'num_layers': 2, 'num_neurons': 64, 'learning_rate': 0.01, 'dropout_rate': 0.1}. Best is trial 41 with value: 0.013343700938754624.

1/1 [==============================] - ETA: 0s
1/1 [==============================] - 0s 185ms/step
[I 2024-09-27 22:23:16,713] Trial 71 finished with value: 0.014413717587788928 and parameters: {'window_size': 6, 'batch_size': 64, 'network_type': 'GRU', 'num_layers': 1, 'num_neurons': 128, 'learning_rate': 0.01, 'dropout_rate': 0.2}. Best is trial 41 with value: 0.013343700938754624.

1/1 [==============================] - ETA: 0s
1/1 [==============================] - 0s 189ms/step
[I 2024-09-27 22:23:24,306] Trial 72 finished with value: 0.016894659572177458 and parameters: {'window_size': 6, 'batch_size': 64, 'network_type': 'GRU', 'num_layers': 1, 'num_neurons': 128, 'learning_rate': 0.0001, 'dropout_rate': 0.2}. Best is trial 41 with value: 0.013343700938754624.

1/1 [==============================] - ETA: 0s
1/1 [==============================] - 0s 201ms/step
[I 2024-09-27 22:23:27,160] Trial 73 finished with value: 0.013596042633056606 and parameters: {'window_size': 6, 'batch_size': 64, 'network_type': 'GRU', 'num_layers': 1, 'num_neurons': 128, 'learning_rate': 0.01, 'dropout_rate': 0.2}. Best is trial 41 with value: 0.013343700938754624.

1/1 [==============================] - ETA: 0s
1/1 [==============================] - 0s 201ms/step
[I 2024-09-27 22:23:30,039] Trial 74 finished with value: 0.03568807676103377 and parameters: {'window_size': 6, 'batch_size': 64, 'network_type': 'GRU', 'num_layers': 1, 'num_neurons': 128, 'learning_rate': 0.01, 'dropout_rate': 0.2}. Best is trial 41 with value: 0.013343700938754624.

1/1 [==============================] - ETA: 0s
1/1 [==============================] - 0s 201ms/step
[I 2024-09-27 22:23:32,761] Trial 75 finished with value: 0.01723894108666313 and parameters: {'window_size': 6, 'batch_size': 64, 'network_type': 'GRU', 'num_layers': 1, 'num_neurons': 128, 'learning_rate': 0.01, 'dropout_rate': 0.2}. Best is trial 41 with value: 0.013343700938754624.

1/1 [==============================] - ETA: 0s
1/1 [==============================] - 0s 201ms/step
[I 2024-09-27 22:23:35,583] Trial 76 finished with value: 0.029348603421991536 and parameters: {'window_size': 4, 'batch_size': 64, 'network_type': 'GRU', 'num_layers': 1, 'num_neurons': 128, 'learning_rate': 0.01, 'dropout_rate': 0.2}. Best is trial 41 with value: 0.013343700938754624.

1/1 [==============================] - ETA: 0s
1/1 [==============================] - 0s 201ms/step
[I 2024-09-27 22:23:38,259] Trial 77 finished with value: 0.01624036746554906 and parameters: {'window_size': 6, 'batch_size': 16, 'network_type': 'GRU', 'num_layers': 1, 'num_neurons': 128, 'learning_rate': 0.01, 'dropout_rate': 0.1}. Best is trial 41 with value: 0.013343700938754624.

1/1 [==============================] - ETA: 0s
1/1 [==============================] - 0s 173ms/step
[I 2024-09-27 22:23:42,591] Trial 78 finished with value: 0.02307184855143232 and parameters: {'window_size': 6, 'batch_size': 64, 'network_type': 'RNN', 'num_layers': 1, 'num_neurons': 128, 'learning_rate': 0.01, 'dropout_rate': 0.2}. Best is trial 41 with value: 0.013343700938754624.

1/1 [==============================] - ETA: 0s
1/1 [==============================] - 0s 201ms/step
[I 2024-09-27 22:23:45,418] Trial 79 finished with value: 0.02105648581186934 and parameters: {'window_size': 6, 'batch_size': 64, 'network_type': 'LSTM', 'num_layers': 1, 'num_neurons': 16, 'learning_rate': 0.01, 'dropout_rate': 0.3}. Best is trial 41 with value: 0.013343700938754624.

1/1 [==============================] - ETA: 0s
1/1 [==============================] - 1s 901ms/step
[I 2024-09-27 22:23:53,028] Trial 80 finished with value: 0.03306931216900169 and parameters: {'window_size': 2, 'batch_size': 32, 'network_type': 'GRU', 'num_layers': 3, 'num_neurons': 128, 'learning_rate': 0.01, 'dropout_rate': 0.1}. Best is trial 41 with value: 0.013343700938754624.

1/1 [==============================] - ETA: 0s
1/1 [==============================] - 0s 185ms/step
[I 2024-09-27 22:23:56,554] Trial 81 finished with value: 0.016747772322760677 and parameters: {'window_size': 6, 'batch_size': 64, 'network_type': 'GRU', 'num_layers': 1, 'num_neurons': 128, 'learning_rate': 0.01, 'dropout_rate': 0.2}. Best is trial 41 with value: 0.013343700938754624.

1/1 [==============================] - ETA: 0s
1/1 [==============================] - 0s 183ms/step
[I 2024-09-27 22:23:59,295] Trial 82 finished with value: 0.03492499160766598 and parameters: {'window_size': 6, 'batch_size': 64, 'network_type': 'GRU', 'num_layers': 1, 'num_neurons': 128, 'learning_rate': 0.01, 'dropout_rate': 0.2}. Best is trial 41 with value: 0.013343700938754624.

1/1 [==============================] - ETA: 0s
1/1 [==============================] - 0s 185ms/step
[I 2024-09-27 22:24:01,915] Trial 83 finished with value: 0.014878917906019437 and parameters: {'window_size': 6, 'batch_size': 64, 'network_type': 'GRU', 'num_layers': 1, 'num_neurons': 128, 'learning_rate': 0.01, 'dropout_rate': 0.2}. Best is trial 41 with value: 0.013343700938754624.

1/1 [==============================] - ETA: 0s
1/1 [==============================] - 0s 179ms/step
[I 2024-09-27 22:24:04,570] Trial 84 finished with value: 0.022661784913804786 and parameters: {'window_size': 6, 'batch_size': 64, 'network_type': 'GRU', 'num_layers': 1, 'num_neurons': 128, 'learning_rate': 0.01, 'dropout_rate': 0.2}. Best is trial 41 with value: 0.013343700938754624.

1/1 [==============================] - ETA: 0s
1/1 [==============================] - 0s 232ms/step
[I 2024-09-27 22:24:07,317] Trial 85 finished with value: 0.0273448112275865 and parameters: {'window_size': 6, 'batch_size': 64, 'network_type': 'GRU', 'num_layers': 1, 'num_neurons': 128, 'learning_rate': 0.01, 'dropout_rate': 0.2}. Best is trial 41 with value: 0.013343700938754624.

1/1 [==============================] - ETA: 0s
1/1 [==============================] - 0s 185ms/step
[I 2024-09-27 22:24:10,259] Trial 86 finished with value: 0.016031562911139583 and parameters: {'window_size': 6, 'batch_size': 64, 'network_type': 'GRU', 'num_layers': 1, 'num_neurons': 64, 'learning_rate': 0.01, 'dropout_rate': 0.2}. Best is trial 41 with value: 0.013343700938754624.

1/1 [==============================] - ETA: 0s
1/1 [==============================] - 0s 201ms/step
[I 2024-09-27 22:24:13,117] Trial 87 finished with value: 0.01497488424513074 and parameters: {'window_size': 6, 'batch_size': 64, 'network_type': 'GRU', 'num_layers': 1, 'num_neurons': 128, 'learning_rate': 0.01, 'dropout_rate': 0.2}. Best is trial 41 with value: 0.013343700938754624.

1/1 [==============================] - ETA: 0s
1/1 [==============================] - 0s 201ms/step
[I 2024-09-27 22:24:15,805] Trial 88 finished with value: 0.03131589063008623 and parameters: {'window_size': 6, 'batch_size': 64, 'network_type': 'GRU', 'num_layers': 1, 'num_neurons': 128, 'learning_rate': 0.01, 'dropout_rate': 0.2}. Best is trial 41 with value: 0.013343700938754624.

1/1 [==============================] - ETA: 0s
1/1 [==============================] - 0s 317ms/step
[I 2024-09-27 22:24:20,014] Trial 89 finished with value: 0.017116701443990086 and parameters: {'window_size': 6, 'batch_size': 64, 'network_type': 'GRU', 'num_layers': 2, 'num_neurons': 32, 'learning_rate': 0.01, 'dropout_rate': 0.1}. Best is trial 41 with value: 0.013343700938754624.

1/1 [==============================] - ETA: 0s
1/1 [==============================] - 0s 185ms/step
[I 2024-09-27 22:24:22,637] Trial 90 finished with value: 0.024927509914744957 and parameters: {'window_size': 4, 'batch_size': 64, 'network_type': 'GRU', 'num_layers': 1, 'num_neurons': 128, 'learning_rate': 0.01, 'dropout_rate': 0.2}. Best is trial 41 with value: 0.013343700938754624.

1/1 [==============================] - ETA: 0s
1/1 [==============================] - 0s 182ms/step
[I 2024-09-27 22:24:25,247] Trial 91 finished with value: 0.02282234658135307 and parameters: {'window_size': 6, 'batch_size': 64, 'network_type': 'GRU', 'num_layers': 1, 'num_neurons': 128, 'learning_rate': 0.01, 'dropout_rate': 0.2}. Best is trial 41 with value: 0.013343700938754624.

1/1 [==============================] - ETA: 0s
1/1 [==============================] - 0s 216ms/step
[I 2024-09-27 22:24:28,582] Trial 92 finished with value: 0.015188388082716189 and parameters: {'window_size': 6, 'batch_size': 64, 'network_type': 'GRU', 'num_layers': 1, 'num_neurons': 128, 'learning_rate': 0.01, 'dropout_rate': 0.2}. Best is trial 41 with value: 0.013343700938754624.

1/1 [==============================] - ETA: 0s
1/1 [==============================] - 0s 204ms/step
[I 2024-09-27 22:24:31,422] Trial 93 finished with value: 0.03118819099002411 and parameters: {'window_size': 6, 'batch_size': 64, 'network_type': 'GRU', 'num_layers': 1, 'num_neurons': 128, 'learning_rate': 0.01, 'dropout_rate': 0.2}. Best is trial 41 with value: 0.013343700938754624.

1/1 [==============================] - ETA: 0s
1/1 [==============================] - 0s 201ms/step
[I 2024-09-27 22:24:34,598] Trial 94 finished with value: 0.02238122293684213 and parameters: {'window_size': 6, 'batch_size': 64, 'network_type': 'GRU', 'num_layers': 1, 'num_neurons': 128, 'learning_rate': 0.01, 'dropout_rate': 0.2}. Best is trial 41 with value: 0.013343700938754624.

1/1 [==============================] - ETA: 0s
1/1 [==============================] - 0s 196ms/step
[I 2024-09-27 22:24:37,282] Trial 95 finished with value: 0.024350240177578364 and parameters: {'window_size': 6, 'batch_size': 64, 'network_type': 'GRU', 'num_layers': 1, 'num_neurons': 128, 'learning_rate': 0.01, 'dropout_rate': 0.2}. Best is trial 41 with value: 0.013343700938754624.

1/1 [==============================] - ETA: 0s
1/1 [==============================] - 0s 163ms/step
[I 2024-09-27 22:24:40,131] Trial 96 finished with value: 0.034969273567199664 and parameters: {'window_size': 6, 'batch_size': 64, 'network_type': 'RNN', 'num_layers': 1, 'num_neurons': 128, 'learning_rate': 0.01, 'dropout_rate': 0.1}. Best is trial 41 with value: 0.013343700938754624.

1/1 [==============================] - ETA: 0s
1/1 [==============================] - 0s 178ms/step
[I 2024-09-27 22:24:42,793] Trial 97 finished with value: 0.020097646077473948 and parameters: {'window_size': 6, 'batch_size': 64, 'network_type': 'GRU', 'num_layers': 1, 'num_neurons': 128, 'learning_rate': 0.01, 'dropout_rate': 0.2}. Best is trial 41 with value: 0.013343700938754624.

1/1 [==============================] - ETA: 0s
1/1 [==============================] - 0s 185ms/step
