[I 2024-09-27 22:49:46,350] Trial 177 finished with value: 0.22201922938698215 and parameters: {'window_size': 4, 'batch_size': 16, 'network_type': 'LSTM', 'num_layers': 1, 'num_neurons': 64, 'learning_rate': 0.01, 'dropout_rate': 0.2}. Best is trial 168 with value: 0.159366235596793.

1/1 [==============================] - ETA: 0s
1/1 [==============================] - 0s 298ms/step
[I 2024-09-27 22:49:50,017] Trial 178 finished with value: 0.18164144947415303 and parameters: {'window_size': 2, 'batch_size': 16, 'network_type': 'RNN', 'num_layers': 2, 'num_neurons': 64, 'learning_rate': 0.01, 'dropout_rate': 0.1}. Best is trial 168 with value: 0.159366235596793.

1/1 [==============================] - ETA: 0s
1/1 [==============================] - 0s 296ms/step
[I 2024-09-27 22:49:53,960] Trial 179 finished with value: 0.28440461948939727 and parameters: {'window_size': 2, 'batch_size': 16, 'network_type': 'RNN', 'num_layers': 2, 'num_neurons': 64, 'learning_rate': 0.0001, 'dropout_rate': 0.1}. Best is trial 168 with value: 0.159366235596793.

1/1 [==============================] - ETA: 0s
1/1 [==============================] - 0s 401ms/step
[I 2024-09-27 22:49:58,687] Trial 180 finished with value: 0.2777600434247185 and parameters: {'window_size': 6, 'batch_size': 16, 'network_type': 'RNN', 'num_layers': 2, 'num_neurons': 64, 'learning_rate': 0.01, 'dropout_rate': 0.1}. Best is trial 168 with value: 0.159366235596793.

1/1 [==============================] - ETA: 0s
1/1 [==============================] - 0s 282ms/step
[I 2024-09-27 22:50:04,026] Trial 181 finished with value: 0.16502774020603722 and parameters: {'window_size': 2, 'batch_size': 16, 'network_type': 'RNN', 'num_layers': 2, 'num_neurons': 64, 'learning_rate': 0.01, 'dropout_rate': 0.1}. Best is trial 168 with value: 0.159366235596793.

1/1 [==============================] - ETA: 0s
1/1 [==============================] - 0s 274ms/step
[I 2024-09-27 22:50:08,196] Trial 182 finished with value: 0.303760426339649 and parameters: {'window_size': 2, 'batch_size': 16, 'network_type': 'RNN', 'num_layers': 2, 'num_neurons': 64, 'learning_rate': 0.01, 'dropout_rate': 0.1}. Best is trial 168 with value: 0.159366235596793.

1/1 [==============================] - ETA: 0s
1/1 [==============================] - 0s 327ms/step
[I 2024-09-27 22:50:12,042] Trial 183 finished with value: 0.20882284936450773 and parameters: {'window_size': 2, 'batch_size': 16, 'network_type': 'RNN', 'num_layers': 2, 'num_neurons': 64, 'learning_rate': 0.01, 'dropout_rate': 0.1}. Best is trial 168 with value: 0.159366235596793.

1/1 [==============================] - ETA: 0s
1/1 [==============================] - 0s 329ms/step
[I 2024-09-27 22:50:17,521] Trial 184 finished with value: 0.14896584805988128 and parameters: {'window_size': 2, 'batch_size': 16, 'network_type': 'RNN', 'num_layers': 2, 'num_neurons': 64, 'learning_rate': 0.01, 'dropout_rate': 0.1}. Best is trial 184 with value: 0.14896584805988128.

1/1 [==============================] - ETA: 0s
1/1 [==============================] - 0s 295ms/step
[I 2024-09-27 22:50:21,585] Trial 185 finished with value: 0.17596724323999313 and parameters: {'window_size': 2, 'batch_size': 16, 'network_type': 'RNN', 'num_layers': 2, 'num_neurons': 64, 'learning_rate': 0.01, 'dropout_rate': 0.1}. Best is trial 184 with value: 0.14896584805988128.

1/1 [==============================] - ETA: 0s
1/1 [==============================] - 0s 297ms/step
[I 2024-09-27 22:50:26,256] Trial 186 finished with value: 0.1630604167211623 and parameters: {'window_size': 2, 'batch_size': 16, 'network_type': 'RNN', 'num_layers': 2, 'num_neurons': 64, 'learning_rate': 0.01, 'dropout_rate': 0.1}. Best is trial 184 with value: 0.14896584805988128.

1/1 [==============================] - ETA: 0s
1/1 [==============================] - 0s 296ms/step
[I 2024-09-27 22:50:30,512] Trial 187 finished with value: 0.17644103504362557 and parameters: {'window_size': 2, 'batch_size': 16, 'network_type': 'RNN', 'num_layers': 2, 'num_neurons': 64, 'learning_rate': 0.01, 'dropout_rate': 0.1}. Best is trial 184 with value: 0.14896584805988128.

1/1 [==============================] - ETA: 0s
1/1 [==============================] - 0s 356ms/step
[I 2024-09-27 22:50:35,781] Trial 188 finished with value: 0.2004667765299479 and parameters: {'window_size': 2, 'batch_size': 16, 'network_type': 'RNN', 'num_layers': 2, 'num_neurons': 64, 'learning_rate': 0.01, 'dropout_rate': 0.1}. Best is trial 184 with value: 0.14896584805988128.

1/1 [==============================] - ETA: 0s
1/1 [==============================] - 0s 409ms/step
[I 2024-09-27 22:50:42,142] Trial 189 finished with value: 0.20630916654495962 and parameters: {'window_size': 2, 'batch_size': 16, 'network_type': 'GRU', 'num_layers': 2, 'num_neurons': 64, 'learning_rate': 0.01, 'dropout_rate': 0.1}. Best is trial 184 with value: 0.14896584805988128.

1/1 [==============================] - ETA: 0s
1/1 [==============================] - 0s 292ms/step
[I 2024-09-27 22:50:46,544] Trial 190 finished with value: 0.18353409435635518 and parameters: {'window_size': 2, 'batch_size': 16, 'network_type': 'RNN', 'num_layers': 2, 'num_neurons': 64, 'learning_rate': 0.01, 'dropout_rate': 0.1}. Best is trial 184 with value: 0.14896584805988128.

1/1 [==============================] - ETA: 0s
1/1 [==============================] - 0s 285ms/step
[I 2024-09-27 22:50:50,560] Trial 191 finished with value: 0.18175451864515033 and parameters: {'window_size': 2, 'batch_size': 16, 'network_type': 'RNN', 'num_layers': 2, 'num_neurons': 64, 'learning_rate': 0.01, 'dropout_rate': 0.1}. Best is trial 184 with value: 0.14896584805988128.

1/1 [==============================] - ETA: 0s
1/1 [==============================] - 0s 302ms/step
[I 2024-09-27 22:50:55,508] Trial 192 finished with value: 0.17269067546299524 and parameters: {'window_size': 2, 'batch_size': 16, 'network_type': 'RNN', 'num_layers': 2, 'num_neurons': 64, 'learning_rate': 0.01, 'dropout_rate': 0.1}. Best is trial 184 with value: 0.14896584805988128.

1/1 [==============================] - ETA: 0s
1/1 [==============================] - 0s 320ms/step
[I 2024-09-27 22:51:00,138] Trial 193 finished with value: 0.1790545353208269 and parameters: {'window_size': 2, 'batch_size': 16, 'network_type': 'RNN', 'num_layers': 2, 'num_neurons': 64, 'learning_rate': 0.01, 'dropout_rate': 0.1}. Best is trial 184 with value: 0.14896584805988128.

1/1 [==============================] - ETA: 0s
1/1 [==============================] - 0s 301ms/step
[I 2024-09-27 22:51:03,970] Trial 194 finished with value: 0.18036746179489863 and parameters: {'window_size': 2, 'batch_size': 16, 'network_type': 'RNN', 'num_layers': 2, 'num_neurons': 64, 'learning_rate': 0.01, 'dropout_rate': 0.1}. Best is trial 184 with value: 0.14896584805988128.

1/1 [==============================] - ETA: 0s
1/1 [==============================] - 0s 485ms/step
[I 2024-09-27 22:51:09,459] Trial 195 finished with value: 0.162264544123695 and parameters: {'window_size': 2, 'batch_size': 16, 'network_type': 'RNN', 'num_layers': 2, 'num_neurons': 64, 'learning_rate': 0.01, 'dropout_rate': 0.1}. Best is trial 184 with value: 0.14896584805988128.

1/1 [==============================] - ETA: 0s
1/1 [==============================] - 0s 317ms/step
[I 2024-09-27 22:51:16,126] Trial 196 finished with value: 0.20063980002630324 and parameters: {'window_size': 2, 'batch_size': 16, 'network_type': 'RNN', 'num_layers': 2, 'num_neurons': 64, 'learning_rate': 0.01, 'dropout_rate': 0.1}. Best is trial 184 with value: 0.14896584805988128.

1/1 [==============================] - ETA: 0s
1/1 [==============================] - 0s 186ms/step
[I 2024-09-27 22:51:19,086] Trial 197 finished with value: 0.18895003205253963 and parameters: {'window_size': 2, 'batch_size': 16, 'network_type': 'RNN', 'num_layers': 1, 'num_neurons': 64, 'learning_rate': 0.01, 'dropout_rate': 0.1}. Best is trial 184 with value: 0.14896584805988128.

1/1 [==============================] - ETA: 0s
1/1 [==============================] - 0s 432ms/step
[I 2024-09-27 22:51:24,906] Trial 198 finished with value: 0.20388089516049338 and parameters: {'window_size': 2, 'batch_size': 16, 'network_type': 'RNN', 'num_layers': 3, 'num_neurons': 64, 'learning_rate': 0.01, 'dropout_rate': 0.1}. Best is trial 184 with value: 0.14896584805988128.

1/1 [==============================] - ETA: 0s
1/1 [==============================] - 0s 326ms/step
[I 2024-09-27 22:51:29,210] Trial 199 finished with value: 0.17339653196788968 and parameters: {'window_size': 2, 'batch_size': 16, 'network_type': 'RNN', 'num_layers': 2, 'num_neurons': 64, 'learning_rate': 0.01, 'dropout_rate': 0.1}. Best is trial 184 with value: 0.14896584805988128.
C:\Users\user\AppData\Local\pypoetry\Cache\virtualenvs\transfer-learning-c0qmjA8b-py3.9\lib\site-packages\keras\src\engine\training.py:3103: UserWarning: You are saving your model as an HDF5 file via `model.save()`. This file format is considered legacy. We recommend using instead the native Keras format, e.g. `model.save('my_model.keras')`.
  saving_api.save_model(
Best parameters: {'window_size': 2, 'batch_size': 16, 'network_type': 'RNN', 'num_layers': 2, 'num_neurons': 64, 'learning_rate': 0.01, 'dropout_rate': 0.1}

1/1 [==============================] - ETA: 0s
1/1 [==============================] - 1s 903ms/step
[I 2024-09-27 22:51:34,149] A new study created in memory with name: no-name-3908a7a6-4ca3-46d8-ba3a-e68759b5a26c

1/1 [==============================] - ETA: 0s
1/1 [==============================] - 1s 519ms/step
[I 2024-09-27 22:51:40,877] Trial 0 finished with value: 6.09319989674886 and parameters: {'window_size': 6, 'batch_size': 64, 'network_type': 'LSTM', 'num_layers': 3, 'num_neurons': 64, 'learning_rate': 0.01, 'dropout_rate': 0.2}. Best is trial 0 with value: 6.09319989674886.

1/1 [==============================] - ETA: 0s
1/1 [==============================] - 1s 622ms/step
[I 2024-09-27 22:51:49,737] Trial 1 finished with value: 0.6108429329816033 and parameters: {'window_size': 4, 'batch_size': 32, 'network_type': 'GRU', 'num_layers': 3, 'num_neurons': 128, 'learning_rate': 0.01, 'dropout_rate': 0.2}. Best is trial 1 with value: 0.6108429329816033.

1/1 [==============================] - ETA: 0s
1/1 [==============================] - 0s 499ms/step
[I 2024-09-27 22:52:03,128] Trial 2 finished with value: 0.6731328388382406 and parameters: {'window_size': 4, 'batch_size': 32, 'network_type': 'LSTM', 'num_layers': 3, 'num_neurons': 32, 'learning_rate': 0.0001, 'dropout_rate': 0.2}. Best is trial 1 with value: 0.6108429329816033.

1/1 [==============================] - ETA: 0s
1/1 [==============================] - 1s 519ms/step
[I 2024-09-27 22:52:10,494] Trial 3 finished with value: 0.3727255201975505 and parameters: {'window_size': 6, 'batch_size': 16, 'network_type': 'LSTM', 'num_layers': 3, 'num_neurons': 16, 'learning_rate': 0.01, 'dropout_rate': 0.3}. Best is trial 3 with value: 0.3727255201975505.

1/1 [==============================] - ETA: 0s
1/1 [==============================] - 0s 408ms/step
[I 2024-09-27 22:52:15,495] Trial 4 finished with value: 0.2474564012527466 and parameters: {'window_size': 6, 'batch_size': 64, 'network_type': 'GRU', 'num_layers': 2, 'num_neurons': 128, 'learning_rate': 0.01, 'dropout_rate': 0.1}. Best is trial 4 with value: 0.2474564012527466.

1/1 [==============================] - ETA: 0s
1/1 [==============================] - 0s 195ms/step
[I 2024-09-27 22:52:18,634] Trial 5 finished with value: 0.22144123916625977 and parameters: {'window_size': 6, 'batch_size': 64, 'network_type': 'LSTM', 'num_layers': 1, 'num_neurons': 16, 'learning_rate': 0.01, 'dropout_rate': 0.1}. Best is trial 5 with value: 0.22144123916625977.

1/1 [==============================] - ETA: 0s
1/1 [==============================] - 0s 353ms/step
[I 2024-09-27 22:52:30,109] Trial 6 finished with value: 0.6489166006480945 and parameters: {'window_size': 4, 'batch_size': 32, 'network_type': 'LSTM', 'num_layers': 2, 'num_neurons': 32, 'learning_rate': 0.0001, 'dropout_rate': 0.3}. Best is trial 5 with value: 0.22144123916625977.

1/1 [==============================] - ETA: 0s
1/1 [==============================] - 1s 503ms/step
[I 2024-09-27 22:52:38,471] Trial 7 finished with value: 0.8320041570663453 and parameters: {'window_size': 4, 'batch_size': 32, 'network_type': 'LSTM', 'num_layers': 3, 'num_neurons': 32, 'learning_rate': 0.01, 'dropout_rate': 0.1}. Best is trial 5 with value: 0.22144123916625977.

1/1 [==============================] - ETA: 0s
1/1 [==============================] - 0s 185ms/step
[I 2024-09-27 22:52:44,800] Trial 8 finished with value: 0.6543554017684038 and parameters: {'window_size': 4, 'batch_size': 64, 'network_type': 'RNN', 'num_layers': 1, 'num_neurons': 32, 'learning_rate': 0.0001, 'dropout_rate': 0.2}. Best is trial 5 with value: 0.22144123916625977.

1/1 [==============================] - ETA: 0s
1/1 [==============================] - 0s 217ms/step
[I 2024-09-27 22:52:52,652] Trial 9 finished with value: 0.30593638264505485 and parameters: {'window_size': 2, 'batch_size': 16, 'network_type': 'GRU', 'num_layers': 1, 'num_neurons': 64, 'learning_rate': 0.0001, 'dropout_rate': 0.1}. Best is trial 5 with value: 0.22144123916625977.

1/1 [==============================] - ETA: 0s
1/1 [==============================] - 0s 235ms/step
[I 2024-09-27 22:52:56,042] Trial 10 finished with value: 0.15624612795679194 and parameters: {'window_size': 2, 'batch_size': 64, 'network_type': 'RNN', 'num_layers': 1, 'num_neurons': 16, 'learning_rate': 0.01, 'dropout_rate': 0.1}. Best is trial 10 with value: 0.15624612795679194.

1/1 [==============================] - ETA: 0s
1/1 [==============================] - 0s 254ms/step
[I 2024-09-27 22:52:59,196] Trial 11 finished with value: 0.12411433064310175 and parameters: {'window_size': 2, 'batch_size': 64, 'network_type': 'RNN', 'num_layers': 1, 'num_neurons': 16, 'learning_rate': 0.01, 'dropout_rate': 0.1}. Best is trial 11 with value: 0.12411433064310175.

1/1 [==============================] - ETA: 0s
1/1 [==============================] - 0s 172ms/step
[I 2024-09-27 22:53:01,958] Trial 12 finished with value: 0.14557379082629554 and parameters: {'window_size': 2, 'batch_size': 64, 'network_type': 'RNN', 'num_layers': 1, 'num_neurons': 16, 'learning_rate': 0.01, 'dropout_rate': 0.1}. Best is trial 11 with value: 0.12411433064310175.

1/1 [==============================] - ETA: 0s
1/1 [==============================] - 0s 231ms/step
[I 2024-09-27 22:53:04,792] Trial 13 finished with value: 0.08461090976313543 and parameters: {'window_size': 2, 'batch_size': 64, 'network_type': 'RNN', 'num_layers': 1, 'num_neurons': 16, 'learning_rate': 0.01, 'dropout_rate': 0.1}. Best is trial 13 with value: 0.08461090976313543.

1/1 [==============================] - ETA: 0s
1/1 [==============================] - 0s 168ms/step
[I 2024-09-27 22:53:07,385] Trial 14 finished with value: 0.14089944086576764 and parameters: {'window_size': 2, 'batch_size': 64, 'network_type': 'RNN', 'num_layers': 1, 'num_neurons': 16, 'learning_rate': 0.01, 'dropout_rate': 0.1}. Best is trial 13 with value: 0.08461090976313543.

1/1 [==============================] - ETA: 0s
1/1 [==============================] - 0s 185ms/step
[I 2024-09-27 22:53:10,260] Trial 15 finished with value: 0.09134416801051089 and parameters: {'window_size': 2, 'batch_size': 64, 'network_type': 'RNN', 'num_layers': 1, 'num_neurons': 16, 'learning_rate': 0.01, 'dropout_rate': 0.1}. Best is trial 13 with value: 0.08461090976313543.

1/1 [==============================] - ETA: 0s
1/1 [==============================] - 0s 169ms/step
[I 2024-09-27 22:53:13,195] Trial 16 finished with value: 0.2519367453424554 and parameters: {'window_size': 2, 'batch_size': 16, 'network_type': 'RNN', 'num_layers': 1, 'num_neurons': 16, 'learning_rate': 0.01, 'dropout_rate': 0.3}. Best is trial 13 with value: 0.08461090976313543.

1/1 [==============================] - ETA: 0s
1/1 [==============================] - 0s 301ms/step
[I 2024-09-27 22:53:17,501] Trial 17 finished with value: 0.16189892643376402 and parameters: {'window_size': 2, 'batch_size': 64, 'network_type': 'RNN', 'num_layers': 2, 'num_neurons': 16, 'learning_rate': 0.01, 'dropout_rate': 0.1}. Best is trial 13 with value: 0.08461090976313543.

1/1 [==============================] - ETA: 0s
1/1 [==============================] - 0s 233ms/step
[I 2024-09-27 22:53:20,507] Trial 18 finished with value: 0.111814191517077 and parameters: {'window_size': 2, 'batch_size': 64, 'network_type': 'RNN', 'num_layers': 1, 'num_neurons': 64, 'learning_rate': 0.01, 'dropout_rate': 0.1}. Best is trial 13 with value: 0.08461090976313543.

1/1 [==============================] - ETA: 0s
1/1 [==============================] - 0s 169ms/step
[I 2024-09-27 22:53:23,216] Trial 19 finished with value: 0.1489973843725104 and parameters: {'window_size': 2, 'batch_size': 16, 'network_type': 'RNN', 'num_layers': 1, 'num_neurons': 128, 'learning_rate': 0.01, 'dropout_rate': 0.3}. Best is trial 13 with value: 0.08461090976313543.

1/1 [==============================] - ETA: 0s
1/1 [==============================] - 0s 300ms/step
[I 2024-09-27 22:53:27,251] Trial 20 finished with value: 0.13507920194927014 and parameters: {'window_size': 2, 'batch_size': 64, 'network_type': 'RNN', 'num_layers': 2, 'num_neurons': 16, 'learning_rate': 0.01, 'dropout_rate': 0.1}. Best is trial 13 with value: 0.08461090976313543.

1/1 [==============================] - ETA: 0s
1/1 [==============================] - 0s 245ms/step
[I 2024-09-27 22:53:29,760] Trial 21 finished with value: 0.11570682570808813 and parameters: {'window_size': 2, 'batch_size': 64, 'network_type': 'RNN', 'num_layers': 1, 'num_neurons': 64, 'learning_rate': 0.01, 'dropout_rate': 0.1}. Best is trial 13 with value: 0.08461090976313543.

1/1 [==============================] - ETA: 0s
1/1 [==============================] - 0s 207ms/step
[I 2024-09-27 22:53:34,070] Trial 22 finished with value: 0.19897835269727204 and parameters: {'window_size': 2, 'batch_size': 64, 'network_type': 'RNN', 'num_layers': 1, 'num_neurons': 64, 'learning_rate': 0.01, 'dropout_rate': 0.1}. Best is trial 13 with value: 0.08461090976313543.

1/1 [==============================] - ETA: 0s
1/1 [==============================] - 0s 184ms/step
[I 2024-09-27 22:53:37,008] Trial 23 finished with value: 0.2044219406529477 and parameters: {'window_size': 2, 'batch_size': 64, 'network_type': 'RNN', 'num_layers': 1, 'num_neurons': 64, 'learning_rate': 0.01, 'dropout_rate': 0.1}. Best is trial 13 with value: 0.08461090976313543.

1/1 [==============================] - ETA: 0s
1/1 [==============================] - 0s 216ms/step
[I 2024-09-27 22:53:39,374] Trial 24 finished with value: 0.13813392714450234 and parameters: {'window_size': 2, 'batch_size': 64, 'network_type': 'RNN', 'num_layers': 1, 'num_neurons': 64, 'learning_rate': 0.01, 'dropout_rate': 0.1}. Best is trial 13 with value: 0.08461090976313543.

1/1 [==============================] - ETA: 0s
1/1 [==============================] - 0s 206ms/step
[I 2024-09-27 22:53:43,444] Trial 25 finished with value: 0.13600249892786928 and parameters: {'window_size': 2, 'batch_size': 64, 'network_type': 'GRU', 'num_layers': 1, 'num_neurons': 16, 'learning_rate': 0.01, 'dropout_rate': 0.1}. Best is trial 13 with value: 0.08461090976313543.

1/1 [==============================] - ETA: 0s
1/1 [==============================] - 0s 200ms/step
[I 2024-09-27 22:53:46,076] Trial 26 finished with value: 0.08785507829565752 and parameters: {'window_size': 2, 'batch_size': 64, 'network_type': 'RNN', 'num_layers': 1, 'num_neurons': 64, 'learning_rate': 0.01, 'dropout_rate': 0.1}. Best is trial 13 with value: 0.08461090976313543.

1/1 [==============================] - ETA: 0s
1/1 [==============================] - 0s 172ms/step
