[I 2024-09-27 23:09:58,281] Trial 193 finished with value: 0.08841607701150994 and parameters: {'window_size': 2, 'batch_size': 64, 'network_type': 'RNN', 'num_layers': 1, 'num_neurons': 16, 'learning_rate': 0.01, 'dropout_rate': 0.1}. Best is trial 114 with value: 0.08357412559107731.

1/1 [==============================] - ETA: 0s
1/1 [==============================] - 0s 230ms/step
[I 2024-09-27 23:10:01,385] Trial 194 finished with value: 0.17065814520183362 and parameters: {'window_size': 2, 'batch_size': 64, 'network_type': 'RNN', 'num_layers': 1, 'num_neurons': 16, 'learning_rate': 0.01, 'dropout_rate': 0.1}. Best is trial 114 with value: 0.08357412559107731.

1/1 [==============================] - ETA: 0s
1/1 [==============================] - 0s 196ms/step
[I 2024-09-27 23:10:04,100] Trial 195 finished with value: 0.10557646470320851 and parameters: {'window_size': 2, 'batch_size': 64, 'network_type': 'RNN', 'num_layers': 1, 'num_neurons': 16, 'learning_rate': 0.01, 'dropout_rate': 0.1}. Best is trial 114 with value: 0.08357412559107731.

1/1 [==============================] - ETA: 0s
1/1 [==============================] - 0s 178ms/step
[I 2024-09-27 23:10:07,429] Trial 196 finished with value: 0.1732310723254555 and parameters: {'window_size': 2, 'batch_size': 64, 'network_type': 'RNN', 'num_layers': 1, 'num_neurons': 16, 'learning_rate': 0.01, 'dropout_rate': 0.1}. Best is trial 114 with value: 0.08357412559107731.
2024-09-27 23:10:08.579436: W tensorflow/core/grappler/utils/graph_view.cc:849] No registered '' OpKernel for CPU devices compatible with node {{node sequential_2006/simple_rnn_1262/while/body/_1/sequential_2006/simple_rnn_1262/while/simple_rnn_cell/Relu}}
	.  Registered:  <no registered kernels>

2024-09-27 23:10:08.614075: E tensorflow/core/grappler/optimizers/tfg_optimizer_hook.cc:135] tfg_optimizer{any(tfg-consolidate-attrs,tfg-toposort,tfg-shape-inference{graph-version=0},tfg-prepare-attrs-export)} failed: INVALID_ARGUMENT: Node sequential_2006/simple_rnn_1262/while/body/_1/sequential_2006/simple_rnn_1262/while/simple_rnn_cell/Relu has an empty op name
	when importing GraphDef to MLIR module in GrapplerHook
2024-09-27 23:10:08.647100: E tensorflow/core/grappler/optimizers/meta_optimizer.cc:961] remapper failed: NOT_FOUND: Op type not registered '' in binary running on DESKTOP-CO9CTFR. Make sure the Op and Kernel are registered in the binary running in this process. Note that if you are loading a saved graph which used ops from tf.contrib (e.g. `tf.contrib.resampler`), accessing should be done before importing the graph, as contrib ops are lazily registered when the module is first accessed.
2024-09-27 23:10:08.655307: E tensorflow/core/grappler/optimizers/tfg_optimizer_hook.cc:135] tfg_optimizer{any(tfg-consolidate-attrs,tfg-functional-to-region,tfg.func(tfg-cf-sink),tfg-region-to-functional{force-control-capture=true},tfg-lift-legacy-call,symbol-privatize{},symbol-dce,tfg-prepare-attrs-export)} failed: INVALID_ARGUMENT: Node sequential_2006/simple_rnn_1262/while/body/_1/sequential_2006/simple_rnn_1262/while/simple_rnn_cell/Relu has an empty op name
	when importing GraphDef to MLIR module in GrapplerHook
2024-09-27 23:10:08.656211: E tensorflow/core/grappler/optimizers/tfg_optimizer_hook.cc:135] tfg_optimizer{any(tfg-consolidate-attrs,tfg-functional-to-region,tfg.func(tfg-cf-sink),tfg-region-to-functional{force-control-capture=true},tfg-lift-legacy-call,symbol-privatize{},symbol-dce,tfg-prepare-attrs-export)} failed: INVALID_ARGUMENT: Node sequential_2006/simple_rnn_1262/while/body/_1/sequential_2006/simple_rnn_1262/while/simple_rnn_cell/Relu has an empty op name
	when importing GraphDef to MLIR module in GrapplerHook
2024-09-27 23:10:08.657960: W tensorflow/core/common_runtime/optimize_function_graph_utils.cc:615] Ignoring multi-device function optimization failure: INVALID_ARGUMENT: Node 'sequential_2006/simple_rnn_1262/while/body/_1/sequential_2006/simple_rnn_1262/while/simple_rnn_cell/Relu' does not specify an operation

1/1 [==============================] - ETA: 0s
1/1 [==============================] - 0s 185ms/step
[I 2024-09-27 23:10:10,172] Trial 197 finished with value: 0.21400744285583498 and parameters: {'window_size': 6, 'batch_size': 64, 'network_type': 'RNN', 'num_layers': 1, 'num_neurons': 16, 'learning_rate': 0.01, 'dropout_rate': 0.2}. Best is trial 114 with value: 0.08357412559107731.

1/1 [==============================] - ETA: 0s
1/1 [==============================] - 0s 190ms/step
[I 2024-09-27 23:10:13,263] Trial 198 finished with value: 0.1436555408176623 and parameters: {'window_size': 2, 'batch_size': 32, 'network_type': 'RNN', 'num_layers': 1, 'num_neurons': 16, 'learning_rate': 0.01, 'dropout_rate': 0.1}. Best is trial 114 with value: 0.08357412559107731.

1/1 [==============================] - ETA: 0s
1/1 [==============================] - 0s 385ms/step
[I 2024-09-27 23:10:18,835] Trial 199 finished with value: 0.20980759434950977 and parameters: {'window_size': 2, 'batch_size': 64, 'network_type': 'RNN', 'num_layers': 2, 'num_neurons': 16, 'learning_rate': 0.01, 'dropout_rate': 0.1}. Best is trial 114 with value: 0.08357412559107731.
C:\Users\user\AppData\Local\pypoetry\Cache\virtualenvs\transfer-learning-c0qmjA8b-py3.9\lib\site-packages\keras\src\engine\training.py:3103: UserWarning: You are saving your model as an HDF5 file via `model.save()`. This file format is considered legacy. We recommend using instead the native Keras format, e.g. `model.save('my_model.keras')`.
  saving_api.save_model(
Best parameters: {'window_size': 2, 'batch_size': 64, 'network_type': 'RNN', 'num_layers': 1, 'num_neurons': 128, 'learning_rate': 0.01, 'dropout_rate': 0.1}

1/1 [==============================] - ETA: 0s
1/1 [==============================] - 0s 200ms/step
[I 2024-09-27 23:10:23,080] A new study created in memory with name: no-name-90af618b-b88d-47c8-875c-048a98816627
[I 2024-09-27 23:10:54,048] Trial 0 finished with value: 0.04617301155970644 and parameters: {'learning_rate': 0.01, 'batch_size': 64, 'network_type': 'LSTM', 'num_layers': 2, 'num_neurons': 64, 'dropout_rate': 0.2}. Best is trial 0 with value: 0.04617301155970644.
[I 2024-09-27 23:11:12,464] Trial 1 finished with value: 0.04125472971109241 and parameters: {'learning_rate': 0.0001, 'batch_size': 32, 'network_type': 'GRU', 'num_layers': 3, 'num_neurons': 16, 'dropout_rate': 0.2}. Best is trial 1 with value: 0.04125472971109241.
[I 2024-09-27 23:11:25,533] Trial 2 finished with value: 0.04841831563069275 and parameters: {'learning_rate': 0.01, 'batch_size': 64, 'network_type': 'LSTM', 'num_layers': 3, 'num_neurons': 32, 'dropout_rate': 0.2}. Best is trial 1 with value: 0.04125472971109241.
[I 2024-09-27 23:11:43,297] Trial 3 finished with value: 0.03809662804236776 and parameters: {'learning_rate': 0.0001, 'batch_size': 16, 'network_type': 'GRU', 'num_layers': 2, 'num_neurons': 16, 'dropout_rate': 0.2}. Best is trial 3 with value: 0.03809662804236776.
[I 2024-09-27 23:11:50,563] Trial 4 finished with value: 0.03307523558689999 and parameters: {'learning_rate': 0.01, 'batch_size': 32, 'network_type': 'GRU', 'num_layers': 1, 'num_neurons': 64, 'dropout_rate': 0.2}. Best is trial 4 with value: 0.03307523558689999.
[I 2024-09-27 23:12:10,753] Trial 5 finished with value: 0.02682420972677379 and parameters: {'learning_rate': 0.0001, 'batch_size': 16, 'network_type': 'LSTM', 'num_layers': 3, 'num_neurons': 64, 'dropout_rate': 0.1}. Best is trial 5 with value: 0.02682420972677379.
[I 2024-09-27 23:12:24,425] Trial 6 finished with value: 0.031683112731346746 and parameters: {'learning_rate': 0.01, 'batch_size': 64, 'network_type': 'LSTM', 'num_layers': 3, 'num_neurons': 128, 'dropout_rate': 0.2}. Best is trial 5 with value: 0.02682420972677379.
[I 2024-09-27 23:12:29,972] Trial 7 finished with value: 0.050762057377741934 and parameters: {'learning_rate': 0.01, 'batch_size': 16, 'network_type': 'RNN', 'num_layers': 2, 'num_neurons': 16, 'dropout_rate': 0.3}. Best is trial 5 with value: 0.02682420972677379.
[I 2024-09-27 23:12:36,126] Trial 8 finished with value: 0.04052154335608853 and parameters: {'learning_rate': 0.01, 'batch_size': 64, 'network_type': 'RNN', 'num_layers': 2, 'num_neurons': 32, 'dropout_rate': 0.1}. Best is trial 5 with value: 0.02682420972677379.
[I 2024-09-27 23:12:44,346] Trial 9 finished with value: 0.03240458455452554 and parameters: {'learning_rate': 0.01, 'batch_size': 32, 'network_type': 'GRU', 'num_layers': 1, 'num_neurons': 16, 'dropout_rate': 0.2}. Best is trial 5 with value: 0.02682420972677379.
[I 2024-09-27 23:12:57,831] Trial 10 finished with value: 0.03719559720846325 and parameters: {'learning_rate': 0.01, 'batch_size': 16, 'network_type': 'LSTM', 'num_layers': 3, 'num_neurons': 64, 'dropout_rate': 0.1}. Best is trial 5 with value: 0.02682420972677379.
[I 2024-09-27 23:13:10,789] Trial 11 finished with value: 0.03845862660041226 and parameters: {'learning_rate': 0.01, 'batch_size': 16, 'network_type': 'LSTM', 'num_layers': 3, 'num_neurons': 128, 'dropout_rate': 0.1}. Best is trial 5 with value: 0.02682420972677379.
[I 2024-09-27 23:13:25,442] Trial 12 finished with value: 0.03826620487066412 and parameters: {'learning_rate': 0.01, 'batch_size': 64, 'network_type': 'LSTM', 'num_layers': 3, 'num_neurons': 128, 'dropout_rate': 0.3}. Best is trial 5 with value: 0.02682420972677379.
[I 2024-09-27 23:13:37,328] Trial 13 finished with value: 0.03457584469134993 and parameters: {'learning_rate': 0.01, 'batch_size': 64, 'network_type': 'LSTM', 'num_layers': 3, 'num_neurons': 128, 'dropout_rate': 0.1}. Best is trial 5 with value: 0.02682420972677379.
[I 2024-09-27 23:13:50,579] Trial 14 finished with value: 0.042057215763972394 and parameters: {'learning_rate': 0.01, 'batch_size': 16, 'network_type': 'LSTM', 'num_layers': 3, 'num_neurons': 64, 'dropout_rate': 0.1}. Best is trial 5 with value: 0.02682420972677379.
[I 2024-09-27 23:14:03,629] Trial 15 finished with value: 0.03680074552389289 and parameters: {'learning_rate': 0.01, 'batch_size': 64, 'network_type': 'LSTM', 'num_layers': 3, 'num_neurons': 128, 'dropout_rate': 0.3}. Best is trial 5 with value: 0.02682420972677379.
[I 2024-09-27 23:14:07,989] Trial 16 finished with value: 0.041780307256258434 and parameters: {'learning_rate': 0.01, 'batch_size': 16, 'network_type': 'RNN', 'num_layers': 1, 'num_neurons': 64, 'dropout_rate': 0.1}. Best is trial 5 with value: 0.02682420972677379.
[I 2024-09-27 23:14:20,441] Trial 17 finished with value: 0.02957599111703727 and parameters: {'learning_rate': 0.01, 'batch_size': 64, 'network_type': 'LSTM', 'num_layers': 3, 'num_neurons': 128, 'dropout_rate': 0.1}. Best is trial 5 with value: 0.02682420972677379.
[I 2024-09-27 23:14:34,974] Trial 18 finished with value: 0.04357775776202866 and parameters: {'learning_rate': 0.01, 'batch_size': 16, 'network_type': 'LSTM', 'num_layers': 3, 'num_neurons': 32, 'dropout_rate': 0.1}. Best is trial 5 with value: 0.02682420972677379.
[I 2024-09-27 23:14:39,367] Trial 19 finished with value: 0.032911288114694445 and parameters: {'learning_rate': 0.01, 'batch_size': 32, 'network_type': 'RNN', 'num_layers': 1, 'num_neurons': 128, 'dropout_rate': 0.1}. Best is trial 5 with value: 0.02682420972677379.
[I 2024-09-27 23:14:51,781] Trial 20 finished with value: 0.03482191041799691 and parameters: {'learning_rate': 0.01, 'batch_size': 64, 'network_type': 'LSTM', 'num_layers': 3, 'num_neurons': 64, 'dropout_rate': 0.1}. Best is trial 5 with value: 0.02682420972677379.
[I 2024-09-27 23:15:05,913] Trial 21 finished with value: 0.03406298211904671 and parameters: {'learning_rate': 0.01, 'batch_size': 64, 'network_type': 'LSTM', 'num_layers': 3, 'num_neurons': 128, 'dropout_rate': 0.1}. Best is trial 5 with value: 0.02682420972677379.
[I 2024-09-27 23:15:18,391] Trial 22 finished with value: 0.033567438272329456 and parameters: {'learning_rate': 0.01, 'batch_size': 64, 'network_type': 'LSTM', 'num_layers': 3, 'num_neurons': 128, 'dropout_rate': 0.2}. Best is trial 5 with value: 0.02682420972677379.
[I 2024-09-27 23:15:30,832] Trial 23 finished with value: 0.03632266756204457 and parameters: {'learning_rate': 0.01, 'batch_size': 64, 'network_type': 'LSTM', 'num_layers': 3, 'num_neurons': 128, 'dropout_rate': 0.3}. Best is trial 5 with value: 0.02682420972677379.
[I 2024-09-27 23:15:45,186] Trial 24 finished with value: 0.03533064123300408 and parameters: {'learning_rate': 0.01, 'batch_size': 64, 'network_type': 'LSTM', 'num_layers': 3, 'num_neurons': 128, 'dropout_rate': 0.1}. Best is trial 5 with value: 0.02682420972677379.
[I 2024-09-27 23:15:57,916] Trial 25 finished with value: 0.030775569182175867 and parameters: {'learning_rate': 0.01, 'batch_size': 16, 'network_type': 'LSTM', 'num_layers': 3, 'num_neurons': 128, 'dropout_rate': 0.2}. Best is trial 5 with value: 0.02682420972677379.
[I 2024-09-27 23:16:12,271] Trial 26 finished with value: 0.041633417569674015 and parameters: {'learning_rate': 0.01, 'batch_size': 16, 'network_type': 'LSTM', 'num_layers': 3, 'num_neurons': 64, 'dropout_rate': 0.1}. Best is trial 5 with value: 0.02682420972677379.
[I 2024-09-27 23:16:25,494] Trial 27 finished with value: 0.03598985723348768 and parameters: {'learning_rate': 0.01, 'batch_size': 16, 'network_type': 'LSTM', 'num_layers': 3, 'num_neurons': 32, 'dropout_rate': 0.1}. Best is trial 5 with value: 0.02682420972677379.
[I 2024-09-27 23:16:32,004] Trial 28 finished with value: 0.032341009213374204 and parameters: {'learning_rate': 0.01, 'batch_size': 16, 'network_type': 'GRU', 'num_layers': 1, 'num_neurons': 128, 'dropout_rate': 0.3}. Best is trial 5 with value: 0.02682420972677379.
[I 2024-09-27 23:16:38,156] Trial 29 finished with value: 0.03751325269845815 and parameters: {'learning_rate': 0.01, 'batch_size': 16, 'network_type': 'RNN', 'num_layers': 2, 'num_neurons': 64, 'dropout_rate': 0.2}. Best is trial 5 with value: 0.02682420972677379.
[I 2024-09-27 23:16:49,127] Trial 30 finished with value: 0.03377331858414872 and parameters: {'learning_rate': 0.01, 'batch_size': 16, 'network_type': 'LSTM', 'num_layers': 2, 'num_neurons': 64, 'dropout_rate': 0.2}. Best is trial 5 with value: 0.02682420972677379.
[I 2024-09-27 23:17:02,158] Trial 31 finished with value: 0.03634099828279934 and parameters: {'learning_rate': 0.01, 'batch_size': 64, 'network_type': 'LSTM', 'num_layers': 3, 'num_neurons': 128, 'dropout_rate': 0.2}. Best is trial 5 with value: 0.02682420972677379.
[I 2024-09-27 23:17:16,127] Trial 32 finished with value: 0.033970297593336835 and parameters: {'learning_rate': 0.01, 'batch_size': 32, 'network_type': 'LSTM', 'num_layers': 3, 'num_neurons': 128, 'dropout_rate': 0.2}. Best is trial 5 with value: 0.02682420972677379.
[I 2024-09-27 23:17:30,141] Trial 33 finished with value: 0.037292587720430835 and parameters: {'learning_rate': 0.01, 'batch_size': 64, 'network_type': 'LSTM', 'num_layers': 3, 'num_neurons': 128, 'dropout_rate': 0.2}. Best is trial 5 with value: 0.02682420972677379.
[I 2024-09-27 23:17:41,907] Trial 34 finished with value: 0.03474538781092719 and parameters: {'learning_rate': 0.01, 'batch_size': 64, 'network_type': 'LSTM', 'num_layers': 3, 'num_neurons': 128, 'dropout_rate': 0.2}. Best is trial 5 with value: 0.02682420972677379.
[I 2024-09-27 23:18:01,055] Trial 35 finished with value: 0.03973980888953573 and parameters: {'learning_rate': 0.0001, 'batch_size': 16, 'network_type': 'GRU', 'num_layers': 3, 'num_neurons': 16, 'dropout_rate': 0.2}. Best is trial 5 with value: 0.02682420972677379.
[I 2024-09-27 23:18:13,159] Trial 36 finished with value: 0.0405818758010864 and parameters: {'learning_rate': 0.01, 'batch_size': 32, 'network_type': 'LSTM', 'num_layers': 3, 'num_neurons': 128, 'dropout_rate': 0.2}. Best is trial 5 with value: 0.02682420972677379.
[I 2024-09-27 23:18:22,637] Trial 37 finished with value: 0.04174701485267056 and parameters: {'learning_rate': 0.01, 'batch_size': 16, 'network_type': 'LSTM', 'num_layers': 2, 'num_neurons': 32, 'dropout_rate': 0.2}. Best is trial 5 with value: 0.02682420972677379.
[I 2024-09-27 23:18:35,741] Trial 38 finished with value: 0.04342072750971872 and parameters: {'learning_rate': 0.01, 'batch_size': 64, 'network_type': 'GRU', 'num_layers': 3, 'num_neurons': 16, 'dropout_rate': 0.2}. Best is trial 5 with value: 0.02682420972677379.
[I 2024-09-27 23:18:39,823] Trial 39 finished with value: 0.05893468148891746 and parameters: {'learning_rate': 0.01, 'batch_size': 32, 'network_type': 'RNN', 'num_layers': 1, 'num_neurons': 64, 'dropout_rate': 0.1}. Best is trial 5 with value: 0.02682420972677379.
[I 2024-09-27 23:18:52,896] Trial 40 finished with value: 0.035676336435171284 and parameters: {'learning_rate': 0.01, 'batch_size': 16, 'network_type': 'LSTM', 'num_layers': 3, 'num_neurons': 128, 'dropout_rate': 0.2}. Best is trial 5 with value: 0.02682420972677379.
[I 2024-09-27 23:18:59,069] Trial 41 finished with value: 0.03655979317885177 and parameters: {'learning_rate': 0.01, 'batch_size': 16, 'network_type': 'GRU', 'num_layers': 1, 'num_neurons': 128, 'dropout_rate': 0.3}. Best is trial 5 with value: 0.02682420972677379.
[I 2024-09-27 23:19:05,516] Trial 42 finished with value: 0.07383433231940639 and parameters: {'learning_rate': 0.01, 'batch_size': 16, 'network_type': 'GRU', 'num_layers': 1, 'num_neurons': 128, 'dropout_rate': 0.3}. Best is trial 5 with value: 0.02682420972677379.
[I 2024-09-27 23:19:11,783] Trial 43 finished with value: 0.04299125183545623 and parameters: {'learning_rate': 0.01, 'batch_size': 16, 'network_type': 'GRU', 'num_layers': 1, 'num_neurons': 128, 'dropout_rate': 0.3}. Best is trial 5 with value: 0.02682420972677379.
[I 2024-09-27 23:19:17,757] Trial 44 finished with value: 0.035573937636155344 and parameters: {'learning_rate': 0.01, 'batch_size': 16, 'network_type': 'GRU', 'num_layers': 1, 'num_neurons': 16, 'dropout_rate': 0.3}. Best is trial 5 with value: 0.02682420972677379.
[I 2024-09-27 23:19:23,523] Trial 45 finished with value: 0.03133093973306508 and parameters: {'learning_rate': 0.01, 'batch_size': 16, 'network_type': 'GRU', 'num_layers': 1, 'num_neurons': 128, 'dropout_rate': 0.3}. Best is trial 5 with value: 0.02682420972677379.
[I 2024-09-27 23:19:32,019] Trial 46 finished with value: 0.03342950982313892 and parameters: {'learning_rate': 0.01, 'batch_size': 64, 'network_type': 'GRU', 'num_layers': 2, 'num_neurons': 128, 'dropout_rate': 0.3}. Best is trial 5 with value: 0.02682420972677379.
[I 2024-09-27 23:19:46,824] Trial 47 finished with value: 0.03294505244034989 and parameters: {'learning_rate': 0.01, 'batch_size': 16, 'network_type': 'LSTM', 'num_layers': 3, 'num_neurons': 128, 'dropout_rate': 0.1}. Best is trial 5 with value: 0.02682420972677379.
[I 2024-09-27 23:19:52,655] Trial 48 finished with value: 0.03341064724555384 and parameters: {'learning_rate': 0.01, 'batch_size': 64, 'network_type': 'LSTM', 'num_layers': 1, 'num_neurons': 32, 'dropout_rate': 0.1}. Best is trial 5 with value: 0.02682420972677379.
[I 2024-09-27 23:19:58,834] Trial 49 finished with value: 0.03768095104510971 and parameters: {'learning_rate': 0.01, 'batch_size': 16, 'network_type': 'RNN', 'num_layers': 3, 'num_neurons': 64, 'dropout_rate': 0.3}. Best is trial 5 with value: 0.02682420972677379.
[I 2024-09-27 23:20:10,457] Trial 50 finished with value: 0.036322214933542124 and parameters: {'learning_rate': 0.01, 'batch_size': 32, 'network_type': 'LSTM', 'num_layers': 3, 'num_neurons': 128, 'dropout_rate': 0.1}. Best is trial 5 with value: 0.02682420972677379.
[I 2024-09-27 23:20:18,264] Trial 51 finished with value: 0.03292401141386765 and parameters: {'learning_rate': 0.01, 'batch_size': 16, 'network_type': 'GRU', 'num_layers': 1, 'num_neurons': 128, 'dropout_rate': 0.3}. Best is trial 5 with value: 0.02682420972677379.
[I 2024-09-27 23:20:24,184] Trial 52 finished with value: 0.04737413806181691 and parameters: {'learning_rate': 0.01, 'batch_size': 16, 'network_type': 'GRU', 'num_layers': 1, 'num_neurons': 128, 'dropout_rate': 0.3}. Best is trial 5 with value: 0.02682420972677379.
[I 2024-09-27 23:20:32,105] Trial 53 finished with value: 0.03402858235285834 and parameters: {'learning_rate': 0.01, 'batch_size': 16, 'network_type': 'GRU', 'num_layers': 1, 'num_neurons': 128, 'dropout_rate': 0.3}. Best is trial 5 with value: 0.02682420972677379.
[I 2024-09-27 23:20:38,101] Trial 54 finished with value: 0.03927753243079554 and parameters: {'learning_rate': 0.01, 'batch_size': 16, 'network_type': 'GRU', 'num_layers': 1, 'num_neurons': 128, 'dropout_rate': 0.3}. Best is trial 5 with value: 0.02682420972677379.
[I 2024-09-27 23:20:44,131] Trial 55 finished with value: 0.0329310224239643 and parameters: {'learning_rate': 0.01, 'batch_size': 16, 'network_type': 'GRU', 'num_layers': 1, 'num_neurons': 128, 'dropout_rate': 0.3}. Best is trial 5 with value: 0.02682420972677379.
[I 2024-09-27 23:20:58,404] Trial 56 finished with value: 0.03757462186079757 and parameters: {'learning_rate': 0.01, 'batch_size': 64, 'network_type': 'LSTM', 'num_layers': 3, 'num_neurons': 64, 'dropout_rate': 0.1}. Best is trial 5 with value: 0.02682420972677379.
[I 2024-09-27 23:21:04,578] Trial 57 finished with value: 0.04202033424377445 and parameters: {'learning_rate': 0.01, 'batch_size': 16, 'network_type': 'GRU', 'num_layers': 1, 'num_neurons': 128, 'dropout_rate': 0.2}. Best is trial 5 with value: 0.02682420972677379.
[I 2024-09-27 23:21:17,320] Trial 58 finished with value: 0.038529521648700445 and parameters: {'learning_rate': 0.01, 'batch_size': 64, 'network_type': 'LSTM', 'num_layers': 3, 'num_neurons': 16, 'dropout_rate': 0.1}. Best is trial 5 with value: 0.02682420972677379.
[I 2024-09-27 23:21:22,676] Trial 59 finished with value: 0.036276557775644175 and parameters: {'learning_rate': 0.01, 'batch_size': 16, 'network_type': 'RNN', 'num_layers': 2, 'num_neurons': 32, 'dropout_rate': 0.3}. Best is trial 5 with value: 0.02682420972677379.
