[I 2024-09-27 20:17:38,356] Trial 149 finished with value: 0.013517570972442616 and parameters: {'window_size': 6, 'batch_size': 16, 'network_type': 'GRU', 'num_layers': 1, 'num_neurons': 64, 'learning_rate': 0.01, 'dropout_rate': 0.1}. Best is trial 117 with value: 0.013069600143948108.

1/2 [==============>...............] - ETA: 0s
2/2 [==============================] - 0s 0s/step
[I 2024-09-27 20:17:42,832] Trial 150 finished with value: 0.013679578046540943 and parameters: {'window_size': 4, 'batch_size': 16, 'network_type': 'GRU', 'num_layers': 1, 'num_neurons': 64, 'learning_rate': 0.01, 'dropout_rate': 0.1}. Best is trial 117 with value: 0.013069600143948108.

1/2 [==============>...............] - ETA: 0s
2/2 [==============================] - 0s 0s/step
[I 2024-09-27 20:17:47,887] Trial 151 finished with value: 0.01376395008904594 and parameters: {'window_size': 6, 'batch_size': 16, 'network_type': 'GRU', 'num_layers': 1, 'num_neurons': 64, 'learning_rate': 0.01, 'dropout_rate': 0.1}. Best is trial 117 with value: 0.013069600143948108.

1/2 [==============>...............] - ETA: 0s
2/2 [==============================] - 0s 0s/step
[I 2024-09-27 20:17:52,134] Trial 152 finished with value: 0.01374018671853201 and parameters: {'window_size': 6, 'batch_size': 16, 'network_type': 'GRU', 'num_layers': 1, 'num_neurons': 64, 'learning_rate': 0.01, 'dropout_rate': 0.1}. Best is trial 117 with value: 0.013069600143948108.

1/2 [==============>...............] - ETA: 0s
2/2 [==============================] - 0s 0s/step
[I 2024-09-27 20:17:58,025] Trial 153 finished with value: 0.013064030824388772 and parameters: {'window_size': 6, 'batch_size': 16, 'network_type': 'GRU', 'num_layers': 1, 'num_neurons': 64, 'learning_rate': 0.01, 'dropout_rate': 0.1}. Best is trial 153 with value: 0.013064030824388772.

1/2 [==============>...............] - ETA: 0s
2/2 [==============================] - 0s 0s/step
[I 2024-09-27 20:18:02,816] Trial 154 finished with value: 0.013291958086831222 and parameters: {'window_size': 6, 'batch_size': 16, 'network_type': 'GRU', 'num_layers': 1, 'num_neurons': 64, 'learning_rate': 0.01, 'dropout_rate': 0.1}. Best is trial 153 with value: 0.013064030824388772.

1/2 [==============>...............] - ETA: 0s
2/2 [==============================] - 0s 16ms/step
[I 2024-09-27 20:18:07,765] Trial 155 finished with value: 0.013856952394757954 and parameters: {'window_size': 6, 'batch_size': 16, 'network_type': 'GRU', 'num_layers': 1, 'num_neurons': 64, 'learning_rate': 0.01, 'dropout_rate': 0.1}. Best is trial 153 with value: 0.013064030824388772.

1/2 [==============>...............] - ETA: 0s
2/2 [==============================] - 0s 8ms/step
[I 2024-09-27 20:18:16,234] Trial 156 finished with value: 0.01642135654176982 and parameters: {'window_size': 6, 'batch_size': 16, 'network_type': 'GRU', 'num_layers': 2, 'num_neurons': 64, 'learning_rate': 0.01, 'dropout_rate': 0.2}. Best is trial 153 with value: 0.013064030824388772.

1/2 [==============>...............] - ETA: 0s
2/2 [==============================] - 0s 16ms/step
[I 2024-09-27 20:18:21,255] Trial 157 finished with value: 0.013462993553706568 and parameters: {'window_size': 6, 'batch_size': 16, 'network_type': 'GRU', 'num_layers': 1, 'num_neurons': 64, 'learning_rate': 0.01, 'dropout_rate': 0.1}. Best is trial 153 with value: 0.013064030824388772.

1/2 [==============>...............] - ETA: 0s
2/2 [==============================] - 0s 0s/step
[I 2024-09-27 20:18:26,260] Trial 158 finished with value: 0.02122940699713572 and parameters: {'window_size': 6, 'batch_size': 64, 'network_type': 'GRU', 'num_layers': 1, 'num_neurons': 64, 'learning_rate': 0.01, 'dropout_rate': 0.1}. Best is trial 153 with value: 0.013064030824388772.

1/2 [==============>...............] - ETA: 0s
2/2 [==============================] - 0s 0s/step
[I 2024-09-27 20:18:31,802] Trial 159 finished with value: 0.015153070545196514 and parameters: {'window_size': 6, 'batch_size': 16, 'network_type': 'LSTM', 'num_layers': 1, 'num_neurons': 64, 'learning_rate': 0.01, 'dropout_rate': 0.1}. Best is trial 153 with value: 0.013064030824388772.

1/2 [==============>...............] - ETA: 0s
2/2 [==============================] - 0s 0s/step
[I 2024-09-27 20:18:36,050] Trial 160 finished with value: 0.013471216501508433 and parameters: {'window_size': 6, 'batch_size': 32, 'network_type': 'GRU', 'num_layers': 1, 'num_neurons': 64, 'learning_rate': 0.01, 'dropout_rate': 0.1}. Best is trial 153 with value: 0.013064030824388772.

1/2 [==============>...............] - ETA: 0s
2/2 [==============================] - 0s 0s/step
[I 2024-09-27 20:18:39,878] Trial 161 finished with value: 0.02074006579262871 and parameters: {'window_size': 6, 'batch_size': 32, 'network_type': 'GRU', 'num_layers': 1, 'num_neurons': 64, 'learning_rate': 0.01, 'dropout_rate': 0.1}. Best is trial 153 with value: 0.013064030824388772.

1/2 [==============>...............] - ETA: 0s
2/2 [==============================] - 0s 0s/step
[I 2024-09-27 20:18:43,805] Trial 162 finished with value: 0.01357749900817871 and parameters: {'window_size': 6, 'batch_size': 32, 'network_type': 'GRU', 'num_layers': 1, 'num_neurons': 64, 'learning_rate': 0.01, 'dropout_rate': 0.1}. Best is trial 153 with value: 0.013064030824388772.

1/2 [==============>...............] - ETA: 0s
2/2 [==============================] - 0s 23ms/step
[I 2024-09-27 20:18:49,296] Trial 163 finished with value: 0.025703315394265326 and parameters: {'window_size': 6, 'batch_size': 32, 'network_type': 'GRU', 'num_layers': 1, 'num_neurons': 16, 'learning_rate': 0.01, 'dropout_rate': 0.1}. Best is trial 153 with value: 0.013064030824388772.

1/2 [==============>...............] - ETA: 0s
2/2 [==============================] - 0s 0s/step
[I 2024-09-27 20:18:54,481] Trial 164 finished with value: 0.012752088696616034 and parameters: {'window_size': 6, 'batch_size': 32, 'network_type': 'GRU', 'num_layers': 1, 'num_neurons': 64, 'learning_rate': 0.01, 'dropout_rate': 0.1}. Best is trial 164 with value: 0.012752088696616034.

1/2 [==============>...............] - ETA: 0s
2/2 [==============================] - 0s 16ms/step
[I 2024-09-27 20:18:58,194] Trial 165 finished with value: 0.013218798868996748 and parameters: {'window_size': 6, 'batch_size': 32, 'network_type': 'GRU', 'num_layers': 1, 'num_neurons': 64, 'learning_rate': 0.01, 'dropout_rate': 0.1}. Best is trial 164 with value: 0.012752088696616034.

1/2 [==============>...............] - ETA: 0s
2/2 [==============================] - 0s 16ms/step
[I 2024-09-27 20:19:02,169] Trial 166 finished with value: 0.013702978270394465 and parameters: {'window_size': 6, 'batch_size': 32, 'network_type': 'GRU', 'num_layers': 1, 'num_neurons': 64, 'learning_rate': 0.01, 'dropout_rate': 0.1}. Best is trial 164 with value: 0.012752088696616034.

1/2 [==============>...............] - ETA: 0s
2/2 [==============================] - 0s 8ms/step
[I 2024-09-27 20:19:05,531] Trial 167 finished with value: 0.013964255414690267 and parameters: {'window_size': 6, 'batch_size': 32, 'network_type': 'RNN', 'num_layers': 1, 'num_neurons': 64, 'learning_rate': 0.01, 'dropout_rate': 0.1}. Best is trial 164 with value: 0.012752088696616034.

1/2 [==============>...............] - ETA: 0s
2/2 [==============================] - 1s 19ms/step
[I 2024-09-27 20:19:13,268] Trial 168 finished with value: 0.026666486236027284 and parameters: {'window_size': 6, 'batch_size': 32, 'network_type': 'GRU', 'num_layers': 2, 'num_neurons': 64, 'learning_rate': 0.01, 'dropout_rate': 0.1}. Best is trial 164 with value: 0.012752088696616034.

1/2 [==============>...............] - ETA: 0s
2/2 [==============================] - 0s 0s/step
[I 2024-09-27 20:19:18,744] Trial 169 finished with value: 0.013266800855978934 and parameters: {'window_size': 2, 'batch_size': 32, 'network_type': 'GRU', 'num_layers': 1, 'num_neurons': 64, 'learning_rate': 0.01, 'dropout_rate': 0.1}. Best is trial 164 with value: 0.012752088696616034.

1/2 [==============>...............] - ETA: 0s
2/2 [==============================] - 0s 7ms/step
[I 2024-09-27 20:19:23,958] Trial 170 finished with value: 0.013168407660264229 and parameters: {'window_size': 2, 'batch_size': 32, 'network_type': 'GRU', 'num_layers': 1, 'num_neurons': 64, 'learning_rate': 0.01, 'dropout_rate': 0.1}. Best is trial 164 with value: 0.012752088696616034.

1/2 [==============>...............] - ETA: 0s
2/2 [==============================] - 0s 16ms/step
[I 2024-09-27 20:19:28,788] Trial 171 finished with value: 0.013466568714533092 and parameters: {'window_size': 2, 'batch_size': 32, 'network_type': 'GRU', 'num_layers': 1, 'num_neurons': 64, 'learning_rate': 0.01, 'dropout_rate': 0.1}. Best is trial 164 with value: 0.012752088696616034.

1/2 [==============>...............] - ETA: 0s
2/2 [==============================] - 0s 16ms/step
[I 2024-09-27 20:19:33,165] Trial 172 finished with value: 0.01354115900626549 and parameters: {'window_size': 2, 'batch_size': 32, 'network_type': 'GRU', 'num_layers': 1, 'num_neurons': 64, 'learning_rate': 0.01, 'dropout_rate': 0.1}. Best is trial 164 with value: 0.012752088696616034.

1/2 [==============>...............] - ETA: 0s
2/2 [==============================] - 0s 0s/step
[I 2024-09-27 20:19:39,354] Trial 173 finished with value: 0.01302354806508773 and parameters: {'window_size': 2, 'batch_size': 32, 'network_type': 'GRU', 'num_layers': 1, 'num_neurons': 64, 'learning_rate': 0.01, 'dropout_rate': 0.1}. Best is trial 164 with value: 0.012752088696616034.

1/2 [==============>...............] - ETA: 0s
2/2 [==============================] - 0s 0s/step
[I 2024-09-27 20:19:44,896] Trial 174 finished with value: 0.015520179381737323 and parameters: {'window_size': 2, 'batch_size': 32, 'network_type': 'GRU', 'num_layers': 1, 'num_neurons': 64, 'learning_rate': 0.01, 'dropout_rate': 0.1}. Best is trial 164 with value: 0.012752088696616034.

1/2 [==============>...............] - ETA: 0s
2/2 [==============================] - 0s 0s/step
[I 2024-09-27 20:19:50,263] Trial 175 finished with value: 0.013117266398209787 and parameters: {'window_size': 2, 'batch_size': 32, 'network_type': 'GRU', 'num_layers': 1, 'num_neurons': 64, 'learning_rate': 0.01, 'dropout_rate': 0.1}. Best is trial 164 with value: 0.012752088696616034.

1/2 [==============>...............] - ETA: 0s
2/2 [==============================] - 0s 0s/step
[I 2024-09-27 20:19:55,389] Trial 176 finished with value: 0.013768547412676678 and parameters: {'window_size': 2, 'batch_size': 32, 'network_type': 'GRU', 'num_layers': 1, 'num_neurons': 64, 'learning_rate': 0.01, 'dropout_rate': 0.1}. Best is trial 164 with value: 0.012752088696616034.

1/2 [==============>...............] - ETA: 0s
2/2 [==============================] - 0s 0s/step
[I 2024-09-27 20:19:59,288] Trial 177 finished with value: 0.013550489168900698 and parameters: {'window_size': 2, 'batch_size': 32, 'network_type': 'GRU', 'num_layers': 1, 'num_neurons': 64, 'learning_rate': 0.01, 'dropout_rate': 0.1}. Best is trial 164 with value: 0.012752088696616034.

1/2 [==============>...............] - ETA: 0s
2/2 [==============================] - 0s 0s/step
[I 2024-09-27 20:20:04,227] Trial 178 finished with value: 0.016559230474325306 and parameters: {'window_size': 2, 'batch_size': 32, 'network_type': 'LSTM', 'num_layers': 1, 'num_neurons': 64, 'learning_rate': 0.01, 'dropout_rate': 0.1}. Best is trial 164 with value: 0.012752088696616034.

1/2 [==============>...............] - ETA: 0s
2/2 [==============================] - 0s 16ms/step
[I 2024-09-27 20:20:09,811] Trial 179 finished with value: 0.0159424145649641 and parameters: {'window_size': 2, 'batch_size': 32, 'network_type': 'GRU', 'num_layers': 2, 'num_neurons': 64, 'learning_rate': 0.01, 'dropout_rate': 0.1}. Best is trial 164 with value: 0.012752088696616034.

1/2 [==============>...............] - ETA: 0s
2/2 [==============================] - 1s 18ms/step
[I 2024-09-27 20:20:22,359] Trial 180 finished with value: 0.018209658158131144 and parameters: {'window_size': 2, 'batch_size': 32, 'network_type': 'GRU', 'num_layers': 3, 'num_neurons': 64, 'learning_rate': 0.01, 'dropout_rate': 0.1}. Best is trial 164 with value: 0.012752088696616034.

1/2 [==============>...............] - ETA: 0s
2/2 [==============================] - 0s 0s/step
[I 2024-09-27 20:20:27,562] Trial 181 finished with value: 0.015789194278227957 and parameters: {'window_size': 2, 'batch_size': 32, 'network_type': 'GRU', 'num_layers': 1, 'num_neurons': 64, 'learning_rate': 0.01, 'dropout_rate': 0.1}. Best is trial 164 with value: 0.012752088696616034.

1/2 [==============>...............] - ETA: 0s
2/2 [==============================] - 0s 8ms/step
[I 2024-09-27 20:20:32,328] Trial 182 finished with value: 0.015834532749958507 and parameters: {'window_size': 2, 'batch_size': 32, 'network_type': 'GRU', 'num_layers': 1, 'num_neurons': 64, 'learning_rate': 0.01, 'dropout_rate': 0.1}. Best is trial 164 with value: 0.012752088696616034.

1/2 [==============>...............] - ETA: 0s
2/2 [==============================] - 0s 0s/step
[I 2024-09-27 20:20:35,901] Trial 183 finished with value: 0.014489749859540867 and parameters: {'window_size': 2, 'batch_size': 32, 'network_type': 'GRU', 'num_layers': 1, 'num_neurons': 64, 'learning_rate': 0.01, 'dropout_rate': 0.1}. Best is trial 164 with value: 0.012752088696616034.

1/2 [==============>...............] - ETA: 0s
2/2 [==============================] - 0s 0s/step
[I 2024-09-27 20:20:40,763] Trial 184 finished with value: 0.013252811945401701 and parameters: {'window_size': 2, 'batch_size': 32, 'network_type': 'GRU', 'num_layers': 1, 'num_neurons': 64, 'learning_rate': 0.01, 'dropout_rate': 0.1}. Best is trial 164 with value: 0.012752088696616034.

1/2 [==============>...............] - ETA: 0s
2/2 [==============================] - 0s 0s/step
[I 2024-09-27 20:20:45,098] Trial 185 finished with value: 0.01449030515475149 and parameters: {'window_size': 2, 'batch_size': 32, 'network_type': 'GRU', 'num_layers': 1, 'num_neurons': 64, 'learning_rate': 0.01, 'dropout_rate': 0.1}. Best is trial 164 with value: 0.012752088696616034.

1/2 [==============>...............] - ETA: 0s
2/2 [==============================] - 0s 16ms/step
[I 2024-09-27 20:20:50,000] Trial 186 finished with value: 0.013879078877277852 and parameters: {'window_size': 2, 'batch_size': 32, 'network_type': 'GRU', 'num_layers': 1, 'num_neurons': 64, 'learning_rate': 0.01, 'dropout_rate': 0.1}. Best is trial 164 with value: 0.012752088696616034.

1/2 [==============>...............] - ETA: 0s
2/2 [==============================] - 0s 0s/step
[I 2024-09-27 20:21:00,622] Trial 187 finished with value: 0.029269085871867634 and parameters: {'window_size': 2, 'batch_size': 32, 'network_type': 'GRU', 'num_layers': 1, 'num_neurons': 64, 'learning_rate': 0.0001, 'dropout_rate': 0.1}. Best is trial 164 with value: 0.012752088696616034.

1/2 [==============>...............] - ETA: 0s
2/2 [==============================] - 0s 0s/step
[I 2024-09-27 20:21:04,873] Trial 188 finished with value: 0.01367506440480549 and parameters: {'window_size': 2, 'batch_size': 32, 'network_type': 'GRU', 'num_layers': 1, 'num_neurons': 64, 'learning_rate': 0.01, 'dropout_rate': 0.1}. Best is trial 164 with value: 0.012752088696616034.

1/2 [==============>...............] - ETA: 0s
2/2 [==============================] - 0s 0s/step
[I 2024-09-27 20:21:12,088] Trial 189 finished with value: 0.013937501675043346 and parameters: {'window_size': 2, 'batch_size': 32, 'network_type': 'LSTM', 'num_layers': 1, 'num_neurons': 64, 'learning_rate': 0.01, 'dropout_rate': 0.1}. Best is trial 164 with value: 0.012752088696616034.

1/2 [==============>...............] - ETA: 0s
2/2 [==============================] - 0s 0s/step
[I 2024-09-27 20:21:23,417] Trial 190 finished with value: 0.014058738488417388 and parameters: {'window_size': 2, 'batch_size': 32, 'network_type': 'GRU', 'num_layers': 1, 'num_neurons': 64, 'learning_rate': 0.01, 'dropout_rate': 0.1}. Best is trial 164 with value: 0.012752088696616034.

1/2 [==============>...............] - ETA: 0s
2/2 [==============================] - 0s 0s/step
[I 2024-09-27 20:21:29,336] Trial 191 finished with value: 0.013494738664382536 and parameters: {'window_size': 2, 'batch_size': 32, 'network_type': 'GRU', 'num_layers': 1, 'num_neurons': 64, 'learning_rate': 0.01, 'dropout_rate': 0.1}. Best is trial 164 with value: 0.012752088696616034.

1/2 [==============>...............] - ETA: 0s
2/2 [==============================] - 0s 0s/step
[I 2024-09-27 20:21:35,343] Trial 192 finished with value: 0.013583529215592605 and parameters: {'window_size': 2, 'batch_size': 32, 'network_type': 'GRU', 'num_layers': 1, 'num_neurons': 64, 'learning_rate': 0.01, 'dropout_rate': 0.1}. Best is trial 164 with value: 0.012752088696616034.

1/2 [==============>...............] - ETA: 0s
2/2 [==============================] - 0s 0s/step
[I 2024-09-27 20:21:40,847] Trial 193 finished with value: 0.01511952784122566 and parameters: {'window_size': 2, 'batch_size': 32, 'network_type': 'GRU', 'num_layers': 1, 'num_neurons': 64, 'learning_rate': 0.01, 'dropout_rate': 0.1}. Best is trial 164 with value: 0.012752088696616034.

1/2 [==============>...............] - ETA: 0s
2/2 [==============================] - 0s 0s/step
[I 2024-09-27 20:21:46,516] Trial 194 finished with value: 0.013136782047076098 and parameters: {'window_size': 2, 'batch_size': 32, 'network_type': 'GRU', 'num_layers': 1, 'num_neurons': 64, 'learning_rate': 0.01, 'dropout_rate': 0.1}. Best is trial 164 with value: 0.012752088696616034.

1/2 [==============>...............] - ETA: 0s
2/2 [==============================] - 0s 0s/step
[I 2024-09-27 20:21:50,765] Trial 195 finished with value: 0.013307448008121585 and parameters: {'window_size': 2, 'batch_size': 32, 'network_type': 'GRU', 'num_layers': 1, 'num_neurons': 64, 'learning_rate': 0.01, 'dropout_rate': 0.1}. Best is trial 164 with value: 0.012752088696616034.

1/2 [==============>...............] - ETA: 0s
2/2 [==============================] - 0s 0s/step
[I 2024-09-27 20:21:55,690] Trial 196 finished with value: 0.013038687608180898 and parameters: {'window_size': 2, 'batch_size': 32, 'network_type': 'GRU', 'num_layers': 1, 'num_neurons': 64, 'learning_rate': 0.01, 'dropout_rate': 0.1}. Best is trial 164 with value: 0.012752088696616034.

1/2 [==============>...............] - ETA: 0s
2/2 [==============================] - 0s 0s/step
[I 2024-09-27 20:21:59,836] Trial 197 finished with value: 0.01317999387398744 and parameters: {'window_size': 2, 'batch_size': 32, 'network_type': 'GRU', 'num_layers': 1, 'num_neurons': 64, 'learning_rate': 0.01, 'dropout_rate': 0.1}. Best is trial 164 with value: 0.012752088696616034.

1/2 [==============>...............] - ETA: 0s
2/2 [==============================] - 0s 0s/step
[I 2024-09-27 20:22:05,091] Trial 198 finished with value: 0.014005022440201183 and parameters: {'window_size': 2, 'batch_size': 32, 'network_type': 'GRU', 'num_layers': 1, 'num_neurons': 64, 'learning_rate': 0.01, 'dropout_rate': 0.1}. Best is trial 164 with value: 0.012752088696616034.

1/2 [==============>...............] - ETA: 0s
2/2 [==============================] - 0s 0s/step
[I 2024-09-27 20:22:09,687] Trial 199 finished with value: 0.01358036302908872 and parameters: {'window_size': 2, 'batch_size': 32, 'network_type': 'GRU', 'num_layers': 1, 'num_neurons': 64, 'learning_rate': 0.01, 'dropout_rate': 0.1}. Best is trial 164 with value: 0.012752088696616034.
C:\Users\user\AppData\Local\pypoetry\Cache\virtualenvs\transfer-learning-c0qmjA8b-py3.9\lib\site-packages\keras\src\engine\training.py:3103: UserWarning: You are saving your model as an HDF5 file via `model.save()`. This file format is considered legacy. We recommend using instead the native Keras format, e.g. `model.save('my_model.keras')`.
  saving_api.save_model(
Best parameters: {'window_size': 6, 'batch_size': 32, 'network_type': 'GRU', 'num_layers': 1, 'num_neurons': 64, 'learning_rate': 0.01, 'dropout_rate': 0.1}

1/2 [==============>...............] - ETA: 0s
2/2 [==============================] - 0s 0s/step
[I 2024-09-27 20:22:15,472] A new study created in memory with name: no-name-ee022cb1-a033-4cc2-b8c9-c4270d847120

1/2 [==============>...............] - ETA: 0s
2/2 [==============================] - 0s 0s/step
[I 2024-09-27 20:22:26,555] Trial 0 finished with value: 0.09513433958590033 and parameters: {'window_size': 6, 'batch_size': 32, 'network_type': 'LSTM', 'num_layers': 1, 'num_neurons': 16, 'learning_rate': 0.0001, 'dropout_rate': 0.3}. Best is trial 0 with value: 0.09513433958590033.

1/2 [==============>...............] - ETA: 0s
2/2 [==============================] - 0s 8ms/step
[I 2024-09-27 20:22:32,345] Trial 1 finished with value: 0.012515967407226568 and parameters: {'window_size': 4, 'batch_size': 16, 'network_type': 'GRU', 'num_layers': 1, 'num_neurons': 64, 'learning_rate': 0.01, 'dropout_rate': 0.2}. Best is trial 1 with value: 0.012515967407226568.

1/2 [==============>...............] - ETA: 0s
2/2 [==============================] - 1s 0s/step
[I 2024-09-27 20:22:46,475] Trial 2 finished with value: 0.013578198637962344 and parameters: {'window_size': 4, 'batch_size': 64, 'network_type': 'LSTM', 'num_layers': 3, 'num_neurons': 16, 'learning_rate': 0.01, 'dropout_rate': 0.1}. Best is trial 1 with value: 0.012515967407226568.

1/2 [==============>...............] - ETA: 0s
2/2 [==============================] - 0s 16ms/step
