[I 2024-09-27 22:31:47,377] Trial 8 finished with value: 0.31360947895050045 and parameters: {'window_size': 2, 'batch_size': 64, 'network_type': 'RNN', 'num_layers': 2, 'num_neurons': 128, 'learning_rate': 0.0001, 'dropout_rate': 0.3}. Best is trial 2 with value: 0.19470797416142055.

1/1 [==============================] - ETA: 0s
1/1 [==============================] - 0s 218ms/step
[I 2024-09-27 22:31:50,302] Trial 9 finished with value: 0.2671702146028217 and parameters: {'window_size': 4, 'batch_size': 64, 'network_type': 'GRU', 'num_layers': 1, 'num_neurons': 16, 'learning_rate': 0.01, 'dropout_rate': 0.2}. Best is trial 2 with value: 0.19470797416142055.

1/1 [==============================] - ETA: 0s
1/1 [==============================] - 0s 291ms/step
[I 2024-09-27 22:31:53,861] Trial 10 finished with value: 0.17874676767985026 and parameters: {'window_size': 2, 'batch_size': 32, 'network_type': 'RNN', 'num_layers': 2, 'num_neurons': 32, 'learning_rate': 0.01, 'dropout_rate': 0.1}. Best is trial 10 with value: 0.17874676767985026.

1/1 [==============================] - ETA: 0s
1/1 [==============================] - 0s 331ms/step
[I 2024-09-27 22:32:00,365] Trial 11 finished with value: 0.1722767881665911 and parameters: {'window_size': 2, 'batch_size': 32, 'network_type': 'RNN', 'num_layers': 2, 'num_neurons': 32, 'learning_rate': 0.01, 'dropout_rate': 0.1}. Best is trial 11 with value: 0.1722767881665911.

1/1 [==============================] - ETA: 0s
1/1 [==============================] - 0s 448ms/step
[I 2024-09-27 22:36:35,682] Trial 12 finished with value: 0.18970311391921268 and parameters: {'window_size': 2, 'batch_size': 32, 'network_type': 'RNN', 'num_layers': 2, 'num_neurons': 32, 'learning_rate': 0.01, 'dropout_rate': 0.1}. Best is trial 11 with value: 0.1722767881665911.

1/1 [==============================] - ETA: 0s
1/1 [==============================] - 1s 501ms/step
[I 2024-09-27 22:36:42,373] Trial 13 finished with value: 0.1791113742192586 and parameters: {'window_size': 2, 'batch_size': 32, 'network_type': 'RNN', 'num_layers': 2, 'num_neurons': 32, 'learning_rate': 0.01, 'dropout_rate': 0.1}. Best is trial 11 with value: 0.1722767881665911.

1/1 [==============================] - ETA: 0s
1/1 [==============================] - 0s 416ms/step
[I 2024-09-27 22:36:49,697] Trial 14 finished with value: 0.17429101235525948 and parameters: {'window_size': 2, 'batch_size': 32, 'network_type': 'RNN', 'num_layers': 2, 'num_neurons': 32, 'learning_rate': 0.01, 'dropout_rate': 0.1}. Best is trial 11 with value: 0.1722767881665911.

1/1 [==============================] - ETA: 0s
1/1 [==============================] - 0s 432ms/step
[I 2024-09-27 22:36:57,112] Trial 15 finished with value: 0.16347541264125276 and parameters: {'window_size': 2, 'batch_size': 32, 'network_type': 'RNN', 'num_layers': 2, 'num_neurons': 32, 'learning_rate': 0.01, 'dropout_rate': 0.1}. Best is trial 15 with value: 0.16347541264125276.

1/1 [==============================] - ETA: 0s
1/1 [==============================] - 1s 649ms/step
[I 2024-09-27 22:37:04,731] Trial 16 finished with value: 0.20608118979136147 and parameters: {'window_size': 2, 'batch_size': 32, 'network_type': 'RNN', 'num_layers': 3, 'num_neurons': 32, 'learning_rate': 0.01, 'dropout_rate': 0.1}. Best is trial 15 with value: 0.16347541264125276.

1/1 [==============================] - ETA: 0s
1/1 [==============================] - 0s 416ms/step
[I 2024-09-27 22:37:10,057] Trial 17 finished with value: 0.23308843353816433 and parameters: {'window_size': 2, 'batch_size': 32, 'network_type': 'RNN', 'num_layers': 2, 'num_neurons': 32, 'learning_rate': 0.01, 'dropout_rate': 0.1}. Best is trial 15 with value: 0.16347541264125276.

1/1 [==============================] - ETA: 0s
1/1 [==============================] - 0s 492ms/step
[I 2024-09-27 22:37:17,215] Trial 18 finished with value: 0.29211340743617 and parameters: {'window_size': 4, 'batch_size': 32, 'network_type': 'GRU', 'num_layers': 2, 'num_neurons': 32, 'learning_rate': 0.01, 'dropout_rate': 0.1}. Best is trial 15 with value: 0.16347541264125276.

1/1 [==============================] - ETA: 0s
1/1 [==============================] - 1s 702ms/step
[I 2024-09-27 22:37:29,332] Trial 19 finished with value: 0.35025479815987975 and parameters: {'window_size': 6, 'batch_size': 32, 'network_type': 'LSTM', 'num_layers': 3, 'num_neurons': 16, 'learning_rate': 0.01, 'dropout_rate': 0.1}. Best is trial 15 with value: 0.16347541264125276.

1/1 [==============================] - ETA: 0s
1/1 [==============================] - 0s 365ms/step
[I 2024-09-27 22:37:35,521] Trial 20 finished with value: 0.17435586588723315 and parameters: {'window_size': 2, 'batch_size': 32, 'network_type': 'RNN', 'num_layers': 2, 'num_neurons': 32, 'learning_rate': 0.01, 'dropout_rate': 0.1}. Best is trial 15 with value: 0.16347541264125276.

1/1 [==============================] - ETA: 0s
1/1 [==============================] - 0s 416ms/step
[I 2024-09-27 22:37:41,264] Trial 21 finished with value: 0.1719947162809826 and parameters: {'window_size': 2, 'batch_size': 32, 'network_type': 'RNN', 'num_layers': 2, 'num_neurons': 32, 'learning_rate': 0.01, 'dropout_rate': 0.1}. Best is trial 15 with value: 0.16347541264125276.

1/1 [==============================] - ETA: 0s
1/1 [==============================] - 0s 363ms/step
[I 2024-09-27 22:37:46,152] Trial 22 finished with value: 0.19609998952774774 and parameters: {'window_size': 2, 'batch_size': 32, 'network_type': 'RNN', 'num_layers': 2, 'num_neurons': 32, 'learning_rate': 0.01, 'dropout_rate': 0.1}. Best is trial 15 with value: 0.16347541264125276.

1/1 [==============================] - ETA: 0s
1/1 [==============================] - 0s 363ms/step
[I 2024-09-27 22:37:51,417] Trial 23 finished with value: 0.19438292557852604 and parameters: {'window_size': 2, 'batch_size': 32, 'network_type': 'RNN', 'num_layers': 2, 'num_neurons': 32, 'learning_rate': 0.01, 'dropout_rate': 0.1}. Best is trial 15 with value: 0.16347541264125276.

1/1 [==============================] - ETA: 0s
1/1 [==============================] - 0s 455ms/step
[I 2024-09-27 22:37:56,461] Trial 24 finished with value: 0.1995519290197463 and parameters: {'window_size': 2, 'batch_size': 32, 'network_type': 'RNN', 'num_layers': 2, 'num_neurons': 32, 'learning_rate': 0.01, 'dropout_rate': 0.1}. Best is trial 15 with value: 0.16347541264125276.

1/1 [==============================] - ETA: 0s
1/1 [==============================] - 0s 379ms/step
[I 2024-09-27 22:38:02,996] Trial 25 finished with value: 0.20052889819372266 and parameters: {'window_size': 2, 'batch_size': 32, 'network_type': 'RNN', 'num_layers': 2, 'num_neurons': 32, 'learning_rate': 0.01, 'dropout_rate': 0.1}. Best is trial 15 with value: 0.16347541264125276.

1/1 [==============================] - ETA: 0s
1/1 [==============================] - 0s 377ms/step
[I 2024-09-27 22:38:07,944] Trial 26 finished with value: 0.26890828791118804 and parameters: {'window_size': 2, 'batch_size': 32, 'network_type': 'RNN', 'num_layers': 2, 'num_neurons': 32, 'learning_rate': 0.01, 'dropout_rate': 0.1}. Best is trial 15 with value: 0.16347541264125276.

1/1 [==============================] - ETA: 0s
1/1 [==============================] - 0s 396ms/step
[I 2024-09-27 22:38:12,894] Trial 27 finished with value: 0.18650683670952206 and parameters: {'window_size': 2, 'batch_size': 32, 'network_type': 'RNN', 'num_layers': 2, 'num_neurons': 16, 'learning_rate': 0.01, 'dropout_rate': 0.1}. Best is trial 15 with value: 0.16347541264125276.

1/1 [==============================] - ETA: 0s
1/1 [==============================] - 0s 269ms/step
[I 2024-09-27 22:38:17,146] Trial 28 finished with value: 0.22550883022107576 and parameters: {'window_size': 4, 'batch_size': 16, 'network_type': 'GRU', 'num_layers': 1, 'num_neurons': 64, 'learning_rate': 0.01, 'dropout_rate': 0.1}. Best is trial 15 with value: 0.16347541264125276.

1/1 [==============================] - ETA: 0s
1/1 [==============================] - 1s 693ms/step
[I 2024-09-27 22:38:26,004] Trial 29 finished with value: 0.3840213904100306 and parameters: {'window_size': 6, 'batch_size': 32, 'network_type': 'LSTM', 'num_layers': 3, 'num_neurons': 128, 'learning_rate': 0.01, 'dropout_rate': 0.3}. Best is trial 15 with value: 0.16347541264125276.

1/1 [==============================] - ETA: 0s
1/1 [==============================] - 0s 216ms/step
[I 2024-09-27 22:38:29,105] Trial 30 finished with value: 0.20883687792326272 and parameters: {'window_size': 4, 'batch_size': 16, 'network_type': 'RNN', 'num_layers': 1, 'num_neurons': 32, 'learning_rate': 0.01, 'dropout_rate': 0.2}. Best is trial 15 with value: 0.16347541264125276.

1/1 [==============================] - ETA: 0s
1/1 [==============================] - 0s 463ms/step
[I 2024-09-27 22:38:34,691] Trial 31 finished with value: 0.18566556340172174 and parameters: {'window_size': 2, 'batch_size': 32, 'network_type': 'RNN', 'num_layers': 2, 'num_neurons': 32, 'learning_rate': 0.01, 'dropout_rate': 0.1}. Best is trial 15 with value: 0.16347541264125276.

1/1 [==============================] - ETA: 0s
1/1 [==============================] - 0s 477ms/step
[I 2024-09-27 22:38:40,449] Trial 32 finished with value: 0.1735099710736956 and parameters: {'window_size': 2, 'batch_size': 32, 'network_type': 'RNN', 'num_layers': 2, 'num_neurons': 32, 'learning_rate': 0.01, 'dropout_rate': 0.1}. Best is trial 15 with value: 0.16347541264125276.

1/1 [==============================] - ETA: 0s
1/1 [==============================] - 0s 327ms/step
[I 2024-09-27 22:38:45,570] Trial 33 finished with value: 0.2189093638828822 and parameters: {'window_size': 2, 'batch_size': 32, 'network_type': 'RNN', 'num_layers': 2, 'num_neurons': 32, 'learning_rate': 0.01, 'dropout_rate': 0.1}. Best is trial 15 with value: 0.16347541264125276.

1/1 [==============================] - ETA: 0s
1/1 [==============================] - 0s 336ms/step
[I 2024-09-27 22:38:49,946] Trial 34 finished with value: 0.26746911630176357 and parameters: {'window_size': 2, 'batch_size': 32, 'network_type': 'RNN', 'num_layers': 2, 'num_neurons': 32, 'learning_rate': 0.01, 'dropout_rate': 0.1}. Best is trial 15 with value: 0.16347541264125276.

1/1 [==============================] - ETA: 0s
1/1 [==============================] - 0s 417ms/step
[I 2024-09-27 22:38:56,195] Trial 35 finished with value: 0.2022274262110392 and parameters: {'window_size': 2, 'batch_size': 32, 'network_type': 'LSTM', 'num_layers': 2, 'num_neurons': 32, 'learning_rate': 0.01, 'dropout_rate': 0.1}. Best is trial 15 with value: 0.16347541264125276.

1/1 [==============================] - ETA: 0s
1/1 [==============================] - 0s 354ms/step
[I 2024-09-27 22:39:01,270] Trial 36 finished with value: 0.23903685794157134 and parameters: {'window_size': 6, 'batch_size': 64, 'network_type': 'RNN', 'num_layers': 2, 'num_neurons': 64, 'learning_rate': 0.01, 'dropout_rate': 0.2}. Best is trial 15 with value: 0.16347541264125276.

1/1 [==============================] - ETA: 0s
1/1 [==============================] - 0s 454ms/step
[I 2024-09-27 22:39:06,967] Trial 37 finished with value: 0.2185424583980015 and parameters: {'window_size': 2, 'batch_size': 16, 'network_type': 'RNN', 'num_layers': 2, 'num_neurons': 128, 'learning_rate': 0.01, 'dropout_rate': 0.3}. Best is trial 15 with value: 0.16347541264125276.

1/1 [==============================] - ETA: 0s
1/1 [==============================] - 1s 655ms/step
[I 2024-09-27 22:39:15,941] Trial 38 finished with value: 0.31436581502641947 and parameters: {'window_size': 2, 'batch_size': 32, 'network_type': 'GRU', 'num_layers': 3, 'num_neurons': 32, 'learning_rate': 0.01, 'dropout_rate': 0.1}. Best is trial 15 with value: 0.16347541264125276.

1/1 [==============================] - ETA: 0s
1/1 [==============================] - 0s 232ms/step
[I 2024-09-27 22:39:19,342] Trial 39 finished with value: 0.2983357433137439 and parameters: {'window_size': 2, 'batch_size': 64, 'network_type': 'LSTM', 'num_layers': 1, 'num_neurons': 64, 'learning_rate': 0.01, 'dropout_rate': 0.3}. Best is trial 15 with value: 0.16347541264125276.

1/1 [==============================] - ETA: 0s
1/1 [==============================] - 0s 338ms/step
[I 2024-09-27 22:39:24,007] Trial 40 finished with value: 0.26016488748438216 and parameters: {'window_size': 6, 'batch_size': 16, 'network_type': 'RNN', 'num_layers': 2, 'num_neurons': 16, 'learning_rate': 0.01, 'dropout_rate': 0.2}. Best is trial 15 with value: 0.16347541264125276.

1/1 [==============================] - ETA: 0s
1/1 [==============================] - 0s 364ms/step
[I 2024-09-27 22:39:28,481] Trial 41 finished with value: 0.19981752867925734 and parameters: {'window_size': 2, 'batch_size': 32, 'network_type': 'RNN', 'num_layers': 2, 'num_neurons': 32, 'learning_rate': 0.01, 'dropout_rate': 0.1}. Best is trial 15 with value: 0.16347541264125276.

1/1 [==============================] - ETA: 0s
1/1 [==============================] - 1s 532ms/step
[I 2024-09-27 22:39:33,172] Trial 42 finished with value: 0.18507796673547652 and parameters: {'window_size': 2, 'batch_size': 32, 'network_type': 'RNN', 'num_layers': 2, 'num_neurons': 32, 'learning_rate': 0.01, 'dropout_rate': 0.1}. Best is trial 15 with value: 0.16347541264125276.

1/1 [==============================] - ETA: 0s
1/1 [==============================] - 0s 369ms/step
[I 2024-09-27 22:39:37,534] Trial 43 finished with value: 0.18428475357237314 and parameters: {'window_size': 2, 'batch_size': 32, 'network_type': 'RNN', 'num_layers': 2, 'num_neurons': 32, 'learning_rate': 0.01, 'dropout_rate': 0.1}. Best is trial 15 with value: 0.16347541264125276.

1/1 [==============================] - ETA: 0s
1/1 [==============================] - 0s 454ms/step
[I 2024-09-27 22:39:42,645] Trial 44 finished with value: 0.19794035362061999 and parameters: {'window_size': 2, 'batch_size': 32, 'network_type': 'RNN', 'num_layers': 2, 'num_neurons': 128, 'learning_rate': 0.01, 'dropout_rate': 0.1}. Best is trial 15 with value: 0.16347541264125276.

1/1 [==============================] - ETA: 0s
1/1 [==============================] - 0s 338ms/step
[I 2024-09-27 22:39:47,672] Trial 45 finished with value: 0.19891086362537583 and parameters: {'window_size': 4, 'batch_size': 32, 'network_type': 'RNN', 'num_layers': 2, 'num_neurons': 32, 'learning_rate': 0.01, 'dropout_rate': 0.1}. Best is trial 15 with value: 0.16347541264125276.

1/1 [==============================] - ETA: 0s
1/1 [==============================] - 0s 316ms/step
[I 2024-09-27 22:39:52,397] Trial 46 finished with value: 0.21114432412102108 and parameters: {'window_size': 2, 'batch_size': 64, 'network_type': 'RNN', 'num_layers': 2, 'num_neurons': 32, 'learning_rate': 0.01, 'dropout_rate': 0.1}. Best is trial 15 with value: 0.16347541264125276.

1/1 [==============================] - ETA: 0s
1/1 [==============================] - 0s 231ms/step
[I 2024-09-27 22:39:55,922] Trial 47 finished with value: 0.29815892187754306 and parameters: {'window_size': 2, 'batch_size': 32, 'network_type': 'GRU', 'num_layers': 1, 'num_neurons': 32, 'learning_rate': 0.01, 'dropout_rate': 0.3}. Best is trial 15 with value: 0.16347541264125276.

1/1 [==============================] - ETA: 0s
1/1 [==============================] - 1s 501ms/step
[I 2024-09-27 22:40:02,116] Trial 48 finished with value: 0.19133499526977538 and parameters: {'window_size': 2, 'batch_size': 32, 'network_type': 'RNN', 'num_layers': 3, 'num_neurons': 32, 'learning_rate': 0.01, 'dropout_rate': 0.1}. Best is trial 15 with value: 0.16347541264125276.

1/1 [==============================] - ETA: 0s
1/1 [==============================] - 0s 431ms/step
[I 2024-09-27 22:40:06,708] Trial 49 finished with value: 0.22770209916432693 and parameters: {'window_size': 2, 'batch_size': 32, 'network_type': 'RNN', 'num_layers': 2, 'num_neurons': 16, 'learning_rate': 0.01, 'dropout_rate': 0.2}. Best is trial 15 with value: 0.16347541264125276.

1/1 [==============================] - ETA: 0s
1/1 [==============================] - 0s 385ms/step
[I 2024-09-27 22:40:12,003] Trial 50 finished with value: 0.3318656330108642 and parameters: {'window_size': 4, 'batch_size': 32, 'network_type': 'LSTM', 'num_layers': 2, 'num_neurons': 32, 'learning_rate': 0.01, 'dropout_rate': 0.1}. Best is trial 15 with value: 0.16347541264125276.

1/1 [==============================] - ETA: 0s
1/1 [==============================] - 0s 432ms/step
[I 2024-09-27 22:40:16,474] Trial 51 finished with value: 0.20121978414626346 and parameters: {'window_size': 2, 'batch_size': 32, 'network_type': 'RNN', 'num_layers': 2, 'num_neurons': 32, 'learning_rate': 0.01, 'dropout_rate': 0.1}. Best is trial 15 with value: 0.16347541264125276.

1/1 [==============================] - ETA: 0s
1/1 [==============================] - 0s 303ms/step
[I 2024-09-27 22:40:21,554] Trial 52 finished with value: 0.18949514679681687 and parameters: {'window_size': 2, 'batch_size': 32, 'network_type': 'RNN', 'num_layers': 2, 'num_neurons': 32, 'learning_rate': 0.01, 'dropout_rate': 0.1}. Best is trial 15 with value: 0.16347541264125276.

1/1 [==============================] - ETA: 0s
1/1 [==============================] - 0s 387ms/step
[I 2024-09-27 22:40:25,945] Trial 53 finished with value: 0.27336113416580926 and parameters: {'window_size': 2, 'batch_size': 32, 'network_type': 'RNN', 'num_layers': 2, 'num_neurons': 32, 'learning_rate': 0.01, 'dropout_rate': 0.1}. Best is trial 15 with value: 0.16347541264125276.

1/1 [==============================] - ETA: 0s
1/1 [==============================] - 1s 517ms/step
[I 2024-09-27 22:40:31,465] Trial 54 finished with value: 0.2712028043383643 and parameters: {'window_size': 2, 'batch_size': 32, 'network_type': 'RNN', 'num_layers': 2, 'num_neurons': 32, 'learning_rate': 0.01, 'dropout_rate': 0.1}. Best is trial 15 with value: 0.16347541264125276.

1/1 [==============================] - ETA: 0s
1/1 [==============================] - 0s 368ms/step
[I 2024-09-27 22:40:37,444] Trial 55 finished with value: 0.17978818184988837 and parameters: {'window_size': 2, 'batch_size': 32, 'network_type': 'RNN', 'num_layers': 2, 'num_neurons': 32, 'learning_rate': 0.01, 'dropout_rate': 0.1}. Best is trial 15 with value: 0.16347541264125276.

1/1 [==============================] - ETA: 0s
1/1 [==============================] - 0s 445ms/step
[I 2024-09-27 22:40:42,809] Trial 56 finished with value: 0.17120849355061848 and parameters: {'window_size': 2, 'batch_size': 64, 'network_type': 'RNN', 'num_layers': 2, 'num_neurons': 64, 'learning_rate': 0.01, 'dropout_rate': 0.1}. Best is trial 15 with value: 0.16347541264125276.

1/1 [==============================] - ETA: 0s
1/1 [==============================] - 0s 446ms/step
[I 2024-09-27 22:40:48,621] Trial 57 finished with value: 0.23327053546905516 and parameters: {'window_size': 6, 'batch_size': 64, 'network_type': 'RNN', 'num_layers': 2, 'num_neurons': 64, 'learning_rate': 0.01, 'dropout_rate': 0.1}. Best is trial 15 with value: 0.16347541264125276.

1/1 [==============================] - ETA: 0s
1/1 [==============================] - 1s 839ms/step
[I 2024-09-27 22:41:01,193] Trial 58 finished with value: 0.3022437689644949 and parameters: {'window_size': 2, 'batch_size': 64, 'network_type': 'GRU', 'num_layers': 3, 'num_neurons': 64, 'learning_rate': 0.01, 'dropout_rate': 0.1}. Best is trial 15 with value: 0.16347541264125276.

1/1 [==============================] - ETA: 0s
1/1 [==============================] - 0s 332ms/step
[I 2024-09-27 22:41:07,499] Trial 59 finished with value: 0.19828530193510507 and parameters: {'window_size': 2, 'batch_size': 64, 'network_type': 'RNN', 'num_layers': 2, 'num_neurons': 64, 'learning_rate': 0.01, 'dropout_rate': 0.1}. Best is trial 15 with value: 0.16347541264125276.

1/1 [==============================] - ETA: 0s
1/1 [==============================] - 0s 332ms/step
[I 2024-09-27 22:41:12,293] Trial 60 finished with value: 0.19512074470520016 and parameters: {'window_size': 2, 'batch_size': 64, 'network_type': 'RNN', 'num_layers': 2, 'num_neurons': 64, 'learning_rate': 0.01, 'dropout_rate': 0.1}. Best is trial 15 with value: 0.16347541264125276.

1/1 [==============================] - ETA: 0s
1/1 [==============================] - 0s 327ms/step
[I 2024-09-27 22:41:17,157] Trial 61 finished with value: 0.18258008639017737 and parameters: {'window_size': 2, 'batch_size': 32, 'network_type': 'RNN', 'num_layers': 2, 'num_neurons': 128, 'learning_rate': 0.01, 'dropout_rate': 0.1}. Best is trial 15 with value: 0.16347541264125276.

1/1 [==============================] - ETA: 0s
1/1 [==============================] - 0s 309ms/step
[I 2024-09-27 22:41:21,383] Trial 62 finished with value: 0.18342403557187031 and parameters: {'window_size': 2, 'batch_size': 64, 'network_type': 'RNN', 'num_layers': 2, 'num_neurons': 32, 'learning_rate': 0.01, 'dropout_rate': 0.1}. Best is trial 15 with value: 0.16347541264125276.

1/1 [==============================] - ETA: 0s
1/1 [==============================] - 0s 332ms/step
[I 2024-09-27 22:41:25,823] Trial 63 finished with value: 0.18567046814873103 and parameters: {'window_size': 2, 'batch_size': 16, 'network_type': 'RNN', 'num_layers': 2, 'num_neurons': 32, 'learning_rate': 0.01, 'dropout_rate': 0.1}. Best is trial 15 with value: 0.16347541264125276.

1/1 [==============================] - ETA: 0s
1/1 [==============================] - 0s 476ms/step
[I 2024-09-27 22:41:31,009] Trial 64 finished with value: 0.1977895070938837 and parameters: {'window_size': 2, 'batch_size': 32, 'network_type': 'RNN', 'num_layers': 2, 'num_neurons': 64, 'learning_rate': 0.01, 'dropout_rate': 0.1}. Best is trial 15 with value: 0.16347541264125276.

1/1 [==============================] - ETA: 0s
1/1 [==============================] - 0s 227ms/step
