[I 2024-09-27 23:21:36,797] Trial 60 finished with value: 0.0393492900408231 and parameters: {'learning_rate': 0.01, 'batch_size': 64, 'network_type': 'LSTM', 'num_layers': 3, 'num_neurons': 64, 'dropout_rate': 0.1}. Best is trial 5 with value: 0.02682420972677379.
[I 2024-09-27 23:21:46,854] Trial 61 finished with value: 0.0228115772834191 and parameters: {'learning_rate': 0.0001, 'batch_size': 32, 'network_type': 'GRU', 'num_layers': 1, 'num_neurons': 16, 'dropout_rate': 0.2}. Best is trial 61 with value: 0.0228115772834191.
[I 2024-09-27 23:21:56,801] Trial 62 finished with value: 0.03611684601123514 and parameters: {'learning_rate': 0.0001, 'batch_size': 32, 'network_type': 'GRU', 'num_layers': 1, 'num_neurons': 16, 'dropout_rate': 0.2}. Best is trial 61 with value: 0.0228115772834191.
[I 2024-09-27 23:22:03,747] Trial 63 finished with value: 0.033685724698580236 and parameters: {'learning_rate': 0.01, 'batch_size': 32, 'network_type': 'GRU', 'num_layers': 1, 'num_neurons': 16, 'dropout_rate': 0.2}. Best is trial 61 with value: 0.0228115772834191.
[I 2024-09-27 23:22:09,853] Trial 64 finished with value: 0.039582614311805174 and parameters: {'learning_rate': 0.01, 'batch_size': 32, 'network_type': 'GRU', 'num_layers': 1, 'num_neurons': 16, 'dropout_rate': 0.2}. Best is trial 61 with value: 0.0228115772834191.
[I 2024-09-27 23:22:15,726] Trial 65 finished with value: 0.033264477729797355 and parameters: {'learning_rate': 0.01, 'batch_size': 32, 'network_type': 'LSTM', 'num_layers': 1, 'num_neurons': 128, 'dropout_rate': 0.2}. Best is trial 61 with value: 0.0228115772834191.
[I 2024-09-27 23:22:27,366] Trial 66 finished with value: 0.07471769607984105 and parameters: {'learning_rate': 0.01, 'batch_size': 16, 'network_type': 'GRU', 'num_layers': 3, 'num_neurons': 16, 'dropout_rate': 0.2}. Best is trial 61 with value: 0.0228115772834191.
[I 2024-09-27 23:22:40,425] Trial 67 finished with value: 0.035825087987459606 and parameters: {'learning_rate': 0.01, 'batch_size': 64, 'network_type': 'LSTM', 'num_layers': 3, 'num_neurons': 128, 'dropout_rate': 0.2}. Best is trial 61 with value: 0.0228115772834191.
[I 2024-09-27 23:22:54,065] Trial 68 finished with value: 0.03242374552213229 and parameters: {'learning_rate': 0.01, 'batch_size': 32, 'network_type': 'LSTM', 'num_layers': 3, 'num_neurons': 64, 'dropout_rate': 0.1}. Best is trial 61 with value: 0.0228115772834191.
[I 2024-09-27 23:23:01,224] Trial 69 finished with value: 0.0440733749683087 and parameters: {'learning_rate': 0.01, 'batch_size': 16, 'network_type': 'GRU', 'num_layers': 1, 'num_neurons': 128, 'dropout_rate': 0.2}. Best is trial 61 with value: 0.0228115772834191.
[I 2024-09-27 23:23:14,868] Trial 70 finished with value: 0.03585363402733434 and parameters: {'learning_rate': 0.01, 'batch_size': 64, 'network_type': 'LSTM', 'num_layers': 3, 'num_neurons': 128, 'dropout_rate': 0.1}. Best is trial 61 with value: 0.0228115772834191.
[I 2024-09-27 23:23:21,025] Trial 71 finished with value: 0.0321443827702449 and parameters: {'learning_rate': 0.01, 'batch_size': 32, 'network_type': 'GRU', 'num_layers': 1, 'num_neurons': 16, 'dropout_rate': 0.2}. Best is trial 61 with value: 0.0228115772834191.
[I 2024-09-27 23:23:26,788] Trial 72 finished with value: 0.035025181183448224 and parameters: {'learning_rate': 0.01, 'batch_size': 32, 'network_type': 'GRU', 'num_layers': 1, 'num_neurons': 16, 'dropout_rate': 0.2}. Best is trial 61 with value: 0.0228115772834191.
[I 2024-09-27 23:23:32,801] Trial 73 finished with value: 0.03328685041574332 and parameters: {'learning_rate': 0.01, 'batch_size': 32, 'network_type': 'GRU', 'num_layers': 1, 'num_neurons': 16, 'dropout_rate': 0.2}. Best is trial 61 with value: 0.0228115772834191.
[I 2024-09-27 23:23:38,810] Trial 74 finished with value: 0.03332514161330004 and parameters: {'learning_rate': 0.01, 'batch_size': 32, 'network_type': 'GRU', 'num_layers': 1, 'num_neurons': 16, 'dropout_rate': 0.2}. Best is trial 61 with value: 0.0228115772834191.
[I 2024-09-27 23:23:48,924] Trial 75 finished with value: 0.03536780702150787 and parameters: {'learning_rate': 0.01, 'batch_size': 32, 'network_type': 'GRU', 'num_layers': 2, 'num_neurons': 16, 'dropout_rate': 0.2}. Best is trial 61 with value: 0.0228115772834191.
[I 2024-09-27 23:23:53,474] Trial 76 finished with value: 0.03548137826185959 and parameters: {'learning_rate': 0.01, 'batch_size': 16, 'network_type': 'RNN', 'num_layers': 1, 'num_neurons': 128, 'dropout_rate': 0.2}. Best is trial 61 with value: 0.0228115772834191.
[I 2024-09-27 23:24:05,504] Trial 77 finished with value: 0.03794959596487194 and parameters: {'learning_rate': 0.01, 'batch_size': 32, 'network_type': 'LSTM', 'num_layers': 3, 'num_neurons': 32, 'dropout_rate': 0.3}. Best is trial 61 with value: 0.0228115772834191.
[I 2024-09-27 23:31:02,545] Trial 78 finished with value: 0.030952876751239495 and parameters: {'learning_rate': 0.01, 'batch_size': 64, 'network_type': 'GRU', 'num_layers': 1, 'num_neurons': 64, 'dropout_rate': 0.2}. Best is trial 61 with value: 0.0228115772834191.
[I 2024-09-27 23:31:22,849] Trial 79 finished with value: 0.04596396552599397 and parameters: {'learning_rate': 0.01, 'batch_size': 64, 'network_type': 'LSTM', 'num_layers': 3, 'num_neurons': 64, 'dropout_rate': 0.2}. Best is trial 61 with value: 0.0228115772834191.
[I 2024-09-27 23:31:32,025] Trial 80 finished with value: 0.033580291234529956 and parameters: {'learning_rate': 0.01, 'batch_size': 64, 'network_type': 'GRU', 'num_layers': 1, 'num_neurons': 64, 'dropout_rate': 0.2}. Best is trial 61 with value: 0.0228115772834191.
[I 2024-09-27 23:31:40,585] Trial 81 finished with value: 0.03547293585997364 and parameters: {'learning_rate': 0.01, 'batch_size': 64, 'network_type': 'GRU', 'num_layers': 1, 'num_neurons': 64, 'dropout_rate': 0.2}. Best is trial 61 with value: 0.0228115772834191.
[I 2024-09-27 23:31:48,949] Trial 82 finished with value: 0.03095833286872278 and parameters: {'learning_rate': 0.01, 'batch_size': 64, 'network_type': 'GRU', 'num_layers': 1, 'num_neurons': 64, 'dropout_rate': 0.2}. Best is trial 61 with value: 0.0228115772834191.
[I 2024-09-27 23:31:58,657] Trial 83 finished with value: 0.03963797826033369 and parameters: {'learning_rate': 0.01, 'batch_size': 64, 'network_type': 'GRU', 'num_layers': 1, 'num_neurons': 64, 'dropout_rate': 0.2}. Best is trial 61 with value: 0.0228115772834191.
[I 2024-09-27 23:32:07,096] Trial 84 finished with value: 0.038857748471773625 and parameters: {'learning_rate': 0.01, 'batch_size': 64, 'network_type': 'GRU', 'num_layers': 1, 'num_neurons': 64, 'dropout_rate': 0.2}. Best is trial 61 with value: 0.0228115772834191.
[I 2024-09-27 23:32:16,445] Trial 85 finished with value: 0.03504365275456353 and parameters: {'learning_rate': 0.01, 'batch_size': 64, 'network_type': 'GRU', 'num_layers': 1, 'num_neurons': 64, 'dropout_rate': 0.2}. Best is trial 61 with value: 0.0228115772834191.
[I 2024-09-27 23:32:33,927] Trial 86 finished with value: 0.0357281302672166 and parameters: {'learning_rate': 0.01, 'batch_size': 64, 'network_type': 'LSTM', 'num_layers': 3, 'num_neurons': 64, 'dropout_rate': 0.2}. Best is trial 61 with value: 0.0228115772834191.
[I 2024-09-27 23:32:41,785] Trial 87 finished with value: 0.032258278553302495 and parameters: {'learning_rate': 0.01, 'batch_size': 64, 'network_type': 'GRU', 'num_layers': 1, 'num_neurons': 64, 'dropout_rate': 0.2}. Best is trial 61 with value: 0.0228115772834191.
[I 2024-09-27 23:32:57,523] Trial 88 finished with value: 0.04028569456247185 and parameters: {'learning_rate': 0.01, 'batch_size': 64, 'network_type': 'LSTM', 'num_layers': 3, 'num_neurons': 64, 'dropout_rate': 0.1}. Best is trial 61 with value: 0.0228115772834191.
[I 2024-09-27 23:33:10,811] Trial 89 finished with value: 0.03624351387757523 and parameters: {'learning_rate': 0.01, 'batch_size': 64, 'network_type': 'GRU', 'num_layers': 2, 'num_neurons': 16, 'dropout_rate': 0.2}. Best is trial 61 with value: 0.0228115772834191.
[I 2024-09-27 23:33:16,297] Trial 90 finished with value: 0.03526804538873522 and parameters: {'learning_rate': 0.01, 'batch_size': 64, 'network_type': 'RNN', 'num_layers': 1, 'num_neurons': 64, 'dropout_rate': 0.1}. Best is trial 61 with value: 0.0228115772834191.
[I 2024-09-27 23:33:26,105] Trial 91 finished with value: 0.03131288535778342 and parameters: {'learning_rate': 0.01, 'batch_size': 64, 'network_type': 'GRU', 'num_layers': 1, 'num_neurons': 64, 'dropout_rate': 0.2}. Best is trial 61 with value: 0.0228115772834191.
[I 2024-09-27 23:33:37,139] Trial 92 finished with value: 0.03163626223344069 and parameters: {'learning_rate': 0.01, 'batch_size': 64, 'network_type': 'GRU', 'num_layers': 1, 'num_neurons': 64, 'dropout_rate': 0.2}. Best is trial 61 with value: 0.0228115772834191.
[I 2024-09-27 23:33:47,631] Trial 93 finished with value: 0.03248781556349535 and parameters: {'learning_rate': 0.01, 'batch_size': 64, 'network_type': 'GRU', 'num_layers': 1, 'num_neurons': 64, 'dropout_rate': 0.2}. Best is trial 61 with value: 0.0228115772834191.
[I 2024-09-27 23:34:01,551] Trial 94 finished with value: 0.031452034069941556 and parameters: {'learning_rate': 0.0001, 'batch_size': 64, 'network_type': 'GRU', 'num_layers': 1, 'num_neurons': 64, 'dropout_rate': 0.2}. Best is trial 61 with value: 0.0228115772834191.
[I 2024-09-27 23:34:18,238] Trial 95 finished with value: 0.03569413904043342 and parameters: {'learning_rate': 0.0001, 'batch_size': 64, 'network_type': 'GRU', 'num_layers': 1, 'num_neurons': 64, 'dropout_rate': 0.2}. Best is trial 61 with value: 0.0228115772834191.
[I 2024-09-27 23:34:25,759] Trial 96 finished with value: 0.033443452248206516 and parameters: {'learning_rate': 0.01, 'batch_size': 64, 'network_type': 'GRU', 'num_layers': 1, 'num_neurons': 64, 'dropout_rate': 0.2}. Best is trial 61 with value: 0.0228115772834191.
[I 2024-09-27 23:34:32,983] Trial 97 finished with value: 0.035495104202857404 and parameters: {'learning_rate': 0.01, 'batch_size': 64, 'network_type': 'GRU', 'num_layers': 1, 'num_neurons': 64, 'dropout_rate': 0.2}. Best is trial 61 with value: 0.0228115772834191.
[I 2024-09-27 23:34:40,056] Trial 98 finished with value: 0.03157440647712122 and parameters: {'learning_rate': 0.01, 'batch_size': 64, 'network_type': 'GRU', 'num_layers': 1, 'num_neurons': 64, 'dropout_rate': 0.2}. Best is trial 61 with value: 0.0228115772834191.
[I 2024-09-27 23:34:47,231] Trial 99 finished with value: 0.03181620553823617 and parameters: {'learning_rate': 0.01, 'batch_size': 64, 'network_type': 'GRU', 'num_layers': 1, 'num_neurons': 64, 'dropout_rate': 0.1}. Best is trial 61 with value: 0.0228115772834191.
[I 2024-09-27 23:34:54,919] Trial 100 finished with value: 0.03187291248028094 and parameters: {'learning_rate': 0.01, 'batch_size': 64, 'network_type': 'GRU', 'num_layers': 1, 'num_neurons': 64, 'dropout_rate': 0.2}. Best is trial 61 with value: 0.0228115772834191.
[I 2024-09-27 23:35:03,043] Trial 101 finished with value: 0.034055010135357215 and parameters: {'learning_rate': 0.01, 'batch_size': 64, 'network_type': 'GRU', 'num_layers': 1, 'num_neurons': 64, 'dropout_rate': 0.2}. Best is trial 61 with value: 0.0228115772834191.
[I 2024-09-27 23:35:10,802] Trial 102 finished with value: 0.031572369942298284 and parameters: {'learning_rate': 0.01, 'batch_size': 64, 'network_type': 'GRU', 'num_layers': 1, 'num_neurons': 64, 'dropout_rate': 0.2}. Best is trial 61 with value: 0.0228115772834191.
[I 2024-09-27 23:35:21,778] Trial 103 finished with value: 0.033541589516859746 and parameters: {'learning_rate': 0.0001, 'batch_size': 64, 'network_type': 'GRU', 'num_layers': 1, 'num_neurons': 64, 'dropout_rate': 0.2}. Best is trial 61 with value: 0.0228115772834191.
[I 2024-09-27 23:35:28,782] Trial 104 finished with value: 0.03203636528895451 and parameters: {'learning_rate': 0.01, 'batch_size': 64, 'network_type': 'GRU', 'num_layers': 1, 'num_neurons': 64, 'dropout_rate': 0.2}. Best is trial 61 with value: 0.0228115772834191.
[I 2024-09-27 23:35:36,547] Trial 105 finished with value: 0.03140837544661303 and parameters: {'learning_rate': 0.01, 'batch_size': 64, 'network_type': 'GRU', 'num_layers': 1, 'num_neurons': 64, 'dropout_rate': 0.2}. Best is trial 61 with value: 0.0228115772834191.
[I 2024-09-27 23:35:44,198] Trial 106 finished with value: 0.031595772449786855 and parameters: {'learning_rate': 0.01, 'batch_size': 64, 'network_type': 'GRU', 'num_layers': 1, 'num_neurons': 64, 'dropout_rate': 0.1}. Best is trial 61 with value: 0.0228115772834191.
[I 2024-09-27 23:35:51,199] Trial 107 finished with value: 0.039172988268045314 and parameters: {'learning_rate': 0.01, 'batch_size': 16, 'network_type': 'GRU', 'num_layers': 1, 'num_neurons': 64, 'dropout_rate': 0.2}. Best is trial 61 with value: 0.0228115772834191.
[I 2024-09-27 23:35:57,733] Trial 108 finished with value: 0.03263873452406664 and parameters: {'learning_rate': 0.01, 'batch_size': 64, 'network_type': 'GRU', 'num_layers': 1, 'num_neurons': 64, 'dropout_rate': 0.2}. Best is trial 61 with value: 0.0228115772834191.
[I 2024-09-27 23:36:10,536] Trial 109 finished with value: 0.028435918881342934 and parameters: {'learning_rate': 0.0001, 'batch_size': 16, 'network_type': 'GRU', 'num_layers': 1, 'num_neurons': 32, 'dropout_rate': 0.2}. Best is trial 61 with value: 0.0228115772834191.
[I 2024-09-27 23:36:23,881] Trial 110 finished with value: 0.03685384251521186 and parameters: {'learning_rate': 0.01, 'batch_size': 16, 'network_type': 'GRU', 'num_layers': 2, 'num_neurons': 32, 'dropout_rate': 0.1}. Best is trial 61 with value: 0.0228115772834191.
[I 2024-09-27 23:36:31,229] Trial 111 finished with value: 0.03456300618098332 and parameters: {'learning_rate': 0.01, 'batch_size': 16, 'network_type': 'GRU', 'num_layers': 1, 'num_neurons': 32, 'dropout_rate': 0.2}. Best is trial 61 with value: 0.0228115772834191.
[I 2024-09-27 23:36:37,959] Trial 112 finished with value: 0.03709200939765346 and parameters: {'learning_rate': 0.01, 'batch_size': 16, 'network_type': 'GRU', 'num_layers': 1, 'num_neurons': 32, 'dropout_rate': 0.2}. Best is trial 61 with value: 0.0228115772834191.
[I 2024-09-27 23:36:44,487] Trial 113 finished with value: 0.033425420027512795 and parameters: {'learning_rate': 0.01, 'batch_size': 16, 'network_type': 'GRU', 'num_layers': 1, 'num_neurons': 32, 'dropout_rate': 0.2}. Best is trial 61 with value: 0.0228115772834191.
[I 2024-09-27 23:36:52,557] Trial 114 finished with value: 0.03105473650418796 and parameters: {'learning_rate': 0.01, 'batch_size': 16, 'network_type': 'GRU', 'num_layers': 1, 'num_neurons': 64, 'dropout_rate': 0.2}. Best is trial 61 with value: 0.0228115772834191.
[I 2024-09-27 23:36:59,429] Trial 115 finished with value: 0.03673791936727669 and parameters: {'learning_rate': 0.01, 'batch_size': 16, 'network_type': 'GRU', 'num_layers': 1, 'num_neurons': 32, 'dropout_rate': 0.2}. Best is trial 61 with value: 0.0228115772834191.
[I 2024-09-27 23:37:04,419] Trial 116 finished with value: 0.03317790229503926 and parameters: {'learning_rate': 0.01, 'batch_size': 16, 'network_type': 'RNN', 'num_layers': 1, 'num_neurons': 64, 'dropout_rate': 0.2}. Best is trial 61 with value: 0.0228115772834191.
[I 2024-09-27 23:37:18,219] Trial 117 finished with value: 0.03166344583951508 and parameters: {'learning_rate': 0.01, 'batch_size': 16, 'network_type': 'LSTM', 'num_layers': 3, 'num_neurons': 64, 'dropout_rate': 0.3}. Best is trial 61 with value: 0.0228115772834191.
[I 2024-09-27 23:37:26,276] Trial 118 finished with value: 0.03182476681929369 and parameters: {'learning_rate': 0.01, 'batch_size': 16, 'network_type': 'GRU', 'num_layers': 1, 'num_neurons': 128, 'dropout_rate': 0.2}. Best is trial 61 with value: 0.0228115772834191.
[I 2024-09-27 23:37:32,985] Trial 119 finished with value: 0.0408490158594572 and parameters: {'learning_rate': 0.01, 'batch_size': 16, 'network_type': 'GRU', 'num_layers': 1, 'num_neurons': 64, 'dropout_rate': 0.1}. Best is trial 61 with value: 0.0228115772834191.
[I 2024-09-27 23:37:47,560] Trial 120 finished with value: 0.034300663801339976 and parameters: {'learning_rate': 0.01, 'batch_size': 16, 'network_type': 'LSTM', 'num_layers': 3, 'num_neurons': 32, 'dropout_rate': 0.2}. Best is trial 61 with value: 0.0228115772834191.
[I 2024-09-27 23:37:53,808] Trial 121 finished with value: 0.033212635553800156 and parameters: {'learning_rate': 0.01, 'batch_size': 64, 'network_type': 'GRU', 'num_layers': 1, 'num_neurons': 64, 'dropout_rate': 0.2}. Best is trial 61 with value: 0.0228115772834191.
[I 2024-09-27 23:38:05,898] Trial 122 finished with value: 0.03019911692692679 and parameters: {'learning_rate': 0.0001, 'batch_size': 64, 'network_type': 'GRU', 'num_layers': 1, 'num_neurons': 64, 'dropout_rate': 0.2}. Best is trial 61 with value: 0.0228115772834191.
[I 2024-09-27 23:38:17,603] Trial 123 finished with value: 0.024731115341186508 and parameters: {'learning_rate': 0.0001, 'batch_size': 16, 'network_type': 'GRU', 'num_layers': 1, 'num_neurons': 64, 'dropout_rate': 0.2}. Best is trial 61 with value: 0.0228115772834191.
[I 2024-09-27 23:38:29,217] Trial 124 finished with value: 0.02680713000664344 and parameters: {'learning_rate': 0.0001, 'batch_size': 16, 'network_type': 'GRU', 'num_layers': 1, 'num_neurons': 64, 'dropout_rate': 0.2}. Best is trial 61 with value: 0.0228115772834191.
[I 2024-09-27 23:38:43,023] Trial 125 finished with value: 0.02653325330294095 and parameters: {'learning_rate': 0.0001, 'batch_size': 16, 'network_type': 'GRU', 'num_layers': 1, 'num_neurons': 64, 'dropout_rate': 0.2}. Best is trial 61 with value: 0.0228115772834191.
[I 2024-09-27 23:38:54,837] Trial 126 finished with value: 0.025859425324660082 and parameters: {'learning_rate': 0.0001, 'batch_size': 16, 'network_type': 'GRU', 'num_layers': 1, 'num_neurons': 64, 'dropout_rate': 0.2}. Best is trial 61 with value: 0.0228115772834191.
[I 2024-09-27 23:39:07,000] Trial 127 finished with value: 0.026537438686077393 and parameters: {'learning_rate': 0.0001, 'batch_size': 16, 'network_type': 'GRU', 'num_layers': 1, 'num_neurons': 64, 'dropout_rate': 0.2}. Best is trial 61 with value: 0.0228115772834191.
[I 2024-09-27 23:39:27,297] Trial 128 finished with value: 0.02699866478259744 and parameters: {'learning_rate': 0.0001, 'batch_size': 16, 'network_type': 'LSTM', 'num_layers': 3, 'num_neurons': 64, 'dropout_rate': 0.2}. Best is trial 61 with value: 0.0228115772834191.
[I 2024-09-27 23:39:47,624] Trial 129 finished with value: 0.024117163217984714 and parameters: {'learning_rate': 0.0001, 'batch_size': 16, 'network_type': 'LSTM', 'num_layers': 3, 'num_neurons': 64, 'dropout_rate': 0.2}. Best is trial 61 with value: 0.0228115772834191.
[I 2024-09-27 23:40:00,848] Trial 130 finished with value: 0.04453081189669093 and parameters: {'learning_rate': 0.0001, 'batch_size': 16, 'network_type': 'LSTM', 'num_layers': 3, 'num_neurons': 64, 'dropout_rate': 0.2}. Best is trial 61 with value: 0.0228115772834191.
[I 2024-09-27 23:40:21,652] Trial 131 finished with value: 0.026285167694091786 and parameters: {'learning_rate': 0.0001, 'batch_size': 16, 'network_type': 'LSTM', 'num_layers': 3, 'num_neurons': 64, 'dropout_rate': 0.2}. Best is trial 61 with value: 0.0228115772834191.
[I 2024-09-27 23:40:40,836] Trial 132 finished with value: 0.024683945142305798 and parameters: {'learning_rate': 0.0001, 'batch_size': 16, 'network_type': 'LSTM', 'num_layers': 3, 'num_neurons': 64, 'dropout_rate': 0.2}. Best is trial 61 with value: 0.0228115772834191.
[I 2024-09-27 23:41:01,311] Trial 133 finished with value: 0.02488195837461032 and parameters: {'learning_rate': 0.0001, 'batch_size': 16, 'network_type': 'LSTM', 'num_layers': 3, 'num_neurons': 64, 'dropout_rate': 0.2}. Best is trial 61 with value: 0.0228115772834191.
[I 2024-09-27 23:41:20,561] Trial 134 finished with value: 0.025255019261286815 and parameters: {'learning_rate': 0.0001, 'batch_size': 16, 'network_type': 'LSTM', 'num_layers': 3, 'num_neurons': 64, 'dropout_rate': 0.2}. Best is trial 61 with value: 0.0228115772834191.
[I 2024-09-27 23:41:41,482] Trial 135 finished with value: 0.024365732926588793 and parameters: {'learning_rate': 0.0001, 'batch_size': 16, 'network_type': 'LSTM', 'num_layers': 3, 'num_neurons': 64, 'dropout_rate': 0.2}. Best is trial 61 with value: 0.0228115772834191.
[I 2024-09-27 23:42:00,979] Trial 136 finished with value: 0.025489120703477138 and parameters: {'learning_rate': 0.0001, 'batch_size': 16, 'network_type': 'LSTM', 'num_layers': 3, 'num_neurons': 64, 'dropout_rate': 0.2}. Best is trial 61 with value: 0.0228115772834191.
[I 2024-09-27 23:42:21,635] Trial 137 finished with value: 0.023657587271470295 and parameters: {'learning_rate': 0.0001, 'batch_size': 16, 'network_type': 'LSTM', 'num_layers': 3, 'num_neurons': 64, 'dropout_rate': 0.2}. Best is trial 61 with value: 0.0228115772834191.
[I 2024-09-27 23:42:42,797] Trial 138 finished with value: 0.02484122210282546 and parameters: {'learning_rate': 0.0001, 'batch_size': 16, 'network_type': 'LSTM', 'num_layers': 3, 'num_neurons': 64, 'dropout_rate': 0.2}. Best is trial 61 with value: 0.0228115772834191.
[I 2024-09-27 23:43:02,521] Trial 139 finished with value: 0.027661184164193935 and parameters: {'learning_rate': 0.0001, 'batch_size': 16, 'network_type': 'LSTM', 'num_layers': 3, 'num_neurons': 64, 'dropout_rate': 0.2}. Best is trial 61 with value: 0.0228115772834191.
[I 2024-09-27 23:43:17,215] Trial 140 finished with value: 0.03354275864821216 and parameters: {'learning_rate': 0.01, 'batch_size': 16, 'network_type': 'LSTM', 'num_layers': 3, 'num_neurons': 64, 'dropout_rate': 0.2}. Best is trial 61 with value: 0.0228115772834191.
[I 2024-09-27 23:43:38,304] Trial 141 finished with value: 0.024356346277090227 and parameters: {'learning_rate': 0.0001, 'batch_size': 16, 'network_type': 'LSTM', 'num_layers': 3, 'num_neurons': 64, 'dropout_rate': 0.2}. Best is trial 61 with value: 0.0228115772834191.
