[I 2024-09-27 21:02:31,713] Trial 26 finished with value: 0.019656899690628053 and parameters: {'window_size': 2, 'batch_size': 16, 'network_type': 'GRU', 'num_layers': 2, 'num_neurons': 128, 'learning_rate': 0.01, 'dropout_rate': 0.3}. Best is trial 23 with value: 0.01880481806894144.

1/2 [==============>...............] - ETA: 0s
2/2 [==============================] - 1s 0s/step
[I 2024-09-27 21:02:48,271] Trial 27 finished with value: 0.027068319355448095 and parameters: {'window_size': 2, 'batch_size': 16, 'network_type': 'GRU', 'num_layers': 2, 'num_neurons': 128, 'learning_rate': 0.01, 'dropout_rate': 0.3}. Best is trial 23 with value: 0.01880481806894144.

1/2 [==============>...............] - ETA: 0s
2/2 [==============================] - 0s 0s/step
[I 2024-09-27 21:02:58,986] Trial 28 finished with value: 0.029095203255613645 and parameters: {'window_size': 2, 'batch_size': 16, 'network_type': 'GRU', 'num_layers': 2, 'num_neurons': 128, 'learning_rate': 0.01, 'dropout_rate': 0.3}. Best is trial 23 with value: 0.01880481806894144.

1/2 [==============>...............] - ETA: 0s
2/2 [==============================] - 0s 0s/step
[I 2024-09-27 21:03:06,096] Trial 29 finished with value: 0.028521328290303554 and parameters: {'window_size': 2, 'batch_size': 16, 'network_type': 'GRU', 'num_layers': 2, 'num_neurons': 128, 'learning_rate': 0.01, 'dropout_rate': 0.3}. Best is trial 23 with value: 0.01880481806894144.

1/2 [==============>...............] - ETA: 0s
2/2 [==============================] - 0s 16ms/step
[I 2024-09-27 21:03:12,905] Trial 30 finished with value: 0.0227018064459165 and parameters: {'window_size': 2, 'batch_size': 16, 'network_type': 'GRU', 'num_layers': 2, 'num_neurons': 128, 'learning_rate': 0.01, 'dropout_rate': 0.3}. Best is trial 23 with value: 0.01880481806894144.

1/2 [==============>...............] - ETA: 0s
2/2 [==============================] - 1s 0s/step
[I 2024-09-27 21:03:22,236] Trial 31 finished with value: 0.022620013515154525 and parameters: {'window_size': 2, 'batch_size': 16, 'network_type': 'GRU', 'num_layers': 2, 'num_neurons': 128, 'learning_rate': 0.01, 'dropout_rate': 0.3}. Best is trial 23 with value: 0.01880481806894144.

1/2 [==============>...............] - ETA: 0s
2/2 [==============================] - 1s 0s/step
[I 2024-09-27 21:03:30,953] Trial 32 finished with value: 0.04860812319815159 and parameters: {'window_size': 2, 'batch_size': 16, 'network_type': 'GRU', 'num_layers': 2, 'num_neurons': 128, 'learning_rate': 0.01, 'dropout_rate': 0.1}. Best is trial 23 with value: 0.01880481806894144.

1/2 [==============>...............] - ETA: 0s
2/2 [==============================] - 0s 16ms/step
[I 2024-09-27 21:03:35,226] Trial 33 finished with value: 0.06788853903792122 and parameters: {'window_size': 6, 'batch_size': 16, 'network_type': 'LSTM', 'num_layers': 1, 'num_neurons': 128, 'learning_rate': 0.01, 'dropout_rate': 0.3}. Best is trial 23 with value: 0.01880481806894144.

1/2 [==============>...............] - ETA: 0s
2/2 [==============================] - 0s 0s/step
[I 2024-09-27 21:03:42,471] Trial 34 finished with value: 0.04869010852773984 and parameters: {'window_size': 2, 'batch_size': 16, 'network_type': 'GRU', 'num_layers': 2, 'num_neurons': 128, 'learning_rate': 0.01, 'dropout_rate': 0.3}. Best is trial 23 with value: 0.01880481806894144.

1/2 [==============>...............] - ETA: 0s
2/2 [==============================] - 0s 0s/step
[I 2024-09-27 21:03:50,060] Trial 35 finished with value: 0.022221247174523097 and parameters: {'window_size': 6, 'batch_size': 64, 'network_type': 'GRU', 'num_layers': 2, 'num_neurons': 32, 'learning_rate': 0.01, 'dropout_rate': 0.1}. Best is trial 23 with value: 0.01880481806894144.

1/2 [==============>...............] - ETA: 0s
2/2 [==============================] - 1s 0s/step
[I 2024-09-27 21:06:38,671] Trial 36 finished with value: 0.034424203907450046 and parameters: {'window_size': 2, 'batch_size': 16, 'network_type': 'LSTM', 'num_layers': 1, 'num_neurons': 128, 'learning_rate': 0.01, 'dropout_rate': 0.3}. Best is trial 23 with value: 0.01880481806894144.

1/2 [==============>...............] - ETA: 1s
2/2 [==============================] - 2s 25ms/step
[I 2024-09-27 21:06:52,323] Trial 37 finished with value: 0.07042366207729688 and parameters: {'window_size': 6, 'batch_size': 64, 'network_type': 'GRU', 'num_layers': 2, 'num_neurons': 16, 'learning_rate': 0.01, 'dropout_rate': 0.3}. Best is trial 23 with value: 0.01880481806894144.

1/2 [==============>...............] - ETA: 0s
2/2 [==============================] - 0s 0s/step
[I 2024-09-27 21:07:07,539] Trial 38 finished with value: 0.024196748584508904 and parameters: {'window_size': 2, 'batch_size': 16, 'network_type': 'LSTM', 'num_layers': 1, 'num_neurons': 128, 'learning_rate': 0.01, 'dropout_rate': 0.3}. Best is trial 23 with value: 0.01880481806894144.

1/2 [==============>...............] - ETA: 0s
2/2 [==============================] - 1s 10ms/step
[I 2024-09-27 21:07:21,375] Trial 39 finished with value: 0.02419939851760865 and parameters: {'window_size': 2, 'batch_size': 64, 'network_type': 'GRU', 'num_layers': 2, 'num_neurons': 32, 'learning_rate': 0.01, 'dropout_rate': 0.1}. Best is trial 23 with value: 0.01880481806894144.

1/2 [==============>...............] - ETA: 0s
2/2 [==============================] - 1s 0s/step
[I 2024-09-27 21:07:39,858] Trial 40 finished with value: 0.03815426667711952 and parameters: {'window_size': 6, 'batch_size': 16, 'network_type': 'LSTM', 'num_layers': 2, 'num_neurons': 128, 'learning_rate': 0.01, 'dropout_rate': 0.2}. Best is trial 23 with value: 0.01880481806894144.

1/2 [==============>...............] - ETA: 0s
2/2 [==============================] - 1s 16ms/step
[I 2024-09-27 21:07:52,839] Trial 41 finished with value: 0.024323944048448044 and parameters: {'window_size': 6, 'batch_size': 64, 'network_type': 'GRU', 'num_layers': 2, 'num_neurons': 32, 'learning_rate': 0.01, 'dropout_rate': 0.1}. Best is trial 23 with value: 0.01880481806894144.

1/2 [==============>...............] - ETA: 1s
2/2 [==============================] - 1s 11ms/step
[I 2024-09-27 21:08:10,030] Trial 42 finished with value: 0.02326366178014062 and parameters: {'window_size': 6, 'batch_size': 64, 'network_type': 'GRU', 'num_layers': 2, 'num_neurons': 32, 'learning_rate': 0.01, 'dropout_rate': 0.1}. Best is trial 23 with value: 0.01880481806894144.

1/2 [==============>...............] - ETA: 1s
2/2 [==============================] - 1s 13ms/step
[I 2024-09-27 21:08:30,007] Trial 43 finished with value: 0.028713843746618794 and parameters: {'window_size': 6, 'batch_size': 64, 'network_type': 'GRU', 'num_layers': 2, 'num_neurons': 32, 'learning_rate': 0.01, 'dropout_rate': 0.1}. Best is trial 23 with value: 0.01880481806894144.

1/2 [==============>...............] - ETA: 0s
2/2 [==============================] - 1s 11ms/step
[I 2024-09-27 21:08:44,746] Trial 44 finished with value: 0.02641471538218585 and parameters: {'window_size': 6, 'batch_size': 64, 'network_type': 'GRU', 'num_layers': 2, 'num_neurons': 32, 'learning_rate': 0.01, 'dropout_rate': 0.1}. Best is trial 23 with value: 0.01880481806894144.

1/2 [==============>...............] - ETA: 0s
2/2 [==============================] - 1s 14ms/step
[I 2024-09-27 21:08:53,306] Trial 45 finished with value: 0.023616657251897065 and parameters: {'window_size': 4, 'batch_size': 64, 'network_type': 'GRU', 'num_layers': 1, 'num_neurons': 32, 'learning_rate': 0.01, 'dropout_rate': 0.1}. Best is trial 23 with value: 0.01880481806894144.

1/2 [==============>...............] - ETA: 1s
2/2 [==============================] - 1s 16ms/step
[I 2024-09-27 21:09:08,822] Trial 46 finished with value: 0.019278928989713843 and parameters: {'window_size': 6, 'batch_size': 64, 'network_type': 'RNN', 'num_layers': 2, 'num_neurons': 128, 'learning_rate': 0.01, 'dropout_rate': 0.2}. Best is trial 23 with value: 0.01880481806894144.

1/2 [==============>...............] - ETA: 0s
2/2 [==============================] - 1s 7ms/step
[I 2024-09-27 21:09:20,004] Trial 47 finished with value: 0.07909952500592109 and parameters: {'window_size': 4, 'batch_size': 64, 'network_type': 'RNN', 'num_layers': 3, 'num_neurons': 128, 'learning_rate': 0.01, 'dropout_rate': 0.2}. Best is trial 23 with value: 0.01880481806894144.

1/2 [==============>...............] - ETA: 0s
2/2 [==============================] - 0s 0s/step
[I 2024-09-27 21:09:25,269] Trial 48 finished with value: 0.036622944593429574 and parameters: {'window_size': 2, 'batch_size': 32, 'network_type': 'RNN', 'num_layers': 1, 'num_neurons': 128, 'learning_rate': 0.01, 'dropout_rate': 0.2}. Best is trial 23 with value: 0.01880481806894144.

1/2 [==============>...............] - ETA: 1s
2/2 [==============================] - 1s 12ms/step
[I 2024-09-27 21:09:35,798] Trial 49 finished with value: 0.019753424416417663 and parameters: {'window_size': 4, 'batch_size': 64, 'network_type': 'RNN', 'num_layers': 2, 'num_neurons': 128, 'learning_rate': 0.01, 'dropout_rate': 0.2}. Best is trial 23 with value: 0.01880481806894144.

1/2 [==============>...............] - ETA: 0s
2/2 [==============================] - 1s 11ms/step
[I 2024-09-27 21:09:47,768] Trial 50 finished with value: 0.02429622225327925 and parameters: {'window_size': 6, 'batch_size': 16, 'network_type': 'RNN', 'num_layers': 2, 'num_neurons': 128, 'learning_rate': 0.01, 'dropout_rate': 0.2}. Best is trial 23 with value: 0.01880481806894144.

1/2 [==============>...............] - ETA: 0s
2/2 [==============================] - 0s 0s/step
[I 2024-09-27 21:09:55,206] Trial 51 finished with value: 0.03548772380663002 and parameters: {'window_size': 4, 'batch_size': 64, 'network_type': 'RNN', 'num_layers': 2, 'num_neurons': 128, 'learning_rate': 0.01, 'dropout_rate': 0.2}. Best is trial 23 with value: 0.01880481806894144.

1/2 [==============>...............] - ETA: 0s
2/2 [==============================] - 1s 11ms/step
[I 2024-09-27 21:10:01,828] Trial 52 finished with value: 0.02659565897091575 and parameters: {'window_size': 4, 'batch_size': 64, 'network_type': 'RNN', 'num_layers': 2, 'num_neurons': 128, 'learning_rate': 0.01, 'dropout_rate': 0.2}. Best is trial 23 with value: 0.01880481806894144.

1/2 [==============>...............] - ETA: 0s
2/2 [==============================] - 0s 16ms/step
[I 2024-09-27 21:10:09,337] Trial 53 finished with value: 0.06986877600006436 and parameters: {'window_size': 4, 'batch_size': 64, 'network_type': 'RNN', 'num_layers': 2, 'num_neurons': 16, 'learning_rate': 0.01, 'dropout_rate': 0.2}. Best is trial 23 with value: 0.01880481806894144.

1/2 [==============>...............] - ETA: 1s
2/2 [==============================] - 1s 16ms/step
[I 2024-09-27 21:10:21,595] Trial 54 finished with value: 0.024536841620569638 and parameters: {'window_size': 4, 'batch_size': 64, 'network_type': 'RNN', 'num_layers': 3, 'num_neurons': 128, 'learning_rate': 0.01, 'dropout_rate': 0.2}. Best is trial 23 with value: 0.01880481806894144.

1/2 [==============>...............] - ETA: 0s
2/2 [==============================] - 0s 0s/step
[I 2024-09-27 21:10:29,204] Trial 55 finished with value: 0.0420036500847858 and parameters: {'window_size': 4, 'batch_size': 32, 'network_type': 'RNN', 'num_layers': 1, 'num_neurons': 128, 'learning_rate': 0.0001, 'dropout_rate': 0.2}. Best is trial 23 with value: 0.01880481806894144.

1/2 [==============>...............] - ETA: 0s
2/2 [==============================] - 1s 0s/step
[I 2024-09-27 21:10:38,701] Trial 56 finished with value: 0.030942517876625067 and parameters: {'window_size': 4, 'batch_size': 64, 'network_type': 'LSTM', 'num_layers': 2, 'num_neurons': 128, 'learning_rate': 0.01, 'dropout_rate': 0.2}. Best is trial 23 with value: 0.01880481806894144.

1/2 [==============>...............] - ETA: 0s
2/2 [==============================] - 0s 0s/step
[I 2024-09-27 21:10:45,377] Trial 57 finished with value: 0.022898513113458956 and parameters: {'window_size': 2, 'batch_size': 16, 'network_type': 'RNN', 'num_layers': 2, 'num_neurons': 64, 'learning_rate': 0.01, 'dropout_rate': 0.2}. Best is trial 23 with value: 0.01880481806894144.

1/2 [==============>...............] - ETA: 0s
2/2 [==============================] - 1s 16ms/step
[I 2024-09-27 21:10:52,878] Trial 58 finished with value: 0.06437501083249632 and parameters: {'window_size': 4, 'batch_size': 64, 'network_type': 'LSTM', 'num_layers': 2, 'num_neurons': 128, 'learning_rate': 0.01, 'dropout_rate': 0.3}. Best is trial 23 with value: 0.01880481806894144.

1/2 [==============>...............] - ETA: 0s
2/2 [==============================] - 0s 0s/step
[I 2024-09-27 21:10:56,490] Trial 59 finished with value: 0.03413261253138384 and parameters: {'window_size': 2, 'batch_size': 16, 'network_type': 'RNN', 'num_layers': 1, 'num_neurons': 128, 'learning_rate': 0.01, 'dropout_rate': 0.2}. Best is trial 23 with value: 0.01880481806894144.

1/2 [==============>...............] - ETA: 0s
2/2 [==============================] - 1s 16ms/step
[I 2024-09-27 21:11:14,428] Trial 60 finished with value: 0.040194802095492685 and parameters: {'window_size': 2, 'batch_size': 32, 'network_type': 'RNN', 'num_layers': 3, 'num_neurons': 16, 'learning_rate': 0.0001, 'dropout_rate': 0.3}. Best is trial 23 with value: 0.01880481806894144.

1/2 [==============>...............] - ETA: 0s
2/2 [==============================] - 1s 16ms/step
[I 2024-09-27 21:11:21,582] Trial 61 finished with value: 0.05879241104559465 and parameters: {'window_size': 6, 'batch_size': 64, 'network_type': 'GRU', 'num_layers': 2, 'num_neurons': 32, 'learning_rate': 0.01, 'dropout_rate': 0.2}. Best is trial 23 with value: 0.01880481806894144.

1/2 [==============>...............] - ETA: 0s
2/2 [==============================] - 1s 16ms/step
[I 2024-09-27 21:11:31,470] Trial 62 finished with value: 0.030869159893556077 and parameters: {'window_size': 6, 'batch_size': 64, 'network_type': 'GRU', 'num_layers': 2, 'num_neurons': 128, 'learning_rate': 0.01, 'dropout_rate': 0.3}. Best is trial 23 with value: 0.01880481806894144.

1/2 [==============>...............] - ETA: 0s
2/2 [==============================] - 1s 16ms/step
[I 2024-09-27 21:11:43,086] Trial 63 finished with value: 0.02216384459625591 and parameters: {'window_size': 6, 'batch_size': 64, 'network_type': 'GRU', 'num_layers': 2, 'num_neurons': 128, 'learning_rate': 0.01, 'dropout_rate': 0.1}. Best is trial 23 with value: 0.01880481806894144.

1/2 [==============>...............] - ETA: 0s
2/2 [==============================] - 1s 16ms/step
[I 2024-09-27 21:11:54,173] Trial 64 finished with value: 0.06390661344744943 and parameters: {'window_size': 6, 'batch_size': 64, 'network_type': 'GRU', 'num_layers': 2, 'num_neurons': 128, 'learning_rate': 0.0001, 'dropout_rate': 0.3}. Best is trial 23 with value: 0.01880481806894144.

1/2 [==============>...............] - ETA: 0s
2/2 [==============================] - 1s 16ms/step
[I 2024-09-27 21:12:02,779] Trial 65 finished with value: 0.026483091901649145 and parameters: {'window_size': 6, 'batch_size': 64, 'network_type': 'LSTM', 'num_layers': 2, 'num_neurons': 128, 'learning_rate': 0.01, 'dropout_rate': 0.2}. Best is trial 23 with value: 0.01880481806894144.

1/2 [==============>...............] - ETA: 0s
2/2 [==============================] - 1s 0s/step
[I 2024-09-27 21:12:11,692] Trial 66 finished with value: 0.03720569563905399 and parameters: {'window_size': 2, 'batch_size': 16, 'network_type': 'GRU', 'num_layers': 2, 'num_neurons': 128, 'learning_rate': 0.01, 'dropout_rate': 0.3}. Best is trial 23 with value: 0.01880481806894144.

1/2 [==============>...............] - ETA: 0s
2/2 [==============================] - 1s 10ms/step
[I 2024-09-27 21:12:21,036] Trial 67 finished with value: 0.0261959125995636 and parameters: {'window_size': 4, 'batch_size': 16, 'network_type': 'GRU', 'num_layers': 2, 'num_neurons': 128, 'learning_rate': 0.01, 'dropout_rate': 0.1}. Best is trial 23 with value: 0.01880481806894144.

1/2 [==============>...............] - ETA: 0s
2/2 [==============================] - 0s 0s/step
[I 2024-09-27 21:12:27,328] Trial 68 finished with value: 0.023564617251356446 and parameters: {'window_size': 2, 'batch_size': 64, 'network_type': 'RNN', 'num_layers': 2, 'num_neurons': 64, 'learning_rate': 0.01, 'dropout_rate': 0.3}. Best is trial 23 with value: 0.01880481806894144.

1/2 [==============>...............] - ETA: 0s
2/2 [==============================] - 0s 0s/step
[I 2024-09-27 21:12:35,307] Trial 69 finished with value: 0.028168999623168597 and parameters: {'window_size': 6, 'batch_size': 16, 'network_type': 'LSTM', 'num_layers': 1, 'num_neurons': 128, 'learning_rate': 0.01, 'dropout_rate': 0.2}. Best is trial 23 with value: 0.01880481806894144.

1/2 [==============>...............] - ETA: 0s
2/2 [==============================] - 1s 0s/step
[I 2024-09-27 21:12:45,514] Trial 70 finished with value: 0.040154400716225315 and parameters: {'window_size': 2, 'batch_size': 64, 'network_type': 'GRU', 'num_layers': 2, 'num_neurons': 128, 'learning_rate': 0.01, 'dropout_rate': 0.3}. Best is trial 23 with value: 0.01880481806894144.

1/2 [==============>...............] - ETA: 0s
2/2 [==============================] - 1s 0s/step
[I 2024-09-27 21:12:55,914] Trial 71 finished with value: 0.020679770545525986 and parameters: {'window_size': 6, 'batch_size': 64, 'network_type': 'GRU', 'num_layers': 2, 'num_neurons': 128, 'learning_rate': 0.01, 'dropout_rate': 0.1}. Best is trial 23 with value: 0.01880481806894144.

1/2 [==============>...............] - ETA: 1s
2/2 [==============================] - 1s 10ms/step
[I 2024-09-27 21:13:17,247] Trial 72 finished with value: 0.023048640662973578 and parameters: {'window_size': 6, 'batch_size': 64, 'network_type': 'GRU', 'num_layers': 2, 'num_neurons': 128, 'learning_rate': 0.01, 'dropout_rate': 0.1}. Best is trial 23 with value: 0.01880481806894144.

1/2 [==============>...............] - ETA: 1s
2/2 [==============================] - 1s 18ms/step
[I 2024-09-27 21:13:30,781] Trial 73 finished with value: 0.02329055721109564 and parameters: {'window_size': 6, 'batch_size': 64, 'network_type': 'GRU', 'num_layers': 2, 'num_neurons': 128, 'learning_rate': 0.01, 'dropout_rate': 0.1}. Best is trial 23 with value: 0.01880481806894144.

1/2 [==============>...............] - ETA: 1s
2/2 [==============================] - 1s 12ms/step
[I 2024-09-27 21:13:45,353] Trial 74 finished with value: 0.019949130437590865 and parameters: {'window_size': 6, 'batch_size': 64, 'network_type': 'GRU', 'num_layers': 2, 'num_neurons': 128, 'learning_rate': 0.01, 'dropout_rate': 0.1}. Best is trial 23 with value: 0.01880481806894144.

1/2 [==============>...............] - ETA: 0s
2/2 [==============================] - 1s 16ms/step
[I 2024-09-27 21:13:54,112] Trial 75 finished with value: 0.06466397612203252 and parameters: {'window_size': 6, 'batch_size': 16, 'network_type': 'GRU', 'num_layers': 2, 'num_neurons': 128, 'learning_rate': 0.01, 'dropout_rate': 0.1}. Best is trial 23 with value: 0.01880481806894144.

1/2 [==============>...............] - ETA: 0s
2/2 [==============================] - 1s 16ms/step
[I 2024-09-27 21:14:03,810] Trial 76 finished with value: 0.02494111334780853 and parameters: {'window_size': 2, 'batch_size': 64, 'network_type': 'GRU', 'num_layers': 2, 'num_neurons': 128, 'learning_rate': 0.01, 'dropout_rate': 0.1}. Best is trial 23 with value: 0.01880481806894144.

1/2 [==============>...............] - ETA: 0s
2/2 [==============================] - 1s 0s/step
[I 2024-09-27 21:14:18,435] Trial 77 finished with value: 0.02254800284427145 and parameters: {'window_size': 4, 'batch_size': 64, 'network_type': 'GRU', 'num_layers': 2, 'num_neurons': 128, 'learning_rate': 0.01, 'dropout_rate': 0.3}. Best is trial 23 with value: 0.01880481806894144.

1/2 [==============>...............] - ETA: 0s
2/2 [==============================] - 1s 5ms/step
[I 2024-09-27 21:14:27,455] Trial 78 finished with value: 0.026142121206630356 and parameters: {'window_size': 6, 'batch_size': 16, 'network_type': 'LSTM', 'num_layers': 1, 'num_neurons': 128, 'learning_rate': 0.01, 'dropout_rate': 0.2}. Best is trial 23 with value: 0.01880481806894144.

1/2 [==============>...............] - ETA: 1s
2/2 [==============================] - 1s 9ms/step
[I 2024-09-27 21:14:50,504] Trial 79 finished with value: 0.04841601749261221 and parameters: {'window_size': 2, 'batch_size': 32, 'network_type': 'GRU', 'num_layers': 3, 'num_neurons': 128, 'learning_rate': 0.0001, 'dropout_rate': 0.3}. Best is trial 23 with value: 0.01880481806894144.

1/2 [==============>...............] - ETA: 0s
2/2 [==============================] - 1s 9ms/step
[I 2024-09-27 21:15:02,567] Trial 80 finished with value: 0.051056393677538094 and parameters: {'window_size': 6, 'batch_size': 64, 'network_type': 'RNN', 'num_layers': 2, 'num_neurons': 64, 'learning_rate': 0.01, 'dropout_rate': 0.1}. Best is trial 23 with value: 0.01880481806894144.

1/2 [==============>...............] - ETA: 0s
2/2 [==============================] - 1s 10ms/step
[I 2024-09-27 21:15:13,251] Trial 81 finished with value: 0.06393117940967734 and parameters: {'window_size': 6, 'batch_size': 64, 'network_type': 'GRU', 'num_layers': 2, 'num_neurons': 128, 'learning_rate': 0.01, 'dropout_rate': 0.1}. Best is trial 23 with value: 0.01880481806894144.

1/2 [==============>...............] - ETA: 0s
2/2 [==============================] - 1s 10ms/step
[I 2024-09-27 21:15:25,488] Trial 82 finished with value: 0.022299681425094607 and parameters: {'window_size': 6, 'batch_size': 64, 'network_type': 'GRU', 'num_layers': 2, 'num_neurons': 128, 'learning_rate': 0.01, 'dropout_rate': 0.1}. Best is trial 23 with value: 0.01880481806894144.

1/2 [==============>...............] - ETA: 0s
2/2 [==============================] - 1s 5ms/step
