[I 2024-09-27 20:05:31,826] Trial 36 finished with value: 0.015182673466511242 and parameters: {'window_size': 2, 'batch_size': 64, 'network_type': 'RNN', 'num_layers': 2, 'num_neurons': 64, 'learning_rate': 0.01, 'dropout_rate': 0.3}. Best is trial 33 with value: 0.01322751606427706.

1/2 [==============>...............] - ETA: 0s
2/2 [==============================] - 1s 4ms/step
[I 2024-09-27 20:05:41,034] Trial 37 finished with value: 0.015426236763978625 and parameters: {'window_size': 2, 'batch_size': 32, 'network_type': 'LSTM', 'num_layers': 2, 'num_neurons': 64, 'learning_rate': 0.01, 'dropout_rate': 0.2}. Best is trial 33 with value: 0.01322751606427706.

1/2 [==============>...............] - ETA: 0s
2/2 [==============================] - 0s 5ms/step
[I 2024-09-27 20:05:48,897] Trial 38 finished with value: 0.016190023460903664 and parameters: {'window_size': 4, 'batch_size': 16, 'network_type': 'LSTM', 'num_layers': 2, 'num_neurons': 64, 'learning_rate': 0.01, 'dropout_rate': 0.3}. Best is trial 33 with value: 0.01322751606427706.

1/2 [==============>...............] - ETA: 0s
2/2 [==============================] - 0s 4ms/step
[I 2024-09-27 20:05:55,935] Trial 39 finished with value: 0.026545173971993557 and parameters: {'window_size': 6, 'batch_size': 32, 'network_type': 'LSTM', 'num_layers': 2, 'num_neurons': 32, 'learning_rate': 0.01, 'dropout_rate': 0.1}. Best is trial 33 with value: 0.01322751606427706.

1/2 [==============>...............] - ETA: 0s
2/2 [==============================] - 1s 28ms/step
[I 2024-09-27 20:06:01,759] Trial 40 finished with value: 0.017873946507771805 and parameters: {'window_size': 2, 'batch_size': 64, 'network_type': 'RNN', 'num_layers': 3, 'num_neurons': 16, 'learning_rate': 0.01, 'dropout_rate': 0.3}. Best is trial 33 with value: 0.01322751606427706.

1/2 [==============>...............] - ETA: 0s
2/2 [==============================] - 0s 3ms/step
[I 2024-09-27 20:06:07,239] Trial 41 finished with value: 0.017866129691784177 and parameters: {'window_size': 2, 'batch_size': 32, 'network_type': 'LSTM', 'num_layers': 1, 'num_neurons': 128, 'learning_rate': 0.01, 'dropout_rate': 0.3}. Best is trial 33 with value: 0.01322751606427706.

1/2 [==============>...............] - ETA: 0s
2/2 [==============================] - 0s 4ms/step
[I 2024-09-27 20:06:13,050] Trial 42 finished with value: 0.016264057098290843 and parameters: {'window_size': 2, 'batch_size': 32, 'network_type': 'LSTM', 'num_layers': 1, 'num_neurons': 128, 'learning_rate': 0.01, 'dropout_rate': 0.3}. Best is trial 33 with value: 0.01322751606427706.

1/2 [==============>...............] - ETA: 0s
2/2 [==============================] - 0s 3ms/step
[I 2024-09-27 20:06:21,173] Trial 43 finished with value: 0.015272858314025077 and parameters: {'window_size': 2, 'batch_size': 32, 'network_type': 'LSTM', 'num_layers': 1, 'num_neurons': 64, 'learning_rate': 0.01, 'dropout_rate': 0.3}. Best is trial 33 with value: 0.01322751606427706.

1/2 [==============>...............] - ETA: 0s
2/2 [==============================] - 0s 7ms/step
[I 2024-09-27 20:06:26,312] Trial 44 finished with value: 0.01791738501110593 and parameters: {'window_size': 4, 'batch_size': 32, 'network_type': 'RNN', 'num_layers': 2, 'num_neurons': 16, 'learning_rate': 0.01, 'dropout_rate': 0.3}. Best is trial 33 with value: 0.01322751606427706.

1/2 [==============>...............] - ETA: 0s
2/2 [==============================] - 0s 4ms/step
[I 2024-09-27 20:06:31,592] Trial 45 finished with value: 0.014246050260005841 and parameters: {'window_size': 2, 'batch_size': 32, 'network_type': 'GRU', 'num_layers': 1, 'num_neurons': 128, 'learning_rate': 0.01, 'dropout_rate': 0.2}. Best is trial 33 with value: 0.01322751606427706.

1/2 [==============>...............] - ETA: 0s
2/2 [==============================] - 0s 5ms/step
[I 2024-09-27 20:06:44,218] Trial 46 finished with value: 0.06390891422544204 and parameters: {'window_size': 6, 'batch_size': 16, 'network_type': 'LSTM', 'num_layers': 2, 'num_neurons': 32, 'learning_rate': 0.01, 'dropout_rate': 0.3}. Best is trial 33 with value: 0.01322751606427706.

1/2 [==============>...............] - ETA: 0s
2/2 [==============================] - 0s 3ms/step
[I 2024-09-27 20:06:48,302] Trial 47 finished with value: 0.015325137260632619 and parameters: {'window_size': 2, 'batch_size': 32, 'network_type': 'LSTM', 'num_layers': 1, 'num_neurons': 128, 'learning_rate': 0.01, 'dropout_rate': 0.3}. Best is trial 33 with value: 0.01322751606427706.

1/2 [==============>...............] - ETA: 0s
2/2 [==============================] - 0s 4ms/step
[I 2024-09-27 20:06:54,572] Trial 48 finished with value: 0.013557960632869166 and parameters: {'window_size': 6, 'batch_size': 16, 'network_type': 'GRU', 'num_layers': 1, 'num_neurons': 32, 'learning_rate': 0.01, 'dropout_rate': 0.3}. Best is trial 33 with value: 0.01322751606427706.

1/2 [==============>...............] - ETA: 0s
2/2 [==============================] - 1s 6ms/step
[I 2024-09-27 20:07:07,934] Trial 49 finished with value: 0.0161909774507795 and parameters: {'window_size': 6, 'batch_size': 16, 'network_type': 'GRU', 'num_layers': 3, 'num_neurons': 32, 'learning_rate': 0.01, 'dropout_rate': 0.3}. Best is trial 33 with value: 0.01322751606427706.

1/2 [==============>...............] - ETA: 0s
2/2 [==============================] - 0s 4ms/step
[I 2024-09-27 20:07:18,076] Trial 50 finished with value: 0.023381772191183887 and parameters: {'window_size': 6, 'batch_size': 16, 'network_type': 'GRU', 'num_layers': 2, 'num_neurons': 32, 'learning_rate': 0.01, 'dropout_rate': 0.1}. Best is trial 33 with value: 0.01322751606427706.

1/2 [==============>...............] - ETA: 0s
2/2 [==============================] - 0s 3ms/step
[I 2024-09-27 20:07:23,149] Trial 51 finished with value: 0.013432826641627711 and parameters: {'window_size': 6, 'batch_size': 16, 'network_type': 'GRU', 'num_layers': 1, 'num_neurons': 32, 'learning_rate': 0.01, 'dropout_rate': 0.3}. Best is trial 33 with value: 0.01322751606427706.

1/2 [==============>...............] - ETA: 0s
2/2 [==============================] - 0s 3ms/step
[I 2024-09-27 20:07:27,556] Trial 52 finished with value: 0.0140900251661028 and parameters: {'window_size': 6, 'batch_size': 16, 'network_type': 'GRU', 'num_layers': 1, 'num_neurons': 32, 'learning_rate': 0.01, 'dropout_rate': 0.3}. Best is trial 33 with value: 0.01322751606427706.

1/2 [==============>...............] - ETA: 0s
2/2 [==============================] - 0s 4ms/step
[I 2024-09-27 20:07:32,405] Trial 53 finished with value: 0.021231253038133908 and parameters: {'window_size': 6, 'batch_size': 16, 'network_type': 'GRU', 'num_layers': 1, 'num_neurons': 32, 'learning_rate': 0.01, 'dropout_rate': 0.3}. Best is trial 33 with value: 0.01322751606427706.

1/2 [==============>...............] - ETA: 0s
2/2 [==============================] - 0s 3ms/step
[I 2024-09-27 20:07:38,096] Trial 54 finished with value: 0.015325536973135817 and parameters: {'window_size': 6, 'batch_size': 16, 'network_type': 'GRU', 'num_layers': 1, 'num_neurons': 32, 'learning_rate': 0.01, 'dropout_rate': 0.3}. Best is trial 33 with value: 0.01322751606427706.

1/2 [==============>...............] - ETA: 0s
2/2 [==============================] - 0s 3ms/step
[I 2024-09-27 20:07:43,171] Trial 55 finished with value: 0.015593186937059654 and parameters: {'window_size': 6, 'batch_size': 16, 'network_type': 'GRU', 'num_layers': 1, 'num_neurons': 32, 'learning_rate': 0.01, 'dropout_rate': 0.3}. Best is trial 33 with value: 0.01322751606427706.

1/2 [==============>...............] - ETA: 0s
2/2 [==============================] - 0s 3ms/step
[I 2024-09-27 20:07:47,348] Trial 56 finished with value: 0.0180238052231925 and parameters: {'window_size': 6, 'batch_size': 16, 'network_type': 'GRU', 'num_layers': 1, 'num_neurons': 32, 'learning_rate': 0.01, 'dropout_rate': 0.3}. Best is trial 33 with value: 0.01322751606427706.

1/2 [==============>...............] - ETA: 0s
2/2 [==============================] - 0s 3ms/step
[I 2024-09-27 20:07:51,415] Trial 57 finished with value: 0.018302903120858343 and parameters: {'window_size': 6, 'batch_size': 16, 'network_type': 'GRU', 'num_layers': 1, 'num_neurons': 32, 'learning_rate': 0.01, 'dropout_rate': 0.3}. Best is trial 33 with value: 0.01322751606427706.

1/2 [==============>...............] - ETA: 0s
2/2 [==============================] - 0s 3ms/step
[I 2024-09-27 20:07:59,140] Trial 58 finished with value: 0.01494185878208706 and parameters: {'window_size': 6, 'batch_size': 16, 'network_type': 'GRU', 'num_layers': 2, 'num_neurons': 32, 'learning_rate': 0.01, 'dropout_rate': 0.2}. Best is trial 33 with value: 0.01322751606427706.

1/2 [==============>...............] - ETA: 0s
2/2 [==============================] - 0s 12ms/step
[I 2024-09-27 20:08:03,673] Trial 59 finished with value: 0.013281616442912328 and parameters: {'window_size': 4, 'batch_size': 16, 'network_type': 'GRU', 'num_layers': 1, 'num_neurons': 32, 'learning_rate': 0.01, 'dropout_rate': 0.3}. Best is trial 33 with value: 0.01322751606427706.

1/2 [==============>...............] - ETA: 0s
2/2 [==============================] - 0s 5ms/step
[I 2024-09-27 20:08:08,408] Trial 60 finished with value: 0.013580200762362089 and parameters: {'window_size': 4, 'batch_size': 16, 'network_type': 'GRU', 'num_layers': 1, 'num_neurons': 64, 'learning_rate': 0.01, 'dropout_rate': 0.3}. Best is trial 33 with value: 0.01322751606427706.

1/2 [==============>...............] - ETA: 0s
2/2 [==============================] - 0s 4ms/step
[I 2024-09-27 20:08:14,744] Trial 61 finished with value: 0.01395336675643919 and parameters: {'window_size': 4, 'batch_size': 16, 'network_type': 'GRU', 'num_layers': 1, 'num_neurons': 64, 'learning_rate': 0.01, 'dropout_rate': 0.3}. Best is trial 33 with value: 0.01322751606427706.

1/2 [==============>...............] - ETA: 0s
2/2 [==============================] - 0s 2ms/step
[I 2024-09-27 20:08:24,935] Trial 62 finished with value: 0.01471654397088127 and parameters: {'window_size': 4, 'batch_size': 16, 'network_type': 'GRU', 'num_layers': 1, 'num_neurons': 64, 'learning_rate': 0.01, 'dropout_rate': 0.3}. Best is trial 33 with value: 0.01322751606427706.

1/2 [==============>...............] - ETA: 0s
2/2 [==============================] - 0s 2ms/step
[I 2024-09-27 20:08:29,018] Trial 63 finished with value: 0.013463253227440082 and parameters: {'window_size': 4, 'batch_size': 16, 'network_type': 'GRU', 'num_layers': 1, 'num_neurons': 64, 'learning_rate': 0.01, 'dropout_rate': 0.3}. Best is trial 33 with value: 0.01322751606427706.

1/2 [==============>...............] - ETA: 0s
2/2 [==============================] - 0s 13ms/step
[I 2024-09-27 20:08:33,850] Trial 64 finished with value: 0.013127395668545276 and parameters: {'window_size': 4, 'batch_size': 16, 'network_type': 'GRU', 'num_layers': 1, 'num_neurons': 64, 'learning_rate': 0.01, 'dropout_rate': 0.3}. Best is trial 64 with value: 0.013127395668545276.

1/2 [==============>...............] - ETA: 0s
2/2 [==============================] - 0s 11ms/step
[I 2024-09-27 20:08:38,060] Trial 65 finished with value: 0.01812788816400478 and parameters: {'window_size': 4, 'batch_size': 16, 'network_type': 'GRU', 'num_layers': 1, 'num_neurons': 64, 'learning_rate': 0.01, 'dropout_rate': 0.3}. Best is trial 64 with value: 0.013127395668545276.

1/2 [==============>...............] - ETA: 0s
2/2 [==============================] - 0s 3ms/step
[I 2024-09-27 20:08:43,392] Trial 66 finished with value: 0.013394844815537732 and parameters: {'window_size': 4, 'batch_size': 16, 'network_type': 'GRU', 'num_layers': 1, 'num_neurons': 64, 'learning_rate': 0.01, 'dropout_rate': 0.3}. Best is trial 64 with value: 0.013127395668545276.

1/2 [==============>...............] - ETA: 0s
2/2 [==============================] - 0s 3ms/step
[I 2024-09-27 20:08:47,336] Trial 67 finished with value: 0.02979168735968102 and parameters: {'window_size': 4, 'batch_size': 16, 'network_type': 'GRU', 'num_layers': 1, 'num_neurons': 64, 'learning_rate': 0.01, 'dropout_rate': 0.3}. Best is trial 64 with value: 0.013127395668545276.

1/2 [==============>...............] - ETA: 0s
2/2 [==============================] - 0s 4ms/step
[I 2024-09-27 20:09:00,560] Trial 68 finished with value: 0.014431756676854295 and parameters: {'window_size': 4, 'batch_size': 16, 'network_type': 'GRU', 'num_layers': 1, 'num_neurons': 64, 'learning_rate': 0.0001, 'dropout_rate': 0.1}. Best is trial 64 with value: 0.013127395668545276.

1/2 [==============>...............] - ETA: 0s
2/2 [==============================] - 0s 2ms/step
[I 2024-09-27 20:09:04,992] Trial 69 finished with value: 0.02015568167454489 and parameters: {'window_size': 4, 'batch_size': 64, 'network_type': 'GRU', 'num_layers': 1, 'num_neurons': 64, 'learning_rate': 0.01, 'dropout_rate': 0.3}. Best is trial 64 with value: 0.013127395668545276.

1/2 [==============>...............] - ETA: 0s
2/2 [==============================] - 0s 4ms/step
[I 2024-09-27 20:09:08,120] Trial 70 finished with value: 0.017342930819537163 and parameters: {'window_size': 4, 'batch_size': 16, 'network_type': 'RNN', 'num_layers': 1, 'num_neurons': 64, 'learning_rate': 0.01, 'dropout_rate': 0.3}. Best is trial 64 with value: 0.013127395668545276.

1/2 [==============>...............] - ETA: 0s
2/2 [==============================] - 0s 3ms/step
[I 2024-09-27 20:09:12,667] Trial 71 finished with value: 0.014165324894157614 and parameters: {'window_size': 4, 'batch_size': 16, 'network_type': 'GRU', 'num_layers': 1, 'num_neurons': 64, 'learning_rate': 0.01, 'dropout_rate': 0.3}. Best is trial 64 with value: 0.013127395668545276.

1/2 [==============>...............] - ETA: 0s
2/2 [==============================] - 0s 4ms/step
[I 2024-09-27 20:09:16,873] Trial 72 finished with value: 0.01376881563341295 and parameters: {'window_size': 4, 'batch_size': 16, 'network_type': 'GRU', 'num_layers': 1, 'num_neurons': 64, 'learning_rate': 0.01, 'dropout_rate': 0.3}. Best is trial 64 with value: 0.013127395668545276.

1/2 [==============>...............] - ETA: 0s
2/2 [==============================] - 0s 3ms/step
[I 2024-09-27 20:09:20,573] Trial 73 finished with value: 0.01734088777851415 and parameters: {'window_size': 4, 'batch_size': 16, 'network_type': 'GRU', 'num_layers': 1, 'num_neurons': 64, 'learning_rate': 0.01, 'dropout_rate': 0.3}. Best is trial 64 with value: 0.013127395668545276.

1/2 [==============>...............] - ETA: 1s
2/2 [==============================] - 2s 5ms/step
[I 2024-09-27 20:09:35,610] Trial 74 finished with value: 0.01880234666772789 and parameters: {'window_size': 4, 'batch_size': 16, 'network_type': 'GRU', 'num_layers': 3, 'num_neurons': 16, 'learning_rate': 0.01, 'dropout_rate': 0.3}. Best is trial 64 with value: 0.013127395668545276.

1/2 [==============>...............] - ETA: 0s
2/2 [==============================] - 0s 3ms/step
[I 2024-09-27 20:09:41,870] Trial 75 finished with value: 0.014137120620624439 and parameters: {'window_size': 4, 'batch_size': 16, 'network_type': 'GRU', 'num_layers': 1, 'num_neurons': 64, 'learning_rate': 0.01, 'dropout_rate': 0.2}. Best is trial 64 with value: 0.013127395668545276.

1/2 [==============>...............] - ETA: 0s
2/2 [==============================] - 0s 3ms/step
[I 2024-09-27 20:09:46,040] Trial 76 finished with value: 0.013607026074383705 and parameters: {'window_size': 4, 'batch_size': 16, 'network_type': 'GRU', 'num_layers': 1, 'num_neurons': 64, 'learning_rate': 0.01, 'dropout_rate': 0.3}. Best is trial 64 with value: 0.013127395668545276.

1/2 [==============>...............] - ETA: 0s
2/2 [==============================] - 0s 17ms/step
[I 2024-09-27 20:09:54,027] Trial 77 finished with value: 0.019691739584948537 and parameters: {'window_size': 4, 'batch_size': 64, 'network_type': 'GRU', 'num_layers': 1, 'num_neurons': 128, 'learning_rate': 0.0001, 'dropout_rate': 0.3}. Best is trial 64 with value: 0.013127395668545276.

1/2 [==============>...............] - ETA: 0s
2/2 [==============================] - 0s 13ms/step
[I 2024-09-27 20:09:57,926] Trial 78 finished with value: 0.01821482262740261 and parameters: {'window_size': 4, 'batch_size': 16, 'network_type': 'RNN', 'num_layers': 1, 'num_neurons': 64, 'learning_rate': 0.01, 'dropout_rate': 0.3}. Best is trial 64 with value: 0.013127395668545276.

1/2 [==============>...............] - ETA: 0s
2/2 [==============================] - 0s 2ms/step
[I 2024-09-27 20:10:03,226] Trial 79 finished with value: 0.018839946978801016 and parameters: {'window_size': 4, 'batch_size': 16, 'network_type': 'GRU', 'num_layers': 1, 'num_neurons': 16, 'learning_rate': 0.01, 'dropout_rate': 0.3}. Best is trial 64 with value: 0.013127395668545276.

1/2 [==============>...............] - ETA: 0s
2/2 [==============================] - 1s 16ms/step
[I 2024-09-27 20:10:16,047] Trial 80 finished with value: 0.022863991260528578 and parameters: {'window_size': 4, 'batch_size': 16, 'network_type': 'GRU', 'num_layers': 3, 'num_neurons': 64, 'learning_rate': 0.01, 'dropout_rate': 0.3}. Best is trial 64 with value: 0.013127395668545276.

1/2 [==============>...............] - ETA: 0s
2/2 [==============================] - 0s 3ms/step
[I 2024-09-27 20:10:22,241] Trial 81 finished with value: 0.014838067490713916 and parameters: {'window_size': 6, 'batch_size': 16, 'network_type': 'GRU', 'num_layers': 1, 'num_neurons': 32, 'learning_rate': 0.01, 'dropout_rate': 0.3}. Best is trial 64 with value: 0.013127395668545276.

1/2 [==============>...............] - ETA: 0s
2/2 [==============================] - 0s 3ms/step
[I 2024-09-27 20:10:26,773] Trial 82 finished with value: 0.015761950261252274 and parameters: {'window_size': 6, 'batch_size': 16, 'network_type': 'GRU', 'num_layers': 1, 'num_neurons': 32, 'learning_rate': 0.01, 'dropout_rate': 0.3}. Best is trial 64 with value: 0.013127395668545276.

1/2 [==============>...............] - ETA: 0s
2/2 [==============================] - 0s 3ms/step
[I 2024-09-27 20:10:31,421] Trial 83 finished with value: 0.01740418849672588 and parameters: {'window_size': 6, 'batch_size': 16, 'network_type': 'GRU', 'num_layers': 1, 'num_neurons': 32, 'learning_rate': 0.01, 'dropout_rate': 0.3}. Best is trial 64 with value: 0.013127395668545276.

1/2 [==============>...............] - ETA: 0s
2/2 [==============================] - 0s 3ms/step
[I 2024-09-27 20:10:36,766] Trial 84 finished with value: 0.013419733251844125 and parameters: {'window_size': 6, 'batch_size': 16, 'network_type': 'GRU', 'num_layers': 1, 'num_neurons': 32, 'learning_rate': 0.01, 'dropout_rate': 0.3}. Best is trial 64 with value: 0.013127395668545276.

1/2 [==============>...............] - ETA: 0s
2/2 [==============================] - 1s 8ms/step
[I 2024-09-27 20:10:44,029] Trial 85 finished with value: 0.0267113645656689 and parameters: {'window_size': 4, 'batch_size': 16, 'network_type': 'GRU', 'num_layers': 2, 'num_neurons': 128, 'learning_rate': 0.01, 'dropout_rate': 0.1}. Best is trial 64 with value: 0.013127395668545276.

1/2 [==============>...............] - ETA: 0s
2/2 [==============================] - 0s 3ms/step
[I 2024-09-27 20:10:48,583] Trial 86 finished with value: 0.017440047563825344 and parameters: {'window_size': 6, 'batch_size': 64, 'network_type': 'GRU', 'num_layers': 1, 'num_neurons': 32, 'learning_rate': 0.01, 'dropout_rate': 0.3}. Best is trial 64 with value: 0.013127395668545276.

1/2 [==============>...............] - ETA: 0s
2/2 [==============================] - 0s 14ms/step
[I 2024-09-27 20:10:54,366] Trial 87 finished with value: 0.014457936164660326 and parameters: {'window_size': 2, 'batch_size': 16, 'network_type': 'LSTM', 'num_layers': 2, 'num_neurons': 32, 'learning_rate': 0.01, 'dropout_rate': 0.3}. Best is trial 64 with value: 0.013127395668545276.

1/2 [==============>...............] - ETA: 0s
2/2 [==============================] - 0s 3ms/step
[I 2024-09-27 20:10:59,068] Trial 88 finished with value: 0.013831867501542371 and parameters: {'window_size': 4, 'batch_size': 32, 'network_type': 'GRU', 'num_layers': 1, 'num_neurons': 64, 'learning_rate': 0.01, 'dropout_rate': 0.3}. Best is trial 64 with value: 0.013127395668545276.

1/2 [==============>...............] - ETA: 0s
2/2 [==============================] - 0s 5ms/step
[I 2024-09-27 20:11:02,279] Trial 89 finished with value: 0.024393800313132128 and parameters: {'window_size': 6, 'batch_size': 16, 'network_type': 'RNN', 'num_layers': 1, 'num_neurons': 128, 'learning_rate': 0.01, 'dropout_rate': 0.2}. Best is trial 64 with value: 0.013127395668545276.

1/2 [==============>...............] - ETA: 1s
2/2 [==============================] - 1s 6ms/step
[I 2024-09-27 20:11:18,080] Trial 90 finished with value: 0.06451790935565262 and parameters: {'window_size': 2, 'batch_size': 32, 'network_type': 'LSTM', 'num_layers': 2, 'num_neurons': 32, 'learning_rate': 0.0001, 'dropout_rate': 0.3}. Best is trial 64 with value: 0.013127395668545276.

1/2 [==============>...............] - ETA: 0s
2/2 [==============================] - 0s 8ms/step
[I 2024-09-27 20:11:26,739] Trial 91 finished with value: 0.01665122947692872 and parameters: {'window_size': 6, 'batch_size': 16, 'network_type': 'GRU', 'num_layers': 1, 'num_neurons': 32, 'learning_rate': 0.01, 'dropout_rate': 0.3}. Best is trial 64 with value: 0.013127395668545276.

1/2 [==============>...............] - ETA: 0s
2/2 [==============================] - 0s 4ms/step
[I 2024-09-27 20:11:34,605] Trial 92 finished with value: 0.014164433043343663 and parameters: {'window_size': 6, 'batch_size': 16, 'network_type': 'GRU', 'num_layers': 1, 'num_neurons': 32, 'learning_rate': 0.01, 'dropout_rate': 0.3}. Best is trial 64 with value: 0.013127395668545276.

1/2 [==============>...............] - ETA: 0s
2/2 [==============================] - 0s 0s/step
