[I 2024-09-27 19:59:06,149] Trial 182 finished with value: 0.009580709695816043 and parameters: {'window_size': 2, 'batch_size': 32, 'network_type': 'LSTM', 'num_layers': 1, 'num_neurons': 128, 'learning_rate': 0.01, 'dropout_rate': 0.1}. Best is trial 131 with value: 0.00941323839442831.

1/3 [=========>....................] - ETA: 0s
3/3 [==============================] - 0s 3ms/step
[I 2024-09-27 19:59:11,695] Trial 183 finished with value: 0.009741737130662087 and parameters: {'window_size': 2, 'batch_size': 32, 'network_type': 'LSTM', 'num_layers': 1, 'num_neurons': 128, 'learning_rate': 0.01, 'dropout_rate': 0.1}. Best is trial 131 with value: 0.00941323839442831.

1/3 [=========>....................] - ETA: 0s
3/3 [==============================] - 0s 3ms/step
[I 2024-09-27 19:59:18,020] Trial 184 finished with value: 0.009477547343348118 and parameters: {'window_size': 2, 'batch_size': 32, 'network_type': 'LSTM', 'num_layers': 1, 'num_neurons': 128, 'learning_rate': 0.01, 'dropout_rate': 0.1}. Best is trial 131 with value: 0.00941323839442831.

1/3 [=========>....................] - ETA: 0s
3/3 [==============================] - 0s 3ms/step
[I 2024-09-27 19:59:24,078] Trial 185 finished with value: 0.00978130954755864 and parameters: {'window_size': 2, 'batch_size': 32, 'network_type': 'LSTM', 'num_layers': 1, 'num_neurons': 128, 'learning_rate': 0.01, 'dropout_rate': 0.1}. Best is trial 131 with value: 0.00941323839442831.

1/3 [=========>....................] - ETA: 0s
3/3 [==============================] - 0s 4ms/step
[I 2024-09-27 19:59:28,805] Trial 186 finished with value: 0.010122950678140346 and parameters: {'window_size': 2, 'batch_size': 32, 'network_type': 'LSTM', 'num_layers': 1, 'num_neurons': 128, 'learning_rate': 0.01, 'dropout_rate': 0.1}. Best is trial 131 with value: 0.00941323839442831.

1/3 [=========>....................] - ETA: 1s
3/3 [==============================] - 1s 6ms/step
[I 2024-09-27 19:59:35,850] Trial 187 finished with value: 0.010379649548463417 and parameters: {'window_size': 2, 'batch_size': 32, 'network_type': 'LSTM', 'num_layers': 2, 'num_neurons': 64, 'learning_rate': 0.01, 'dropout_rate': 0.3}. Best is trial 131 with value: 0.00941323839442831.

1/3 [=========>....................] - ETA: 0s
3/3 [==============================] - 0s 3ms/step
[I 2024-09-27 19:59:41,453] Trial 188 finished with value: 0.009475384943921803 and parameters: {'window_size': 2, 'batch_size': 32, 'network_type': 'LSTM', 'num_layers': 1, 'num_neurons': 128, 'learning_rate': 0.01, 'dropout_rate': 0.1}. Best is trial 131 with value: 0.00941323839442831.

1/3 [=========>....................] - ETA: 0s
3/3 [==============================] - 0s 3ms/step
[I 2024-09-27 19:59:45,117] Trial 189 finished with value: 0.011251215568730532 and parameters: {'window_size': 2, 'batch_size': 32, 'network_type': 'LSTM', 'num_layers': 1, 'num_neurons': 128, 'learning_rate': 0.01, 'dropout_rate': 0.1}. Best is trial 131 with value: 0.00941323839442831.

1/3 [=========>....................] - ETA: 0s
3/3 [==============================] - 0s 4ms/step
[I 2024-09-27 19:59:56,664] Trial 190 finished with value: 0.01053345772757459 and parameters: {'window_size': 6, 'batch_size': 32, 'network_type': 'LSTM', 'num_layers': 1, 'num_neurons': 128, 'learning_rate': 0.01, 'dropout_rate': 0.1}. Best is trial 131 with value: 0.00941323839442831.

1/3 [=========>....................] - ETA: 0s
3/3 [==============================] - 0s 3ms/step
[I 2024-09-27 20:00:03,055] Trial 191 finished with value: 0.009607432022900653 and parameters: {'window_size': 2, 'batch_size': 32, 'network_type': 'LSTM', 'num_layers': 1, 'num_neurons': 128, 'learning_rate': 0.01, 'dropout_rate': 0.1}. Best is trial 131 with value: 0.00941323839442831.

1/3 [=========>....................] - ETA: 0s
3/3 [==============================] - 0s 3ms/step
[I 2024-09-27 20:00:09,334] Trial 192 finished with value: 0.009578237637667592 and parameters: {'window_size': 2, 'batch_size': 32, 'network_type': 'LSTM', 'num_layers': 1, 'num_neurons': 128, 'learning_rate': 0.01, 'dropout_rate': 0.1}. Best is trial 131 with value: 0.00941323839442831.

1/3 [=========>....................] - ETA: 0s
3/3 [==============================] - 0s 3ms/step
[I 2024-09-27 20:00:14,607] Trial 193 finished with value: 0.009746377293492706 and parameters: {'window_size': 2, 'batch_size': 32, 'network_type': 'LSTM', 'num_layers': 1, 'num_neurons': 128, 'learning_rate': 0.01, 'dropout_rate': 0.1}. Best is trial 131 with value: 0.00941323839442831.

1/3 [=========>....................] - ETA: 0s
3/3 [==============================] - 0s 2ms/step
[I 2024-09-27 20:00:19,349] Trial 194 finished with value: 0.009925203309932224 and parameters: {'window_size': 2, 'batch_size': 32, 'network_type': 'LSTM', 'num_layers': 1, 'num_neurons': 128, 'learning_rate': 0.01, 'dropout_rate': 0.1}. Best is trial 131 with value: 0.00941323839442831.

1/3 [=========>....................] - ETA: 0s
3/3 [==============================] - 0s 2ms/step
[I 2024-09-27 20:00:26,337] Trial 195 finished with value: 0.00956740700694877 and parameters: {'window_size': 2, 'batch_size': 32, 'network_type': 'LSTM', 'num_layers': 1, 'num_neurons': 32, 'learning_rate': 0.01, 'dropout_rate': 0.1}. Best is trial 131 with value: 0.00941323839442831.

1/3 [=========>....................] - ETA: 0s
3/3 [==============================] - 0s 3ms/step
[I 2024-09-27 20:00:31,975] Trial 196 finished with value: 0.009807674713537728 and parameters: {'window_size': 2, 'batch_size': 32, 'network_type': 'LSTM', 'num_layers': 1, 'num_neurons': 128, 'learning_rate': 0.01, 'dropout_rate': 0.1}. Best is trial 131 with value: 0.00941323839442831.

1/3 [=========>....................] - ETA: 1s
3/3 [==============================] - 1s 6ms/step
[I 2024-09-27 20:00:43,352] Trial 197 finished with value: 0.010676330640282429 and parameters: {'window_size': 2, 'batch_size': 32, 'network_type': 'LSTM', 'num_layers': 3, 'num_neurons': 128, 'learning_rate': 0.01, 'dropout_rate': 0.2}. Best is trial 131 with value: 0.00941323839442831.

1/3 [=========>....................] - ETA: 0s
3/3 [==============================] - 0s 3ms/step
[I 2024-09-27 20:00:47,722] Trial 198 finished with value: 0.010966545044536324 and parameters: {'window_size': 2, 'batch_size': 64, 'network_type': 'LSTM', 'num_layers': 1, 'num_neurons': 16, 'learning_rate': 0.01, 'dropout_rate': 0.1}. Best is trial 131 with value: 0.00941323839442831.

1/3 [=========>....................] - ETA: 0s
3/3 [==============================] - 0s 2ms/step
[I 2024-09-27 20:00:52,847] Trial 199 finished with value: 0.009738173857541152 and parameters: {'window_size': 2, 'batch_size': 32, 'network_type': 'LSTM', 'num_layers': 1, 'num_neurons': 128, 'learning_rate': 0.01, 'dropout_rate': 0.1}. Best is trial 131 with value: 0.00941323839442831.
C:\Users\user\AppData\Local\pypoetry\Cache\virtualenvs\transfer-learning-c0qmjA8b-py3.9\lib\site-packages\keras\src\engine\training.py:3103: UserWarning: You are saving your model as an HDF5 file via `model.save()`. This file format is considered legacy. We recommend using instead the native Keras format, e.g. `model.save('my_model.keras')`.
  saving_api.save_model(
Best parameters: {'window_size': 2, 'batch_size': 32, 'network_type': 'LSTM', 'num_layers': 1, 'num_neurons': 128, 'learning_rate': 0.01, 'dropout_rate': 0.1}

1/3 [=========>....................] - ETA: 0s
3/3 [==============================] - 0s 4ms/step
[I 2024-09-27 20:00:57,468] A new study created in memory with name: no-name-617f52f3-9767-4734-8a1e-68451e24b133

1/2 [==============>...............] - ETA: 0s
2/2 [==============================] - 0s 10ms/step
[I 2024-09-27 20:01:05,068] Trial 0 finished with value: 0.019802827871762768 and parameters: {'window_size': 2, 'batch_size': 32, 'network_type': 'RNN', 'num_layers': 3, 'num_neurons': 16, 'learning_rate': 0.01, 'dropout_rate': 0.1}. Best is trial 0 with value: 0.019802827871762768.

1/2 [==============>...............] - ETA: 0s
2/2 [==============================] - 1s 10ms/step
[I 2024-09-27 20:01:13,619] Trial 1 finished with value: 0.016270878204932566 and parameters: {'window_size': 2, 'batch_size': 16, 'network_type': 'RNN', 'num_layers': 3, 'num_neurons': 64, 'learning_rate': 0.0001, 'dropout_rate': 0.2}. Best is trial 1 with value: 0.016270878204932566.

1/2 [==============>...............] - ETA: 0s
2/2 [==============================] - 0s 3ms/step
[I 2024-09-27 20:01:19,751] Trial 2 finished with value: 0.02140534526873859 and parameters: {'window_size': 2, 'batch_size': 64, 'network_type': 'LSTM', 'num_layers': 2, 'num_neurons': 64, 'learning_rate': 0.01, 'dropout_rate': 0.3}. Best is trial 1 with value: 0.016270878204932566.

1/2 [==============>...............] - ETA: 0s
2/2 [==============================] - 0s 7ms/step
[I 2024-09-27 20:01:24,450] Trial 3 finished with value: 0.017338372298649356 and parameters: {'window_size': 6, 'batch_size': 32, 'network_type': 'RNN', 'num_layers': 1, 'num_neurons': 16, 'learning_rate': 0.01, 'dropout_rate': 0.3}. Best is trial 1 with value: 0.016270878204932566.

1/2 [==============>...............] - ETA: 0s
2/2 [==============================] - 0s 7ms/step
[I 2024-09-27 20:01:30,541] Trial 4 finished with value: 0.027281925459165846 and parameters: {'window_size': 4, 'batch_size': 64, 'network_type': 'LSTM', 'num_layers': 2, 'num_neurons': 128, 'learning_rate': 0.01, 'dropout_rate': 0.1}. Best is trial 1 with value: 0.016270878204932566.

1/2 [==============>...............] - ETA: 0s
2/2 [==============================] - 0s 3ms/step
[I 2024-09-27 20:01:35,586] Trial 5 finished with value: 0.013831976034702395 and parameters: {'window_size': 2, 'batch_size': 32, 'network_type': 'LSTM', 'num_layers': 1, 'num_neurons': 128, 'learning_rate': 0.01, 'dropout_rate': 0.3}. Best is trial 5 with value: 0.013831976034702395.

1/2 [==============>...............] - ETA: 0s
2/2 [==============================] - 1s 14ms/step
[I 2024-09-27 20:01:43,875] Trial 6 finished with value: 0.02582897784258865 and parameters: {'window_size': 4, 'batch_size': 32, 'network_type': 'RNN', 'num_layers': 3, 'num_neurons': 64, 'learning_rate': 0.0001, 'dropout_rate': 0.2}. Best is trial 5 with value: 0.013831976034702395.

1/2 [==============>...............] - ETA: 0s
2/2 [==============================] - 0s 3ms/step
[I 2024-09-27 20:01:47,627] Trial 7 finished with value: 0.019050482427751675 and parameters: {'window_size': 4, 'batch_size': 64, 'network_type': 'LSTM', 'num_layers': 1, 'num_neurons': 16, 'learning_rate': 0.01, 'dropout_rate': 0.1}. Best is trial 5 with value: 0.013831976034702395.

1/2 [==============>...............] - ETA: 0s
2/2 [==============================] - 0s 3ms/step
[I 2024-09-27 20:01:56,182] Trial 8 finished with value: 0.041604390731224634 and parameters: {'window_size': 2, 'batch_size': 32, 'network_type': 'RNN', 'num_layers': 1, 'num_neurons': 32, 'learning_rate': 0.0001, 'dropout_rate': 0.3}. Best is trial 5 with value: 0.013831976034702395.

1/2 [==============>...............] - ETA: 0s
2/2 [==============================] - 0s 8ms/step
[I 2024-09-27 20:01:59,884] Trial 9 finished with value: 0.016770040473422468 and parameters: {'window_size': 4, 'batch_size': 32, 'network_type': 'RNN', 'num_layers': 1, 'num_neurons': 16, 'learning_rate': 0.01, 'dropout_rate': 0.2}. Best is trial 5 with value: 0.013831976034702395.

1/2 [==============>...............] - ETA: 0s
2/2 [==============================] - 0s 6ms/step
[I 2024-09-27 20:02:05,439] Trial 10 finished with value: 0.015063775702885224 and parameters: {'window_size': 6, 'batch_size': 16, 'network_type': 'GRU', 'num_layers': 1, 'num_neurons': 128, 'learning_rate': 0.01, 'dropout_rate': 0.3}. Best is trial 5 with value: 0.013831976034702395.

1/2 [==============>...............] - ETA: 0s
2/2 [==============================] - 0s 4ms/step
[I 2024-09-27 20:02:11,060] Trial 11 finished with value: 0.02085397441046576 and parameters: {'window_size': 6, 'batch_size': 16, 'network_type': 'GRU', 'num_layers': 1, 'num_neurons': 128, 'learning_rate': 0.01, 'dropout_rate': 0.3}. Best is trial 5 with value: 0.013831976034702395.

1/2 [==============>...............] - ETA: 0s
2/2 [==============================] - 0s 5ms/step
[I 2024-09-27 20:02:16,333] Trial 12 finished with value: 0.01622671008791243 and parameters: {'window_size': 6, 'batch_size': 16, 'network_type': 'GRU', 'num_layers': 1, 'num_neurons': 128, 'learning_rate': 0.01, 'dropout_rate': 0.3}. Best is trial 5 with value: 0.013831976034702395.

1/2 [==============>...............] - ETA: 0s
2/2 [==============================] - 0s 3ms/step
[I 2024-09-27 20:02:21,516] Trial 13 finished with value: 0.02032292338779992 and parameters: {'window_size': 6, 'batch_size': 16, 'network_type': 'GRU', 'num_layers': 1, 'num_neurons': 128, 'learning_rate': 0.01, 'dropout_rate': 0.3}. Best is trial 5 with value: 0.013831976034702395.

1/2 [==============>...............] - ETA: 0s
2/2 [==============================] - 0s 5ms/step
[I 2024-09-27 20:02:28,421] Trial 14 finished with value: 0.013506183992113379 and parameters: {'window_size': 6, 'batch_size': 16, 'network_type': 'GRU', 'num_layers': 1, 'num_neurons': 128, 'learning_rate': 0.01, 'dropout_rate': 0.3}. Best is trial 14 with value: 0.013506183992113379.

1/2 [==============>...............] - ETA: 0s
2/2 [==============================] - 0s 5ms/step
[I 2024-09-27 20:02:35,373] Trial 15 finished with value: 0.014342856578337835 and parameters: {'window_size': 2, 'batch_size': 32, 'network_type': 'LSTM', 'num_layers': 2, 'num_neurons': 32, 'learning_rate': 0.01, 'dropout_rate': 0.3}. Best is trial 14 with value: 0.013506183992113379.

1/2 [==============>...............] - ETA: 0s
2/2 [==============================] - 0s 6ms/step
[I 2024-09-27 20:02:44,925] Trial 16 finished with value: 0.04284685506820676 and parameters: {'window_size': 6, 'batch_size': 16, 'network_type': 'LSTM', 'num_layers': 1, 'num_neurons': 128, 'learning_rate': 0.01, 'dropout_rate': 0.3}. Best is trial 14 with value: 0.013506183992113379.

1/2 [==============>...............] - ETA: 0s
2/2 [==============================] - 0s 3ms/step
[I 2024-09-27 20:02:50,768] Trial 17 finished with value: 0.016243532180786113 and parameters: {'window_size': 2, 'batch_size': 16, 'network_type': 'GRU', 'num_layers': 1, 'num_neurons': 128, 'learning_rate': 0.01, 'dropout_rate': 0.3}. Best is trial 14 with value: 0.013506183992113379.

1/2 [==============>...............] - ETA: 0s
2/2 [==============================] - 1s 11ms/step
[I 2024-09-27 20:03:01,632] Trial 18 finished with value: 0.022021467617579844 and parameters: {'window_size': 6, 'batch_size': 32, 'network_type': 'GRU', 'num_layers': 2, 'num_neurons': 128, 'learning_rate': 0.01, 'dropout_rate': 0.1}. Best is trial 14 with value: 0.013506183992113379.

1/2 [==============>...............] - ETA: 3s
2/2 [==============================] - 4s 11ms/step
[I 2024-09-27 20:03:14,397] Trial 19 finished with value: 0.01468046780121632 and parameters: {'window_size': 2, 'batch_size': 64, 'network_type': 'LSTM', 'num_layers': 3, 'num_neurons': 32, 'learning_rate': 0.01, 'dropout_rate': 0.2}. Best is trial 14 with value: 0.013506183992113379.

1/2 [==============>...............] - ETA: 0s
2/2 [==============================] - 0s 4ms/step
[I 2024-09-27 20:03:24,030] Trial 20 finished with value: 0.015615254715510783 and parameters: {'window_size': 6, 'batch_size': 32, 'network_type': 'GRU', 'num_layers': 1, 'num_neurons': 128, 'learning_rate': 0.01, 'dropout_rate': 0.3}. Best is trial 14 with value: 0.013506183992113379.

1/2 [==============>...............] - ETA: 0s
2/2 [==============================] - 0s 3ms/step
[I 2024-09-27 20:03:31,710] Trial 21 finished with value: 0.014526376161819857 and parameters: {'window_size': 2, 'batch_size': 32, 'network_type': 'LSTM', 'num_layers': 2, 'num_neurons': 32, 'learning_rate': 0.01, 'dropout_rate': 0.3}. Best is trial 14 with value: 0.013506183992113379.

1/2 [==============>...............] - ETA: 0s
2/2 [==============================] - 0s 11ms/step
[I 2024-09-27 20:03:38,698] Trial 22 finished with value: 0.014296792825063078 and parameters: {'window_size': 2, 'batch_size': 32, 'network_type': 'LSTM', 'num_layers': 2, 'num_neurons': 32, 'learning_rate': 0.01, 'dropout_rate': 0.3}. Best is trial 14 with value: 0.013506183992113379.

1/2 [==============>...............] - ETA: 0s
2/2 [==============================] - 0s 3ms/step
[I 2024-09-27 20:03:44,849] Trial 23 finished with value: 0.013799126380529155 and parameters: {'window_size': 2, 'batch_size': 32, 'network_type': 'LSTM', 'num_layers': 2, 'num_neurons': 32, 'learning_rate': 0.01, 'dropout_rate': 0.3}. Best is trial 14 with value: 0.013506183992113379.

1/2 [==============>...............] - ETA: 0s
2/2 [==============================] - 0s 3ms/step
[I 2024-09-27 20:03:51,351] Trial 24 finished with value: 0.013423384385231208 and parameters: {'window_size': 2, 'batch_size': 32, 'network_type': 'LSTM', 'num_layers': 2, 'num_neurons': 32, 'learning_rate': 0.01, 'dropout_rate': 0.3}. Best is trial 24 with value: 0.013423384385231208.

1/2 [==============>...............] - ETA: 0s
2/2 [==============================] - 1s 5ms/step
[I 2024-09-27 20:04:01,136] Trial 25 finished with value: 0.014423400732187109 and parameters: {'window_size': 2, 'batch_size': 16, 'network_type': 'LSTM', 'num_layers': 2, 'num_neurons': 32, 'learning_rate': 0.01, 'dropout_rate': 0.3}. Best is trial 24 with value: 0.013423384385231208.

1/2 [==============>...............] - ETA: 0s
2/2 [==============================] - 0s 3ms/step
[I 2024-09-27 20:04:10,073] Trial 26 finished with value: 0.015054625254410968 and parameters: {'window_size': 2, 'batch_size': 32, 'network_type': 'LSTM', 'num_layers': 2, 'num_neurons': 32, 'learning_rate': 0.01, 'dropout_rate': 0.3}. Best is trial 24 with value: 0.013423384385231208.

1/2 [==============>...............] - ETA: 0s
2/2 [==============================] - 0s 6ms/step
[I 2024-09-27 20:04:16,491] Trial 27 finished with value: 0.015193224002153442 and parameters: {'window_size': 2, 'batch_size': 32, 'network_type': 'GRU', 'num_layers': 2, 'num_neurons': 32, 'learning_rate': 0.01, 'dropout_rate': 0.3}. Best is trial 24 with value: 0.013423384385231208.

1/2 [==============>...............] - ETA: 0s
2/2 [==============================] - 0s 7ms/step
[I 2024-09-27 20:04:23,039] Trial 28 finished with value: 0.016481029265635702 and parameters: {'window_size': 4, 'batch_size': 64, 'network_type': 'LSTM', 'num_layers': 2, 'num_neurons': 32, 'learning_rate': 0.01, 'dropout_rate': 0.1}. Best is trial 24 with value: 0.013423384385231208.

1/2 [==============>...............] - ETA: 0s
2/2 [==============================] - 1s 6ms/step
[I 2024-09-27 20:04:32,464] Trial 29 finished with value: 0.03507201085771834 and parameters: {'window_size': 6, 'batch_size': 16, 'network_type': 'GRU', 'num_layers': 3, 'num_neurons': 32, 'learning_rate': 0.01, 'dropout_rate': 0.2}. Best is trial 24 with value: 0.013423384385231208.

1/2 [==============>...............] - ETA: 0s
2/2 [==============================] - 0s 13ms/step
[I 2024-09-27 20:04:39,481] Trial 30 finished with value: 0.01623986258873571 and parameters: {'window_size': 2, 'batch_size': 32, 'network_type': 'LSTM', 'num_layers': 2, 'num_neurons': 64, 'learning_rate': 0.01, 'dropout_rate': 0.1}. Best is trial 24 with value: 0.013423384385231208.

1/2 [==============>...............] - ETA: 0s
2/2 [==============================] - 0s 3ms/step
[I 2024-09-27 20:04:44,542] Trial 31 finished with value: 0.013937794538644636 and parameters: {'window_size': 2, 'batch_size': 32, 'network_type': 'LSTM', 'num_layers': 1, 'num_neurons': 128, 'learning_rate': 0.01, 'dropout_rate': 0.3}. Best is trial 24 with value: 0.013423384385231208.

1/2 [==============>...............] - ETA: 0s
2/2 [==============================] - 1s 8ms/step
[I 2024-09-27 20:04:53,204] Trial 32 finished with value: 0.014909728869413717 and parameters: {'window_size': 2, 'batch_size': 32, 'network_type': 'LSTM', 'num_layers': 3, 'num_neurons': 16, 'learning_rate': 0.01, 'dropout_rate': 0.3}. Best is trial 24 with value: 0.013423384385231208.

1/2 [==============>...............] - ETA: 0s
2/2 [==============================] - 1s 16ms/step
[I 2024-09-27 20:05:03,123] Trial 33 finished with value: 0.01322751606427706 and parameters: {'window_size': 2, 'batch_size': 32, 'network_type': 'LSTM', 'num_layers': 2, 'num_neurons': 64, 'learning_rate': 0.01, 'dropout_rate': 0.3}. Best is trial 33 with value: 0.01322751606427706.

1/2 [==============>...............] - ETA: 0s
2/2 [==============================] - 0s 6ms/step
[I 2024-09-27 20:05:15,177] Trial 34 finished with value: 0.013838777224222816 and parameters: {'window_size': 2, 'batch_size': 32, 'network_type': 'LSTM', 'num_layers': 2, 'num_neurons': 64, 'learning_rate': 0.01, 'dropout_rate': 0.3}. Best is trial 33 with value: 0.01322751606427706.

1/2 [==============>...............] - ETA: 0s
2/2 [==============================] - 0s 11ms/step
[I 2024-09-27 20:05:27,123] Trial 35 finished with value: 0.017549311503385862 and parameters: {'window_size': 2, 'batch_size': 32, 'network_type': 'LSTM', 'num_layers': 2, 'num_neurons': 64, 'learning_rate': 0.0001, 'dropout_rate': 0.3}. Best is trial 33 with value: 0.01322751606427706.

1/2 [==============>...............] - ETA: 0s
2/2 [==============================] - 0s 9ms/step
