[I 2024-09-27 22:16:32,952] Trial 188 finished with value: 0.02338833404438837 and parameters: {'window_size': 2, 'batch_size': 32, 'network_type': 'RNN', 'num_layers': 1, 'num_neurons': 64, 'learning_rate': 0.01, 'dropout_rate': 0.1}. Best is trial 129 with value: 0.015391002348491131.

1/2 [==============>...............] - ETA: 0s
2/2 [==============================] - 0s 7ms/step
[I 2024-09-27 22:16:37,672] Trial 189 finished with value: 0.046253078781641456 and parameters: {'window_size': 6, 'batch_size': 32, 'network_type': 'RNN', 'num_layers': 1, 'num_neurons': 64, 'learning_rate': 0.01, 'dropout_rate': 0.1}. Best is trial 129 with value: 0.015391002348491131.

1/2 [==============>...............] - ETA: 0s
2/2 [==============================] - 1s 16ms/step
[I 2024-09-27 22:16:45,875] Trial 190 finished with value: 0.048367175994095984 and parameters: {'window_size': 4, 'batch_size': 32, 'network_type': 'RNN', 'num_layers': 2, 'num_neurons': 16, 'learning_rate': 0.01, 'dropout_rate': 0.1}. Best is trial 129 with value: 0.015391002348491131.

1/2 [==============>...............] - ETA: 0s
2/2 [==============================] - 0s 0s/step
[I 2024-09-27 22:16:50,139] Trial 191 finished with value: 0.03021302855014802 and parameters: {'window_size': 2, 'batch_size': 32, 'network_type': 'RNN', 'num_layers': 1, 'num_neurons': 16, 'learning_rate': 0.01, 'dropout_rate': 0.1}. Best is trial 129 with value: 0.015391002348491131.

1/2 [==============>...............] - ETA: 0s
2/2 [==============================] - 0s 0s/step
[I 2024-09-27 22:16:54,443] Trial 192 finished with value: 0.018407285886151457 and parameters: {'window_size': 2, 'batch_size': 32, 'network_type': 'RNN', 'num_layers': 1, 'num_neurons': 16, 'learning_rate': 0.01, 'dropout_rate': 0.1}. Best is trial 129 with value: 0.015391002348491131.

1/2 [==============>...............] - ETA: 0s
2/2 [==============================] - 0s 0s/step
[I 2024-09-27 22:16:58,553] Trial 193 finished with value: 0.022987269631453932 and parameters: {'window_size': 2, 'batch_size': 32, 'network_type': 'RNN', 'num_layers': 1, 'num_neurons': 16, 'learning_rate': 0.01, 'dropout_rate': 0.1}. Best is trial 129 with value: 0.015391002348491131.

1/2 [==============>...............] - ETA: 0s
2/2 [==============================] - 0s 0s/step
[I 2024-09-27 22:17:02,757] Trial 194 finished with value: 0.019409140527248393 and parameters: {'window_size': 2, 'batch_size': 32, 'network_type': 'RNN', 'num_layers': 1, 'num_neurons': 16, 'learning_rate': 0.01, 'dropout_rate': 0.1}. Best is trial 129 with value: 0.015391002348491131.

1/2 [==============>...............] - ETA: 0s
2/2 [==============================] - 0s 0s/step
[I 2024-09-27 22:17:06,829] Trial 195 finished with value: 0.025480523765087137 and parameters: {'window_size': 2, 'batch_size': 32, 'network_type': 'RNN', 'num_layers': 1, 'num_neurons': 16, 'learning_rate': 0.01, 'dropout_rate': 0.1}. Best is trial 129 with value: 0.015391002348491131.

1/2 [==============>...............] - ETA: 0s
2/2 [==============================] - 0s 0s/step
[I 2024-09-27 22:17:10,006] Trial 196 finished with value: 0.032038579804556724 and parameters: {'window_size': 2, 'batch_size': 32, 'network_type': 'RNN', 'num_layers': 1, 'num_neurons': 16, 'learning_rate': 0.01, 'dropout_rate': 0.1}. Best is trial 129 with value: 0.015391002348491131.

1/2 [==============>...............] - ETA: 0s
2/2 [==============================] - 0s 0s/step
[I 2024-09-27 22:17:13,830] Trial 197 finished with value: 0.017215750915663592 and parameters: {'window_size': 2, 'batch_size': 32, 'network_type': 'RNN', 'num_layers': 1, 'num_neurons': 16, 'learning_rate': 0.01, 'dropout_rate': 0.1}. Best is trial 129 with value: 0.015391002348491131.

1/2 [==============>...............] - ETA: 0s
2/2 [==============================] - 0s 0s/step
[I 2024-09-27 22:17:19,417] Trial 198 finished with value: 0.02419454700606211 and parameters: {'window_size': 2, 'batch_size': 32, 'network_type': 'RNN', 'num_layers': 1, 'num_neurons': 16, 'learning_rate': 0.01, 'dropout_rate': 0.3}. Best is trial 129 with value: 0.015391002348491131.

1/2 [==============>...............] - ETA: 0s
2/2 [==============================] - 0s 0s/step
[I 2024-09-27 22:17:25,360] Trial 199 finished with value: 0.027749919048377456 and parameters: {'window_size': 2, 'batch_size': 32, 'network_type': 'GRU', 'num_layers': 1, 'num_neurons': 16, 'learning_rate': 0.01, 'dropout_rate': 0.1}. Best is trial 129 with value: 0.015391002348491131.
C:\Users\user\AppData\Local\pypoetry\Cache\virtualenvs\transfer-learning-c0qmjA8b-py3.9\lib\site-packages\keras\src\engine\training.py:3103: UserWarning: You are saving your model as an HDF5 file via `model.save()`. This file format is considered legacy. We recommend using instead the native Keras format, e.g. `model.save('my_model.keras')`.
  saving_api.save_model(
Best parameters: {'window_size': 2, 'batch_size': 32, 'network_type': 'RNN', 'num_layers': 1, 'num_neurons': 64, 'learning_rate': 0.01, 'dropout_rate': 0.1}

1/2 [==============>...............] - ETA: 0s
2/2 [==============================] - 0s 0s/step
[I 2024-09-27 22:17:29,793] A new study created in memory with name: no-name-62981462-c79d-4136-bb00-fbe779776041
Training small models

1/1 [==============================] - ETA: 0s
1/1 [==============================] - 0s 281ms/step
[I 2024-09-27 22:17:35,881] Trial 0 finished with value: 0.0338728046417236 and parameters: {'window_size': 6, 'batch_size': 16, 'network_type': 'LSTM', 'num_layers': 1, 'num_neurons': 64, 'learning_rate': 0.01, 'dropout_rate': 0.3}. Best is trial 0 with value: 0.0338728046417236.

1/1 [==============================] - ETA: 0s
1/1 [==============================] - 0s 263ms/step
[I 2024-09-27 22:17:40,620] Trial 1 finished with value: 0.04568116818941554 and parameters: {'window_size': 2, 'batch_size': 16, 'network_type': 'GRU', 'num_layers': 1, 'num_neurons': 64, 'learning_rate': 0.01, 'dropout_rate': 0.2}. Best is trial 0 with value: 0.0338728046417236.

1/1 [==============================] - ETA: 0s
1/1 [==============================] - 1s 532ms/step
[I 2024-09-27 22:17:46,835] Trial 2 finished with value: 0.0563582875993517 and parameters: {'window_size': 6, 'batch_size': 64, 'network_type': 'LSTM', 'num_layers': 2, 'num_neurons': 128, 'learning_rate': 0.01, 'dropout_rate': 0.3}. Best is trial 0 with value: 0.0338728046417236.

1/1 [==============================] - ETA: 0s
1/1 [==============================] - 0s 269ms/step
[I 2024-09-27 22:17:50,896] Trial 3 finished with value: 0.024029834227128444 and parameters: {'window_size': 4, 'batch_size': 32, 'network_type': 'GRU', 'num_layers': 1, 'num_neurons': 128, 'learning_rate': 0.01, 'dropout_rate': 0.3}. Best is trial 3 with value: 0.024029834227128444.

1/1 [==============================] - ETA: 0s
1/1 [==============================] - 0s 248ms/step
[I 2024-09-27 22:18:01,015] Trial 4 finished with value: 0.01595499293009439 and parameters: {'window_size': 6, 'batch_size': 64, 'network_type': 'GRU', 'num_layers': 1, 'num_neurons': 128, 'learning_rate': 0.0001, 'dropout_rate': 0.2}. Best is trial 4 with value: 0.01595499293009439.

1/1 [==============================] - ETA: 0s
1/1 [==============================] - 0s 383ms/step
[I 2024-09-27 22:18:09,800] Trial 5 finished with value: 0.03199693100269027 and parameters: {'window_size': 2, 'batch_size': 32, 'network_type': 'RNN', 'num_layers': 2, 'num_neurons': 64, 'learning_rate': 0.0001, 'dropout_rate': 0.1}. Best is trial 4 with value: 0.01595499293009439.

1/1 [==============================] - ETA: 0s
1/1 [==============================] - 0s 263ms/step
[I 2024-09-27 22:18:13,409] Trial 6 finished with value: 0.034996577116159264 and parameters: {'window_size': 2, 'batch_size': 16, 'network_type': 'RNN', 'num_layers': 1, 'num_neurons': 64, 'learning_rate': 0.01, 'dropout_rate': 0.3}. Best is trial 4 with value: 0.01595499293009439.

1/1 [==============================] - ETA: 0s
1/1 [==============================] - 0s 201ms/step
[I 2024-09-27 22:18:21,213] Trial 7 finished with value: 0.021115942868319436 and parameters: {'window_size': 4, 'batch_size': 32, 'network_type': 'RNN', 'num_layers': 1, 'num_neurons': 16, 'learning_rate': 0.0001, 'dropout_rate': 0.2}. Best is trial 4 with value: 0.01595499293009439.

1/1 [==============================] - ETA: 0s
1/1 [==============================] - 0s 228ms/step
[I 2024-09-27 22:18:26,495] Trial 8 finished with value: 0.027132883601718442 and parameters: {'window_size': 6, 'batch_size': 32, 'network_type': 'LSTM', 'num_layers': 1, 'num_neurons': 16, 'learning_rate': 0.01, 'dropout_rate': 0.3}. Best is trial 4 with value: 0.01595499293009439.

1/1 [==============================] - ETA: 0s
1/1 [==============================] - 0s 310ms/step
[I 2024-09-27 22:18:29,975] Trial 9 finished with value: 0.016634857495625828 and parameters: {'window_size': 6, 'batch_size': 64, 'network_type': 'RNN', 'num_layers': 1, 'num_neurons': 128, 'learning_rate': 0.01, 'dropout_rate': 0.2}. Best is trial 4 with value: 0.01595499293009439.

1/1 [==============================] - ETA: 0s
1/1 [==============================] - 1s 642ms/step
[I 2024-09-27 22:18:39,601] Trial 10 finished with value: 0.04176398022969563 and parameters: {'window_size': 6, 'batch_size': 64, 'network_type': 'GRU', 'num_layers': 3, 'num_neurons': 32, 'learning_rate': 0.01, 'dropout_rate': 0.1}. Best is trial 4 with value: 0.01595499293009439.

1/1 [==============================] - ETA: 0s
1/1 [==============================] - 1s 517ms/step
[I 2024-09-27 22:18:45,771] Trial 11 finished with value: 0.021879782994588187 and parameters: {'window_size': 6, 'batch_size': 64, 'network_type': 'RNN', 'num_layers': 3, 'num_neurons': 128, 'learning_rate': 0.01, 'dropout_rate': 0.2}. Best is trial 4 with value: 0.01595499293009439.

1/1 [==============================] - ETA: 0s
1/1 [==============================] - 0s 348ms/step
[I 2024-09-27 22:18:50,223] Trial 12 finished with value: 0.0152320555580987 and parameters: {'window_size': 6, 'batch_size': 64, 'network_type': 'GRU', 'num_layers': 1, 'num_neurons': 128, 'learning_rate': 0.01, 'dropout_rate': 0.2}. Best is trial 12 with value: 0.0152320555580987.

1/1 [==============================] - ETA: 0s
1/1 [==============================] - 0s 332ms/step
[I 2024-09-27 22:18:57,547] Trial 13 finished with value: 0.019238177299499466 and parameters: {'window_size': 6, 'batch_size': 64, 'network_type': 'GRU', 'num_layers': 1, 'num_neurons': 128, 'learning_rate': 0.01, 'dropout_rate': 0.2}. Best is trial 12 with value: 0.0152320555580987.

1/1 [==============================] - ETA: 0s
1/1 [==============================] - 0s 489ms/step
[I 2024-09-27 22:19:06,609] Trial 14 finished with value: 0.10366273689270017 and parameters: {'window_size': 6, 'batch_size': 64, 'network_type': 'GRU', 'num_layers': 3, 'num_neurons': 32, 'learning_rate': 0.01, 'dropout_rate': 0.2}. Best is trial 12 with value: 0.0152320555580987.

1/1 [==============================] - ETA: 0s
1/1 [==============================] - 0s 433ms/step
[I 2024-09-27 22:19:13,385] Trial 15 finished with value: 0.021659793420271415 and parameters: {'window_size': 4, 'batch_size': 64, 'network_type': 'GRU', 'num_layers': 2, 'num_neurons': 128, 'learning_rate': 0.01, 'dropout_rate': 0.2}. Best is trial 12 with value: 0.0152320555580987.

1/1 [==============================] - ETA: 0s
1/1 [==============================] - 0s 247ms/step
[I 2024-09-27 22:19:16,987] Trial 16 finished with value: 0.014720902231004493 and parameters: {'window_size': 6, 'batch_size': 64, 'network_type': 'GRU', 'num_layers': 1, 'num_neurons': 128, 'learning_rate': 0.01, 'dropout_rate': 0.1}. Best is trial 16 with value: 0.014720902231004493.

1/1 [==============================] - ETA: 0s
1/1 [==============================] - 0s 241ms/step
[I 2024-09-27 22:19:20,573] Trial 17 finished with value: 0.014988791995578331 and parameters: {'window_size': 6, 'batch_size': 64, 'network_type': 'GRU', 'num_layers': 1, 'num_neurons': 128, 'learning_rate': 0.01, 'dropout_rate': 0.1}. Best is trial 16 with value: 0.014720902231004493.

1/1 [==============================] - ETA: 0s
1/1 [==============================] - 1s 502ms/step
[I 2024-09-27 22:19:27,848] Trial 18 finished with value: 0.03958939430930397 and parameters: {'window_size': 4, 'batch_size': 64, 'network_type': 'GRU', 'num_layers': 3, 'num_neurons': 16, 'learning_rate': 0.01, 'dropout_rate': 0.1}. Best is trial 16 with value: 0.014720902231004493.

1/1 [==============================] - ETA: 0s
1/1 [==============================] - 0s 423ms/step
[I 2024-09-27 22:19:33,813] Trial 19 finished with value: 0.044427710826580376 and parameters: {'window_size': 2, 'batch_size': 16, 'network_type': 'GRU', 'num_layers': 2, 'num_neurons': 32, 'learning_rate': 0.01, 'dropout_rate': 0.1}. Best is trial 16 with value: 0.014720902231004493.

1/1 [==============================] - ETA: 0s
1/1 [==============================] - 0s 301ms/step
[I 2024-09-27 22:19:36,901] Trial 20 finished with value: 0.02267712603674996 and parameters: {'window_size': 6, 'batch_size': 64, 'network_type': 'LSTM', 'num_layers': 1, 'num_neurons': 128, 'learning_rate': 0.01, 'dropout_rate': 0.1}. Best is trial 16 with value: 0.014720902231004493.

1/1 [==============================] - ETA: 0s
1/1 [==============================] - 0s 201ms/step
[I 2024-09-27 22:19:40,789] Trial 21 finished with value: 0.016522590425279385 and parameters: {'window_size': 6, 'batch_size': 64, 'network_type': 'GRU', 'num_layers': 1, 'num_neurons': 128, 'learning_rate': 0.01, 'dropout_rate': 0.1}. Best is trial 16 with value: 0.014720902231004493.

1/1 [==============================] - ETA: 0s
1/1 [==============================] - 0s 201ms/step
[I 2024-09-27 22:19:43,883] Trial 22 finished with value: 0.026205978393554652 and parameters: {'window_size': 6, 'batch_size': 64, 'network_type': 'GRU', 'num_layers': 1, 'num_neurons': 128, 'learning_rate': 0.01, 'dropout_rate': 0.1}. Best is trial 16 with value: 0.014720902231004493.

1/1 [==============================] - ETA: 0s
1/1 [==============================] - 1s 673ms/step
[I 2024-09-27 22:19:48,342] Trial 23 finished with value: 0.02134191290537515 and parameters: {'window_size': 6, 'batch_size': 64, 'network_type': 'GRU', 'num_layers': 1, 'num_neurons': 128, 'learning_rate': 0.01, 'dropout_rate': 0.1}. Best is trial 16 with value: 0.014720902231004493.

1/1 [==============================] - ETA: 0s
1/1 [==============================] - 0s 238ms/step
[I 2024-09-27 22:19:53,364] Trial 24 finished with value: 0.01445588673485649 and parameters: {'window_size': 6, 'batch_size': 64, 'network_type': 'GRU', 'num_layers': 1, 'num_neurons': 128, 'learning_rate': 0.01, 'dropout_rate': 0.1}. Best is trial 24 with value: 0.01445588673485649.

1/1 [==============================] - ETA: 0s
1/1 [==============================] - 0s 201ms/step
[I 2024-09-27 22:19:56,390] Trial 25 finished with value: 0.019876671791076647 and parameters: {'window_size': 6, 'batch_size': 64, 'network_type': 'GRU', 'num_layers': 1, 'num_neurons': 128, 'learning_rate': 0.01, 'dropout_rate': 0.1}. Best is trial 24 with value: 0.01445588673485649.

1/1 [==============================] - ETA: 0s
1/1 [==============================] - 0s 232ms/step
[I 2024-09-27 22:19:59,948] Trial 26 finished with value: 0.028678228484259667 and parameters: {'window_size': 6, 'batch_size': 64, 'network_type': 'GRU', 'num_layers': 1, 'num_neurons': 128, 'learning_rate': 0.01, 'dropout_rate': 0.1}. Best is trial 24 with value: 0.01445588673485649.

1/1 [==============================] - ETA: 0s
1/1 [==============================] - 0s 433ms/step
[I 2024-09-27 22:20:05,950] Trial 27 finished with value: 0.02412497435675724 and parameters: {'window_size': 6, 'batch_size': 64, 'network_type': 'GRU', 'num_layers': 1, 'num_neurons': 16, 'learning_rate': 0.01, 'dropout_rate': 0.1}. Best is trial 24 with value: 0.01445588673485649.

1/1 [==============================] - ETA: 0s
1/1 [==============================] - 1s 564ms/step
[I 2024-09-27 22:20:14,901] Trial 28 finished with value: 0.03891334346624523 and parameters: {'window_size': 2, 'batch_size': 32, 'network_type': 'GRU', 'num_layers': 3, 'num_neurons': 32, 'learning_rate': 0.01, 'dropout_rate': 0.1}. Best is trial 24 with value: 0.01445588673485649.

1/1 [==============================] - ETA: 0s
1/1 [==============================] - 1s 503ms/step
[I 2024-09-27 22:20:21,173] Trial 29 finished with value: 0.03645701269669963 and parameters: {'window_size': 4, 'batch_size': 16, 'network_type': 'LSTM', 'num_layers': 2, 'num_neurons': 64, 'learning_rate': 0.01, 'dropout_rate': 0.1}. Best is trial 24 with value: 0.01445588673485649.

1/1 [==============================] - ETA: 0s
1/1 [==============================] - 0s 247ms/step
[I 2024-09-27 22:20:24,731] Trial 30 finished with value: 0.028741279284159333 and parameters: {'window_size': 6, 'batch_size': 16, 'network_type': 'LSTM', 'num_layers': 1, 'num_neurons': 128, 'learning_rate': 0.01, 'dropout_rate': 0.1}. Best is trial 24 with value: 0.01445588673485649.

1/1 [==============================] - ETA: 0s
1/1 [==============================] - 0s 342ms/step
[I 2024-09-27 22:20:28,226] Trial 31 finished with value: 0.016060851520962198 and parameters: {'window_size': 6, 'batch_size': 64, 'network_type': 'GRU', 'num_layers': 1, 'num_neurons': 128, 'learning_rate': 0.01, 'dropout_rate': 0.1}. Best is trial 24 with value: 0.01445588673485649.

1/1 [==============================] - ETA: 0s
1/1 [==============================] - 0s 232ms/step
[I 2024-09-27 22:20:31,737] Trial 32 finished with value: 0.030516904195149703 and parameters: {'window_size': 6, 'batch_size': 64, 'network_type': 'GRU', 'num_layers': 1, 'num_neurons': 128, 'learning_rate': 0.01, 'dropout_rate': 0.1}. Best is trial 24 with value: 0.01445588673485649.

1/1 [==============================] - ETA: 0s
1/1 [==============================] - 0s 247ms/step
[I 2024-09-27 22:20:35,080] Trial 33 finished with value: 0.01432214715745713 and parameters: {'window_size': 6, 'batch_size': 64, 'network_type': 'GRU', 'num_layers': 1, 'num_neurons': 128, 'learning_rate': 0.01, 'dropout_rate': 0.2}. Best is trial 33 with value: 0.01432214715745713.

1/1 [==============================] - ETA: 0s
1/1 [==============================] - 0s 232ms/step
[I 2024-09-27 22:20:40,201] Trial 34 finished with value: 0.018097211943732323 and parameters: {'window_size': 6, 'batch_size': 64, 'network_type': 'GRU', 'num_layers': 1, 'num_neurons': 128, 'learning_rate': 0.01, 'dropout_rate': 0.3}. Best is trial 33 with value: 0.01432214715745713.

1/1 [==============================] - ETA: 0s
1/1 [==============================] - 1s 508ms/step
[I 2024-09-27 22:20:46,937] Trial 35 finished with value: 0.01643416203392878 and parameters: {'window_size': 6, 'batch_size': 64, 'network_type': 'GRU', 'num_layers': 1, 'num_neurons': 128, 'learning_rate': 0.01, 'dropout_rate': 0.2}. Best is trial 33 with value: 0.01432214715745713.

1/1 [==============================] - ETA: 0s
1/1 [==============================] - 0s 231ms/step
[I 2024-09-27 22:20:52,118] Trial 36 finished with value: 0.03524660983452431 and parameters: {'window_size': 2, 'batch_size': 64, 'network_type': 'GRU', 'num_layers': 1, 'num_neurons': 64, 'learning_rate': 0.01, 'dropout_rate': 0.3}. Best is trial 33 with value: 0.01432214715745713.

1/1 [==============================] - ETA: 0s
1/1 [==============================] - 0s 486ms/step
[I 2024-09-27 22:21:03,716] Trial 37 finished with value: 0.03738115564982092 and parameters: {'window_size': 6, 'batch_size': 16, 'network_type': 'GRU', 'num_layers': 2, 'num_neurons': 128, 'learning_rate': 0.01, 'dropout_rate': 0.1}. Best is trial 33 with value: 0.01432214715745713.

1/1 [==============================] - ETA: 0s
1/1 [==============================] - 0s 225ms/step
[I 2024-09-27 22:21:07,721] Trial 38 finished with value: 0.025099049308083276 and parameters: {'window_size': 4, 'batch_size': 32, 'network_type': 'RNN', 'num_layers': 1, 'num_neurons': 128, 'learning_rate': 0.01, 'dropout_rate': 0.1}. Best is trial 33 with value: 0.01432214715745713.

1/1 [==============================] - ETA: 0s
1/1 [==============================] - 0s 252ms/step
[I 2024-09-27 22:21:11,726] Trial 39 finished with value: 0.0235083033243815 and parameters: {'window_size': 6, 'batch_size': 64, 'network_type': 'LSTM', 'num_layers': 1, 'num_neurons': 64, 'learning_rate': 0.01, 'dropout_rate': 0.3}. Best is trial 33 with value: 0.01432214715745713.

1/1 [==============================] - ETA: 0s
1/1 [==============================] - 0s 248ms/step
[I 2024-09-27 22:21:16,007] Trial 40 finished with value: 0.03916823269770694 and parameters: {'window_size': 2, 'batch_size': 32, 'network_type': 'GRU', 'num_layers': 1, 'num_neurons': 16, 'learning_rate': 0.01, 'dropout_rate': 0.2}. Best is trial 33 with value: 0.01432214715745713.

1/1 [==============================] - ETA: 0s
1/1 [==============================] - 0s 200ms/step
[I 2024-09-27 22:21:19,164] Trial 41 finished with value: 0.013343700938754624 and parameters: {'window_size': 6, 'batch_size': 64, 'network_type': 'GRU', 'num_layers': 1, 'num_neurons': 128, 'learning_rate': 0.01, 'dropout_rate': 0.2}. Best is trial 41 with value: 0.013343700938754624.

1/1 [==============================] - ETA: 0s
1/1 [==============================] - 0s 200ms/step
