[I 2024-09-27 23:07:41,087] Trial 154 finished with value: 0.21972453985716167 and parameters: {'window_size': 2, 'batch_size': 64, 'network_type': 'RNN', 'num_layers': 1, 'num_neurons': 16, 'learning_rate': 0.01, 'dropout_rate': 0.1}. Best is trial 114 with value: 0.08357412559107731.
2024-09-27 23:07:42.362253: W tensorflow/core/grappler/utils/graph_view.cc:849] No registered '' OpKernel for CPU devices compatible with node {{node sequential_1964/simple_rnn_1218/while/body/_1/sequential_1964/simple_rnn_1218/while/simple_rnn_cell/Relu}}
	.  Registered:  <no registered kernels>

2024-09-27 23:07:42.399653: E tensorflow/core/grappler/optimizers/tfg_optimizer_hook.cc:135] tfg_optimizer{any(tfg-consolidate-attrs,tfg-toposort,tfg-shape-inference{graph-version=0},tfg-prepare-attrs-export)} failed: INVALID_ARGUMENT: Node sequential_1964/simple_rnn_1218/while/body/_1/sequential_1964/simple_rnn_1218/while/simple_rnn_cell/Relu has an empty op name
	when importing GraphDef to MLIR module in GrapplerHook
2024-09-27 23:07:42.440898: E tensorflow/core/grappler/optimizers/tfg_optimizer_hook.cc:135] tfg_optimizer{any(tfg-consolidate-attrs,tfg-functional-to-region,tfg.func(tfg-cf-sink),tfg-region-to-functional{force-control-capture=true},tfg-lift-legacy-call,symbol-privatize{},symbol-dce,tfg-prepare-attrs-export)} failed: INVALID_ARGUMENT: Node sequential_1964/simple_rnn_1218/while/body/_1/sequential_1964/simple_rnn_1218/while/simple_rnn_cell/Relu has an empty op name
	when importing GraphDef to MLIR module in GrapplerHook
2024-09-27 23:07:42.441813: E tensorflow/core/grappler/optimizers/tfg_optimizer_hook.cc:135] tfg_optimizer{any(tfg-consolidate-attrs,tfg-functional-to-region,tfg.func(tfg-cf-sink),tfg-region-to-functional{force-control-capture=true},tfg-lift-legacy-call,symbol-privatize{},symbol-dce,tfg-prepare-attrs-export)} failed: INVALID_ARGUMENT: Node sequential_1964/simple_rnn_1218/while/body/_1/sequential_1964/simple_rnn_1218/while/simple_rnn_cell/Relu has an empty op name
	when importing GraphDef to MLIR module in GrapplerHook
2024-09-27 23:07:42.443678: W tensorflow/core/common_runtime/optimize_function_graph_utils.cc:615] Ignoring multi-device function optimization failure: INVALID_ARGUMENT: Node 'sequential_1964/simple_rnn_1218/while/body/_1/sequential_1964/simple_rnn_1218/while/simple_rnn_cell/Relu' does not specify an operation

1/1 [==============================] - ETA: 0s
1/1 [==============================] - 0s 235ms/step
[I 2024-09-27 23:07:44,961] Trial 155 finished with value: 0.32432138290405277 and parameters: {'window_size': 6, 'batch_size': 64, 'network_type': 'RNN', 'num_layers': 1, 'num_neurons': 16, 'learning_rate': 0.01, 'dropout_rate': 0.1}. Best is trial 114 with value: 0.08357412559107731.

1/1 [==============================] - ETA: 0s
1/1 [==============================] - 0s 261ms/step
[I 2024-09-27 23:07:48,114] Trial 156 finished with value: 0.15917399717966715 and parameters: {'window_size': 6, 'batch_size': 64, 'network_type': 'GRU', 'num_layers': 1, 'num_neurons': 128, 'learning_rate': 0.01, 'dropout_rate': 0.1}. Best is trial 114 with value: 0.08357412559107731.
2024-09-27 23:07:49.445846: W tensorflow/core/grappler/utils/graph_view.cc:849] No registered '' OpKernel for CPU devices compatible with node {{node sequential_1966/simple_rnn_1219/while/body/_1/sequential_1966/simple_rnn_1219/while/simple_rnn_cell/Relu}}
	.  Registered:  <no registered kernels>

2024-09-27 23:07:49.500483: E tensorflow/core/grappler/optimizers/tfg_optimizer_hook.cc:135] tfg_optimizer{any(tfg-consolidate-attrs,tfg-toposort,tfg-shape-inference{graph-version=0},tfg-prepare-attrs-export)} failed: INVALID_ARGUMENT: Node sequential_1966/simple_rnn_1219/while/body/_1/sequential_1966/simple_rnn_1219/while/simple_rnn_cell/Relu has an empty op name
	when importing GraphDef to MLIR module in GrapplerHook
2024-09-27 23:07:49.561088: E tensorflow/core/grappler/optimizers/tfg_optimizer_hook.cc:135] tfg_optimizer{any(tfg-consolidate-attrs,tfg-functional-to-region,tfg.func(tfg-cf-sink),tfg-region-to-functional{force-control-capture=true},tfg-lift-legacy-call,symbol-privatize{},symbol-dce,tfg-prepare-attrs-export)} failed: INVALID_ARGUMENT: Node sequential_1966/simple_rnn_1219/while/body/_1/sequential_1966/simple_rnn_1219/while/simple_rnn_cell/Relu has an empty op name
	when importing GraphDef to MLIR module in GrapplerHook
2024-09-27 23:07:49.562296: E tensorflow/core/grappler/optimizers/tfg_optimizer_hook.cc:135] tfg_optimizer{any(tfg-consolidate-attrs,tfg-functional-to-region,tfg.func(tfg-cf-sink),tfg-region-to-functional{force-control-capture=true},tfg-lift-legacy-call,symbol-privatize{},symbol-dce,tfg-prepare-attrs-export)} failed: INVALID_ARGUMENT: Node sequential_1966/simple_rnn_1219/while/body/_1/sequential_1966/simple_rnn_1219/while/simple_rnn_cell/Relu has an empty op name
	when importing GraphDef to MLIR module in GrapplerHook
2024-09-27 23:07:49.564493: W tensorflow/core/common_runtime/optimize_function_graph_utils.cc:615] Ignoring multi-device function optimization failure: INVALID_ARGUMENT: Node 'sequential_1966/simple_rnn_1219/while/body/_1/sequential_1966/simple_rnn_1219/while/simple_rnn_cell/Relu' does not specify an operation

1/1 [==============================] - ETA: 0s
1/1 [==============================] - 0s 207ms/step
[I 2024-09-27 23:07:50,935] Trial 157 finished with value: 0.2794841288884481 and parameters: {'window_size': 6, 'batch_size': 64, 'network_type': 'RNN', 'num_layers': 1, 'num_neurons': 128, 'learning_rate': 0.01, 'dropout_rate': 0.2}. Best is trial 114 with value: 0.08357412559107731.

1/1 [==============================] - ETA: 0s
1/1 [==============================] - 1s 563ms/step
[I 2024-09-27 23:07:57,749] Trial 158 finished with value: 0.15271912725348222 and parameters: {'window_size': 2, 'batch_size': 32, 'network_type': 'RNN', 'num_layers': 3, 'num_neurons': 16, 'learning_rate': 0.01, 'dropout_rate': 0.1}. Best is trial 114 with value: 0.08357412559107731.

1/1 [==============================] - ETA: 0s
1/1 [==============================] - 0s 216ms/step
[I 2024-09-27 23:08:00,825] Trial 159 finished with value: 0.11377517670079283 and parameters: {'window_size': 2, 'batch_size': 64, 'network_type': 'RNN', 'num_layers': 1, 'num_neurons': 64, 'learning_rate': 0.01, 'dropout_rate': 0.3}. Best is trial 114 with value: 0.08357412559107731.

1/1 [==============================] - ETA: 0s
1/1 [==============================] - 0s 208ms/step
[I 2024-09-27 23:08:03,750] Trial 160 finished with value: 0.16923860695487578 and parameters: {'window_size': 2, 'batch_size': 64, 'network_type': 'RNN', 'num_layers': 1, 'num_neurons': 128, 'learning_rate': 0.01, 'dropout_rate': 0.1}. Best is trial 114 with value: 0.08357412559107731.

1/1 [==============================] - ETA: 0s
1/1 [==============================] - 0s 185ms/step
[I 2024-09-27 23:08:09,860] Trial 161 finished with value: 0.2181336054801941 and parameters: {'window_size': 2, 'batch_size': 16, 'network_type': 'RNN', 'num_layers': 1, 'num_neurons': 128, 'learning_rate': 0.0001, 'dropout_rate': 0.1}. Best is trial 114 with value: 0.08357412559107731.

1/1 [==============================] - ETA: 0s
1/1 [==============================] - 0s 203ms/step
[I 2024-09-27 23:08:12,751] Trial 162 finished with value: 0.1141660012194985 and parameters: {'window_size': 2, 'batch_size': 16, 'network_type': 'RNN', 'num_layers': 1, 'num_neurons': 128, 'learning_rate': 0.01, 'dropout_rate': 0.1}. Best is trial 114 with value: 0.08357412559107731.

1/1 [==============================] - ETA: 0s
1/1 [==============================] - 0s 182ms/step
[I 2024-09-27 23:08:15,660] Trial 163 finished with value: 0.1313986487137644 and parameters: {'window_size': 2, 'batch_size': 16, 'network_type': 'RNN', 'num_layers': 1, 'num_neurons': 128, 'learning_rate': 0.01, 'dropout_rate': 0.1}. Best is trial 114 with value: 0.08357412559107731.

1/1 [==============================] - ETA: 0s
1/1 [==============================] - 0s 204ms/step
[I 2024-09-27 23:08:18,580] Trial 164 finished with value: 0.11781606774581106 and parameters: {'window_size': 2, 'batch_size': 16, 'network_type': 'RNN', 'num_layers': 1, 'num_neurons': 128, 'learning_rate': 0.01, 'dropout_rate': 0.1}. Best is trial 114 with value: 0.08357412559107731.

1/1 [==============================] - ETA: 0s
1/1 [==============================] - 0s 176ms/step
[I 2024-09-27 23:08:21,413] Trial 165 finished with value: 0.11744632193916722 and parameters: {'window_size': 2, 'batch_size': 16, 'network_type': 'RNN', 'num_layers': 1, 'num_neurons': 128, 'learning_rate': 0.01, 'dropout_rate': 0.1}. Best is trial 114 with value: 0.08357412559107731.

1/1 [==============================] - ETA: 0s
1/1 [==============================] - 0s 316ms/step
[I 2024-09-27 23:08:25,675] Trial 166 finished with value: 0.10945181440052233 and parameters: {'window_size': 2, 'batch_size': 64, 'network_type': 'RNN', 'num_layers': 2, 'num_neurons': 128, 'learning_rate': 0.01, 'dropout_rate': 0.1}. Best is trial 114 with value: 0.08357412559107731.

1/1 [==============================] - ETA: 0s
1/1 [==============================] - 0s 217ms/step
[I 2024-09-27 23:08:28,683] Trial 167 finished with value: 0.11157869584936846 and parameters: {'window_size': 2, 'batch_size': 64, 'network_type': 'RNN', 'num_layers': 1, 'num_neurons': 16, 'learning_rate': 0.01, 'dropout_rate': 0.1}. Best is trial 114 with value: 0.08357412559107731.

1/1 [==============================] - ETA: 0s
1/1 [==============================] - 0s 252ms/step
[I 2024-09-27 23:08:33,761] Trial 168 finished with value: 0.12072199871665554 and parameters: {'window_size': 2, 'batch_size': 64, 'network_type': 'RNN', 'num_layers': 1, 'num_neurons': 128, 'learning_rate': 0.01, 'dropout_rate': 0.2}. Best is trial 114 with value: 0.08357412559107731.
2024-09-27 23:08:35.131059: W tensorflow/core/grappler/utils/graph_view.cc:849] No registered '' OpKernel for CPU devices compatible with node {{node sequential_1978/simple_rnn_1234/while/body/_1/sequential_1978/simple_rnn_1234/while/simple_rnn_cell/Relu}}
	.  Registered:  <no registered kernels>

2024-09-27 23:08:35.167074: E tensorflow/core/grappler/optimizers/tfg_optimizer_hook.cc:135] tfg_optimizer{any(tfg-consolidate-attrs,tfg-toposort,tfg-shape-inference{graph-version=0},tfg-prepare-attrs-export)} failed: INVALID_ARGUMENT: Node sequential_1978/simple_rnn_1234/while/body/_1/sequential_1978/simple_rnn_1234/while/simple_rnn_cell/Relu has an empty op name
	when importing GraphDef to MLIR module in GrapplerHook
2024-09-27 23:08:35.200396: E tensorflow/core/grappler/optimizers/meta_optimizer.cc:961] remapper failed: NOT_FOUND: Op type not registered '' in binary running on DESKTOP-CO9CTFR. Make sure the Op and Kernel are registered in the binary running in this process. Note that if you are loading a saved graph which used ops from tf.contrib (e.g. `tf.contrib.resampler`), accessing should be done before importing the graph, as contrib ops are lazily registered when the module is first accessed.
2024-09-27 23:08:35.207996: E tensorflow/core/grappler/optimizers/tfg_optimizer_hook.cc:135] tfg_optimizer{any(tfg-consolidate-attrs,tfg-functional-to-region,tfg.func(tfg-cf-sink),tfg-region-to-functional{force-control-capture=true},tfg-lift-legacy-call,symbol-privatize{},symbol-dce,tfg-prepare-attrs-export)} failed: INVALID_ARGUMENT: Node sequential_1978/simple_rnn_1234/while/body/_1/sequential_1978/simple_rnn_1234/while/simple_rnn_cell/Relu has an empty op name
	when importing GraphDef to MLIR module in GrapplerHook
2024-09-27 23:08:35.208928: E tensorflow/core/grappler/optimizers/tfg_optimizer_hook.cc:135] tfg_optimizer{any(tfg-consolidate-attrs,tfg-functional-to-region,tfg.func(tfg-cf-sink),tfg-region-to-functional{force-control-capture=true},tfg-lift-legacy-call,symbol-privatize{},symbol-dce,tfg-prepare-attrs-export)} failed: INVALID_ARGUMENT: Node sequential_1978/simple_rnn_1234/while/body/_1/sequential_1978/simple_rnn_1234/while/simple_rnn_cell/Relu has an empty op name
	when importing GraphDef to MLIR module in GrapplerHook
2024-09-27 23:08:35.210752: W tensorflow/core/common_runtime/optimize_function_graph_utils.cc:615] Ignoring multi-device function optimization failure: INVALID_ARGUMENT: Node 'sequential_1978/simple_rnn_1234/while/body/_1/sequential_1978/simple_rnn_1234/while/simple_rnn_cell/Relu' does not specify an operation

1/1 [==============================] - ETA: 0s
1/1 [==============================] - 0s 221ms/step
[I 2024-09-27 23:08:37,034] Trial 169 finished with value: 0.18921522254943848 and parameters: {'window_size': 6, 'batch_size': 32, 'network_type': 'RNN', 'num_layers': 1, 'num_neurons': 128, 'learning_rate': 0.01, 'dropout_rate': 0.1}. Best is trial 114 with value: 0.08357412559107731.

1/1 [==============================] - ETA: 0s
1/1 [==============================] - 0s 225ms/step
[I 2024-09-27 23:08:40,914] Trial 170 finished with value: 0.262341858914024 and parameters: {'window_size': 2, 'batch_size': 16, 'network_type': 'LSTM', 'num_layers': 1, 'num_neurons': 16, 'learning_rate': 0.01, 'dropout_rate': 0.1}. Best is trial 114 with value: 0.08357412559107731.

1/1 [==============================] - ETA: 0s
1/1 [==============================] - 0s 184ms/step
[I 2024-09-27 23:08:43,779] Trial 171 finished with value: 0.1651868463315462 and parameters: {'window_size': 2, 'batch_size': 64, 'network_type': 'RNN', 'num_layers': 1, 'num_neurons': 128, 'learning_rate': 0.01, 'dropout_rate': 0.1}. Best is trial 114 with value: 0.08357412559107731.

1/1 [==============================] - ETA: 0s
1/1 [==============================] - 0s 185ms/step
[I 2024-09-27 23:08:46,800] Trial 172 finished with value: 0.09690688434400058 and parameters: {'window_size': 2, 'batch_size': 64, 'network_type': 'RNN', 'num_layers': 1, 'num_neurons': 128, 'learning_rate': 0.01, 'dropout_rate': 0.1}. Best is trial 114 with value: 0.08357412559107731.

1/1 [==============================] - ETA: 0s
1/1 [==============================] - 0s 178ms/step
[I 2024-09-27 23:08:49,899] Trial 173 finished with value: 0.09360403793736509 and parameters: {'window_size': 2, 'batch_size': 64, 'network_type': 'RNN', 'num_layers': 1, 'num_neurons': 128, 'learning_rate': 0.01, 'dropout_rate': 0.1}. Best is trial 114 with value: 0.08357412559107731.

1/1 [==============================] - ETA: 0s
1/1 [==============================] - 0s 189ms/step
[I 2024-09-27 23:08:52,431] Trial 174 finished with value: 0.1843213301708824 and parameters: {'window_size': 2, 'batch_size': 64, 'network_type': 'RNN', 'num_layers': 1, 'num_neurons': 128, 'learning_rate': 0.01, 'dropout_rate': 0.1}. Best is trial 114 with value: 0.08357412559107731.

1/1 [==============================] - ETA: 0s
1/1 [==============================] - 0s 178ms/step
[I 2024-09-27 23:08:55,916] Trial 175 finished with value: 0.09314160000650507 and parameters: {'window_size': 2, 'batch_size': 64, 'network_type': 'RNN', 'num_layers': 1, 'num_neurons': 128, 'learning_rate': 0.01, 'dropout_rate': 0.1}. Best is trial 114 with value: 0.08357412559107731.

1/1 [==============================] - ETA: 0s
1/1 [==============================] - 0s 216ms/step
[I 2024-09-27 23:08:58,936] Trial 176 finished with value: 0.20570235443115234 and parameters: {'window_size': 4, 'batch_size': 64, 'network_type': 'RNN', 'num_layers': 1, 'num_neurons': 128, 'learning_rate': 0.01, 'dropout_rate': 0.1}. Best is trial 114 with value: 0.08357412559107731.

1/1 [==============================] - ETA: 0s
1/1 [==============================] - 0s 195ms/step
[I 2024-09-27 23:09:01,526] Trial 177 finished with value: 0.11194591692874307 and parameters: {'window_size': 2, 'batch_size': 64, 'network_type': 'RNN', 'num_layers': 1, 'num_neurons': 64, 'learning_rate': 0.01, 'dropout_rate': 0.2}. Best is trial 114 with value: 0.08357412559107731.

1/1 [==============================] - ETA: 0s
1/1 [==============================] - 0s 247ms/step
[I 2024-09-27 23:09:04,895] Trial 178 finished with value: 0.08768889989350974 and parameters: {'window_size': 2, 'batch_size': 64, 'network_type': 'RNN', 'num_layers': 1, 'num_neurons': 128, 'learning_rate': 0.01, 'dropout_rate': 0.1}. Best is trial 114 with value: 0.08357412559107731.

1/1 [==============================] - ETA: 0s
1/1 [==============================] - 0s 301ms/step
[I 2024-09-27 23:09:08,757] Trial 179 finished with value: 0.08696328143069619 and parameters: {'window_size': 2, 'batch_size': 64, 'network_type': 'RNN', 'num_layers': 1, 'num_neurons': 32, 'learning_rate': 0.01, 'dropout_rate': 0.1}. Best is trial 114 with value: 0.08357412559107731.

1/1 [==============================] - ETA: 0s
1/1 [==============================] - 0s 183ms/step
[I 2024-09-27 23:09:15,615] Trial 180 finished with value: 0.4154604852325038 and parameters: {'window_size': 2, 'batch_size': 64, 'network_type': 'RNN', 'num_layers': 1, 'num_neurons': 32, 'learning_rate': 0.0001, 'dropout_rate': 0.1}. Best is trial 114 with value: 0.08357412559107731.

1/1 [==============================] - ETA: 0s
1/1 [==============================] - 0s 194ms/step
[I 2024-09-27 23:09:18,460] Trial 181 finished with value: 0.08634377148276882 and parameters: {'window_size': 2, 'batch_size': 64, 'network_type': 'RNN', 'num_layers': 1, 'num_neurons': 32, 'learning_rate': 0.01, 'dropout_rate': 0.1}. Best is trial 114 with value: 0.08357412559107731.

1/1 [==============================] - ETA: 0s
1/1 [==============================] - 0s 173ms/step
[I 2024-09-27 23:09:21,298] Trial 182 finished with value: 0.10186100216915735 and parameters: {'window_size': 2, 'batch_size': 64, 'network_type': 'RNN', 'num_layers': 1, 'num_neurons': 32, 'learning_rate': 0.01, 'dropout_rate': 0.1}. Best is trial 114 with value: 0.08357412559107731.

1/1 [==============================] - ETA: 0s
1/1 [==============================] - 0s 183ms/step
[I 2024-09-27 23:09:23,817] Trial 183 finished with value: 0.09911106972945366 and parameters: {'window_size': 2, 'batch_size': 64, 'network_type': 'RNN', 'num_layers': 1, 'num_neurons': 32, 'learning_rate': 0.01, 'dropout_rate': 0.1}. Best is trial 114 with value: 0.08357412559107731.

1/1 [==============================] - ETA: 0s
1/1 [==============================] - 0s 179ms/step
[I 2024-09-27 23:09:26,532] Trial 184 finished with value: 0.13788095905906275 and parameters: {'window_size': 2, 'batch_size': 64, 'network_type': 'RNN', 'num_layers': 1, 'num_neurons': 32, 'learning_rate': 0.01, 'dropout_rate': 0.1}. Best is trial 114 with value: 0.08357412559107731.

1/1 [==============================] - ETA: 0s
1/1 [==============================] - 0s 185ms/step
[I 2024-09-27 23:09:29,080] Trial 185 finished with value: 0.10006919278596578 and parameters: {'window_size': 2, 'batch_size': 64, 'network_type': 'RNN', 'num_layers': 1, 'num_neurons': 32, 'learning_rate': 0.01, 'dropout_rate': 0.1}. Best is trial 114 with value: 0.08357412559107731.

1/1 [==============================] - ETA: 0s
1/1 [==============================] - 0s 238ms/step
[I 2024-09-27 23:09:32,903] Trial 186 finished with value: 0.12494171519028513 and parameters: {'window_size': 2, 'batch_size': 64, 'network_type': 'GRU', 'num_layers': 1, 'num_neurons': 32, 'learning_rate': 0.01, 'dropout_rate': 0.1}. Best is trial 114 with value: 0.08357412559107731.

1/1 [==============================] - ETA: 0s
1/1 [==============================] - 0s 188ms/step
[I 2024-09-27 23:09:35,870] Trial 187 finished with value: 0.12444688746803685 and parameters: {'window_size': 2, 'batch_size': 64, 'network_type': 'RNN', 'num_layers': 1, 'num_neurons': 32, 'learning_rate': 0.01, 'dropout_rate': 0.2}. Best is trial 114 with value: 0.08357412559107731.

1/1 [==============================] - ETA: 0s
1/1 [==============================] - 1s 590ms/step
[I 2024-09-27 23:09:42,539] Trial 188 finished with value: 0.09588788509368898 and parameters: {'window_size': 2, 'batch_size': 64, 'network_type': 'RNN', 'num_layers': 3, 'num_neurons': 32, 'learning_rate': 0.01, 'dropout_rate': 0.1}. Best is trial 114 with value: 0.08357412559107731.

1/1 [==============================] - ETA: 0s
1/1 [==============================] - 0s 215ms/step
[I 2024-09-27 23:09:46,103] Trial 189 finished with value: 0.2758222871830589 and parameters: {'window_size': 2, 'batch_size': 64, 'network_type': 'RNN', 'num_layers': 1, 'num_neurons': 16, 'learning_rate': 0.01, 'dropout_rate': 0.3}. Best is trial 114 with value: 0.08357412559107731.

1/1 [==============================] - ETA: 0s
1/1 [==============================] - 0s 254ms/step
[I 2024-09-27 23:09:49,450] Trial 190 finished with value: 0.21551671231420416 and parameters: {'window_size': 2, 'batch_size': 64, 'network_type': 'RNN', 'num_layers': 1, 'num_neurons': 32, 'learning_rate': 0.01, 'dropout_rate': 0.1}. Best is trial 114 with value: 0.08357412559107731.

1/1 [==============================] - ETA: 0s
1/1 [==============================] - 0s 183ms/step
[I 2024-09-27 23:09:52,572] Trial 191 finished with value: 0.11067519609551682 and parameters: {'window_size': 2, 'batch_size': 64, 'network_type': 'RNN', 'num_layers': 1, 'num_neurons': 128, 'learning_rate': 0.01, 'dropout_rate': 0.1}. Best is trial 114 with value: 0.08357412559107731.

1/1 [==============================] - ETA: 0s
1/1 [==============================] - 0s 176ms/step
[I 2024-09-27 23:09:55,021] Trial 192 finished with value: 0.11962686634063721 and parameters: {'window_size': 2, 'batch_size': 64, 'network_type': 'RNN', 'num_layers': 1, 'num_neurons': 128, 'learning_rate': 0.01, 'dropout_rate': 0.1}. Best is trial 114 with value: 0.08357412559107731.

1/1 [==============================] - ETA: 0s
1/1 [==============================] - 0s 170ms/step
