[I 2024-09-27 19:27:08,775] Trial 160 finished with value: 0.017943125521143282 and parameters: {'window_size': 2, 'batch_size': 16, 'network_type': 'RNN', 'num_layers': 1, 'num_neurons': 16, 'learning_rate': 0.01, 'dropout_rate': 0.2}. Best is trial 57 with value: 0.013169454112648965.

1/2 [==============>...............] - ETA: 0s
2/2 [==============================] - 0s 16ms/step
[I 2024-09-27 19:27:26,893] Trial 161 finished with value: 0.06636575068533421 and parameters: {'window_size': 2, 'batch_size': 16, 'network_type': 'RNN', 'num_layers': 1, 'num_neurons': 16, 'learning_rate': 0.0001, 'dropout_rate': 0.2}. Best is trial 57 with value: 0.013169454112648965.

1/2 [==============>...............] - ETA: 0s
2/2 [==============================] - 1s 5ms/step
[I 2024-09-27 19:27:35,432] Trial 162 finished with value: 0.017421990940968194 and parameters: {'window_size': 2, 'batch_size': 16, 'network_type': 'RNN', 'num_layers': 1, 'num_neurons': 16, 'learning_rate': 0.01, 'dropout_rate': 0.2}. Best is trial 57 with value: 0.013169454112648965.

1/2 [==============>...............] - ETA: 0s
2/2 [==============================] - 0s 0s/step
[I 2024-09-27 19:27:44,614] Trial 163 finished with value: 0.015614156569043797 and parameters: {'window_size': 2, 'batch_size': 16, 'network_type': 'RNN', 'num_layers': 1, 'num_neurons': 16, 'learning_rate': 0.01, 'dropout_rate': 0.2}. Best is trial 57 with value: 0.013169454112648965.

1/2 [==============>...............] - ETA: 0s
2/2 [==============================] - 1s 4ms/step
[I 2024-09-27 19:27:53,367] Trial 164 finished with value: 0.015746099397540094 and parameters: {'window_size': 2, 'batch_size': 16, 'network_type': 'RNN', 'num_layers': 1, 'num_neurons': 16, 'learning_rate': 0.01, 'dropout_rate': 0.2}. Best is trial 57 with value: 0.013169454112648965.

1/2 [==============>...............] - ETA: 0s
2/2 [==============================] - 0s 8ms/step
[I 2024-09-27 19:28:02,565] Trial 165 finished with value: 0.01953274596730868 and parameters: {'window_size': 2, 'batch_size': 16, 'network_type': 'RNN', 'num_layers': 1, 'num_neurons': 16, 'learning_rate': 0.01, 'dropout_rate': 0.2}. Best is trial 57 with value: 0.013169454112648965.

1/2 [==============>...............] - ETA: 0s
2/2 [==============================] - 0s 0s/step
[I 2024-09-27 19:28:10,691] Trial 166 finished with value: 0.03320853822881526 and parameters: {'window_size': 6, 'batch_size': 64, 'network_type': 'LSTM', 'num_layers': 1, 'num_neurons': 16, 'learning_rate': 0.01, 'dropout_rate': 0.2}. Best is trial 57 with value: 0.013169454112648965.

1/2 [==============>...............] - ETA: 0s
2/2 [==============================] - 0s 0s/step
[I 2024-09-27 19:28:18,559] Trial 167 finished with value: 0.012022255604465806 and parameters: {'window_size': 2, 'batch_size': 16, 'network_type': 'RNN', 'num_layers': 2, 'num_neurons': 128, 'learning_rate': 0.01, 'dropout_rate': 0.3}. Best is trial 167 with value: 0.012022255604465806.

1/2 [==============>...............] - ETA: 0s
2/2 [==============================] - 0s 0s/step
[I 2024-09-27 19:28:25,018] Trial 168 finished with value: 0.01959665774305662 and parameters: {'window_size': 2, 'batch_size': 16, 'network_type': 'RNN', 'num_layers': 2, 'num_neurons': 128, 'learning_rate': 0.01, 'dropout_rate': 0.3}. Best is trial 167 with value: 0.012022255604465806.

1/2 [==============>...............] - ETA: 0s
2/2 [==============================] - 1s 16ms/step
[I 2024-09-27 19:28:35,242] Trial 169 finished with value: 0.02671968855460485 and parameters: {'window_size': 2, 'batch_size': 16, 'network_type': 'LSTM', 'num_layers': 3, 'num_neurons': 128, 'learning_rate': 0.01, 'dropout_rate': 0.3}. Best is trial 167 with value: 0.012022255604465806.

1/2 [==============>...............] - ETA: 0s
2/2 [==============================] - 0s 0s/step
[I 2024-09-27 19:28:40,013] Trial 170 finished with value: 0.019944924250245098 and parameters: {'window_size': 2, 'batch_size': 16, 'network_type': 'RNN', 'num_layers': 2, 'num_neurons': 128, 'learning_rate': 0.01, 'dropout_rate': 0.3}. Best is trial 167 with value: 0.012022255604465806.

1/2 [==============>...............] - ETA: 0s
2/2 [==============================] - 0s 0s/step
[I 2024-09-27 19:28:46,263] Trial 171 finished with value: 0.01892822828392188 and parameters: {'window_size': 2, 'batch_size': 16, 'network_type': 'RNN', 'num_layers': 2, 'num_neurons': 128, 'learning_rate': 0.01, 'dropout_rate': 0.3}. Best is trial 167 with value: 0.012022255604465806.

1/2 [==============>...............] - ETA: 0s
2/2 [==============================] - 1s 0s/step
[I 2024-09-27 19:28:55,833] Trial 172 finished with value: 0.026600720956921578 and parameters: {'window_size': 2, 'batch_size': 16, 'network_type': 'RNN', 'num_layers': 2, 'num_neurons': 128, 'learning_rate': 0.01, 'dropout_rate': 0.3}. Best is trial 167 with value: 0.012022255604465806.

1/2 [==============>...............] - ETA: 0s
2/2 [==============================] - 0s 0s/step
[I 2024-09-27 19:29:02,321] Trial 173 finished with value: 0.01719401643176874 and parameters: {'window_size': 2, 'batch_size': 16, 'network_type': 'RNN', 'num_layers': 2, 'num_neurons': 64, 'learning_rate': 0.01, 'dropout_rate': 0.2}. Best is trial 167 with value: 0.012022255604465806.

1/2 [==============>...............] - ETA: 0s
2/2 [==============================] - 0s 0s/step
[I 2024-09-27 19:29:28,914] Trial 174 finished with value: 0.015083746065696083 and parameters: {'window_size': 2, 'batch_size': 16, 'network_type': 'RNN', 'num_layers': 1, 'num_neurons': 32, 'learning_rate': 0.01, 'dropout_rate': 0.2}. Best is trial 167 with value: 0.012022255604465806.

1/2 [==============>...............] - ETA: 0s
2/2 [==============================] - 1s 16ms/step
[I 2024-09-27 19:29:37,012] Trial 175 finished with value: 0.019931337570150694 and parameters: {'window_size': 2, 'batch_size': 16, 'network_type': 'RNN', 'num_layers': 1, 'num_neurons': 32, 'learning_rate': 0.01, 'dropout_rate': 0.2}. Best is trial 167 with value: 0.012022255604465806.

1/2 [==============>...............] - ETA: 0s
2/2 [==============================] - 0s 0s/step
[I 2024-09-27 19:29:48,646] Trial 176 finished with value: 0.02909485384325187 and parameters: {'window_size': 2, 'batch_size': 16, 'network_type': 'LSTM', 'num_layers': 1, 'num_neurons': 32, 'learning_rate': 0.0001, 'dropout_rate': 0.2}. Best is trial 167 with value: 0.012022255604465806.

1/2 [==============>...............] - ETA: 0s
2/2 [==============================] - 1s 5ms/step
[I 2024-09-27 19:29:53,527] Trial 177 finished with value: 0.0192519354869922 and parameters: {'window_size': 2, 'batch_size': 16, 'network_type': 'RNN', 'num_layers': 1, 'num_neurons': 32, 'learning_rate': 0.01, 'dropout_rate': 0.2}. Best is trial 167 with value: 0.012022255604465806.

1/2 [==============>...............] - ETA: 0s
2/2 [==============================] - 0s 0s/step
[I 2024-09-27 19:30:00,262] Trial 178 finished with value: 0.01391480286916097 and parameters: {'window_size': 2, 'batch_size': 16, 'network_type': 'LSTM', 'num_layers': 1, 'num_neurons': 32, 'learning_rate': 0.01, 'dropout_rate': 0.2}. Best is trial 167 with value: 0.012022255604465806.

1/2 [==============>...............] - ETA: 0s
2/2 [==============================] - 0s 0s/step
[I 2024-09-27 19:30:05,122] Trial 179 finished with value: 0.01611019453406334 and parameters: {'window_size': 2, 'batch_size': 16, 'network_type': 'RNN', 'num_layers': 1, 'num_neurons': 32, 'learning_rate': 0.01, 'dropout_rate': 0.1}. Best is trial 167 with value: 0.012022255604465806.

1/2 [==============>...............] - ETA: 0s
2/2 [==============================] - 0s 16ms/step
[I 2024-09-27 19:30:10,813] Trial 180 finished with value: 0.015690182333407195 and parameters: {'window_size': 4, 'batch_size': 32, 'network_type': 'LSTM', 'num_layers': 1, 'num_neurons': 128, 'learning_rate': 0.01, 'dropout_rate': 0.2}. Best is trial 167 with value: 0.012022255604465806.

1/2 [==============>...............] - ETA: 0s
2/2 [==============================] - 0s 0s/step
[I 2024-09-27 19:30:18,413] Trial 181 finished with value: 0.014789623384674391 and parameters: {'window_size': 2, 'batch_size': 16, 'network_type': 'LSTM', 'num_layers': 1, 'num_neurons': 32, 'learning_rate': 0.01, 'dropout_rate': 0.2}. Best is trial 167 with value: 0.012022255604465806.

1/2 [==============>...............] - ETA: 0s
2/2 [==============================] - 0s 0s/step
[I 2024-09-27 19:30:23,662] Trial 182 finished with value: 0.013773543462157251 and parameters: {'window_size': 2, 'batch_size': 16, 'network_type': 'LSTM', 'num_layers': 1, 'num_neurons': 32, 'learning_rate': 0.01, 'dropout_rate': 0.2}. Best is trial 167 with value: 0.012022255604465806.

1/2 [==============>...............] - ETA: 0s
2/2 [==============================] - 0s 16ms/step
[I 2024-09-27 19:30:28,922] Trial 183 finished with value: 0.016596956943472227 and parameters: {'window_size': 2, 'batch_size': 16, 'network_type': 'LSTM', 'num_layers': 1, 'num_neurons': 32, 'learning_rate': 0.01, 'dropout_rate': 0.2}. Best is trial 167 with value: 0.012022255604465806.

1/2 [==============>...............] - ETA: 0s
2/2 [==============================] - 0s 0s/step
[I 2024-09-27 19:30:34,417] Trial 184 finished with value: 0.015372781227032345 and parameters: {'window_size': 2, 'batch_size': 16, 'network_type': 'LSTM', 'num_layers': 1, 'num_neurons': 32, 'learning_rate': 0.01, 'dropout_rate': 0.2}. Best is trial 167 with value: 0.012022255604465806.

1/2 [==============>...............] - ETA: 0s
2/2 [==============================] - 0s 0s/step
[I 2024-09-27 19:30:42,771] Trial 185 finished with value: 0.01766892651220163 and parameters: {'window_size': 2, 'batch_size': 16, 'network_type': 'LSTM', 'num_layers': 1, 'num_neurons': 32, 'learning_rate': 0.01, 'dropout_rate': 0.2}. Best is trial 167 with value: 0.012022255604465806.

1/2 [==============>...............] - ETA: 0s
2/2 [==============================] - 1s 3ms/step
[I 2024-09-27 19:30:52,092] Trial 186 finished with value: 0.019862668270866076 and parameters: {'window_size': 2, 'batch_size': 16, 'network_type': 'LSTM', 'num_layers': 1, 'num_neurons': 32, 'learning_rate': 0.01, 'dropout_rate': 0.2}. Best is trial 167 with value: 0.012022255604465806.

1/2 [==============>...............] - ETA: 0s
2/2 [==============================] - 1s 3ms/step
[I 2024-09-27 19:31:02,474] Trial 187 finished with value: 0.01853860200444857 and parameters: {'window_size': 2, 'batch_size': 64, 'network_type': 'LSTM', 'num_layers': 1, 'num_neurons': 32, 'learning_rate': 0.01, 'dropout_rate': 0.2}. Best is trial 167 with value: 0.012022255604465806.

1/2 [==============>...............] - ETA: 0s
2/2 [==============================] - 0s 0s/step
[I 2024-09-27 19:31:08,973] Trial 188 finished with value: 0.02006860107680162 and parameters: {'window_size': 2, 'batch_size': 16, 'network_type': 'LSTM', 'num_layers': 1, 'num_neurons': 32, 'learning_rate': 0.01, 'dropout_rate': 0.2}. Best is trial 167 with value: 0.012022255604465806.

1/2 [==============>...............] - ETA: 0s
2/2 [==============================] - 0s 0s/step
[I 2024-09-27 19:31:16,352] Trial 189 finished with value: 0.020527838960289955 and parameters: {'window_size': 2, 'batch_size': 16, 'network_type': 'LSTM', 'num_layers': 2, 'num_neurons': 32, 'learning_rate': 0.01, 'dropout_rate': 0.3}. Best is trial 167 with value: 0.012022255604465806.

1/2 [==============>...............] - ETA: 0s
2/2 [==============================] - 0s 0s/step
[I 2024-09-27 19:31:20,901] Trial 190 finished with value: 0.02058090215921402 and parameters: {'window_size': 2, 'batch_size': 16, 'network_type': 'LSTM', 'num_layers': 1, 'num_neurons': 32, 'learning_rate': 0.01, 'dropout_rate': 0.2}. Best is trial 167 with value: 0.012022255604465806.

1/2 [==============>...............] - ETA: 0s
2/2 [==============================] - 0s 0s/step
[I 2024-09-27 19:31:25,728] Trial 191 finished with value: 0.01907572034498056 and parameters: {'window_size': 2, 'batch_size': 16, 'network_type': 'LSTM', 'num_layers': 1, 'num_neurons': 32, 'learning_rate': 0.01, 'dropout_rate': 0.2}. Best is trial 167 with value: 0.012022255604465806.

1/2 [==============>...............] - ETA: 0s
2/2 [==============================] - 0s 0s/step
[I 2024-09-27 19:31:30,171] Trial 192 finished with value: 0.014113873566190404 and parameters: {'window_size': 2, 'batch_size': 16, 'network_type': 'RNN', 'num_layers': 1, 'num_neurons': 128, 'learning_rate': 0.01, 'dropout_rate': 0.2}. Best is trial 167 with value: 0.012022255604465806.

1/2 [==============>...............] - ETA: 0s
2/2 [==============================] - 0s 0s/step
[I 2024-09-27 19:31:38,936] Trial 193 finished with value: 0.018099523767828942 and parameters: {'window_size': 2, 'batch_size': 16, 'network_type': 'RNN', 'num_layers': 1, 'num_neurons': 128, 'learning_rate': 0.01, 'dropout_rate': 0.2}. Best is trial 167 with value: 0.012022255604465806.

1/2 [==============>...............] - ETA: 0s
2/2 [==============================] - 0s 0s/step
[I 2024-09-27 19:31:46,046] Trial 194 finished with value: 0.01956682039797306 and parameters: {'window_size': 2, 'batch_size': 16, 'network_type': 'GRU', 'num_layers': 1, 'num_neurons': 128, 'learning_rate': 0.01, 'dropout_rate': 0.2}. Best is trial 167 with value: 0.012022255604465806.

1/2 [==============>...............] - ETA: 0s
2/2 [==============================] - 0s 1ms/step
[I 2024-09-27 19:31:51,207] Trial 195 finished with value: 0.019487286652127903 and parameters: {'window_size': 2, 'batch_size': 16, 'network_type': 'LSTM', 'num_layers': 1, 'num_neurons': 128, 'learning_rate': 0.01, 'dropout_rate': 0.2}. Best is trial 167 with value: 0.012022255604465806.

1/2 [==============>...............] - ETA: 0s
2/2 [==============================] - 0s 0s/step
[I 2024-09-27 19:31:55,563] Trial 196 finished with value: 0.01874949605266253 and parameters: {'window_size': 2, 'batch_size': 16, 'network_type': 'RNN', 'num_layers': 1, 'num_neurons': 128, 'learning_rate': 0.01, 'dropout_rate': 0.2}. Best is trial 167 with value: 0.012022255604465806.

1/2 [==============>...............] - ETA: 0s
2/2 [==============================] - 0s 0s/step
[I 2024-09-27 19:32:00,492] Trial 197 finished with value: 0.017803090398510298 and parameters: {'window_size': 2, 'batch_size': 16, 'network_type': 'LSTM', 'num_layers': 1, 'num_neurons': 128, 'learning_rate': 0.01, 'dropout_rate': 0.2}. Best is trial 167 with value: 0.012022255604465806.

1/2 [==============>...............] - ETA: 0s
2/2 [==============================] - 0s 3ms/step
[I 2024-09-27 19:32:04,242] Trial 198 finished with value: 0.016055535172422728 and parameters: {'window_size': 2, 'batch_size': 16, 'network_type': 'RNN', 'num_layers': 1, 'num_neurons': 128, 'learning_rate': 0.01, 'dropout_rate': 0.2}. Best is trial 167 with value: 0.012022255604465806.

1/2 [==============>...............] - ETA: 0s
2/2 [==============================] - 0s 16ms/step
[I 2024-09-27 19:32:12,360] Trial 199 finished with value: 0.014595661894841627 and parameters: {'window_size': 6, 'batch_size': 16, 'network_type': 'LSTM', 'num_layers': 1, 'num_neurons': 32, 'learning_rate': 0.01, 'dropout_rate': 0.2}. Best is trial 167 with value: 0.012022255604465806.
C:\Users\user\AppData\Local\pypoetry\Cache\virtualenvs\transfer-learning-c0qmjA8b-py3.9\lib\site-packages\keras\src\engine\training.py:3103: UserWarning: You are saving your model as an HDF5 file via `model.save()`. This file format is considered legacy. We recommend using instead the native Keras format, e.g. `model.save('my_model.keras')`.
  saving_api.save_model(
Best parameters: {'window_size': 2, 'batch_size': 16, 'network_type': 'RNN', 'num_layers': 2, 'num_neurons': 128, 'learning_rate': 0.01, 'dropout_rate': 0.3}

1/2 [==============>...............] - ETA: 0s
2/2 [==============================] - 0s 0s/step
[I 2024-09-27 19:32:19,479] A new study created in memory with name: no-name-1510d855-cc31-463a-ba56-d448654da3a1

1/3 [=========>....................] - ETA: 1s
3/3 [==============================] - ETA: 0s
3/3 [==============================] - 1s 26ms/step
[I 2024-09-27 19:32:30,383] Trial 0 finished with value: 0.010067656342662986 and parameters: {'window_size': 6, 'batch_size': 16, 'network_type': 'RNN', 'num_layers': 2, 'num_neurons': 64, 'learning_rate': 0.01, 'dropout_rate': 0.3}. Best is trial 0 with value: 0.010067656342662986.

1/3 [=========>....................] - ETA: 0s
3/3 [==============================] - 0s 8ms/step
[I 2024-09-27 19:32:41,537] Trial 1 finished with value: 0.010727532366047735 and parameters: {'window_size': 4, 'batch_size': 64, 'network_type': 'RNN', 'num_layers': 2, 'num_neurons': 64, 'learning_rate': 0.01, 'dropout_rate': 0.3}. Best is trial 0 with value: 0.010067656342662986.

1/3 [=========>....................] - ETA: 0s
3/3 [==============================] - 0s 0s/step
[I 2024-09-27 19:32:49,297] Trial 2 finished with value: 0.012813875164784176 and parameters: {'window_size': 2, 'batch_size': 32, 'network_type': 'GRU', 'num_layers': 2, 'num_neurons': 128, 'learning_rate': 0.01, 'dropout_rate': 0.2}. Best is trial 0 with value: 0.010067656342662986.

1/3 [=========>....................] - ETA: 1s
3/3 [==============================] - 1s 8ms/step
[I 2024-09-27 19:32:57,764] Trial 3 finished with value: 0.015687562621158106 and parameters: {'window_size': 4, 'batch_size': 64, 'network_type': 'LSTM', 'num_layers': 3, 'num_neurons': 16, 'learning_rate': 0.01, 'dropout_rate': 0.2}. Best is trial 0 with value: 0.010067656342662986.

1/3 [=========>....................] - ETA: 54s
3/3 [==============================] - 27s 7ms/step
[I 2024-09-27 19:33:35,565] Trial 4 finished with value: 0.01057526461507233 and parameters: {'window_size': 2, 'batch_size': 64, 'network_type': 'RNN', 'num_layers': 3, 'num_neurons': 128, 'learning_rate': 0.0001, 'dropout_rate': 0.3}. Best is trial 0 with value: 0.010067656342662986.

1/3 [=========>....................] - ETA: 2s
3/3 [==============================] - 1s 4ms/step
[I 2024-09-27 19:33:48,001] Trial 5 finished with value: 0.013183373978440188 and parameters: {'window_size': 2, 'batch_size': 16, 'network_type': 'RNN', 'num_layers': 3, 'num_neurons': 64, 'learning_rate': 0.01, 'dropout_rate': 0.2}. Best is trial 0 with value: 0.010067656342662986.

1/3 [=========>....................] - ETA: 1s
3/3 [==============================] - 1s 0s/step
[I 2024-09-27 19:34:01,371] Trial 6 finished with value: 0.015239292299243767 and parameters: {'window_size': 2, 'batch_size': 16, 'network_type': 'RNN', 'num_layers': 3, 'num_neurons': 128, 'learning_rate': 0.01, 'dropout_rate': 0.3}. Best is trial 0 with value: 0.010067656342662986.

1/3 [=========>....................] - ETA: 0s
3/3 [==============================] - 0s 0s/step
[I 2024-09-27 19:34:08,553] Trial 7 finished with value: 0.011491930869088245 and parameters: {'window_size': 6, 'batch_size': 16, 'network_type': 'GRU', 'num_layers': 1, 'num_neurons': 16, 'learning_rate': 0.01, 'dropout_rate': 0.2}. Best is trial 0 with value: 0.010067656342662986.

1/3 [=========>....................] - ETA: 0s
3/3 [==============================] - 1s 8ms/step
[I 2024-09-27 19:34:18,063] Trial 8 finished with value: 0.010007058838723413 and parameters: {'window_size': 2, 'batch_size': 16, 'network_type': 'LSTM', 'num_layers': 2, 'num_neurons': 64, 'learning_rate': 0.01, 'dropout_rate': 0.3}. Best is trial 8 with value: 0.010007058838723413.

1/3 [=========>....................] - ETA: 3s
3/3 [==============================] - 2s 6ms/step
[I 2024-09-27 19:34:45,937] Trial 9 finished with value: 0.014200104636205753 and parameters: {'window_size': 2, 'batch_size': 32, 'network_type': 'GRU', 'num_layers': 3, 'num_neurons': 32, 'learning_rate': 0.0001, 'dropout_rate': 0.2}. Best is trial 8 with value: 0.010007058838723413.

1/3 [=========>....................] - ETA: 1s
3/3 [==============================] - 1s 7ms/step
[I 2024-09-27 19:34:55,028] Trial 10 finished with value: 0.012794054300888725 and parameters: {'window_size': 4, 'batch_size': 16, 'network_type': 'LSTM', 'num_layers': 1, 'num_neurons': 32, 'learning_rate': 0.01, 'dropout_rate': 0.1}. Best is trial 8 with value: 0.010007058838723413.

1/3 [=========>....................] - ETA: 3s
3/3 [==============================] - 2s 9ms/step
[I 2024-09-27 19:35:12,835] Trial 11 finished with value: 0.01584153607354235 and parameters: {'window_size': 6, 'batch_size': 16, 'network_type': 'LSTM', 'num_layers': 2, 'num_neurons': 64, 'learning_rate': 0.01, 'dropout_rate': 0.3}. Best is trial 8 with value: 0.010007058838723413.

1/3 [=========>....................] - ETA: 1s
3/3 [==============================] - 1s 8ms/step
[I 2024-09-27 19:35:29,042] Trial 12 finished with value: 0.0167543724223749 and parameters: {'window_size': 6, 'batch_size': 16, 'network_type': 'LSTM', 'num_layers': 2, 'num_neurons': 64, 'learning_rate': 0.01, 'dropout_rate': 0.3}. Best is trial 8 with value: 0.010007058838723413.

1/3 [=========>....................] - ETA: 1s
3/3 [==============================] - 1s 8ms/step
[I 2024-09-27 19:35:43,795] Trial 13 finished with value: 0.010366642827418313 and parameters: {'window_size': 6, 'batch_size': 16, 'network_type': 'RNN', 'num_layers': 2, 'num_neurons': 64, 'learning_rate': 0.01, 'dropout_rate': 0.1}. Best is trial 8 with value: 0.010007058838723413.

1/3 [=========>....................] - ETA: 1s
3/3 [==============================] - 1s 14ms/step
