[I 2024-09-28 00:29:31,765] Trial 185 finished with value: 0.030269000126765297 and parameters: {'learning_rate': 0.0001, 'batch_size': 16, 'network_type': 'GRU', 'num_layers': 1, 'num_neurons': 32, 'dropout_rate': 0.1}. Best is trial 180 with value: 0.02921919529254619.
[I 2024-09-28 00:29:42,921] Trial 186 finished with value: 0.031010637796842107 and parameters: {'learning_rate': 0.0001, 'batch_size': 16, 'network_type': 'GRU', 'num_layers': 1, 'num_neurons': 32, 'dropout_rate': 0.1}. Best is trial 180 with value: 0.02921919529254619.
[I 2024-09-28 00:29:48,828] Trial 187 finished with value: 0.04513481448246886 and parameters: {'learning_rate': 0.01, 'batch_size': 16, 'network_type': 'GRU', 'num_layers': 1, 'num_neurons': 32, 'dropout_rate': 0.1}. Best is trial 180 with value: 0.02921919529254619.
[I 2024-09-28 00:29:54,623] Trial 188 finished with value: 0.045213382574228175 and parameters: {'learning_rate': 0.01, 'batch_size': 16, 'network_type': 'GRU', 'num_layers': 1, 'num_neurons': 32, 'dropout_rate': 0.1}. Best is trial 180 with value: 0.02921919529254619.
[I 2024-09-28 00:30:00,064] Trial 189 finished with value: 0.03939778030835669 and parameters: {'learning_rate': 0.01, 'batch_size': 16, 'network_type': 'GRU', 'num_layers': 1, 'num_neurons': 32, 'dropout_rate': 0.1}. Best is trial 180 with value: 0.02921919529254619.
[I 2024-09-28 00:30:06,899] Trial 190 finished with value: 0.037251786818871105 and parameters: {'learning_rate': 0.01, 'batch_size': 16, 'network_type': 'GRU', 'num_layers': 1, 'num_neurons': 32, 'dropout_rate': 0.1}. Best is trial 180 with value: 0.02921919529254619.
[I 2024-09-28 00:30:21,916] Trial 191 finished with value: 0.029146899443406316 and parameters: {'learning_rate': 0.0001, 'batch_size': 16, 'network_type': 'GRU', 'num_layers': 1, 'num_neurons': 32, 'dropout_rate': 0.1}. Best is trial 191 with value: 0.029146899443406316.
[I 2024-09-28 00:30:37,473] Trial 192 finished with value: 0.03183989429473874 and parameters: {'learning_rate': 0.0001, 'batch_size': 16, 'network_type': 'GRU', 'num_layers': 1, 'num_neurons': 32, 'dropout_rate': 0.1}. Best is trial 191 with value: 0.029146899443406316.
[I 2024-09-28 00:30:47,703] Trial 193 finished with value: 0.031037714664752657 and parameters: {'learning_rate': 0.0001, 'batch_size': 16, 'network_type': 'GRU', 'num_layers': 1, 'num_neurons': 32, 'dropout_rate': 0.1}. Best is trial 191 with value: 0.029146899443406316.
[I 2024-09-28 00:30:59,193] Trial 194 finished with value: 0.03325345971034121 and parameters: {'learning_rate': 0.0001, 'batch_size': 16, 'network_type': 'GRU', 'num_layers': 1, 'num_neurons': 32, 'dropout_rate': 0.1}. Best is trial 191 with value: 0.029146899443406316.
[I 2024-09-28 00:31:09,650] Trial 195 finished with value: 0.02930088167924148 and parameters: {'learning_rate': 0.0001, 'batch_size': 16, 'network_type': 'GRU', 'num_layers': 1, 'num_neurons': 32, 'dropout_rate': 0.1}. Best is trial 191 with value: 0.029146899443406316.
[I 2024-09-28 00:31:15,371] Trial 196 finished with value: 0.03972309112548827 and parameters: {'learning_rate': 0.01, 'batch_size': 16, 'network_type': 'GRU', 'num_layers': 1, 'num_neurons': 32, 'dropout_rate': 0.1}. Best is trial 191 with value: 0.029146899443406316.
[I 2024-09-28 00:31:20,785] Trial 197 finished with value: 0.05831774084384627 and parameters: {'learning_rate': 0.01, 'batch_size': 16, 'network_type': 'GRU', 'num_layers': 1, 'num_neurons': 32, 'dropout_rate': 0.1}. Best is trial 191 with value: 0.029146899443406316.
[I 2024-09-28 00:31:27,365] Trial 198 finished with value: 0.03917255728061386 and parameters: {'learning_rate': 0.01, 'batch_size': 16, 'network_type': 'GRU', 'num_layers': 1, 'num_neurons': 32, 'dropout_rate': 0.1}. Best is trial 191 with value: 0.029146899443406316.
[I 2024-09-28 00:31:34,424] Trial 199 finished with value: 0.04492888285563541 and parameters: {'learning_rate': 0.01, 'batch_size': 16, 'network_type': 'GRU', 'num_layers': 1, 'num_neurons': 32, 'dropout_rate': 0.1}. Best is trial 191 with value: 0.029146899443406316.
C:\Users\user\AppData\Local\pypoetry\Cache\virtualenvs\transfer-learning-c0qmjA8b-py3.9\lib\site-packages\keras\src\engine\training.py:3103: UserWarning: You are saving your model as an HDF5 file via `model.save()`. This file format is considered legacy. We recommend using instead the native Keras format, e.g. `model.save('my_model.keras')`.
  saving_api.save_model(
[I 2024-09-28 00:31:45,621] A new study created in memory with name: no-name-71114e36-dd06-4cf0-8319-d91cb93067b1
[I 2024-09-28 00:31:49,970] Trial 0 finished with value: 0.03132912360297313 and parameters: {'learning_rate': 0.01, 'batch_size': 32, 'network_type': 'RNN', 'num_layers': 1, 'num_neurons': 32, 'dropout_rate': 0.3}. Best is trial 0 with value: 0.03132912360297313.
[I 2024-09-28 00:32:03,688] Trial 1 finished with value: 0.03795260291629364 and parameters: {'learning_rate': 0.0001, 'batch_size': 64, 'network_type': 'LSTM', 'num_layers': 2, 'num_neurons': 16, 'dropout_rate': 0.1}. Best is trial 0 with value: 0.03132912360297313.
[I 2024-09-28 00:32:12,972] Trial 2 finished with value: 0.015867952770657015 and parameters: {'learning_rate': 0.0001, 'batch_size': 32, 'network_type': 'RNN', 'num_layers': 2, 'num_neurons': 128, 'dropout_rate': 0.2}. Best is trial 2 with value: 0.015867952770657015.
[I 2024-09-28 00:32:23,097] Trial 3 finished with value: 0.022428400993347135 and parameters: {'learning_rate': 0.0001, 'batch_size': 32, 'network_type': 'LSTM', 'num_layers': 1, 'num_neurons': 128, 'dropout_rate': 0.1}. Best is trial 2 with value: 0.015867952770657015.
[I 2024-09-28 00:32:32,008] Trial 4 finished with value: 0.04043681928846575 and parameters: {'learning_rate': 0.01, 'batch_size': 16, 'network_type': 'GRU', 'num_layers': 2, 'num_neurons': 32, 'dropout_rate': 0.1}. Best is trial 2 with value: 0.015867952770657015.
[I 2024-09-28 00:32:42,597] Trial 5 finished with value: 0.02094445800781254 and parameters: {'learning_rate': 0.01, 'batch_size': 64, 'network_type': 'LSTM', 'num_layers': 2, 'num_neurons': 64, 'dropout_rate': 0.2}. Best is trial 2 with value: 0.015867952770657015.
[I 2024-09-28 00:32:51,774] Trial 6 finished with value: 0.02349038431379534 and parameters: {'learning_rate': 0.01, 'batch_size': 32, 'network_type': 'LSTM', 'num_layers': 2, 'num_neurons': 32, 'dropout_rate': 0.3}. Best is trial 2 with value: 0.015867952770657015.
[I 2024-09-28 00:33:18,702] Trial 7 finished with value: 0.0232457335789998 and parameters: {'learning_rate': 0.01, 'batch_size': 16, 'network_type': 'GRU', 'num_layers': 3, 'num_neurons': 128, 'dropout_rate': 0.3}. Best is trial 2 with value: 0.015867952770657015.
[I 2024-09-28 00:33:23,261] Trial 8 finished with value: 0.02285133213467066 and parameters: {'learning_rate': 0.01, 'batch_size': 32, 'network_type': 'RNN', 'num_layers': 1, 'num_neurons': 128, 'dropout_rate': 0.3}. Best is trial 2 with value: 0.015867952770657015.
[I 2024-09-28 00:33:26,981] Trial 9 finished with value: 0.023053763601515048 and parameters: {'learning_rate': 0.01, 'batch_size': 64, 'network_type': 'RNN', 'num_layers': 1, 'num_neurons': 64, 'dropout_rate': 0.2}. Best is trial 2 with value: 0.015867952770657015.
[I 2024-09-28 00:33:33,298] Trial 10 finished with value: 0.03387361939748132 and parameters: {'learning_rate': 0.01, 'batch_size': 32, 'network_type': 'RNN', 'num_layers': 3, 'num_neurons': 16, 'dropout_rate': 0.2}. Best is trial 2 with value: 0.015867952770657015.
[I 2024-09-28 00:33:42,721] Trial 11 finished with value: 0.024652237786187105 and parameters: {'learning_rate': 0.01, 'batch_size': 64, 'network_type': 'LSTM', 'num_layers': 2, 'num_neurons': 64, 'dropout_rate': 0.2}. Best is trial 2 with value: 0.015867952770657015.
[I 2024-09-28 00:33:49,309] Trial 12 finished with value: 0.031597265031602685 and parameters: {'learning_rate': 0.01, 'batch_size': 64, 'network_type': 'RNN', 'num_layers': 2, 'num_neurons': 64, 'dropout_rate': 0.2}. Best is trial 2 with value: 0.015867952770657015.
[I 2024-09-28 00:33:58,812] Trial 13 finished with value: 0.03561669762929284 and parameters: {'learning_rate': 0.01, 'batch_size': 64, 'network_type': 'LSTM', 'num_layers': 2, 'num_neurons': 128, 'dropout_rate': 0.2}. Best is trial 2 with value: 0.015867952770657015.
[I 2024-09-28 00:34:08,121] Trial 14 finished with value: 0.020072074360317674 and parameters: {'learning_rate': 0.01, 'batch_size': 16, 'network_type': 'GRU', 'num_layers': 2, 'num_neurons': 64, 'dropout_rate': 0.2}. Best is trial 2 with value: 0.015867952770657015.
[I 2024-09-28 00:34:17,177] Trial 15 finished with value: 0.019729346805148634 and parameters: {'learning_rate': 0.01, 'batch_size': 16, 'network_type': 'GRU', 'num_layers': 2, 'num_neurons': 64, 'dropout_rate': 0.2}. Best is trial 2 with value: 0.015867952770657015.
[I 2024-09-28 00:34:31,271] Trial 16 finished with value: 0.024592343330383255 and parameters: {'learning_rate': 0.01, 'batch_size': 16, 'network_type': 'GRU', 'num_layers': 3, 'num_neurons': 128, 'dropout_rate': 0.2}. Best is trial 2 with value: 0.015867952770657015.
[I 2024-09-28 00:34:40,356] Trial 17 finished with value: 0.047669419076707666 and parameters: {'learning_rate': 0.01, 'batch_size': 16, 'network_type': 'GRU', 'num_layers': 2, 'num_neurons': 16, 'dropout_rate': 0.2}. Best is trial 2 with value: 0.015867952770657015.
[I 2024-09-28 00:34:45,305] Trial 18 finished with value: 0.06493000952402747 and parameters: {'learning_rate': 0.01, 'batch_size': 16, 'network_type': 'RNN', 'num_layers': 2, 'num_neurons': 128, 'dropout_rate': 0.2}. Best is trial 2 with value: 0.015867952770657015.
[I 2024-09-28 00:54:21,501] Trial 19 finished with value: 0.049536925315856975 and parameters: {'learning_rate': 0.01, 'batch_size': 32, 'network_type': 'GRU', 'num_layers': 3, 'num_neurons': 64, 'dropout_rate': 0.1}. Best is trial 2 with value: 0.015867952770657015.
[I 2024-09-28 00:54:38,673] Trial 20 finished with value: 0.02453524208068843 and parameters: {'learning_rate': 0.01, 'batch_size': 16, 'network_type': 'GRU', 'num_layers': 2, 'num_neurons': 64, 'dropout_rate': 0.2}. Best is trial 2 with value: 0.015867952770657015.
[I 2024-09-28 00:54:51,989] Trial 21 finished with value: 0.038649660110473674 and parameters: {'learning_rate': 0.01, 'batch_size': 16, 'network_type': 'GRU', 'num_layers': 2, 'num_neurons': 64, 'dropout_rate': 0.2}. Best is trial 2 with value: 0.015867952770657015.
[I 2024-09-28 00:55:07,531] Trial 22 finished with value: 0.018364546140034972 and parameters: {'learning_rate': 0.01, 'batch_size': 16, 'network_type': 'GRU', 'num_layers': 2, 'num_neurons': 64, 'dropout_rate': 0.2}. Best is trial 2 with value: 0.015867952770657015.
[I 2024-09-28 00:55:26,727] Trial 23 finished with value: 0.024888472451104014 and parameters: {'learning_rate': 0.01, 'batch_size': 16, 'network_type': 'GRU', 'num_layers': 2, 'num_neurons': 64, 'dropout_rate': 0.2}. Best is trial 2 with value: 0.015867952770657015.
[I 2024-09-28 00:55:47,548] Trial 24 finished with value: 0.03942465294731992 and parameters: {'learning_rate': 0.01, 'batch_size': 16, 'network_type': 'GRU', 'num_layers': 2, 'num_neurons': 64, 'dropout_rate': 0.2}. Best is trial 2 with value: 0.015867952770657015.
[I 2024-09-28 00:55:59,196] Trial 25 finished with value: 0.048197529474894245 and parameters: {'learning_rate': 0.01, 'batch_size': 32, 'network_type': 'RNN', 'num_layers': 2, 'num_neurons': 128, 'dropout_rate': 0.2}. Best is trial 2 with value: 0.015867952770657015.
[I 2024-09-28 00:56:15,777] Trial 26 finished with value: 0.018258761299981014 and parameters: {'learning_rate': 0.01, 'batch_size': 16, 'network_type': 'GRU', 'num_layers': 2, 'num_neurons': 32, 'dropout_rate': 0.2}. Best is trial 2 with value: 0.015867952770657015.
[I 2024-09-28 00:56:24,249] Trial 27 finished with value: 0.018089404635959205 and parameters: {'learning_rate': 0.01, 'batch_size': 32, 'network_type': 'RNN', 'num_layers': 2, 'num_neurons': 32, 'dropout_rate': 0.2}. Best is trial 2 with value: 0.015867952770657015.
[I 2024-09-28 00:56:33,920] Trial 28 finished with value: 0.024445267147488084 and parameters: {'learning_rate': 0.01, 'batch_size': 32, 'network_type': 'RNN', 'num_layers': 3, 'num_neurons': 32, 'dropout_rate': 0.3}. Best is trial 2 with value: 0.015867952770657015.
[I 2024-09-28 00:56:39,448] Trial 29 finished with value: 0.026145757993062377 and parameters: {'learning_rate': 0.01, 'batch_size': 32, 'network_type': 'RNN', 'num_layers': 1, 'num_neurons': 32, 'dropout_rate': 0.1}. Best is trial 2 with value: 0.015867952770657015.
[I 2024-09-28 00:56:45,490] Trial 30 finished with value: 0.022007778379652274 and parameters: {'learning_rate': 0.01, 'batch_size': 32, 'network_type': 'RNN', 'num_layers': 1, 'num_neurons': 32, 'dropout_rate': 0.3}. Best is trial 2 with value: 0.015867952770657015.
[I 2024-09-28 00:56:54,038] Trial 31 finished with value: 0.0207147051493327 and parameters: {'learning_rate': 0.01, 'batch_size': 32, 'network_type': 'RNN', 'num_layers': 2, 'num_neurons': 32, 'dropout_rate': 0.2}. Best is trial 2 with value: 0.015867952770657015.
[I 2024-09-28 00:57:01,506] Trial 32 finished with value: 0.035707442389594224 and parameters: {'learning_rate': 0.01, 'batch_size': 32, 'network_type': 'RNN', 'num_layers': 2, 'num_neurons': 32, 'dropout_rate': 0.2}. Best is trial 2 with value: 0.015867952770657015.
[I 2024-09-28 00:57:15,144] Trial 33 finished with value: 0.027037059360080336 and parameters: {'learning_rate': 0.01, 'batch_size': 32, 'network_type': 'GRU', 'num_layers': 2, 'num_neurons': 32, 'dropout_rate': 0.2}. Best is trial 2 with value: 0.015867952770657015.
[I 2024-09-28 00:57:28,435] Trial 34 finished with value: 0.014100491629706478 and parameters: {'learning_rate': 0.0001, 'batch_size': 16, 'network_type': 'RNN', 'num_layers': 2, 'num_neurons': 16, 'dropout_rate': 0.1}. Best is trial 34 with value: 0.014100491629706478.
[I 2024-09-28 00:57:40,151] Trial 35 finished with value: 0.021062090343899165 and parameters: {'learning_rate': 0.0001, 'batch_size': 32, 'network_type': 'RNN', 'num_layers': 2, 'num_neurons': 16, 'dropout_rate': 0.1}. Best is trial 34 with value: 0.014100491629706478.
[I 2024-09-28 00:57:51,760] Trial 36 finished with value: 0.01442797078026666 and parameters: {'learning_rate': 0.0001, 'batch_size': 16, 'network_type': 'RNN', 'num_layers': 2, 'num_neurons': 16, 'dropout_rate': 0.1}. Best is trial 34 with value: 0.014100491629706478.
[I 2024-09-28 00:58:05,158] Trial 37 finished with value: 0.02000798882378469 and parameters: {'learning_rate': 0.0001, 'batch_size': 32, 'network_type': 'RNN', 'num_layers': 2, 'num_neurons': 16, 'dropout_rate': 0.1}. Best is trial 34 with value: 0.014100491629706478.
[I 2024-09-28 00:58:15,251] Trial 38 finished with value: 0.012845816718207479 and parameters: {'learning_rate': 0.0001, 'batch_size': 16, 'network_type': 'RNN', 'num_layers': 1, 'num_neurons': 16, 'dropout_rate': 0.1}. Best is trial 38 with value: 0.012845816718207479.
[I 2024-09-28 00:58:25,258] Trial 39 finished with value: 0.020059341536627844 and parameters: {'learning_rate': 0.0001, 'batch_size': 16, 'network_type': 'RNN', 'num_layers': 1, 'num_neurons': 16, 'dropout_rate': 0.1}. Best is trial 38 with value: 0.012845816718207479.
[I 2024-09-28 00:58:36,874] Trial 40 finished with value: 0.01260630162556965 and parameters: {'learning_rate': 0.0001, 'batch_size': 16, 'network_type': 'RNN', 'num_layers': 1, 'num_neurons': 16, 'dropout_rate': 0.1}. Best is trial 40 with value: 0.01260630162556965.
[I 2024-09-28 00:58:47,219] Trial 41 finished with value: 0.02524215083652069 and parameters: {'learning_rate': 0.0001, 'batch_size': 16, 'network_type': 'RNN', 'num_layers': 1, 'num_neurons': 16, 'dropout_rate': 0.1}. Best is trial 40 with value: 0.01260630162556965.
[I 2024-09-28 00:58:56,848] Trial 42 finished with value: 0.0156055224736531 and parameters: {'learning_rate': 0.0001, 'batch_size': 16, 'network_type': 'RNN', 'num_layers': 1, 'num_neurons': 16, 'dropout_rate': 0.1}. Best is trial 40 with value: 0.01260630162556965.
[I 2024-09-28 00:59:01,791] Trial 43 finished with value: 0.033851658397250746 and parameters: {'learning_rate': 0.01, 'batch_size': 16, 'network_type': 'RNN', 'num_layers': 1, 'num_neurons': 16, 'dropout_rate': 0.1}. Best is trial 40 with value: 0.01260630162556965.
[I 2024-09-28 00:59:07,350] Trial 44 finished with value: 0.029876704110039645 and parameters: {'learning_rate': 0.01, 'batch_size': 16, 'network_type': 'RNN', 'num_layers': 1, 'num_neurons': 16, 'dropout_rate': 0.1}. Best is trial 40 with value: 0.01260630162556965.
[I 2024-09-28 00:59:14,796] Trial 45 finished with value: 0.04011653041839604 and parameters: {'learning_rate': 0.01, 'batch_size': 16, 'network_type': 'RNN', 'num_layers': 1, 'num_neurons': 16, 'dropout_rate': 0.1}. Best is trial 40 with value: 0.01260630162556965.
[I 2024-09-28 00:59:23,637] Trial 46 finished with value: 0.02568194113837352 and parameters: {'learning_rate': 0.01, 'batch_size': 16, 'network_type': 'LSTM', 'num_layers': 1, 'num_neurons': 16, 'dropout_rate': 0.1}. Best is trial 40 with value: 0.01260630162556965.
[I 2024-09-28 00:59:29,291] Trial 47 finished with value: 0.01713482284545896 and parameters: {'learning_rate': 0.01, 'batch_size': 16, 'network_type': 'RNN', 'num_layers': 1, 'num_neurons': 16, 'dropout_rate': 0.1}. Best is trial 40 with value: 0.01260630162556965.
[I 2024-09-28 00:59:34,827] Trial 48 finished with value: 0.025974904590182875 and parameters: {'learning_rate': 0.01, 'batch_size': 16, 'network_type': 'RNN', 'num_layers': 1, 'num_neurons': 16, 'dropout_rate': 0.1}. Best is trial 40 with value: 0.01260630162556965.
[I 2024-09-28 00:59:41,161] Trial 49 finished with value: 0.04591779751247834 and parameters: {'learning_rate': 0.01, 'batch_size': 64, 'network_type': 'RNN', 'num_layers': 1, 'num_neurons': 16, 'dropout_rate': 0.1}. Best is trial 40 with value: 0.01260630162556965.
[I 2024-09-28 00:59:53,722] Trial 50 finished with value: 0.01991851954989965 and parameters: {'learning_rate': 0.01, 'batch_size': 16, 'network_type': 'LSTM', 'num_layers': 1, 'num_neurons': 16, 'dropout_rate': 0.1}. Best is trial 40 with value: 0.01260630162556965.
[I 2024-09-28 01:00:04,030] Trial 51 finished with value: 0.014072491751776765 and parameters: {'learning_rate': 0.0001, 'batch_size': 16, 'network_type': 'RNN', 'num_layers': 1, 'num_neurons': 16, 'dropout_rate': 0.1}. Best is trial 40 with value: 0.01260630162556965.
[I 2024-09-28 01:00:13,318] Trial 52 finished with value: 0.013926144282023125 and parameters: {'learning_rate': 0.0001, 'batch_size': 16, 'network_type': 'RNN', 'num_layers': 1, 'num_neurons': 16, 'dropout_rate': 0.1}. Best is trial 40 with value: 0.01260630162556965.
[I 2024-09-28 01:00:18,207] Trial 53 finished with value: 0.02592552545335562 and parameters: {'learning_rate': 0.01, 'batch_size': 16, 'network_type': 'RNN', 'num_layers': 1, 'num_neurons': 16, 'dropout_rate': 0.1}. Best is trial 40 with value: 0.01260630162556965.
[I 2024-09-28 01:00:23,107] Trial 54 finished with value: 0.01740198410881888 and parameters: {'learning_rate': 0.01, 'batch_size': 16, 'network_type': 'RNN', 'num_layers': 1, 'num_neurons': 16, 'dropout_rate': 0.1}. Best is trial 40 with value: 0.01260630162556965.
[I 2024-09-28 01:00:29,983] Trial 55 finished with value: 0.05279454157087541 and parameters: {'learning_rate': 0.01, 'batch_size': 16, 'network_type': 'RNN', 'num_layers': 1, 'num_neurons': 16, 'dropout_rate': 0.1}. Best is trial 40 with value: 0.01260630162556965.
[I 2024-09-28 01:00:38,218] Trial 56 finished with value: 0.027294740041097023 and parameters: {'learning_rate': 0.01, 'batch_size': 16, 'network_type': 'RNN', 'num_layers': 3, 'num_neurons': 16, 'dropout_rate': 0.1}. Best is trial 40 with value: 0.01260630162556965.
[I 2024-09-28 01:00:43,236] Trial 57 finished with value: 0.02302731238471139 and parameters: {'learning_rate': 0.01, 'batch_size': 64, 'network_type': 'RNN', 'num_layers': 1, 'num_neurons': 16, 'dropout_rate': 0.1}. Best is trial 40 with value: 0.01260630162556965.
[I 2024-09-28 01:00:50,975] Trial 58 finished with value: 0.017107340282864068 and parameters: {'learning_rate': 0.01, 'batch_size': 16, 'network_type': 'LSTM', 'num_layers': 1, 'num_neurons': 16, 'dropout_rate': 0.1}. Best is trial 40 with value: 0.01260630162556965.
[I 2024-09-28 01:00:55,984] Trial 59 finished with value: 0.01817343182033963 and parameters: {'learning_rate': 0.01, 'batch_size': 16, 'network_type': 'RNN', 'num_layers': 1, 'num_neurons': 16, 'dropout_rate': 0.3}. Best is trial 40 with value: 0.01260630162556965.
[I 2024-09-28 01:01:06,546] Trial 60 finished with value: 0.04847356520758739 and parameters: {'learning_rate': 0.01, 'batch_size': 16, 'network_type': 'RNN', 'num_layers': 3, 'num_neurons': 16, 'dropout_rate': 0.1}. Best is trial 40 with value: 0.01260630162556965.
[I 2024-09-28 01:01:15,763] Trial 61 finished with value: 0.014554337501525893 and parameters: {'learning_rate': 0.0001, 'batch_size': 16, 'network_type': 'RNN', 'num_layers': 1, 'num_neurons': 16, 'dropout_rate': 0.1}. Best is trial 40 with value: 0.01260630162556965.
[I 2024-09-28 01:01:24,643] Trial 62 finished with value: 0.022550179905361567 and parameters: {'learning_rate': 0.0001, 'batch_size': 16, 'network_type': 'RNN', 'num_layers': 1, 'num_neurons': 16, 'dropout_rate': 0.1}. Best is trial 40 with value: 0.01260630162556965.
[I 2024-09-28 01:01:29,301] Trial 63 finished with value: 0.05167425515916616 and parameters: {'learning_rate': 0.01, 'batch_size': 16, 'network_type': 'RNN', 'num_layers': 1, 'num_neurons': 16, 'dropout_rate': 0.1}. Best is trial 40 with value: 0.01260630162556965.
[I 2024-09-28 01:01:34,119] Trial 64 finished with value: 0.02585015869140629 and parameters: {'learning_rate': 0.01, 'batch_size': 16, 'network_type': 'RNN', 'num_layers': 1, 'num_neurons': 16, 'dropout_rate': 0.1}. Best is trial 40 with value: 0.01260630162556965.
