[I 2024-09-27 23:43:58,873] Trial 142 finished with value: 0.027957941935612577 and parameters: {'learning_rate': 0.0001, 'batch_size': 16, 'network_type': 'LSTM', 'num_layers': 3, 'num_neurons': 64, 'dropout_rate': 0.2}. Best is trial 61 with value: 0.0228115772834191.
[I 2024-09-27 23:44:11,580] Trial 143 finished with value: 0.05009930874751169 and parameters: {'learning_rate': 0.01, 'batch_size': 16, 'network_type': 'LSTM', 'num_layers': 3, 'num_neurons': 64, 'dropout_rate': 0.2}. Best is trial 61 with value: 0.0228115772834191.
[I 2024-09-27 23:44:26,269] Trial 144 finished with value: 0.033645691284766584 and parameters: {'learning_rate': 0.01, 'batch_size': 16, 'network_type': 'LSTM', 'num_layers': 3, 'num_neurons': 64, 'dropout_rate': 0.2}. Best is trial 61 with value: 0.0228115772834191.
[I 2024-09-27 23:44:41,236] Trial 145 finished with value: 0.05080504762209381 and parameters: {'learning_rate': 0.01, 'batch_size': 16, 'network_type': 'LSTM', 'num_layers': 3, 'num_neurons': 64, 'dropout_rate': 0.2}. Best is trial 61 with value: 0.0228115772834191.
[I 2024-09-27 23:44:53,801] Trial 146 finished with value: 0.0361274544642522 and parameters: {'learning_rate': 0.01, 'batch_size': 16, 'network_type': 'LSTM', 'num_layers': 3, 'num_neurons': 64, 'dropout_rate': 0.2}. Best is trial 61 with value: 0.0228115772834191.
[I 2024-09-27 23:45:07,408] Trial 147 finished with value: 0.04501587449587306 and parameters: {'learning_rate': 0.0001, 'batch_size': 16, 'network_type': 'LSTM', 'num_layers': 3, 'num_neurons': 64, 'dropout_rate': 0.2}. Best is trial 61 with value: 0.0228115772834191.
[I 2024-09-27 23:45:26,039] Trial 148 finished with value: 0.026301682765667245 and parameters: {'learning_rate': 0.0001, 'batch_size': 16, 'network_type': 'LSTM', 'num_layers': 3, 'num_neurons': 64, 'dropout_rate': 0.2}. Best is trial 61 with value: 0.0228115772834191.
[I 2024-09-27 23:45:39,525] Trial 149 finished with value: 0.0326862399027898 and parameters: {'learning_rate': 0.01, 'batch_size': 16, 'network_type': 'LSTM', 'num_layers': 3, 'num_neurons': 64, 'dropout_rate': 0.2}. Best is trial 61 with value: 0.0228115772834191.
[I 2024-09-27 23:45:53,538] Trial 150 finished with value: 0.04103089714050297 and parameters: {'learning_rate': 0.01, 'batch_size': 16, 'network_type': 'LSTM', 'num_layers': 3, 'num_neurons': 64, 'dropout_rate': 0.2}. Best is trial 61 with value: 0.0228115772834191.
[I 2024-09-27 23:46:05,913] Trial 151 finished with value: 0.05679250519092264 and parameters: {'learning_rate': 0.01, 'batch_size': 16, 'network_type': 'LSTM', 'num_layers': 3, 'num_neurons': 64, 'dropout_rate': 0.2}. Best is trial 61 with value: 0.0228115772834191.
[I 2024-09-27 23:46:20,340] Trial 152 finished with value: 0.03883865998341491 and parameters: {'learning_rate': 0.01, 'batch_size': 16, 'network_type': 'LSTM', 'num_layers': 3, 'num_neurons': 64, 'dropout_rate': 0.2}. Best is trial 61 with value: 0.0228115772834191.
[I 2024-09-27 23:46:32,984] Trial 153 finished with value: 0.030057110639718873 and parameters: {'learning_rate': 0.01, 'batch_size': 16, 'network_type': 'LSTM', 'num_layers': 3, 'num_neurons': 64, 'dropout_rate': 0.2}. Best is trial 61 with value: 0.0228115772834191.
[I 2024-09-27 23:46:53,488] Trial 154 finished with value: 0.024316789040198704 and parameters: {'learning_rate': 0.0001, 'batch_size': 16, 'network_type': 'LSTM', 'num_layers': 3, 'num_neurons': 64, 'dropout_rate': 0.2}. Best is trial 61 with value: 0.0228115772834191.
[I 2024-09-27 23:47:05,952] Trial 155 finished with value: 0.03836469426521892 and parameters: {'learning_rate': 0.01, 'batch_size': 16, 'network_type': 'LSTM', 'num_layers': 3, 'num_neurons': 64, 'dropout_rate': 0.2}. Best is trial 61 with value: 0.0228115772834191.
[I 2024-09-27 23:47:18,102] Trial 156 finished with value: 0.034103830337524406 and parameters: {'learning_rate': 0.01, 'batch_size': 16, 'network_type': 'LSTM', 'num_layers': 3, 'num_neurons': 64, 'dropout_rate': 0.2}. Best is trial 61 with value: 0.0228115772834191.
[I 2024-09-27 23:47:33,232] Trial 157 finished with value: 0.031781074597285366 and parameters: {'learning_rate': 0.01, 'batch_size': 16, 'network_type': 'LSTM', 'num_layers': 3, 'num_neurons': 64, 'dropout_rate': 0.2}. Best is trial 61 with value: 0.0228115772834191.
[I 2024-09-27 23:47:52,261] Trial 158 finished with value: 0.02436072613642766 and parameters: {'learning_rate': 0.0001, 'batch_size': 16, 'network_type': 'LSTM', 'num_layers': 3, 'num_neurons': 64, 'dropout_rate': 0.2}. Best is trial 61 with value: 0.0228115772834191.
[I 2024-09-27 23:48:06,667] Trial 159 finished with value: 0.04043923095556405 and parameters: {'learning_rate': 0.01, 'batch_size': 16, 'network_type': 'LSTM', 'num_layers': 3, 'num_neurons': 64, 'dropout_rate': 0.2}. Best is trial 61 with value: 0.0228115772834191.
[I 2024-09-27 23:48:20,032] Trial 160 finished with value: 0.035120025928203895 and parameters: {'learning_rate': 0.01, 'batch_size': 16, 'network_type': 'LSTM', 'num_layers': 3, 'num_neurons': 64, 'dropout_rate': 0.2}. Best is trial 61 with value: 0.0228115772834191.
[I 2024-09-27 23:48:33,582] Trial 161 finished with value: 0.03071477453525251 and parameters: {'learning_rate': 0.01, 'batch_size': 16, 'network_type': 'LSTM', 'num_layers': 3, 'num_neurons': 64, 'dropout_rate': 0.2}. Best is trial 61 with value: 0.0228115772834191.
[I 2024-09-27 23:48:46,985] Trial 162 finished with value: 0.045104497432708716 and parameters: {'learning_rate': 0.01, 'batch_size': 16, 'network_type': 'LSTM', 'num_layers': 3, 'num_neurons': 64, 'dropout_rate': 0.2}. Best is trial 61 with value: 0.0228115772834191.
[I 2024-09-27 23:49:00,150] Trial 163 finished with value: 0.043037459190075185 and parameters: {'learning_rate': 0.01, 'batch_size': 16, 'network_type': 'LSTM', 'num_layers': 3, 'num_neurons': 64, 'dropout_rate': 0.2}. Best is trial 61 with value: 0.0228115772834191.
[I 2024-09-27 23:49:15,418] Trial 164 finished with value: 0.031800575623145505 and parameters: {'learning_rate': 0.01, 'batch_size': 16, 'network_type': 'LSTM', 'num_layers': 3, 'num_neurons': 64, 'dropout_rate': 0.2}. Best is trial 61 with value: 0.0228115772834191.
[I 2024-09-27 23:49:28,469] Trial 165 finished with value: 0.04493816837897665 and parameters: {'learning_rate': 0.0001, 'batch_size': 16, 'network_type': 'LSTM', 'num_layers': 3, 'num_neurons': 64, 'dropout_rate': 0.2}. Best is trial 61 with value: 0.0228115772834191.
[I 2024-09-27 23:49:48,520] Trial 166 finished with value: 0.024793703446021446 and parameters: {'learning_rate': 0.0001, 'batch_size': 16, 'network_type': 'LSTM', 'num_layers': 3, 'num_neurons': 64, 'dropout_rate': 0.2}. Best is trial 61 with value: 0.0228115772834191.
[I 2024-09-27 23:50:01,489] Trial 167 finished with value: 0.036312012085547796 and parameters: {'learning_rate': 0.01, 'batch_size': 16, 'network_type': 'LSTM', 'num_layers': 3, 'num_neurons': 64, 'dropout_rate': 0.2}. Best is trial 61 with value: 0.0228115772834191.
[I 2024-09-27 23:50:15,715] Trial 168 finished with value: 0.04457872148660517 and parameters: {'learning_rate': 0.01, 'batch_size': 16, 'network_type': 'LSTM', 'num_layers': 3, 'num_neurons': 64, 'dropout_rate': 0.2}. Best is trial 61 with value: 0.0228115772834191.
[I 2024-09-27 23:50:31,093] Trial 169 finished with value: 0.037312523181621864 and parameters: {'learning_rate': 0.01, 'batch_size': 16, 'network_type': 'LSTM', 'num_layers': 3, 'num_neurons': 16, 'dropout_rate': 0.2}. Best is trial 61 with value: 0.0228115772834191.
[I 2024-09-27 23:50:43,169] Trial 170 finished with value: 0.08039853224387539 and parameters: {'learning_rate': 0.01, 'batch_size': 16, 'network_type': 'LSTM', 'num_layers': 3, 'num_neurons': 64, 'dropout_rate': 0.2}. Best is trial 61 with value: 0.0228115772834191.
[I 2024-09-27 23:50:56,911] Trial 171 finished with value: 0.02999847800915059 and parameters: {'learning_rate': 0.01, 'batch_size': 16, 'network_type': 'LSTM', 'num_layers': 3, 'num_neurons': 64, 'dropout_rate': 0.2}. Best is trial 61 with value: 0.0228115772834191.
[I 2024-09-27 23:51:09,646] Trial 172 finished with value: 0.028369707180903498 and parameters: {'learning_rate': 0.01, 'batch_size': 16, 'network_type': 'LSTM', 'num_layers': 3, 'num_neurons': 64, 'dropout_rate': 0.2}. Best is trial 61 with value: 0.0228115772834191.
[I 2024-09-27 23:51:30,163] Trial 173 finished with value: 0.02453800868988037 and parameters: {'learning_rate': 0.0001, 'batch_size': 16, 'network_type': 'LSTM', 'num_layers': 3, 'num_neurons': 64, 'dropout_rate': 0.2}. Best is trial 61 with value: 0.0228115772834191.
[I 2024-09-27 23:51:42,943] Trial 174 finished with value: 0.0421649626218356 and parameters: {'learning_rate': 0.01, 'batch_size': 16, 'network_type': 'LSTM', 'num_layers': 3, 'num_neurons': 64, 'dropout_rate': 0.2}. Best is trial 61 with value: 0.0228115772834191.
[I 2024-09-27 23:51:56,854] Trial 175 finished with value: 0.04163210626748896 and parameters: {'learning_rate': 0.01, 'batch_size': 16, 'network_type': 'LSTM', 'num_layers': 3, 'num_neurons': 64, 'dropout_rate': 0.2}. Best is trial 61 with value: 0.0228115772834191.
[I 2024-09-27 23:52:11,904] Trial 176 finished with value: 0.03855870738396282 and parameters: {'learning_rate': 0.01, 'batch_size': 16, 'network_type': 'LSTM', 'num_layers': 3, 'num_neurons': 64, 'dropout_rate': 0.2}. Best is trial 61 with value: 0.0228115772834191.
[I 2024-09-27 23:52:24,524] Trial 177 finished with value: 0.032144442851726844 and parameters: {'learning_rate': 0.01, 'batch_size': 16, 'network_type': 'LSTM', 'num_layers': 3, 'num_neurons': 64, 'dropout_rate': 0.2}. Best is trial 61 with value: 0.0228115772834191.
[I 2024-09-27 23:52:37,552] Trial 178 finished with value: 0.03312453578068662 and parameters: {'learning_rate': 0.01, 'batch_size': 16, 'network_type': 'LSTM', 'num_layers': 3, 'num_neurons': 64, 'dropout_rate': 0.2}. Best is trial 61 with value: 0.0228115772834191.
[I 2024-09-27 23:52:51,195] Trial 179 finished with value: 0.03659074541238642 and parameters: {'learning_rate': 0.01, 'batch_size': 16, 'network_type': 'LSTM', 'num_layers': 3, 'num_neurons': 64, 'dropout_rate': 0.2}. Best is trial 61 with value: 0.0228115772834191.
[I 2024-09-27 23:53:03,590] Trial 180 finished with value: 0.040794101641728364 and parameters: {'learning_rate': 0.01, 'batch_size': 16, 'network_type': 'LSTM', 'num_layers': 3, 'num_neurons': 64, 'dropout_rate': 0.2}. Best is trial 61 with value: 0.0228115772834191.
[I 2024-09-27 23:53:23,985] Trial 181 finished with value: 0.024527389893165 and parameters: {'learning_rate': 0.0001, 'batch_size': 16, 'network_type': 'LSTM', 'num_layers': 3, 'num_neurons': 64, 'dropout_rate': 0.2}. Best is trial 61 with value: 0.0228115772834191.
[I 2024-09-27 23:53:42,366] Trial 182 finished with value: 0.024698693642249473 and parameters: {'learning_rate': 0.0001, 'batch_size': 16, 'network_type': 'LSTM', 'num_layers': 3, 'num_neurons': 64, 'dropout_rate': 0.2}. Best is trial 61 with value: 0.0228115772834191.
[I 2024-09-27 23:54:02,627] Trial 183 finished with value: 0.025346691204951366 and parameters: {'learning_rate': 0.0001, 'batch_size': 16, 'network_type': 'LSTM', 'num_layers': 3, 'num_neurons': 64, 'dropout_rate': 0.2}. Best is trial 61 with value: 0.0228115772834191.
[I 2024-09-27 23:54:14,950] Trial 184 finished with value: 0.04521147860013519 and parameters: {'learning_rate': 0.0001, 'batch_size': 16, 'network_type': 'LSTM', 'num_layers': 3, 'num_neurons': 64, 'dropout_rate': 0.2}. Best is trial 61 with value: 0.0228115772834191.
[I 2024-09-27 23:54:28,313] Trial 185 finished with value: 0.0334443500958956 and parameters: {'learning_rate': 0.01, 'batch_size': 16, 'network_type': 'LSTM', 'num_layers': 3, 'num_neurons': 64, 'dropout_rate': 0.2}. Best is trial 61 with value: 0.0228115772834191.
[I 2024-09-27 23:54:41,426] Trial 186 finished with value: 0.04523867665804347 and parameters: {'learning_rate': 0.0001, 'batch_size': 16, 'network_type': 'LSTM', 'num_layers': 3, 'num_neurons': 16, 'dropout_rate': 0.2}. Best is trial 61 with value: 0.0228115772834191.
[I 2024-09-27 23:54:53,372] Trial 187 finished with value: 0.03272545975905201 and parameters: {'learning_rate': 0.01, 'batch_size': 16, 'network_type': 'LSTM', 'num_layers': 3, 'num_neurons': 64, 'dropout_rate': 0.2}. Best is trial 61 with value: 0.0228115772834191.
[I 2024-09-27 23:55:12,960] Trial 188 finished with value: 0.034549980897169805 and parameters: {'learning_rate': 0.0001, 'batch_size': 32, 'network_type': 'LSTM', 'num_layers': 3, 'num_neurons': 64, 'dropout_rate': 0.2}. Best is trial 61 with value: 0.0228115772834191.
[I 2024-09-27 23:55:32,153] Trial 189 finished with value: 0.025973923389728225 and parameters: {'learning_rate': 0.0001, 'batch_size': 16, 'network_type': 'LSTM', 'num_layers': 2, 'num_neurons': 64, 'dropout_rate': 0.2}. Best is trial 61 with value: 0.0228115772834191.
[I 2024-09-27 23:55:51,751] Trial 190 finished with value: 0.03868452820411099 and parameters: {'learning_rate': 0.01, 'batch_size': 16, 'network_type': 'LSTM', 'num_layers': 3, 'num_neurons': 64, 'dropout_rate': 0.2}. Best is trial 61 with value: 0.0228115772834191.
[I 2024-09-28 00:04:44,469] Trial 191 finished with value: 0.035268267154693604 and parameters: {'learning_rate': 0.01, 'batch_size': 16, 'network_type': 'LSTM', 'num_layers': 2, 'num_neurons': 64, 'dropout_rate': 0.2}. Best is trial 61 with value: 0.0228115772834191.
[I 2024-09-28 00:05:06,986] Trial 192 finished with value: 0.03596206074494584 and parameters: {'learning_rate': 0.01, 'batch_size': 16, 'network_type': 'LSTM', 'num_layers': 3, 'num_neurons': 64, 'dropout_rate': 0.2}. Best is trial 61 with value: 0.0228115772834191.
[I 2024-09-28 00:05:24,376] Trial 193 finished with value: 0.03506742583788357 and parameters: {'learning_rate': 0.01, 'batch_size': 16, 'network_type': 'LSTM', 'num_layers': 2, 'num_neurons': 64, 'dropout_rate': 0.2}. Best is trial 61 with value: 0.0228115772834191.
[I 2024-09-28 00:05:43,779] Trial 194 finished with value: 0.038564417875730096 and parameters: {'learning_rate': 0.01, 'batch_size': 16, 'network_type': 'LSTM', 'num_layers': 2, 'num_neurons': 64, 'dropout_rate': 0.2}. Best is trial 61 with value: 0.0228115772834191.
[I 2024-09-28 00:05:53,373] Trial 195 finished with value: 0.036701666685251086 and parameters: {'learning_rate': 0.01, 'batch_size': 16, 'network_type': 'RNN', 'num_layers': 2, 'num_neurons': 64, 'dropout_rate': 0.2}. Best is trial 61 with value: 0.0228115772834191.
[I 2024-09-28 00:06:12,622] Trial 196 finished with value: 0.040407465127798275 and parameters: {'learning_rate': 0.01, 'batch_size': 16, 'network_type': 'LSTM', 'num_layers': 3, 'num_neurons': 64, 'dropout_rate': 0.2}. Best is trial 61 with value: 0.0228115772834191.
[I 2024-09-28 00:06:32,257] Trial 197 finished with value: 0.035550891949580304 and parameters: {'learning_rate': 0.01, 'batch_size': 16, 'network_type': 'LSTM', 'num_layers': 3, 'num_neurons': 64, 'dropout_rate': 0.2}. Best is trial 61 with value: 0.0228115772834191.
[I 2024-09-28 00:06:49,608] Trial 198 finished with value: 0.036147440360142655 and parameters: {'learning_rate': 0.01, 'batch_size': 16, 'network_type': 'LSTM', 'num_layers': 3, 'num_neurons': 64, 'dropout_rate': 0.2}. Best is trial 61 with value: 0.0228115772834191.
[I 2024-09-28 00:07:08,511] Trial 199 finished with value: 0.03339409032234778 and parameters: {'learning_rate': 0.01, 'batch_size': 32, 'network_type': 'LSTM', 'num_layers': 3, 'num_neurons': 64, 'dropout_rate': 0.2}. Best is trial 61 with value: 0.0228115772834191.
C:\Users\user\AppData\Local\pypoetry\Cache\virtualenvs\transfer-learning-c0qmjA8b-py3.9\lib\site-packages\keras\src\engine\training.py:3103: UserWarning: You are saving your model as an HDF5 file via `model.save()`. This file format is considered legacy. We recommend using instead the native Keras format, e.g. `model.save('my_model.keras')`.
  saving_api.save_model(
[I 2024-09-28 00:07:23,684] A new study created in memory with name: no-name-c826980c-3b9e-4e7b-94d0-4afb911d9929
[I 2024-09-28 00:07:32,427] Trial 0 finished with value: 0.05022649999765253 and parameters: {'learning_rate': 0.01, 'batch_size': 16, 'network_type': 'LSTM', 'num_layers': 1, 'num_neurons': 128, 'dropout_rate': 0.2}. Best is trial 0 with value: 0.05022649999765253.
[I 2024-09-28 00:07:41,924] Trial 1 finished with value: 0.039866726728586085 and parameters: {'learning_rate': 0.01, 'batch_size': 64, 'network_type': 'RNN', 'num_layers': 3, 'num_neurons': 16, 'dropout_rate': 0.3}. Best is trial 1 with value: 0.039866726728586085.
[I 2024-09-28 00:07:50,481] Trial 2 finished with value: 0.09243539175620448 and parameters: {'learning_rate': 0.01, 'batch_size': 16, 'network_type': 'RNN', 'num_layers': 3, 'num_neurons': 32, 'dropout_rate': 0.2}. Best is trial 1 with value: 0.039866726728586085.
[I 2024-09-28 00:08:08,717] Trial 3 finished with value: 0.03909590592751137 and parameters: {'learning_rate': 0.01, 'batch_size': 16, 'network_type': 'GRU', 'num_layers': 3, 'num_neurons': 16, 'dropout_rate': 0.2}. Best is trial 3 with value: 0.03909590592751137.
[I 2024-09-28 00:08:25,693] Trial 4 finished with value: 0.03945414121334368 and parameters: {'learning_rate': 0.01, 'batch_size': 16, 'network_type': 'GRU', 'num_layers': 3, 'num_neurons': 32, 'dropout_rate': 0.1}. Best is trial 3 with value: 0.03909590592751137.
[I 2024-09-28 00:08:32,026] Trial 5 finished with value: 0.1035935096373925 and parameters: {'learning_rate': 0.01, 'batch_size': 64, 'network_type': 'RNN', 'num_layers': 2, 'num_neurons': 128, 'dropout_rate': 0.1}. Best is trial 3 with value: 0.03909590592751137.
[I 2024-09-28 00:08:36,640] Trial 6 finished with value: 0.03477203882657564 and parameters: {'learning_rate': 0.01, 'batch_size': 64, 'network_type': 'RNN', 'num_layers': 1, 'num_neurons': 32, 'dropout_rate': 0.1}. Best is trial 6 with value: 0.03477203882657564.
[I 2024-09-28 00:08:54,847] Trial 7 finished with value: 0.04147133299020618 and parameters: {'learning_rate': 0.0001, 'batch_size': 64, 'network_type': 'LSTM', 'num_layers': 1, 'num_neurons': 64, 'dropout_rate': 0.2}. Best is trial 6 with value: 0.03477203882657564.
[I 2024-09-28 00:09:07,946] Trial 8 finished with value: 0.04124744998491731 and parameters: {'learning_rate': 0.01, 'batch_size': 16, 'network_type': 'GRU', 'num_layers': 2, 'num_neurons': 128, 'dropout_rate': 0.3}. Best is trial 6 with value: 0.03477203882657564.
[I 2024-09-28 00:09:33,807] Trial 9 finished with value: 0.03939124870300295 and parameters: {'learning_rate': 0.01, 'batch_size': 32, 'network_type': 'LSTM', 'num_layers': 3, 'num_neurons': 128, 'dropout_rate': 0.2}. Best is trial 6 with value: 0.03477203882657564.
[I 2024-09-28 00:09:40,405] Trial 10 finished with value: 0.03731156514241144 and parameters: {'learning_rate': 0.01, 'batch_size': 32, 'network_type': 'RNN', 'num_layers': 1, 'num_neurons': 32, 'dropout_rate': 0.1}. Best is trial 6 with value: 0.03477203882657564.
[I 2024-09-28 00:09:44,933] Trial 11 finished with value: 0.0396404674970187 and parameters: {'learning_rate': 0.01, 'batch_size': 32, 'network_type': 'RNN', 'num_layers': 1, 'num_neurons': 32, 'dropout_rate': 0.1}. Best is trial 6 with value: 0.03477203882657564.
[I 2024-09-28 00:09:49,423] Trial 12 finished with value: 0.04648934378990764 and parameters: {'learning_rate': 0.01, 'batch_size': 32, 'network_type': 'RNN', 'num_layers': 1, 'num_neurons': 32, 'dropout_rate': 0.1}. Best is trial 6 with value: 0.03477203882657564.
[I 2024-09-28 00:09:54,041] Trial 13 finished with value: 0.037993531557229884 and parameters: {'learning_rate': 0.01, 'batch_size': 32, 'network_type': 'RNN', 'num_layers': 1, 'num_neurons': 32, 'dropout_rate': 0.1}. Best is trial 6 with value: 0.03477203882657564.
[I 2024-09-28 00:09:59,261] Trial 14 finished with value: 0.03774790540108318 and parameters: {'learning_rate': 0.01, 'batch_size': 64, 'network_type': 'RNN', 'num_layers': 1, 'num_neurons': 64, 'dropout_rate': 0.1}. Best is trial 6 with value: 0.03477203882657564.
[I 2024-09-28 00:10:04,534] Trial 15 finished with value: 0.04004123995854308 and parameters: {'learning_rate': 0.01, 'batch_size': 32, 'network_type': 'RNN', 'num_layers': 1, 'num_neurons': 32, 'dropout_rate': 0.1}. Best is trial 6 with value: 0.03477203882657564.
[I 2024-09-28 00:10:09,202] Trial 16 finished with value: 0.046364183205824666 and parameters: {'learning_rate': 0.01, 'batch_size': 64, 'network_type': 'RNN', 'num_layers': 1, 'num_neurons': 32, 'dropout_rate': 0.1}. Best is trial 6 with value: 0.03477203882657564.
[I 2024-09-28 00:10:16,393] Trial 17 finished with value: 0.03645071576191832 and parameters: {'learning_rate': 0.01, 'batch_size': 64, 'network_type': 'RNN', 'num_layers': 2, 'num_neurons': 32, 'dropout_rate': 0.3}. Best is trial 6 with value: 0.03477203882657564.
[I 2024-09-28 00:10:26,761] Trial 18 finished with value: 0.03977162064038794 and parameters: {'learning_rate': 0.01, 'batch_size': 64, 'network_type': 'GRU', 'num_layers': 2, 'num_neurons': 16, 'dropout_rate': 0.3}. Best is trial 6 with value: 0.03477203882657564.
[I 2024-09-28 00:10:38,563] Trial 19 finished with value: 0.04483196786733778 and parameters: {'learning_rate': 0.01, 'batch_size': 64, 'network_type': 'LSTM', 'num_layers': 2, 'num_neurons': 64, 'dropout_rate': 0.3}. Best is trial 6 with value: 0.03477203882657564.
[I 2024-09-28 00:10:44,464] Trial 20 finished with value: 0.042721092297480695 and parameters: {'learning_rate': 0.01, 'batch_size': 64, 'network_type': 'RNN', 'num_layers': 2, 'num_neurons': 32, 'dropout_rate': 0.3}. Best is trial 6 with value: 0.03477203882657564.
[I 2024-09-28 00:10:50,151] Trial 21 finished with value: 0.07475347672975982 and parameters: {'learning_rate': 0.01, 'batch_size': 32, 'network_type': 'RNN', 'num_layers': 2, 'num_neurons': 32, 'dropout_rate': 0.3}. Best is trial 6 with value: 0.03477203882657564.
