[I 2024-09-27 22:24:45,458] Trial 98 finished with value: 0.01472401491800943 and parameters: {'window_size': 6, 'batch_size': 16, 'network_type': 'GRU', 'num_layers': 1, 'num_neurons': 128, 'learning_rate': 0.01, 'dropout_rate': 0.3}. Best is trial 41 with value: 0.013343700938754624.

1/1 [==============================] - ETA: 0s
1/1 [==============================] - 0s 468ms/step
[I 2024-09-27 22:24:51,225] Trial 99 finished with value: 0.07847312079535593 and parameters: {'window_size': 6, 'batch_size': 16, 'network_type': 'LSTM', 'num_layers': 3, 'num_neurons': 128, 'learning_rate': 0.01, 'dropout_rate': 0.3}. Best is trial 41 with value: 0.013343700938754624.

1/1 [==============================] - ETA: 0s
1/1 [==============================] - 0s 185ms/step
[I 2024-09-27 22:24:54,040] Trial 100 finished with value: 0.034799249869126574 and parameters: {'window_size': 2, 'batch_size': 16, 'network_type': 'GRU', 'num_layers': 1, 'num_neurons': 16, 'learning_rate': 0.01, 'dropout_rate': 0.3}. Best is trial 41 with value: 0.013343700938754624.

1/1 [==============================] - ETA: 0s
1/1 [==============================] - 0s 191ms/step
[I 2024-09-27 22:24:56,674] Trial 101 finished with value: 0.013676397959391264 and parameters: {'window_size': 6, 'batch_size': 16, 'network_type': 'GRU', 'num_layers': 1, 'num_neurons': 128, 'learning_rate': 0.01, 'dropout_rate': 0.3}. Best is trial 41 with value: 0.013343700938754624.

1/1 [==============================] - ETA: 0s
1/1 [==============================] - 0s 247ms/step
[I 2024-09-27 22:24:59,425] Trial 102 finished with value: 0.025126140912373824 and parameters: {'window_size': 6, 'batch_size': 16, 'network_type': 'GRU', 'num_layers': 1, 'num_neurons': 128, 'learning_rate': 0.01, 'dropout_rate': 0.3}. Best is trial 41 with value: 0.013343700938754624.

1/1 [==============================] - ETA: 0s
1/1 [==============================] - 0s 185ms/step
[I 2024-09-27 22:25:03,099] Trial 103 finished with value: 0.01771106656392411 and parameters: {'window_size': 6, 'batch_size': 16, 'network_type': 'GRU', 'num_layers': 1, 'num_neurons': 128, 'learning_rate': 0.01, 'dropout_rate': 0.3}. Best is trial 41 with value: 0.013343700938754624.

1/1 [==============================] - ETA: 0s
1/1 [==============================] - 0s 185ms/step
[I 2024-09-27 22:25:06,009] Trial 104 finished with value: 0.022105682161119213 and parameters: {'window_size': 6, 'batch_size': 16, 'network_type': 'GRU', 'num_layers': 1, 'num_neurons': 128, 'learning_rate': 0.01, 'dropout_rate': 0.3}. Best is trial 41 with value: 0.013343700938754624.

1/1 [==============================] - ETA: 0s
1/1 [==============================] - 0s 178ms/step
[I 2024-09-27 22:25:08,867] Trial 105 finished with value: 0.02749332555135088 and parameters: {'window_size': 6, 'batch_size': 16, 'network_type': 'GRU', 'num_layers': 1, 'num_neurons': 128, 'learning_rate': 0.01, 'dropout_rate': 0.3}. Best is trial 41 with value: 0.013343700938754624.

1/1 [==============================] - ETA: 0s
1/1 [==============================] - 0s 254ms/step
[I 2024-09-27 22:25:11,931] Trial 106 finished with value: 0.015100467258029493 and parameters: {'window_size': 6, 'batch_size': 16, 'network_type': 'GRU', 'num_layers': 1, 'num_neurons': 128, 'learning_rate': 0.01, 'dropout_rate': 0.3}. Best is trial 41 with value: 0.013343700938754624.

1/1 [==============================] - ETA: 0s
1/1 [==============================] - 0s 247ms/step
[I 2024-09-27 22:25:15,467] Trial 107 finished with value: 0.021803181966145797 and parameters: {'window_size': 6, 'batch_size': 16, 'network_type': 'GRU', 'num_layers': 1, 'num_neurons': 128, 'learning_rate': 0.01, 'dropout_rate': 0.3}. Best is trial 41 with value: 0.013343700938754624.

1/1 [==============================] - ETA: 0s
1/1 [==============================] - 0s 197ms/step
[I 2024-09-27 22:25:22,225] Trial 108 finished with value: 0.016049684842427563 and parameters: {'window_size': 6, 'batch_size': 32, 'network_type': 'GRU', 'num_layers': 1, 'num_neurons': 64, 'learning_rate': 0.0001, 'dropout_rate': 0.1}. Best is trial 41 with value: 0.013343700938754624.

1/1 [==============================] - ETA: 0s
1/1 [==============================] - 0s 331ms/step
[I 2024-09-27 22:25:26,903] Trial 109 finished with value: 0.024660040961371484 and parameters: {'window_size': 6, 'batch_size': 16, 'network_type': 'GRU', 'num_layers': 2, 'num_neurons': 128, 'learning_rate': 0.01, 'dropout_rate': 0.3}. Best is trial 41 with value: 0.013343700938754624.

1/1 [==============================] - ETA: 0s
1/1 [==============================] - 0s 204ms/step
[I 2024-09-27 22:25:29,645] Trial 110 finished with value: 0.03959461203488434 and parameters: {'window_size': 4, 'batch_size': 16, 'network_type': 'GRU', 'num_layers': 1, 'num_neurons': 32, 'learning_rate': 0.01, 'dropout_rate': 0.1}. Best is trial 41 with value: 0.013343700938754624.

1/1 [==============================] - ETA: 0s
1/1 [==============================] - 0s 276ms/step
[I 2024-09-27 22:25:33,254] Trial 111 finished with value: 0.027405060026380705 and parameters: {'window_size': 6, 'batch_size': 16, 'network_type': 'GRU', 'num_layers': 1, 'num_neurons': 128, 'learning_rate': 0.01, 'dropout_rate': 0.3}. Best is trial 41 with value: 0.013343700938754624.

1/1 [==============================] - ETA: 0s
1/1 [==============================] - 0s 201ms/step
[I 2024-09-27 22:25:37,049] Trial 112 finished with value: 0.024074922031826398 and parameters: {'window_size': 6, 'batch_size': 16, 'network_type': 'GRU', 'num_layers': 1, 'num_neurons': 128, 'learning_rate': 0.01, 'dropout_rate': 0.3}. Best is trial 41 with value: 0.013343700938754624.

1/1 [==============================] - ETA: 0s
1/1 [==============================] - 0s 178ms/step
[I 2024-09-27 22:25:40,347] Trial 113 finished with value: 0.027095592710706877 and parameters: {'window_size': 6, 'batch_size': 16, 'network_type': 'GRU', 'num_layers': 1, 'num_neurons': 128, 'learning_rate': 0.01, 'dropout_rate': 0.3}. Best is trial 41 with value: 0.013343700938754624.

1/1 [==============================] - ETA: 0s
1/1 [==============================] - 0s 185ms/step
[I 2024-09-27 22:25:43,320] Trial 114 finished with value: 0.017385704676310176 and parameters: {'window_size': 6, 'batch_size': 16, 'network_type': 'GRU', 'num_layers': 1, 'num_neurons': 128, 'learning_rate': 0.01, 'dropout_rate': 0.3}. Best is trial 41 with value: 0.013343700938754624.

1/1 [==============================] - ETA: 0s
1/1 [==============================] - 0s 201ms/step
[I 2024-09-27 22:25:46,407] Trial 115 finished with value: 0.031211814880371058 and parameters: {'window_size': 6, 'batch_size': 16, 'network_type': 'GRU', 'num_layers': 1, 'num_neurons': 128, 'learning_rate': 0.01, 'dropout_rate': 0.3}. Best is trial 41 with value: 0.013343700938754624.

1/1 [==============================] - ETA: 0s
1/1 [==============================] - 0s 163ms/step
[I 2024-09-27 22:25:48,464] Trial 116 finished with value: 0.0187081844541762 and parameters: {'window_size': 6, 'batch_size': 64, 'network_type': 'RNN', 'num_layers': 1, 'num_neurons': 128, 'learning_rate': 0.01, 'dropout_rate': 0.1}. Best is trial 41 with value: 0.013343700938754624.

1/1 [==============================] - ETA: 0s
1/1 [==============================] - 0s 206ms/step
[I 2024-09-27 22:25:51,176] Trial 117 finished with value: 0.0281866539849175 and parameters: {'window_size': 6, 'batch_size': 64, 'network_type': 'GRU', 'num_layers': 1, 'num_neurons': 128, 'learning_rate': 0.01, 'dropout_rate': 0.3}. Best is trial 41 with value: 0.013343700938754624.

1/1 [==============================] - ETA: 0s
1/1 [==============================] - 0s 185ms/step
[I 2024-09-27 22:25:54,137] Trial 118 finished with value: 0.03042979706658253 and parameters: {'window_size': 6, 'batch_size': 16, 'network_type': 'GRU', 'num_layers': 1, 'num_neurons': 128, 'learning_rate': 0.01, 'dropout_rate': 0.1}. Best is trial 41 with value: 0.013343700938754624.

1/1 [==============================] - ETA: 0s
1/1 [==============================] - 0s 185ms/step
[I 2024-09-27 22:25:56,812] Trial 119 finished with value: 0.020673453436957454 and parameters: {'window_size': 6, 'batch_size': 64, 'network_type': 'GRU', 'num_layers': 1, 'num_neurons': 128, 'learning_rate': 0.01, 'dropout_rate': 0.2}. Best is trial 41 with value: 0.013343700938754624.

1/1 [==============================] - ETA: 0s
1/1 [==============================] - 1s 602ms/step
[I 2024-09-27 22:26:08,240] Trial 120 finished with value: 0.026762891981336818 and parameters: {'window_size': 6, 'batch_size': 32, 'network_type': 'LSTM', 'num_layers': 3, 'num_neurons': 128, 'learning_rate': 0.0001, 'dropout_rate': 0.3}. Best is trial 41 with value: 0.013343700938754624.

1/1 [==============================] - ETA: 0s
1/1 [==============================] - 0s 201ms/step
[I 2024-09-27 22:26:15,996] Trial 121 finished with value: 0.01768870226542152 and parameters: {'window_size': 6, 'batch_size': 64, 'network_type': 'GRU', 'num_layers': 1, 'num_neurons': 128, 'learning_rate': 0.0001, 'dropout_rate': 0.2}. Best is trial 41 with value: 0.013343700938754624.

1/1 [==============================] - ETA: 0s
1/1 [==============================] - 0s 194ms/step
[I 2024-09-27 22:26:18,681] Trial 122 finished with value: 0.01528402487436933 and parameters: {'window_size': 6, 'batch_size': 64, 'network_type': 'GRU', 'num_layers': 1, 'num_neurons': 128, 'learning_rate': 0.01, 'dropout_rate': 0.2}. Best is trial 41 with value: 0.013343700938754624.

1/1 [==============================] - ETA: 0s
1/1 [==============================] - 0s 183ms/step
[I 2024-09-27 22:26:21,382] Trial 123 finished with value: 0.04067866770426429 and parameters: {'window_size': 6, 'batch_size': 64, 'network_type': 'GRU', 'num_layers': 1, 'num_neurons': 128, 'learning_rate': 0.01, 'dropout_rate': 0.2}. Best is trial 41 with value: 0.013343700938754624.

1/1 [==============================] - ETA: 0s
1/1 [==============================] - 0s 223ms/step
[I 2024-09-27 22:26:24,454] Trial 124 finished with value: 0.017667710410224056 and parameters: {'window_size': 6, 'batch_size': 64, 'network_type': 'GRU', 'num_layers': 1, 'num_neurons': 128, 'learning_rate': 0.01, 'dropout_rate': 0.2}. Best is trial 41 with value: 0.013343700938754624.

1/1 [==============================] - ETA: 0s
1/1 [==============================] - 0s 196ms/step
[I 2024-09-27 22:26:27,277] Trial 125 finished with value: 0.015311755710177918 and parameters: {'window_size': 6, 'batch_size': 64, 'network_type': 'GRU', 'num_layers': 1, 'num_neurons': 128, 'learning_rate': 0.01, 'dropout_rate': 0.2}. Best is trial 41 with value: 0.013343700938754624.

1/1 [==============================] - ETA: 0s
1/1 [==============================] - 0s 201ms/step
[I 2024-09-27 22:26:30,446] Trial 126 finished with value: 0.036735146742600686 and parameters: {'window_size': 2, 'batch_size': 64, 'network_type': 'GRU', 'num_layers': 1, 'num_neurons': 16, 'learning_rate': 0.01, 'dropout_rate': 0.2}. Best is trial 41 with value: 0.013343700938754624.

1/1 [==============================] - ETA: 0s
1/1 [==============================] - 0s 185ms/step
[I 2024-09-27 22:26:33,240] Trial 127 finished with value: 0.043493397712707486 and parameters: {'window_size': 6, 'batch_size': 64, 'network_type': 'GRU', 'num_layers': 1, 'num_neurons': 128, 'learning_rate': 0.01, 'dropout_rate': 0.1}. Best is trial 41 with value: 0.013343700938754624.

1/1 [==============================] - ETA: 0s
1/1 [==============================] - 0s 185ms/step
[I 2024-09-27 22:26:35,979] Trial 128 finished with value: 0.014654830932617201 and parameters: {'window_size': 6, 'batch_size': 64, 'network_type': 'GRU', 'num_layers': 1, 'num_neurons': 128, 'learning_rate': 0.01, 'dropout_rate': 0.2}. Best is trial 41 with value: 0.013343700938754624.

1/1 [==============================] - ETA: 0s
1/1 [==============================] - 0s 207ms/step
[I 2024-09-27 22:26:43,834] Trial 129 finished with value: 0.016078546735975467 and parameters: {'window_size': 6, 'batch_size': 64, 'network_type': 'GRU', 'num_layers': 1, 'num_neurons': 128, 'learning_rate': 0.0001, 'dropout_rate': 0.2}. Best is trial 41 with value: 0.013343700938754624.

1/1 [==============================] - ETA: 0s
1/1 [==============================] - 0s 330ms/step
[I 2024-09-27 22:26:48,206] Trial 130 finished with value: 0.05874548456403941 and parameters: {'window_size': 6, 'batch_size': 64, 'network_type': 'GRU', 'num_layers': 2, 'num_neurons': 64, 'learning_rate': 0.01, 'dropout_rate': 0.1}. Best is trial 41 with value: 0.013343700938754624.

1/1 [==============================] - ETA: 0s
1/1 [==============================] - 0s 185ms/step
[I 2024-09-27 22:26:50,818] Trial 131 finished with value: 0.018292751206292035 and parameters: {'window_size': 6, 'batch_size': 64, 'network_type': 'GRU', 'num_layers': 1, 'num_neurons': 128, 'learning_rate': 0.01, 'dropout_rate': 0.2}. Best is trial 41 with value: 0.013343700938754624.

1/1 [==============================] - ETA: 0s
1/1 [==============================] - 0s 183ms/step
[I 2024-09-27 22:26:53,435] Trial 132 finished with value: 0.02064384979671901 and parameters: {'window_size': 6, 'batch_size': 64, 'network_type': 'GRU', 'num_layers': 1, 'num_neurons': 128, 'learning_rate': 0.01, 'dropout_rate': 0.2}. Best is trial 41 with value: 0.013343700938754624.

1/1 [==============================] - ETA: 0s
1/1 [==============================] - 0s 179ms/step
[I 2024-09-27 22:26:56,070] Trial 133 finished with value: 0.020425564342074914 and parameters: {'window_size': 6, 'batch_size': 64, 'network_type': 'GRU', 'num_layers': 1, 'num_neurons': 128, 'learning_rate': 0.01, 'dropout_rate': 0.2}. Best is trial 41 with value: 0.013343700938754624.

1/1 [==============================] - ETA: 0s
1/1 [==============================] - 0s 178ms/step
[I 2024-09-27 22:26:58,724] Trial 134 finished with value: 0.020919620619879817 and parameters: {'window_size': 6, 'batch_size': 64, 'network_type': 'GRU', 'num_layers': 1, 'num_neurons': 128, 'learning_rate': 0.01, 'dropout_rate': 0.2}. Best is trial 41 with value: 0.013343700938754624.

1/1 [==============================] - ETA: 0s
1/1 [==============================] - 0s 188ms/step
[I 2024-09-27 22:27:01,417] Trial 135 finished with value: 0.016072192509969066 and parameters: {'window_size': 6, 'batch_size': 64, 'network_type': 'GRU', 'num_layers': 1, 'num_neurons': 128, 'learning_rate': 0.01, 'dropout_rate': 0.2}. Best is trial 41 with value: 0.013343700938754624.

1/1 [==============================] - ETA: 0s
1/1 [==============================] - 0s 181ms/step
[I 2024-09-27 22:27:04,055] Trial 136 finished with value: 0.026341852534901025 and parameters: {'window_size': 4, 'batch_size': 64, 'network_type': 'GRU', 'num_layers': 1, 'num_neurons': 128, 'learning_rate': 0.01, 'dropout_rate': 0.2}. Best is trial 41 with value: 0.013343700938754624.

1/1 [==============================] - ETA: 0s
1/1 [==============================] - 0s 185ms/step
[I 2024-09-27 22:27:06,852] Trial 137 finished with value: 0.0316032512452867 and parameters: {'window_size': 6, 'batch_size': 64, 'network_type': 'GRU', 'num_layers': 1, 'num_neurons': 32, 'learning_rate': 0.01, 'dropout_rate': 0.2}. Best is trial 41 with value: 0.013343700938754624.

1/1 [==============================] - ETA: 0s
1/1 [==============================] - 0s 166ms/step
[I 2024-09-27 22:27:10,370] Trial 138 finished with value: 0.028195846133761915 and parameters: {'window_size': 6, 'batch_size': 16, 'network_type': 'RNN', 'num_layers': 1, 'num_neurons': 128, 'learning_rate': 0.01, 'dropout_rate': 0.3}. Best is trial 41 with value: 0.013343700938754624.

1/1 [==============================] - ETA: 0s
1/1 [==============================] - 0s 455ms/step
[I 2024-09-27 22:27:14,016] Trial 139 finished with value: 0.01543007257249619 and parameters: {'window_size': 6, 'batch_size': 64, 'network_type': 'GRU', 'num_layers': 1, 'num_neurons': 128, 'learning_rate': 0.01, 'dropout_rate': 0.1}. Best is trial 41 with value: 0.013343700938754624.

1/1 [==============================] - ETA: 0s
1/1 [==============================] - 0s 417ms/step
[I 2024-09-27 22:27:20,809] Trial 140 finished with value: 0.03602492247687442 and parameters: {'window_size': 6, 'batch_size': 64, 'network_type': 'GRU', 'num_layers': 1, 'num_neurons': 128, 'learning_rate': 0.01, 'dropout_rate': 0.2}. Best is trial 41 with value: 0.013343700938754624.

1/1 [==============================] - ETA: 0s
1/1 [==============================] - 0s 238ms/step
[I 2024-09-27 22:27:24,841] Trial 141 finished with value: 0.03822663858201766 and parameters: {'window_size': 6, 'batch_size': 64, 'network_type': 'GRU', 'num_layers': 1, 'num_neurons': 128, 'learning_rate': 0.01, 'dropout_rate': 0.2}. Best is trial 41 with value: 0.013343700938754624.

1/1 [==============================] - ETA: 0s
1/1 [==============================] - 0s 216ms/step
[I 2024-09-27 22:27:28,092] Trial 142 finished with value: 0.015843622843424467 and parameters: {'window_size': 6, 'batch_size': 64, 'network_type': 'GRU', 'num_layers': 1, 'num_neurons': 128, 'learning_rate': 0.01, 'dropout_rate': 0.2}. Best is trial 41 with value: 0.013343700938754624.

1/1 [==============================] - ETA: 0s
1/1 [==============================] - 0s 238ms/step
[I 2024-09-27 22:27:31,870] Trial 143 finished with value: 0.02160658401913112 and parameters: {'window_size': 6, 'batch_size': 64, 'network_type': 'GRU', 'num_layers': 1, 'num_neurons': 128, 'learning_rate': 0.01, 'dropout_rate': 0.2}. Best is trial 41 with value: 0.013343700938754624.

1/1 [==============================] - ETA: 0s
1/1 [==============================] - 0s 432ms/step
[I 2024-09-27 22:27:35,771] Trial 144 finished with value: 0.022631704436408138 and parameters: {'window_size': 6, 'batch_size': 64, 'network_type': 'GRU', 'num_layers': 1, 'num_neurons': 128, 'learning_rate': 0.01, 'dropout_rate': 0.2}. Best is trial 41 with value: 0.013343700938754624.

1/1 [==============================] - ETA: 0s
1/1 [==============================] - 0s 203ms/step
[I 2024-09-27 22:27:45,156] Trial 145 finished with value: 0.01556694306267629 and parameters: {'window_size': 6, 'batch_size': 16, 'network_type': 'GRU', 'num_layers': 1, 'num_neurons': 128, 'learning_rate': 0.0001, 'dropout_rate': 0.2}. Best is trial 41 with value: 0.013343700938754624.

1/1 [==============================] - ETA: 0s
1/1 [==============================] - 1s 602ms/step
[I 2024-09-27 22:27:52,246] Trial 146 finished with value: 0.05581709512074785 and parameters: {'window_size': 6, 'batch_size': 64, 'network_type': 'LSTM', 'num_layers': 3, 'num_neurons': 128, 'learning_rate': 0.01, 'dropout_rate': 0.3}. Best is trial 41 with value: 0.013343700938754624.

1/1 [==============================] - ETA: 0s
1/1 [==============================] - 0s 185ms/step
[I 2024-09-27 22:27:57,388] Trial 147 finished with value: 0.030860588954045233 and parameters: {'window_size': 2, 'batch_size': 32, 'network_type': 'GRU', 'num_layers': 1, 'num_neurons': 128, 'learning_rate': 0.01, 'dropout_rate': 0.1}. Best is trial 41 with value: 0.013343700938754624.

1/1 [==============================] - ETA: 0s
1/1 [==============================] - 0s 263ms/step
[I 2024-09-27 22:28:00,287] Trial 148 finished with value: 0.023853581746419234 and parameters: {'window_size': 6, 'batch_size': 64, 'network_type': 'GRU', 'num_layers': 1, 'num_neurons': 128, 'learning_rate': 0.01, 'dropout_rate': 0.2}. Best is trial 41 with value: 0.013343700938754624.

1/1 [==============================] - ETA: 0s
1/1 [==============================] - 0s 286ms/step
[I 2024-09-27 22:28:05,402] Trial 149 finished with value: 0.020866135385301368 and parameters: {'window_size': 6, 'batch_size': 64, 'network_type': 'GRU', 'num_layers': 1, 'num_neurons': 16, 'learning_rate': 0.01, 'dropout_rate': 0.2}. Best is trial 41 with value: 0.013343700938754624.

1/1 [==============================] - ETA: 0s
1/1 [==============================] - 0s 272ms/step
[I 2024-09-27 22:28:10,197] Trial 150 finished with value: 0.018710570229424326 and parameters: {'window_size': 6, 'batch_size': 16, 'network_type': 'GRU', 'num_layers': 1, 'num_neurons': 128, 'learning_rate': 0.01, 'dropout_rate': 0.3}. Best is trial 41 with value: 0.013343700938754624.

1/1 [==============================] - ETA: 0s
1/1 [==============================] - 0s 207ms/step
[I 2024-09-27 22:28:14,037] Trial 151 finished with value: 0.015264814482794856 and parameters: {'window_size': 6, 'batch_size': 64, 'network_type': 'GRU', 'num_layers': 1, 'num_neurons': 128, 'learning_rate': 0.01, 'dropout_rate': 0.2}. Best is trial 41 with value: 0.013343700938754624.

1/1 [==============================] - ETA: 0s
1/1 [==============================] - 0s 346ms/step
[I 2024-09-27 22:28:17,861] Trial 152 finished with value: 0.018294731775919646 and parameters: {'window_size': 6, 'batch_size': 64, 'network_type': 'GRU', 'num_layers': 1, 'num_neurons': 128, 'learning_rate': 0.01, 'dropout_rate': 0.2}. Best is trial 41 with value: 0.013343700938754624.

1/1 [==============================] - ETA: 0s
1/1 [==============================] - 0s 194ms/step
[I 2024-09-27 22:28:21,042] Trial 153 finished with value: 0.016729350725809746 and parameters: {'window_size': 6, 'batch_size': 64, 'network_type': 'GRU', 'num_layers': 1, 'num_neurons': 128, 'learning_rate': 0.01, 'dropout_rate': 0.2}. Best is trial 41 with value: 0.013343700938754624.

1/1 [==============================] - ETA: 0s
1/1 [==============================] - 0s 274ms/step
