[I 2024-09-27 21:15:36,378] Trial 83 finished with value: 0.056890912012620413 and parameters: {'window_size': 6, 'batch_size': 64, 'network_type': 'GRU', 'num_layers': 2, 'num_neurons': 128, 'learning_rate': 0.01, 'dropout_rate': 0.1}. Best is trial 23 with value: 0.01880481806894144.

1/2 [==============>...............] - ETA: 0s
2/2 [==============================] - 1s 9ms/step
[I 2024-09-27 21:15:45,627] Trial 84 finished with value: 0.04739658609303561 and parameters: {'window_size': 6, 'batch_size': 64, 'network_type': 'GRU', 'num_layers': 2, 'num_neurons': 16, 'learning_rate': 0.01, 'dropout_rate': 0.1}. Best is trial 23 with value: 0.01880481806894144.

1/2 [==============>...............] - ETA: 0s
2/2 [==============================] - 1s 0s/step
[I 2024-09-27 21:15:58,005] Trial 85 finished with value: 0.029010455586693504 and parameters: {'window_size': 6, 'batch_size': 16, 'network_type': 'GRU', 'num_layers': 2, 'num_neurons': 128, 'learning_rate': 0.01, 'dropout_rate': 0.1}. Best is trial 23 with value: 0.01880481806894144.

1/2 [==============>...............] - ETA: 0s
2/2 [==============================] - 1s 0s/step
[I 2024-09-27 21:16:06,205] Trial 86 finished with value: 0.023045125002446386 and parameters: {'window_size': 4, 'batch_size': 64, 'network_type': 'GRU', 'num_layers': 2, 'num_neurons': 128, 'learning_rate': 0.01, 'dropout_rate': 0.2}. Best is trial 23 with value: 0.01880481806894144.

1/2 [==============>...............] - ETA: 0s
2/2 [==============================] - 0s 11ms/step
[I 2024-09-27 21:16:15,165] Trial 87 finished with value: 0.02385150573650997 and parameters: {'window_size': 2, 'batch_size': 64, 'network_type': 'GRU', 'num_layers': 2, 'num_neurons': 128, 'learning_rate': 0.01, 'dropout_rate': 0.3}. Best is trial 23 with value: 0.01880481806894144.

1/2 [==============>...............] - ETA: 0s
2/2 [==============================] - 0s 0s/step
[I 2024-09-27 21:16:21,382] Trial 88 finished with value: 0.056789145599712036 and parameters: {'window_size': 6, 'batch_size': 16, 'network_type': 'LSTM', 'num_layers': 1, 'num_neurons': 128, 'learning_rate': 0.0001, 'dropout_rate': 0.1}. Best is trial 23 with value: 0.01880481806894144.

1/2 [==============>...............] - ETA: 0s
2/2 [==============================] - 0s 0s/step
[I 2024-09-27 21:16:27,826] Trial 89 finished with value: 0.02499072898989138 and parameters: {'window_size': 4, 'batch_size': 64, 'network_type': 'RNN', 'num_layers': 2, 'num_neurons': 128, 'learning_rate': 0.01, 'dropout_rate': 0.2}. Best is trial 23 with value: 0.01880481806894144.

1/2 [==============>...............] - ETA: 0s
2/2 [==============================] - 0s 0s/step
[I 2024-09-27 21:16:41,040] Trial 90 finished with value: 0.019962250108520197 and parameters: {'window_size': 2, 'batch_size': 16, 'network_type': 'GRU', 'num_layers': 2, 'num_neurons': 128, 'learning_rate': 0.01, 'dropout_rate': 0.3}. Best is trial 23 with value: 0.01880481806894144.

1/2 [==============>...............] - ETA: 0s
2/2 [==============================] - 1s 12ms/step
[I 2024-09-27 21:16:49,780] Trial 91 finished with value: 0.04968489205340545 and parameters: {'window_size': 2, 'batch_size': 16, 'network_type': 'GRU', 'num_layers': 2, 'num_neurons': 128, 'learning_rate': 0.01, 'dropout_rate': 0.3}. Best is trial 23 with value: 0.01880481806894144.

1/2 [==============>...............] - ETA: 0s
2/2 [==============================] - 1s 12ms/step
[I 2024-09-27 21:17:07,873] Trial 92 finished with value: 0.022237825632095348 and parameters: {'window_size': 2, 'batch_size': 16, 'network_type': 'GRU', 'num_layers': 2, 'num_neurons': 128, 'learning_rate': 0.01, 'dropout_rate': 0.3}. Best is trial 23 with value: 0.01880481806894144.

1/2 [==============>...............] - ETA: 0s
2/2 [==============================] - 0s 0s/step
[I 2024-09-27 21:17:17,586] Trial 93 finished with value: 0.025969902922709787 and parameters: {'window_size': 2, 'batch_size': 16, 'network_type': 'GRU', 'num_layers': 2, 'num_neurons': 128, 'learning_rate': 0.01, 'dropout_rate': 0.3}. Best is trial 23 with value: 0.01880481806894144.

1/2 [==============>...............] - ETA: 0s
2/2 [==============================] - 0s 0s/step
[I 2024-09-27 21:17:27,227] Trial 94 finished with value: 0.04578137804071109 and parameters: {'window_size': 2, 'batch_size': 16, 'network_type': 'GRU', 'num_layers': 2, 'num_neurons': 128, 'learning_rate': 0.0001, 'dropout_rate': 0.3}. Best is trial 23 with value: 0.01880481806894144.

1/2 [==============>...............] - ETA: 0s
2/2 [==============================] - 0s 0s/step
[I 2024-09-27 21:17:34,229] Trial 95 finished with value: 0.0410856226036946 and parameters: {'window_size': 2, 'batch_size': 16, 'network_type': 'GRU', 'num_layers': 2, 'num_neurons': 128, 'learning_rate': 0.01, 'dropout_rate': 0.3}. Best is trial 23 with value: 0.01880481806894144.

1/2 [==============>...............] - ETA: 0s
2/2 [==============================] - 1s 0s/step
[I 2024-09-27 21:17:39,777] Trial 96 finished with value: 0.025326064417759586 and parameters: {'window_size': 2, 'batch_size': 64, 'network_type': 'RNN', 'num_layers': 2, 'num_neurons': 16, 'learning_rate': 0.01, 'dropout_rate': 0.2}. Best is trial 23 with value: 0.01880481806894144.

1/2 [==============>...............] - ETA: 0s
2/2 [==============================] - 1s 22ms/step
[I 2024-09-27 21:17:50,987] Trial 97 finished with value: 0.07595649834301162 and parameters: {'window_size': 4, 'batch_size': 32, 'network_type': 'GRU', 'num_layers': 3, 'num_neurons': 128, 'learning_rate': 0.01, 'dropout_rate': 0.3}. Best is trial 23 with value: 0.01880481806894144.

1/2 [==============>...............] - ETA: 0s
2/2 [==============================] - 0s 4ms/step
[I 2024-09-27 21:17:58,144] Trial 98 finished with value: 0.021697104318575425 and parameters: {'window_size': 6, 'batch_size': 16, 'network_type': 'LSTM', 'num_layers': 1, 'num_neurons': 128, 'learning_rate': 0.01, 'dropout_rate': 0.1}. Best is trial 23 with value: 0.01880481806894144.

1/2 [==============>...............] - ETA: 0s
2/2 [==============================] - 0s 4ms/step
[I 2024-09-27 21:18:03,808] Trial 99 finished with value: 0.026325748721758534 and parameters: {'window_size': 2, 'batch_size': 16, 'network_type': 'LSTM', 'num_layers': 1, 'num_neurons': 128, 'learning_rate': 0.01, 'dropout_rate': 0.2}. Best is trial 23 with value: 0.01880481806894144.

1/2 [==============>...............] - ETA: 0s
2/2 [==============================] - 0s 5ms/step
[I 2024-09-27 21:18:10,161] Trial 100 finished with value: 0.058090317986228254 and parameters: {'window_size': 6, 'batch_size': 16, 'network_type': 'LSTM', 'num_layers': 1, 'num_neurons': 128, 'learning_rate': 0.01, 'dropout_rate': 0.3}. Best is trial 23 with value: 0.01880481806894144.

1/2 [==============>...............] - ETA: 0s
2/2 [==============================] - 0s 5ms/step
[I 2024-09-27 21:18:17,127] Trial 101 finished with value: 0.027658154736865656 and parameters: {'window_size': 6, 'batch_size': 16, 'network_type': 'LSTM', 'num_layers': 1, 'num_neurons': 128, 'learning_rate': 0.01, 'dropout_rate': 0.1}. Best is trial 23 with value: 0.01880481806894144.

1/2 [==============>...............] - ETA: 0s
2/2 [==============================] - 0s 1ms/step
[I 2024-09-27 21:18:26,440] Trial 102 finished with value: 0.022765512542291123 and parameters: {'window_size': 6, 'batch_size': 16, 'network_type': 'LSTM', 'num_layers': 1, 'num_neurons': 128, 'learning_rate': 0.01, 'dropout_rate': 0.1}. Best is trial 23 with value: 0.01880481806894144.

1/2 [==============>...............] - ETA: 0s
2/2 [==============================] - 0s 335us/step
[I 2024-09-27 21:18:35,882] Trial 103 finished with value: 0.023642330381003294 and parameters: {'window_size': 6, 'batch_size': 16, 'network_type': 'LSTM', 'num_layers': 1, 'num_neurons': 128, 'learning_rate': 0.01, 'dropout_rate': 0.1}. Best is trial 23 with value: 0.01880481806894144.

1/2 [==============>...............] - ETA: 0s
2/2 [==============================] - 1s 0s/step
[I 2024-09-27 21:18:43,736] Trial 104 finished with value: 0.023272085032679815 and parameters: {'window_size': 6, 'batch_size': 64, 'network_type': 'RNN', 'num_layers': 2, 'num_neurons': 64, 'learning_rate': 0.01, 'dropout_rate': 0.1}. Best is trial 23 with value: 0.01880481806894144.

1/2 [==============>...............] - ETA: 0s
2/2 [==============================] - 0s 0s/step
[I 2024-09-27 21:18:50,949] Trial 105 finished with value: 0.03528082232041793 and parameters: {'window_size': 6, 'batch_size': 64, 'network_type': 'GRU', 'num_layers': 2, 'num_neurons': 128, 'learning_rate': 0.01, 'dropout_rate': 0.1}. Best is trial 23 with value: 0.01880481806894144.

1/2 [==============>...............] - ETA: 0s
2/2 [==============================] - 1s 0s/step
[I 2024-09-27 21:19:01,863] Trial 106 finished with value: 0.030459326194680256 and parameters: {'window_size': 4, 'batch_size': 16, 'network_type': 'GRU', 'num_layers': 2, 'num_neurons': 128, 'learning_rate': 0.01, 'dropout_rate': 0.1}. Best is trial 23 with value: 0.01880481806894144.

1/2 [==============>...............] - ETA: 0s
2/2 [==============================] - 0s 0s/step
[I 2024-09-27 21:19:07,287] Trial 107 finished with value: 0.03140214936931929 and parameters: {'window_size': 2, 'batch_size': 64, 'network_type': 'LSTM', 'num_layers': 1, 'num_neurons': 128, 'learning_rate': 0.01, 'dropout_rate': 0.2}. Best is trial 23 with value: 0.01880481806894144.

1/2 [==============>...............] - ETA: 0s
2/2 [==============================] - 0s 0s/step
[I 2024-09-27 21:19:16,872] Trial 108 finished with value: 0.029972871569069956 and parameters: {'window_size': 6, 'batch_size': 16, 'network_type': 'GRU', 'num_layers': 2, 'num_neurons': 128, 'learning_rate': 0.01, 'dropout_rate': 0.3}. Best is trial 23 with value: 0.01880481806894144.

1/2 [==============>...............] - ETA: 0s
2/2 [==============================] - 0s 0s/step
[I 2024-09-27 21:19:21,711] Trial 109 finished with value: 0.017788416224977257 and parameters: {'window_size': 4, 'batch_size': 64, 'network_type': 'RNN', 'num_layers': 2, 'num_neurons': 128, 'learning_rate': 0.01, 'dropout_rate': 0.2}. Best is trial 109 with value: 0.017788416224977257.

1/2 [==============>...............] - ETA: 0s
2/2 [==============================] - 0s 0s/step
[I 2024-09-27 21:19:27,728] Trial 110 finished with value: 0.03543706081742826 and parameters: {'window_size': 4, 'batch_size': 16, 'network_type': 'RNN', 'num_layers': 2, 'num_neurons': 128, 'learning_rate': 0.01, 'dropout_rate': 0.2}. Best is trial 109 with value: 0.017788416224977257.

1/2 [==============>...............] - ETA: 0s
2/2 [==============================] - 0s 0s/step
[I 2024-09-27 21:19:32,653] Trial 111 finished with value: 0.040743353926617175 and parameters: {'window_size': 4, 'batch_size': 64, 'network_type': 'RNN', 'num_layers': 2, 'num_neurons': 128, 'learning_rate': 0.01, 'dropout_rate': 0.2}. Best is trial 109 with value: 0.017788416224977257.

1/2 [==============>...............] - ETA: 0s
2/2 [==============================] - 1s 1ms/step
[I 2024-09-27 21:19:37,475] Trial 112 finished with value: 0.043967929850453925 and parameters: {'window_size': 4, 'batch_size': 64, 'network_type': 'RNN', 'num_layers': 2, 'num_neurons': 128, 'learning_rate': 0.01, 'dropout_rate': 0.2}. Best is trial 109 with value: 0.017788416224977257.

1/2 [==============>...............] - ETA: 0s
2/2 [==============================] - 0s 0s/step
[I 2024-09-27 21:19:43,735] Trial 113 finished with value: 0.06170242564056232 and parameters: {'window_size': 4, 'batch_size': 64, 'network_type': 'RNN', 'num_layers': 2, 'num_neurons': 128, 'learning_rate': 0.01, 'dropout_rate': 0.2}. Best is trial 109 with value: 0.017788416224977257.

1/2 [==============>...............] - ETA: 0s
2/2 [==============================] - 0s 0s/step
[I 2024-09-27 21:19:49,240] Trial 114 finished with value: 0.05762237373123999 and parameters: {'window_size': 4, 'batch_size': 64, 'network_type': 'RNN', 'num_layers': 2, 'num_neurons': 128, 'learning_rate': 0.01, 'dropout_rate': 0.2}. Best is trial 109 with value: 0.017788416224977257.

1/2 [==============>...............] - ETA: 0s
2/2 [==============================] - 0s 0s/step
[I 2024-09-27 21:19:56,525] Trial 115 finished with value: 0.022063553642142908 and parameters: {'window_size': 6, 'batch_size': 64, 'network_type': 'GRU', 'num_layers': 2, 'num_neurons': 128, 'learning_rate': 0.01, 'dropout_rate': 0.1}. Best is trial 109 with value: 0.017788416224977257.

1/2 [==============>...............] - ETA: 0s
2/2 [==============================] - 0s 16ms/step
[I 2024-09-27 21:20:00,981] Trial 116 finished with value: 0.04516329270104569 and parameters: {'window_size': 2, 'batch_size': 64, 'network_type': 'RNN', 'num_layers': 2, 'num_neurons': 128, 'learning_rate': 0.01, 'dropout_rate': 0.3}. Best is trial 109 with value: 0.017788416224977257.

1/2 [==============>...............] - ETA: 0s
2/2 [==============================] - 0s 0s/step
[I 2024-09-27 21:20:04,946] Trial 117 finished with value: 0.03150916643576189 and parameters: {'window_size': 6, 'batch_size': 64, 'network_type': 'GRU', 'num_layers': 1, 'num_neurons': 16, 'learning_rate': 0.01, 'dropout_rate': 0.2}. Best is trial 109 with value: 0.017788416224977257.

1/2 [==============>...............] - ETA: 0s
2/2 [==============================] - 1s 7ms/step
[I 2024-09-27 21:20:16,225] Trial 118 finished with value: 0.023728462918944985 and parameters: {'window_size': 4, 'batch_size': 32, 'network_type': 'LSTM', 'num_layers': 3, 'num_neurons': 128, 'learning_rate': 0.01, 'dropout_rate': 0.1}. Best is trial 109 with value: 0.017788416224977257.

1/2 [==============>...............] - ETA: 0s
2/2 [==============================] - 1s 0s/step
[I 2024-09-27 21:20:24,664] Trial 119 finished with value: 0.04131064827243487 and parameters: {'window_size': 2, 'batch_size': 64, 'network_type': 'GRU', 'num_layers': 2, 'num_neurons': 128, 'learning_rate': 0.01, 'dropout_rate': 0.3}. Best is trial 109 with value: 0.017788416224977257.

1/2 [==============>...............] - ETA: 0s
2/2 [==============================] - 0s 7ms/step
[I 2024-09-27 21:20:32,451] Trial 120 finished with value: 0.02724903766675429 and parameters: {'window_size': 6, 'batch_size': 16, 'network_type': 'GRU', 'num_layers': 2, 'num_neurons': 32, 'learning_rate': 0.01, 'dropout_rate': 0.1}. Best is trial 109 with value: 0.017788416224977257.

1/2 [==============>...............] - ETA: 0s
2/2 [==============================] - 0s 0s/step
[I 2024-09-27 21:20:39,423] Trial 121 finished with value: 0.02167521294138649 and parameters: {'window_size': 6, 'batch_size': 64, 'network_type': 'GRU', 'num_layers': 2, 'num_neurons': 128, 'learning_rate': 0.01, 'dropout_rate': 0.1}. Best is trial 109 with value: 0.017788416224977257.

1/2 [==============>...............] - ETA: 0s
2/2 [==============================] - 0s 0s/step
[I 2024-09-27 21:20:46,199] Trial 122 finished with value: 0.027607912274924196 and parameters: {'window_size': 6, 'batch_size': 64, 'network_type': 'GRU', 'num_layers': 2, 'num_neurons': 128, 'learning_rate': 0.01, 'dropout_rate': 0.1}. Best is trial 109 with value: 0.017788416224977257.

1/2 [==============>...............] - ETA: 0s
2/2 [==============================] - 0s 0s/step
[I 2024-09-27 21:20:53,232] Trial 123 finished with value: 0.026215432584285735 and parameters: {'window_size': 6, 'batch_size': 64, 'network_type': 'GRU', 'num_layers': 2, 'num_neurons': 128, 'learning_rate': 0.01, 'dropout_rate': 0.1}. Best is trial 109 with value: 0.017788416224977257.

1/2 [==============>...............] - ETA: 0s
2/2 [==============================] - 0s 16ms/step
[I 2024-09-27 21:21:06,173] Trial 124 finished with value: 0.023066137124191633 and parameters: {'window_size': 6, 'batch_size': 64, 'network_type': 'GRU', 'num_layers': 2, 'num_neurons': 128, 'learning_rate': 0.01, 'dropout_rate': 0.1}. Best is trial 109 with value: 0.017788416224977257.

1/2 [==============>...............] - ETA: 0s
2/2 [==============================] - 0s 0s/step
[I 2024-09-27 21:21:15,594] Trial 125 finished with value: 0.023857937617735428 and parameters: {'window_size': 6, 'batch_size': 64, 'network_type': 'GRU', 'num_layers': 2, 'num_neurons': 128, 'learning_rate': 0.01, 'dropout_rate': 0.1}. Best is trial 109 with value: 0.017788416224977257.

1/2 [==============>...............] - ETA: 0s
2/2 [==============================] - 0s 16ms/step
[I 2024-09-27 21:21:20,509] Trial 126 finished with value: 0.03535216645896436 and parameters: {'window_size': 2, 'batch_size': 64, 'network_type': 'RNN', 'num_layers': 2, 'num_neurons': 128, 'learning_rate': 0.01, 'dropout_rate': 0.2}. Best is trial 109 with value: 0.017788416224977257.

1/2 [==============>...............] - ETA: 0s
2/2 [==============================] - 1s 16ms/step
[I 2024-09-27 21:21:33,096] Trial 127 finished with value: 0.027508646336468788 and parameters: {'window_size': 6, 'batch_size': 64, 'network_type': 'GRU', 'num_layers': 2, 'num_neurons': 64, 'learning_rate': 0.01, 'dropout_rate': 0.3}. Best is trial 109 with value: 0.017788416224977257.

1/2 [==============>...............] - ETA: 0s
2/2 [==============================] - 1s 0s/step
[I 2024-09-27 21:21:49,486] Trial 128 finished with value: 0.02813629097005595 and parameters: {'window_size': 4, 'batch_size': 16, 'network_type': 'GRU', 'num_layers': 2, 'num_neurons': 128, 'learning_rate': 0.01, 'dropout_rate': 0.1}. Best is trial 109 with value: 0.017788416224977257.

1/2 [==============>...............] - ETA: 0s
2/2 [==============================] - 0s 0s/step
[I 2024-09-27 21:21:57,075] Trial 129 finished with value: 0.025580625046383254 and parameters: {'window_size': 6, 'batch_size': 64, 'network_type': 'LSTM', 'num_layers': 1, 'num_neurons': 128, 'learning_rate': 0.01, 'dropout_rate': 0.2}. Best is trial 109 with value: 0.017788416224977257.

1/2 [==============>...............] - ETA: 0s
2/2 [==============================] - 0s 10ms/step
[I 2024-09-27 21:22:03,376] Trial 130 finished with value: 0.042913761173685394 and parameters: {'window_size': 2, 'batch_size': 16, 'network_type': 'GRU', 'num_layers': 2, 'num_neurons': 128, 'learning_rate': 0.01, 'dropout_rate': 0.3}. Best is trial 109 with value: 0.017788416224977257.

1/2 [==============>...............] - ETA: 0s
2/2 [==============================] - 0s 0s/step
[I 2024-09-27 21:22:09,859] Trial 131 finished with value: 0.022749318848956722 and parameters: {'window_size': 6, 'batch_size': 64, 'network_type': 'GRU', 'num_layers': 2, 'num_neurons': 128, 'learning_rate': 0.01, 'dropout_rate': 0.1}. Best is trial 109 with value: 0.017788416224977257.

1/2 [==============>...............] - ETA: 0s
2/2 [==============================] - 0s 0s/step
[I 2024-09-27 21:22:18,386] Trial 132 finished with value: 0.06599775022810156 and parameters: {'window_size': 6, 'batch_size': 64, 'network_type': 'GRU', 'num_layers': 2, 'num_neurons': 128, 'learning_rate': 0.0001, 'dropout_rate': 0.1}. Best is trial 109 with value: 0.017788416224977257.

1/2 [==============>...............] - ETA: 0s
2/2 [==============================] - 0s 0s/step
[I 2024-09-27 21:22:26,550] Trial 133 finished with value: 0.023565099136395887 and parameters: {'window_size': 6, 'batch_size': 64, 'network_type': 'GRU', 'num_layers': 2, 'num_neurons': 128, 'learning_rate': 0.01, 'dropout_rate': 0.1}. Best is trial 109 with value: 0.017788416224977257.

1/2 [==============>...............] - ETA: 0s
2/2 [==============================] - 0s 0s/step
[I 2024-09-27 21:22:33,635] Trial 134 finished with value: 0.02205713188106364 and parameters: {'window_size': 6, 'batch_size': 64, 'network_type': 'GRU', 'num_layers': 2, 'num_neurons': 128, 'learning_rate': 0.01, 'dropout_rate': 0.1}. Best is trial 109 with value: 0.017788416224977257.

1/2 [==============>...............] - ETA: 0s
2/2 [==============================] - 0s 0s/step
[I 2024-09-27 21:22:39,828] Trial 135 finished with value: 0.06982658474011855 and parameters: {'window_size': 6, 'batch_size': 64, 'network_type': 'GRU', 'num_layers': 2, 'num_neurons': 128, 'learning_rate': 0.01, 'dropout_rate': 0.1}. Best is trial 109 with value: 0.017788416224977257.

1/2 [==============>...............] - ETA: 0s
2/2 [==============================] - 0s 0s/step
[I 2024-09-27 21:22:44,279] Trial 136 finished with value: 0.020576490553942603 and parameters: {'window_size': 6, 'batch_size': 64, 'network_type': 'RNN', 'num_layers': 2, 'num_neurons': 128, 'learning_rate': 0.01, 'dropout_rate': 0.1}. Best is trial 109 with value: 0.017788416224977257.

1/2 [==============>...............] - ETA: 0s
2/2 [==============================] - 1s 0s/step
[I 2024-09-27 21:22:49,607] Trial 137 finished with value: 0.036350359859673886 and parameters: {'window_size': 4, 'batch_size': 16, 'network_type': 'RNN', 'num_layers': 2, 'num_neurons': 128, 'learning_rate': 0.01, 'dropout_rate': 0.2}. Best is trial 109 with value: 0.017788416224977257.

1/2 [==============>...............] - ETA: 0s
2/2 [==============================] - 0s 0s/step
[I 2024-09-27 21:22:55,493] Trial 138 finished with value: 0.027087155659993496 and parameters: {'window_size': 2, 'batch_size': 64, 'network_type': 'RNN', 'num_layers': 2, 'num_neurons': 128, 'learning_rate': 0.0001, 'dropout_rate': 0.3}. Best is trial 109 with value: 0.017788416224977257.

1/2 [==============>...............] - ETA: 0s
2/2 [==============================] - 0s 0s/step
