[I 2024-09-28 01:11:47,979] Trial 146 finished with value: 0.017561751895480704 and parameters: {'learning_rate': 0.01, 'batch_size': 16, 'network_type': 'RNN', 'num_layers': 2, 'num_neurons': 16, 'dropout_rate': 0.1}. Best is trial 40 with value: 0.01260630162556965.
[I 2024-09-28 01:11:57,910] Trial 147 finished with value: 0.013783912552727559 and parameters: {'learning_rate': 0.0001, 'batch_size': 16, 'network_type': 'RNN', 'num_layers': 2, 'num_neurons': 16, 'dropout_rate': 0.1}. Best is trial 40 with value: 0.01260630162556965.
[I 2024-09-28 01:12:02,935] Trial 148 finished with value: 0.019438352796766534 and parameters: {'learning_rate': 0.01, 'batch_size': 16, 'network_type': 'RNN', 'num_layers': 2, 'num_neurons': 16, 'dropout_rate': 0.1}. Best is trial 40 with value: 0.01260630162556965.
[I 2024-09-28 01:12:08,049] Trial 149 finished with value: 0.018930293718973798 and parameters: {'learning_rate': 0.01, 'batch_size': 16, 'network_type': 'RNN', 'num_layers': 2, 'num_neurons': 16, 'dropout_rate': 0.1}. Best is trial 40 with value: 0.01260630162556965.
[I 2024-09-28 01:12:13,316] Trial 150 finished with value: 0.021850742340087867 and parameters: {'learning_rate': 0.01, 'batch_size': 16, 'network_type': 'RNN', 'num_layers': 2, 'num_neurons': 32, 'dropout_rate': 0.1}. Best is trial 40 with value: 0.01260630162556965.
[I 2024-09-28 01:12:25,016] Trial 151 finished with value: 0.020349934048122797 and parameters: {'learning_rate': 0.0001, 'batch_size': 16, 'network_type': 'RNN', 'num_layers': 2, 'num_neurons': 16, 'dropout_rate': 0.1}. Best is trial 40 with value: 0.01260630162556965.
[I 2024-09-28 01:12:34,518] Trial 152 finished with value: 0.01675252882639564 and parameters: {'learning_rate': 0.0001, 'batch_size': 16, 'network_type': 'RNN', 'num_layers': 2, 'num_neurons': 16, 'dropout_rate': 0.1}. Best is trial 40 with value: 0.01260630162556965.
[I 2024-09-28 01:12:39,512] Trial 153 finished with value: 0.029096903165181518 and parameters: {'learning_rate': 0.01, 'batch_size': 16, 'network_type': 'RNN', 'num_layers': 2, 'num_neurons': 16, 'dropout_rate': 0.1}. Best is trial 40 with value: 0.01260630162556965.
[I 2024-09-28 01:12:49,038] Trial 154 finished with value: 0.020679839134216275 and parameters: {'learning_rate': 0.0001, 'batch_size': 16, 'network_type': 'RNN', 'num_layers': 2, 'num_neurons': 16, 'dropout_rate': 0.1}. Best is trial 40 with value: 0.01260630162556965.
[I 2024-09-28 01:12:55,662] Trial 155 finished with value: 0.03227143330044221 and parameters: {'learning_rate': 0.01, 'batch_size': 16, 'network_type': 'RNN', 'num_layers': 2, 'num_neurons': 16, 'dropout_rate': 0.1}. Best is trial 40 with value: 0.01260630162556965.
[I 2024-09-28 01:13:05,333] Trial 156 finished with value: 0.03436359606848827 and parameters: {'learning_rate': 0.01, 'batch_size': 16, 'network_type': 'LSTM', 'num_layers': 2, 'num_neurons': 16, 'dropout_rate': 0.1}. Best is trial 40 with value: 0.01260630162556965.
[I 2024-09-28 01:13:15,820] Trial 157 finished with value: 0.0152649919721815 and parameters: {'learning_rate': 0.0001, 'batch_size': 16, 'network_type': 'RNN', 'num_layers': 2, 'num_neurons': 16, 'dropout_rate': 0.1}. Best is trial 40 with value: 0.01260630162556965.
[I 2024-09-28 01:13:20,648] Trial 158 finished with value: 0.035208789931403306 and parameters: {'learning_rate': 0.01, 'batch_size': 16, 'network_type': 'RNN', 'num_layers': 2, 'num_neurons': 16, 'dropout_rate': 0.2}. Best is trial 40 with value: 0.01260630162556965.
[I 2024-09-28 01:13:31,587] Trial 159 finished with value: 0.013144550323486333 and parameters: {'learning_rate': 0.0001, 'batch_size': 16, 'network_type': 'RNN', 'num_layers': 2, 'num_neurons': 16, 'dropout_rate': 0.1}. Best is trial 40 with value: 0.01260630162556965.
[I 2024-09-28 01:13:41,793] Trial 160 finished with value: 0.013887835820515892 and parameters: {'learning_rate': 0.0001, 'batch_size': 16, 'network_type': 'RNN', 'num_layers': 2, 'num_neurons': 16, 'dropout_rate': 0.1}. Best is trial 40 with value: 0.01260630162556965.
[I 2024-09-28 01:13:51,202] Trial 161 finished with value: 0.013708534346686483 and parameters: {'learning_rate': 0.0001, 'batch_size': 16, 'network_type': 'RNN', 'num_layers': 2, 'num_neurons': 16, 'dropout_rate': 0.1}. Best is trial 40 with value: 0.01260630162556965.
[I 2024-09-28 01:14:00,633] Trial 162 finished with value: 0.013927951388888853 and parameters: {'learning_rate': 0.0001, 'batch_size': 16, 'network_type': 'RNN', 'num_layers': 2, 'num_neurons': 16, 'dropout_rate': 0.1}. Best is trial 40 with value: 0.01260630162556965.
[I 2024-09-28 01:14:07,145] Trial 163 finished with value: 0.03719657834370935 and parameters: {'learning_rate': 0.01, 'batch_size': 16, 'network_type': 'RNN', 'num_layers': 2, 'num_neurons': 16, 'dropout_rate': 0.1}. Best is trial 40 with value: 0.01260630162556965.
[I 2024-09-28 01:14:12,156] Trial 164 finished with value: 0.020177614317999963 and parameters: {'learning_rate': 0.01, 'batch_size': 16, 'network_type': 'RNN', 'num_layers': 2, 'num_neurons': 16, 'dropout_rate': 0.1}. Best is trial 40 with value: 0.01260630162556965.
[I 2024-09-28 01:14:16,894] Trial 165 finished with value: 0.022626729435390916 and parameters: {'learning_rate': 0.01, 'batch_size': 16, 'network_type': 'RNN', 'num_layers': 2, 'num_neurons': 16, 'dropout_rate': 0.1}. Best is trial 40 with value: 0.01260630162556965.
[I 2024-09-28 01:14:22,302] Trial 166 finished with value: 0.018712466875712104 and parameters: {'learning_rate': 0.01, 'batch_size': 16, 'network_type': 'RNN', 'num_layers': 2, 'num_neurons': 64, 'dropout_rate': 0.1}. Best is trial 40 with value: 0.01260630162556965.
[I 2024-09-28 01:14:35,736] Trial 167 finished with value: 0.03353160720401337 and parameters: {'learning_rate': 0.0001, 'batch_size': 16, 'network_type': 'GRU', 'num_layers': 2, 'num_neurons': 16, 'dropout_rate': 0.1}. Best is trial 40 with value: 0.01260630162556965.
[I 2024-09-28 01:14:46,605] Trial 168 finished with value: 0.02992375130123559 and parameters: {'learning_rate': 0.0001, 'batch_size': 32, 'network_type': 'RNN', 'num_layers': 2, 'num_neurons': 16, 'dropout_rate': 0.1}. Best is trial 40 with value: 0.01260630162556965.
[I 2024-09-28 01:14:55,816] Trial 169 finished with value: 0.013766260253058505 and parameters: {'learning_rate': 0.0001, 'batch_size': 16, 'network_type': 'RNN', 'num_layers': 2, 'num_neurons': 16, 'dropout_rate': 0.1}. Best is trial 40 with value: 0.01260630162556965.
[I 2024-09-28 01:15:05,025] Trial 170 finished with value: 0.01287457264794245 and parameters: {'learning_rate': 0.0001, 'batch_size': 16, 'network_type': 'RNN', 'num_layers': 2, 'num_neurons': 16, 'dropout_rate': 0.3}. Best is trial 40 with value: 0.01260630162556965.
[I 2024-09-28 01:15:10,120] Trial 171 finished with value: 0.01759693781534831 and parameters: {'learning_rate': 0.01, 'batch_size': 16, 'network_type': 'RNN', 'num_layers': 2, 'num_neurons': 16, 'dropout_rate': 0.3}. Best is trial 40 with value: 0.01260630162556965.
[I 2024-09-28 01:15:15,842] Trial 172 finished with value: 0.016578559345669222 and parameters: {'learning_rate': 0.01, 'batch_size': 16, 'network_type': 'RNN', 'num_layers': 2, 'num_neurons': 16, 'dropout_rate': 0.3}. Best is trial 40 with value: 0.01260630162556965.
[I 2024-09-28 01:15:20,863] Trial 173 finished with value: 0.030413172403971393 and parameters: {'learning_rate': 0.01, 'batch_size': 16, 'network_type': 'RNN', 'num_layers': 2, 'num_neurons': 16, 'dropout_rate': 0.3}. Best is trial 40 with value: 0.01260630162556965.
[I 2024-09-28 01:15:25,643] Trial 174 finished with value: 0.042794646581014034 and parameters: {'learning_rate': 0.01, 'batch_size': 16, 'network_type': 'RNN', 'num_layers': 2, 'num_neurons': 16, 'dropout_rate': 0.3}. Best is trial 40 with value: 0.01260630162556965.
[I 2024-09-28 01:15:35,075] Trial 175 finished with value: 0.021194717301262718 and parameters: {'learning_rate': 0.0001, 'batch_size': 16, 'network_type': 'RNN', 'num_layers': 2, 'num_neurons': 16, 'dropout_rate': 0.3}. Best is trial 40 with value: 0.01260630162556965.
[I 2024-09-28 01:15:39,680] Trial 176 finished with value: 0.015040097236633305 and parameters: {'learning_rate': 0.01, 'batch_size': 16, 'network_type': 'RNN', 'num_layers': 2, 'num_neurons': 16, 'dropout_rate': 0.1}. Best is trial 40 with value: 0.01260630162556965.
[I 2024-09-28 01:15:49,305] Trial 177 finished with value: 0.02251503139071989 and parameters: {'learning_rate': 0.0001, 'batch_size': 64, 'network_type': 'RNN', 'num_layers': 2, 'num_neurons': 16, 'dropout_rate': 0.1}. Best is trial 40 with value: 0.01260630162556965.
[I 2024-09-28 01:15:55,858] Trial 178 finished with value: 0.03869534375932485 and parameters: {'learning_rate': 0.01, 'batch_size': 16, 'network_type': 'RNN', 'num_layers': 3, 'num_neurons': 16, 'dropout_rate': 0.1}. Best is trial 40 with value: 0.01260630162556965.
[I 2024-09-28 01:16:00,669] Trial 179 finished with value: 0.02502899530198841 and parameters: {'learning_rate': 0.01, 'batch_size': 16, 'network_type': 'RNN', 'num_layers': 2, 'num_neurons': 16, 'dropout_rate': 0.1}. Best is trial 40 with value: 0.01260630162556965.
[I 2024-09-28 01:16:05,857] Trial 180 finished with value: 0.04847952567206493 and parameters: {'learning_rate': 0.01, 'batch_size': 16, 'network_type': 'RNN', 'num_layers': 2, 'num_neurons': 16, 'dropout_rate': 0.1}. Best is trial 40 with value: 0.01260630162556965.
[I 2024-09-28 01:16:15,217] Trial 181 finished with value: 0.013701383908589647 and parameters: {'learning_rate': 0.0001, 'batch_size': 16, 'network_type': 'RNN', 'num_layers': 2, 'num_neurons': 16, 'dropout_rate': 0.1}. Best is trial 40 with value: 0.01260630162556965.
[I 2024-09-28 01:16:20,220] Trial 182 finished with value: 0.04084023676978221 and parameters: {'learning_rate': 0.01, 'batch_size': 16, 'network_type': 'RNN', 'num_layers': 2, 'num_neurons': 16, 'dropout_rate': 0.1}. Best is trial 40 with value: 0.01260630162556965.
[I 2024-09-28 01:16:26,285] Trial 183 finished with value: 0.018171579572889545 and parameters: {'learning_rate': 0.01, 'batch_size': 16, 'network_type': 'RNN', 'num_layers': 2, 'num_neurons': 16, 'dropout_rate': 0.1}. Best is trial 40 with value: 0.01260630162556965.
[I 2024-09-28 01:16:37,068] Trial 184 finished with value: 0.014105138778686528 and parameters: {'learning_rate': 0.0001, 'batch_size': 16, 'network_type': 'RNN', 'num_layers': 2, 'num_neurons': 16, 'dropout_rate': 0.1}. Best is trial 40 with value: 0.01260630162556965.
[I 2024-09-28 01:16:46,543] Trial 185 finished with value: 0.014040413008795858 and parameters: {'learning_rate': 0.0001, 'batch_size': 16, 'network_type': 'RNN', 'num_layers': 2, 'num_neurons': 16, 'dropout_rate': 0.1}. Best is trial 40 with value: 0.01260630162556965.
[I 2024-09-28 01:16:51,261] Trial 186 finished with value: 0.04291910107930505 and parameters: {'learning_rate': 0.01, 'batch_size': 16, 'network_type': 'RNN', 'num_layers': 2, 'num_neurons': 16, 'dropout_rate': 0.1}. Best is trial 40 with value: 0.01260630162556965.
[I 2024-09-28 01:16:56,397] Trial 187 finished with value: 0.02194710318247475 and parameters: {'learning_rate': 0.01, 'batch_size': 16, 'network_type': 'RNN', 'num_layers': 2, 'num_neurons': 32, 'dropout_rate': 0.1}. Best is trial 40 with value: 0.01260630162556965.
[I 2024-09-28 01:17:03,294] Trial 188 finished with value: 0.019010422070821105 and parameters: {'learning_rate': 0.01, 'batch_size': 16, 'network_type': 'RNN', 'num_layers': 2, 'num_neurons': 16, 'dropout_rate': 0.3}. Best is trial 40 with value: 0.01260630162556965.
[I 2024-09-28 01:17:08,406] Trial 189 finished with value: 0.03510718388027619 and parameters: {'learning_rate': 0.01, 'batch_size': 16, 'network_type': 'RNN', 'num_layers': 2, 'num_neurons': 16, 'dropout_rate': 0.1}. Best is trial 40 with value: 0.01260630162556965.
[I 2024-09-28 01:17:17,591] Trial 190 finished with value: 0.0297145927217272 and parameters: {'learning_rate': 0.01, 'batch_size': 16, 'network_type': 'LSTM', 'num_layers': 2, 'num_neurons': 16, 'dropout_rate': 0.2}. Best is trial 40 with value: 0.01260630162556965.
[I 2024-09-28 01:17:22,381] Trial 191 finished with value: 0.01922313202752009 and parameters: {'learning_rate': 0.01, 'batch_size': 16, 'network_type': 'RNN', 'num_layers': 2, 'num_neurons': 16, 'dropout_rate': 0.1}. Best is trial 40 with value: 0.01260630162556965.
[I 2024-09-28 01:17:27,137] Trial 192 finished with value: 0.031489526324802015 and parameters: {'learning_rate': 0.01, 'batch_size': 16, 'network_type': 'RNN', 'num_layers': 2, 'num_neurons': 16, 'dropout_rate': 0.1}. Best is trial 40 with value: 0.01260630162556965.
[I 2024-09-28 01:17:32,095] Trial 193 finished with value: 0.035037446445888985 and parameters: {'learning_rate': 0.01, 'batch_size': 16, 'network_type': 'RNN', 'num_layers': 2, 'num_neurons': 16, 'dropout_rate': 0.1}. Best is trial 40 with value: 0.01260630162556965.
[I 2024-09-28 01:17:38,424] Trial 194 finished with value: 0.036577709939744775 and parameters: {'learning_rate': 0.01, 'batch_size': 16, 'network_type': 'RNN', 'num_layers': 2, 'num_neurons': 16, 'dropout_rate': 0.1}. Best is trial 40 with value: 0.01260630162556965.
[I 2024-09-28 01:17:43,350] Trial 195 finished with value: 0.027926969952053533 and parameters: {'learning_rate': 0.01, 'batch_size': 16, 'network_type': 'RNN', 'num_layers': 2, 'num_neurons': 16, 'dropout_rate': 0.1}. Best is trial 40 with value: 0.01260630162556965.
[I 2024-09-28 01:17:48,038] Trial 196 finished with value: 0.02856459395090743 and parameters: {'learning_rate': 0.01, 'batch_size': 16, 'network_type': 'RNN', 'num_layers': 2, 'num_neurons': 16, 'dropout_rate': 0.1}. Best is trial 40 with value: 0.01260630162556965.
[I 2024-09-28 01:17:52,816] Trial 197 finished with value: 0.03082672267489967 and parameters: {'learning_rate': 0.01, 'batch_size': 16, 'network_type': 'RNN', 'num_layers': 2, 'num_neurons': 16, 'dropout_rate': 0.1}. Best is trial 40 with value: 0.01260630162556965.
[I 2024-09-28 01:17:58,219] Trial 198 finished with value: 0.018379063182406934 and parameters: {'learning_rate': 0.01, 'batch_size': 16, 'network_type': 'RNN', 'num_layers': 2, 'num_neurons': 16, 'dropout_rate': 0.1}. Best is trial 40 with value: 0.01260630162556965.
[I 2024-09-28 01:18:07,324] Trial 199 finished with value: 0.042806620491875585 and parameters: {'learning_rate': 0.01, 'batch_size': 16, 'network_type': 'GRU', 'num_layers': 2, 'num_neurons': 64, 'dropout_rate': 0.1}. Best is trial 40 with value: 0.01260630162556965.
C:\Users\user\AppData\Local\pypoetry\Cache\virtualenvs\transfer-learning-c0qmjA8b-py3.9\lib\site-packages\keras\src\engine\training.py:3103: UserWarning: You are saving your model as an HDF5 file via `model.save()`. This file format is considered legacy. We recommend using instead the native Keras format, e.g. `model.save('my_model.keras')`.
  saving_api.save_model(
[I 2024-09-28 01:18:18,013] A new study created in memory with name: no-name-9357841f-7723-4347-bb71-f69f72ddd110
[I 2024-09-28 01:18:28,692] Trial 0 finished with value: 0.03312706459893125 and parameters: {'learning_rate': 0.01, 'batch_size': 32, 'network_type': 'LSTM', 'num_layers': 2, 'num_neurons': 32, 'dropout_rate': 0.2}. Best is trial 0 with value: 0.03312706459893125.
[I 2024-09-28 01:18:34,188] Trial 1 finished with value: 0.03889403639899363 and parameters: {'learning_rate': 0.01, 'batch_size': 16, 'network_type': 'RNN', 'num_layers': 1, 'num_neurons': 16, 'dropout_rate': 0.3}. Best is trial 0 with value: 0.03312706459893125.
[I 2024-09-28 01:18:49,363] Trial 2 finished with value: 0.015406008402506523 and parameters: {'learning_rate': 0.01, 'batch_size': 16, 'network_type': 'GRU', 'num_layers': 3, 'num_neurons': 64, 'dropout_rate': 0.3}. Best is trial 2 with value: 0.015406008402506523.
[I 2024-09-28 01:18:57,651] Trial 3 finished with value: 0.021622606383429596 and parameters: {'learning_rate': 0.01, 'batch_size': 16, 'network_type': 'RNN', 'num_layers': 3, 'num_neurons': 32, 'dropout_rate': 0.1}. Best is trial 2 with value: 0.015406008402506523.
[I 2024-09-28 01:19:09,300] Trial 4 finished with value: 0.01722435749901669 and parameters: {'learning_rate': 0.0001, 'batch_size': 64, 'network_type': 'RNN', 'num_layers': 2, 'num_neurons': 128, 'dropout_rate': 0.3}. Best is trial 2 with value: 0.015406008402506523.
[I 2024-09-28 01:19:23,854] Trial 5 finished with value: 0.04603850078582767 and parameters: {'learning_rate': 0.01, 'batch_size': 32, 'network_type': 'LSTM', 'num_layers': 3, 'num_neurons': 64, 'dropout_rate': 0.2}. Best is trial 2 with value: 0.015406008402506523.
[I 2024-09-28 01:19:36,010] Trial 6 finished with value: 0.02843534882863357 and parameters: {'learning_rate': 0.0001, 'batch_size': 64, 'network_type': 'LSTM', 'num_layers': 1, 'num_neurons': 16, 'dropout_rate': 0.1}. Best is trial 2 with value: 0.015406008402506523.
[I 2024-09-28 01:19:43,749] Trial 7 finished with value: 0.033074797948201534 and parameters: {'learning_rate': 0.01, 'batch_size': 32, 'network_type': 'RNN', 'num_layers': 3, 'num_neurons': 16, 'dropout_rate': 0.3}. Best is trial 2 with value: 0.015406008402506523.
[I 2024-09-28 01:19:49,063] Trial 8 finished with value: 0.021243473900688987 and parameters: {'learning_rate': 0.01, 'batch_size': 64, 'network_type': 'RNN', 'num_layers': 1, 'num_neurons': 16, 'dropout_rate': 0.3}. Best is trial 2 with value: 0.015406008402506523.
[I 2024-09-28 01:19:55,207] Trial 9 finished with value: 0.01466648621029323 and parameters: {'learning_rate': 0.01, 'batch_size': 64, 'network_type': 'RNN', 'num_layers': 1, 'num_neurons': 32, 'dropout_rate': 0.2}. Best is trial 9 with value: 0.01466648621029323.
[I 2024-09-28 01:20:04,315] Trial 10 finished with value: 0.022338319248623357 and parameters: {'learning_rate': 0.01, 'batch_size': 64, 'network_type': 'GRU', 'num_layers': 1, 'num_neurons': 32, 'dropout_rate': 0.2}. Best is trial 9 with value: 0.01466648621029323.
[I 2024-09-28 01:20:18,009] Trial 11 finished with value: 0.015791173617045098 and parameters: {'learning_rate': 0.01, 'batch_size': 16, 'network_type': 'GRU', 'num_layers': 3, 'num_neurons': 64, 'dropout_rate': 0.2}. Best is trial 9 with value: 0.01466648621029323.
[I 2024-09-28 01:20:25,081] Trial 12 finished with value: 0.017579376008775533 and parameters: {'learning_rate': 0.01, 'batch_size': 16, 'network_type': 'GRU', 'num_layers': 1, 'num_neurons': 64, 'dropout_rate': 0.3}. Best is trial 9 with value: 0.01466648621029323.
[I 2024-09-28 01:20:41,555] Trial 13 finished with value: 0.025340302149454708 and parameters: {'learning_rate': 0.01, 'batch_size': 16, 'network_type': 'GRU', 'num_layers': 3, 'num_neurons': 128, 'dropout_rate': 0.2}. Best is trial 9 with value: 0.01466648621029323.
[I 2024-09-28 01:20:52,301] Trial 14 finished with value: 0.03562514548831519 and parameters: {'learning_rate': 0.01, 'batch_size': 64, 'network_type': 'GRU', 'num_layers': 2, 'num_neurons': 32, 'dropout_rate': 0.1}. Best is trial 9 with value: 0.01466648621029323.
[I 2024-09-28 01:20:57,936] Trial 15 finished with value: 0.014857833226521776 and parameters: {'learning_rate': 0.01, 'batch_size': 64, 'network_type': 'RNN', 'num_layers': 1, 'num_neurons': 64, 'dropout_rate': 0.3}. Best is trial 9 with value: 0.01466648621029323.
[I 2024-09-28 01:21:04,100] Trial 16 finished with value: 0.02274437257978655 and parameters: {'learning_rate': 0.01, 'batch_size': 64, 'network_type': 'RNN', 'num_layers': 1, 'num_neurons': 64, 'dropout_rate': 0.2}. Best is trial 9 with value: 0.01466648621029323.
[I 2024-09-28 01:21:11,627] Trial 17 finished with value: 0.03922921318478058 and parameters: {'learning_rate': 0.01, 'batch_size': 64, 'network_type': 'RNN', 'num_layers': 1, 'num_neurons': 32, 'dropout_rate': 0.2}. Best is trial 9 with value: 0.01466648621029323.
[I 2024-09-28 01:21:17,578] Trial 18 finished with value: 0.03653838136461049 and parameters: {'learning_rate': 0.01, 'batch_size': 64, 'network_type': 'RNN', 'num_layers': 1, 'num_neurons': 128, 'dropout_rate': 0.3}. Best is trial 9 with value: 0.01466648621029323.
[I 2024-09-28 01:21:23,262] Trial 19 finished with value: 0.029213926951090534 and parameters: {'learning_rate': 0.01, 'batch_size': 64, 'network_type': 'RNN', 'num_layers': 1, 'num_neurons': 32, 'dropout_rate': 0.1}. Best is trial 9 with value: 0.01466648621029323.
[I 2024-09-28 01:21:28,836] Trial 20 finished with value: 0.03681996695200605 and parameters: {'learning_rate': 0.01, 'batch_size': 64, 'network_type': 'RNN', 'num_layers': 1, 'num_neurons': 64, 'dropout_rate': 0.3}. Best is trial 9 with value: 0.01466648621029323.
[I 2024-09-28 01:21:44,235] Trial 21 finished with value: 0.036838192727830704 and parameters: {'learning_rate': 0.01, 'batch_size': 16, 'network_type': 'GRU', 'num_layers': 3, 'num_neurons': 64, 'dropout_rate': 0.3}. Best is trial 9 with value: 0.01466648621029323.
[I 2024-09-28 01:21:58,669] Trial 22 finished with value: 0.012659055497911255 and parameters: {'learning_rate': 0.01, 'batch_size': 16, 'network_type': 'GRU', 'num_layers': 3, 'num_neurons': 64, 'dropout_rate': 0.3}. Best is trial 22 with value: 0.012659055497911255.
[I 2024-09-28 01:22:06,216] Trial 23 finished with value: 0.025996269543965698 and parameters: {'learning_rate': 0.01, 'batch_size': 32, 'network_type': 'LSTM', 'num_layers': 1, 'num_neurons': 64, 'dropout_rate': 0.3}. Best is trial 22 with value: 0.012659055497911255.
[I 2024-09-28 01:22:14,482] Trial 24 finished with value: 0.013196305274963393 and parameters: {'learning_rate': 0.01, 'batch_size': 64, 'network_type': 'RNN', 'num_layers': 2, 'num_neurons': 64, 'dropout_rate': 0.3}. Best is trial 22 with value: 0.012659055497911255.
[I 2024-09-28 01:22:25,938] Trial 25 finished with value: 0.015251473426818861 and parameters: {'learning_rate': 0.01, 'batch_size': 16, 'network_type': 'GRU', 'num_layers': 2, 'num_neurons': 64, 'dropout_rate': 0.2}. Best is trial 22 with value: 0.012659055497911255.
