[I 2024-09-27 20:40:42,263] Trial 116 finished with value: 0.010753748347361883 and parameters: {'window_size': 6, 'batch_size': 32, 'network_type': 'GRU', 'num_layers': 2, 'num_neurons': 128, 'learning_rate': 0.01, 'dropout_rate': 0.3}. Best is trial 103 with value: 0.010646479258934657.

1/2 [==============>...............] - ETA: 1s
2/2 [==============================] - 1s 2ms/step
[I 2024-09-27 20:41:04,631] Trial 117 finished with value: 0.01757928907871247 and parameters: {'window_size': 2, 'batch_size': 32, 'network_type': 'GRU', 'num_layers': 2, 'num_neurons': 128, 'learning_rate': 0.01, 'dropout_rate': 0.3}. Best is trial 103 with value: 0.010646479258934657.

1/2 [==============>...............] - ETA: 0s
2/2 [==============================] - 1s 13ms/step
[I 2024-09-27 20:41:29,713] Trial 118 finished with value: 0.0442596172442039 and parameters: {'window_size': 6, 'batch_size': 32, 'network_type': 'GRU', 'num_layers': 3, 'num_neurons': 128, 'learning_rate': 0.0001, 'dropout_rate': 0.3}. Best is trial 103 with value: 0.010646479258934657.

1/2 [==============>...............] - ETA: 0s
2/2 [==============================] - 1s 0s/step
[I 2024-09-27 20:41:46,526] Trial 119 finished with value: 0.011853517398238178 and parameters: {'window_size': 6, 'batch_size': 32, 'network_type': 'GRU', 'num_layers': 2, 'num_neurons': 128, 'learning_rate': 0.01, 'dropout_rate': 0.3}. Best is trial 103 with value: 0.010646479258934657.

1/2 [==============>...............] - ETA: 0s
2/2 [==============================] - 1s 16ms/step
[I 2024-09-27 20:41:54,662] Trial 120 finished with value: 0.011588580717643104 and parameters: {'window_size': 6, 'batch_size': 32, 'network_type': 'GRU', 'num_layers': 2, 'num_neurons': 128, 'learning_rate': 0.01, 'dropout_rate': 0.3}. Best is trial 103 with value: 0.010646479258934657.

1/2 [==============>...............] - ETA: 0s
2/2 [==============================] - 1s 7ms/step
[I 2024-09-27 20:42:04,764] Trial 121 finished with value: 0.011198137531677884 and parameters: {'window_size': 6, 'batch_size': 32, 'network_type': 'GRU', 'num_layers': 2, 'num_neurons': 64, 'learning_rate': 0.01, 'dropout_rate': 0.3}. Best is trial 103 with value: 0.010646479258934657.

1/2 [==============>...............] - ETA: 0s
2/2 [==============================] - 1s 8ms/step
[I 2024-09-27 20:42:25,544] Trial 122 finished with value: 0.010609922771652536 and parameters: {'window_size': 6, 'batch_size': 32, 'network_type': 'GRU', 'num_layers': 2, 'num_neurons': 128, 'learning_rate': 0.01, 'dropout_rate': 0.3}. Best is trial 122 with value: 0.010609922771652536.

1/2 [==============>...............] - ETA: 0s
2/2 [==============================] - 1s 6ms/step
[I 2024-09-27 20:42:39,310] Trial 123 finished with value: 0.010852609495321913 and parameters: {'window_size': 6, 'batch_size': 32, 'network_type': 'GRU', 'num_layers': 2, 'num_neurons': 128, 'learning_rate': 0.01, 'dropout_rate': 0.3}. Best is trial 122 with value: 0.010609922771652536.

1/2 [==============>...............] - ETA: 0s
2/2 [==============================] - 1s 18ms/step
[I 2024-09-27 20:42:50,550] Trial 124 finished with value: 0.011278962612152102 and parameters: {'window_size': 6, 'batch_size': 32, 'network_type': 'GRU', 'num_layers': 2, 'num_neurons': 128, 'learning_rate': 0.01, 'dropout_rate': 0.3}. Best is trial 122 with value: 0.010609922771652536.

1/2 [==============>...............] - ETA: 0s
2/2 [==============================] - 1s 0s/step
[I 2024-09-27 20:43:06,147] Trial 125 finished with value: 0.011340111280481025 and parameters: {'window_size': 6, 'batch_size': 32, 'network_type': 'GRU', 'num_layers': 2, 'num_neurons': 128, 'learning_rate': 0.01, 'dropout_rate': 0.3}. Best is trial 122 with value: 0.010609922771652536.

1/2 [==============>...............] - ETA: 0s
2/2 [==============================] - 1s 15ms/step
[I 2024-09-27 20:43:27,661] Trial 126 finished with value: 0.012972076212366424 and parameters: {'window_size': 6, 'batch_size': 32, 'network_type': 'GRU', 'num_layers': 2, 'num_neurons': 128, 'learning_rate': 0.01, 'dropout_rate': 0.3}. Best is trial 122 with value: 0.010609922771652536.

1/2 [==============>...............] - ETA: 0s
2/2 [==============================] - 0s 0s/step
[I 2024-09-27 20:43:43,047] Trial 127 finished with value: 0.017234209969639785 and parameters: {'window_size': 6, 'batch_size': 32, 'network_type': 'GRU', 'num_layers': 2, 'num_neurons': 128, 'learning_rate': 0.01, 'dropout_rate': 0.3}. Best is trial 122 with value: 0.010609922771652536.

1/2 [==============>...............] - ETA: 0s
2/2 [==============================] - 0s 10ms/step
[I 2024-09-27 20:43:55,430] Trial 128 finished with value: 0.028012578288714094 and parameters: {'window_size': 6, 'batch_size': 32, 'network_type': 'LSTM', 'num_layers': 2, 'num_neurons': 128, 'learning_rate': 0.0001, 'dropout_rate': 0.3}. Best is trial 122 with value: 0.010609922771652536.

1/2 [==============>...............] - ETA: 0s
2/2 [==============================] - 0s 7ms/step
[I 2024-09-27 20:44:06,720] Trial 129 finished with value: 0.018068025852243114 and parameters: {'window_size': 6, 'batch_size': 64, 'network_type': 'GRU', 'num_layers': 2, 'num_neurons': 128, 'learning_rate': 0.01, 'dropout_rate': 0.3}. Best is trial 122 with value: 0.010609922771652536.

1/2 [==============>...............] - ETA: 0s
2/2 [==============================] - 0s 0s/step
[I 2024-09-27 20:44:14,746] Trial 130 finished with value: 0.012072536726792657 and parameters: {'window_size': 6, 'batch_size': 32, 'network_type': 'GRU', 'num_layers': 1, 'num_neurons': 128, 'learning_rate': 0.01, 'dropout_rate': 0.3}. Best is trial 122 with value: 0.010609922771652536.

1/2 [==============>...............] - ETA: 0s
2/2 [==============================] - 0s 0s/step
[I 2024-09-27 20:44:28,066] Trial 131 finished with value: 0.010823932578166329 and parameters: {'window_size': 6, 'batch_size': 32, 'network_type': 'GRU', 'num_layers': 2, 'num_neurons': 128, 'learning_rate': 0.01, 'dropout_rate': 0.3}. Best is trial 122 with value: 0.010609922771652536.

1/2 [==============>...............] - ETA: 0s
2/2 [==============================] - 0s 7ms/step
[I 2024-09-27 20:44:37,241] Trial 132 finished with value: 0.01555720019837221 and parameters: {'window_size': 6, 'batch_size': 32, 'network_type': 'GRU', 'num_layers': 2, 'num_neurons': 128, 'learning_rate': 0.01, 'dropout_rate': 0.3}. Best is trial 122 with value: 0.010609922771652536.

1/2 [==============>...............] - ETA: 0s
2/2 [==============================] - 0s 0s/step
[I 2024-09-27 20:44:46,901] Trial 133 finished with value: 0.014239857132236156 and parameters: {'window_size': 6, 'batch_size': 32, 'network_type': 'GRU', 'num_layers': 2, 'num_neurons': 128, 'learning_rate': 0.01, 'dropout_rate': 0.3}. Best is trial 122 with value: 0.010609922771652536.

1/2 [==============>...............] - ETA: 0s
2/2 [==============================] - 0s 10ms/step
[I 2024-09-27 20:45:01,549] Trial 134 finished with value: 0.01227767570316792 and parameters: {'window_size': 6, 'batch_size': 32, 'network_type': 'GRU', 'num_layers': 2, 'num_neurons': 128, 'learning_rate': 0.01, 'dropout_rate': 0.3}. Best is trial 122 with value: 0.010609922771652536.

1/2 [==============>...............] - ETA: 0s
2/2 [==============================] - 0s 16ms/step
[I 2024-09-27 20:45:09,798] Trial 135 finished with value: 0.010855143477519355 and parameters: {'window_size': 6, 'batch_size': 32, 'network_type': 'GRU', 'num_layers': 2, 'num_neurons': 128, 'learning_rate': 0.01, 'dropout_rate': 0.3}. Best is trial 122 with value: 0.010609922771652536.

1/2 [==============>...............] - ETA: 0s
2/2 [==============================] - 0s 0s/step
[I 2024-09-27 20:45:19,449] Trial 136 finished with value: 0.011136034602920208 and parameters: {'window_size': 6, 'batch_size': 32, 'network_type': 'GRU', 'num_layers': 2, 'num_neurons': 128, 'learning_rate': 0.01, 'dropout_rate': 0.3}. Best is trial 122 with value: 0.010609922771652536.

1/2 [==============>...............] - ETA: 0s
2/2 [==============================] - 0s 8ms/step
[I 2024-09-27 20:45:28,364] Trial 137 finished with value: 0.012153753201166797 and parameters: {'window_size': 6, 'batch_size': 32, 'network_type': 'GRU', 'num_layers': 2, 'num_neurons': 128, 'learning_rate': 0.01, 'dropout_rate': 0.3}. Best is trial 122 with value: 0.010609922771652536.

1/2 [==============>...............] - ETA: 0s
2/2 [==============================] - 0s 11ms/step
[I 2024-09-27 20:45:39,919] Trial 138 finished with value: 0.018273914019266774 and parameters: {'window_size': 6, 'batch_size': 32, 'network_type': 'GRU', 'num_layers': 2, 'num_neurons': 128, 'learning_rate': 0.01, 'dropout_rate': 0.3}. Best is trial 122 with value: 0.010609922771652536.

1/2 [==============>...............] - ETA: 0s
2/2 [==============================] - 0s 0s/step
[I 2024-09-27 20:45:48,162] Trial 139 finished with value: 0.016370777396055372 and parameters: {'window_size': 2, 'batch_size': 32, 'network_type': 'GRU', 'num_layers': 2, 'num_neurons': 128, 'learning_rate': 0.01, 'dropout_rate': 0.3}. Best is trial 122 with value: 0.010609922771652536.

1/2 [==============>...............] - ETA: 0s
2/2 [==============================] - 0s 0s/step
[I 2024-09-27 20:45:59,882] Trial 140 finished with value: 0.012110976447661709 and parameters: {'window_size': 6, 'batch_size': 32, 'network_type': 'GRU', 'num_layers': 2, 'num_neurons': 128, 'learning_rate': 0.01, 'dropout_rate': 0.3}. Best is trial 122 with value: 0.010609922771652536.

1/2 [==============>...............] - ETA: 0s
2/2 [==============================] - 1s 16ms/step
[I 2024-09-27 20:46:10,363] Trial 141 finished with value: 0.0110717487335205 and parameters: {'window_size': 6, 'batch_size': 32, 'network_type': 'GRU', 'num_layers': 2, 'num_neurons': 128, 'learning_rate': 0.01, 'dropout_rate': 0.3}. Best is trial 122 with value: 0.010609922771652536.

1/2 [==============>...............] - ETA: 0s
2/2 [==============================] - 0s 10ms/step
[I 2024-09-27 20:46:23,202] Trial 142 finished with value: 0.01340046973029773 and parameters: {'window_size': 6, 'batch_size': 32, 'network_type': 'GRU', 'num_layers': 2, 'num_neurons': 128, 'learning_rate': 0.01, 'dropout_rate': 0.3}. Best is trial 122 with value: 0.010609922771652536.

1/2 [==============>...............] - ETA: 0s
2/2 [==============================] - 0s 0s/step
[I 2024-09-27 20:46:35,197] Trial 143 finished with value: 0.010875951707363126 and parameters: {'window_size': 6, 'batch_size': 32, 'network_type': 'GRU', 'num_layers': 2, 'num_neurons': 128, 'learning_rate': 0.01, 'dropout_rate': 0.3}. Best is trial 122 with value: 0.010609922771652536.

1/2 [==============>...............] - ETA: 0s
2/2 [==============================] - 1s 12ms/step
[I 2024-09-27 20:46:47,786] Trial 144 finished with value: 0.012134333088994026 and parameters: {'window_size': 6, 'batch_size': 32, 'network_type': 'GRU', 'num_layers': 2, 'num_neurons': 128, 'learning_rate': 0.01, 'dropout_rate': 0.3}. Best is trial 122 with value: 0.010609922771652536.

1/2 [==============>...............] - ETA: 0s
2/2 [==============================] - 0s 0s/step
[I 2024-09-27 20:48:30,100] Trial 145 finished with value: 0.01206153532862664 and parameters: {'window_size': 6, 'batch_size': 32, 'network_type': 'GRU', 'num_layers': 2, 'num_neurons': 128, 'learning_rate': 0.01, 'dropout_rate': 0.3}. Best is trial 122 with value: 0.010609922771652536.

1/2 [==============>...............] - ETA: 0s
2/2 [==============================] - 1s 0s/step
[I 2024-09-27 20:48:55,026] Trial 146 finished with value: 0.021264918252825744 and parameters: {'window_size': 6, 'batch_size': 32, 'network_type': 'GRU', 'num_layers': 3, 'num_neurons': 128, 'learning_rate': 0.01, 'dropout_rate': 0.3}. Best is trial 122 with value: 0.010609922771652536.

1/2 [==============>...............] - ETA: 0s
2/2 [==============================] - 0s 0s/step
[I 2024-09-27 20:49:04,352] Trial 147 finished with value: 0.012118105863531436 and parameters: {'window_size': 6, 'batch_size': 32, 'network_type': 'GRU', 'num_layers': 2, 'num_neurons': 128, 'learning_rate': 0.01, 'dropout_rate': 0.3}. Best is trial 122 with value: 0.010609922771652536.

1/2 [==============>...............] - ETA: 0s
2/2 [==============================] - 0s 16ms/step
[I 2024-09-27 20:49:15,472] Trial 148 finished with value: 0.011824994087219244 and parameters: {'window_size': 6, 'batch_size': 32, 'network_type': 'GRU', 'num_layers': 2, 'num_neurons': 32, 'learning_rate': 0.01, 'dropout_rate': 0.1}. Best is trial 122 with value: 0.010609922771652536.

1/2 [==============>...............] - ETA: 0s
2/2 [==============================] - 1s 16ms/step
[I 2024-09-27 20:49:29,592] Trial 149 finished with value: 0.01201968415081501 and parameters: {'window_size': 6, 'batch_size': 32, 'network_type': 'GRU', 'num_layers': 2, 'num_neurons': 128, 'learning_rate': 0.01, 'dropout_rate': 0.3}. Best is trial 122 with value: 0.010609922771652536.

1/2 [==============>...............] - ETA: 0s
2/2 [==============================] - 0s 7ms/step
[I 2024-09-27 20:49:44,379] Trial 150 finished with value: 0.016919335693120964 and parameters: {'window_size': 6, 'batch_size': 32, 'network_type': 'GRU', 'num_layers': 2, 'num_neurons': 128, 'learning_rate': 0.01, 'dropout_rate': 0.3}. Best is trial 122 with value: 0.010609922771652536.

1/2 [==============>...............] - ETA: 0s
2/2 [==============================] - 1s 0s/step
[I 2024-09-27 20:49:56,283] Trial 151 finished with value: 0.01200844731926918 and parameters: {'window_size': 6, 'batch_size': 32, 'network_type': 'GRU', 'num_layers': 2, 'num_neurons': 128, 'learning_rate': 0.01, 'dropout_rate': 0.3}. Best is trial 122 with value: 0.010609922771652536.

1/2 [==============>...............] - ETA: 0s
2/2 [==============================] - 0s 16ms/step
[I 2024-09-27 20:50:04,307] Trial 152 finished with value: 0.01212843826413155 and parameters: {'window_size': 6, 'batch_size': 32, 'network_type': 'GRU', 'num_layers': 2, 'num_neurons': 128, 'learning_rate': 0.01, 'dropout_rate': 0.3}. Best is trial 122 with value: 0.010609922771652536.

1/2 [==============>...............] - ETA: 0s
2/2 [==============================] - 0s 0s/step
[I 2024-09-27 20:50:13,496] Trial 153 finished with value: 0.012188932880759245 and parameters: {'window_size': 6, 'batch_size': 32, 'network_type': 'GRU', 'num_layers': 2, 'num_neurons': 128, 'learning_rate': 0.01, 'dropout_rate': 0.3}. Best is trial 122 with value: 0.010609922771652536.

1/2 [==============>...............] - ETA: 0s
2/2 [==============================] - 0s 16ms/step
[I 2024-09-27 20:50:25,149] Trial 154 finished with value: 0.012764690543214482 and parameters: {'window_size': 6, 'batch_size': 32, 'network_type': 'GRU', 'num_layers': 2, 'num_neurons': 128, 'learning_rate': 0.01, 'dropout_rate': 0.3}. Best is trial 122 with value: 0.010609922771652536.

1/2 [==============>...............] - ETA: 0s
2/2 [==============================] - 0s 0s/step
[I 2024-09-27 20:50:40,719] Trial 155 finished with value: 0.010960233598947525 and parameters: {'window_size': 6, 'batch_size': 64, 'network_type': 'GRU', 'num_layers': 2, 'num_neurons': 128, 'learning_rate': 0.01, 'dropout_rate': 0.3}. Best is trial 122 with value: 0.010609922771652536.

1/2 [==============>...............] - ETA: 0s
2/2 [==============================] - 0s 16ms/step
[I 2024-09-27 20:50:46,687] Trial 156 finished with value: 0.0190605750232935 and parameters: {'window_size': 6, 'batch_size': 64, 'network_type': 'GRU', 'num_layers': 2, 'num_neurons': 16, 'learning_rate': 0.01, 'dropout_rate': 0.3}. Best is trial 122 with value: 0.010609922771652536.

1/2 [==============>...............] - ETA: 0s
2/2 [==============================] - 0s 16ms/step
[I 2024-09-27 20:50:53,855] Trial 157 finished with value: 0.028014233157038687 and parameters: {'window_size': 6, 'batch_size': 64, 'network_type': 'LSTM', 'num_layers': 2, 'num_neurons': 128, 'learning_rate': 0.01, 'dropout_rate': 0.3}. Best is trial 122 with value: 0.010609922771652536.

1/2 [==============>...............] - ETA: 0s
2/2 [==============================] - 1s 0s/step
[I 2024-09-27 20:51:07,084] Trial 158 finished with value: 0.03150409230589868 and parameters: {'window_size': 6, 'batch_size': 64, 'network_type': 'GRU', 'num_layers': 2, 'num_neurons': 128, 'learning_rate': 0.0001, 'dropout_rate': 0.3}. Best is trial 122 with value: 0.010609922771652536.

1/2 [==============>...............] - ETA: 0s
2/2 [==============================] - 0s 0s/step
[I 2024-09-27 20:51:23,601] Trial 159 finished with value: 0.012328072339296345 and parameters: {'window_size': 6, 'batch_size': 64, 'network_type': 'GRU', 'num_layers': 2, 'num_neurons': 128, 'learning_rate': 0.01, 'dropout_rate': 0.3}. Best is trial 122 with value: 0.010609922771652536.

1/2 [==============>...............] - ETA: 0s
2/2 [==============================] - 0s 0s/step
[I 2024-09-27 20:51:27,356] Trial 160 finished with value: 0.01625492063661416 and parameters: {'window_size': 6, 'batch_size': 64, 'network_type': 'GRU', 'num_layers': 1, 'num_neurons': 32, 'learning_rate': 0.01, 'dropout_rate': 0.1}. Best is trial 122 with value: 0.010609922771652536.

1/2 [==============>...............] - ETA: 0s
2/2 [==============================] - 0s 0s/step
[I 2024-09-27 20:51:36,888] Trial 161 finished with value: 0.011052873104810715 and parameters: {'window_size': 6, 'batch_size': 32, 'network_type': 'GRU', 'num_layers': 2, 'num_neurons': 128, 'learning_rate': 0.01, 'dropout_rate': 0.3}. Best is trial 122 with value: 0.010609922771652536.

1/2 [==============>...............] - ETA: 0s
2/2 [==============================] - 0s 10ms/step
[I 2024-09-27 20:51:46,778] Trial 162 finished with value: 0.010961330145597456 and parameters: {'window_size': 6, 'batch_size': 32, 'network_type': 'GRU', 'num_layers': 2, 'num_neurons': 128, 'learning_rate': 0.01, 'dropout_rate': 0.3}. Best is trial 122 with value: 0.010609922771652536.

1/2 [==============>...............] - ETA: 0s
2/2 [==============================] - 0s 16ms/step
[I 2024-09-27 20:51:54,769] Trial 163 finished with value: 0.011662953441341722 and parameters: {'window_size': 6, 'batch_size': 32, 'network_type': 'GRU', 'num_layers': 2, 'num_neurons': 128, 'learning_rate': 0.01, 'dropout_rate': 0.3}. Best is trial 122 with value: 0.010609922771652536.

1/2 [==============>...............] - ETA: 0s
2/2 [==============================] - 0s 0s/step
[I 2024-09-27 20:52:04,556] Trial 164 finished with value: 0.015477824737628307 and parameters: {'window_size': 6, 'batch_size': 32, 'network_type': 'GRU', 'num_layers': 2, 'num_neurons': 128, 'learning_rate': 0.01, 'dropout_rate': 0.3}. Best is trial 122 with value: 0.010609922771652536.

1/2 [==============>...............] - ETA: 0s
2/2 [==============================] - 1s 0s/step
[I 2024-09-27 20:52:16,382] Trial 165 finished with value: 0.011487347324689224 and parameters: {'window_size': 6, 'batch_size': 32, 'network_type': 'GRU', 'num_layers': 2, 'num_neurons': 128, 'learning_rate': 0.01, 'dropout_rate': 0.3}. Best is trial 122 with value: 0.010609922771652536.

1/2 [==============>...............] - ETA: 0s
2/2 [==============================] - 0s 0s/step
[I 2024-09-27 20:52:32,579] Trial 166 finished with value: 0.011054540862639748 and parameters: {'window_size': 6, 'batch_size': 32, 'network_type': 'GRU', 'num_layers': 2, 'num_neurons': 128, 'learning_rate': 0.01, 'dropout_rate': 0.3}. Best is trial 122 with value: 0.010609922771652536.

1/2 [==============>...............] - ETA: 0s
2/2 [==============================] - 0s 16ms/step
[I 2024-09-27 20:52:42,221] Trial 167 finished with value: 0.017458445698022833 and parameters: {'window_size': 6, 'batch_size': 32, 'network_type': 'GRU', 'num_layers': 2, 'num_neurons': 128, 'learning_rate': 0.01, 'dropout_rate': 0.3}. Best is trial 122 with value: 0.010609922771652536.

1/2 [==============>...............] - ETA: 0s
2/2 [==============================] - 0s 0s/step
[I 2024-09-27 20:52:51,788] Trial 168 finished with value: 0.013208458811044687 and parameters: {'window_size': 6, 'batch_size': 32, 'network_type': 'GRU', 'num_layers': 2, 'num_neurons': 128, 'learning_rate': 0.01, 'dropout_rate': 0.3}. Best is trial 122 with value: 0.010609922771652536.

1/2 [==============>...............] - ETA: 0s
2/2 [==============================] - 1s 16ms/step
[I 2024-09-27 20:53:01,141] Trial 169 finished with value: 0.018854732774771184 and parameters: {'window_size': 2, 'batch_size': 32, 'network_type': 'GRU', 'num_layers': 2, 'num_neurons': 128, 'learning_rate': 0.01, 'dropout_rate': 0.3}. Best is trial 122 with value: 0.010609922771652536.

1/2 [==============>...............] - ETA: 0s
2/2 [==============================] - 1s 0s/step
[I 2024-09-27 20:53:16,495] Trial 170 finished with value: 0.01368610535562039 and parameters: {'window_size': 6, 'batch_size': 32, 'network_type': 'GRU', 'num_layers': 2, 'num_neurons': 128, 'learning_rate': 0.01, 'dropout_rate': 0.3}. Best is trial 122 with value: 0.010609922771652536.

1/2 [==============>...............] - ETA: 0s
2/2 [==============================] - 0s 10ms/step
[I 2024-09-27 20:53:27,739] Trial 171 finished with value: 0.014221776639421787 and parameters: {'window_size': 6, 'batch_size': 32, 'network_type': 'GRU', 'num_layers': 2, 'num_neurons': 128, 'learning_rate': 0.01, 'dropout_rate': 0.3}. Best is trial 122 with value: 0.010609922771652536.

1/2 [==============>...............] - ETA: 0s
2/2 [==============================] - 1s 16ms/step
