[I 2024-09-27 22:56:20,635] Trial 70 finished with value: 0.14238176339467365 and parameters: {'window_size': 6, 'batch_size': 64, 'network_type': 'GRU', 'num_layers': 1, 'num_neurons': 64, 'learning_rate': 0.01, 'dropout_rate': 0.1}. Best is trial 31 with value: 0.08416931684393632.

1/1 [==============================] - ETA: 0s
1/1 [==============================] - 0s 204ms/step
[I 2024-09-27 22:56:23,316] Trial 71 finished with value: 0.1566984832914252 and parameters: {'window_size': 2, 'batch_size': 64, 'network_type': 'RNN', 'num_layers': 1, 'num_neurons': 16, 'learning_rate': 0.01, 'dropout_rate': 0.1}. Best is trial 31 with value: 0.08416931684393632.

1/1 [==============================] - ETA: 0s
1/1 [==============================] - 0s 175ms/step
[I 2024-09-27 22:56:25,839] Trial 72 finished with value: 0.10670183658599855 and parameters: {'window_size': 2, 'batch_size': 64, 'network_type': 'RNN', 'num_layers': 1, 'num_neurons': 16, 'learning_rate': 0.01, 'dropout_rate': 0.1}. Best is trial 31 with value: 0.08416931684393632.

1/1 [==============================] - ETA: 0s
1/1 [==============================] - 0s 241ms/step
[I 2024-09-27 22:56:29,545] Trial 73 finished with value: 0.08445521615680897 and parameters: {'window_size': 2, 'batch_size': 64, 'network_type': 'RNN', 'num_layers': 1, 'num_neurons': 16, 'learning_rate': 0.01, 'dropout_rate': 0.2}. Best is trial 31 with value: 0.08416931684393632.

1/1 [==============================] - ETA: 0s
1/1 [==============================] - 0s 194ms/step
[I 2024-09-27 22:56:32,527] Trial 74 finished with value: 0.09954716662356729 and parameters: {'window_size': 2, 'batch_size': 64, 'network_type': 'RNN', 'num_layers': 1, 'num_neurons': 16, 'learning_rate': 0.01, 'dropout_rate': 0.2}. Best is trial 31 with value: 0.08416931684393632.

1/1 [==============================] - ETA: 0s
1/1 [==============================] - 0s 438ms/step
[I 2024-09-27 22:56:38,138] Trial 75 finished with value: 0.19073354961997582 and parameters: {'window_size': 2, 'batch_size': 64, 'network_type': 'RNN', 'num_layers': 3, 'num_neurons': 16, 'learning_rate': 0.01, 'dropout_rate': 0.2}. Best is trial 31 with value: 0.08416931684393632.

1/1 [==============================] - ETA: 0s
1/1 [==============================] - 0s 183ms/step
[I 2024-09-27 22:56:41,114] Trial 76 finished with value: 0.09146342172120747 and parameters: {'window_size': 2, 'batch_size': 32, 'network_type': 'RNN', 'num_layers': 1, 'num_neurons': 128, 'learning_rate': 0.01, 'dropout_rate': 0.2}. Best is trial 31 with value: 0.08416931684393632.

1/1 [==============================] - ETA: 0s
1/1 [==============================] - 0s 237ms/step
[I 2024-09-27 22:56:43,800] Trial 77 finished with value: 0.09307282191828677 and parameters: {'window_size': 2, 'batch_size': 64, 'network_type': 'RNN', 'num_layers': 1, 'num_neurons': 16, 'learning_rate': 0.01, 'dropout_rate': 0.2}. Best is trial 31 with value: 0.08416931684393632.

1/1 [==============================] - ETA: 0s
1/1 [==============================] - 0s 287ms/step
[I 2024-09-27 22:56:47,892] Trial 78 finished with value: 0.17354473540657445 and parameters: {'window_size': 2, 'batch_size': 16, 'network_type': 'RNN', 'num_layers': 2, 'num_neurons': 128, 'learning_rate': 0.01, 'dropout_rate': 0.2}. Best is trial 31 with value: 0.08416931684393632.

1/1 [==============================] - ETA: 0s
1/1 [==============================] - 0s 177ms/step
[I 2024-09-27 22:56:50,712] Trial 79 finished with value: 0.12121632450505307 and parameters: {'window_size': 2, 'batch_size': 64, 'network_type': 'RNN', 'num_layers': 1, 'num_neurons': 32, 'learning_rate': 0.01, 'dropout_rate': 0.3}. Best is trial 31 with value: 0.08416931684393632.

1/1 [==============================] - ETA: 0s
1/1 [==============================] - 0s 355ms/step
[I 2024-09-27 22:56:54,403] Trial 80 finished with value: 0.5167531292298262 and parameters: {'window_size': 4, 'batch_size': 64, 'network_type': 'LSTM', 'num_layers': 1, 'num_neurons': 128, 'learning_rate': 0.01, 'dropout_rate': 0.2}. Best is trial 31 with value: 0.08416931684393632.

1/1 [==============================] - ETA: 0s
1/1 [==============================] - 0s 163ms/step
[I 2024-09-27 22:56:56,913] Trial 81 finished with value: 0.13519423484802245 and parameters: {'window_size': 2, 'batch_size': 64, 'network_type': 'RNN', 'num_layers': 1, 'num_neurons': 16, 'learning_rate': 0.01, 'dropout_rate': 0.1}. Best is trial 31 with value: 0.08416931684393632.

1/1 [==============================] - ETA: 0s
1/1 [==============================] - 0s 227ms/step
[I 2024-09-27 22:56:59,605] Trial 82 finished with value: 0.1168518023239939 and parameters: {'window_size': 2, 'batch_size': 64, 'network_type': 'RNN', 'num_layers': 1, 'num_neurons': 16, 'learning_rate': 0.01, 'dropout_rate': 0.1}. Best is trial 31 with value: 0.08416931684393632.

1/1 [==============================] - ETA: 0s
1/1 [==============================] - 0s 163ms/step
[I 2024-09-27 22:57:06,808] Trial 83 finished with value: 0.8722156590662504 and parameters: {'window_size': 2, 'batch_size': 64, 'network_type': 'RNN', 'num_layers': 1, 'num_neurons': 16, 'learning_rate': 0.0001, 'dropout_rate': 0.1}. Best is trial 31 with value: 0.08416931684393632.

1/1 [==============================] - ETA: 0s
1/1 [==============================] - 0s 295ms/step
[I 2024-09-27 23:02:52,594] Trial 84 finished with value: 0.3264546855625353 and parameters: {'window_size': 2, 'batch_size': 64, 'network_type': 'RNN', 'num_layers': 1, 'num_neurons': 16, 'learning_rate': 0.01, 'dropout_rate': 0.1}. Best is trial 31 with value: 0.08416931684393632.

1/1 [==============================] - ETA: 0s
1/1 [==============================] - 0s 332ms/step
[I 2024-09-27 23:02:57,382] Trial 85 finished with value: 0.11297446808062102 and parameters: {'window_size': 2, 'batch_size': 64, 'network_type': 'RNN', 'num_layers': 1, 'num_neurons': 64, 'learning_rate': 0.01, 'dropout_rate': 0.1}. Best is trial 31 with value: 0.08416931684393632.

1/1 [==============================] - ETA: 0s
1/1 [==============================] - 0s 325ms/step
[I 2024-09-27 23:03:02,629] Trial 86 finished with value: 0.12043060132076866 and parameters: {'window_size': 2, 'batch_size': 64, 'network_type': 'RNN', 'num_layers': 1, 'num_neurons': 128, 'learning_rate': 0.01, 'dropout_rate': 0.1}. Best is trial 31 with value: 0.08416931684393632.

1/1 [==============================] - ETA: 0s
1/1 [==============================] - 0s 394ms/step
[I 2024-09-27 23:03:08,049] Trial 87 finished with value: 0.3184500551859538 and parameters: {'window_size': 6, 'batch_size': 64, 'network_type': 'GRU', 'num_layers': 1, 'num_neurons': 16, 'learning_rate': 0.01, 'dropout_rate': 0.1}. Best is trial 31 with value: 0.08416931684393632.

1/1 [==============================] - ETA: 0s
1/1 [==============================] - 1s 636ms/step
[I 2024-09-27 23:03:16,543] Trial 88 finished with value: 0.09569951654735365 and parameters: {'window_size': 2, 'batch_size': 64, 'network_type': 'RNN', 'num_layers': 3, 'num_neurons': 128, 'learning_rate': 0.01, 'dropout_rate': 0.1}. Best is trial 31 with value: 0.08416931684393632.

1/1 [==============================] - ETA: 0s
1/1 [==============================] - 0s 237ms/step
[I 2024-09-27 23:03:20,418] Trial 89 finished with value: 0.1752990171030948 and parameters: {'window_size': 2, 'batch_size': 32, 'network_type': 'RNN', 'num_layers': 1, 'num_neurons': 64, 'learning_rate': 0.01, 'dropout_rate': 0.3}. Best is trial 31 with value: 0.08416931684393632.

1/1 [==============================] - ETA: 0s
1/1 [==============================] - 0s 432ms/step
[I 2024-09-27 23:03:26,236] Trial 90 finished with value: 0.12918844950826544 and parameters: {'window_size': 2, 'batch_size': 16, 'network_type': 'RNN', 'num_layers': 2, 'num_neurons': 16, 'learning_rate': 0.01, 'dropout_rate': 0.1}. Best is trial 31 with value: 0.08416931684393632.

1/1 [==============================] - ETA: 0s
1/1 [==============================] - 0s 259ms/step
[I 2024-09-27 23:03:30,247] Trial 91 finished with value: 0.10267198005475497 and parameters: {'window_size': 2, 'batch_size': 32, 'network_type': 'RNN', 'num_layers': 1, 'num_neurons': 128, 'learning_rate': 0.01, 'dropout_rate': 0.2}. Best is trial 31 with value: 0.08416931684393632.

1/1 [==============================] - ETA: 0s
1/1 [==============================] - 0s 317ms/step
[I 2024-09-27 23:03:34,833] Trial 92 finished with value: 0.18101536168550192 and parameters: {'window_size': 2, 'batch_size': 32, 'network_type': 'RNN', 'num_layers': 1, 'num_neurons': 128, 'learning_rate': 0.01, 'dropout_rate': 0.2}. Best is trial 31 with value: 0.08416931684393632.

1/1 [==============================] - ETA: 0s
1/1 [==============================] - 0s 297ms/step
[I 2024-09-27 23:03:38,777] Trial 93 finished with value: 0.1360329327332346 and parameters: {'window_size': 2, 'batch_size': 32, 'network_type': 'RNN', 'num_layers': 1, 'num_neurons': 128, 'learning_rate': 0.01, 'dropout_rate': 0.2}. Best is trial 31 with value: 0.08416931684393632.

1/1 [==============================] - ETA: 0s
1/1 [==============================] - 0s 240ms/step
[I 2024-09-27 23:03:43,095] Trial 94 finished with value: 0.10632898802506298 and parameters: {'window_size': 2, 'batch_size': 32, 'network_type': 'RNN', 'num_layers': 1, 'num_neurons': 128, 'learning_rate': 0.01, 'dropout_rate': 0.2}. Best is trial 31 with value: 0.08416931684393632.

1/1 [==============================] - ETA: 0s
1/1 [==============================] - 0s 222ms/step
[I 2024-09-27 23:03:46,854] Trial 95 finished with value: 0.09420018030467787 and parameters: {'window_size': 2, 'batch_size': 32, 'network_type': 'RNN', 'num_layers': 1, 'num_neurons': 128, 'learning_rate': 0.01, 'dropout_rate': 0.2}. Best is trial 31 with value: 0.08416931684393632.

1/1 [==============================] - ETA: 0s
1/1 [==============================] - 0s 252ms/step
[I 2024-09-27 23:03:50,276] Trial 96 finished with value: 0.15873046930212725 and parameters: {'window_size': 2, 'batch_size': 64, 'network_type': 'RNN', 'num_layers': 1, 'num_neurons': 128, 'learning_rate': 0.01, 'dropout_rate': 0.1}. Best is trial 31 with value: 0.08416931684393632.

1/1 [==============================] - ETA: 0s
1/1 [==============================] - 0s 212ms/step
[I 2024-09-27 23:03:53,482] Trial 97 finished with value: 0.11191637761969317 and parameters: {'window_size': 2, 'batch_size': 64, 'network_type': 'RNN', 'num_layers': 1, 'num_neurons': 128, 'learning_rate': 0.01, 'dropout_rate': 0.2}. Best is trial 31 with value: 0.08416931684393632.

1/1 [==============================] - ETA: 0s
1/1 [==============================] - 0s 284ms/step
[I 2024-09-27 23:03:58,142] Trial 98 finished with value: 0.7658797599007103 and parameters: {'window_size': 4, 'batch_size': 64, 'network_type': 'LSTM', 'num_layers': 1, 'num_neurons': 32, 'learning_rate': 0.01, 'dropout_rate': 0.1}. Best is trial 31 with value: 0.08416931684393632.

1/1 [==============================] - ETA: 0s
1/1 [==============================] - 0s 248ms/step
[I 2024-09-27 23:04:01,896] Trial 99 finished with value: 0.1045635583275243 and parameters: {'window_size': 2, 'batch_size': 64, 'network_type': 'RNN', 'num_layers': 1, 'num_neurons': 16, 'learning_rate': 0.01, 'dropout_rate': 0.1}. Best is trial 31 with value: 0.08416931684393632.

1/1 [==============================] - ETA: 0s
1/1 [==============================] - 0s 251ms/step
[I 2024-09-27 23:04:05,756] Trial 100 finished with value: 0.0927697417108636 and parameters: {'window_size': 2, 'batch_size': 64, 'network_type': 'RNN', 'num_layers': 1, 'num_neurons': 128, 'learning_rate': 0.01, 'dropout_rate': 0.1}. Best is trial 31 with value: 0.08416931684393632.

1/1 [==============================] - ETA: 0s
1/1 [==============================] - 0s 234ms/step
[I 2024-09-27 23:04:14,842] Trial 101 finished with value: 0.27087372448569846 and parameters: {'window_size': 2, 'batch_size': 64, 'network_type': 'RNN', 'num_layers': 1, 'num_neurons': 128, 'learning_rate': 0.0001, 'dropout_rate': 0.1}. Best is trial 31 with value: 0.08416931684393632.

1/1 [==============================] - ETA: 0s
1/1 [==============================] - 0s 225ms/step
[I 2024-09-27 23:04:18,757] Trial 102 finished with value: 0.08708366178211414 and parameters: {'window_size': 2, 'batch_size': 64, 'network_type': 'RNN', 'num_layers': 1, 'num_neurons': 128, 'learning_rate': 0.01, 'dropout_rate': 0.1}. Best is trial 31 with value: 0.08416931684393632.

1/1 [==============================] - ETA: 0s
1/1 [==============================] - 0s 263ms/step
[I 2024-09-27 23:04:22,087] Trial 103 finished with value: 0.16245434791163396 and parameters: {'window_size': 2, 'batch_size': 64, 'network_type': 'RNN', 'num_layers': 1, 'num_neurons': 128, 'learning_rate': 0.01, 'dropout_rate': 0.1}. Best is trial 31 with value: 0.08416931684393632.

1/1 [==============================] - ETA: 0s
1/1 [==============================] - 0s 238ms/step
[I 2024-09-27 23:04:25,230] Trial 104 finished with value: 0.2719974474655955 and parameters: {'window_size': 2, 'batch_size': 64, 'network_type': 'RNN', 'num_layers': 1, 'num_neurons': 128, 'learning_rate': 0.01, 'dropout_rate': 0.1}. Best is trial 31 with value: 0.08416931684393632.

1/1 [==============================] - ETA: 0s
1/1 [==============================] - 0s 231ms/step
[I 2024-09-27 23:04:28,668] Trial 105 finished with value: 0.1048827597467523 and parameters: {'window_size': 2, 'batch_size': 64, 'network_type': 'RNN', 'num_layers': 1, 'num_neurons': 64, 'learning_rate': 0.01, 'dropout_rate': 0.1}. Best is trial 31 with value: 0.08416931684393632.

1/1 [==============================] - ETA: 0s
1/1 [==============================] - 0s 300ms/step
[I 2024-09-27 23:04:33,075] Trial 106 finished with value: 0.3625574747085571 and parameters: {'window_size': 6, 'batch_size': 64, 'network_type': 'GRU', 'num_layers': 1, 'num_neurons': 128, 'learning_rate': 0.01, 'dropout_rate': 0.1}. Best is trial 31 with value: 0.08416931684393632.

1/1 [==============================] - ETA: 0s
1/1 [==============================] - 1s 547ms/step
[I 2024-09-27 23:04:40,123] Trial 107 finished with value: 0.22345392719068025 and parameters: {'window_size': 2, 'batch_size': 32, 'network_type': 'RNN', 'num_layers': 3, 'num_neurons': 16, 'learning_rate': 0.01, 'dropout_rate': 0.1}. Best is trial 31 with value: 0.08416931684393632.

1/1 [==============================] - ETA: 0s
1/1 [==============================] - 0s 238ms/step
[I 2024-09-27 23:04:43,504] Trial 108 finished with value: 0.11152028957166171 and parameters: {'window_size': 2, 'batch_size': 64, 'network_type': 'RNN', 'num_layers': 1, 'num_neurons': 128, 'learning_rate': 0.01, 'dropout_rate': 0.3}. Best is trial 31 with value: 0.08416931684393632.

1/1 [==============================] - ETA: 0s
1/1 [==============================] - 0s 300ms/step
[I 2024-09-27 23:04:47,712] Trial 109 finished with value: 0.1299712492290296 and parameters: {'window_size': 2, 'batch_size': 64, 'network_type': 'RNN', 'num_layers': 1, 'num_neurons': 16, 'learning_rate': 0.01, 'dropout_rate': 0.2}. Best is trial 31 with value: 0.08416931684393632.

1/1 [==============================] - ETA: 0s
1/1 [==============================] - 0s 200ms/step
[I 2024-09-27 23:04:51,054] Trial 110 finished with value: 0.10918631905003598 and parameters: {'window_size': 2, 'batch_size': 16, 'network_type': 'RNN', 'num_layers': 1, 'num_neurons': 128, 'learning_rate': 0.01, 'dropout_rate': 0.1}. Best is trial 31 with value: 0.08416931684393632.

1/1 [==============================] - ETA: 0s
1/1 [==============================] - 0s 222ms/step
[I 2024-09-27 23:04:54,359] Trial 111 finished with value: 0.12789342910365056 and parameters: {'window_size': 2, 'batch_size': 64, 'network_type': 'RNN', 'num_layers': 1, 'num_neurons': 128, 'learning_rate': 0.01, 'dropout_rate': 0.1}. Best is trial 31 with value: 0.08416931684393632.

1/1 [==============================] - ETA: 0s
1/1 [==============================] - 0s 207ms/step
[I 2024-09-27 23:04:57,364] Trial 112 finished with value: 0.15355428188725523 and parameters: {'window_size': 2, 'batch_size': 64, 'network_type': 'RNN', 'num_layers': 1, 'num_neurons': 128, 'learning_rate': 0.01, 'dropout_rate': 0.1}. Best is trial 31 with value: 0.08416931684393632.

1/1 [==============================] - ETA: 0s
1/1 [==============================] - 0s 252ms/step
[I 2024-09-27 23:05:01,698] Trial 113 finished with value: 0.09968293210079797 and parameters: {'window_size': 2, 'batch_size': 64, 'network_type': 'RNN', 'num_layers': 1, 'num_neurons': 128, 'learning_rate': 0.01, 'dropout_rate': 0.1}. Best is trial 31 with value: 0.08416931684393632.

1/1 [==============================] - ETA: 0s
1/1 [==============================] - 0s 231ms/step
[I 2024-09-27 23:05:06,126] Trial 114 finished with value: 0.08357412559107731 and parameters: {'window_size': 2, 'batch_size': 64, 'network_type': 'RNN', 'num_layers': 1, 'num_neurons': 128, 'learning_rate': 0.01, 'dropout_rate': 0.1}. Best is trial 114 with value: 0.08357412559107731.

1/1 [==============================] - ETA: 0s
1/1 [==============================] - 0s 369ms/step
[I 2024-09-27 23:05:11,271] Trial 115 finished with value: 0.11347307576631245 and parameters: {'window_size': 2, 'batch_size': 64, 'network_type': 'RNN', 'num_layers': 2, 'num_neurons': 128, 'learning_rate': 0.01, 'dropout_rate': 0.1}. Best is trial 114 with value: 0.08357412559107731.

1/1 [==============================] - ETA: 0s
1/1 [==============================] - 0s 220ms/step
[I 2024-09-27 23:05:14,456] Trial 116 finished with value: 0.14379985086541427 and parameters: {'window_size': 2, 'batch_size': 64, 'network_type': 'RNN', 'num_layers': 1, 'num_neurons': 64, 'learning_rate': 0.01, 'dropout_rate': 0.1}. Best is trial 114 with value: 0.08357412559107731.

1/1 [==============================] - ETA: 0s
1/1 [==============================] - 0s 200ms/step
[I 2024-09-27 23:05:17,699] Trial 117 finished with value: 0.1166660055361296 and parameters: {'window_size': 2, 'batch_size': 64, 'network_type': 'RNN', 'num_layers': 1, 'num_neurons': 16, 'learning_rate': 0.01, 'dropout_rate': 0.1}. Best is trial 114 with value: 0.08357412559107731.

1/1 [==============================] - ETA: 0s
1/1 [==============================] - 0s 317ms/step
[I 2024-09-27 23:05:21,720] Trial 118 finished with value: 1.1939283986372107 and parameters: {'window_size': 4, 'batch_size': 64, 'network_type': 'LSTM', 'num_layers': 1, 'num_neurons': 128, 'learning_rate': 0.01, 'dropout_rate': 0.1}. Best is trial 114 with value: 0.08357412559107731.

1/1 [==============================] - ETA: 0s
1/1 [==============================] - 0s 227ms/step
[I 2024-09-27 23:05:25,168] Trial 119 finished with value: 0.14039857141595138 and parameters: {'window_size': 2, 'batch_size': 64, 'network_type': 'RNN', 'num_layers': 1, 'num_neurons': 32, 'learning_rate': 0.01, 'dropout_rate': 0.1}. Best is trial 114 with value: 0.08357412559107731.

1/1 [==============================] - ETA: 0s
1/1 [==============================] - 0s 228ms/step
[I 2024-09-27 23:05:28,160] Trial 120 finished with value: 0.2265319689449511 and parameters: {'window_size': 2, 'batch_size': 64, 'network_type': 'RNN', 'num_layers': 1, 'num_neurons': 16, 'learning_rate': 0.01, 'dropout_rate': 0.2}. Best is trial 114 with value: 0.08357412559107731.

1/1 [==============================] - ETA: 0s
1/1 [==============================] - 0s 263ms/step
[I 2024-09-27 23:05:36,312] Trial 121 finished with value: 0.2696901487802204 and parameters: {'window_size': 2, 'batch_size': 64, 'network_type': 'RNN', 'num_layers': 1, 'num_neurons': 128, 'learning_rate': 0.0001, 'dropout_rate': 0.1}. Best is trial 114 with value: 0.08357412559107731.

1/1 [==============================] - ETA: 0s
1/1 [==============================] - 0s 351ms/step
[I 2024-09-27 23:05:39,720] Trial 122 finished with value: 0.14692938332808647 and parameters: {'window_size': 2, 'batch_size': 64, 'network_type': 'RNN', 'num_layers': 1, 'num_neurons': 128, 'learning_rate': 0.01, 'dropout_rate': 0.1}. Best is trial 114 with value: 0.08357412559107731.

1/1 [==============================] - ETA: 0s
1/1 [==============================] - 0s 211ms/step
[I 2024-09-27 23:05:43,166] Trial 123 finished with value: 0.22299732855746623 and parameters: {'window_size': 2, 'batch_size': 64, 'network_type': 'RNN', 'num_layers': 1, 'num_neurons': 128, 'learning_rate': 0.01, 'dropout_rate': 0.1}. Best is trial 114 with value: 0.08357412559107731.

1/1 [==============================] - ETA: 0s
1/1 [==============================] - 0s 213ms/step
[I 2024-09-27 23:05:46,285] Trial 124 finished with value: 0.22521374295887195 and parameters: {'window_size': 2, 'batch_size': 64, 'network_type': 'RNN', 'num_layers': 1, 'num_neurons': 128, 'learning_rate': 0.01, 'dropout_rate': 0.1}. Best is trial 114 with value: 0.08357412559107731.

1/1 [==============================] - ETA: 0s
1/1 [==============================] - 0s 238ms/step
[I 2024-09-27 23:05:49,534] Trial 125 finished with value: 0.0859976971776862 and parameters: {'window_size': 2, 'batch_size': 64, 'network_type': 'RNN', 'num_layers': 1, 'num_neurons': 128, 'learning_rate': 0.01, 'dropout_rate': 0.1}. Best is trial 114 with value: 0.08357412559107731.

1/1 [==============================] - ETA: 0s
1/1 [==============================] - 0s 200ms/step
