[I 2024-09-27 23:05:52,525] Trial 126 finished with value: 0.22444921613994398 and parameters: {'window_size': 2, 'batch_size': 64, 'network_type': 'RNN', 'num_layers': 1, 'num_neurons': 128, 'learning_rate': 0.01, 'dropout_rate': 0.1}. Best is trial 114 with value: 0.08357412559107731.

1/1 [==============================] - ETA: 0s
1/1 [==============================] - 0s 255ms/step
[I 2024-09-27 23:05:56,639] Trial 127 finished with value: 0.1916218533264963 and parameters: {'window_size': 2, 'batch_size': 32, 'network_type': 'GRU', 'num_layers': 1, 'num_neurons': 16, 'learning_rate': 0.01, 'dropout_rate': 0.1}. Best is trial 114 with value: 0.08357412559107731.
2024-09-27 23:05:59.961030: W tensorflow/core/grappler/utils/graph_view.cc:849] No registered '' OpKernel for CPU devices compatible with node {{node sequential_1937/simple_rnn_1189/while/body/_1/sequential_1937/simple_rnn_1189/while/simple_rnn_cell/Relu}}
	.  Registered:  <no registered kernels>

2024-09-27 23:05:59.964479: W tensorflow/core/grappler/utils/graph_view.cc:849] No registered '' OpKernel for CPU devices compatible with node {{node sequential_1937/simple_rnn_1190/while/body/_74/sequential_1937/simple_rnn_1190/while/simple_rnn_cell/Relu}}
	.  Registered:  <no registered kernels>

2024-09-27 23:05:59.966084: W tensorflow/core/grappler/utils/graph_view.cc:849] No registered '' OpKernel for CPU devices compatible with node {{node sequential_1937/simple_rnn_1191/while/body/_157/sequential_1937/simple_rnn_1191/while/simple_rnn_cell/Relu}}
	.  Registered:  <no registered kernels>

2024-09-27 23:06:00.085800: E tensorflow/core/grappler/optimizers/tfg_optimizer_hook.cc:135] tfg_optimizer{any(tfg-consolidate-attrs,tfg-toposort,tfg-shape-inference{graph-version=0},tfg-prepare-attrs-export)} failed: INVALID_ARGUMENT: Node sequential_1937/simple_rnn_1191/while/body/_157/sequential_1937/simple_rnn_1191/while/simple_rnn_cell/Relu has an empty op name
	when importing GraphDef to MLIR module in GrapplerHook
2024-09-27 23:06:00.195949: E tensorflow/core/grappler/optimizers/meta_optimizer.cc:961] remapper failed: NOT_FOUND: Op type not registered '' in binary running on DESKTOP-CO9CTFR. Make sure the Op and Kernel are registered in the binary running in this process. Note that if you are loading a saved graph which used ops from tf.contrib (e.g. `tf.contrib.resampler`), accessing should be done before importing the graph, as contrib ops are lazily registered when the module is first accessed.
2024-09-27 23:06:00.225739: E tensorflow/core/grappler/optimizers/tfg_optimizer_hook.cc:135] tfg_optimizer{any(tfg-consolidate-attrs,tfg-functional-to-region,tfg.func(tfg-cf-sink),tfg-region-to-functional{force-control-capture=true},tfg-lift-legacy-call,symbol-privatize{},symbol-dce,tfg-prepare-attrs-export)} failed: INVALID_ARGUMENT: Node sequential_1937/simple_rnn_1189/while/body/_1/sequential_1937/simple_rnn_1189/while/simple_rnn_cell/Relu has an empty op name
	when importing GraphDef to MLIR module in GrapplerHook
2024-09-27 23:06:00.228263: E tensorflow/core/grappler/optimizers/tfg_optimizer_hook.cc:135] tfg_optimizer{any(tfg-consolidate-attrs,tfg-functional-to-region,tfg.func(tfg-cf-sink),tfg-region-to-functional{force-control-capture=true},tfg-lift-legacy-call,symbol-privatize{},symbol-dce,tfg-prepare-attrs-export)} failed: INVALID_ARGUMENT: Node sequential_1937/simple_rnn_1189/while/body/_1/sequential_1937/simple_rnn_1189/while/simple_rnn_cell/Relu has an empty op name
	when importing GraphDef to MLIR module in GrapplerHook
2024-09-27 23:06:00.237464: W tensorflow/core/common_runtime/optimize_function_graph_utils.cc:615] Ignoring multi-device function optimization failure: INVALID_ARGUMENT: Node 'sequential_1937/simple_rnn_1189/while/body/_1/sequential_1937/simple_rnn_1189/while/simple_rnn_cell/Relu' does not specify an operation

1/1 [==============================] - ETA: 0s
1/1 [==============================] - 1s 902ms/step
[I 2024-09-27 23:06:08,492] Trial 128 finished with value: 0.2566490428288778 and parameters: {'window_size': 6, 'batch_size': 64, 'network_type': 'RNN', 'num_layers': 3, 'num_neurons': 64, 'learning_rate': 0.0001, 'dropout_rate': 0.1}. Best is trial 114 with value: 0.08357412559107731.

1/1 [==============================] - ETA: 0s
1/1 [==============================] - 0s 216ms/step
[I 2024-09-27 23:06:13,384] Trial 129 finished with value: 0.09135254644092762 and parameters: {'window_size': 2, 'batch_size': 64, 'network_type': 'RNN', 'num_layers': 1, 'num_neurons': 128, 'learning_rate': 0.01, 'dropout_rate': 0.2}. Best is trial 114 with value: 0.08357412559107731.

1/1 [==============================] - ETA: 0s
1/1 [==============================] - 0s 305ms/step
[I 2024-09-27 23:06:16,500] Trial 130 finished with value: 0.15437357681675962 and parameters: {'window_size': 2, 'batch_size': 64, 'network_type': 'RNN', 'num_layers': 1, 'num_neurons': 128, 'learning_rate': 0.01, 'dropout_rate': 0.3}. Best is trial 114 with value: 0.08357412559107731.

1/1 [==============================] - ETA: 0s
1/1 [==============================] - 0s 203ms/step
[I 2024-09-27 23:06:19,499] Trial 131 finished with value: 0.10796339471716632 and parameters: {'window_size': 2, 'batch_size': 64, 'network_type': 'RNN', 'num_layers': 1, 'num_neurons': 128, 'learning_rate': 0.01, 'dropout_rate': 0.2}. Best is trial 114 with value: 0.08357412559107731.

1/1 [==============================] - ETA: 0s
1/1 [==============================] - 0s 198ms/step
[I 2024-09-27 23:06:22,499] Trial 132 finished with value: 0.11144683782677903 and parameters: {'window_size': 2, 'batch_size': 64, 'network_type': 'RNN', 'num_layers': 1, 'num_neurons': 128, 'learning_rate': 0.01, 'dropout_rate': 0.2}. Best is trial 114 with value: 0.08357412559107731.

1/1 [==============================] - ETA: 0s
1/1 [==============================] - 0s 204ms/step
[I 2024-09-27 23:06:29,503] Trial 133 finished with value: 0.24358374414945902 and parameters: {'window_size': 2, 'batch_size': 64, 'network_type': 'RNN', 'num_layers': 1, 'num_neurons': 128, 'learning_rate': 0.0001, 'dropout_rate': 0.2}. Best is trial 114 with value: 0.08357412559107731.

1/1 [==============================] - ETA: 0s
1/1 [==============================] - 0s 200ms/step
[I 2024-09-27 23:06:32,488] Trial 134 finished with value: 0.17737151452114708 and parameters: {'window_size': 2, 'batch_size': 64, 'network_type': 'RNN', 'num_layers': 1, 'num_neurons': 128, 'learning_rate': 0.01, 'dropout_rate': 0.2}. Best is trial 114 with value: 0.08357412559107731.

1/1 [==============================] - ETA: 0s
1/1 [==============================] - 0s 215ms/step
[I 2024-09-27 23:06:35,722] Trial 135 finished with value: 0.14520051830693295 and parameters: {'window_size': 2, 'batch_size': 64, 'network_type': 'RNN', 'num_layers': 1, 'num_neurons': 16, 'learning_rate': 0.01, 'dropout_rate': 0.2}. Best is trial 114 with value: 0.08357412559107731.

1/1 [==============================] - ETA: 0s
1/1 [==============================] - 0s 204ms/step
[I 2024-09-27 23:06:38,945] Trial 136 finished with value: 0.09179950598666545 and parameters: {'window_size': 2, 'batch_size': 16, 'network_type': 'RNN', 'num_layers': 1, 'num_neurons': 128, 'learning_rate': 0.01, 'dropout_rate': 0.1}. Best is trial 114 with value: 0.08357412559107731.

1/1 [==============================] - ETA: 0s
1/1 [==============================] - 0s 497ms/step
[I 2024-09-27 23:06:44,759] Trial 137 finished with value: 0.13126850103077137 and parameters: {'window_size': 2, 'batch_size': 64, 'network_type': 'RNN', 'num_layers': 2, 'num_neurons': 128, 'learning_rate': 0.01, 'dropout_rate': 0.1}. Best is trial 114 with value: 0.08357412559107731.

1/1 [==============================] - ETA: 0s
1/1 [==============================] - 0s 201ms/step
[I 2024-09-27 23:06:48,914] Trial 138 finished with value: 0.1164872539419877 and parameters: {'window_size': 2, 'batch_size': 64, 'network_type': 'RNN', 'num_layers': 1, 'num_neurons': 16, 'learning_rate': 0.01, 'dropout_rate': 0.2}. Best is trial 114 with value: 0.08357412559107731.

1/1 [==============================] - ETA: 0s
1/1 [==============================] - 0s 254ms/step
[I 2024-09-27 23:06:51,720] Trial 139 finished with value: 0.14926756060750862 and parameters: {'window_size': 2, 'batch_size': 32, 'network_type': 'RNN', 'num_layers': 1, 'num_neurons': 128, 'learning_rate': 0.01, 'dropout_rate': 0.1}. Best is trial 114 with value: 0.08357412559107731.

1/1 [==============================] - ETA: 0s
1/1 [==============================] - 0s 207ms/step
[I 2024-09-27 23:06:54,829] Trial 140 finished with value: 0.10364047095650121 and parameters: {'window_size': 2, 'batch_size': 64, 'network_type': 'RNN', 'num_layers': 1, 'num_neurons': 64, 'learning_rate': 0.01, 'dropout_rate': 0.1}. Best is trial 114 with value: 0.08357412559107731.

1/1 [==============================] - ETA: 0s
1/1 [==============================] - 0s 233ms/step
[I 2024-09-27 23:06:58,750] Trial 141 finished with value: 0.08586524466464394 and parameters: {'window_size': 2, 'batch_size': 16, 'network_type': 'RNN', 'num_layers': 1, 'num_neurons': 128, 'learning_rate': 0.01, 'dropout_rate': 0.1}. Best is trial 114 with value: 0.08357412559107731.

1/1 [==============================] - ETA: 0s
1/1 [==============================] - 0s 184ms/step
[I 2024-09-27 23:07:01,517] Trial 142 finished with value: 0.1308520279934532 and parameters: {'window_size': 2, 'batch_size': 16, 'network_type': 'RNN', 'num_layers': 1, 'num_neurons': 128, 'learning_rate': 0.01, 'dropout_rate': 0.1}. Best is trial 114 with value: 0.08357412559107731.

1/1 [==============================] - ETA: 0s
1/1 [==============================] - 0s 200ms/step
[I 2024-09-27 23:07:04,945] Trial 143 finished with value: 0.1968971875090348 and parameters: {'window_size': 2, 'batch_size': 16, 'network_type': 'RNN', 'num_layers': 1, 'num_neurons': 128, 'learning_rate': 0.01, 'dropout_rate': 0.1}. Best is trial 114 with value: 0.08357412559107731.

1/1 [==============================] - ETA: 0s
1/1 [==============================] - 0s 246ms/step
[I 2024-09-27 23:07:07,752] Trial 144 finished with value: 0.09716065517224766 and parameters: {'window_size': 2, 'batch_size': 16, 'network_type': 'RNN', 'num_layers': 1, 'num_neurons': 128, 'learning_rate': 0.01, 'dropout_rate': 0.1}. Best is trial 114 with value: 0.08357412559107731.

1/1 [==============================] - ETA: 0s
1/1 [==============================] - 0s 200ms/step
[I 2024-09-27 23:07:10,689] Trial 145 finished with value: 0.14722649900536788 and parameters: {'window_size': 2, 'batch_size': 16, 'network_type': 'RNN', 'num_layers': 1, 'num_neurons': 128, 'learning_rate': 0.01, 'dropout_rate': 0.1}. Best is trial 114 with value: 0.08357412559107731.

1/1 [==============================] - ETA: 0s
1/1 [==============================] - 0s 235ms/step
[I 2024-09-27 23:07:14,342] Trial 146 finished with value: 1.4671770641102508 and parameters: {'window_size': 4, 'batch_size': 64, 'network_type': 'LSTM', 'num_layers': 1, 'num_neurons': 128, 'learning_rate': 0.01, 'dropout_rate': 0.1}. Best is trial 114 with value: 0.08357412559107731.

1/1 [==============================] - ETA: 0s
1/1 [==============================] - 0s 232ms/step
[I 2024-09-27 23:07:17,318] Trial 147 finished with value: 0.10756696495256926 and parameters: {'window_size': 2, 'batch_size': 64, 'network_type': 'RNN', 'num_layers': 1, 'num_neurons': 16, 'learning_rate': 0.01, 'dropout_rate': 0.2}. Best is trial 114 with value: 0.08357412559107731.

1/1 [==============================] - ETA: 0s
1/1 [==============================] - 0s 268ms/step
[I 2024-09-27 23:07:21,510] Trial 148 finished with value: 0.19489903590553684 and parameters: {'window_size': 2, 'batch_size': 64, 'network_type': 'RNN', 'num_layers': 1, 'num_neurons': 32, 'learning_rate': 0.01, 'dropout_rate': 0.1}. Best is trial 114 with value: 0.08357412559107731.

1/1 [==============================] - ETA: 0s
1/1 [==============================] - 0s 200ms/step
[I 2024-09-27 23:07:25,155] Trial 149 finished with value: 0.09581021710446008 and parameters: {'window_size': 2, 'batch_size': 16, 'network_type': 'RNN', 'num_layers': 1, 'num_neurons': 128, 'learning_rate': 0.01, 'dropout_rate': 0.1}. Best is trial 114 with value: 0.08357412559107731.
2024-09-27 23:07:26.451967: W tensorflow/core/grappler/utils/graph_view.cc:849] No registered '' OpKernel for CPU devices compatible with node {{node sequential_1959/simple_rnn_1213/while/body/_1/sequential_1959/simple_rnn_1213/while/simple_rnn_cell/Relu}}
	.  Registered:  <no registered kernels>

2024-09-27 23:07:26.488346: E tensorflow/core/grappler/optimizers/tfg_optimizer_hook.cc:135] tfg_optimizer{any(tfg-consolidate-attrs,tfg-toposort,tfg-shape-inference{graph-version=0},tfg-prepare-attrs-export)} failed: INVALID_ARGUMENT: Node sequential_1959/simple_rnn_1213/while/body/_1/sequential_1959/simple_rnn_1213/while/simple_rnn_cell/Relu has an empty op name
	when importing GraphDef to MLIR module in GrapplerHook
2024-09-27 23:07:26.522536: E tensorflow/core/grappler/optimizers/meta_optimizer.cc:961] remapper failed: NOT_FOUND: Op type not registered '' in binary running on DESKTOP-CO9CTFR. Make sure the Op and Kernel are registered in the binary running in this process. Note that if you are loading a saved graph which used ops from tf.contrib (e.g. `tf.contrib.resampler`), accessing should be done before importing the graph, as contrib ops are lazily registered when the module is first accessed.
2024-09-27 23:07:26.529895: E tensorflow/core/grappler/optimizers/tfg_optimizer_hook.cc:135] tfg_optimizer{any(tfg-consolidate-attrs,tfg-functional-to-region,tfg.func(tfg-cf-sink),tfg-region-to-functional{force-control-capture=true},tfg-lift-legacy-call,symbol-privatize{},symbol-dce,tfg-prepare-attrs-export)} failed: INVALID_ARGUMENT: Node sequential_1959/simple_rnn_1213/while/body/_1/sequential_1959/simple_rnn_1213/while/simple_rnn_cell/Relu has an empty op name
	when importing GraphDef to MLIR module in GrapplerHook
2024-09-27 23:07:26.530796: E tensorflow/core/grappler/optimizers/tfg_optimizer_hook.cc:135] tfg_optimizer{any(tfg-consolidate-attrs,tfg-functional-to-region,tfg.func(tfg-cf-sink),tfg-region-to-functional{force-control-capture=true},tfg-lift-legacy-call,symbol-privatize{},symbol-dce,tfg-prepare-attrs-export)} failed: INVALID_ARGUMENT: Node sequential_1959/simple_rnn_1213/while/body/_1/sequential_1959/simple_rnn_1213/while/simple_rnn_cell/Relu has an empty op name
	when importing GraphDef to MLIR module in GrapplerHook
2024-09-27 23:07:26.532541: W tensorflow/core/common_runtime/optimize_function_graph_utils.cc:615] Ignoring multi-device function optimization failure: INVALID_ARGUMENT: Node 'sequential_1959/simple_rnn_1213/while/body/_1/sequential_1959/simple_rnn_1213/while/simple_rnn_cell/Relu' does not specify an operation

1/1 [==============================] - ETA: 0s
1/1 [==============================] - 0s 231ms/step
[I 2024-09-27 23:07:28,346] Trial 150 finished with value: 0.09115730381011965 and parameters: {'window_size': 6, 'batch_size': 64, 'network_type': 'RNN', 'num_layers': 1, 'num_neurons': 16, 'learning_rate': 0.01, 'dropout_rate': 0.1}. Best is trial 114 with value: 0.08357412559107731.

1/1 [==============================] - ETA: 0s
1/1 [==============================] - 0s 185ms/step
[I 2024-09-27 23:07:31,753] Trial 151 finished with value: 0.11917415016575864 and parameters: {'window_size': 2, 'batch_size': 64, 'network_type': 'RNN', 'num_layers': 1, 'num_neurons': 16, 'learning_rate': 0.01, 'dropout_rate': 0.1}. Best is trial 114 with value: 0.08357412559107731.
2024-09-27 23:07:33.054861: W tensorflow/core/grappler/utils/graph_view.cc:849] No registered '' OpKernel for CPU devices compatible with node {{node sequential_1961/simple_rnn_1215/while/body/_1/sequential_1961/simple_rnn_1215/while/simple_rnn_cell/Relu}}
	.  Registered:  <no registered kernels>

2024-09-27 23:07:33.090094: E tensorflow/core/grappler/optimizers/tfg_optimizer_hook.cc:135] tfg_optimizer{any(tfg-consolidate-attrs,tfg-toposort,tfg-shape-inference{graph-version=0},tfg-prepare-attrs-export)} failed: INVALID_ARGUMENT: Node sequential_1961/simple_rnn_1215/while/body/_1/sequential_1961/simple_rnn_1215/while/simple_rnn_cell/Relu has an empty op name
	when importing GraphDef to MLIR module in GrapplerHook
2024-09-27 23:07:33.128837: E tensorflow/core/grappler/optimizers/tfg_optimizer_hook.cc:135] tfg_optimizer{any(tfg-consolidate-attrs,tfg-functional-to-region,tfg.func(tfg-cf-sink),tfg-region-to-functional{force-control-capture=true},tfg-lift-legacy-call,symbol-privatize{},symbol-dce,tfg-prepare-attrs-export)} failed: INVALID_ARGUMENT: Node sequential_1961/simple_rnn_1215/while/body/_1/sequential_1961/simple_rnn_1215/while/simple_rnn_cell/Relu has an empty op name
	when importing GraphDef to MLIR module in GrapplerHook
2024-09-27 23:07:33.129747: E tensorflow/core/grappler/optimizers/tfg_optimizer_hook.cc:135] tfg_optimizer{any(tfg-consolidate-attrs,tfg-functional-to-region,tfg.func(tfg-cf-sink),tfg-region-to-functional{force-control-capture=true},tfg-lift-legacy-call,symbol-privatize{},symbol-dce,tfg-prepare-attrs-export)} failed: INVALID_ARGUMENT: Node sequential_1961/simple_rnn_1215/while/body/_1/sequential_1961/simple_rnn_1215/while/simple_rnn_cell/Relu has an empty op name
	when importing GraphDef to MLIR module in GrapplerHook
2024-09-27 23:07:33.131478: W tensorflow/core/common_runtime/optimize_function_graph_utils.cc:615] Ignoring multi-device function optimization failure: INVALID_ARGUMENT: Node 'sequential_1961/simple_rnn_1215/while/body/_1/sequential_1961/simple_rnn_1215/while/simple_rnn_cell/Relu' does not specify an operation

1/1 [==============================] - ETA: 0s
1/1 [==============================] - 0s 210ms/step
[I 2024-09-27 23:07:34,818] Trial 152 finished with value: 0.11454148241678873 and parameters: {'window_size': 6, 'batch_size': 64, 'network_type': 'RNN', 'num_layers': 1, 'num_neurons': 16, 'learning_rate': 0.01, 'dropout_rate': 0.1}. Best is trial 114 with value: 0.08357412559107731.
2024-09-27 23:07:36.129979: W tensorflow/core/grappler/utils/graph_view.cc:849] No registered '' OpKernel for CPU devices compatible with node {{node sequential_1962/simple_rnn_1216/while/body/_1/sequential_1962/simple_rnn_1216/while/simple_rnn_cell/Relu}}
	.  Registered:  <no registered kernels>

2024-09-27 23:07:36.165268: E tensorflow/core/grappler/optimizers/tfg_optimizer_hook.cc:135] tfg_optimizer{any(tfg-consolidate-attrs,tfg-toposort,tfg-shape-inference{graph-version=0},tfg-prepare-attrs-export)} failed: INVALID_ARGUMENT: Node sequential_1962/simple_rnn_1216/while/body/_1/sequential_1962/simple_rnn_1216/while/simple_rnn_cell/Relu has an empty op name
	when importing GraphDef to MLIR module in GrapplerHook
2024-09-27 23:07:36.204515: E tensorflow/core/grappler/optimizers/tfg_optimizer_hook.cc:135] tfg_optimizer{any(tfg-consolidate-attrs,tfg-functional-to-region,tfg.func(tfg-cf-sink),tfg-region-to-functional{force-control-capture=true},tfg-lift-legacy-call,symbol-privatize{},symbol-dce,tfg-prepare-attrs-export)} failed: INVALID_ARGUMENT: Node sequential_1962/simple_rnn_1216/while/body/_1/sequential_1962/simple_rnn_1216/while/simple_rnn_cell/Relu has an empty op name
	when importing GraphDef to MLIR module in GrapplerHook
2024-09-27 23:07:36.205461: E tensorflow/core/grappler/optimizers/tfg_optimizer_hook.cc:135] tfg_optimizer{any(tfg-consolidate-attrs,tfg-functional-to-region,tfg.func(tfg-cf-sink),tfg-region-to-functional{force-control-capture=true},tfg-lift-legacy-call,symbol-privatize{},symbol-dce,tfg-prepare-attrs-export)} failed: INVALID_ARGUMENT: Node sequential_1962/simple_rnn_1216/while/body/_1/sequential_1962/simple_rnn_1216/while/simple_rnn_cell/Relu has an empty op name
	when importing GraphDef to MLIR module in GrapplerHook
2024-09-27 23:07:36.207299: W tensorflow/core/common_runtime/optimize_function_graph_utils.cc:615] Ignoring multi-device function optimization failure: INVALID_ARGUMENT: Node 'sequential_1962/simple_rnn_1216/while/body/_1/sequential_1962/simple_rnn_1216/while/simple_rnn_cell/Relu' does not specify an operation

1/1 [==============================] - ETA: 0s
1/1 [==============================] - 0s 217ms/step
[I 2024-09-27 23:07:37,751] Trial 153 finished with value: 0.20096732940673828 and parameters: {'window_size': 6, 'batch_size': 64, 'network_type': 'RNN', 'num_layers': 1, 'num_neurons': 16, 'learning_rate': 0.01, 'dropout_rate': 0.1}. Best is trial 114 with value: 0.08357412559107731.

1/1 [==============================] - ETA: 0s
1/1 [==============================] - 0s 202ms/step
