[I 2024-09-27 19:36:01,759] Trial 14 finished with value: 0.015103404845764388 and parameters: {'window_size': 6, 'batch_size': 16, 'network_type': 'LSTM', 'num_layers': 2, 'num_neurons': 64, 'learning_rate': 0.01, 'dropout_rate': 0.3}. Best is trial 8 with value: 0.010007058838723413.

1/3 [=========>....................] - ETA: 2s
3/3 [==============================] - 1s 16ms/step
[I 2024-09-27 19:36:19,398] Trial 15 finished with value: 0.010900582592252276 and parameters: {'window_size': 2, 'batch_size': 32, 'network_type': 'RNN', 'num_layers': 2, 'num_neurons': 64, 'learning_rate': 0.01, 'dropout_rate': 0.3}. Best is trial 8 with value: 0.010007058838723413.

1/3 [=========>....................] - ETA: 2s
3/3 [==============================] - 1s 12ms/step
[I 2024-09-27 19:36:54,406] Trial 16 finished with value: 0.014610167805828264 and parameters: {'window_size': 6, 'batch_size': 16, 'network_type': 'LSTM', 'num_layers': 2, 'num_neurons': 64, 'learning_rate': 0.01, 'dropout_rate': 0.3}. Best is trial 8 with value: 0.010007058838723413.

1/3 [=========>....................] - ETA: 0s
3/3 [==============================] - 0s 2ms/step
[I 2024-09-27 19:37:06,519] Trial 17 finished with value: 0.011300365625922357 and parameters: {'window_size': 6, 'batch_size': 16, 'network_type': 'LSTM', 'num_layers': 1, 'num_neurons': 16, 'learning_rate': 0.01, 'dropout_rate': 0.1}. Best is trial 8 with value: 0.010007058838723413.

1/3 [=========>....................] - ETA: 1s
3/3 [==============================] - 1s 6ms/step
[I 2024-09-27 19:37:16,593] Trial 18 finished with value: 0.011166651843299328 and parameters: {'window_size': 2, 'batch_size': 32, 'network_type': 'RNN', 'num_layers': 2, 'num_neurons': 32, 'learning_rate': 0.01, 'dropout_rate': 0.3}. Best is trial 8 with value: 0.010007058838723413.

1/3 [=========>....................] - ETA: 1s
3/3 [==============================] - 1s 14ms/step
[I 2024-09-27 19:37:31,418] Trial 19 finished with value: 0.011699118424152982 and parameters: {'window_size': 4, 'batch_size': 64, 'network_type': 'GRU', 'num_layers': 2, 'num_neurons': 64, 'learning_rate': 0.01, 'dropout_rate': 0.3}. Best is trial 8 with value: 0.010007058838723413.

1/3 [=========>....................] - ETA: 0s
3/3 [==============================] - 1s 8ms/step
[I 2024-09-27 19:37:40,340] Trial 20 finished with value: 0.010181810749110893 and parameters: {'window_size': 6, 'batch_size': 16, 'network_type': 'RNN', 'num_layers': 1, 'num_neurons': 64, 'learning_rate': 0.01, 'dropout_rate': 0.1}. Best is trial 8 with value: 0.010007058838723413.

1/3 [=========>....................] - ETA: 0s
3/3 [==============================] - 0s 0s/step
[I 2024-09-27 19:37:47,625] Trial 21 finished with value: 0.010383634830588727 and parameters: {'window_size': 6, 'batch_size': 16, 'network_type': 'RNN', 'num_layers': 1, 'num_neurons': 64, 'learning_rate': 0.01, 'dropout_rate': 0.1}. Best is trial 8 with value: 0.010007058838723413.

1/3 [=========>....................] - ETA: 0s
3/3 [==============================] - 0s 0s/step
[I 2024-09-27 19:37:55,259] Trial 22 finished with value: 0.01000809831049905 and parameters: {'window_size': 6, 'batch_size': 16, 'network_type': 'RNN', 'num_layers': 1, 'num_neurons': 64, 'learning_rate': 0.01, 'dropout_rate': 0.1}. Best is trial 8 with value: 0.010007058838723413.

1/3 [=========>....................] - ETA: 0s
3/3 [==============================] - 0s 3ms/step
[I 2024-09-27 19:38:03,433] Trial 23 finished with value: 0.009660403248089464 and parameters: {'window_size': 6, 'batch_size': 16, 'network_type': 'RNN', 'num_layers': 1, 'num_neurons': 64, 'learning_rate': 0.01, 'dropout_rate': 0.1}. Best is trial 23 with value: 0.009660403248089464.

1/3 [=========>....................] - ETA: 0s
3/3 [==============================] - 0s 0s/step
[I 2024-09-27 19:38:14,485] Trial 24 finished with value: 0.00997360078256522 and parameters: {'window_size': 6, 'batch_size': 16, 'network_type': 'RNN', 'num_layers': 1, 'num_neurons': 64, 'learning_rate': 0.01, 'dropout_rate': 0.1}. Best is trial 23 with value: 0.009660403248089464.

1/3 [=========>....................] - ETA: 0s
3/3 [==============================] - 1s 8ms/step
[I 2024-09-27 19:38:24,137] Trial 25 finished with value: 0.009595602502285598 and parameters: {'window_size': 2, 'batch_size': 16, 'network_type': 'LSTM', 'num_layers': 1, 'num_neurons': 64, 'learning_rate': 0.01, 'dropout_rate': 0.1}. Best is trial 25 with value: 0.009595602502285598.

1/3 [=========>....................] - ETA: 1s
3/3 [==============================] - 1s 8ms/step
[I 2024-09-27 19:38:33,234] Trial 26 finished with value: 0.010661215557980894 and parameters: {'window_size': 6, 'batch_size': 16, 'network_type': 'RNN', 'num_layers': 1, 'num_neurons': 16, 'learning_rate': 0.01, 'dropout_rate': 0.1}. Best is trial 25 with value: 0.009595602502285598.

1/3 [=========>....................] - ETA: 0s
3/3 [==============================] - 0s 11ms/step
[I 2024-09-27 19:38:40,297] Trial 27 finished with value: 0.010340605152187063 and parameters: {'window_size': 6, 'batch_size': 16, 'network_type': 'RNN', 'num_layers': 1, 'num_neurons': 32, 'learning_rate': 0.01, 'dropout_rate': 0.1}. Best is trial 25 with value: 0.009595602502285598.

1/3 [=========>....................] - ETA: 0s
3/3 [==============================] - 0s 8ms/step
[I 2024-09-27 19:38:48,999] Trial 28 finished with value: 0.011694741926331449 and parameters: {'window_size': 4, 'batch_size': 64, 'network_type': 'GRU', 'num_layers': 1, 'num_neurons': 128, 'learning_rate': 0.01, 'dropout_rate': 0.1}. Best is trial 25 with value: 0.009595602502285598.

1/3 [=========>....................] - ETA: 0s
3/3 [==============================] - 0s 0s/step
[I 2024-09-27 19:38:54,411] Trial 29 finished with value: 0.009802128862327255 and parameters: {'window_size': 2, 'batch_size': 32, 'network_type': 'LSTM', 'num_layers': 1, 'num_neurons': 64, 'learning_rate': 0.01, 'dropout_rate': 0.1}. Best is trial 25 with value: 0.009595602502285598.

1/3 [=========>....................] - ETA: 0s
3/3 [==============================] - 0s 0s/step
[I 2024-09-27 19:39:00,326] Trial 30 finished with value: 0.009668415005777925 and parameters: {'window_size': 2, 'batch_size': 32, 'network_type': 'LSTM', 'num_layers': 1, 'num_neurons': 64, 'learning_rate': 0.01, 'dropout_rate': 0.1}. Best is trial 25 with value: 0.009595602502285598.

1/3 [=========>....................] - ETA: 0s
3/3 [==============================] - 0s 8ms/step
[I 2024-09-27 19:39:05,182] Trial 31 finished with value: 0.010360294637545736 and parameters: {'window_size': 2, 'batch_size': 32, 'network_type': 'LSTM', 'num_layers': 1, 'num_neurons': 64, 'learning_rate': 0.01, 'dropout_rate': 0.1}. Best is trial 25 with value: 0.009595602502285598.

1/3 [=========>....................] - ETA: 0s
3/3 [==============================] - 0s 8ms/step
[I 2024-09-27 19:39:10,244] Trial 32 finished with value: 0.009488021994980292 and parameters: {'window_size': 2, 'batch_size': 32, 'network_type': 'LSTM', 'num_layers': 1, 'num_neurons': 64, 'learning_rate': 0.01, 'dropout_rate': 0.1}. Best is trial 32 with value: 0.009488021994980292.

1/3 [=========>....................] - ETA: 0s
3/3 [==============================] - 0s 7ms/step
[I 2024-09-27 19:39:15,166] Trial 33 finished with value: 0.009965375406641358 and parameters: {'window_size': 2, 'batch_size': 32, 'network_type': 'LSTM', 'num_layers': 1, 'num_neurons': 64, 'learning_rate': 0.01, 'dropout_rate': 0.1}. Best is trial 32 with value: 0.009488021994980292.

1/3 [=========>....................] - ETA: 0s
3/3 [==============================] - 0s 0s/step
[I 2024-09-27 19:39:21,461] Trial 34 finished with value: 0.009617796478137168 and parameters: {'window_size': 2, 'batch_size': 32, 'network_type': 'LSTM', 'num_layers': 1, 'num_neurons': 64, 'learning_rate': 0.01, 'dropout_rate': 0.1}. Best is trial 32 with value: 0.009488021994980292.

1/3 [=========>....................] - ETA: 0s
3/3 [==============================] - 0s 0s/step
[I 2024-09-27 19:39:27,748] Trial 35 finished with value: 0.00961067196684824 and parameters: {'window_size': 2, 'batch_size': 32, 'network_type': 'LSTM', 'num_layers': 1, 'num_neurons': 128, 'learning_rate': 0.01, 'dropout_rate': 0.1}. Best is trial 32 with value: 0.009488021994980292.

1/3 [=========>....................] - ETA: 0s
3/3 [==============================] - 0s 8ms/step
[I 2024-09-27 19:39:34,233] Trial 36 finished with value: 0.009723092193334877 and parameters: {'window_size': 2, 'batch_size': 32, 'network_type': 'LSTM', 'num_layers': 1, 'num_neurons': 128, 'learning_rate': 0.01, 'dropout_rate': 0.1}. Best is trial 32 with value: 0.009488021994980292.

1/3 [=========>....................] - ETA: 0s
3/3 [==============================] - 0s 5ms/step
[I 2024-09-27 19:40:07,980] Trial 37 finished with value: 0.00955378468943314 and parameters: {'window_size': 2, 'batch_size': 32, 'network_type': 'LSTM', 'num_layers': 1, 'num_neurons': 128, 'learning_rate': 0.01, 'dropout_rate': 0.1}. Best is trial 32 with value: 0.009488021994980292.

1/3 [=========>....................] - ETA: 1s
3/3 [==============================] - 1s 5ms/step
[I 2024-09-27 19:40:19,140] Trial 38 finished with value: 0.012544331328969604 and parameters: {'window_size': 2, 'batch_size': 32, 'network_type': 'LSTM', 'num_layers': 3, 'num_neurons': 128, 'learning_rate': 0.01, 'dropout_rate': 0.2}. Best is trial 32 with value: 0.009488021994980292.

1/3 [=========>....................] - ETA: 0s
3/3 [==============================] - 0s 0s/step
[I 2024-09-27 19:40:23,753] Trial 39 finished with value: 0.009928036719980373 and parameters: {'window_size': 2, 'batch_size': 32, 'network_type': 'LSTM', 'num_layers': 1, 'num_neurons': 128, 'learning_rate': 0.01, 'dropout_rate': 0.1}. Best is trial 32 with value: 0.009488021994980292.

1/3 [=========>....................] - ETA: 0s
3/3 [==============================] - 0s 5ms/step
[I 2024-09-27 19:40:30,554] Trial 40 finished with value: 0.009861877495134381 and parameters: {'window_size': 2, 'batch_size': 32, 'network_type': 'LSTM', 'num_layers': 1, 'num_neurons': 128, 'learning_rate': 0.01, 'dropout_rate': 0.1}. Best is trial 32 with value: 0.009488021994980292.

1/3 [=========>....................] - ETA: 0s
3/3 [==============================] - 0s 6ms/step
[I 2024-09-27 19:40:35,269] Trial 41 finished with value: 0.0097911761075678 and parameters: {'window_size': 2, 'batch_size': 32, 'network_type': 'LSTM', 'num_layers': 1, 'num_neurons': 128, 'learning_rate': 0.01, 'dropout_rate': 0.1}. Best is trial 32 with value: 0.009488021994980292.

1/3 [=========>....................] - ETA: 0s
3/3 [==============================] - 0s 5ms/step
[I 2024-09-27 19:40:42,863] Trial 42 finished with value: 0.009478084547418948 and parameters: {'window_size': 2, 'batch_size': 32, 'network_type': 'LSTM', 'num_layers': 1, 'num_neurons': 128, 'learning_rate': 0.01, 'dropout_rate': 0.1}. Best is trial 42 with value: 0.009478084547418948.

1/3 [=========>....................] - ETA: 0s
3/3 [==============================] - 0s 6ms/step
[I 2024-09-27 19:40:52,764] Trial 43 finished with value: 0.009886155403835677 and parameters: {'window_size': 2, 'batch_size': 32, 'network_type': 'LSTM', 'num_layers': 1, 'num_neurons': 128, 'learning_rate': 0.01, 'dropout_rate': 0.2}. Best is trial 42 with value: 0.009478084547418948.

1/3 [=========>....................] - ETA: 1s
3/3 [==============================] - 1s 13ms/step
[I 2024-09-27 19:41:03,617] Trial 44 finished with value: 0.015027400977174999 and parameters: {'window_size': 2, 'batch_size': 32, 'network_type': 'LSTM', 'num_layers': 3, 'num_neurons': 128, 'learning_rate': 0.01, 'dropout_rate': 0.1}. Best is trial 42 with value: 0.009478084547418948.

1/3 [=========>....................] - ETA: 0s
3/3 [==============================] - 0s 7ms/step
[I 2024-09-27 19:41:07,307] Trial 45 finished with value: 0.011184531141334856 and parameters: {'window_size': 2, 'batch_size': 64, 'network_type': 'LSTM', 'num_layers': 1, 'num_neurons': 128, 'learning_rate': 0.01, 'dropout_rate': 0.1}. Best is trial 42 with value: 0.009478084547418948.

1/3 [=========>....................] - ETA: 0s
3/3 [==============================] - 0s 0s/step
[I 2024-09-27 19:41:13,188] Trial 46 finished with value: 0.009520423476125157 and parameters: {'window_size': 2, 'batch_size': 32, 'network_type': 'LSTM', 'num_layers': 1, 'num_neurons': 128, 'learning_rate': 0.01, 'dropout_rate': 0.1}. Best is trial 42 with value: 0.009478084547418948.

1/3 [=========>....................] - ETA: 0s
3/3 [==============================] - 0s 8ms/step
[I 2024-09-27 19:41:19,160] Trial 47 finished with value: 0.010016007819645841 and parameters: {'window_size': 2, 'batch_size': 32, 'network_type': 'GRU', 'num_layers': 1, 'num_neurons': 128, 'learning_rate': 0.01, 'dropout_rate': 0.2}. Best is trial 42 with value: 0.009478084547418948.

1/3 [=========>....................] - ETA: 1s
3/3 [==============================] - 1s 8ms/step
[I 2024-09-27 19:41:28,864] Trial 48 finished with value: 0.014905767268028813 and parameters: {'window_size': 4, 'batch_size': 32, 'network_type': 'LSTM', 'num_layers': 3, 'num_neurons': 16, 'learning_rate': 0.01, 'dropout_rate': 0.1}. Best is trial 42 with value: 0.009478084547418948.

1/3 [=========>....................] - ETA: 0s
3/3 [==============================] - 0s 8ms/step
[I 2024-09-27 19:41:35,063] Trial 49 finished with value: 0.009730846042364417 and parameters: {'window_size': 2, 'batch_size': 64, 'network_type': 'LSTM', 'num_layers': 1, 'num_neurons': 128, 'learning_rate': 0.01, 'dropout_rate': 0.1}. Best is trial 42 with value: 0.009478084547418948.

1/3 [=========>....................] - ETA: 0s
3/3 [==============================] - 0s 8ms/step
[I 2024-09-27 19:41:40,031] Trial 50 finished with value: 0.010147103235755168 and parameters: {'window_size': 2, 'batch_size': 32, 'network_type': 'LSTM', 'num_layers': 1, 'num_neurons': 32, 'learning_rate': 0.01, 'dropout_rate': 0.1}. Best is trial 42 with value: 0.009478084547418948.

1/3 [=========>....................] - ETA: 0s
3/3 [==============================] - 0s 8ms/step
[I 2024-09-27 19:41:45,277] Trial 51 finished with value: 0.009862847126705546 and parameters: {'window_size': 2, 'batch_size': 32, 'network_type': 'LSTM', 'num_layers': 1, 'num_neurons': 128, 'learning_rate': 0.01, 'dropout_rate': 0.1}. Best is trial 42 with value: 0.009478084547418948.

1/3 [=========>....................] - ETA: 0s
3/3 [==============================] - 0s 0s/step
[I 2024-09-27 19:41:49,737] Trial 52 finished with value: 0.00973216234462362 and parameters: {'window_size': 2, 'batch_size': 32, 'network_type': 'LSTM', 'num_layers': 1, 'num_neurons': 128, 'learning_rate': 0.01, 'dropout_rate': 0.1}. Best is trial 42 with value: 0.009478084547418948.

1/3 [=========>....................] - ETA: 0s
3/3 [==============================] - 0s 8ms/step
[I 2024-09-27 19:41:54,984] Trial 53 finished with value: 0.009849174143562857 and parameters: {'window_size': 2, 'batch_size': 32, 'network_type': 'LSTM', 'num_layers': 1, 'num_neurons': 128, 'learning_rate': 0.01, 'dropout_rate': 0.1}. Best is trial 42 with value: 0.009478084547418948.

1/3 [=========>....................] - ETA: 0s
3/3 [==============================] - 0s 0s/step
[I 2024-09-27 19:42:02,031] Trial 54 finished with value: 0.009491385617726287 and parameters: {'window_size': 2, 'batch_size': 32, 'network_type': 'LSTM', 'num_layers': 1, 'num_neurons': 128, 'learning_rate': 0.01, 'dropout_rate': 0.1}. Best is trial 42 with value: 0.009478084547418948.

1/3 [=========>....................] - ETA: 0s
3/3 [==============================] - 0s 0s/step
[I 2024-09-27 19:42:08,751] Trial 55 finished with value: 0.009531613937565981 and parameters: {'window_size': 2, 'batch_size': 32, 'network_type': 'LSTM', 'num_layers': 1, 'num_neurons': 128, 'learning_rate': 0.01, 'dropout_rate': 0.1}. Best is trial 42 with value: 0.009478084547418948.

1/3 [=========>....................] - ETA: 1s
3/3 [==============================] - 1s 11ms/step
[I 2024-09-27 19:42:23,473] Trial 56 finished with value: 0.015701823922171107 and parameters: {'window_size': 4, 'batch_size': 32, 'network_type': 'GRU', 'num_layers': 3, 'num_neurons': 128, 'learning_rate': 0.01, 'dropout_rate': 0.2}. Best is trial 42 with value: 0.009478084547418948.

1/3 [=========>....................] - ETA: 0s
3/3 [==============================] - 0s 8ms/step
[I 2024-09-27 19:42:29,301] Trial 57 finished with value: 0.009581996702812089 and parameters: {'window_size': 2, 'batch_size': 32, 'network_type': 'LSTM', 'num_layers': 1, 'num_neurons': 128, 'learning_rate': 0.01, 'dropout_rate': 0.1}. Best is trial 42 with value: 0.009478084547418948.

1/3 [=========>....................] - ETA: 0s
3/3 [==============================] - 0s 4ms/step
[I 2024-09-27 19:42:34,483] Trial 58 finished with value: 0.009890714356597042 and parameters: {'window_size': 2, 'batch_size': 32, 'network_type': 'LSTM', 'num_layers': 1, 'num_neurons': 128, 'learning_rate': 0.01, 'dropout_rate': 0.1}. Best is trial 42 with value: 0.009478084547418948.

1/3 [=========>....................] - ETA: 0s
3/3 [==============================] - 0s 0s/step
[I 2024-09-27 19:42:39,714] Trial 59 finished with value: 0.009560205738309407 and parameters: {'window_size': 2, 'batch_size': 32, 'network_type': 'LSTM', 'num_layers': 1, 'num_neurons': 128, 'learning_rate': 0.01, 'dropout_rate': 0.1}. Best is trial 42 with value: 0.009478084547418948.

1/3 [=========>....................] - ETA: 0s
3/3 [==============================] - 0s 0s/step
[I 2024-09-27 19:42:43,908] Trial 60 finished with value: 0.01314701745879482 and parameters: {'window_size': 2, 'batch_size': 32, 'network_type': 'LSTM', 'num_layers': 1, 'num_neurons': 16, 'learning_rate': 0.01, 'dropout_rate': 0.3}. Best is trial 42 with value: 0.009478084547418948.

1/3 [=========>....................] - ETA: 0s
3/3 [==============================] - 0s 0s/step
[I 2024-09-27 19:42:49,779] Trial 61 finished with value: 0.00945127295104551 and parameters: {'window_size': 2, 'batch_size': 32, 'network_type': 'LSTM', 'num_layers': 1, 'num_neurons': 128, 'learning_rate': 0.01, 'dropout_rate': 0.1}. Best is trial 61 with value: 0.00945127295104551.

1/3 [=========>....................] - ETA: 0s
3/3 [==============================] - 0s 5ms/step
[I 2024-09-27 19:42:55,638] Trial 62 finished with value: 0.009680441789224116 and parameters: {'window_size': 2, 'batch_size': 32, 'network_type': 'LSTM', 'num_layers': 1, 'num_neurons': 128, 'learning_rate': 0.01, 'dropout_rate': 0.1}. Best is trial 61 with value: 0.00945127295104551.

1/3 [=========>....................] - ETA: 0s
3/3 [==============================] - 0s 5ms/step
[I 2024-09-27 19:43:02,231] Trial 63 finished with value: 0.009812889764006712 and parameters: {'window_size': 2, 'batch_size': 32, 'network_type': 'LSTM', 'num_layers': 1, 'num_neurons': 128, 'learning_rate': 0.01, 'dropout_rate': 0.1}. Best is trial 61 with value: 0.00945127295104551.

1/3 [=========>....................] - ETA: 0s
3/3 [==============================] - 0s 5ms/step
[I 2024-09-27 19:43:06,495] Trial 64 finished with value: 0.013952971717001685 and parameters: {'window_size': 2, 'batch_size': 32, 'network_type': 'LSTM', 'num_layers': 1, 'num_neurons': 128, 'learning_rate': 0.01, 'dropout_rate': 0.1}. Best is trial 61 with value: 0.00945127295104551.

1/3 [=========>....................] - ETA: 0s
3/3 [==============================] - 0s 8ms/step
[I 2024-09-27 19:43:15,923] Trial 65 finished with value: 0.010463840639087516 and parameters: {'window_size': 2, 'batch_size': 32, 'network_type': 'LSTM', 'num_layers': 2, 'num_neurons': 32, 'learning_rate': 0.01, 'dropout_rate': 0.1}. Best is trial 61 with value: 0.00945127295104551.

1/3 [=========>....................] - ETA: 0s
3/3 [==============================] - 0s 0s/step
[I 2024-09-27 19:43:22,503] Trial 66 finished with value: 0.010575681268305019 and parameters: {'window_size': 4, 'batch_size': 64, 'network_type': 'GRU', 'num_layers': 1, 'num_neurons': 128, 'learning_rate': 0.01, 'dropout_rate': 0.1}. Best is trial 61 with value: 0.00945127295104551.

1/3 [=========>....................] - ETA: 0s
3/3 [==============================] - 0s 0s/step
[I 2024-09-27 19:43:30,172] Trial 67 finished with value: 0.009445951347619719 and parameters: {'window_size': 2, 'batch_size': 32, 'network_type': 'LSTM', 'num_layers': 1, 'num_neurons': 128, 'learning_rate': 0.01, 'dropout_rate': 0.1}. Best is trial 67 with value: 0.009445951347619719.

1/3 [=========>....................] - ETA: 0s
3/3 [==============================] - 0s 8ms/step
[I 2024-09-27 19:43:38,093] Trial 68 finished with value: 0.009860427675112872 and parameters: {'window_size': 2, 'batch_size': 32, 'network_type': 'LSTM', 'num_layers': 1, 'num_neurons': 128, 'learning_rate': 0.01, 'dropout_rate': 0.1}. Best is trial 67 with value: 0.009445951347619719.

1/3 [=========>....................] - ETA: 0s
3/3 [==============================] - 0s 0s/step
[I 2024-09-27 19:43:41,904] Trial 69 finished with value: 0.011858239502973959 and parameters: {'window_size': 2, 'batch_size': 32, 'network_type': 'LSTM', 'num_layers': 1, 'num_neurons': 16, 'learning_rate': 0.01, 'dropout_rate': 0.3}. Best is trial 67 with value: 0.009445951347619719.

1/3 [=========>....................] - ETA: 0s
3/3 [==============================] - 0s 8ms/step
