[I 2024-09-27 19:20:54,390] Trial 104 finished with value: 0.021300851305325826 and parameters: {'window_size': 2, 'batch_size': 16, 'network_type': 'RNN', 'num_layers': 1, 'num_neurons': 16, 'learning_rate': 0.01, 'dropout_rate': 0.2}. Best is trial 57 with value: 0.013169454112648965.

1/2 [==============>...............] - ETA: 0s
2/2 [==============================] - 0s 0s/step
[I 2024-09-27 19:20:57,800] Trial 105 finished with value: 0.017285791844129563 and parameters: {'window_size': 2, 'batch_size': 16, 'network_type': 'RNN', 'num_layers': 1, 'num_neurons': 16, 'learning_rate': 0.01, 'dropout_rate': 0.2}. Best is trial 57 with value: 0.013169454112648965.

1/2 [==============>...............] - ETA: 0s
2/2 [==============================] - 0s 16ms/step
[I 2024-09-27 19:21:02,590] Trial 106 finished with value: 0.020404489973317022 and parameters: {'window_size': 4, 'batch_size': 32, 'network_type': 'LSTM', 'num_layers': 1, 'num_neurons': 128, 'learning_rate': 0.01, 'dropout_rate': 0.1}. Best is trial 57 with value: 0.013169454112648965.

1/2 [==============>...............] - ETA: 0s
2/2 [==============================] - 0s 0s/step
[I 2024-09-27 19:21:06,710] Trial 107 finished with value: 0.01525360208253066 and parameters: {'window_size': 2, 'batch_size': 16, 'network_type': 'LSTM', 'num_layers': 1, 'num_neurons': 32, 'learning_rate': 0.01, 'dropout_rate': 0.2}. Best is trial 57 with value: 0.013169454112648965.

1/2 [==============>...............] - ETA: 0s
2/2 [==============================] - 1s 6ms/step
[I 2024-09-27 19:21:13,920] Trial 108 finished with value: 0.01810904374718666 and parameters: {'window_size': 2, 'batch_size': 16, 'network_type': 'GRU', 'num_layers': 1, 'num_neurons': 128, 'learning_rate': 0.01, 'dropout_rate': 0.2}. Best is trial 57 with value: 0.013169454112648965.

1/2 [==============>...............] - ETA: 0s
2/2 [==============================] - 0s 0s/step
[I 2024-09-27 19:21:19,025] Trial 109 finished with value: 0.022360080828269322 and parameters: {'window_size': 2, 'batch_size': 16, 'network_type': 'RNN', 'num_layers': 1, 'num_neurons': 16, 'learning_rate': 0.01, 'dropout_rate': 0.2}. Best is trial 57 with value: 0.013169454112648965.

1/2 [==============>...............] - ETA: 0s
2/2 [==============================] - 0s 16ms/step
[I 2024-09-27 19:21:23,626] Trial 110 finished with value: 0.02398084725936254 and parameters: {'window_size': 2, 'batch_size': 64, 'network_type': 'LSTM', 'num_layers': 1, 'num_neurons': 128, 'learning_rate': 0.01, 'dropout_rate': 0.2}. Best is trial 57 with value: 0.013169454112648965.

1/2 [==============>...............] - ETA: 0s
2/2 [==============================] - 0s 16ms/step
[I 2024-09-27 19:21:28,025] Trial 111 finished with value: 0.019419032543897628 and parameters: {'window_size': 2, 'batch_size': 16, 'network_type': 'RNN', 'num_layers': 1, 'num_neurons': 16, 'learning_rate': 0.01, 'dropout_rate': 0.2}. Best is trial 57 with value: 0.013169454112648965.

1/2 [==============>...............] - ETA: 0s
2/2 [==============================] - 0s 0s/step
[I 2024-09-27 19:21:31,664] Trial 112 finished with value: 0.0188440743436416 and parameters: {'window_size': 2, 'batch_size': 16, 'network_type': 'RNN', 'num_layers': 1, 'num_neurons': 16, 'learning_rate': 0.01, 'dropout_rate': 0.2}. Best is trial 57 with value: 0.013169454112648965.

1/2 [==============>...............] - ETA: 0s
2/2 [==============================] - 0s 0s/step
[I 2024-09-27 19:21:36,292] Trial 113 finished with value: 0.019531063199043273 and parameters: {'window_size': 2, 'batch_size': 16, 'network_type': 'RNN', 'num_layers': 1, 'num_neurons': 16, 'learning_rate': 0.01, 'dropout_rate': 0.2}. Best is trial 57 with value: 0.013169454112648965.

1/2 [==============>...............] - ETA: 0s
2/2 [==============================] - 0s 0s/step
[I 2024-09-27 19:21:41,045] Trial 114 finished with value: 0.019279880752166113 and parameters: {'window_size': 2, 'batch_size': 16, 'network_type': 'RNN', 'num_layers': 1, 'num_neurons': 16, 'learning_rate': 0.01, 'dropout_rate': 0.2}. Best is trial 57 with value: 0.013169454112648965.

1/2 [==============>...............] - ETA: 0s
2/2 [==============================] - 0s 13ms/step
[I 2024-09-27 19:21:46,413] Trial 115 finished with value: 0.027547745634209034 and parameters: {'window_size': 6, 'batch_size': 16, 'network_type': 'RNN', 'num_layers': 2, 'num_neurons': 16, 'learning_rate': 0.01, 'dropout_rate': 0.2}. Best is trial 57 with value: 0.013169454112648965.

1/2 [==============>...............] - ETA: 0s
2/2 [==============================] - 0s 0s/step
[I 2024-09-27 19:21:50,749] Trial 116 finished with value: 0.022776615704099334 and parameters: {'window_size': 2, 'batch_size': 16, 'network_type': 'LSTM', 'num_layers': 1, 'num_neurons': 128, 'learning_rate': 0.01, 'dropout_rate': 0.3}. Best is trial 57 with value: 0.013169454112648965.

1/2 [==============>...............] - ETA: 0s
2/2 [==============================] - 0s 8ms/step
[I 2024-09-27 19:21:57,952] Trial 117 finished with value: 0.020495267212390898 and parameters: {'window_size': 2, 'batch_size': 16, 'network_type': 'RNN', 'num_layers': 3, 'num_neurons': 16, 'learning_rate': 0.01, 'dropout_rate': 0.2}. Best is trial 57 with value: 0.013169454112648965.

1/2 [==============>...............] - ETA: 0s
2/2 [==============================] - 0s 0s/step
[I 2024-09-27 19:22:02,993] Trial 118 finished with value: 0.01983829596141974 and parameters: {'window_size': 2, 'batch_size': 16, 'network_type': 'LSTM', 'num_layers': 1, 'num_neurons': 128, 'learning_rate': 0.01, 'dropout_rate': 0.2}. Best is trial 57 with value: 0.013169454112648965.

1/2 [==============>...............] - ETA: 0s
2/2 [==============================] - 0s 0s/step
[I 2024-09-27 19:22:05,523] Trial 119 finished with value: 0.02303612602253755 and parameters: {'window_size': 2, 'batch_size': 64, 'network_type': 'RNN', 'num_layers': 1, 'num_neurons': 16, 'learning_rate': 0.01, 'dropout_rate': 0.2}. Best is trial 57 with value: 0.013169454112648965.

1/2 [==============>...............] - ETA: 0s
2/2 [==============================] - 0s 0s/step
[I 2024-09-27 19:22:13,579] Trial 120 finished with value: 0.019006243020296097 and parameters: {'window_size': 2, 'batch_size': 16, 'network_type': 'LSTM', 'num_layers': 1, 'num_neurons': 128, 'learning_rate': 0.01, 'dropout_rate': 0.2}. Best is trial 57 with value: 0.013169454112648965.

1/2 [==============>...............] - ETA: 0s
2/2 [==============================] - 0s 0s/step
[I 2024-09-27 19:22:18,726] Trial 121 finished with value: 0.021945136134823167 and parameters: {'window_size': 2, 'batch_size': 16, 'network_type': 'RNN', 'num_layers': 1, 'num_neurons': 16, 'learning_rate': 0.01, 'dropout_rate': 0.2}. Best is trial 57 with value: 0.013169454112648965.

1/2 [==============>...............] - ETA: 0s
2/2 [==============================] - 0s 10ms/step
[I 2024-09-27 19:22:27,154] Trial 122 finished with value: 0.019861948450406394 and parameters: {'window_size': 2, 'batch_size': 16, 'network_type': 'RNN', 'num_layers': 1, 'num_neurons': 16, 'learning_rate': 0.01, 'dropout_rate': 0.2}. Best is trial 57 with value: 0.013169454112648965.

1/2 [==============>...............] - ETA: 0s
2/2 [==============================] - 0s 0s/step
[I 2024-09-27 19:22:33,494] Trial 123 finished with value: 0.018060769349336623 and parameters: {'window_size': 2, 'batch_size': 16, 'network_type': 'RNN', 'num_layers': 1, 'num_neurons': 16, 'learning_rate': 0.01, 'dropout_rate': 0.2}. Best is trial 57 with value: 0.013169454112648965.

1/2 [==============>...............] - ETA: 0s
2/2 [==============================] - 0s 0s/step
[I 2024-09-27 19:22:39,004] Trial 124 finished with value: 0.015477352331082028 and parameters: {'window_size': 2, 'batch_size': 16, 'network_type': 'RNN', 'num_layers': 1, 'num_neurons': 16, 'learning_rate': 0.01, 'dropout_rate': 0.2}. Best is trial 57 with value: 0.013169454112648965.

1/2 [==============>...............] - ETA: 0s
2/2 [==============================] - 0s 16ms/step
[I 2024-09-27 19:22:44,608] Trial 125 finished with value: 0.017807789454857507 and parameters: {'window_size': 2, 'batch_size': 16, 'network_type': 'RNN', 'num_layers': 1, 'num_neurons': 16, 'learning_rate': 0.01, 'dropout_rate': 0.2}. Best is trial 57 with value: 0.013169454112648965.

1/2 [==============>...............] - ETA: 0s
2/2 [==============================] - 0s 16ms/step
[I 2024-09-27 19:22:56,490] Trial 126 finished with value: 0.03363239334458891 and parameters: {'window_size': 4, 'batch_size': 32, 'network_type': 'RNN', 'num_layers': 1, 'num_neurons': 16, 'learning_rate': 0.0001, 'dropout_rate': 0.1}. Best is trial 57 with value: 0.013169454112648965.

1/2 [==============>...............] - ETA: 0s
2/2 [==============================] - 0s 0s/step
[I 2024-09-27 19:23:05,036] Trial 127 finished with value: 0.017270660335818925 and parameters: {'window_size': 2, 'batch_size': 16, 'network_type': 'LSTM', 'num_layers': 1, 'num_neurons': 32, 'learning_rate': 0.01, 'dropout_rate': 0.2}. Best is trial 57 with value: 0.013169454112648965.

1/2 [==============>...............] - ETA: 0s
2/2 [==============================] - 0s 0s/step
[I 2024-09-27 19:23:09,898] Trial 128 finished with value: 0.01884068726996581 and parameters: {'window_size': 2, 'batch_size': 16, 'network_type': 'RNN', 'num_layers': 1, 'num_neurons': 128, 'learning_rate': 0.01, 'dropout_rate': 0.2}. Best is trial 57 with value: 0.013169454112648965.

1/2 [==============>...............] - ETA: 0s
2/2 [==============================] - 0s 0s/step
[I 2024-09-27 19:23:18,715] Trial 129 finished with value: 0.018500235016147296 and parameters: {'window_size': 2, 'batch_size': 16, 'network_type': 'GRU', 'num_layers': 1, 'num_neurons': 16, 'learning_rate': 0.01, 'dropout_rate': 0.2}. Best is trial 57 with value: 0.013169454112648965.

1/2 [==============>...............] - ETA: 0s
2/2 [==============================] - 0s 0s/step
[I 2024-09-27 19:23:22,573] Trial 130 finished with value: 0.0216943541765213 and parameters: {'window_size': 2, 'batch_size': 16, 'network_type': 'RNN', 'num_layers': 1, 'num_neurons': 16, 'learning_rate': 0.01, 'dropout_rate': 0.2}. Best is trial 57 with value: 0.013169454112648965.

1/2 [==============>...............] - ETA: 0s
2/2 [==============================] - 0s 0s/step
[I 2024-09-27 19:23:26,899] Trial 131 finished with value: 0.015100632791717847 and parameters: {'window_size': 2, 'batch_size': 16, 'network_type': 'LSTM', 'num_layers': 1, 'num_neurons': 32, 'learning_rate': 0.01, 'dropout_rate': 0.2}. Best is trial 57 with value: 0.013169454112648965.

1/2 [==============>...............] - ETA: 0s
2/2 [==============================] - 0s 0s/step
[I 2024-09-27 19:23:31,822] Trial 132 finished with value: 0.014651602402329447 and parameters: {'window_size': 2, 'batch_size': 16, 'network_type': 'LSTM', 'num_layers': 1, 'num_neurons': 32, 'learning_rate': 0.01, 'dropout_rate': 0.2}. Best is trial 57 with value: 0.013169454112648965.

1/2 [==============>...............] - ETA: 0s
2/2 [==============================] - 0s 0s/step
[I 2024-09-27 19:23:38,106] Trial 133 finished with value: 0.01619923890630404 and parameters: {'window_size': 2, 'batch_size': 16, 'network_type': 'LSTM', 'num_layers': 1, 'num_neurons': 32, 'learning_rate': 0.01, 'dropout_rate': 0.2}. Best is trial 57 with value: 0.013169454112648965.

1/2 [==============>...............] - ETA: 0s
2/2 [==============================] - 0s 0s/step
[I 2024-09-27 19:23:44,162] Trial 134 finished with value: 0.01904666742682457 and parameters: {'window_size': 2, 'batch_size': 16, 'network_type': 'LSTM', 'num_layers': 1, 'num_neurons': 32, 'learning_rate': 0.01, 'dropout_rate': 0.2}. Best is trial 57 with value: 0.013169454112648965.

1/2 [==============>...............] - ETA: 0s
2/2 [==============================] - 0s 0s/step
[I 2024-09-27 19:23:54,237] Trial 135 finished with value: 0.034158144985636074 and parameters: {'window_size': 2, 'batch_size': 16, 'network_type': 'LSTM', 'num_layers': 1, 'num_neurons': 32, 'learning_rate': 0.0001, 'dropout_rate': 0.2}. Best is trial 57 with value: 0.013169454112648965.

1/2 [==============>...............] - ETA: 0s
2/2 [==============================] - 0s 0s/step
[I 2024-09-27 19:23:59,312] Trial 136 finished with value: 0.01549531409641107 and parameters: {'window_size': 2, 'batch_size': 64, 'network_type': 'LSTM', 'num_layers': 1, 'num_neurons': 32, 'learning_rate': 0.01, 'dropout_rate': 0.2}. Best is trial 57 with value: 0.013169454112648965.

1/2 [==============>...............] - ETA: 0s
2/2 [==============================] - 0s 8ms/step
[I 2024-09-27 19:24:03,409] Trial 137 finished with value: 0.023025088602846324 and parameters: {'window_size': 6, 'batch_size': 16, 'network_type': 'LSTM', 'num_layers': 1, 'num_neurons': 32, 'learning_rate': 0.01, 'dropout_rate': 0.2}. Best is trial 57 with value: 0.013169454112648965.

1/2 [==============>...............] - ETA: 0s
2/2 [==============================] - 0s 0s/step
[I 2024-09-27 19:24:10,263] Trial 138 finished with value: 0.019977062657475477 and parameters: {'window_size': 2, 'batch_size': 16, 'network_type': 'LSTM', 'num_layers': 2, 'num_neurons': 32, 'learning_rate': 0.01, 'dropout_rate': 0.3}. Best is trial 57 with value: 0.013169454112648965.

1/2 [==============>...............] - ETA: 0s
2/2 [==============================] - 1s 0s/step
[I 2024-09-27 19:24:21,157] Trial 139 finished with value: 0.02095150256653627 and parameters: {'window_size': 2, 'batch_size': 16, 'network_type': 'LSTM', 'num_layers': 3, 'num_neurons': 32, 'learning_rate': 0.01, 'dropout_rate': 0.2}. Best is trial 57 with value: 0.013169454112648965.

1/2 [==============>...............] - ETA: 0s
2/2 [==============================] - 0s 0s/step
[I 2024-09-27 19:24:26,185] Trial 140 finished with value: 0.02242649144927661 and parameters: {'window_size': 2, 'batch_size': 16, 'network_type': 'LSTM', 'num_layers': 1, 'num_neurons': 128, 'learning_rate': 0.01, 'dropout_rate': 0.2}. Best is trial 57 with value: 0.013169454112648965.

1/2 [==============>...............] - ETA: 0s
2/2 [==============================] - 0s 0s/step
[I 2024-09-27 19:24:30,947] Trial 141 finished with value: 0.015012367020050687 and parameters: {'window_size': 2, 'batch_size': 16, 'network_type': 'LSTM', 'num_layers': 1, 'num_neurons': 32, 'learning_rate': 0.01, 'dropout_rate': 0.2}. Best is trial 57 with value: 0.013169454112648965.

1/2 [==============>...............] - ETA: 0s
2/2 [==============================] - 0s 0s/step
[I 2024-09-27 19:24:35,421] Trial 142 finished with value: 0.016506512025992074 and parameters: {'window_size': 2, 'batch_size': 16, 'network_type': 'LSTM', 'num_layers': 1, 'num_neurons': 32, 'learning_rate': 0.01, 'dropout_rate': 0.2}. Best is trial 57 with value: 0.013169454112648965.

1/2 [==============>...............] - ETA: 0s
2/2 [==============================] - 0s 0s/step
[I 2024-09-27 19:24:41,034] Trial 143 finished with value: 0.01608434035877387 and parameters: {'window_size': 2, 'batch_size': 16, 'network_type': 'LSTM', 'num_layers': 1, 'num_neurons': 32, 'learning_rate': 0.01, 'dropout_rate': 0.2}. Best is trial 57 with value: 0.013169454112648965.

1/2 [==============>...............] - ETA: 0s
2/2 [==============================] - 0s 8ms/step
[I 2024-09-27 19:24:46,643] Trial 144 finished with value: 0.023952602967619894 and parameters: {'window_size': 2, 'batch_size': 16, 'network_type': 'LSTM', 'num_layers': 1, 'num_neurons': 32, 'learning_rate': 0.01, 'dropout_rate': 0.2}. Best is trial 57 with value: 0.013169454112648965.

1/2 [==============>...............] - ETA: 0s
2/2 [==============================] - 0s 0s/step
[I 2024-09-27 19:24:53,043] Trial 145 finished with value: 0.01825836305320263 and parameters: {'window_size': 2, 'batch_size': 16, 'network_type': 'LSTM', 'num_layers': 1, 'num_neurons': 32, 'learning_rate': 0.01, 'dropout_rate': 0.2}. Best is trial 57 with value: 0.013169454112648965.

1/2 [==============>...............] - ETA: 0s
2/2 [==============================] - 0s 16ms/step
[I 2024-09-27 19:25:00,804] Trial 146 finished with value: 0.015043337841828666 and parameters: {'window_size': 2, 'batch_size': 16, 'network_type': 'LSTM', 'num_layers': 1, 'num_neurons': 128, 'learning_rate': 0.01, 'dropout_rate': 0.2}. Best is trial 57 with value: 0.013169454112648965.

1/2 [==============>...............] - ETA: 0s
2/2 [==============================] - 0s 0s/step
[I 2024-09-27 19:25:07,556] Trial 147 finished with value: 0.024959516649444898 and parameters: {'window_size': 2, 'batch_size': 16, 'network_type': 'LSTM', 'num_layers': 1, 'num_neurons': 128, 'learning_rate': 0.01, 'dropout_rate': 0.2}. Best is trial 57 with value: 0.013169454112648965.

1/2 [==============>...............] - ETA: 0s
2/2 [==============================] - 0s 0s/step
[I 2024-09-27 19:25:15,971] Trial 148 finished with value: 0.06725396295885246 and parameters: {'window_size': 2, 'batch_size': 64, 'network_type': 'LSTM', 'num_layers': 1, 'num_neurons': 128, 'learning_rate': 0.0001, 'dropout_rate': 0.2}. Best is trial 57 with value: 0.013169454112648965.

1/2 [==============>...............] - ETA: 0s
2/2 [==============================] - 0s 16ms/step
[I 2024-09-27 19:25:21,978] Trial 149 finished with value: 0.02167723849027053 and parameters: {'window_size': 4, 'batch_size': 16, 'network_type': 'LSTM', 'num_layers': 1, 'num_neurons': 128, 'learning_rate': 0.01, 'dropout_rate': 0.2}. Best is trial 57 with value: 0.013169454112648965.

1/2 [==============>...............] - ETA: 0s
2/2 [==============================] - 0s 0s/step
[I 2024-09-27 19:25:28,100] Trial 150 finished with value: 0.015561735565463702 and parameters: {'window_size': 2, 'batch_size': 32, 'network_type': 'LSTM', 'num_layers': 1, 'num_neurons': 128, 'learning_rate': 0.01, 'dropout_rate': 0.1}. Best is trial 57 with value: 0.013169454112648965.

1/2 [==============>...............] - ETA: 0s
2/2 [==============================] - 0s 0s/step
[I 2024-09-27 19:25:35,303] Trial 151 finished with value: 0.016755781754851342 and parameters: {'window_size': 2, 'batch_size': 16, 'network_type': 'LSTM', 'num_layers': 1, 'num_neurons': 64, 'learning_rate': 0.01, 'dropout_rate': 0.2}. Best is trial 57 with value: 0.013169454112648965.

1/2 [==============>...............] - ETA: 0s
2/2 [==============================] - 0s 0s/step
[I 2024-09-27 19:25:42,627] Trial 152 finished with value: 0.01564891874790192 and parameters: {'window_size': 2, 'batch_size': 16, 'network_type': 'LSTM', 'num_layers': 1, 'num_neurons': 128, 'learning_rate': 0.01, 'dropout_rate': 0.2}. Best is trial 57 with value: 0.013169454112648965.

1/2 [==============>...............] - ETA: 0s
2/2 [==============================] - 0s 0s/step
[I 2024-09-27 19:25:52,577] Trial 153 finished with value: 0.016713119069735213 and parameters: {'window_size': 2, 'batch_size': 16, 'network_type': 'LSTM', 'num_layers': 1, 'num_neurons': 32, 'learning_rate': 0.01, 'dropout_rate': 0.2}. Best is trial 57 with value: 0.013169454112648965.

1/2 [==============>...............] - ETA: 0s
2/2 [==============================] - 0s 0s/step
[I 2024-09-27 19:26:08,640] Trial 154 finished with value: 0.02305591741204262 and parameters: {'window_size': 2, 'batch_size': 16, 'network_type': 'LSTM', 'num_layers': 1, 'num_neurons': 128, 'learning_rate': 0.0001, 'dropout_rate': 0.2}. Best is trial 57 with value: 0.013169454112648965.

1/2 [==============>...............] - ETA: 0s
2/2 [==============================] - 1s 0s/step
[I 2024-09-27 19:26:18,727] Trial 155 finished with value: 0.015408300841848058 and parameters: {'window_size': 2, 'batch_size': 16, 'network_type': 'LSTM', 'num_layers': 1, 'num_neurons': 128, 'learning_rate': 0.01, 'dropout_rate': 0.2}. Best is trial 57 with value: 0.013169454112648965.

1/2 [==============>...............] - ETA: 0s
2/2 [==============================] - 1s 3ms/step
[I 2024-09-27 19:26:30,492] Trial 156 finished with value: 0.017266738583644234 and parameters: {'window_size': 2, 'batch_size': 16, 'network_type': 'LSTM', 'num_layers': 1, 'num_neurons': 32, 'learning_rate': 0.01, 'dropout_rate': 0.2}. Best is trial 57 with value: 0.013169454112648965.

1/2 [==============>...............] - ETA: 0s
2/2 [==============================] - 0s 16ms/step
[I 2024-09-27 19:26:39,494] Trial 157 finished with value: 0.01536229221522808 and parameters: {'window_size': 2, 'batch_size': 16, 'network_type': 'RNN', 'num_layers': 1, 'num_neurons': 128, 'learning_rate': 0.01, 'dropout_rate': 0.2}. Best is trial 57 with value: 0.013169454112648965.

1/2 [==============>...............] - ETA: 0s
2/2 [==============================] - 1s 0s/step
[I 2024-09-27 19:26:48,522] Trial 158 finished with value: 0.01698731766144435 and parameters: {'window_size': 2, 'batch_size': 16, 'network_type': 'GRU', 'num_layers': 1, 'num_neurons': 16, 'learning_rate': 0.01, 'dropout_rate': 0.2}. Best is trial 57 with value: 0.013169454112648965.

1/2 [==============>...............] - ETA: 0s
2/2 [==============================] - 1s 5ms/step
[I 2024-09-27 19:27:01,229] Trial 159 finished with value: 0.01844134190181891 and parameters: {'window_size': 2, 'batch_size': 16, 'network_type': 'LSTM', 'num_layers': 1, 'num_neurons': 128, 'learning_rate': 0.01, 'dropout_rate': 0.2}. Best is trial 57 with value: 0.013169454112648965.

1/2 [==============>...............] - ETA: 0s
2/2 [==============================] - 0s 0s/step
