[I 2024-09-28 01:22:35,833] Trial 26 finished with value: 0.05667463175455732 and parameters: {'learning_rate': 0.01, 'batch_size': 64, 'network_type': 'RNN', 'num_layers': 2, 'num_neurons': 32, 'dropout_rate': 0.3}. Best is trial 22 with value: 0.012659055497911255.
[I 2024-09-28 01:22:44,720] Trial 27 finished with value: 0.01979337957170271 and parameters: {'learning_rate': 0.01, 'batch_size': 64, 'network_type': 'RNN', 'num_layers': 2, 'num_neurons': 128, 'dropout_rate': 0.3}. Best is trial 22 with value: 0.012659055497911255.
[I 2024-09-28 01:23:03,917] Trial 28 finished with value: 0.042692362255520325 and parameters: {'learning_rate': 0.01, 'batch_size': 32, 'network_type': 'LSTM', 'num_layers': 2, 'num_neurons': 64, 'dropout_rate': 0.1}. Best is trial 22 with value: 0.012659055497911255.
[I 2024-09-28 01:23:16,680] Trial 29 finished with value: 0.015282915009392668 and parameters: {'learning_rate': 0.01, 'batch_size': 16, 'network_type': 'GRU', 'num_layers': 2, 'num_neurons': 32, 'dropout_rate': 0.2}. Best is trial 22 with value: 0.012659055497911255.
[I 2024-09-28 01:23:33,478] Trial 30 finished with value: 0.04234045643276642 and parameters: {'learning_rate': 0.01, 'batch_size': 32, 'network_type': 'LSTM', 'num_layers': 3, 'num_neurons': 32, 'dropout_rate': 0.2}. Best is trial 22 with value: 0.012659055497911255.
[I 2024-09-28 01:23:40,620] Trial 31 finished with value: 0.0168327205446031 and parameters: {'learning_rate': 0.01, 'batch_size': 64, 'network_type': 'RNN', 'num_layers': 2, 'num_neurons': 64, 'dropout_rate': 0.3}. Best is trial 22 with value: 0.012659055497911255.
[I 2024-09-28 01:23:46,764] Trial 32 finished with value: 0.019059611002604202 and parameters: {'learning_rate': 0.01, 'batch_size': 64, 'network_type': 'RNN', 'num_layers': 1, 'num_neurons': 64, 'dropout_rate': 0.3}. Best is trial 22 with value: 0.012659055497911255.
[I 2024-09-28 01:23:52,831] Trial 33 finished with value: 0.016334102524651457 and parameters: {'learning_rate': 0.01, 'batch_size': 64, 'network_type': 'RNN', 'num_layers': 1, 'num_neurons': 64, 'dropout_rate': 0.3}. Best is trial 22 with value: 0.012659055497911255.
[I 2024-09-28 01:24:01,025] Trial 34 finished with value: 0.023902675522698265 and parameters: {'learning_rate': 0.01, 'batch_size': 64, 'network_type': 'RNN', 'num_layers': 3, 'num_neurons': 64, 'dropout_rate': 0.3}. Best is trial 22 with value: 0.012659055497911255.
[I 2024-09-28 01:24:09,225] Trial 35 finished with value: 0.013091242154439305 and parameters: {'learning_rate': 0.01, 'batch_size': 16, 'network_type': 'RNN', 'num_layers': 2, 'num_neurons': 64, 'dropout_rate': 0.3}. Best is trial 22 with value: 0.012659055497911255.
[I 2024-09-28 01:24:15,946] Trial 36 finished with value: 0.014957569546169718 and parameters: {'learning_rate': 0.01, 'batch_size': 16, 'network_type': 'RNN', 'num_layers': 2, 'num_neurons': 16, 'dropout_rate': 0.3}. Best is trial 22 with value: 0.012659055497911255.
[I 2024-09-28 01:24:23,159] Trial 37 finished with value: 0.018111031850179 and parameters: {'learning_rate': 0.01, 'batch_size': 16, 'network_type': 'RNN', 'num_layers': 2, 'num_neurons': 64, 'dropout_rate': 0.3}. Best is trial 22 with value: 0.012659055497911255.
[I 2024-09-28 01:24:34,192] Trial 38 finished with value: 0.019194352891710034 and parameters: {'learning_rate': 0.01, 'batch_size': 16, 'network_type': 'GRU', 'num_layers': 2, 'num_neurons': 128, 'dropout_rate': 0.1}. Best is trial 22 with value: 0.012659055497911255.
[I 2024-09-28 01:24:53,371] Trial 39 finished with value: 0.05398719077640113 and parameters: {'learning_rate': 0.01, 'batch_size': 16, 'network_type': 'LSTM', 'num_layers': 3, 'num_neurons': 16, 'dropout_rate': 0.3}. Best is trial 22 with value: 0.012659055497911255.
[I 2024-09-28 01:25:00,352] Trial 40 finished with value: 0.013758006201850057 and parameters: {'learning_rate': 0.01, 'batch_size': 16, 'network_type': 'RNN', 'num_layers': 2, 'num_neurons': 32, 'dropout_rate': 0.2}. Best is trial 22 with value: 0.012659055497911255.
[I 2024-09-28 01:25:07,608] Trial 41 finished with value: 0.036865955246819425 and parameters: {'learning_rate': 0.01, 'batch_size': 16, 'network_type': 'RNN', 'num_layers': 2, 'num_neurons': 32, 'dropout_rate': 0.2}. Best is trial 22 with value: 0.012659055497911255.
[I 2024-09-28 01:25:14,360] Trial 42 finished with value: 0.04650690057542592 and parameters: {'learning_rate': 0.01, 'batch_size': 16, 'network_type': 'RNN', 'num_layers': 2, 'num_neurons': 32, 'dropout_rate': 0.2}. Best is trial 22 with value: 0.012659055497911255.
[I 2024-09-28 01:25:22,918] Trial 43 finished with value: 0.0289744222429064 and parameters: {'learning_rate': 0.01, 'batch_size': 16, 'network_type': 'RNN', 'num_layers': 2, 'num_neurons': 32, 'dropout_rate': 0.2}. Best is trial 22 with value: 0.012659055497911255.
[I 2024-09-28 01:25:29,879] Trial 44 finished with value: 0.023493391036987346 and parameters: {'learning_rate': 0.01, 'batch_size': 16, 'network_type': 'RNN', 'num_layers': 2, 'num_neurons': 32, 'dropout_rate': 0.2}. Best is trial 22 with value: 0.012659055497911255.
[I 2024-09-28 01:25:38,432] Trial 45 finished with value: 0.0214285661909315 and parameters: {'learning_rate': 0.01, 'batch_size': 16, 'network_type': 'RNN', 'num_layers': 3, 'num_neurons': 64, 'dropout_rate': 0.2}. Best is trial 22 with value: 0.012659055497911255.
[I 2024-09-28 01:25:50,569] Trial 46 finished with value: 0.014576856931050585 and parameters: {'learning_rate': 0.01, 'batch_size': 16, 'network_type': 'GRU', 'num_layers': 2, 'num_neurons': 32, 'dropout_rate': 0.3}. Best is trial 22 with value: 0.012659055497911255.
[I 2024-09-28 01:26:05,297] Trial 47 finished with value: 0.03422961807250981 and parameters: {'learning_rate': 0.01, 'batch_size': 16, 'network_type': 'GRU', 'num_layers': 2, 'num_neurons': 16, 'dropout_rate': 0.3}. Best is trial 22 with value: 0.012659055497911255.
[I 2024-09-28 01:26:17,489] Trial 48 finished with value: 0.014354886372884105 and parameters: {'learning_rate': 0.01, 'batch_size': 16, 'network_type': 'GRU', 'num_layers': 2, 'num_neurons': 64, 'dropout_rate': 0.3}. Best is trial 22 with value: 0.012659055497911255.
