[I 2024-09-27 19:52:26,883] Trial 126 finished with value: 0.011151052478333593 and parameters: {'window_size': 2, 'batch_size': 32, 'network_type': 'RNN', 'num_layers': 2, 'num_neurons': 32, 'learning_rate': 0.01, 'dropout_rate': 0.1}. Best is trial 67 with value: 0.009445951347619719.

1/3 [=========>....................] - ETA: 0s
3/3 [==============================] - 0s 5ms/step
[I 2024-09-27 19:52:35,277] Trial 127 finished with value: 0.010080317507327446 and parameters: {'window_size': 2, 'batch_size': 32, 'network_type': 'LSTM', 'num_layers': 1, 'num_neurons': 64, 'learning_rate': 0.01, 'dropout_rate': 0.1}. Best is trial 67 with value: 0.009445951347619719.

1/3 [=========>....................] - ETA: 0s
3/3 [==============================] - 0s 2ms/step
[I 2024-09-27 19:52:42,151] Trial 128 finished with value: 0.010364610329480241 and parameters: {'window_size': 2, 'batch_size': 16, 'network_type': 'LSTM', 'num_layers': 1, 'num_neurons': 32, 'learning_rate': 0.01, 'dropout_rate': 0.3}. Best is trial 67 with value: 0.009445951347619719.

1/3 [=========>....................] - ETA: 0s
3/3 [==============================] - 0s 4ms/step
[I 2024-09-27 19:52:48,971] Trial 129 finished with value: 0.009781984147891196 and parameters: {'window_size': 2, 'batch_size': 32, 'network_type': 'LSTM', 'num_layers': 1, 'num_neurons': 128, 'learning_rate': 0.01, 'dropout_rate': 0.1}. Best is trial 67 with value: 0.009445951347619719.

1/3 [=========>....................] - ETA: 0s
3/3 [==============================] - 0s 5ms/step
[I 2024-09-27 19:52:58,980] Trial 130 finished with value: 0.011039129242968201 and parameters: {'window_size': 6, 'batch_size': 32, 'network_type': 'LSTM', 'num_layers': 1, 'num_neurons': 16, 'learning_rate': 0.01, 'dropout_rate': 0.1}. Best is trial 67 with value: 0.009445951347619719.

1/3 [=========>....................] - ETA: 0s
3/3 [==============================] - 0s 3ms/step
[I 2024-09-27 19:53:05,935] Trial 131 finished with value: 0.00941323839442831 and parameters: {'window_size': 2, 'batch_size': 32, 'network_type': 'LSTM', 'num_layers': 1, 'num_neurons': 128, 'learning_rate': 0.01, 'dropout_rate': 0.1}. Best is trial 131 with value: 0.00941323839442831.

1/3 [=========>....................] - ETA: 1s
3/3 [==============================] - 1s 6ms/step
[I 2024-09-27 19:53:12,235] Trial 132 finished with value: 0.009739341473915208 and parameters: {'window_size': 2, 'batch_size': 32, 'network_type': 'LSTM', 'num_layers': 1, 'num_neurons': 128, 'learning_rate': 0.01, 'dropout_rate': 0.1}. Best is trial 131 with value: 0.00941323839442831.

1/3 [=========>....................] - ETA: 0s
3/3 [==============================] - 0s 4ms/step
[I 2024-09-27 19:53:19,644] Trial 133 finished with value: 0.00979190969467163 and parameters: {'window_size': 2, 'batch_size': 32, 'network_type': 'LSTM', 'num_layers': 1, 'num_neurons': 128, 'learning_rate': 0.01, 'dropout_rate': 0.1}. Best is trial 131 with value: 0.00941323839442831.

1/3 [=========>....................] - ETA: 0s
3/3 [==============================] - 0s 3ms/step
[I 2024-09-27 19:53:35,703] Trial 134 finished with value: 0.010762711061558254 and parameters: {'window_size': 2, 'batch_size': 32, 'network_type': 'LSTM', 'num_layers': 1, 'num_neurons': 128, 'learning_rate': 0.0001, 'dropout_rate': 0.1}. Best is trial 131 with value: 0.00941323839442831.

1/3 [=========>....................] - ETA: 0s
3/3 [==============================] - 0s 3ms/step
[I 2024-09-27 19:53:47,433] Trial 135 finished with value: 0.010956752861049811 and parameters: {'window_size': 2, 'batch_size': 32, 'network_type': 'LSTM', 'num_layers': 1, 'num_neurons': 128, 'learning_rate': 0.0001, 'dropout_rate': 0.1}. Best is trial 131 with value: 0.00941323839442831.

1/3 [=========>....................] - ETA: 0s
3/3 [==============================] - 0s 3ms/step
[I 2024-09-27 19:53:54,340] Trial 136 finished with value: 0.00980271833043703 and parameters: {'window_size': 2, 'batch_size': 32, 'network_type': 'LSTM', 'num_layers': 1, 'num_neurons': 64, 'learning_rate': 0.01, 'dropout_rate': 0.1}. Best is trial 131 with value: 0.00941323839442831.

1/3 [=========>....................] - ETA: 1s
3/3 [==============================] - 1s 8ms/step
[I 2024-09-27 19:54:04,198] Trial 137 finished with value: 0.010466745467253133 and parameters: {'window_size': 2, 'batch_size': 64, 'network_type': 'LSTM', 'num_layers': 3, 'num_neurons': 128, 'learning_rate': 0.01, 'dropout_rate': 0.2}. Best is trial 131 with value: 0.00941323839442831.

1/3 [=========>....................] - ETA: 0s
3/3 [==============================] - 0s 5ms/step
[I 2024-09-27 19:54:10,509] Trial 138 finished with value: 0.010516533596414917 and parameters: {'window_size': 2, 'batch_size': 32, 'network_type': 'LSTM', 'num_layers': 2, 'num_neurons': 128, 'learning_rate': 0.01, 'dropout_rate': 0.1}. Best is trial 131 with value: 0.00941323839442831.

1/3 [=========>....................] - ETA: 0s
3/3 [==============================] - 0s 2ms/step
[I 2024-09-27 19:54:15,503] Trial 139 finished with value: 0.010439244821038045 and parameters: {'window_size': 2, 'batch_size': 32, 'network_type': 'LSTM', 'num_layers': 1, 'num_neurons': 32, 'learning_rate': 0.01, 'dropout_rate': 0.1}. Best is trial 131 with value: 0.00941323839442831.

1/3 [=========>....................] - ETA: 0s
3/3 [==============================] - 0s 4ms/step
[I 2024-09-27 19:54:20,264] Trial 140 finished with value: 0.012050542878433013 and parameters: {'window_size': 2, 'batch_size': 32, 'network_type': 'GRU', 'num_layers': 1, 'num_neurons': 128, 'learning_rate': 0.01, 'dropout_rate': 0.1}. Best is trial 131 with value: 0.00941323839442831.

1/3 [=========>....................] - ETA: 0s
3/3 [==============================] - 0s 3ms/step
[I 2024-09-27 19:54:32,541] Trial 141 finished with value: 0.010589382487283626 and parameters: {'window_size': 2, 'batch_size': 32, 'network_type': 'LSTM', 'num_layers': 1, 'num_neurons': 128, 'learning_rate': 0.0001, 'dropout_rate': 0.1}. Best is trial 131 with value: 0.00941323839442831.

1/3 [=========>....................] - ETA: 0s
3/3 [==============================] - 0s 3ms/step
[I 2024-09-27 19:54:37,388] Trial 142 finished with value: 0.00996914797433665 and parameters: {'window_size': 2, 'batch_size': 32, 'network_type': 'LSTM', 'num_layers': 1, 'num_neurons': 128, 'learning_rate': 0.01, 'dropout_rate': 0.1}. Best is trial 131 with value: 0.00941323839442831.

1/3 [=========>....................] - ETA: 0s
3/3 [==============================] - 0s 3ms/step
[I 2024-09-27 19:54:43,329] Trial 143 finished with value: 0.00959151128648033 and parameters: {'window_size': 2, 'batch_size': 32, 'network_type': 'LSTM', 'num_layers': 1, 'num_neurons': 128, 'learning_rate': 0.01, 'dropout_rate': 0.1}. Best is trial 131 with value: 0.00941323839442831.

1/3 [=========>....................] - ETA: 0s
3/3 [==============================] - 0s 3ms/step
[I 2024-09-27 19:54:48,967] Trial 144 finished with value: 0.009810404062271119 and parameters: {'window_size': 2, 'batch_size': 32, 'network_type': 'LSTM', 'num_layers': 1, 'num_neurons': 128, 'learning_rate': 0.01, 'dropout_rate': 0.1}. Best is trial 131 with value: 0.00941323839442831.

1/3 [=========>....................] - ETA: 0s
3/3 [==============================] - 0s 4ms/step
[I 2024-09-27 19:54:52,730] Trial 145 finished with value: 0.014891201630882596 and parameters: {'window_size': 4, 'batch_size': 32, 'network_type': 'LSTM', 'num_layers': 1, 'num_neurons': 128, 'learning_rate': 0.01, 'dropout_rate': 0.1}. Best is trial 131 with value: 0.00941323839442831.

1/3 [=========>....................] - ETA: 0s
3/3 [==============================] - 0s 2ms/step
[I 2024-09-27 19:54:58,281] Trial 146 finished with value: 0.009683336812005918 and parameters: {'window_size': 2, 'batch_size': 32, 'network_type': 'LSTM', 'num_layers': 1, 'num_neurons': 128, 'learning_rate': 0.01, 'dropout_rate': 0.1}. Best is trial 131 with value: 0.00941323839442831.

1/3 [=========>....................] - ETA: 0s
3/3 [==============================] - 0s 3ms/step
[I 2024-09-27 19:55:03,574] Trial 147 finished with value: 0.00978951367861788 and parameters: {'window_size': 2, 'batch_size': 32, 'network_type': 'LSTM', 'num_layers': 1, 'num_neurons': 128, 'learning_rate': 0.01, 'dropout_rate': 0.1}. Best is trial 131 with value: 0.00941323839442831.

1/3 [=========>....................] - ETA: 0s
3/3 [==============================] - 0s 2ms/step
[I 2024-09-27 19:55:09,044] Trial 148 finished with value: 0.009569420767502047 and parameters: {'window_size': 2, 'batch_size': 32, 'network_type': 'LSTM', 'num_layers': 1, 'num_neurons': 128, 'learning_rate': 0.01, 'dropout_rate': 0.1}. Best is trial 131 with value: 0.00941323839442831.

1/3 [=========>....................] - ETA: 0s
3/3 [==============================] - 0s 3ms/step
[I 2024-09-27 19:55:13,916] Trial 149 finished with value: 0.009650011116350202 and parameters: {'window_size': 2, 'batch_size': 32, 'network_type': 'RNN', 'num_layers': 1, 'num_neurons': 64, 'learning_rate': 0.01, 'dropout_rate': 0.1}. Best is trial 131 with value: 0.00941323839442831.

1/3 [=========>....................] - ETA: 0s
3/3 [==============================] - 0s 4ms/step
[I 2024-09-27 19:55:22,571] Trial 150 finished with value: 0.010059755338749416 and parameters: {'window_size': 2, 'batch_size': 16, 'network_type': 'LSTM', 'num_layers': 2, 'num_neurons': 128, 'learning_rate': 0.01, 'dropout_rate': 0.1}. Best is trial 131 with value: 0.00941323839442831.

1/3 [=========>....................] - ETA: 0s
3/3 [==============================] - 0s 3ms/step
[I 2024-09-27 19:55:29,029] Trial 151 finished with value: 0.009489565577305542 and parameters: {'window_size': 2, 'batch_size': 32, 'network_type': 'LSTM', 'num_layers': 1, 'num_neurons': 128, 'learning_rate': 0.01, 'dropout_rate': 0.1}. Best is trial 131 with value: 0.00941323839442831.

1/3 [=========>....................] - ETA: 0s
3/3 [==============================] - 0s 4ms/step
[I 2024-09-27 19:55:34,295] Trial 152 finished with value: 0.009953141403869848 and parameters: {'window_size': 2, 'batch_size': 32, 'network_type': 'LSTM', 'num_layers': 1, 'num_neurons': 128, 'learning_rate': 0.01, 'dropout_rate': 0.1}. Best is trial 131 with value: 0.00941323839442831.

1/3 [=========>....................] - ETA: 0s
3/3 [==============================] - 0s 3ms/step
[I 2024-09-27 19:55:40,092] Trial 153 finished with value: 0.00976133030233249 and parameters: {'window_size': 2, 'batch_size': 32, 'network_type': 'LSTM', 'num_layers': 1, 'num_neurons': 128, 'learning_rate': 0.01, 'dropout_rate': 0.1}. Best is trial 131 with value: 0.00941323839442831.

1/3 [=========>....................] - ETA: 1s
3/3 [==============================] - 1s 4ms/step
[I 2024-09-27 19:55:48,255] Trial 154 finished with value: 0.009659098853527661 and parameters: {'window_size': 2, 'batch_size': 32, 'network_type': 'LSTM', 'num_layers': 1, 'num_neurons': 128, 'learning_rate': 0.01, 'dropout_rate': 0.1}. Best is trial 131 with value: 0.00941323839442831.

1/3 [=========>....................] - ETA: 0s
3/3 [==============================] - 0s 3ms/step
[I 2024-09-27 19:55:56,403] Trial 155 finished with value: 0.009606471494889598 and parameters: {'window_size': 2, 'batch_size': 32, 'network_type': 'LSTM', 'num_layers': 1, 'num_neurons': 128, 'learning_rate': 0.01, 'dropout_rate': 0.1}. Best is trial 131 with value: 0.00941323839442831.

1/3 [=========>....................] - ETA: 0s
3/3 [==============================] - 0s 4ms/step
[I 2024-09-27 19:56:02,931] Trial 156 finished with value: 0.010638144395720792 and parameters: {'window_size': 2, 'batch_size': 32, 'network_type': 'LSTM', 'num_layers': 1, 'num_neurons': 128, 'learning_rate': 0.01, 'dropout_rate': 0.3}. Best is trial 131 with value: 0.00941323839442831.

1/3 [=========>....................] - ETA: 0s
3/3 [==============================] - 0s 2ms/step
[I 2024-09-27 19:56:09,623] Trial 157 finished with value: 0.01119912252627628 and parameters: {'window_size': 2, 'batch_size': 32, 'network_type': 'LSTM', 'num_layers': 1, 'num_neurons': 32, 'learning_rate': 0.01, 'dropout_rate': 0.1}. Best is trial 131 with value: 0.00941323839442831.

1/3 [=========>....................] - ETA: 0s
3/3 [==============================] - 0s 3ms/step
[I 2024-09-27 19:56:15,897] Trial 158 finished with value: 0.009904759178698902 and parameters: {'window_size': 2, 'batch_size': 32, 'network_type': 'LSTM', 'num_layers': 1, 'num_neurons': 128, 'learning_rate': 0.01, 'dropout_rate': 0.1}. Best is trial 131 with value: 0.00941323839442831.

1/3 [=========>....................] - ETA: 0s
3/3 [==============================] - 0s 7ms/step
[I 2024-09-27 19:56:28,345] Trial 159 finished with value: 0.01280411217461771 and parameters: {'window_size': 6, 'batch_size': 32, 'network_type': 'LSTM', 'num_layers': 1, 'num_neurons': 128, 'learning_rate': 0.01, 'dropout_rate': 0.1}. Best is trial 131 with value: 0.00941323839442831.

1/3 [=========>....................] - ETA: 0s
3/3 [==============================] - 0s 3ms/step
[I 2024-09-27 19:56:34,491] Trial 160 finished with value: 0.010133869181216601 and parameters: {'window_size': 2, 'batch_size': 32, 'network_type': 'LSTM', 'num_layers': 1, 'num_neurons': 16, 'learning_rate': 0.01, 'dropout_rate': 0.2}. Best is trial 131 with value: 0.00941323839442831.

1/3 [=========>....................] - ETA: 0s
3/3 [==============================] - 0s 3ms/step
[I 2024-09-27 19:56:43,723] Trial 161 finished with value: 0.0095942166254554 and parameters: {'window_size': 2, 'batch_size': 32, 'network_type': 'LSTM', 'num_layers': 1, 'num_neurons': 128, 'learning_rate': 0.01, 'dropout_rate': 0.1}. Best is trial 131 with value: 0.00941323839442831.

1/3 [=========>....................] - ETA: 0s
3/3 [==============================] - 0s 3ms/step
[I 2024-09-27 19:56:48,743] Trial 162 finished with value: 0.00965470090046735 and parameters: {'window_size': 2, 'batch_size': 32, 'network_type': 'LSTM', 'num_layers': 1, 'num_neurons': 128, 'learning_rate': 0.01, 'dropout_rate': 0.1}. Best is trial 131 with value: 0.00941323839442831.

1/3 [=========>....................] - ETA: 0s
3/3 [==============================] - 0s 3ms/step
[I 2024-09-27 19:56:52,919] Trial 163 finished with value: 0.010043500151432735 and parameters: {'window_size': 2, 'batch_size': 32, 'network_type': 'LSTM', 'num_layers': 1, 'num_neurons': 128, 'learning_rate': 0.01, 'dropout_rate': 0.1}. Best is trial 131 with value: 0.00941323839442831.

1/3 [=========>....................] - ETA: 0s
3/3 [==============================] - 0s 3ms/step
[I 2024-09-27 19:56:57,326] Trial 164 finished with value: 0.010068918923257102 and parameters: {'window_size': 2, 'batch_size': 32, 'network_type': 'LSTM', 'num_layers': 1, 'num_neurons': 128, 'learning_rate': 0.01, 'dropout_rate': 0.1}. Best is trial 131 with value: 0.00941323839442831.

1/3 [=========>....................] - ETA: 1s
3/3 [==============================] - 1s 5ms/step
[I 2024-09-27 19:57:08,534] Trial 165 finished with value: 0.010734268860078198 and parameters: {'window_size': 2, 'batch_size': 64, 'network_type': 'LSTM', 'num_layers': 3, 'num_neurons': 128, 'learning_rate': 0.01, 'dropout_rate': 0.1}. Best is trial 131 with value: 0.00941323839442831.

1/3 [=========>....................] - ETA: 0s
3/3 [==============================] - 0s 2ms/step
[I 2024-09-27 19:57:13,651] Trial 166 finished with value: 0.00990949706628289 and parameters: {'window_size': 2, 'batch_size': 32, 'network_type': 'LSTM', 'num_layers': 1, 'num_neurons': 128, 'learning_rate': 0.01, 'dropout_rate': 0.1}. Best is trial 131 with value: 0.00941323839442831.

1/3 [=========>....................] - ETA: 0s
3/3 [==============================] - 0s 2ms/step
[I 2024-09-27 19:57:18,292] Trial 167 finished with value: 0.00991437991907899 and parameters: {'window_size': 2, 'batch_size': 32, 'network_type': 'LSTM', 'num_layers': 1, 'num_neurons': 32, 'learning_rate': 0.01, 'dropout_rate': 0.1}. Best is trial 131 with value: 0.00941323839442831.

1/3 [=========>....................] - ETA: 0s
3/3 [==============================] - 0s 4ms/step
[I 2024-09-27 19:57:29,786] Trial 168 finished with value: 0.014811406501581971 and parameters: {'window_size': 2, 'batch_size': 32, 'network_type': 'LSTM', 'num_layers': 2, 'num_neurons': 128, 'learning_rate': 0.0001, 'dropout_rate': 0.1}. Best is trial 131 with value: 0.00941323839442831.

1/3 [=========>....................] - ETA: 0s
3/3 [==============================] - 0s 5ms/step
[I 2024-09-27 19:57:37,300] Trial 169 finished with value: 0.01111269436366316 and parameters: {'window_size': 4, 'batch_size': 32, 'network_type': 'GRU', 'num_layers': 1, 'num_neurons': 64, 'learning_rate': 0.01, 'dropout_rate': 0.1}. Best is trial 131 with value: 0.00941323839442831.

1/3 [=========>....................] - ETA: 0s
3/3 [==============================] - 0s 3ms/step
[I 2024-09-27 19:57:42,854] Trial 170 finished with value: 0.009561179819241377 and parameters: {'window_size': 2, 'batch_size': 32, 'network_type': 'LSTM', 'num_layers': 1, 'num_neurons': 128, 'learning_rate': 0.01, 'dropout_rate': 0.1}. Best is trial 131 with value: 0.00941323839442831.

1/3 [=========>....................] - ETA: 0s
3/3 [==============================] - 0s 3ms/step
[I 2024-09-27 19:57:49,234] Trial 171 finished with value: 0.009517879120061096 and parameters: {'window_size': 2, 'batch_size': 32, 'network_type': 'LSTM', 'num_layers': 1, 'num_neurons': 128, 'learning_rate': 0.01, 'dropout_rate': 0.1}. Best is trial 131 with value: 0.00941323839442831.

1/3 [=========>....................] - ETA: 0s
3/3 [==============================] - 0s 2ms/step
[I 2024-09-27 19:57:55,426] Trial 172 finished with value: 0.00965180726118491 and parameters: {'window_size': 2, 'batch_size': 32, 'network_type': 'LSTM', 'num_layers': 1, 'num_neurons': 128, 'learning_rate': 0.01, 'dropout_rate': 0.1}. Best is trial 131 with value: 0.00941323839442831.

1/3 [=========>....................] - ETA: 0s
3/3 [==============================] - 0s 3ms/step
[I 2024-09-27 19:58:00,974] Trial 173 finished with value: 0.009682793785148944 and parameters: {'window_size': 2, 'batch_size': 32, 'network_type': 'LSTM', 'num_layers': 1, 'num_neurons': 128, 'learning_rate': 0.01, 'dropout_rate': 0.1}. Best is trial 131 with value: 0.00941323839442831.

1/3 [=========>....................] - ETA: 0s
3/3 [==============================] - 0s 3ms/step
[I 2024-09-27 19:58:05,777] Trial 174 finished with value: 0.009673863810552678 and parameters: {'window_size': 2, 'batch_size': 32, 'network_type': 'LSTM', 'num_layers': 1, 'num_neurons': 128, 'learning_rate': 0.01, 'dropout_rate': 0.1}. Best is trial 131 with value: 0.00941323839442831.

1/3 [=========>....................] - ETA: 0s
3/3 [==============================] - 0s 4ms/step
[I 2024-09-27 19:58:11,639] Trial 175 finished with value: 0.009419392098843215 and parameters: {'window_size': 2, 'batch_size': 32, 'network_type': 'LSTM', 'num_layers': 1, 'num_neurons': 128, 'learning_rate': 0.01, 'dropout_rate': 0.1}. Best is trial 131 with value: 0.00941323839442831.

1/3 [=========>....................] - ETA: 0s
3/3 [==============================] - 0s 3ms/step
[I 2024-09-27 19:58:16,410] Trial 176 finished with value: 0.009925294976838878 and parameters: {'window_size': 2, 'batch_size': 32, 'network_type': 'LSTM', 'num_layers': 1, 'num_neurons': 128, 'learning_rate': 0.01, 'dropout_rate': 0.1}. Best is trial 131 with value: 0.00941323839442831.

1/3 [=========>....................] - ETA: 0s
3/3 [==============================] - 0s 3ms/step
[I 2024-09-27 19:58:21,912] Trial 177 finished with value: 0.009930578483662134 and parameters: {'window_size': 2, 'batch_size': 32, 'network_type': 'LSTM', 'num_layers': 1, 'num_neurons': 128, 'learning_rate': 0.01, 'dropout_rate': 0.1}. Best is trial 131 with value: 0.00941323839442831.

1/3 [=========>....................] - ETA: 0s
3/3 [==============================] - 0s 3ms/step
[I 2024-09-27 19:58:28,722] Trial 178 finished with value: 0.009617898571659145 and parameters: {'window_size': 2, 'batch_size': 32, 'network_type': 'LSTM', 'num_layers': 1, 'num_neurons': 128, 'learning_rate': 0.01, 'dropout_rate': 0.1}. Best is trial 131 with value: 0.00941323839442831.

1/3 [=========>....................] - ETA: 0s
3/3 [==============================] - 0s 4ms/step
[I 2024-09-27 19:58:32,920] Trial 179 finished with value: 0.009877954936363328 and parameters: {'window_size': 2, 'batch_size': 32, 'network_type': 'RNN', 'num_layers': 1, 'num_neurons': 32, 'learning_rate': 0.01, 'dropout_rate': 0.1}. Best is trial 131 with value: 0.00941323839442831.

1/3 [=========>....................] - ETA: 0s
3/3 [==============================] - 0s 3ms/step
[I 2024-09-27 19:58:38,890] Trial 180 finished with value: 0.009646937202399886 and parameters: {'window_size': 2, 'batch_size': 16, 'network_type': 'LSTM', 'num_layers': 1, 'num_neurons': 128, 'learning_rate': 0.01, 'dropout_rate': 0.1}. Best is trial 131 with value: 0.00941323839442831.

1/3 [=========>....................] - ETA: 0s
3/3 [==============================] - 0s 3ms/step
[I 2024-09-27 19:58:59,321] Trial 181 finished with value: 0.009828916952643596 and parameters: {'window_size': 2, 'batch_size': 32, 'network_type': 'LSTM', 'num_layers': 1, 'num_neurons': 128, 'learning_rate': 0.01, 'dropout_rate': 0.1}. Best is trial 131 with value: 0.00941323839442831.

1/3 [=========>....................] - ETA: 0s
3/3 [==============================] - 0s 2ms/step
