[I 2024-09-27 19:43:49,302] Trial 70 finished with value: 0.009527320834952344 and parameters: {'window_size': 2, 'batch_size': 32, 'network_type': 'LSTM', 'num_layers': 2, 'num_neurons': 128, 'learning_rate': 0.01, 'dropout_rate': 0.1}. Best is trial 67 with value: 0.009445951347619719.

1/3 [=========>....................] - ETA: 0s
3/3 [==============================] - 0s 6ms/step
[I 2024-09-27 19:43:58,242] Trial 71 finished with value: 0.010294672257463697 and parameters: {'window_size': 2, 'batch_size': 32, 'network_type': 'LSTM', 'num_layers': 2, 'num_neurons': 128, 'learning_rate': 0.01, 'dropout_rate': 0.1}. Best is trial 67 with value: 0.009445951347619719.

1/3 [=========>....................] - ETA: 0s
3/3 [==============================] - 0s 5ms/step
[I 2024-09-27 19:44:05,752] Trial 72 finished with value: 0.010962804089129809 and parameters: {'window_size': 2, 'batch_size': 32, 'network_type': 'LSTM', 'num_layers': 2, 'num_neurons': 128, 'learning_rate': 0.01, 'dropout_rate': 0.1}. Best is trial 67 with value: 0.009445951347619719.

1/3 [=========>....................] - ETA: 0s
3/3 [==============================] - 0s 4ms/step
[I 2024-09-27 19:44:13,880] Trial 73 finished with value: 0.009736318997933832 and parameters: {'window_size': 2, 'batch_size': 32, 'network_type': 'LSTM', 'num_layers': 2, 'num_neurons': 128, 'learning_rate': 0.01, 'dropout_rate': 0.1}. Best is trial 67 with value: 0.009445951347619719.

1/3 [=========>....................] - ETA: 0s
3/3 [==============================] - 0s 4ms/step
[I 2024-09-27 19:44:27,621] Trial 74 finished with value: 0.009774579205983121 and parameters: {'window_size': 2, 'batch_size': 32, 'network_type': 'LSTM', 'num_layers': 2, 'num_neurons': 128, 'learning_rate': 0.01, 'dropout_rate': 0.1}. Best is trial 67 with value: 0.009445951347619719.

1/3 [=========>....................] - ETA: 0s
3/3 [==============================] - 0s 3ms/step
[I 2024-09-27 19:44:34,414] Trial 75 finished with value: 0.009920352062708896 and parameters: {'window_size': 2, 'batch_size': 32, 'network_type': 'LSTM', 'num_layers': 2, 'num_neurons': 128, 'learning_rate': 0.01, 'dropout_rate': 0.1}. Best is trial 67 with value: 0.009445951347619719.

1/3 [=========>....................] - ETA: 0s
3/3 [==============================] - 0s 8ms/step
[I 2024-09-27 19:44:38,389] Trial 76 finished with value: 0.010889751175759545 and parameters: {'window_size': 2, 'batch_size': 32, 'network_type': 'LSTM', 'num_layers': 1, 'num_neurons': 32, 'learning_rate': 0.01, 'dropout_rate': 0.1}. Best is trial 67 with value: 0.009445951347619719.

1/3 [=========>....................] - ETA: 0s
3/3 [==============================] - 0s 0s/step
[I 2024-09-27 19:44:42,661] Trial 77 finished with value: 0.010254119564110126 and parameters: {'window_size': 2, 'batch_size': 32, 'network_type': 'LSTM', 'num_layers': 1, 'num_neurons': 128, 'learning_rate': 0.01, 'dropout_rate': 0.2}. Best is trial 67 with value: 0.009445951347619719.

1/3 [=========>....................] - ETA: 1s
3/3 [==============================] - 1s 8ms/step
[I 2024-09-27 19:44:56,193] Trial 78 finished with value: 0.012541858365570289 and parameters: {'window_size': 4, 'batch_size': 64, 'network_type': 'GRU', 'num_layers': 3, 'num_neurons': 128, 'learning_rate': 0.01, 'dropout_rate': 0.1}. Best is trial 67 with value: 0.009445951347619719.

1/3 [=========>....................] - ETA: 0s
3/3 [==============================] - 0s 0s/step
[I 2024-09-27 19:45:01,098] Trial 79 finished with value: 0.009969585126554464 and parameters: {'window_size': 2, 'batch_size': 32, 'network_type': 'LSTM', 'num_layers': 1, 'num_neurons': 128, 'learning_rate': 0.01, 'dropout_rate': 0.1}. Best is trial 67 with value: 0.009445951347619719.

1/3 [=========>....................] - ETA: 1s
3/3 [==============================] - 1s 4ms/step
[I 2024-09-27 19:45:09,086] Trial 80 finished with value: 0.01027926361728722 and parameters: {'window_size': 2, 'batch_size': 32, 'network_type': 'LSTM', 'num_layers': 2, 'num_neurons': 128, 'learning_rate': 0.01, 'dropout_rate': 0.1}. Best is trial 67 with value: 0.009445951347619719.

1/3 [=========>....................] - ETA: 0s
3/3 [==============================] - 0s 0s/step
[I 2024-09-27 19:45:14,212] Trial 81 finished with value: 0.010336614511382413 and parameters: {'window_size': 2, 'batch_size': 32, 'network_type': 'LSTM', 'num_layers': 1, 'num_neurons': 128, 'learning_rate': 0.01, 'dropout_rate': 0.1}. Best is trial 67 with value: 0.009445951347619719.

1/3 [=========>....................] - ETA: 0s
3/3 [==============================] - 0s 0s/step
[I 2024-09-27 19:45:18,703] Trial 82 finished with value: 0.009749002241752519 and parameters: {'window_size': 2, 'batch_size': 32, 'network_type': 'LSTM', 'num_layers': 1, 'num_neurons': 128, 'learning_rate': 0.01, 'dropout_rate': 0.1}. Best is trial 67 with value: 0.009445951347619719.

1/3 [=========>....................] - ETA: 0s
3/3 [==============================] - 0s 0s/step
[I 2024-09-27 19:45:24,705] Trial 83 finished with value: 0.00975961703649709 and parameters: {'window_size': 2, 'batch_size': 32, 'network_type': 'LSTM', 'num_layers': 1, 'num_neurons': 128, 'learning_rate': 0.01, 'dropout_rate': 0.1}. Best is trial 67 with value: 0.009445951347619719.

1/3 [=========>....................] - ETA: 0s
3/3 [==============================] - 0s 3ms/step
[I 2024-09-27 19:45:29,480] Trial 84 finished with value: 0.00975032361124603 and parameters: {'window_size': 2, 'batch_size': 32, 'network_type': 'LSTM', 'num_layers': 1, 'num_neurons': 128, 'learning_rate': 0.01, 'dropout_rate': 0.1}. Best is trial 67 with value: 0.009445951347619719.

1/3 [=========>....................] - ETA: 0s
3/3 [==============================] - 0s 8ms/step
[I 2024-09-27 19:45:34,110] Trial 85 finished with value: 0.009723094402904243 and parameters: {'window_size': 2, 'batch_size': 32, 'network_type': 'LSTM', 'num_layers': 1, 'num_neurons': 128, 'learning_rate': 0.01, 'dropout_rate': 0.1}. Best is trial 67 with value: 0.009445951347619719.

1/3 [=========>....................] - ETA: 0s
3/3 [==============================] - 0s 0s/step
[I 2024-09-27 19:45:44,958] Trial 86 finished with value: 0.11607207197202762 and parameters: {'window_size': 2, 'batch_size': 32, 'network_type': 'LSTM', 'num_layers': 1, 'num_neurons': 16, 'learning_rate': 0.0001, 'dropout_rate': 0.1}. Best is trial 67 with value: 0.009445951347619719.

1/3 [=========>....................] - ETA: 0s
3/3 [==============================] - 0s 11ms/step
[I 2024-09-27 19:45:49,363] Trial 87 finished with value: 0.01019890687163447 and parameters: {'window_size': 2, 'batch_size': 32, 'network_type': 'RNN', 'num_layers': 1, 'num_neurons': 128, 'learning_rate': 0.01, 'dropout_rate': 0.3}. Best is trial 67 with value: 0.009445951347619719.

1/3 [=========>....................] - ETA: 0s
3/3 [==============================] - 0s 8ms/step
[I 2024-09-27 19:46:00,096] Trial 88 finished with value: 0.047375723372043016 and parameters: {'window_size': 2, 'batch_size': 32, 'network_type': 'LSTM', 'num_layers': 1, 'num_neurons': 64, 'learning_rate': 0.0001, 'dropout_rate': 0.1}. Best is trial 67 with value: 0.009445951347619719.

1/3 [=========>....................] - ETA: 1s
3/3 [==============================] - 1s 0s/step
[I 2024-09-27 19:46:09,044] Trial 89 finished with value: 0.009588563267613802 and parameters: {'window_size': 2, 'batch_size': 32, 'network_type': 'LSTM', 'num_layers': 1, 'num_neurons': 128, 'learning_rate': 0.01, 'dropout_rate': 0.1}. Best is trial 67 with value: 0.009445951347619719.

1/3 [=========>....................] - ETA: 1s
3/3 [==============================] - 1s 12ms/step
[I 2024-09-27 19:46:29,698] Trial 90 finished with value: 0.028661477010641524 and parameters: {'window_size': 6, 'batch_size': 64, 'network_type': 'LSTM', 'num_layers': 3, 'num_neurons': 32, 'learning_rate': 0.01, 'dropout_rate': 0.2}. Best is trial 67 with value: 0.009445951347619719.

1/3 [=========>....................] - ETA: 0s
3/3 [==============================] - 0s 3ms/step
[I 2024-09-27 19:46:34,543] Trial 91 finished with value: 0.010172657190913887 and parameters: {'window_size': 2, 'batch_size': 32, 'network_type': 'LSTM', 'num_layers': 1, 'num_neurons': 128, 'learning_rate': 0.01, 'dropout_rate': 0.1}. Best is trial 67 with value: 0.009445951347619719.

1/3 [=========>....................] - ETA: 0s
3/3 [==============================] - 0s 0s/step
[I 2024-09-27 19:46:40,576] Trial 92 finished with value: 0.01002004259405002 and parameters: {'window_size': 2, 'batch_size': 32, 'network_type': 'LSTM', 'num_layers': 1, 'num_neurons': 128, 'learning_rate': 0.01, 'dropout_rate': 0.1}. Best is trial 67 with value: 0.009445951347619719.

1/3 [=========>....................] - ETA: 0s
3/3 [==============================] - 0s 3ms/step
[I 2024-09-27 19:46:44,498] Trial 93 finished with value: 0.010303200157595354 and parameters: {'window_size': 2, 'batch_size': 32, 'network_type': 'LSTM', 'num_layers': 1, 'num_neurons': 128, 'learning_rate': 0.01, 'dropout_rate': 0.1}. Best is trial 67 with value: 0.009445951347619719.

1/3 [=========>....................] - ETA: 0s
3/3 [==============================] - 0s 3ms/step
[I 2024-09-27 19:46:50,689] Trial 94 finished with value: 0.009477712466683188 and parameters: {'window_size': 2, 'batch_size': 32, 'network_type': 'LSTM', 'num_layers': 1, 'num_neurons': 128, 'learning_rate': 0.01, 'dropout_rate': 0.1}. Best is trial 67 with value: 0.009445951347619719.

1/3 [=========>....................] - ETA: 0s
3/3 [==============================] - 0s 0s/step
[I 2024-09-27 19:46:55,702] Trial 95 finished with value: 0.00954034354988958 and parameters: {'window_size': 2, 'batch_size': 32, 'network_type': 'LSTM', 'num_layers': 1, 'num_neurons': 128, 'learning_rate': 0.01, 'dropout_rate': 0.1}. Best is trial 67 with value: 0.009445951347619719.

1/3 [=========>....................] - ETA: 0s
3/3 [==============================] - 0s 0s/step
[I 2024-09-27 19:47:02,027] Trial 96 finished with value: 0.0097088739972719 and parameters: {'window_size': 2, 'batch_size': 32, 'network_type': 'LSTM', 'num_layers': 1, 'num_neurons': 128, 'learning_rate': 0.01, 'dropout_rate': 0.1}. Best is trial 67 with value: 0.009445951347619719.

1/3 [=========>....................] - ETA: 0s
3/3 [==============================] - 0s 8ms/step
[I 2024-09-27 19:47:06,824] Trial 97 finished with value: 0.00984940971455104 and parameters: {'window_size': 2, 'batch_size': 32, 'network_type': 'LSTM', 'num_layers': 1, 'num_neurons': 64, 'learning_rate': 0.01, 'dropout_rate': 0.1}. Best is trial 67 with value: 0.009445951347619719.

1/3 [=========>....................] - ETA: 0s
3/3 [==============================] - 0s 0s/step
[I 2024-09-27 19:47:12,639] Trial 98 finished with value: 0.011335995024529057 and parameters: {'window_size': 4, 'batch_size': 32, 'network_type': 'LSTM', 'num_layers': 1, 'num_neurons': 128, 'learning_rate': 0.01, 'dropout_rate': 0.1}. Best is trial 67 with value: 0.009445951347619719.

1/3 [=========>....................] - ETA: 1s
3/3 [==============================] - 1s 7ms/step
[I 2024-09-27 19:47:20,152] Trial 99 finished with value: 0.010401475066870032 and parameters: {'window_size': 2, 'batch_size': 32, 'network_type': 'GRU', 'num_layers': 1, 'num_neurons': 128, 'learning_rate': 0.01, 'dropout_rate': 0.1}. Best is trial 67 with value: 0.009445951347619719.

1/3 [=========>....................] - ETA: 0s
3/3 [==============================] - 0s 0s/step
[I 2024-09-27 19:47:30,700] Trial 100 finished with value: 0.010492652073712418 and parameters: {'window_size': 2, 'batch_size': 32, 'network_type': 'RNN', 'num_layers': 2, 'num_neurons': 128, 'learning_rate': 0.01, 'dropout_rate': 0.1}. Best is trial 67 with value: 0.009445951347619719.

1/3 [=========>....................] - ETA: 0s
3/3 [==============================] - 0s 0s/step
[I 2024-09-27 19:47:37,221] Trial 101 finished with value: 0.009766578476193928 and parameters: {'window_size': 2, 'batch_size': 32, 'network_type': 'LSTM', 'num_layers': 1, 'num_neurons': 128, 'learning_rate': 0.01, 'dropout_rate': 0.1}. Best is trial 67 with value: 0.009445951347619719.

1/3 [=========>....................] - ETA: 0s
3/3 [==============================] - 0s 0s/step
[I 2024-09-27 19:47:43,347] Trial 102 finished with value: 0.009573619184359701 and parameters: {'window_size': 2, 'batch_size': 32, 'network_type': 'LSTM', 'num_layers': 1, 'num_neurons': 128, 'learning_rate': 0.01, 'dropout_rate': 0.1}. Best is trial 67 with value: 0.009445951347619719.

1/3 [=========>....................] - ETA: 0s
3/3 [==============================] - 0s 0s/step
[I 2024-09-27 19:47:47,965] Trial 103 finished with value: 0.009852279992170738 and parameters: {'window_size': 2, 'batch_size': 32, 'network_type': 'LSTM', 'num_layers': 1, 'num_neurons': 128, 'learning_rate': 0.01, 'dropout_rate': 0.1}. Best is trial 67 with value: 0.009445951347619719.

1/3 [=========>....................] - ETA: 0s
3/3 [==============================] - 0s 6ms/step
[I 2024-09-27 19:47:52,853] Trial 104 finished with value: 0.009592678637571739 and parameters: {'window_size': 2, 'batch_size': 32, 'network_type': 'LSTM', 'num_layers': 1, 'num_neurons': 128, 'learning_rate': 0.01, 'dropout_rate': 0.1}. Best is trial 67 with value: 0.009445951347619719.

1/3 [=========>....................] - ETA: 0s
3/3 [==============================] - 0s 4ms/step
[I 2024-09-27 19:47:57,091] Trial 105 finished with value: 0.010192060107916175 and parameters: {'window_size': 2, 'batch_size': 32, 'network_type': 'LSTM', 'num_layers': 1, 'num_neurons': 128, 'learning_rate': 0.01, 'dropout_rate': 0.1}. Best is trial 67 with value: 0.009445951347619719.

1/3 [=========>....................] - ETA: 0s
3/3 [==============================] - 0s 0s/step
[I 2024-09-27 19:48:02,320] Trial 106 finished with value: 0.0100284168149384 and parameters: {'window_size': 2, 'batch_size': 16, 'network_type': 'LSTM', 'num_layers': 1, 'num_neurons': 64, 'learning_rate': 0.01, 'dropout_rate': 0.3}. Best is trial 67 with value: 0.009445951347619719.

1/3 [=========>....................] - ETA: 0s
3/3 [==============================] - 0s 0s/step
[I 2024-09-27 19:48:07,365] Trial 107 finished with value: 0.009633243366026546 and parameters: {'window_size': 2, 'batch_size': 32, 'network_type': 'LSTM', 'num_layers': 1, 'num_neurons': 128, 'learning_rate': 0.01, 'dropout_rate': 0.1}. Best is trial 67 with value: 0.009445951347619719.

1/3 [=========>....................] - ETA: 0s
3/3 [==============================] - 0s 0s/step
[I 2024-09-27 19:48:12,648] Trial 108 finished with value: 0.013006112493685825 and parameters: {'window_size': 6, 'batch_size': 32, 'network_type': 'LSTM', 'num_layers': 1, 'num_neurons': 16, 'learning_rate': 0.01, 'dropout_rate': 0.1}. Best is trial 67 with value: 0.009445951347619719.

1/3 [=========>....................] - ETA: 1s
3/3 [==============================] - 1s 5ms/step
[I 2024-09-27 19:48:22,580] Trial 109 finished with value: 0.010950162897647267 and parameters: {'window_size': 2, 'batch_size': 32, 'network_type': 'LSTM', 'num_layers': 3, 'num_neurons': 128, 'learning_rate': 0.01, 'dropout_rate': 0.2}. Best is trial 67 with value: 0.009445951347619719.

1/3 [=========>....................] - ETA: 3s
3/3 [==============================] - 2s 11ms/step
[I 2024-09-27 19:48:33,153] Trial 110 finished with value: 0.010655665370779978 and parameters: {'window_size': 2, 'batch_size': 64, 'network_type': 'LSTM', 'num_layers': 2, 'num_neurons': 128, 'learning_rate': 0.01, 'dropout_rate': 0.1}. Best is trial 67 with value: 0.009445951347619719.

1/3 [=========>....................] - ETA: 1s
3/3 [==============================] - 1s 5ms/step
[I 2024-09-27 19:48:46,162] Trial 111 finished with value: 0.009484586567945888 and parameters: {'window_size': 2, 'batch_size': 32, 'network_type': 'LSTM', 'num_layers': 1, 'num_neurons': 128, 'learning_rate': 0.01, 'dropout_rate': 0.1}. Best is trial 67 with value: 0.009445951347619719.

1/3 [=========>....................] - ETA: 1s
3/3 [==============================] - 1s 5ms/step
[I 2024-09-27 19:48:57,479] Trial 112 finished with value: 0.009931955686757261 and parameters: {'window_size': 2, 'batch_size': 32, 'network_type': 'LSTM', 'num_layers': 1, 'num_neurons': 128, 'learning_rate': 0.01, 'dropout_rate': 0.1}. Best is trial 67 with value: 0.009445951347619719.

1/3 [=========>....................] - ETA: 1s
3/3 [==============================] - 1s 6ms/step
[I 2024-09-27 19:49:10,139] Trial 113 finished with value: 0.009521249720748042 and parameters: {'window_size': 2, 'batch_size': 32, 'network_type': 'LSTM', 'num_layers': 1, 'num_neurons': 128, 'learning_rate': 0.01, 'dropout_rate': 0.1}. Best is trial 67 with value: 0.009445951347619719.

1/3 [=========>....................] - ETA: 1s
3/3 [==============================] - 1s 7ms/step
[I 2024-09-27 19:49:21,331] Trial 114 finished with value: 0.009776358758899527 and parameters: {'window_size': 2, 'batch_size': 32, 'network_type': 'LSTM', 'num_layers': 1, 'num_neurons': 128, 'learning_rate': 0.01, 'dropout_rate': 0.1}. Best is trial 67 with value: 0.009445951347619719.

1/3 [=========>....................] - ETA: 1s
3/3 [==============================] - 1s 7ms/step
[I 2024-09-27 19:49:32,818] Trial 115 finished with value: 0.009693372501453884 and parameters: {'window_size': 2, 'batch_size': 32, 'network_type': 'LSTM', 'num_layers': 1, 'num_neurons': 128, 'learning_rate': 0.01, 'dropout_rate': 0.1}. Best is trial 67 with value: 0.009445951347619719.

1/3 [=========>....................] - ETA: 1s
3/3 [==============================] - 1s 5ms/step
[I 2024-09-27 19:49:44,682] Trial 116 finished with value: 0.00961456544970123 and parameters: {'window_size': 2, 'batch_size': 32, 'network_type': 'LSTM', 'num_layers': 1, 'num_neurons': 128, 'learning_rate': 0.01, 'dropout_rate': 0.1}. Best is trial 67 with value: 0.009445951347619719.

1/3 [=========>....................] - ETA: 1s
3/3 [==============================] - 1s 3ms/step
[I 2024-09-27 19:49:56,380] Trial 117 finished with value: 0.00948398959468788 and parameters: {'window_size': 2, 'batch_size': 32, 'network_type': 'LSTM', 'num_layers': 1, 'num_neurons': 32, 'learning_rate': 0.01, 'dropout_rate': 0.1}. Best is trial 67 with value: 0.009445951347619719.

1/3 [=========>....................] - ETA: 0s
3/3 [==============================] - 0s 3ms/step
[I 2024-09-27 19:50:07,753] Trial 118 finished with value: 0.010239406184873718 and parameters: {'window_size': 4, 'batch_size': 32, 'network_type': 'GRU', 'num_layers': 1, 'num_neurons': 32, 'learning_rate': 0.01, 'dropout_rate': 0.1}. Best is trial 67 with value: 0.009445951347619719.

1/3 [=========>....................] - ETA: 0s
3/3 [==============================] - 0s 0s/step
[I 2024-09-27 19:50:15,409] Trial 119 finished with value: 0.011448457570143148 and parameters: {'window_size': 2, 'batch_size': 32, 'network_type': 'LSTM', 'num_layers': 1, 'num_neurons': 32, 'learning_rate': 0.01, 'dropout_rate': 0.1}. Best is trial 67 with value: 0.009445951347619719.

1/3 [=========>....................] - ETA: 0s
3/3 [==============================] - 0s 0s/step
[I 2024-09-27 19:50:20,502] Trial 120 finished with value: 0.010673074178292719 and parameters: {'window_size': 2, 'batch_size': 32, 'network_type': 'LSTM', 'num_layers': 1, 'num_neurons': 32, 'learning_rate': 0.01, 'dropout_rate': 0.1}. Best is trial 67 with value: 0.009445951347619719.

1/3 [=========>....................] - ETA: 0s
3/3 [==============================] - 0s 0s/step
[I 2024-09-27 19:50:26,055] Trial 121 finished with value: 0.010976720121544851 and parameters: {'window_size': 2, 'batch_size': 32, 'network_type': 'LSTM', 'num_layers': 1, 'num_neurons': 32, 'learning_rate': 0.01, 'dropout_rate': 0.1}. Best is trial 67 with value: 0.009445951347619719.

1/3 [=========>....................] - ETA: 1s
3/3 [==============================] - 1s 10ms/step
[I 2024-09-27 19:51:30,857] Trial 122 finished with value: 0.009479361413230364 and parameters: {'window_size': 2, 'batch_size': 32, 'network_type': 'LSTM', 'num_layers': 1, 'num_neurons': 32, 'learning_rate': 0.01, 'dropout_rate': 0.1}. Best is trial 67 with value: 0.009445951347619719.

1/3 [=========>....................] - ETA: 1s
3/3 [==============================] - 1s 7ms/step
[I 2024-09-27 19:51:54,597] Trial 123 finished with value: 0.10597335690847585 and parameters: {'window_size': 2, 'batch_size': 32, 'network_type': 'LSTM', 'num_layers': 1, 'num_neurons': 32, 'learning_rate': 0.0001, 'dropout_rate': 0.1}. Best is trial 67 with value: 0.009445951347619719.

1/3 [=========>....................] - ETA: 0s
3/3 [==============================] - 0s 3ms/step
[I 2024-09-27 19:52:05,302] Trial 124 finished with value: 0.009581679001660418 and parameters: {'window_size': 2, 'batch_size': 32, 'network_type': 'LSTM', 'num_layers': 1, 'num_neurons': 32, 'learning_rate': 0.01, 'dropout_rate': 0.1}. Best is trial 67 with value: 0.009445951347619719.

1/3 [=========>....................] - ETA: 0s
3/3 [==============================] - 0s 3ms/step
[I 2024-09-27 19:52:15,058] Trial 125 finished with value: 0.00971134145159117 and parameters: {'window_size': 2, 'batch_size': 32, 'network_type': 'LSTM', 'num_layers': 1, 'num_neurons': 32, 'learning_rate': 0.01, 'dropout_rate': 0.1}. Best is trial 67 with value: 0.009445951347619719.

1/3 [=========>....................] - ETA: 1s
3/3 [==============================] - 1s 14ms/step
