[I 2024-09-27 22:41:34,312] Trial 65 finished with value: 0.16671287877219063 and parameters: {'window_size': 2, 'batch_size': 32, 'network_type': 'RNN', 'num_layers': 1, 'num_neurons': 32, 'learning_rate': 0.01, 'dropout_rate': 0.1}. Best is trial 15 with value: 0.16347541264125276.

1/1 [==============================] - ETA: 0s
1/1 [==============================] - 0s 200ms/step
[I 2024-09-27 22:41:37,316] Trial 66 finished with value: 0.21237503618943063 and parameters: {'window_size': 4, 'batch_size': 32, 'network_type': 'RNN', 'num_layers': 1, 'num_neurons': 32, 'learning_rate': 0.01, 'dropout_rate': 0.3}. Best is trial 15 with value: 0.16347541264125276.

1/1 [==============================] - ETA: 0s
1/1 [==============================] - 0s 263ms/step
[I 2024-09-27 22:41:40,770] Trial 67 finished with value: 0.27658802363986057 and parameters: {'window_size': 2, 'batch_size': 32, 'network_type': 'LSTM', 'num_layers': 1, 'num_neurons': 16, 'learning_rate': 0.01, 'dropout_rate': 0.2}. Best is trial 15 with value: 0.16347541264125276.

1/1 [==============================] - ETA: 0s
1/1 [==============================] - 0s 195ms/step
[I 2024-09-27 22:41:43,312] Trial 68 finished with value: 0.2265837392352876 and parameters: {'window_size': 2, 'batch_size': 32, 'network_type': 'RNN', 'num_layers': 1, 'num_neurons': 32, 'learning_rate': 0.01, 'dropout_rate': 0.1}. Best is trial 15 with value: 0.16347541264125276.

1/1 [==============================] - ETA: 0s
1/1 [==============================] - 0s 212ms/step
[I 2024-09-27 22:41:45,974] Trial 69 finished with value: 0.3864105103997623 and parameters: {'window_size': 6, 'batch_size': 64, 'network_type': 'RNN', 'num_layers': 1, 'num_neurons': 32, 'learning_rate': 0.01, 'dropout_rate': 0.1}. Best is trial 15 with value: 0.16347541264125276.

1/1 [==============================] - ETA: 0s
1/1 [==============================] - 0s 232ms/step
[I 2024-09-27 22:41:49,169] Trial 70 finished with value: 0.25743551177070245 and parameters: {'window_size': 2, 'batch_size': 16, 'network_type': 'GRU', 'num_layers': 1, 'num_neurons': 64, 'learning_rate': 0.01, 'dropout_rate': 0.1}. Best is trial 15 with value: 0.16347541264125276.

1/1 [==============================] - ETA: 0s
1/1 [==============================] - 0s 317ms/step
[I 2024-09-27 22:41:53,945] Trial 71 finished with value: 0.2986840331213814 and parameters: {'window_size': 2, 'batch_size': 32, 'network_type': 'RNN', 'num_layers': 2, 'num_neurons': 32, 'learning_rate': 0.0001, 'dropout_rate': 0.1}. Best is trial 15 with value: 0.16347541264125276.

1/1 [==============================] - ETA: 0s
1/1 [==============================] - 0s 470ms/step
[I 2024-09-27 22:42:08,181] Trial 72 finished with value: 0.19041372249239968 and parameters: {'window_size': 2, 'batch_size': 32, 'network_type': 'RNN', 'num_layers': 2, 'num_neurons': 32, 'learning_rate': 0.01, 'dropout_rate': 0.1}. Best is trial 15 with value: 0.16347541264125276.

1/1 [==============================] - ETA: 0s
1/1 [==============================] - 0s 295ms/step
[I 2024-09-27 22:42:12,547] Trial 73 finished with value: 0.2396394870394752 and parameters: {'window_size': 2, 'batch_size': 32, 'network_type': 'RNN', 'num_layers': 2, 'num_neurons': 32, 'learning_rate': 0.01, 'dropout_rate': 0.1}. Best is trial 15 with value: 0.16347541264125276.

1/1 [==============================] - ETA: 0s
1/1 [==============================] - 0s 301ms/step
[I 2024-09-27 22:42:16,931] Trial 74 finished with value: 0.17613359319596064 and parameters: {'window_size': 2, 'batch_size': 32, 'network_type': 'RNN', 'num_layers': 2, 'num_neurons': 32, 'learning_rate': 0.01, 'dropout_rate': 0.1}. Best is trial 15 with value: 0.16347541264125276.

1/1 [==============================] - ETA: 0s
1/1 [==============================] - 0s 448ms/step
[I 2024-09-27 22:42:22,893] Trial 75 finished with value: 0.21216771893274217 and parameters: {'window_size': 2, 'batch_size': 32, 'network_type': 'RNN', 'num_layers': 3, 'num_neurons': 128, 'learning_rate': 0.01, 'dropout_rate': 0.1}. Best is trial 15 with value: 0.16347541264125276.

1/1 [==============================] - ETA: 0s
1/1 [==============================] - 0s 250ms/step
[I 2024-09-27 22:42:26,029] Trial 76 finished with value: 0.2414886267071678 and parameters: {'window_size': 2, 'batch_size': 32, 'network_type': 'RNN', 'num_layers': 1, 'num_neurons': 32, 'learning_rate': 0.01, 'dropout_rate': 0.1}. Best is trial 15 with value: 0.16347541264125276.

1/1 [==============================] - ETA: 0s
1/1 [==============================] - 0s 301ms/step
[I 2024-09-27 22:42:30,147] Trial 77 finished with value: 0.21597401110331216 and parameters: {'window_size': 2, 'batch_size': 32, 'network_type': 'RNN', 'num_layers': 2, 'num_neurons': 32, 'learning_rate': 0.01, 'dropout_rate': 0.3}. Best is trial 15 with value: 0.16347541264125276.

1/1 [==============================] - ETA: 0s
1/1 [==============================] - 0s 301ms/step
[I 2024-09-27 22:42:34,372] Trial 78 finished with value: 0.1978187181381952 and parameters: {'window_size': 2, 'batch_size': 32, 'network_type': 'RNN', 'num_layers': 2, 'num_neurons': 32, 'learning_rate': 0.01, 'dropout_rate': 0.1}. Best is trial 15 with value: 0.16347541264125276.

1/1 [==============================] - ETA: 0s
1/1 [==============================] - 0s 371ms/step
[I 2024-09-27 22:42:39,321] Trial 79 finished with value: 0.35903235982593734 and parameters: {'window_size': 4, 'batch_size': 32, 'network_type': 'LSTM', 'num_layers': 2, 'num_neurons': 16, 'learning_rate': 0.01, 'dropout_rate': 0.2}. Best is trial 15 with value: 0.16347541264125276.

1/1 [==============================] - ETA: 0s
1/1 [==============================] - 0s 405ms/step
[I 2024-09-27 22:42:45,079] Trial 80 finished with value: 0.26361356785718126 and parameters: {'window_size': 6, 'batch_size': 64, 'network_type': 'RNN', 'num_layers': 2, 'num_neurons': 32, 'learning_rate': 0.01, 'dropout_rate': 0.1}. Best is trial 15 with value: 0.16347541264125276.

1/1 [==============================] - ETA: 0s
1/1 [==============================] - 0s 323ms/step
[I 2024-09-27 22:42:50,756] Trial 81 finished with value: 0.15957848367236907 and parameters: {'window_size': 2, 'batch_size': 32, 'network_type': 'RNN', 'num_layers': 2, 'num_neurons': 32, 'learning_rate': 0.01, 'dropout_rate': 0.1}. Best is trial 81 with value: 0.15957848367236907.

1/1 [==============================] - ETA: 0s
1/1 [==============================] - 0s 299ms/step
[I 2024-09-27 22:42:54,858] Trial 82 finished with value: 0.1934442429315476 and parameters: {'window_size': 2, 'batch_size': 32, 'network_type': 'RNN', 'num_layers': 2, 'num_neurons': 32, 'learning_rate': 0.01, 'dropout_rate': 0.1}. Best is trial 81 with value: 0.15957848367236907.

1/1 [==============================] - ETA: 0s
1/1 [==============================] - 0s 301ms/step
[I 2024-09-27 22:42:59,438] Trial 83 finished with value: 0.17602389063153948 and parameters: {'window_size': 2, 'batch_size': 32, 'network_type': 'RNN', 'num_layers': 2, 'num_neurons': 32, 'learning_rate': 0.01, 'dropout_rate': 0.1}. Best is trial 81 with value: 0.15957848367236907.

1/1 [==============================] - ETA: 0s
1/1 [==============================] - 0s 300ms/step
[I 2024-09-27 22:43:03,790] Trial 84 finished with value: 0.18982381520952496 and parameters: {'window_size': 2, 'batch_size': 32, 'network_type': 'RNN', 'num_layers': 2, 'num_neurons': 32, 'learning_rate': 0.01, 'dropout_rate': 0.1}. Best is trial 81 with value: 0.15957848367236907.

1/1 [==============================] - ETA: 0s
1/1 [==============================] - 0s 298ms/step
[I 2024-09-27 22:43:07,525] Trial 85 finished with value: 0.18668873732430594 and parameters: {'window_size': 2, 'batch_size': 32, 'network_type': 'RNN', 'num_layers': 2, 'num_neurons': 32, 'learning_rate': 0.01, 'dropout_rate': 0.1}. Best is trial 81 with value: 0.15957848367236907.

1/1 [==============================] - ETA: 0s
1/1 [==============================] - 0s 306ms/step
[I 2024-09-27 22:43:12,496] Trial 86 finished with value: 0.16161206358955016 and parameters: {'window_size': 2, 'batch_size': 32, 'network_type': 'RNN', 'num_layers': 2, 'num_neurons': 32, 'learning_rate': 0.01, 'dropout_rate': 0.1}. Best is trial 81 with value: 0.15957848367236907.

1/1 [==============================] - ETA: 0s
1/1 [==============================] - 0s 299ms/step
[I 2024-09-27 22:43:16,862] Trial 87 finished with value: 0.17537733809153236 and parameters: {'window_size': 2, 'batch_size': 32, 'network_type': 'RNN', 'num_layers': 2, 'num_neurons': 32, 'learning_rate': 0.01, 'dropout_rate': 0.1}. Best is trial 81 with value: 0.15957848367236907.

1/1 [==============================] - ETA: 0s
1/1 [==============================] - 0s 277ms/step
[I 2024-09-27 22:43:21,270] Trial 88 finished with value: 0.18386879557654967 and parameters: {'window_size': 2, 'batch_size': 16, 'network_type': 'GRU', 'num_layers': 1, 'num_neurons': 64, 'learning_rate': 0.01, 'dropout_rate': 0.1}. Best is trial 81 with value: 0.15957848367236907.

1/1 [==============================] - ETA: 0s
1/1 [==============================] - 0s 434ms/step
[I 2024-09-27 22:43:27,585] Trial 89 finished with value: 0.21099330307188488 and parameters: {'window_size': 2, 'batch_size': 32, 'network_type': 'RNN', 'num_layers': 3, 'num_neurons': 32, 'learning_rate': 0.01, 'dropout_rate': 0.1}. Best is trial 81 with value: 0.15957848367236907.

1/1 [==============================] - ETA: 0s
1/1 [==============================] - 0s 286ms/step
[I 2024-09-27 22:43:31,679] Trial 90 finished with value: 0.2262828501292637 and parameters: {'window_size': 2, 'batch_size': 32, 'network_type': 'RNN', 'num_layers': 2, 'num_neurons': 128, 'learning_rate': 0.01, 'dropout_rate': 0.1}. Best is trial 81 with value: 0.15957848367236907.

1/1 [==============================] - ETA: 0s
1/1 [==============================] - 0s 333ms/step
[I 2024-09-27 22:43:35,422] Trial 91 finished with value: 0.261494105884007 and parameters: {'window_size': 2, 'batch_size': 32, 'network_type': 'RNN', 'num_layers': 2, 'num_neurons': 32, 'learning_rate': 0.01, 'dropout_rate': 0.1}. Best is trial 81 with value: 0.15957848367236907.

1/1 [==============================] - ETA: 0s
1/1 [==============================] - 0s 301ms/step
[I 2024-09-27 22:43:39,191] Trial 92 finished with value: 0.20920615727560862 and parameters: {'window_size': 2, 'batch_size': 32, 'network_type': 'RNN', 'num_layers': 2, 'num_neurons': 32, 'learning_rate': 0.01, 'dropout_rate': 0.1}. Best is trial 81 with value: 0.15957848367236907.

1/1 [==============================] - ETA: 0s
1/1 [==============================] - 0s 301ms/step
[I 2024-09-27 22:43:43,135] Trial 93 finished with value: 0.19646743501935685 and parameters: {'window_size': 2, 'batch_size': 32, 'network_type': 'RNN', 'num_layers': 2, 'num_neurons': 32, 'learning_rate': 0.01, 'dropout_rate': 0.1}. Best is trial 81 with value: 0.15957848367236907.

1/1 [==============================] - ETA: 0s
1/1 [==============================] - 0s 289ms/step
[I 2024-09-27 22:43:48,065] Trial 94 finished with value: 0.1788195575532459 and parameters: {'window_size': 2, 'batch_size': 32, 'network_type': 'RNN', 'num_layers': 2, 'num_neurons': 32, 'learning_rate': 0.01, 'dropout_rate': 0.1}. Best is trial 81 with value: 0.15957848367236907.

1/1 [==============================] - ETA: 0s
1/1 [==============================] - 0s 309ms/step
[I 2024-09-27 22:43:52,155] Trial 95 finished with value: 0.19239139166332425 and parameters: {'window_size': 2, 'batch_size': 32, 'network_type': 'RNN', 'num_layers': 2, 'num_neurons': 32, 'learning_rate': 0.01, 'dropout_rate': 0.1}. Best is trial 81 with value: 0.15957848367236907.

1/1 [==============================] - ETA: 0s
1/1 [==============================] - 0s 379ms/step
[I 2024-09-27 22:43:57,385] Trial 96 finished with value: 0.18916293689182823 and parameters: {'window_size': 2, 'batch_size': 64, 'network_type': 'RNN', 'num_layers': 2, 'num_neurons': 32, 'learning_rate': 0.01, 'dropout_rate': 0.3}. Best is trial 81 with value: 0.15957848367236907.

1/1 [==============================] - ETA: 0s
1/1 [==============================] - 0s 440ms/step
[I 2024-09-27 22:44:03,741] Trial 97 finished with value: 0.339036086935746 and parameters: {'window_size': 4, 'batch_size': 32, 'network_type': 'LSTM', 'num_layers': 2, 'num_neurons': 32, 'learning_rate': 0.01, 'dropout_rate': 0.2}. Best is trial 81 with value: 0.15957848367236907.

1/1 [==============================] - ETA: 0s
1/1 [==============================] - 0s 300ms/step
[I 2024-09-27 22:44:09,066] Trial 98 finished with value: 0.1632741362707955 and parameters: {'window_size': 2, 'batch_size': 32, 'network_type': 'RNN', 'num_layers': 2, 'num_neurons': 64, 'learning_rate': 0.01, 'dropout_rate': 0.1}. Best is trial 81 with value: 0.15957848367236907.

1/1 [==============================] - ETA: 0s
1/1 [==============================] - 0s 285ms/step
[I 2024-09-27 22:44:12,890] Trial 99 finished with value: 0.1939157658531552 and parameters: {'window_size': 2, 'batch_size': 32, 'network_type': 'RNN', 'num_layers': 2, 'num_neurons': 64, 'learning_rate': 0.01, 'dropout_rate': 0.1}. Best is trial 81 with value: 0.15957848367236907.

1/1 [==============================] - ETA: 0s
1/1 [==============================] - 0s 410ms/step
[I 2024-09-27 22:44:16,862] Trial 100 finished with value: 0.29000657047944906 and parameters: {'window_size': 6, 'batch_size': 32, 'network_type': 'RNN', 'num_layers': 2, 'num_neurons': 64, 'learning_rate': 0.01, 'dropout_rate': 0.1}. Best is trial 81 with value: 0.15957848367236907.

1/1 [==============================] - ETA: 0s
1/1 [==============================] - 0s 301ms/step
[I 2024-09-27 22:44:20,607] Trial 101 finished with value: 0.202985067594619 and parameters: {'window_size': 2, 'batch_size': 32, 'network_type': 'RNN', 'num_layers': 2, 'num_neurons': 64, 'learning_rate': 0.01, 'dropout_rate': 0.1}. Best is trial 81 with value: 0.15957848367236907.

1/1 [==============================] - ETA: 0s
1/1 [==============================] - 0s 289ms/step
[I 2024-09-27 22:44:24,587] Trial 102 finished with value: 0.1982510754721505 and parameters: {'window_size': 2, 'batch_size': 32, 'network_type': 'RNN', 'num_layers': 2, 'num_neurons': 64, 'learning_rate': 0.01, 'dropout_rate': 0.1}. Best is trial 81 with value: 0.15957848367236907.

1/1 [==============================] - ETA: 0s
1/1 [==============================] - 0s 300ms/step
[I 2024-09-27 22:44:29,276] Trial 103 finished with value: 0.17648962002708796 and parameters: {'window_size': 2, 'batch_size': 32, 'network_type': 'RNN', 'num_layers': 2, 'num_neurons': 64, 'learning_rate': 0.01, 'dropout_rate': 0.1}. Best is trial 81 with value: 0.15957848367236907.

1/1 [==============================] - ETA: 0s
1/1 [==============================] - 0s 317ms/step
[I 2024-09-27 22:44:33,649] Trial 104 finished with value: 0.17860502551850815 and parameters: {'window_size': 2, 'batch_size': 32, 'network_type': 'RNN', 'num_layers': 2, 'num_neurons': 32, 'learning_rate': 0.01, 'dropout_rate': 0.1}. Best is trial 81 with value: 0.15957848367236907.

1/1 [==============================] - ETA: 0s
1/1 [==============================] - 0s 163ms/step
[I 2024-09-27 22:44:35,977] Trial 105 finished with value: 0.2770033885410853 and parameters: {'window_size': 2, 'batch_size': 64, 'network_type': 'RNN', 'num_layers': 1, 'num_neurons': 16, 'learning_rate': 0.01, 'dropout_rate': 0.1}. Best is trial 81 with value: 0.15957848367236907.

1/1 [==============================] - ETA: 0s
1/1 [==============================] - 0s 455ms/step
[I 2024-09-27 22:44:42,199] Trial 106 finished with value: 0.2916062710625784 and parameters: {'window_size': 2, 'batch_size': 32, 'network_type': 'GRU', 'num_layers': 2, 'num_neurons': 32, 'learning_rate': 0.01, 'dropout_rate': 0.1}. Best is trial 81 with value: 0.15957848367236907.

1/1 [==============================] - ETA: 0s
1/1 [==============================] - 0s 282ms/step
[I 2024-09-27 22:44:46,522] Trial 107 finished with value: 0.22004799411410378 and parameters: {'window_size': 2, 'batch_size': 16, 'network_type': 'RNN', 'num_layers': 2, 'num_neurons': 32, 'learning_rate': 0.01, 'dropout_rate': 0.1}. Best is trial 81 with value: 0.15957848367236907.

1/1 [==============================] - ETA: 0s
1/1 [==============================] - 0s 386ms/step
[I 2024-09-27 22:44:52,112] Trial 108 finished with value: 0.18038519832066124 and parameters: {'window_size': 2, 'batch_size': 32, 'network_type': 'RNN', 'num_layers': 3, 'num_neurons': 64, 'learning_rate': 0.01, 'dropout_rate': 0.1}. Best is trial 81 with value: 0.15957848367236907.

1/1 [==============================] - ETA: 0s
1/1 [==============================] - 0s 301ms/step
[I 2024-09-27 22:44:55,841] Trial 109 finished with value: 0.268591250646682 and parameters: {'window_size': 2, 'batch_size': 32, 'network_type': 'RNN', 'num_layers': 2, 'num_neurons': 32, 'learning_rate': 0.0001, 'dropout_rate': 0.1}. Best is trial 81 with value: 0.15957848367236907.

1/1 [==============================] - ETA: 0s
1/1 [==============================] - 0s 174ms/step
[I 2024-09-27 22:44:58,135] Trial 110 finished with value: 0.20321038940974642 and parameters: {'window_size': 2, 'batch_size': 32, 'network_type': 'RNN', 'num_layers': 1, 'num_neurons': 32, 'learning_rate': 0.01, 'dropout_rate': 0.1}. Best is trial 81 with value: 0.15957848367236907.

1/1 [==============================] - ETA: 0s
1/1 [==============================] - 0s 284ms/step
[I 2024-09-27 22:45:02,150] Trial 111 finished with value: 0.1768331220717657 and parameters: {'window_size': 2, 'batch_size': 32, 'network_type': 'RNN', 'num_layers': 2, 'num_neurons': 32, 'learning_rate': 0.01, 'dropout_rate': 0.1}. Best is trial 81 with value: 0.15957848367236907.

1/1 [==============================] - ETA: 0s
1/1 [==============================] - 0s 298ms/step
[I 2024-09-27 22:45:06,020] Trial 112 finished with value: 0.1864663715816679 and parameters: {'window_size': 2, 'batch_size': 32, 'network_type': 'RNN', 'num_layers': 2, 'num_neurons': 32, 'learning_rate': 0.01, 'dropout_rate': 0.1}. Best is trial 81 with value: 0.15957848367236907.

1/1 [==============================] - ETA: 0s
1/1 [==============================] - 0s 332ms/step
[I 2024-09-27 22:45:09,731] Trial 113 finished with value: 0.23664893486386246 and parameters: {'window_size': 2, 'batch_size': 32, 'network_type': 'RNN', 'num_layers': 2, 'num_neurons': 32, 'learning_rate': 0.01, 'dropout_rate': 0.1}. Best is trial 81 with value: 0.15957848367236907.

1/1 [==============================] - ETA: 0s
1/1 [==============================] - 10s 10s/step
[I 2024-09-27 22:45:22,786] Trial 114 finished with value: 0.20991292817252022 and parameters: {'window_size': 2, 'batch_size': 32, 'network_type': 'RNN', 'num_layers': 2, 'num_neurons': 32, 'learning_rate': 0.01, 'dropout_rate': 0.1}. Best is trial 81 with value: 0.15957848367236907.

1/1 [==============================] - ETA: 0s
1/1 [==============================] - 0s 322ms/step
[I 2024-09-27 22:45:26,717] Trial 115 finished with value: 0.3038226857866559 and parameters: {'window_size': 2, 'batch_size': 32, 'network_type': 'RNN', 'num_layers': 2, 'num_neurons': 128, 'learning_rate': 0.0001, 'dropout_rate': 0.1}. Best is trial 81 with value: 0.15957848367236907.

1/1 [==============================] - ETA: 0s
1/1 [==============================] - 0s 298ms/step
[I 2024-09-27 22:45:30,997] Trial 116 finished with value: 0.2072689003263201 and parameters: {'window_size': 2, 'batch_size': 64, 'network_type': 'RNN', 'num_layers': 2, 'num_neurons': 32, 'learning_rate': 0.01, 'dropout_rate': 0.3}. Best is trial 81 with value: 0.15957848367236907.

1/1 [==============================] - ETA: 0s
1/1 [==============================] - 0s 370ms/step
[I 2024-09-27 22:45:35,524] Trial 117 finished with value: 0.3064067703882853 and parameters: {'window_size': 2, 'batch_size': 32, 'network_type': 'LSTM', 'num_layers': 2, 'num_neurons': 32, 'learning_rate': 0.01, 'dropout_rate': 0.2}. Best is trial 81 with value: 0.15957848367236907.

1/1 [==============================] - ETA: 0s
1/1 [==============================] - 0s 314ms/step
[I 2024-09-27 22:45:39,175] Trial 118 finished with value: 0.2201838516436125 and parameters: {'window_size': 4, 'batch_size': 32, 'network_type': 'RNN', 'num_layers': 2, 'num_neurons': 32, 'learning_rate': 0.01, 'dropout_rate': 0.1}. Best is trial 81 with value: 0.15957848367236907.

1/1 [==============================] - ETA: 0s
1/1 [==============================] - 0s 284ms/step
[I 2024-09-27 22:45:43,014] Trial 119 finished with value: 0.2125278926122756 and parameters: {'window_size': 2, 'batch_size': 32, 'network_type': 'RNN', 'num_layers': 2, 'num_neurons': 64, 'learning_rate': 0.01, 'dropout_rate': 0.1}. Best is trial 81 with value: 0.15957848367236907.

1/1 [==============================] - ETA: 0s
1/1 [==============================] - 0s 293ms/step
[I 2024-09-27 22:45:47,204] Trial 120 finished with value: 0.19394437520644242 and parameters: {'window_size': 6, 'batch_size': 32, 'network_type': 'RNN', 'num_layers': 2, 'num_neurons': 32, 'learning_rate': 0.01, 'dropout_rate': 0.1}. Best is trial 81 with value: 0.15957848367236907.

1/1 [==============================] - ETA: 0s
1/1 [==============================] - 0s 316ms/step
