[I 2024-09-27 20:30:48,933] Trial 60 finished with value: 0.012676676705479617 and parameters: {'window_size': 6, 'batch_size': 16, 'network_type': 'GRU', 'num_layers': 3, 'num_neurons': 64, 'learning_rate': 0.01, 'dropout_rate': 0.3}. Best is trial 54 with value: 0.010740319564938544.

1/2 [==============>...............] - ETA: 0s
2/2 [==============================] - 0s 0s/step
[I 2024-09-27 20:31:01,777] Trial 61 finished with value: 0.012430301174521435 and parameters: {'window_size': 6, 'batch_size': 32, 'network_type': 'GRU', 'num_layers': 2, 'num_neurons': 64, 'learning_rate': 0.01, 'dropout_rate': 0.2}. Best is trial 54 with value: 0.010740319564938544.

1/2 [==============>...............] - ETA: 0s
2/2 [==============================] - 1s 5ms/step
[I 2024-09-27 20:31:13,098] Trial 62 finished with value: 0.011698547189434366 and parameters: {'window_size': 6, 'batch_size': 32, 'network_type': 'GRU', 'num_layers': 2, 'num_neurons': 64, 'learning_rate': 0.01, 'dropout_rate': 0.2}. Best is trial 54 with value: 0.010740319564938544.

1/2 [==============>...............] - ETA: 0s
2/2 [==============================] - 1s 8ms/step
[I 2024-09-27 20:31:25,375] Trial 63 finished with value: 0.012197246198852854 and parameters: {'window_size': 6, 'batch_size': 32, 'network_type': 'GRU', 'num_layers': 2, 'num_neurons': 64, 'learning_rate': 0.01, 'dropout_rate': 0.2}. Best is trial 54 with value: 0.010740319564938544.

1/2 [==============>...............] - ETA: 0s
2/2 [==============================] - 1s 8ms/step
[I 2024-09-27 20:31:34,929] Trial 64 finished with value: 0.012069907923539484 and parameters: {'window_size': 6, 'batch_size': 32, 'network_type': 'GRU', 'num_layers': 2, 'num_neurons': 64, 'learning_rate': 0.01, 'dropout_rate': 0.2}. Best is trial 54 with value: 0.010740319564938544.

1/2 [==============>...............] - ETA: 0s
2/2 [==============================] - 0s 8ms/step
[I 2024-09-27 20:31:42,407] Trial 65 finished with value: 0.011224404285351436 and parameters: {'window_size': 6, 'batch_size': 32, 'network_type': 'RNN', 'num_layers': 2, 'num_neurons': 64, 'learning_rate': 0.01, 'dropout_rate': 0.2}. Best is trial 54 with value: 0.010740319564938544.

1/2 [==============>...............] - ETA: 0s
2/2 [==============================] - 0s 16ms/step
[I 2024-09-27 20:31:50,074] Trial 66 finished with value: 0.025872281160354626 and parameters: {'window_size': 4, 'batch_size': 16, 'network_type': 'RNN', 'num_layers': 2, 'num_neurons': 16, 'learning_rate': 0.01, 'dropout_rate': 0.2}. Best is trial 54 with value: 0.010740319564938544.

1/2 [==============>...............] - ETA: 0s
2/2 [==============================] - 0s 0s/step
[I 2024-09-27 20:32:41,105] Trial 67 finished with value: 0.01443871943155925 and parameters: {'window_size': 6, 'batch_size': 32, 'network_type': 'RNN', 'num_layers': 2, 'num_neurons': 64, 'learning_rate': 0.01, 'dropout_rate': 0.2}. Best is trial 54 with value: 0.010740319564938544.

1/2 [==============>...............] - ETA: 0s
2/2 [==============================] - 0s 0s/step
[I 2024-09-27 20:32:47,727] Trial 68 finished with value: 0.012199439724286392 and parameters: {'window_size': 6, 'batch_size': 16, 'network_type': 'RNN', 'num_layers': 2, 'num_neurons': 64, 'learning_rate': 0.01, 'dropout_rate': 0.2}. Best is trial 54 with value: 0.010740319564938544.

1/2 [==============>...............] - ETA: 0s
2/2 [==============================] - 0s 0s/step
[I 2024-09-27 20:32:53,622] Trial 69 finished with value: 0.020022199312845875 and parameters: {'window_size': 6, 'batch_size': 32, 'network_type': 'RNN', 'num_layers': 2, 'num_neurons': 128, 'learning_rate': 0.01, 'dropout_rate': 0.2}. Best is trial 54 with value: 0.010740319564938544.

1/2 [==============>...............] - ETA: 0s
2/2 [==============================] - 0s 0s/step
[I 2024-09-27 20:32:58,292] Trial 70 finished with value: 0.015769380285189708 and parameters: {'window_size': 2, 'batch_size': 16, 'network_type': 'RNN', 'num_layers': 1, 'num_neurons': 64, 'learning_rate': 0.01, 'dropout_rate': 0.2}. Best is trial 54 with value: 0.010740319564938544.

1/2 [==============>...............] - ETA: 0s
2/2 [==============================] - 0s 0s/step
[I 2024-09-27 20:33:04,505] Trial 71 finished with value: 0.013562851468722029 and parameters: {'window_size': 6, 'batch_size': 32, 'network_type': 'RNN', 'num_layers': 2, 'num_neurons': 64, 'learning_rate': 0.01, 'dropout_rate': 0.2}. Best is trial 54 with value: 0.010740319564938544.

1/2 [==============>...............] - ETA: 0s
2/2 [==============================] - 0s 0s/step
[I 2024-09-27 20:33:11,951] Trial 72 finished with value: 0.012614387392997745 and parameters: {'window_size': 6, 'batch_size': 32, 'network_type': 'GRU', 'num_layers': 2, 'num_neurons': 64, 'learning_rate': 0.01, 'dropout_rate': 0.2}. Best is trial 54 with value: 0.010740319564938544.

1/2 [==============>...............] - ETA: 0s
2/2 [==============================] - 0s 0s/step
[I 2024-09-27 20:33:17,582] Trial 73 finished with value: 0.02404558983941874 and parameters: {'window_size': 6, 'batch_size': 32, 'network_type': 'RNN', 'num_layers': 2, 'num_neurons': 64, 'learning_rate': 0.01, 'dropout_rate': 0.2}. Best is trial 54 with value: 0.010740319564938544.

1/2 [==============>...............] - ETA: 0s
2/2 [==============================] - 0s 16ms/step
[I 2024-09-27 20:33:25,417] Trial 74 finished with value: 0.011208673025170965 and parameters: {'window_size': 6, 'batch_size': 32, 'network_type': 'GRU', 'num_layers': 2, 'num_neurons': 64, 'learning_rate': 0.01, 'dropout_rate': 0.2}. Best is trial 54 with value: 0.010740319564938544.

1/2 [==============>...............] - ETA: 0s
2/2 [==============================] - 0s 0s/step
[I 2024-09-27 20:33:41,693] Trial 75 finished with value: 0.017213587045669564 and parameters: {'window_size': 6, 'batch_size': 64, 'network_type': 'LSTM', 'num_layers': 2, 'num_neurons': 64, 'learning_rate': 0.01, 'dropout_rate': 0.2}. Best is trial 54 with value: 0.010740319564938544.

1/2 [==============>...............] - ETA: 0s
2/2 [==============================] - 0s 0s/step
[I 2024-09-27 20:33:46,485] Trial 76 finished with value: 0.026642764072418227 and parameters: {'window_size': 4, 'batch_size': 32, 'network_type': 'RNN', 'num_layers': 2, 'num_neurons': 64, 'learning_rate': 0.01, 'dropout_rate': 0.3}. Best is trial 54 with value: 0.010740319564938544.

1/2 [==============>...............] - ETA: 0s
2/2 [==============================] - 1s 16ms/step
[I 2024-09-27 20:34:00,426] Trial 77 finished with value: 0.01211726844807466 and parameters: {'window_size': 6, 'batch_size': 16, 'network_type': 'GRU', 'num_layers': 3, 'num_neurons': 32, 'learning_rate': 0.01, 'dropout_rate': 0.2}. Best is trial 54 with value: 0.010740319564938544.

1/2 [==============>...............] - ETA: 0s
2/2 [==============================] - 0s 0s/step
[I 2024-09-27 20:34:05,840] Trial 78 finished with value: 0.011520796075463293 and parameters: {'window_size': 6, 'batch_size': 32, 'network_type': 'RNN', 'num_layers': 2, 'num_neurons': 64, 'learning_rate': 0.01, 'dropout_rate': 0.1}. Best is trial 54 with value: 0.010740319564938544.

1/2 [==============>...............] - ETA: 0s
2/2 [==============================] - 1s 16ms/step
[I 2024-09-27 20:34:17,888] Trial 79 finished with value: 0.01698049640655518 and parameters: {'window_size': 6, 'batch_size': 32, 'network_type': 'GRU', 'num_layers': 2, 'num_neurons': 16, 'learning_rate': 0.01, 'dropout_rate': 0.2}. Best is trial 54 with value: 0.010740319564938544.

1/2 [==============>...............] - ETA: 0s
2/2 [==============================] - 1s 16ms/step
[I 2024-09-27 20:34:23,294] Trial 80 finished with value: 0.017474524273872364 and parameters: {'window_size': 4, 'batch_size': 16, 'network_type': 'RNN', 'num_layers': 2, 'num_neurons': 64, 'learning_rate': 0.01, 'dropout_rate': 0.2}. Best is trial 54 with value: 0.010740319564938544.

1/2 [==============>...............] - ETA: 0s
2/2 [==============================] - 0s 0s/step
[I 2024-09-27 20:34:32,388] Trial 81 finished with value: 0.011965870370467499 and parameters: {'window_size': 6, 'batch_size': 32, 'network_type': 'GRU', 'num_layers': 2, 'num_neurons': 64, 'learning_rate': 0.01, 'dropout_rate': 0.2}. Best is trial 54 with value: 0.010740319564938544.

1/2 [==============>...............] - ETA: 0s
2/2 [==============================] - 0s 0s/step
[I 2024-09-27 20:34:41,456] Trial 82 finished with value: 0.014533405318856248 and parameters: {'window_size': 6, 'batch_size': 32, 'network_type': 'GRU', 'num_layers': 2, 'num_neurons': 64, 'learning_rate': 0.01, 'dropout_rate': 0.2}. Best is trial 54 with value: 0.010740319564938544.

1/2 [==============>...............] - ETA: 0s
2/2 [==============================] - 0s 0s/step
[I 2024-09-27 20:34:50,824] Trial 83 finished with value: 0.01709879230459532 and parameters: {'window_size': 6, 'batch_size': 32, 'network_type': 'GRU', 'num_layers': 2, 'num_neurons': 64, 'learning_rate': 0.01, 'dropout_rate': 0.2}. Best is trial 54 with value: 0.010740319564938544.

1/2 [==============>...............] - ETA: 0s
2/2 [==============================] - 1s 16ms/step
[I 2024-09-27 20:35:00,521] Trial 84 finished with value: 0.013737974966565774 and parameters: {'window_size': 6, 'batch_size': 32, 'network_type': 'GRU', 'num_layers': 2, 'num_neurons': 64, 'learning_rate': 0.01, 'dropout_rate': 0.2}. Best is trial 54 with value: 0.010740319564938544.

1/2 [==============>...............] - ETA: 0s
2/2 [==============================] - 0s 0s/step
[I 2024-09-27 20:35:10,006] Trial 85 finished with value: 0.01088844187557697 and parameters: {'window_size': 6, 'batch_size': 32, 'network_type': 'GRU', 'num_layers': 2, 'num_neurons': 64, 'learning_rate': 0.01, 'dropout_rate': 0.2}. Best is trial 54 with value: 0.010740319564938544.

1/2 [==============>...............] - ETA: 0s
2/2 [==============================] - 0s 0s/step
[I 2024-09-27 20:35:19,649] Trial 86 finished with value: 0.015179538945357009 and parameters: {'window_size': 6, 'batch_size': 32, 'network_type': 'GRU', 'num_layers': 2, 'num_neurons': 64, 'learning_rate': 0.01, 'dropout_rate': 0.2}. Best is trial 54 with value: 0.010740319564938544.

1/2 [==============>...............] - ETA: 0s
2/2 [==============================] - 0s 0s/step
[I 2024-09-27 20:35:26,343] Trial 87 finished with value: 0.019222927932937946 and parameters: {'window_size': 6, 'batch_size': 16, 'network_type': 'LSTM', 'num_layers': 1, 'num_neurons': 64, 'learning_rate': 0.01, 'dropout_rate': 0.2}. Best is trial 54 with value: 0.010740319564938544.

1/2 [==============>...............] - ETA: 0s
2/2 [==============================] - 1s 0s/step
[I 2024-09-27 20:35:34,399] Trial 88 finished with value: 0.014366791509664982 and parameters: {'window_size': 2, 'batch_size': 64, 'network_type': 'GRU', 'num_layers': 2, 'num_neurons': 64, 'learning_rate': 0.01, 'dropout_rate': 0.2}. Best is trial 54 with value: 0.010740319564938544.

1/2 [==============>...............] - ETA: 0s
2/2 [==============================] - 0s 0s/step
[I 2024-09-27 20:35:41,512] Trial 89 finished with value: 0.014658738389611237 and parameters: {'window_size': 6, 'batch_size': 32, 'network_type': 'RNN', 'num_layers': 2, 'num_neurons': 128, 'learning_rate': 0.01, 'dropout_rate': 0.3}. Best is trial 54 with value: 0.010740319564938544.

1/2 [==============>...............] - ETA: 0s
2/2 [==============================] - 1s 10ms/step
[I 2024-09-27 20:35:54,266] Trial 90 finished with value: 0.0153095987176895 and parameters: {'window_size': 4, 'batch_size': 16, 'network_type': 'GRU', 'num_layers': 3, 'num_neurons': 32, 'learning_rate': 0.01, 'dropout_rate': 0.2}. Best is trial 54 with value: 0.010740319564938544.

1/2 [==============>...............] - ETA: 0s
2/2 [==============================] - 0s 0s/step
[I 2024-09-27 20:36:01,654] Trial 91 finished with value: 0.010914782767494515 and parameters: {'window_size': 6, 'batch_size': 32, 'network_type': 'GRU', 'num_layers': 2, 'num_neurons': 64, 'learning_rate': 0.01, 'dropout_rate': 0.2}. Best is trial 54 with value: 0.010740319564938544.

1/2 [==============>...............] - ETA: 0s
2/2 [==============================] - 1s 0s/step
[I 2024-09-27 20:36:10,267] Trial 92 finished with value: 0.0133297613610824 and parameters: {'window_size': 6, 'batch_size': 32, 'network_type': 'GRU', 'num_layers': 2, 'num_neurons': 64, 'learning_rate': 0.01, 'dropout_rate': 0.2}. Best is trial 54 with value: 0.010740319564938544.

1/2 [==============>...............] - ETA: 0s
2/2 [==============================] - 1s 0s/step
[I 2024-09-27 20:36:23,013] Trial 93 finished with value: 0.014478284607330963 and parameters: {'window_size': 6, 'batch_size': 32, 'network_type': 'GRU', 'num_layers': 2, 'num_neurons': 64, 'learning_rate': 0.01, 'dropout_rate': 0.2}. Best is trial 54 with value: 0.010740319564938544.

1/2 [==============>...............] - ETA: 0s
2/2 [==============================] - 0s 0s/step
[I 2024-09-27 20:36:34,388] Trial 94 finished with value: 0.01093800733486811 and parameters: {'window_size': 6, 'batch_size': 32, 'network_type': 'GRU', 'num_layers': 2, 'num_neurons': 64, 'learning_rate': 0.01, 'dropout_rate': 0.2}. Best is trial 54 with value: 0.010740319564938544.

1/2 [==============>...............] - ETA: 0s
2/2 [==============================] - 0s 0s/step
[I 2024-09-27 20:36:43,875] Trial 95 finished with value: 0.011174357508619627 and parameters: {'window_size': 6, 'batch_size': 32, 'network_type': 'GRU', 'num_layers': 2, 'num_neurons': 64, 'learning_rate': 0.01, 'dropout_rate': 0.2}. Best is trial 54 with value: 0.010740319564938544.

1/2 [==============>...............] - ETA: 0s
2/2 [==============================] - 0s 10ms/step
[I 2024-09-27 20:36:52,523] Trial 96 finished with value: 0.019763860017061242 and parameters: {'window_size': 6, 'batch_size': 32, 'network_type': 'GRU', 'num_layers': 2, 'num_neurons': 64, 'learning_rate': 0.01, 'dropout_rate': 0.2}. Best is trial 54 with value: 0.010740319564938544.

1/2 [==============>...............] - ETA: 0s
2/2 [==============================] - 0s 8ms/step
[I 2024-09-27 20:37:03,652] Trial 97 finished with value: 0.018546789606412258 and parameters: {'window_size': 6, 'batch_size': 32, 'network_type': 'GRU', 'num_layers': 2, 'num_neurons': 64, 'learning_rate': 0.01, 'dropout_rate': 0.2}. Best is trial 54 with value: 0.010740319564938544.

1/2 [==============>...............] - ETA: 0s
2/2 [==============================] - 0s 0s/step
[I 2024-09-27 20:37:12,053] Trial 98 finished with value: 0.01199446651836237 and parameters: {'window_size': 6, 'batch_size': 32, 'network_type': 'GRU', 'num_layers': 2, 'num_neurons': 64, 'learning_rate': 0.01, 'dropout_rate': 0.2}. Best is trial 54 with value: 0.010740319564938544.

1/2 [==============>...............] - ETA: 0s
2/2 [==============================] - 0s 0s/step
[I 2024-09-27 20:37:21,516] Trial 99 finished with value: 0.011824206605553632 and parameters: {'window_size': 6, 'batch_size': 32, 'network_type': 'GRU', 'num_layers': 2, 'num_neurons': 64, 'learning_rate': 0.01, 'dropout_rate': 0.1}. Best is trial 54 with value: 0.010740319564938544.

1/2 [==============>...............] - ETA: 0s
2/2 [==============================] - 0s 0s/step
[I 2024-09-27 20:37:29,949] Trial 100 finished with value: 0.010794936016201975 and parameters: {'window_size': 6, 'batch_size': 32, 'network_type': 'GRU', 'num_layers': 2, 'num_neurons': 64, 'learning_rate': 0.01, 'dropout_rate': 0.2}. Best is trial 54 with value: 0.010740319564938544.

1/2 [==============>...............] - ETA: 0s
2/2 [==============================] - 1s 0s/step
[I 2024-09-27 20:37:39,272] Trial 101 finished with value: 0.015434521297613786 and parameters: {'window_size': 6, 'batch_size': 32, 'network_type': 'GRU', 'num_layers': 2, 'num_neurons': 64, 'learning_rate': 0.01, 'dropout_rate': 0.2}. Best is trial 54 with value: 0.010740319564938544.

1/2 [==============>...............] - ETA: 0s
2/2 [==============================] - 0s 0s/step
[I 2024-09-27 20:37:48,864] Trial 102 finished with value: 0.014645528410871828 and parameters: {'window_size': 6, 'batch_size': 32, 'network_type': 'GRU', 'num_layers': 2, 'num_neurons': 64, 'learning_rate': 0.01, 'dropout_rate': 0.2}. Best is trial 54 with value: 0.010740319564938544.

1/2 [==============>...............] - ETA: 0s
2/2 [==============================] - 0s 0s/step
[I 2024-09-27 20:37:56,535] Trial 103 finished with value: 0.010646479258934657 and parameters: {'window_size': 6, 'batch_size': 32, 'network_type': 'GRU', 'num_layers': 2, 'num_neurons': 64, 'learning_rate': 0.01, 'dropout_rate': 0.2}. Best is trial 103 with value: 0.010646479258934657.

1/2 [==============>...............] - ETA: 0s
2/2 [==============================] - 0s 7ms/step
[I 2024-09-27 20:38:08,230] Trial 104 finished with value: 0.040596445505817744 and parameters: {'window_size': 6, 'batch_size': 32, 'network_type': 'GRU', 'num_layers': 2, 'num_neurons': 64, 'learning_rate': 0.0001, 'dropout_rate': 0.2}. Best is trial 103 with value: 0.010646479258934657.

1/2 [==============>...............] - ETA: 0s
2/2 [==============================] - 1s 16ms/step
[I 2024-09-27 20:38:19,710] Trial 105 finished with value: 0.010857738748192786 and parameters: {'window_size': 6, 'batch_size': 32, 'network_type': 'GRU', 'num_layers': 2, 'num_neurons': 64, 'learning_rate': 0.01, 'dropout_rate': 0.2}. Best is trial 103 with value: 0.010646479258934657.

1/2 [==============>...............] - ETA: 0s
2/2 [==============================] - 1s 16ms/step
[I 2024-09-27 20:38:31,528] Trial 106 finished with value: 0.02230708553890388 and parameters: {'window_size': 6, 'batch_size': 32, 'network_type': 'GRU', 'num_layers': 2, 'num_neurons': 16, 'learning_rate': 0.01, 'dropout_rate': 0.2}. Best is trial 103 with value: 0.010646479258934657.

1/2 [==============>...............] - ETA: 0s
2/2 [==============================] - 0s 0s/step
[I 2024-09-27 20:38:40,994] Trial 107 finished with value: 0.013139233425259592 and parameters: {'window_size': 6, 'batch_size': 32, 'network_type': 'GRU', 'num_layers': 2, 'num_neurons': 64, 'learning_rate': 0.01, 'dropout_rate': 0.2}. Best is trial 103 with value: 0.010646479258934657.

1/2 [==============>...............] - ETA: 0s
2/2 [==============================] - 1s 0s/step
[I 2024-09-27 20:38:59,587] Trial 108 finished with value: 0.014065661335984872 and parameters: {'window_size': 6, 'batch_size': 32, 'network_type': 'GRU', 'num_layers': 2, 'num_neurons': 64, 'learning_rate': 0.01, 'dropout_rate': 0.2}. Best is trial 103 with value: 0.010646479258934657.

1/2 [==============>...............] - ETA: 0s
2/2 [==============================] - 0s 16ms/step
[I 2024-09-27 20:39:10,611] Trial 109 finished with value: 0.017292453318834312 and parameters: {'window_size': 6, 'batch_size': 32, 'network_type': 'GRU', 'num_layers': 1, 'num_neurons': 64, 'learning_rate': 0.01, 'dropout_rate': 0.2}. Best is trial 103 with value: 0.010646479258934657.

1/2 [==============>...............] - ETA: 0s
2/2 [==============================] - 0s 0s/step
[I 2024-09-27 20:39:22,148] Trial 110 finished with value: 0.011524591108163196 and parameters: {'window_size': 6, 'batch_size': 32, 'network_type': 'GRU', 'num_layers': 2, 'num_neurons': 64, 'learning_rate': 0.01, 'dropout_rate': 0.2}. Best is trial 103 with value: 0.010646479258934657.

1/2 [==============>...............] - ETA: 0s
2/2 [==============================] - 1s 16ms/step
[I 2024-09-27 20:39:38,222] Trial 111 finished with value: 0.0412671306282282 and parameters: {'window_size': 6, 'batch_size': 32, 'network_type': 'GRU', 'num_layers': 2, 'num_neurons': 64, 'learning_rate': 0.0001, 'dropout_rate': 0.2}. Best is trial 103 with value: 0.010646479258934657.

1/2 [==============>...............] - ETA: 0s
2/2 [==============================] - 1s 7ms/step
[I 2024-09-27 20:39:57,038] Trial 112 finished with value: 0.039407973592480036 and parameters: {'window_size': 6, 'batch_size': 32, 'network_type': 'GRU', 'num_layers': 2, 'num_neurons': 64, 'learning_rate': 0.0001, 'dropout_rate': 0.2}. Best is trial 103 with value: 0.010646479258934657.

1/2 [==============>...............] - ETA: 0s
2/2 [==============================] - 1s 0s/step
[I 2024-09-27 20:40:07,822] Trial 113 finished with value: 0.012902781421939536 and parameters: {'window_size': 6, 'batch_size': 32, 'network_type': 'GRU', 'num_layers': 2, 'num_neurons': 64, 'learning_rate': 0.01, 'dropout_rate': 0.2}. Best is trial 103 with value: 0.010646479258934657.

1/2 [==============>...............] - ETA: 0s
2/2 [==============================] - 0s 0s/step
[I 2024-09-27 20:40:16,462] Trial 114 finished with value: 0.01774213000635307 and parameters: {'window_size': 6, 'batch_size': 32, 'network_type': 'GRU', 'num_layers': 2, 'num_neurons': 64, 'learning_rate': 0.01, 'dropout_rate': 0.2}. Best is trial 103 with value: 0.010646479258934657.

1/2 [==============>...............] - ETA: 0s
2/2 [==============================] - 0s 0s/step
[I 2024-09-27 20:40:27,897] Trial 115 finished with value: 0.013940697898467386 and parameters: {'window_size': 6, 'batch_size': 32, 'network_type': 'GRU', 'num_layers': 2, 'num_neurons': 64, 'learning_rate': 0.01, 'dropout_rate': 0.2}. Best is trial 103 with value: 0.010646479258934657.

1/2 [==============>...............] - ETA: 1s
2/2 [==============================] - 1s 12ms/step
