[I 2024-09-27 22:02:50,439] Trial 75 finished with value: 0.04988786757843836 and parameters: {'window_size': 2, 'batch_size': 32, 'network_type': 'RNN', 'num_layers': 2, 'num_neurons': 64, 'learning_rate': 0.01, 'dropout_rate': 0.1}. Best is trial 51 with value: 0.01705618526254382.

1/2 [==============>...............] - ETA: 0s
2/2 [==============================] - 0s 0s/step
[I 2024-09-27 22:02:55,496] Trial 76 finished with value: 0.025186723930495137 and parameters: {'window_size': 2, 'batch_size': 32, 'network_type': 'RNN', 'num_layers': 2, 'num_neurons': 64, 'learning_rate': 0.01, 'dropout_rate': 0.1}. Best is trial 51 with value: 0.01705618526254382.

1/2 [==============>...............] - ETA: 0s
2/2 [==============================] - 0s 0s/step
[I 2024-09-27 22:03:02,234] Trial 77 finished with value: 0.057897700859950156 and parameters: {'window_size': 6, 'batch_size': 32, 'network_type': 'RNN', 'num_layers': 2, 'num_neurons': 16, 'learning_rate': 0.0001, 'dropout_rate': 0.1}. Best is trial 51 with value: 0.01705618526254382.

1/2 [==============>...............] - ETA: 0s
2/2 [==============================] - 0s 0s/step
[I 2024-09-27 22:03:05,431] Trial 78 finished with value: 0.019749056237084534 and parameters: {'window_size': 2, 'batch_size': 16, 'network_type': 'RNN', 'num_layers': 1, 'num_neurons': 64, 'learning_rate': 0.01, 'dropout_rate': 0.1}. Best is trial 51 with value: 0.01705618526254382.

1/2 [==============>...............] - ETA: 0s
2/2 [==============================] - 0s 0s/step
[I 2024-09-27 22:03:10,033] Trial 79 finished with value: 0.02407219387866833 and parameters: {'window_size': 4, 'batch_size': 16, 'network_type': 'LSTM', 'num_layers': 1, 'num_neurons': 32, 'learning_rate': 0.01, 'dropout_rate': 0.1}. Best is trial 51 with value: 0.01705618526254382.

1/2 [==============>...............] - ETA: 0s
2/2 [==============================] - 0s 0s/step
[I 2024-09-27 22:03:13,156] Trial 80 finished with value: 0.028011862576007854 and parameters: {'window_size': 2, 'batch_size': 16, 'network_type': 'RNN', 'num_layers': 1, 'num_neurons': 64, 'learning_rate': 0.01, 'dropout_rate': 0.3}. Best is trial 51 with value: 0.01705618526254382.

1/2 [==============>...............] - ETA: 0s
2/2 [==============================] - 0s 0s/step
[I 2024-09-27 22:03:16,197] Trial 81 finished with value: 0.029751429310866776 and parameters: {'window_size': 2, 'batch_size': 16, 'network_type': 'RNN', 'num_layers': 1, 'num_neurons': 64, 'learning_rate': 0.01, 'dropout_rate': 0.1}. Best is trial 51 with value: 0.01705618526254382.

1/2 [==============>...............] - ETA: 0s
2/2 [==============================] - 0s 16ms/step
[I 2024-09-27 22:03:19,395] Trial 82 finished with value: 0.02558795521940505 and parameters: {'window_size': 2, 'batch_size': 16, 'network_type': 'RNN', 'num_layers': 1, 'num_neurons': 64, 'learning_rate': 0.01, 'dropout_rate': 0.1}. Best is trial 51 with value: 0.01705618526254382.

1/2 [==============>...............] - ETA: 0s
2/2 [==============================] - 1s 2ms/step
[I 2024-09-27 22:03:25,283] Trial 83 finished with value: 0.03552128434181214 and parameters: {'window_size': 2, 'batch_size': 16, 'network_type': 'RNN', 'num_layers': 2, 'num_neurons': 64, 'learning_rate': 0.01, 'dropout_rate': 0.1}. Best is trial 51 with value: 0.01705618526254382.

1/2 [==============>...............] - ETA: 0s
2/2 [==============================] - 0s 0s/step
[I 2024-09-27 22:03:29,253] Trial 84 finished with value: 0.01826834552628654 and parameters: {'window_size': 2, 'batch_size': 32, 'network_type': 'RNN', 'num_layers': 1, 'num_neurons': 64, 'learning_rate': 0.01, 'dropout_rate': 0.1}. Best is trial 51 with value: 0.01705618526254382.

1/2 [==============>...............] - ETA: 0s
2/2 [==============================] - 0s 0s/step
[I 2024-09-27 22:03:32,858] Trial 85 finished with value: 0.018153013084615987 and parameters: {'window_size': 2, 'batch_size': 32, 'network_type': 'RNN', 'num_layers': 1, 'num_neurons': 64, 'learning_rate': 0.01, 'dropout_rate': 0.1}. Best is trial 51 with value: 0.01705618526254382.

1/2 [==============>...............] - ETA: 0s
2/2 [==============================] - 0s 0s/step
[I 2024-09-27 22:03:37,135] Trial 86 finished with value: 0.025650979212352217 and parameters: {'window_size': 2, 'batch_size': 32, 'network_type': 'LSTM', 'num_layers': 1, 'num_neurons': 64, 'learning_rate': 0.01, 'dropout_rate': 0.1}. Best is trial 51 with value: 0.01705618526254382.

1/2 [==============>...............] - ETA: 0s
2/2 [==============================] - 0s 0s/step
[I 2024-09-27 22:03:40,847] Trial 87 finished with value: 0.026908234093870446 and parameters: {'window_size': 2, 'batch_size': 32, 'network_type': 'RNN', 'num_layers': 1, 'num_neurons': 64, 'learning_rate': 0.01, 'dropout_rate': 0.1}. Best is trial 51 with value: 0.01705618526254382.

1/2 [==============>...............] - ETA: 0s
2/2 [==============================] - 0s 0s/step
[I 2024-09-27 22:03:43,806] Trial 88 finished with value: 0.018989857699189875 and parameters: {'window_size': 2, 'batch_size': 64, 'network_type': 'RNN', 'num_layers': 1, 'num_neurons': 64, 'learning_rate': 0.01, 'dropout_rate': 0.1}. Best is trial 51 with value: 0.01705618526254382.

1/2 [==============>...............] - ETA: 0s
2/2 [==============================] - 0s 0s/step
[I 2024-09-27 22:03:46,804] Trial 89 finished with value: 0.025589374457086846 and parameters: {'window_size': 2, 'batch_size': 64, 'network_type': 'RNN', 'num_layers': 1, 'num_neurons': 128, 'learning_rate': 0.01, 'dropout_rate': 0.1}. Best is trial 51 with value: 0.01705618526254382.

1/2 [==============>...............] - ETA: 0s
2/2 [==============================] - 0s 0s/step
[I 2024-09-27 22:03:51,272] Trial 90 finished with value: 0.02246906578540803 and parameters: {'window_size': 2, 'batch_size': 64, 'network_type': 'LSTM', 'num_layers': 1, 'num_neurons': 64, 'learning_rate': 0.01, 'dropout_rate': 0.1}. Best is trial 51 with value: 0.01705618526254382.

1/2 [==============>...............] - ETA: 0s
2/2 [==============================] - 0s 7ms/step
[I 2024-09-27 22:03:55,268] Trial 91 finished with value: 0.027549930691719068 and parameters: {'window_size': 2, 'batch_size': 64, 'network_type': 'RNN', 'num_layers': 1, 'num_neurons': 64, 'learning_rate': 0.01, 'dropout_rate': 0.1}. Best is trial 51 with value: 0.01705618526254382.

1/2 [==============>...............] - ETA: 0s
2/2 [==============================] - 0s 0s/step
[I 2024-09-27 22:04:01,400] Trial 92 finished with value: 0.04259685160432545 and parameters: {'window_size': 2, 'batch_size': 64, 'network_type': 'RNN', 'num_layers': 1, 'num_neurons': 64, 'learning_rate': 0.0001, 'dropout_rate': 0.1}. Best is trial 51 with value: 0.01705618526254382.

1/2 [==============>...............] - ETA: 0s
2/2 [==============================] - 0s 16ms/step
[I 2024-09-27 22:04:06,538] Trial 93 finished with value: 0.030944764196872723 and parameters: {'window_size': 2, 'batch_size': 64, 'network_type': 'RNN', 'num_layers': 1, 'num_neurons': 64, 'learning_rate': 0.01, 'dropout_rate': 0.1}. Best is trial 51 with value: 0.01705618526254382.

1/2 [==============>...............] - ETA: 0s
2/2 [==============================] - 0s 16ms/step
[I 2024-09-27 22:04:09,912] Trial 94 finished with value: 0.027216464000088838 and parameters: {'window_size': 2, 'batch_size': 32, 'network_type': 'RNN', 'num_layers': 1, 'num_neurons': 64, 'learning_rate': 0.01, 'dropout_rate': 0.1}. Best is trial 51 with value: 0.01705618526254382.

1/2 [==============>...............] - ETA: 0s
2/2 [==============================] - 0s 0s/step
[I 2024-09-27 22:04:13,907] Trial 95 finished with value: 0.023311536754880645 and parameters: {'window_size': 2, 'batch_size': 16, 'network_type': 'RNN', 'num_layers': 1, 'num_neurons': 64, 'learning_rate': 0.01, 'dropout_rate': 0.1}. Best is trial 51 with value: 0.01705618526254382.

1/2 [==============>...............] - ETA: 0s
2/2 [==============================] - 0s 16ms/step
[I 2024-09-27 22:04:19,299] Trial 96 finished with value: 0.01989689757142749 and parameters: {'window_size': 2, 'batch_size': 32, 'network_type': 'RNN', 'num_layers': 1, 'num_neurons': 16, 'learning_rate': 0.01, 'dropout_rate': 0.1}. Best is trial 51 with value: 0.01705618526254382.

1/2 [==============>...............] - ETA: 0s
2/2 [==============================] - 0s 0s/step
[I 2024-09-27 22:04:22,893] Trial 97 finished with value: 0.02682083878346853 and parameters: {'window_size': 2, 'batch_size': 32, 'network_type': 'RNN', 'num_layers': 1, 'num_neurons': 64, 'learning_rate': 0.01, 'dropout_rate': 0.3}. Best is trial 51 with value: 0.01705618526254382.

1/2 [==============>...............] - ETA: 0s
2/2 [==============================] - 0s 0s/step
[I 2024-09-27 22:04:25,946] Trial 98 finished with value: 0.021894229011876255 and parameters: {'window_size': 2, 'batch_size': 32, 'network_type': 'RNN', 'num_layers': 1, 'num_neurons': 32, 'learning_rate': 0.01, 'dropout_rate': 0.1}. Best is trial 51 with value: 0.01705618526254382.

1/2 [==============>...............] - ETA: 0s
2/2 [==============================] - 0s 0s/step
[I 2024-09-27 22:04:34,460] Trial 99 finished with value: 0.054658437543445175 and parameters: {'window_size': 4, 'batch_size': 64, 'network_type': 'LSTM', 'num_layers': 1, 'num_neurons': 64, 'learning_rate': 0.0001, 'dropout_rate': 0.1}. Best is trial 51 with value: 0.01705618526254382.

1/2 [==============>...............] - ETA: 0s
2/2 [==============================] - 0s 16ms/step
[I 2024-09-27 22:04:37,674] Trial 100 finished with value: 0.020946920020239703 and parameters: {'window_size': 2, 'batch_size': 32, 'network_type': 'RNN', 'num_layers': 1, 'num_neurons': 64, 'learning_rate': 0.01, 'dropout_rate': 0.1}. Best is trial 51 with value: 0.01705618526254382.

1/2 [==============>...............] - ETA: 0s
2/2 [==============================] - 0s 0s/step
[I 2024-09-27 22:04:42,583] Trial 101 finished with value: 0.032908106574645414 and parameters: {'window_size': 6, 'batch_size': 32, 'network_type': 'RNN', 'num_layers': 2, 'num_neurons': 64, 'learning_rate': 0.01, 'dropout_rate': 0.1}. Best is trial 51 with value: 0.01705618526254382.

1/2 [==============>...............] - ETA: 0s
2/2 [==============================] - 0s 0s/step
[I 2024-09-27 22:04:46,993] Trial 102 finished with value: 0.065212852202929 and parameters: {'window_size': 6, 'batch_size': 32, 'network_type': 'RNN', 'num_layers': 1, 'num_neurons': 64, 'learning_rate': 0.0001, 'dropout_rate': 0.1}. Best is trial 51 with value: 0.01705618526254382.

1/2 [==============>...............] - ETA: 0s
2/2 [==============================] - 0s 16ms/step
[I 2024-09-27 22:04:52,328] Trial 103 finished with value: 0.03549698776465197 and parameters: {'window_size': 6, 'batch_size': 32, 'network_type': 'RNN', 'num_layers': 2, 'num_neurons': 64, 'learning_rate': 0.01, 'dropout_rate': 0.1}. Best is trial 51 with value: 0.01705618526254382.

1/2 [==============>...............] - ETA: 0s
2/2 [==============================] - 0s 0s/step
[I 2024-09-27 22:04:56,782] Trial 104 finished with value: 0.020862410604953776 and parameters: {'window_size': 2, 'batch_size': 32, 'network_type': 'RNN', 'num_layers': 1, 'num_neurons': 64, 'learning_rate': 0.01, 'dropout_rate': 0.1}. Best is trial 51 with value: 0.01705618526254382.

1/2 [==============>...............] - ETA: 0s
2/2 [==============================] - 1s 0s/step
[I 2024-09-27 22:05:04,192] Trial 105 finished with value: 0.024954446979931433 and parameters: {'window_size': 2, 'batch_size': 32, 'network_type': 'RNN', 'num_layers': 2, 'num_neurons': 64, 'learning_rate': 0.01, 'dropout_rate': 0.1}. Best is trial 51 with value: 0.01705618526254382.

1/2 [==============>...............] - ETA: 0s
2/2 [==============================] - 0s 0s/step
[I 2024-09-27 22:05:10,101] Trial 106 finished with value: 0.032746703312947205 and parameters: {'window_size': 6, 'batch_size': 32, 'network_type': 'RNN', 'num_layers': 2, 'num_neurons': 64, 'learning_rate': 0.01, 'dropout_rate': 0.1}. Best is trial 51 with value: 0.01705618526254382.

1/2 [==============>...............] - ETA: 0s
2/2 [==============================] - 0s 0s/step
[I 2024-09-27 22:05:13,670] Trial 107 finished with value: 0.03239087338958469 and parameters: {'window_size': 2, 'batch_size': 32, 'network_type': 'RNN', 'num_layers': 1, 'num_neurons': 64, 'learning_rate': 0.01, 'dropout_rate': 0.1}. Best is trial 51 with value: 0.01705618526254382.

1/2 [==============>...............] - ETA: 0s
2/2 [==============================] - 0s 16ms/step
[I 2024-09-27 22:05:18,824] Trial 108 finished with value: 0.028529725824083613 and parameters: {'window_size': 2, 'batch_size': 32, 'network_type': 'RNN', 'num_layers': 2, 'num_neurons': 64, 'learning_rate': 0.01, 'dropout_rate': 0.1}. Best is trial 51 with value: 0.01705618526254382.

1/2 [==============>...............] - ETA: 0s
2/2 [==============================] - 0s 0s/step
[I 2024-09-27 22:05:22,765] Trial 109 finished with value: 0.030467620628220705 and parameters: {'window_size': 2, 'batch_size': 16, 'network_type': 'LSTM', 'num_layers': 1, 'num_neurons': 64, 'learning_rate': 0.01, 'dropout_rate': 0.1}. Best is trial 51 with value: 0.01705618526254382.

1/2 [==============>...............] - ETA: 0s
2/2 [==============================] - 0s 0s/step
[I 2024-09-27 22:05:27,395] Trial 110 finished with value: 0.045986831499980056 and parameters: {'window_size': 6, 'batch_size': 32, 'network_type': 'RNN', 'num_layers': 2, 'num_neurons': 64, 'learning_rate': 0.01, 'dropout_rate': 0.1}. Best is trial 51 with value: 0.01705618526254382.

1/2 [==============>...............] - ETA: 0s
2/2 [==============================] - 0s 0s/step
[I 2024-09-27 22:05:30,352] Trial 111 finished with value: 0.022402315165315368 and parameters: {'window_size': 2, 'batch_size': 32, 'network_type': 'RNN', 'num_layers': 1, 'num_neurons': 16, 'learning_rate': 0.01, 'dropout_rate': 0.1}. Best is trial 51 with value: 0.01705618526254382.

1/2 [==============>...............] - ETA: 0s
2/2 [==============================] - 0s 0s/step
[I 2024-09-27 22:05:33,649] Trial 112 finished with value: 0.029047648336206176 and parameters: {'window_size': 2, 'batch_size': 32, 'network_type': 'RNN', 'num_layers': 1, 'num_neurons': 16, 'learning_rate': 0.01, 'dropout_rate': 0.1}. Best is trial 51 with value: 0.01705618526254382.

1/2 [==============>...............] - ETA: 0s
2/2 [==============================] - 0s 0s/step
[I 2024-09-27 22:05:38,366] Trial 113 finished with value: 0.01844115330491748 and parameters: {'window_size': 2, 'batch_size': 32, 'network_type': 'RNN', 'num_layers': 1, 'num_neurons': 16, 'learning_rate': 0.01, 'dropout_rate': 0.1}. Best is trial 51 with value: 0.01705618526254382.

1/2 [==============>...............] - ETA: 0s
2/2 [==============================] - 0s 7ms/step
[I 2024-09-27 22:05:41,656] Trial 114 finished with value: 0.02928909311124258 and parameters: {'window_size': 2, 'batch_size': 32, 'network_type': 'RNN', 'num_layers': 1, 'num_neurons': 16, 'learning_rate': 0.01, 'dropout_rate': 0.1}. Best is trial 51 with value: 0.01705618526254382.

1/2 [==============>...............] - ETA: 0s
2/2 [==============================] - 0s 0s/step
[I 2024-09-27 22:05:44,939] Trial 115 finished with value: 0.032121875166893014 and parameters: {'window_size': 2, 'batch_size': 32, 'network_type': 'RNN', 'num_layers': 1, 'num_neurons': 128, 'learning_rate': 0.01, 'dropout_rate': 0.1}. Best is trial 51 with value: 0.01705618526254382.

1/2 [==============>...............] - ETA: 0s
2/2 [==============================] - 0s 0s/step
[I 2024-09-27 22:05:50,068] Trial 116 finished with value: 0.04117160415649416 and parameters: {'window_size': 2, 'batch_size': 32, 'network_type': 'RNN', 'num_layers': 2, 'num_neurons': 16, 'learning_rate': 0.01, 'dropout_rate': 0.3}. Best is trial 51 with value: 0.01705618526254382.

1/2 [==============>...............] - ETA: 0s
2/2 [==============================] - 0s 16ms/step
[I 2024-09-27 22:05:53,208] Trial 117 finished with value: 0.025743243155656043 and parameters: {'window_size': 4, 'batch_size': 32, 'network_type': 'RNN', 'num_layers': 1, 'num_neurons': 16, 'learning_rate': 0.01, 'dropout_rate': 0.1}. Best is trial 51 with value: 0.01705618526254382.

1/2 [==============>...............] - ETA: 0s
2/2 [==============================] - 0s 0s/step
[I 2024-09-27 22:05:59,462] Trial 118 finished with value: 0.02565665513277055 and parameters: {'window_size': 2, 'batch_size': 32, 'network_type': 'RNN', 'num_layers': 2, 'num_neurons': 64, 'learning_rate': 0.01, 'dropout_rate': 0.1}. Best is trial 51 with value: 0.01705618526254382.

1/2 [==============>...............] - ETA: 0s
2/2 [==============================] - 0s 16ms/step
[I 2024-09-27 22:06:03,009] Trial 119 finished with value: 0.03187943753174374 and parameters: {'window_size': 2, 'batch_size': 64, 'network_type': 'LSTM', 'num_layers': 1, 'num_neurons': 64, 'learning_rate': 0.01, 'dropout_rate': 0.1}. Best is trial 51 with value: 0.01705618526254382.

1/2 [==============>...............] - ETA: 0s
2/2 [==============================] - 1s 10ms/step
[I 2024-09-27 22:06:17,408] Trial 120 finished with value: 0.024837451329598068 and parameters: {'window_size': 6, 'batch_size': 16, 'network_type': 'GRU', 'num_layers': 3, 'num_neurons': 32, 'learning_rate': 0.01, 'dropout_rate': 0.1}. Best is trial 51 with value: 0.01705618526254382.

1/2 [==============>...............] - ETA: 0s
2/2 [==============================] - 0s 0s/step
[I 2024-09-27 22:06:22,500] Trial 121 finished with value: 0.025545067276273464 and parameters: {'window_size': 2, 'batch_size': 32, 'network_type': 'RNN', 'num_layers': 1, 'num_neurons': 16, 'learning_rate': 0.01, 'dropout_rate': 0.1}. Best is trial 51 with value: 0.01705618526254382.

1/2 [==============>...............] - ETA: 0s
2/2 [==============================] - 0s 16ms/step
[I 2024-09-27 22:06:27,518] Trial 122 finished with value: 0.026340580131326414 and parameters: {'window_size': 2, 'batch_size': 32, 'network_type': 'RNN', 'num_layers': 1, 'num_neurons': 16, 'learning_rate': 0.01, 'dropout_rate': 0.1}. Best is trial 51 with value: 0.01705618526254382.

1/2 [==============>...............] - ETA: 0s
2/2 [==============================] - 0s 0s/step
[I 2024-09-27 22:06:31,143] Trial 123 finished with value: 0.02348092235837665 and parameters: {'window_size': 2, 'batch_size': 32, 'network_type': 'RNN', 'num_layers': 1, 'num_neurons': 16, 'learning_rate': 0.01, 'dropout_rate': 0.1}. Best is trial 51 with value: 0.01705618526254382.

1/2 [==============>...............] - ETA: 0s
2/2 [==============================] - 0s 0s/step
[I 2024-09-27 22:06:34,348] Trial 124 finished with value: 0.022404538018362872 and parameters: {'window_size': 2, 'batch_size': 32, 'network_type': 'RNN', 'num_layers': 1, 'num_neurons': 16, 'learning_rate': 0.01, 'dropout_rate': 0.1}. Best is trial 51 with value: 0.01705618526254382.

1/2 [==============>...............] - ETA: 0s
2/2 [==============================] - 0s 16ms/step
[I 2024-09-27 22:06:42,387] Trial 125 finished with value: 0.08889420575329235 and parameters: {'window_size': 2, 'batch_size': 32, 'network_type': 'RNN', 'num_layers': 1, 'num_neurons': 16, 'learning_rate': 0.0001, 'dropout_rate': 0.1}. Best is trial 51 with value: 0.01705618526254382.

1/2 [==============>...............] - ETA: 0s
2/2 [==============================] - 0s 7ms/step
[I 2024-09-27 22:06:46,766] Trial 126 finished with value: 0.023018407932349626 and parameters: {'window_size': 2, 'batch_size': 32, 'network_type': 'RNN', 'num_layers': 2, 'num_neurons': 64, 'learning_rate': 0.01, 'dropout_rate': 0.1}. Best is trial 51 with value: 0.01705618526254382.

1/2 [==============>...............] - ETA: 0s
2/2 [==============================] - 0s 0s/step
[I 2024-09-27 22:06:49,742] Trial 127 finished with value: 0.022852300788675044 and parameters: {'window_size': 2, 'batch_size': 32, 'network_type': 'RNN', 'num_layers': 1, 'num_neurons': 64, 'learning_rate': 0.01, 'dropout_rate': 0.1}. Best is trial 51 with value: 0.01705618526254382.

1/2 [==============>...............] - ETA: 0s
2/2 [==============================] - 0s 0s/step
[I 2024-09-27 22:06:56,032] Trial 128 finished with value: 0.02519461671795165 and parameters: {'window_size': 2, 'batch_size': 32, 'network_type': 'RNN', 'num_layers': 2, 'num_neurons': 64, 'learning_rate': 0.01, 'dropout_rate': 0.1}. Best is trial 51 with value: 0.01705618526254382.

1/2 [==============>...............] - ETA: 0s
2/2 [==============================] - 0s 0s/step
[I 2024-09-27 22:06:59,222] Trial 129 finished with value: 0.015391002348491131 and parameters: {'window_size': 2, 'batch_size': 32, 'network_type': 'RNN', 'num_layers': 1, 'num_neurons': 64, 'learning_rate': 0.01, 'dropout_rate': 0.1}. Best is trial 129 with value: 0.015391002348491131.

1/2 [==============>...............] - ETA: 0s
2/2 [==============================] - 1s 0s/step
[I 2024-09-27 22:07:10,206] Trial 130 finished with value: 0.029502287791325507 and parameters: {'window_size': 6, 'batch_size': 64, 'network_type': 'GRU', 'num_layers': 3, 'num_neurons': 64, 'learning_rate': 0.01, 'dropout_rate': 0.1}. Best is trial 129 with value: 0.015391002348491131.

1/2 [==============>...............] - ETA: 0s
2/2 [==============================] - 0s 0s/step
[I 2024-09-27 22:07:14,004] Trial 131 finished with value: 0.01892215906722206 and parameters: {'window_size': 2, 'batch_size': 32, 'network_type': 'RNN', 'num_layers': 1, 'num_neurons': 64, 'learning_rate': 0.01, 'dropout_rate': 0.1}. Best is trial 129 with value: 0.015391002348491131.

1/2 [==============>...............] - ETA: 0s
2/2 [==============================] - 0s 0s/step
