[I 2024-09-28 00:21:00,553] Trial 104 finished with value: 0.03728116174844597 and parameters: {'learning_rate': 0.01, 'batch_size': 32, 'network_type': 'RNN', 'num_layers': 2, 'num_neurons': 128, 'dropout_rate': 0.2}. Best is trial 102 with value: 0.03291887081586397.
[I 2024-09-28 00:21:08,397] Trial 105 finished with value: 0.03494247983052184 and parameters: {'learning_rate': 0.0001, 'batch_size': 32, 'network_type': 'RNN', 'num_layers': 2, 'num_neurons': 128, 'dropout_rate': 0.2}. Best is trial 102 with value: 0.03291887081586397.
[I 2024-09-28 00:21:14,103] Trial 106 finished with value: 0.04263841607020455 and parameters: {'learning_rate': 0.01, 'batch_size': 32, 'network_type': 'RNN', 'num_layers': 2, 'num_neurons': 128, 'dropout_rate': 0.2}. Best is trial 102 with value: 0.03291887081586397.
[I 2024-09-28 00:21:22,316] Trial 107 finished with value: 0.03367373994680555 and parameters: {'learning_rate': 0.0001, 'batch_size': 32, 'network_type': 'RNN', 'num_layers': 2, 'num_neurons': 128, 'dropout_rate': 0.2}. Best is trial 102 with value: 0.03291887081586397.
[I 2024-09-28 00:21:29,097] Trial 108 finished with value: 0.035745038032531776 and parameters: {'learning_rate': 0.0001, 'batch_size': 16, 'network_type': 'RNN', 'num_layers': 2, 'num_neurons': 128, 'dropout_rate': 0.2}. Best is trial 102 with value: 0.03291887081586397.
[I 2024-09-28 00:21:35,614] Trial 109 finished with value: 0.0420733732076792 and parameters: {'learning_rate': 0.01, 'batch_size': 32, 'network_type': 'RNN', 'num_layers': 2, 'num_neurons': 32, 'dropout_rate': 0.2}. Best is trial 102 with value: 0.03291887081586397.
[I 2024-09-28 00:21:42,194] Trial 110 finished with value: 0.043641355918004 and parameters: {'learning_rate': 0.01, 'batch_size': 32, 'network_type': 'LSTM', 'num_layers': 1, 'num_neurons': 16, 'dropout_rate': 0.2}. Best is trial 102 with value: 0.03291887081586397.
[I 2024-09-28 00:21:47,368] Trial 111 finished with value: 0.03580684185028074 and parameters: {'learning_rate': 0.01, 'batch_size': 32, 'network_type': 'RNN', 'num_layers': 2, 'num_neurons': 128, 'dropout_rate': 0.2}. Best is trial 102 with value: 0.03291887081586397.
[I 2024-09-28 00:21:52,741] Trial 112 finished with value: 0.03506581908005934 and parameters: {'learning_rate': 0.01, 'batch_size': 32, 'network_type': 'RNN', 'num_layers': 2, 'num_neurons': 128, 'dropout_rate': 0.2}. Best is trial 102 with value: 0.03291887081586397.
[I 2024-09-28 00:21:57,713] Trial 113 finished with value: 0.04454131511541512 and parameters: {'learning_rate': 0.01, 'batch_size': 32, 'network_type': 'RNN', 'num_layers': 2, 'num_neurons': 128, 'dropout_rate': 0.2}. Best is trial 102 with value: 0.03291887081586397.
[I 2024-09-28 00:22:02,677] Trial 114 finished with value: 0.06842421997510471 and parameters: {'learning_rate': 0.01, 'batch_size': 32, 'network_type': 'RNN', 'num_layers': 2, 'num_neurons': 128, 'dropout_rate': 0.2}. Best is trial 102 with value: 0.03291887081586397.
[I 2024-09-28 00:22:08,004] Trial 115 finished with value: 0.061832142096299364 and parameters: {'learning_rate': 0.01, 'batch_size': 32, 'network_type': 'RNN', 'num_layers': 2, 'num_neurons': 128, 'dropout_rate': 0.2}. Best is trial 102 with value: 0.03291887081586397.
[I 2024-09-28 00:22:13,848] Trial 116 finished with value: 0.048033507567185656 and parameters: {'learning_rate': 0.01, 'batch_size': 32, 'network_type': 'RNN', 'num_layers': 2, 'num_neurons': 128, 'dropout_rate': 0.2}. Best is trial 102 with value: 0.03291887081586397.
[I 2024-09-28 00:22:18,789] Trial 117 finished with value: 0.05187797047541695 and parameters: {'learning_rate': 0.01, 'batch_size': 64, 'network_type': 'RNN', 'num_layers': 2, 'num_neurons': 128, 'dropout_rate': 0.2}. Best is trial 102 with value: 0.03291887081586397.
[I 2024-09-28 00:22:22,353] Trial 118 finished with value: 0.04950426593193645 and parameters: {'learning_rate': 0.01, 'batch_size': 32, 'network_type': 'RNN', 'num_layers': 1, 'num_neurons': 32, 'dropout_rate': 0.2}. Best is trial 102 with value: 0.03291887081586397.
[I 2024-09-28 00:22:31,109] Trial 119 finished with value: 0.03657596804545479 and parameters: {'learning_rate': 0.0001, 'batch_size': 64, 'network_type': 'RNN', 'num_layers': 2, 'num_neurons': 128, 'dropout_rate': 0.2}. Best is trial 102 with value: 0.03291887081586397.
[I 2024-09-28 00:22:36,637] Trial 120 finished with value: 0.038126835052783706 and parameters: {'learning_rate': 0.01, 'batch_size': 32, 'network_type': 'RNN', 'num_layers': 2, 'num_neurons': 128, 'dropout_rate': 0.2}. Best is trial 102 with value: 0.03291887081586397.
[I 2024-09-28 00:22:42,537] Trial 121 finished with value: 0.04350294934786287 and parameters: {'learning_rate': 0.01, 'batch_size': 32, 'network_type': 'RNN', 'num_layers': 2, 'num_neurons': 128, 'dropout_rate': 0.2}. Best is trial 102 with value: 0.03291887081586397.
[I 2024-09-28 00:22:48,314] Trial 122 finished with value: 0.04208011311751149 and parameters: {'learning_rate': 0.01, 'batch_size': 32, 'network_type': 'RNN', 'num_layers': 2, 'num_neurons': 128, 'dropout_rate': 0.2}. Best is trial 102 with value: 0.03291887081586397.
[I 2024-09-28 00:22:53,296] Trial 123 finished with value: 0.06655694858844466 and parameters: {'learning_rate': 0.01, 'batch_size': 32, 'network_type': 'RNN', 'num_layers': 2, 'num_neurons': 128, 'dropout_rate': 0.2}. Best is trial 102 with value: 0.03291887081586397.
[I 2024-09-28 00:22:58,239] Trial 124 finished with value: 0.08850753736495974 and parameters: {'learning_rate': 0.01, 'batch_size': 32, 'network_type': 'RNN', 'num_layers': 2, 'num_neurons': 128, 'dropout_rate': 0.2}. Best is trial 102 with value: 0.03291887081586397.
[I 2024-09-28 00:23:03,176] Trial 125 finished with value: 0.04990927032323988 and parameters: {'learning_rate': 0.01, 'batch_size': 32, 'network_type': 'RNN', 'num_layers': 2, 'num_neurons': 128, 'dropout_rate': 0.2}. Best is trial 102 with value: 0.03291887081586397.
[I 2024-09-28 00:23:07,909] Trial 126 finished with value: 0.039651714434990555 and parameters: {'learning_rate': 0.01, 'batch_size': 64, 'network_type': 'RNN', 'num_layers': 2, 'num_neurons': 128, 'dropout_rate': 0.2}. Best is trial 102 with value: 0.03291887081586397.
[I 2024-09-28 00:23:13,072] Trial 127 finished with value: 0.051682068347930946 and parameters: {'learning_rate': 0.01, 'batch_size': 32, 'network_type': 'RNN', 'num_layers': 2, 'num_neurons': 128, 'dropout_rate': 0.2}. Best is trial 102 with value: 0.03291887081586397.
[I 2024-09-28 00:23:16,940] Trial 128 finished with value: 0.062213562708634616 and parameters: {'learning_rate': 0.01, 'batch_size': 32, 'network_type': 'RNN', 'num_layers': 1, 'num_neurons': 32, 'dropout_rate': 0.2}. Best is trial 102 with value: 0.03291887081586397.
[I 2024-09-28 00:23:23,355] Trial 129 finished with value: 0.04535471219282883 and parameters: {'learning_rate': 0.01, 'batch_size': 16, 'network_type': 'RNN', 'num_layers': 2, 'num_neurons': 128, 'dropout_rate': 0.2}. Best is trial 102 with value: 0.03291887081586397.
[I 2024-09-28 00:23:32,227] Trial 130 finished with value: 0.03786475585057184 and parameters: {'learning_rate': 0.01, 'batch_size': 64, 'network_type': 'LSTM', 'num_layers': 2, 'num_neurons': 128, 'dropout_rate': 0.2}. Best is trial 102 with value: 0.03291887081586397.
[I 2024-09-28 00:23:39,719] Trial 131 finished with value: 0.03556046537252577 and parameters: {'learning_rate': 0.0001, 'batch_size': 32, 'network_type': 'RNN', 'num_layers': 2, 'num_neurons': 128, 'dropout_rate': 0.2}. Best is trial 102 with value: 0.03291887081586397.
[I 2024-09-28 00:23:44,700] Trial 132 finished with value: 0.03926615491280193 and parameters: {'learning_rate': 0.01, 'batch_size': 32, 'network_type': 'RNN', 'num_layers': 2, 'num_neurons': 128, 'dropout_rate': 0.2}. Best is trial 102 with value: 0.03291887081586397.
[I 2024-09-28 00:23:49,749] Trial 133 finished with value: 0.03513682237038248 and parameters: {'learning_rate': 0.01, 'batch_size': 32, 'network_type': 'RNN', 'num_layers': 2, 'num_neurons': 128, 'dropout_rate': 0.2}. Best is trial 102 with value: 0.03291887081586397.
[I 2024-09-28 00:23:55,916] Trial 134 finished with value: 0.03494377987201394 and parameters: {'learning_rate': 0.01, 'batch_size': 32, 'network_type': 'RNN', 'num_layers': 2, 'num_neurons': 128, 'dropout_rate': 0.2}. Best is trial 102 with value: 0.03291887081586397.
[I 2024-09-28 00:24:01,304] Trial 135 finished with value: 0.03649072551727292 and parameters: {'learning_rate': 0.01, 'batch_size': 32, 'network_type': 'RNN', 'num_layers': 2, 'num_neurons': 16, 'dropout_rate': 0.2}. Best is trial 102 with value: 0.03291887081586397.
[I 2024-09-28 00:24:06,133] Trial 136 finished with value: 0.05339872338221627 and parameters: {'learning_rate': 0.01, 'batch_size': 32, 'network_type': 'RNN', 'num_layers': 2, 'num_neurons': 128, 'dropout_rate': 0.1}. Best is trial 102 with value: 0.03291887081586397.
[I 2024-09-28 00:24:14,798] Trial 137 finished with value: 0.03609504567659822 and parameters: {'learning_rate': 0.0001, 'batch_size': 64, 'network_type': 'RNN', 'num_layers': 2, 'num_neurons': 128, 'dropout_rate': 0.2}. Best is trial 102 with value: 0.03291887081586397.
[I 2024-09-28 00:24:19,508] Trial 138 finished with value: 0.07655707660088175 and parameters: {'learning_rate': 0.01, 'batch_size': 32, 'network_type': 'RNN', 'num_layers': 2, 'num_neurons': 128, 'dropout_rate': 0.2}. Best is trial 102 with value: 0.03291887081586397.
[I 2024-09-28 00:24:23,235] Trial 139 finished with value: 0.039302889713874266 and parameters: {'learning_rate': 0.01, 'batch_size': 32, 'network_type': 'RNN', 'num_layers': 1, 'num_neurons': 128, 'dropout_rate': 0.2}. Best is trial 102 with value: 0.03291887081586397.
[I 2024-09-28 00:24:33,287] Trial 140 finished with value: 0.031945486215444685 and parameters: {'learning_rate': 0.0001, 'batch_size': 64, 'network_type': 'RNN', 'num_layers': 2, 'num_neurons': 32, 'dropout_rate': 0.1}. Best is trial 140 with value: 0.031945486215444685.
[I 2024-09-28 00:24:38,337] Trial 141 finished with value: 0.04026435848382807 and parameters: {'learning_rate': 0.01, 'batch_size': 64, 'network_type': 'RNN', 'num_layers': 2, 'num_neurons': 32, 'dropout_rate': 0.1}. Best is trial 140 with value: 0.031945486215444685.
[I 2024-09-28 00:24:42,894] Trial 142 finished with value: 0.045347103302295425 and parameters: {'learning_rate': 0.01, 'batch_size': 64, 'network_type': 'RNN', 'num_layers': 2, 'num_neurons': 32, 'dropout_rate': 0.1}. Best is trial 140 with value: 0.031945486215444685.
[I 2024-09-28 00:24:47,657] Trial 143 finished with value: 0.03927061609121473 and parameters: {'learning_rate': 0.01, 'batch_size': 64, 'network_type': 'RNN', 'num_layers': 2, 'num_neurons': 32, 'dropout_rate': 0.1}. Best is trial 140 with value: 0.031945486215444685.
[I 2024-09-28 00:24:56,090] Trial 144 finished with value: 0.032508850977970974 and parameters: {'learning_rate': 0.0001, 'batch_size': 64, 'network_type': 'RNN', 'num_layers': 2, 'num_neurons': 32, 'dropout_rate': 0.1}. Best is trial 140 with value: 0.031945486215444685.
[I 2024-09-28 00:25:01,045] Trial 145 finished with value: 0.05530657379443831 and parameters: {'learning_rate': 0.01, 'batch_size': 64, 'network_type': 'RNN', 'num_layers': 2, 'num_neurons': 32, 'dropout_rate': 0.1}. Best is trial 140 with value: 0.031945486215444685.
[I 2024-09-28 00:25:07,272] Trial 146 finished with value: 0.03964956408280596 and parameters: {'learning_rate': 0.01, 'batch_size': 64, 'network_type': 'RNN', 'num_layers': 2, 'num_neurons': 32, 'dropout_rate': 0.1}. Best is trial 140 with value: 0.031945486215444685.
[I 2024-09-28 00:25:20,078] Trial 147 finished with value: 0.04198784850193901 and parameters: {'learning_rate': 0.0001, 'batch_size': 64, 'network_type': 'GRU', 'num_layers': 2, 'num_neurons': 32, 'dropout_rate': 0.1}. Best is trial 140 with value: 0.031945486215444685.
[I 2024-09-28 00:25:25,239] Trial 148 finished with value: 0.04147988975965063 and parameters: {'learning_rate': 0.01, 'batch_size': 64, 'network_type': 'RNN', 'num_layers': 2, 'num_neurons': 32, 'dropout_rate': 0.1}. Best is trial 140 with value: 0.031945486215444685.
[I 2024-09-28 00:25:29,793] Trial 149 finished with value: 0.04903523239722622 and parameters: {'learning_rate': 0.01, 'batch_size': 64, 'network_type': 'RNN', 'num_layers': 2, 'num_neurons': 32, 'dropout_rate': 0.1}. Best is trial 140 with value: 0.031945486215444685.
[I 2024-09-28 00:25:34,866] Trial 150 finished with value: 0.04196854697740999 and parameters: {'learning_rate': 0.01, 'batch_size': 64, 'network_type': 'RNN', 'num_layers': 2, 'num_neurons': 32, 'dropout_rate': 0.1}. Best is trial 140 with value: 0.031945486215444685.
[I 2024-09-28 00:25:41,159] Trial 151 finished with value: 0.03857713897411644 and parameters: {'learning_rate': 0.01, 'batch_size': 32, 'network_type': 'RNN', 'num_layers': 2, 'num_neurons': 128, 'dropout_rate': 0.2}. Best is trial 140 with value: 0.031945486215444685.
[I 2024-09-28 00:25:46,303] Trial 152 finished with value: 0.043494714736938514 and parameters: {'learning_rate': 0.01, 'batch_size': 64, 'network_type': 'RNN', 'num_layers': 2, 'num_neurons': 128, 'dropout_rate': 0.2}. Best is trial 140 with value: 0.031945486215444685.
[I 2024-09-28 00:25:51,409] Trial 153 finished with value: 0.035065535508669345 and parameters: {'learning_rate': 0.01, 'batch_size': 32, 'network_type': 'RNN', 'num_layers': 2, 'num_neurons': 128, 'dropout_rate': 0.1}. Best is trial 140 with value: 0.031945486215444685.
[I 2024-09-28 00:25:56,776] Trial 154 finished with value: 0.05035767148091246 and parameters: {'learning_rate': 0.01, 'batch_size': 32, 'network_type': 'RNN', 'num_layers': 2, 'num_neurons': 128, 'dropout_rate': 0.2}. Best is trial 140 with value: 0.031945486215444685.
[I 2024-09-28 00:26:01,820] Trial 155 finished with value: 0.043931103266202524 and parameters: {'learning_rate': 0.01, 'batch_size': 64, 'network_type': 'RNN', 'num_layers': 2, 'num_neurons': 128, 'dropout_rate': 0.2}. Best is trial 140 with value: 0.031945486215444685.
[I 2024-09-28 00:26:05,786] Trial 156 finished with value: 0.034913497521327115 and parameters: {'learning_rate': 0.01, 'batch_size': 16, 'network_type': 'RNN', 'num_layers': 1, 'num_neurons': 32, 'dropout_rate': 0.2}. Best is trial 140 with value: 0.031945486215444685.
[I 2024-09-28 00:26:14,851] Trial 157 finished with value: 0.030540289291968732 and parameters: {'learning_rate': 0.0001, 'batch_size': 16, 'network_type': 'RNN', 'num_layers': 1, 'num_neurons': 32, 'dropout_rate': 0.1}. Best is trial 157 with value: 0.030540289291968732.
[I 2024-09-28 00:26:18,482] Trial 158 finished with value: 0.0656672117159917 and parameters: {'learning_rate': 0.01, 'batch_size': 16, 'network_type': 'RNN', 'num_layers': 1, 'num_neurons': 32, 'dropout_rate': 0.1}. Best is trial 157 with value: 0.030540289291968732.
[I 2024-09-28 00:26:24,046] Trial 159 finished with value: 0.047608586054581896 and parameters: {'learning_rate': 0.01, 'batch_size': 16, 'network_type': 'LSTM', 'num_layers': 1, 'num_neurons': 32, 'dropout_rate': 0.1}. Best is trial 157 with value: 0.030540289291968732.
[I 2024-09-28 00:26:27,571] Trial 160 finished with value: 0.06750614797152008 and parameters: {'learning_rate': 0.01, 'batch_size': 16, 'network_type': 'RNN', 'num_layers': 1, 'num_neurons': 32, 'dropout_rate': 0.1}. Best is trial 157 with value: 0.030540289291968732.
[I 2024-09-28 00:26:35,780] Trial 161 finished with value: 0.030712766794058013 and parameters: {'learning_rate': 0.0001, 'batch_size': 16, 'network_type': 'RNN', 'num_layers': 1, 'num_neurons': 32, 'dropout_rate': 0.1}. Best is trial 157 with value: 0.030540289291968732.
[I 2024-09-28 00:26:39,411] Trial 162 finished with value: 0.04552133684891924 and parameters: {'learning_rate': 0.01, 'batch_size': 64, 'network_type': 'RNN', 'num_layers': 1, 'num_neurons': 32, 'dropout_rate': 0.1}. Best is trial 157 with value: 0.030540289291968732.
[I 2024-09-28 00:26:43,038] Trial 163 finished with value: 0.035908728636228085 and parameters: {'learning_rate': 0.01, 'batch_size': 16, 'network_type': 'RNN', 'num_layers': 1, 'num_neurons': 32, 'dropout_rate': 0.1}. Best is trial 157 with value: 0.030540289291968732.
[I 2024-09-28 00:26:47,544] Trial 164 finished with value: 0.054744205328134364 and parameters: {'learning_rate': 0.01, 'batch_size': 16, 'network_type': 'RNN', 'num_layers': 1, 'num_neurons': 32, 'dropout_rate': 0.1}. Best is trial 157 with value: 0.030540289291968732.
[I 2024-09-28 00:26:51,558] Trial 165 finished with value: 0.045297961565164455 and parameters: {'learning_rate': 0.01, 'batch_size': 16, 'network_type': 'RNN', 'num_layers': 1, 'num_neurons': 32, 'dropout_rate': 0.1}. Best is trial 157 with value: 0.030540289291968732.
[I 2024-09-28 00:26:59,823] Trial 166 finished with value: 0.03003745533869819 and parameters: {'learning_rate': 0.0001, 'batch_size': 16, 'network_type': 'RNN', 'num_layers': 1, 'num_neurons': 32, 'dropout_rate': 0.1}. Best is trial 166 with value: 0.03003745533869819.
[I 2024-09-28 00:27:03,223] Trial 167 finished with value: 0.06678977082325864 and parameters: {'learning_rate': 0.01, 'batch_size': 16, 'network_type': 'RNN', 'num_layers': 1, 'num_neurons': 32, 'dropout_rate': 0.1}. Best is trial 166 with value: 0.03003745533869819.
[I 2024-09-28 00:27:06,708] Trial 168 finished with value: 0.04600988861230707 and parameters: {'learning_rate': 0.01, 'batch_size': 16, 'network_type': 'RNN', 'num_layers': 1, 'num_neurons': 32, 'dropout_rate': 0.1}. Best is trial 166 with value: 0.03003745533869819.
[I 2024-09-28 00:27:10,700] Trial 169 finished with value: 0.03595416160730213 and parameters: {'learning_rate': 0.01, 'batch_size': 16, 'network_type': 'RNN', 'num_layers': 1, 'num_neurons': 32, 'dropout_rate': 0.1}. Best is trial 166 with value: 0.03003745533869819.
[I 2024-09-28 00:27:14,869] Trial 170 finished with value: 0.04124604698327875 and parameters: {'learning_rate': 0.01, 'batch_size': 16, 'network_type': 'RNN', 'num_layers': 1, 'num_neurons': 32, 'dropout_rate': 0.1}. Best is trial 166 with value: 0.03003745533869819.
[I 2024-09-28 00:27:23,850] Trial 171 finished with value: 0.032185824614304796 and parameters: {'learning_rate': 0.0001, 'batch_size': 16, 'network_type': 'RNN', 'num_layers': 1, 'num_neurons': 32, 'dropout_rate': 0.1}. Best is trial 166 with value: 0.03003745533869819.
[I 2024-09-28 00:27:27,732] Trial 172 finished with value: 0.03908132791519164 and parameters: {'learning_rate': 0.01, 'batch_size': 16, 'network_type': 'RNN', 'num_layers': 1, 'num_neurons': 32, 'dropout_rate': 0.1}. Best is trial 166 with value: 0.03003745533869819.
[I 2024-09-28 00:27:31,260] Trial 173 finished with value: 0.05213107013702396 and parameters: {'learning_rate': 0.01, 'batch_size': 16, 'network_type': 'RNN', 'num_layers': 1, 'num_neurons': 32, 'dropout_rate': 0.1}. Best is trial 166 with value: 0.03003745533869819.
[I 2024-09-28 00:27:34,917] Trial 174 finished with value: 0.040363377974583545 and parameters: {'learning_rate': 0.01, 'batch_size': 16, 'network_type': 'RNN', 'num_layers': 1, 'num_neurons': 32, 'dropout_rate': 0.1}. Best is trial 166 with value: 0.03003745533869819.
[I 2024-09-28 00:27:42,989] Trial 175 finished with value: 0.03031328898209791 and parameters: {'learning_rate': 0.0001, 'batch_size': 16, 'network_type': 'RNN', 'num_layers': 1, 'num_neurons': 32, 'dropout_rate': 0.1}. Best is trial 166 with value: 0.03003745533869819.
[I 2024-09-28 00:27:53,506] Trial 176 finished with value: 0.03080953172536994 and parameters: {'learning_rate': 0.0001, 'batch_size': 16, 'network_type': 'GRU', 'num_layers': 1, 'num_neurons': 32, 'dropout_rate': 0.1}. Best is trial 166 with value: 0.03003745533869819.
[I 2024-09-28 00:28:05,931] Trial 177 finished with value: 0.029613805550795326 and parameters: {'learning_rate': 0.0001, 'batch_size': 16, 'network_type': 'GRU', 'num_layers': 1, 'num_neurons': 32, 'dropout_rate': 0.1}. Best is trial 177 with value: 0.029613805550795326.
[I 2024-09-28 00:28:16,292] Trial 178 finished with value: 0.030080282651461062 and parameters: {'learning_rate': 0.0001, 'batch_size': 16, 'network_type': 'GRU', 'num_layers': 1, 'num_neurons': 32, 'dropout_rate': 0.1}. Best is trial 177 with value: 0.029613805550795326.
[I 2024-09-28 00:28:26,476] Trial 179 finished with value: 0.029662369581369245 and parameters: {'learning_rate': 0.0001, 'batch_size': 16, 'network_type': 'GRU', 'num_layers': 1, 'num_neurons': 32, 'dropout_rate': 0.1}. Best is trial 177 with value: 0.029613805550795326.
[I 2024-09-28 00:28:37,931] Trial 180 finished with value: 0.02921919529254619 and parameters: {'learning_rate': 0.0001, 'batch_size': 16, 'network_type': 'GRU', 'num_layers': 1, 'num_neurons': 32, 'dropout_rate': 0.1}. Best is trial 180 with value: 0.02921919529254619.
[I 2024-09-28 00:28:48,418] Trial 181 finished with value: 0.02982554875887356 and parameters: {'learning_rate': 0.0001, 'batch_size': 16, 'network_type': 'GRU', 'num_layers': 1, 'num_neurons': 32, 'dropout_rate': 0.1}. Best is trial 180 with value: 0.02921919529254619.
[I 2024-09-28 00:28:59,231] Trial 182 finished with value: 0.029787465975834763 and parameters: {'learning_rate': 0.0001, 'batch_size': 16, 'network_type': 'GRU', 'num_layers': 1, 'num_neurons': 32, 'dropout_rate': 0.1}. Best is trial 180 with value: 0.02921919529254619.
[I 2024-09-28 00:29:11,099] Trial 183 finished with value: 0.032461075562697166 and parameters: {'learning_rate': 0.0001, 'batch_size': 16, 'network_type': 'GRU', 'num_layers': 1, 'num_neurons': 32, 'dropout_rate': 0.1}. Best is trial 180 with value: 0.02921919529254619.
[I 2024-09-28 00:29:21,470] Trial 184 finished with value: 0.02971783858079176 and parameters: {'learning_rate': 0.0001, 'batch_size': 16, 'network_type': 'GRU', 'num_layers': 1, 'num_neurons': 32, 'dropout_rate': 0.1}. Best is trial 180 with value: 0.02921919529254619.
