[I 2024-09-27 22:45:52,480] Trial 121 finished with value: 0.19172954686482743 and parameters: {'window_size': 2, 'batch_size': 32, 'network_type': 'RNN', 'num_layers': 2, 'num_neurons': 32, 'learning_rate': 0.01, 'dropout_rate': 0.1}. Best is trial 81 with value: 0.15957848367236907.

1/1 [==============================] - ETA: 0s
1/1 [==============================] - 0s 417ms/step
[I 2024-09-27 22:45:56,221] Trial 122 finished with value: 0.2467411176590692 and parameters: {'window_size': 2, 'batch_size': 32, 'network_type': 'RNN', 'num_layers': 2, 'num_neurons': 32, 'learning_rate': 0.01, 'dropout_rate': 0.1}. Best is trial 81 with value: 0.15957848367236907.

1/1 [==============================] - ETA: 0s
1/1 [==============================] - 0s 285ms/step
[I 2024-09-27 22:46:00,053] Trial 123 finished with value: 0.22021986934116905 and parameters: {'window_size': 2, 'batch_size': 32, 'network_type': 'RNN', 'num_layers': 2, 'num_neurons': 32, 'learning_rate': 0.01, 'dropout_rate': 0.1}. Best is trial 81 with value: 0.15957848367236907.

1/1 [==============================] - ETA: 0s
1/1 [==============================] - 0s 285ms/step
[I 2024-09-27 22:46:03,976] Trial 124 finished with value: 0.19742626072111583 and parameters: {'window_size': 2, 'batch_size': 32, 'network_type': 'RNN', 'num_layers': 2, 'num_neurons': 32, 'learning_rate': 0.01, 'dropout_rate': 0.1}. Best is trial 81 with value: 0.15957848367236907.

1/1 [==============================] - ETA: 0s
1/1 [==============================] - 0s 286ms/step
[I 2024-09-27 22:46:08,203] Trial 125 finished with value: 0.2114105237325032 and parameters: {'window_size': 2, 'batch_size': 32, 'network_type': 'RNN', 'num_layers': 2, 'num_neurons': 32, 'learning_rate': 0.01, 'dropout_rate': 0.1}. Best is trial 81 with value: 0.15957848367236907.

1/1 [==============================] - ETA: 0s
1/1 [==============================] - 0s 171ms/step
[I 2024-09-27 22:46:10,523] Trial 126 finished with value: 0.2518323834737141 and parameters: {'window_size': 2, 'batch_size': 32, 'network_type': 'RNN', 'num_layers': 1, 'num_neurons': 16, 'learning_rate': 0.01, 'dropout_rate': 0.1}. Best is trial 81 with value: 0.15957848367236907.

1/1 [==============================] - ETA: 0s
1/1 [==============================] - 0s 354ms/step
[I 2024-09-27 22:46:15,587] Trial 127 finished with value: 0.24326610024770096 and parameters: {'window_size': 2, 'batch_size': 16, 'network_type': 'GRU', 'num_layers': 2, 'num_neurons': 32, 'learning_rate': 0.01, 'dropout_rate': 0.1}. Best is trial 81 with value: 0.15957848367236907.

1/1 [==============================] - ETA: 0s
1/1 [==============================] - 0s 281ms/step
[I 2024-09-27 22:46:19,242] Trial 128 finished with value: 0.2043046510787237 and parameters: {'window_size': 2, 'batch_size': 64, 'network_type': 'RNN', 'num_layers': 2, 'num_neurons': 32, 'learning_rate': 0.01, 'dropout_rate': 0.1}. Best is trial 81 with value: 0.15957848367236907.

1/1 [==============================] - ETA: 0s
1/1 [==============================] - 1s 714ms/step
[I 2024-09-27 22:46:25,231] Trial 129 finished with value: 0.2043060835883731 and parameters: {'window_size': 2, 'batch_size': 32, 'network_type': 'RNN', 'num_layers': 3, 'num_neurons': 32, 'learning_rate': 0.01, 'dropout_rate': 0.1}. Best is trial 81 with value: 0.15957848367236907.

1/1 [==============================] - ETA: 0s
1/1 [==============================] - 0s 294ms/step
[I 2024-09-27 22:46:30,367] Trial 130 finished with value: 0.17308166372208367 and parameters: {'window_size': 2, 'batch_size': 32, 'network_type': 'RNN', 'num_layers': 2, 'num_neurons': 64, 'learning_rate': 0.01, 'dropout_rate': 0.1}. Best is trial 81 with value: 0.15957848367236907.

1/1 [==============================] - ETA: 0s
1/1 [==============================] - 0s 295ms/step
[I 2024-09-27 22:46:34,559] Trial 131 finished with value: 0.3066698153359549 and parameters: {'window_size': 2, 'batch_size': 32, 'network_type': 'RNN', 'num_layers': 2, 'num_neurons': 64, 'learning_rate': 0.0001, 'dropout_rate': 0.1}. Best is trial 81 with value: 0.15957848367236907.

1/1 [==============================] - ETA: 0s
1/1 [==============================] - 0s 288ms/step
[I 2024-09-27 22:46:38,302] Trial 132 finished with value: 0.18648352845509847 and parameters: {'window_size': 2, 'batch_size': 32, 'network_type': 'RNN', 'num_layers': 2, 'num_neurons': 64, 'learning_rate': 0.01, 'dropout_rate': 0.1}. Best is trial 81 with value: 0.15957848367236907.

1/1 [==============================] - ETA: 0s
1/1 [==============================] - 0s 312ms/step
[I 2024-09-27 22:46:42,120] Trial 133 finished with value: 0.17910255840846467 and parameters: {'window_size': 2, 'batch_size': 32, 'network_type': 'RNN', 'num_layers': 2, 'num_neurons': 64, 'learning_rate': 0.01, 'dropout_rate': 0.1}. Best is trial 81 with value: 0.15957848367236907.

1/1 [==============================] - ETA: 0s
1/1 [==============================] - 0s 280ms/step
[I 2024-09-27 22:46:46,386] Trial 134 finished with value: 0.18785760084788 and parameters: {'window_size': 2, 'batch_size': 32, 'network_type': 'RNN', 'num_layers': 2, 'num_neurons': 64, 'learning_rate': 0.01, 'dropout_rate': 0.1}. Best is trial 81 with value: 0.15957848367236907.

1/1 [==============================] - ETA: 0s
1/1 [==============================] - 0s 275ms/step
[I 2024-09-27 22:46:50,238] Trial 135 finished with value: 0.277087590035938 and parameters: {'window_size': 2, 'batch_size': 32, 'network_type': 'RNN', 'num_layers': 2, 'num_neurons': 64, 'learning_rate': 0.0001, 'dropout_rate': 0.1}. Best is trial 81 with value: 0.15957848367236907.

1/1 [==============================] - ETA: 0s
1/1 [==============================] - 0s 316ms/step
[I 2024-09-27 22:46:54,149] Trial 136 finished with value: 0.1801460029965355 and parameters: {'window_size': 2, 'batch_size': 32, 'network_type': 'RNN', 'num_layers': 2, 'num_neurons': 32, 'learning_rate': 0.01, 'dropout_rate': 0.1}. Best is trial 81 with value: 0.15957848367236907.

1/1 [==============================] - ETA: 0s
1/1 [==============================] - 0s 299ms/step
[I 2024-09-27 22:46:57,720] Trial 137 finished with value: 0.232828925541469 and parameters: {'window_size': 2, 'batch_size': 32, 'network_type': 'RNN', 'num_layers': 2, 'num_neurons': 32, 'learning_rate': 0.01, 'dropout_rate': 0.3}. Best is trial 81 with value: 0.15957848367236907.

1/1 [==============================] - ETA: 0s
1/1 [==============================] - 0s 232ms/step
[I 2024-09-27 22:47:01,097] Trial 138 finished with value: 0.18494248830704457 and parameters: {'window_size': 2, 'batch_size': 32, 'network_type': 'RNN', 'num_layers': 1, 'num_neurons': 32, 'learning_rate': 0.01, 'dropout_rate': 0.1}. Best is trial 81 with value: 0.15957848367236907.

1/1 [==============================] - ETA: 0s
1/1 [==============================] - 0s 363ms/step
[I 2024-09-27 22:47:06,768] Trial 139 finished with value: 0.3641549635937339 and parameters: {'window_size': 4, 'batch_size': 32, 'network_type': 'LSTM', 'num_layers': 2, 'num_neurons': 128, 'learning_rate': 0.0001, 'dropout_rate': 0.2}. Best is trial 81 with value: 0.15957848367236907.

1/1 [==============================] - ETA: 0s
1/1 [==============================] - 0s 299ms/step
[I 2024-09-27 22:47:11,237] Trial 140 finished with value: 0.18206652327946252 and parameters: {'window_size': 2, 'batch_size': 32, 'network_type': 'RNN', 'num_layers': 2, 'num_neurons': 64, 'learning_rate': 0.01, 'dropout_rate': 0.1}. Best is trial 81 with value: 0.15957848367236907.

1/1 [==============================] - ETA: 0s
1/1 [==============================] - 0s 332ms/step
[I 2024-09-27 22:47:15,341] Trial 141 finished with value: 0.19202519734700518 and parameters: {'window_size': 2, 'batch_size': 32, 'network_type': 'RNN', 'num_layers': 2, 'num_neurons': 32, 'learning_rate': 0.01, 'dropout_rate': 0.1}. Best is trial 81 with value: 0.15957848367236907.

1/1 [==============================] - ETA: 0s
1/1 [==============================] - 0s 416ms/step
[I 2024-09-27 22:47:18,950] Trial 142 finished with value: 0.202783597219558 and parameters: {'window_size': 2, 'batch_size': 32, 'network_type': 'RNN', 'num_layers': 2, 'num_neurons': 32, 'learning_rate': 0.01, 'dropout_rate': 0.1}. Best is trial 81 with value: 0.15957848367236907.

1/1 [==============================] - ETA: 0s
1/1 [==============================] - 0s 282ms/step
[I 2024-09-27 22:47:22,659] Trial 143 finished with value: 0.17355229722885857 and parameters: {'window_size': 2, 'batch_size': 32, 'network_type': 'RNN', 'num_layers': 2, 'num_neurons': 32, 'learning_rate': 0.01, 'dropout_rate': 0.1}. Best is trial 81 with value: 0.15957848367236907.

1/1 [==============================] - ETA: 0s
1/1 [==============================] - 0s 280ms/step
[I 2024-09-27 22:47:26,685] Trial 144 finished with value: 0.18924316592443552 and parameters: {'window_size': 2, 'batch_size': 32, 'network_type': 'RNN', 'num_layers': 2, 'num_neurons': 32, 'learning_rate': 0.01, 'dropout_rate': 0.1}. Best is trial 81 with value: 0.15957848367236907.

1/1 [==============================] - ETA: 0s
1/1 [==============================] - 0s 286ms/step
[I 2024-09-27 22:47:30,710] Trial 145 finished with value: 0.1664825604756673 and parameters: {'window_size': 2, 'batch_size': 64, 'network_type': 'RNN', 'num_layers': 2, 'num_neurons': 32, 'learning_rate': 0.01, 'dropout_rate': 0.1}. Best is trial 81 with value: 0.15957848367236907.

1/1 [==============================] - ETA: 0s
1/1 [==============================] - 1s 511ms/step
[I 2024-09-27 22:47:34,574] Trial 146 finished with value: 0.20416903105236234 and parameters: {'window_size': 2, 'batch_size': 64, 'network_type': 'RNN', 'num_layers': 2, 'num_neurons': 32, 'learning_rate': 0.01, 'dropout_rate': 0.1}. Best is trial 81 with value: 0.15957848367236907.

1/1 [==============================] - ETA: 0s
1/1 [==============================] - 0s 431ms/step
[I 2024-09-27 22:47:40,421] Trial 147 finished with value: 0.20932595875683951 and parameters: {'window_size': 6, 'batch_size': 64, 'network_type': 'RNN', 'num_layers': 2, 'num_neurons': 32, 'learning_rate': 0.01, 'dropout_rate': 0.1}. Best is trial 81 with value: 0.15957848367236907.

1/1 [==============================] - ETA: 0s
1/1 [==============================] - 0s 271ms/step
[I 2024-09-27 22:47:44,247] Trial 148 finished with value: 0.20675931258428662 and parameters: {'window_size': 2, 'batch_size': 64, 'network_type': 'RNN', 'num_layers': 2, 'num_neurons': 32, 'learning_rate': 0.01, 'dropout_rate': 0.1}. Best is trial 81 with value: 0.15957848367236907.

1/1 [==============================] - ETA: 0s
1/1 [==============================] - 0s 291ms/step
[I 2024-09-27 22:47:48,236] Trial 149 finished with value: 0.3364252840223766 and parameters: {'window_size': 2, 'batch_size': 64, 'network_type': 'RNN', 'num_layers': 2, 'num_neurons': 16, 'learning_rate': 0.01, 'dropout_rate': 0.1}. Best is trial 81 with value: 0.15957848367236907.

1/1 [==============================] - ETA: 0s
1/1 [==============================] - 0s 218ms/step
[I 2024-09-27 22:47:51,281] Trial 150 finished with value: 0.23998398249489913 and parameters: {'window_size': 2, 'batch_size': 64, 'network_type': 'GRU', 'num_layers': 1, 'num_neurons': 64, 'learning_rate': 0.01, 'dropout_rate': 0.1}. Best is trial 81 with value: 0.15957848367236907.

1/1 [==============================] - ETA: 0s
1/1 [==============================] - 0s 279ms/step
[I 2024-09-27 22:47:54,758] Trial 151 finished with value: 0.19963123453231085 and parameters: {'window_size': 2, 'batch_size': 32, 'network_type': 'RNN', 'num_layers': 2, 'num_neurons': 32, 'learning_rate': 0.01, 'dropout_rate': 0.1}. Best is trial 81 with value: 0.15957848367236907.

1/1 [==============================] - ETA: 0s
1/1 [==============================] - 0s 270ms/step
[I 2024-09-27 22:47:58,605] Trial 152 finished with value: 0.18872318422226678 and parameters: {'window_size': 2, 'batch_size': 32, 'network_type': 'RNN', 'num_layers': 2, 'num_neurons': 32, 'learning_rate': 0.01, 'dropout_rate': 0.1}. Best is trial 81 with value: 0.15957848367236907.

1/1 [==============================] - ETA: 0s
1/1 [==============================] - 0s 275ms/step
[I 2024-09-27 22:48:02,335] Trial 153 finished with value: 0.23087614667983278 and parameters: {'window_size': 2, 'batch_size': 32, 'network_type': 'RNN', 'num_layers': 2, 'num_neurons': 32, 'learning_rate': 0.01, 'dropout_rate': 0.1}. Best is trial 81 with value: 0.15957848367236907.

1/1 [==============================] - ETA: 0s
1/1 [==============================] - 0s 410ms/step
[I 2024-09-27 22:48:06,020] Trial 154 finished with value: 0.20922289185296922 and parameters: {'window_size': 2, 'batch_size': 32, 'network_type': 'RNN', 'num_layers': 2, 'num_neurons': 32, 'learning_rate': 0.01, 'dropout_rate': 0.1}. Best is trial 81 with value: 0.15957848367236907.

1/1 [==============================] - ETA: 0s
1/1 [==============================] - 0s 267ms/step
[I 2024-09-27 22:48:09,545] Trial 155 finished with value: 0.2003613630476452 and parameters: {'window_size': 2, 'batch_size': 64, 'network_type': 'RNN', 'num_layers': 2, 'num_neurons': 32, 'learning_rate': 0.01, 'dropout_rate': 0.1}. Best is trial 81 with value: 0.15957848367236907.

1/1 [==============================] - ETA: 0s
1/1 [==============================] - 0s 385ms/step
[I 2024-09-27 22:48:15,241] Trial 156 finished with value: 0.1724457129977998 and parameters: {'window_size': 2, 'batch_size': 16, 'network_type': 'RNN', 'num_layers': 2, 'num_neurons': 32, 'learning_rate': 0.01, 'dropout_rate': 0.1}. Best is trial 81 with value: 0.15957848367236907.

1/1 [==============================] - ETA: 0s
1/1 [==============================] - 0s 304ms/step
[I 2024-09-27 22:48:19,398] Trial 157 finished with value: 0.1674087592079526 and parameters: {'window_size': 2, 'batch_size': 16, 'network_type': 'RNN', 'num_layers': 2, 'num_neurons': 32, 'learning_rate': 0.01, 'dropout_rate': 0.1}. Best is trial 81 with value: 0.15957848367236907.

1/1 [==============================] - ETA: 0s
1/1 [==============================] - 0s 401ms/step
[I 2024-09-27 22:48:24,681] Trial 158 finished with value: 0.20624331560589018 and parameters: {'window_size': 2, 'batch_size': 16, 'network_type': 'RNN', 'num_layers': 3, 'num_neurons': 32, 'learning_rate': 0.01, 'dropout_rate': 0.1}. Best is trial 81 with value: 0.15957848367236907.

1/1 [==============================] - ETA: 0s
1/1 [==============================] - 0s 300ms/step
[I 2024-09-27 22:48:29,724] Trial 159 finished with value: 0.16564432076045443 and parameters: {'window_size': 2, 'batch_size': 16, 'network_type': 'RNN', 'num_layers': 2, 'num_neurons': 32, 'learning_rate': 0.01, 'dropout_rate': 0.1}. Best is trial 81 with value: 0.15957848367236907.

1/1 [==============================] - ETA: 0s
1/1 [==============================] - 0s 293ms/step
[I 2024-09-27 22:48:34,270] Trial 160 finished with value: 0.17199821535746254 and parameters: {'window_size': 2, 'batch_size': 16, 'network_type': 'RNN', 'num_layers': 2, 'num_neurons': 32, 'learning_rate': 0.01, 'dropout_rate': 0.1}. Best is trial 81 with value: 0.15957848367236907.

1/1 [==============================] - ETA: 0s
1/1 [==============================] - 0s 354ms/step
[I 2024-09-27 22:48:38,301] Trial 161 finished with value: 0.18895302904219852 and parameters: {'window_size': 2, 'batch_size': 16, 'network_type': 'RNN', 'num_layers': 2, 'num_neurons': 32, 'learning_rate': 0.01, 'dropout_rate': 0.1}. Best is trial 81 with value: 0.15957848367236907.

1/1 [==============================] - ETA: 0s
1/1 [==============================] - 0s 294ms/step
[I 2024-09-27 22:48:42,053] Trial 162 finished with value: 0.19123303726741245 and parameters: {'window_size': 2, 'batch_size': 16, 'network_type': 'RNN', 'num_layers': 2, 'num_neurons': 32, 'learning_rate': 0.01, 'dropout_rate': 0.1}. Best is trial 81 with value: 0.15957848367236907.

1/1 [==============================] - ETA: 0s
1/1 [==============================] - 0s 328ms/step
[I 2024-09-27 22:48:46,025] Trial 163 finished with value: 0.1812086856932867 and parameters: {'window_size': 2, 'batch_size': 16, 'network_type': 'RNN', 'num_layers': 2, 'num_neurons': 32, 'learning_rate': 0.01, 'dropout_rate': 0.1}. Best is trial 81 with value: 0.15957848367236907.

1/1 [==============================] - ETA: 0s
1/1 [==============================] - 0s 347ms/step
[I 2024-09-27 22:48:51,150] Trial 164 finished with value: 0.1915383466084798 and parameters: {'window_size': 2, 'batch_size': 16, 'network_type': 'RNN', 'num_layers': 2, 'num_neurons': 32, 'learning_rate': 0.01, 'dropout_rate': 0.1}. Best is trial 81 with value: 0.15957848367236907.

1/1 [==============================] - ETA: 0s
1/1 [==============================] - 0s 317ms/step
[I 2024-09-27 22:48:55,644] Trial 165 finished with value: 0.18498728379749116 and parameters: {'window_size': 2, 'batch_size': 16, 'network_type': 'RNN', 'num_layers': 2, 'num_neurons': 32, 'learning_rate': 0.01, 'dropout_rate': 0.1}. Best is trial 81 with value: 0.15957848367236907.

1/1 [==============================] - ETA: 0s
1/1 [==============================] - 0s 317ms/step
[I 2024-09-27 22:48:59,460] Trial 166 finished with value: 0.1765833368755522 and parameters: {'window_size': 2, 'batch_size': 16, 'network_type': 'RNN', 'num_layers': 2, 'num_neurons': 32, 'learning_rate': 0.01, 'dropout_rate': 0.1}. Best is trial 81 with value: 0.15957848367236907.

1/1 [==============================] - ETA: 0s
1/1 [==============================] - 0s 301ms/step
[I 2024-09-27 22:49:03,145] Trial 167 finished with value: 0.17340275355747764 and parameters: {'window_size': 2, 'batch_size': 16, 'network_type': 'RNN', 'num_layers': 2, 'num_neurons': 64, 'learning_rate': 0.01, 'dropout_rate': 0.1}. Best is trial 81 with value: 0.15957848367236907.

1/1 [==============================] - ETA: 0s
1/1 [==============================] - 0s 290ms/step
[I 2024-09-27 22:49:07,747] Trial 168 finished with value: 0.159366235596793 and parameters: {'window_size': 2, 'batch_size': 16, 'network_type': 'RNN', 'num_layers': 2, 'num_neurons': 64, 'learning_rate': 0.01, 'dropout_rate': 0.1}. Best is trial 168 with value: 0.159366235596793.

1/1 [==============================] - ETA: 0s
1/1 [==============================] - 0s 285ms/step
[I 2024-09-27 22:49:12,459] Trial 169 finished with value: 0.1839221956616356 and parameters: {'window_size': 2, 'batch_size': 16, 'network_type': 'RNN', 'num_layers': 2, 'num_neurons': 64, 'learning_rate': 0.01, 'dropout_rate': 0.3}. Best is trial 168 with value: 0.159366235596793.

1/1 [==============================] - ETA: 0s
1/1 [==============================] - 0s 296ms/step
[I 2024-09-27 22:49:16,601] Trial 170 finished with value: 0.19398856299264086 and parameters: {'window_size': 2, 'batch_size': 16, 'network_type': 'RNN', 'num_layers': 2, 'num_neurons': 64, 'learning_rate': 0.01, 'dropout_rate': 0.1}. Best is trial 168 with value: 0.159366235596793.

1/1 [==============================] - ETA: 0s
1/1 [==============================] - 0s 298ms/step
[I 2024-09-27 22:49:20,545] Trial 171 finished with value: 0.17880840678442092 and parameters: {'window_size': 2, 'batch_size': 16, 'network_type': 'RNN', 'num_layers': 2, 'num_neurons': 64, 'learning_rate': 0.01, 'dropout_rate': 0.1}. Best is trial 168 with value: 0.159366235596793.

1/1 [==============================] - ETA: 0s
1/1 [==============================] - 0s 412ms/step
[I 2024-09-27 22:49:25,520] Trial 172 finished with value: 0.24211763799758182 and parameters: {'window_size': 2, 'batch_size': 16, 'network_type': 'RNN', 'num_layers': 2, 'num_neurons': 64, 'learning_rate': 0.01, 'dropout_rate': 0.1}. Best is trial 168 with value: 0.159366235596793.

1/1 [==============================] - ETA: 0s
1/1 [==============================] - 0s 323ms/step
[I 2024-09-27 22:49:29,555] Trial 173 finished with value: 0.17054126698630195 and parameters: {'window_size': 2, 'batch_size': 16, 'network_type': 'RNN', 'num_layers': 2, 'num_neurons': 64, 'learning_rate': 0.01, 'dropout_rate': 0.1}. Best is trial 168 with value: 0.159366235596793.

1/1 [==============================] - ETA: 0s
1/1 [==============================] - 0s 301ms/step
[I 2024-09-27 22:49:34,168] Trial 174 finished with value: 0.1639617751893543 and parameters: {'window_size': 2, 'batch_size': 16, 'network_type': 'RNN', 'num_layers': 2, 'num_neurons': 64, 'learning_rate': 0.01, 'dropout_rate': 0.1}. Best is trial 168 with value: 0.159366235596793.

1/1 [==============================] - ETA: 0s
1/1 [==============================] - 0s 306ms/step
[I 2024-09-27 22:49:38,929] Trial 175 finished with value: 0.16103394717261904 and parameters: {'window_size': 2, 'batch_size': 16, 'network_type': 'RNN', 'num_layers': 2, 'num_neurons': 64, 'learning_rate': 0.01, 'dropout_rate': 0.1}. Best is trial 168 with value: 0.159366235596793.

1/1 [==============================] - ETA: 0s
1/1 [==============================] - 0s 301ms/step
[I 2024-09-27 22:49:42,963] Trial 176 finished with value: 0.20620744192032583 and parameters: {'window_size': 2, 'batch_size': 16, 'network_type': 'RNN', 'num_layers': 2, 'num_neurons': 64, 'learning_rate': 0.01, 'dropout_rate': 0.1}. Best is trial 168 with value: 0.159366235596793.

1/1 [==============================] - ETA: 0s
1/1 [==============================] - 0s 246ms/step
