[I 2024-09-27 22:28:24,602] Trial 154 finished with value: 0.014781712214152008 and parameters: {'window_size': 6, 'batch_size': 64, 'network_type': 'GRU', 'num_layers': 1, 'num_neurons': 128, 'learning_rate': 0.01, 'dropout_rate': 0.2}. Best is trial 41 with value: 0.013343700938754624.

1/1 [==============================] - ETA: 0s
1/1 [==============================] - 0s 281ms/step
[I 2024-09-27 22:28:27,862] Trial 155 finished with value: 0.014181636280483682 and parameters: {'window_size': 6, 'batch_size': 64, 'network_type': 'GRU', 'num_layers': 1, 'num_neurons': 128, 'learning_rate': 0.01, 'dropout_rate': 0.2}. Best is trial 41 with value: 0.013343700938754624.

1/1 [==============================] - ETA: 0s
1/1 [==============================] - 0s 300ms/step
[I 2024-09-27 22:28:31,050] Trial 156 finished with value: 0.015358115620083268 and parameters: {'window_size': 6, 'batch_size': 64, 'network_type': 'GRU', 'num_layers': 1, 'num_neurons': 128, 'learning_rate': 0.01, 'dropout_rate': 0.2}. Best is trial 41 with value: 0.013343700938754624.

1/1 [==============================] - ETA: 0s
1/1 [==============================] - 0s 216ms/step
[I 2024-09-27 22:28:34,974] Trial 157 finished with value: 0.016324595451354992 and parameters: {'window_size': 6, 'batch_size': 64, 'network_type': 'GRU', 'num_layers': 1, 'num_neurons': 128, 'learning_rate': 0.01, 'dropout_rate': 0.1}. Best is trial 41 with value: 0.013343700938754624.

1/1 [==============================] - ETA: 0s
1/1 [==============================] - 0s 347ms/step
[I 2024-09-27 22:28:40,190] Trial 158 finished with value: 0.036333306524488705 and parameters: {'window_size': 6, 'batch_size': 64, 'network_type': 'GRU', 'num_layers': 2, 'num_neurons': 128, 'learning_rate': 0.01, 'dropout_rate': 0.2}. Best is trial 41 with value: 0.013343700938754624.

1/1 [==============================] - ETA: 0s
1/1 [==============================] - 0s 232ms/step
[I 2024-09-27 22:28:43,999] Trial 159 finished with value: 0.025434437751769973 and parameters: {'window_size': 6, 'batch_size': 16, 'network_type': 'GRU', 'num_layers': 1, 'num_neurons': 128, 'learning_rate': 0.01, 'dropout_rate': 0.2}. Best is trial 41 with value: 0.013343700938754624.

1/1 [==============================] - ETA: 0s
1/1 [==============================] - 0s 183ms/step
[I 2024-09-27 22:28:46,923] Trial 160 finished with value: 0.024537221475080993 and parameters: {'window_size': 4, 'batch_size': 64, 'network_type': 'GRU', 'num_layers': 1, 'num_neurons': 64, 'learning_rate': 0.01, 'dropout_rate': 0.3}. Best is trial 41 with value: 0.013343700938754624.

1/1 [==============================] - ETA: 0s
1/1 [==============================] - 0s 194ms/step
[I 2024-09-27 22:28:50,293] Trial 161 finished with value: 0.022468520164489733 and parameters: {'window_size': 6, 'batch_size': 64, 'network_type': 'GRU', 'num_layers': 1, 'num_neurons': 128, 'learning_rate': 0.01, 'dropout_rate': 0.2}. Best is trial 41 with value: 0.013343700938754624.

1/1 [==============================] - ETA: 0s
1/1 [==============================] - 0s 409ms/step
[I 2024-09-27 22:28:53,724] Trial 162 finished with value: 0.014938331180148682 and parameters: {'window_size': 6, 'batch_size': 64, 'network_type': 'GRU', 'num_layers': 1, 'num_neurons': 128, 'learning_rate': 0.01, 'dropout_rate': 0.2}. Best is trial 41 with value: 0.013343700938754624.

1/1 [==============================] - ETA: 0s
1/1 [==============================] - 0s 201ms/step
[I 2024-09-27 22:28:56,851] Trial 163 finished with value: 0.01381317647298176 and parameters: {'window_size': 6, 'batch_size': 64, 'network_type': 'GRU', 'num_layers': 1, 'num_neurons': 128, 'learning_rate': 0.01, 'dropout_rate': 0.2}. Best is trial 41 with value: 0.013343700938754624.

1/1 [==============================] - ETA: 0s
1/1 [==============================] - 0s 208ms/step
[I 2024-09-27 22:29:00,562] Trial 164 finished with value: 0.02106452984280052 and parameters: {'window_size': 6, 'batch_size': 64, 'network_type': 'GRU', 'num_layers': 1, 'num_neurons': 128, 'learning_rate': 0.01, 'dropout_rate': 0.2}. Best is trial 41 with value: 0.013343700938754624.

1/1 [==============================] - ETA: 0s
1/1 [==============================] - 0s 216ms/step
[I 2024-09-27 22:29:03,538] Trial 165 finished with value: 0.014222419102986668 and parameters: {'window_size': 6, 'batch_size': 64, 'network_type': 'GRU', 'num_layers': 1, 'num_neurons': 128, 'learning_rate': 0.01, 'dropout_rate': 0.2}. Best is trial 41 with value: 0.013343700938754624.

1/1 [==============================] - ETA: 0s
1/1 [==============================] - 0s 254ms/step
[I 2024-09-27 22:29:07,636] Trial 166 finished with value: 0.03434968757629391 and parameters: {'window_size': 6, 'batch_size': 64, 'network_type': 'GRU', 'num_layers': 1, 'num_neurons': 128, 'learning_rate': 0.01, 'dropout_rate': 0.2}. Best is trial 41 with value: 0.013343700938754624.

1/1 [==============================] - ETA: 0s
1/1 [==============================] - 0s 204ms/step
[I 2024-09-27 22:29:10,832] Trial 167 finished with value: 0.015030462265014637 and parameters: {'window_size': 6, 'batch_size': 64, 'network_type': 'GRU', 'num_layers': 1, 'num_neurons': 128, 'learning_rate': 0.01, 'dropout_rate': 0.2}. Best is trial 41 with value: 0.013343700938754624.

1/1 [==============================] - ETA: 0s
1/1 [==============================] - 0s 193ms/step
[I 2024-09-27 22:29:13,630] Trial 168 finished with value: 0.0262155813641018 and parameters: {'window_size': 6, 'batch_size': 64, 'network_type': 'RNN', 'num_layers': 1, 'num_neurons': 32, 'learning_rate': 0.01, 'dropout_rate': 0.2}. Best is trial 41 with value: 0.013343700938754624.

1/1 [==============================] - ETA: 0s
1/1 [==============================] - 0s 204ms/step
[I 2024-09-27 22:29:16,903] Trial 169 finished with value: 0.019483506308661556 and parameters: {'window_size': 6, 'batch_size': 64, 'network_type': 'GRU', 'num_layers': 1, 'num_neurons': 128, 'learning_rate': 0.01, 'dropout_rate': 0.2}. Best is trial 41 with value: 0.013343700938754624.

1/1 [==============================] - ETA: 0s
1/1 [==============================] - 0s 269ms/step
[I 2024-09-27 22:29:19,925] Trial 170 finished with value: 0.01877566803826225 and parameters: {'window_size': 6, 'batch_size': 64, 'network_type': 'GRU', 'num_layers': 1, 'num_neurons': 128, 'learning_rate': 0.01, 'dropout_rate': 0.2}. Best is trial 41 with value: 0.013343700938754624.

1/1 [==============================] - ETA: 0s
1/1 [==============================] - 0s 202ms/step
[I 2024-09-27 22:29:22,844] Trial 171 finished with value: 0.01822160975138345 and parameters: {'window_size': 6, 'batch_size': 64, 'network_type': 'GRU', 'num_layers': 1, 'num_neurons': 128, 'learning_rate': 0.01, 'dropout_rate': 0.2}. Best is trial 41 with value: 0.013343700938754624.

1/1 [==============================] - ETA: 0s
1/1 [==============================] - 0s 208ms/step
[I 2024-09-27 22:29:25,992] Trial 172 finished with value: 0.015299173249138716 and parameters: {'window_size': 6, 'batch_size': 64, 'network_type': 'GRU', 'num_layers': 1, 'num_neurons': 128, 'learning_rate': 0.01, 'dropout_rate': 0.2}. Best is trial 41 with value: 0.013343700938754624.

1/1 [==============================] - ETA: 0s
1/1 [==============================] - 0s 195ms/step
[I 2024-09-27 22:29:28,864] Trial 173 finished with value: 0.015634765095180962 and parameters: {'window_size': 6, 'batch_size': 64, 'network_type': 'GRU', 'num_layers': 1, 'num_neurons': 128, 'learning_rate': 0.01, 'dropout_rate': 0.2}. Best is trial 41 with value: 0.013343700938754624.

1/1 [==============================] - ETA: 0s
1/1 [==============================] - 0s 216ms/step
[I 2024-09-27 22:29:32,025] Trial 174 finished with value: 0.014920773612128378 and parameters: {'window_size': 6, 'batch_size': 64, 'network_type': 'GRU', 'num_layers': 1, 'num_neurons': 128, 'learning_rate': 0.01, 'dropout_rate': 0.2}. Best is trial 41 with value: 0.013343700938754624.

1/1 [==============================] - ETA: 0s
1/1 [==============================] - 0s 205ms/step
[I 2024-09-27 22:29:34,918] Trial 175 finished with value: 0.02254284053378634 and parameters: {'window_size': 6, 'batch_size': 64, 'network_type': 'GRU', 'num_layers': 1, 'num_neurons': 128, 'learning_rate': 0.01, 'dropout_rate': 0.2}. Best is trial 41 with value: 0.013343700938754624.

1/1 [==============================] - ETA: 0s
1/1 [==============================] - 0s 265ms/step
[I 2024-09-27 22:29:38,250] Trial 176 finished with value: 0.04053174887763126 and parameters: {'window_size': 6, 'batch_size': 64, 'network_type': 'GRU', 'num_layers': 1, 'num_neurons': 128, 'learning_rate': 0.01, 'dropout_rate': 0.2}. Best is trial 41 with value: 0.013343700938754624.

1/1 [==============================] - ETA: 0s
1/1 [==============================] - 1s 535ms/step
[I 2024-09-27 22:29:46,094] Trial 177 finished with value: 0.07841110547383628 and parameters: {'window_size': 6, 'batch_size': 64, 'network_type': 'LSTM', 'num_layers': 3, 'num_neurons': 128, 'learning_rate': 0.01, 'dropout_rate': 0.1}. Best is trial 41 with value: 0.013343700938754624.

1/1 [==============================] - ETA: 0s
1/1 [==============================] - 0s 200ms/step
[I 2024-09-27 22:29:49,931] Trial 178 finished with value: 0.01597457673814562 and parameters: {'window_size': 6, 'batch_size': 64, 'network_type': 'GRU', 'num_layers': 1, 'num_neurons': 128, 'learning_rate': 0.01, 'dropout_rate': 0.2}. Best is trial 41 with value: 0.013343700938754624.

1/1 [==============================] - ETA: 0s
1/1 [==============================] - 0s 250ms/step
[I 2024-09-27 22:29:53,190] Trial 179 finished with value: 0.035768746449397155 and parameters: {'window_size': 2, 'batch_size': 64, 'network_type': 'GRU', 'num_layers': 1, 'num_neurons': 128, 'learning_rate': 0.01, 'dropout_rate': 0.2}. Best is trial 41 with value: 0.013343700938754624.

1/1 [==============================] - ETA: 0s
1/1 [==============================] - 0s 201ms/step
[I 2024-09-27 22:29:56,131] Trial 180 finished with value: 0.01877933703528509 and parameters: {'window_size': 6, 'batch_size': 64, 'network_type': 'GRU', 'num_layers': 1, 'num_neurons': 128, 'learning_rate': 0.01, 'dropout_rate': 0.2}. Best is trial 41 with value: 0.013343700938754624.

1/1 [==============================] - ETA: 0s
1/1 [==============================] - 0s 203ms/step
[I 2024-09-27 22:29:59,254] Trial 181 finished with value: 0.016450898382398844 and parameters: {'window_size': 6, 'batch_size': 64, 'network_type': 'GRU', 'num_layers': 1, 'num_neurons': 128, 'learning_rate': 0.01, 'dropout_rate': 0.2}. Best is trial 41 with value: 0.013343700938754624.

1/1 [==============================] - ETA: 0s
1/1 [==============================] - 0s 196ms/step
[I 2024-09-27 22:30:02,109] Trial 182 finished with value: 0.0179035063849555 and parameters: {'window_size': 6, 'batch_size': 64, 'network_type': 'GRU', 'num_layers': 1, 'num_neurons': 128, 'learning_rate': 0.01, 'dropout_rate': 0.2}. Best is trial 41 with value: 0.013343700938754624.

1/1 [==============================] - ETA: 0s
1/1 [==============================] - 0s 196ms/step
[I 2024-09-27 22:30:05,218] Trial 183 finished with value: 0.014984990543789323 and parameters: {'window_size': 6, 'batch_size': 64, 'network_type': 'GRU', 'num_layers': 1, 'num_neurons': 128, 'learning_rate': 0.01, 'dropout_rate': 0.2}. Best is trial 41 with value: 0.013343700938754624.

1/1 [==============================] - ETA: 0s
1/1 [==============================] - 0s 281ms/step
[I 2024-09-27 22:30:08,239] Trial 184 finished with value: 0.02887247827317976 and parameters: {'window_size': 6, 'batch_size': 64, 'network_type': 'GRU', 'num_layers': 1, 'num_neurons': 128, 'learning_rate': 0.01, 'dropout_rate': 0.2}. Best is trial 41 with value: 0.013343700938754624.

1/1 [==============================] - ETA: 0s
1/1 [==============================] - 0s 206ms/step
[I 2024-09-27 22:30:11,330] Trial 185 finished with value: 0.015478609720865875 and parameters: {'window_size': 6, 'batch_size': 64, 'network_type': 'GRU', 'num_layers': 1, 'num_neurons': 128, 'learning_rate': 0.01, 'dropout_rate': 0.1}. Best is trial 41 with value: 0.013343700938754624.

1/1 [==============================] - ETA: 0s
1/1 [==============================] - 0s 281ms/step
[I 2024-09-27 22:30:15,890] Trial 186 finished with value: 0.026276192665100062 and parameters: {'window_size': 6, 'batch_size': 32, 'network_type': 'GRU', 'num_layers': 1, 'num_neurons': 128, 'learning_rate': 0.01, 'dropout_rate': 0.2}. Best is trial 41 with value: 0.013343700938754624.

1/1 [==============================] - ETA: 0s
1/1 [==============================] - 0s 296ms/step
[I 2024-09-27 22:30:19,051] Trial 187 finished with value: 0.015414130740695519 and parameters: {'window_size': 6, 'batch_size': 64, 'network_type': 'GRU', 'num_layers': 1, 'num_neurons': 128, 'learning_rate': 0.01, 'dropout_rate': 0.2}. Best is trial 41 with value: 0.013343700938754624.

1/1 [==============================] - ETA: 0s
1/1 [==============================] - 0s 201ms/step
[I 2024-09-27 22:30:22,044] Trial 188 finished with value: 0.017865875985887306 and parameters: {'window_size': 6, 'batch_size': 64, 'network_type': 'GRU', 'num_layers': 1, 'num_neurons': 128, 'learning_rate': 0.01, 'dropout_rate': 0.2}. Best is trial 41 with value: 0.013343700938754624.

1/1 [==============================] - ETA: 0s
1/1 [==============================] - 0s 198ms/step
[I 2024-09-27 22:30:25,328] Trial 189 finished with value: 0.04009760189056393 and parameters: {'window_size': 6, 'batch_size': 64, 'network_type': 'GRU', 'num_layers': 1, 'num_neurons': 16, 'learning_rate': 0.01, 'dropout_rate': 0.2}. Best is trial 41 with value: 0.013343700938754624.

1/1 [==============================] - ETA: 0s
1/1 [==============================] - 0s 434ms/step
[I 2024-09-27 22:30:30,195] Trial 190 finished with value: 0.061960174984402094 and parameters: {'window_size': 6, 'batch_size': 64, 'network_type': 'GRU', 'num_layers': 2, 'num_neurons': 128, 'learning_rate': 0.01, 'dropout_rate': 0.1}. Best is trial 41 with value: 0.013343700938754624.

1/1 [==============================] - ETA: 0s
1/1 [==============================] - 0s 198ms/step
[I 2024-09-27 22:30:33,708] Trial 191 finished with value: 0.027241290622287292 and parameters: {'window_size': 6, 'batch_size': 64, 'network_type': 'GRU', 'num_layers': 1, 'num_neurons': 128, 'learning_rate': 0.01, 'dropout_rate': 0.2}. Best is trial 41 with value: 0.013343700938754624.

1/1 [==============================] - ETA: 0s
1/1 [==============================] - 0s 213ms/step
[I 2024-09-27 22:30:41,359] Trial 192 finished with value: 0.020917282528347386 and parameters: {'window_size': 6, 'batch_size': 64, 'network_type': 'GRU', 'num_layers': 1, 'num_neurons': 128, 'learning_rate': 0.0001, 'dropout_rate': 0.2}. Best is trial 41 with value: 0.013343700938754624.

1/1 [==============================] - ETA: 0s
1/1 [==============================] - 0s 202ms/step
[I 2024-09-27 22:30:44,232] Trial 193 finished with value: 0.028871100743611617 and parameters: {'window_size': 6, 'batch_size': 64, 'network_type': 'GRU', 'num_layers': 1, 'num_neurons': 128, 'learning_rate': 0.01, 'dropout_rate': 0.2}. Best is trial 41 with value: 0.013343700938754624.

1/1 [==============================] - ETA: 0s
1/1 [==============================] - 0s 254ms/step
[I 2024-09-27 22:30:47,776] Trial 194 finished with value: 0.013369148360358333 and parameters: {'window_size': 6, 'batch_size': 64, 'network_type': 'GRU', 'num_layers': 1, 'num_neurons': 128, 'learning_rate': 0.01, 'dropout_rate': 0.2}. Best is trial 41 with value: 0.013343700938754624.

1/1 [==============================] - ETA: 0s
1/1 [==============================] - 0s 199ms/step
[I 2024-09-27 22:30:51,719] Trial 195 finished with value: 0.02352266142103406 and parameters: {'window_size': 6, 'batch_size': 64, 'network_type': 'GRU', 'num_layers': 1, 'num_neurons': 128, 'learning_rate': 0.01, 'dropout_rate': 0.2}. Best is trial 41 with value: 0.013343700938754624.

1/1 [==============================] - ETA: 0s
1/1 [==============================] - 0s 201ms/step
[I 2024-09-27 22:30:54,606] Trial 196 finished with value: 0.020520044326782214 and parameters: {'window_size': 6, 'batch_size': 64, 'network_type': 'GRU', 'num_layers': 1, 'num_neurons': 128, 'learning_rate': 0.01, 'dropout_rate': 0.2}. Best is trial 41 with value: 0.013343700938754624.

1/1 [==============================] - ETA: 0s
1/1 [==============================] - 0s 216ms/step
[I 2024-09-27 22:30:57,977] Trial 197 finished with value: 0.014666630533006467 and parameters: {'window_size': 6, 'batch_size': 64, 'network_type': 'GRU', 'num_layers': 1, 'num_neurons': 128, 'learning_rate': 0.01, 'dropout_rate': 0.2}. Best is trial 41 with value: 0.013343700938754624.

1/1 [==============================] - ETA: 0s
1/1 [==============================] - 0s 238ms/step
[I 2024-09-27 22:31:01,088] Trial 198 finished with value: 0.015029956075880277 and parameters: {'window_size': 6, 'batch_size': 64, 'network_type': 'GRU', 'num_layers': 1, 'num_neurons': 128, 'learning_rate': 0.01, 'dropout_rate': 0.2}. Best is trial 41 with value: 0.013343700938754624.

1/1 [==============================] - ETA: 0s
1/1 [==============================] - 0s 206ms/step
[I 2024-09-27 22:31:03,988] Trial 199 finished with value: 0.014151147312588128 and parameters: {'window_size': 6, 'batch_size': 64, 'network_type': 'GRU', 'num_layers': 1, 'num_neurons': 64, 'learning_rate': 0.01, 'dropout_rate': 0.2}. Best is trial 41 with value: 0.013343700938754624.
C:\Users\user\AppData\Local\pypoetry\Cache\virtualenvs\transfer-learning-c0qmjA8b-py3.9\lib\site-packages\keras\src\engine\training.py:3103: UserWarning: You are saving your model as an HDF5 file via `model.save()`. This file format is considered legacy. We recommend using instead the native Keras format, e.g. `model.save('my_model.keras')`.
  saving_api.save_model(
Best parameters: {'window_size': 6, 'batch_size': 64, 'network_type': 'GRU', 'num_layers': 1, 'num_neurons': 128, 'learning_rate': 0.01, 'dropout_rate': 0.2}

1/1 [==============================] - ETA: 0s
1/1 [==============================] - 0s 216ms/step
[I 2024-09-27 22:31:08,104] A new study created in memory with name: no-name-309dc3da-5ea6-4da5-b48c-7dec88d34d14

1/1 [==============================] - ETA: 0s
1/1 [==============================] - 0s 195ms/step
[I 2024-09-27 22:31:10,708] Trial 0 finished with value: 0.20123663601122402 and parameters: {'window_size': 4, 'batch_size': 16, 'network_type': 'RNN', 'num_layers': 1, 'num_neurons': 128, 'learning_rate': 0.01, 'dropout_rate': 0.2}. Best is trial 0 with value: 0.20123663601122402.

1/1 [==============================] - ETA: 0s
1/1 [==============================] - 0s 344ms/step
[I 2024-09-27 22:31:15,553] Trial 1 finished with value: 0.4037603716008803 and parameters: {'window_size': 6, 'batch_size': 16, 'network_type': 'LSTM', 'num_layers': 2, 'num_neurons': 32, 'learning_rate': 0.0001, 'dropout_rate': 0.3}. Best is trial 0 with value: 0.20123663601122402.

1/1 [==============================] - ETA: 0s
1/1 [==============================] - 0s 285ms/step
[I 2024-09-27 22:31:19,452] Trial 2 finished with value: 0.19470797416142055 and parameters: {'window_size': 2, 'batch_size': 64, 'network_type': 'RNN', 'num_layers': 2, 'num_neurons': 128, 'learning_rate': 0.01, 'dropout_rate': 0.2}. Best is trial 2 with value: 0.19470797416142055.

1/1 [==============================] - ETA: 0s
1/1 [==============================] - 1s 506ms/step
[I 2024-09-27 22:31:26,936] Trial 3 finished with value: 0.32248104749407086 and parameters: {'window_size': 2, 'batch_size': 32, 'network_type': 'LSTM', 'num_layers': 3, 'num_neurons': 64, 'learning_rate': 0.01, 'dropout_rate': 0.2}. Best is trial 2 with value: 0.19470797416142055.

1/1 [==============================] - ETA: 0s
1/1 [==============================] - 0s 199ms/step
[I 2024-09-27 22:31:30,228] Trial 4 finished with value: 0.286512856684233 and parameters: {'window_size': 4, 'batch_size': 64, 'network_type': 'GRU', 'num_layers': 1, 'num_neurons': 64, 'learning_rate': 0.01, 'dropout_rate': 0.1}. Best is trial 2 with value: 0.19470797416142055.

1/1 [==============================] - ETA: 0s
1/1 [==============================] - 0s 371ms/step
[I 2024-09-27 22:31:34,172] Trial 5 finished with value: 0.38430638475979073 and parameters: {'window_size': 6, 'batch_size': 16, 'network_type': 'RNN', 'num_layers': 2, 'num_neurons': 128, 'learning_rate': 0.0001, 'dropout_rate': 0.3}. Best is trial 2 with value: 0.19470797416142055.

1/1 [==============================] - ETA: 0s
1/1 [==============================] - 1s 548ms/step
[I 2024-09-27 22:31:40,829] Trial 6 finished with value: 0.27081093143281476 and parameters: {'window_size': 2, 'batch_size': 64, 'network_type': 'GRU', 'num_layers': 3, 'num_neurons': 16, 'learning_rate': 0.01, 'dropout_rate': 0.3}. Best is trial 2 with value: 0.19470797416142055.

1/1 [==============================] - ETA: 0s
1/1 [==============================] - 0s 214ms/step
[I 2024-09-27 22:31:43,623] Trial 7 finished with value: 0.3931755857467651 and parameters: {'window_size': 6, 'batch_size': 16, 'network_type': 'LSTM', 'num_layers': 1, 'num_neurons': 64, 'learning_rate': 0.0001, 'dropout_rate': 0.2}. Best is trial 2 with value: 0.19470797416142055.

1/1 [==============================] - ETA: 0s
1/1 [==============================] - 0s 287ms/step
