[I 2024-09-27 22:53:48,849] Trial 27 finished with value: 0.0855308602483649 and parameters: {'window_size': 2, 'batch_size': 64, 'network_type': 'RNN', 'num_layers': 1, 'num_neurons': 128, 'learning_rate': 0.01, 'dropout_rate': 0.1}. Best is trial 13 with value: 0.08461090976313543.
2024-09-27 22:53:49.934864: W tensorflow/core/grappler/utils/graph_view.cc:849] No registered '' OpKernel for CPU devices compatible with node {{node sequential_1837/simple_rnn_1087/while/body/_1/sequential_1837/simple_rnn_1087/while/simple_rnn_cell/Relu}}
	.  Registered:  <no registered kernels>

2024-09-27 22:53:49.975657: E tensorflow/core/grappler/optimizers/tfg_optimizer_hook.cc:135] tfg_optimizer{any(tfg-consolidate-attrs,tfg-toposort,tfg-shape-inference{graph-version=0},tfg-prepare-attrs-export)} failed: INVALID_ARGUMENT: Node sequential_1837/simple_rnn_1087/while/body/_1/sequential_1837/simple_rnn_1087/while/simple_rnn_cell/Relu has an empty op name
	when importing GraphDef to MLIR module in GrapplerHook
2024-09-27 22:53:50.010067: E tensorflow/core/grappler/optimizers/meta_optimizer.cc:961] remapper failed: NOT_FOUND: Op type not registered '' in binary running on DESKTOP-CO9CTFR. Make sure the Op and Kernel are registered in the binary running in this process. Note that if you are loading a saved graph which used ops from tf.contrib (e.g. `tf.contrib.resampler`), accessing should be done before importing the graph, as contrib ops are lazily registered when the module is first accessed.
2024-09-27 22:53:50.017738: E tensorflow/core/grappler/optimizers/tfg_optimizer_hook.cc:135] tfg_optimizer{any(tfg-consolidate-attrs,tfg-functional-to-region,tfg.func(tfg-cf-sink),tfg-region-to-functional{force-control-capture=true},tfg-lift-legacy-call,symbol-privatize{},symbol-dce,tfg-prepare-attrs-export)} failed: INVALID_ARGUMENT: Node sequential_1837/simple_rnn_1087/while/body/_1/sequential_1837/simple_rnn_1087/while/simple_rnn_cell/Relu has an empty op name
	when importing GraphDef to MLIR module in GrapplerHook
2024-09-27 22:53:50.018748: E tensorflow/core/grappler/optimizers/tfg_optimizer_hook.cc:135] tfg_optimizer{any(tfg-consolidate-attrs,tfg-functional-to-region,tfg.func(tfg-cf-sink),tfg-region-to-functional{force-control-capture=true},tfg-lift-legacy-call,symbol-privatize{},symbol-dce,tfg-prepare-attrs-export)} failed: INVALID_ARGUMENT: Node sequential_1837/simple_rnn_1087/while/body/_1/sequential_1837/simple_rnn_1087/while/simple_rnn_cell/Relu has an empty op name
	when importing GraphDef to MLIR module in GrapplerHook
2024-09-27 22:53:50.020819: W tensorflow/core/common_runtime/optimize_function_graph_utils.cc:615] Ignoring multi-device function optimization failure: INVALID_ARGUMENT: Node 'sequential_1837/simple_rnn_1087/while/body/_1/sequential_1837/simple_rnn_1087/while/simple_rnn_cell/Relu' does not specify an operation

1/1 [==============================] - ETA: 0s
1/1 [==============================] - 0s 201ms/step
[I 2024-09-27 22:53:51,853] Trial 28 finished with value: 0.18386917069753012 and parameters: {'window_size': 6, 'batch_size': 16, 'network_type': 'RNN', 'num_layers': 1, 'num_neurons': 128, 'learning_rate': 0.01, 'dropout_rate': 0.3}. Best is trial 13 with value: 0.08461090976313543.

1/1 [==============================] - ETA: 0s
1/1 [==============================] - 0s 430ms/step
[I 2024-09-27 22:53:57,778] Trial 29 finished with value: 0.12255619049072267 and parameters: {'window_size': 2, 'batch_size': 32, 'network_type': 'GRU', 'num_layers': 2, 'num_neurons': 128, 'learning_rate': 0.01, 'dropout_rate': 0.2}. Best is trial 13 with value: 0.08461090976313543.
2024-09-27 22:54:00.247625: W tensorflow/core/grappler/utils/graph_view.cc:849] No registered '' OpKernel for CPU devices compatible with node {{node sequential_1839/simple_rnn_1088/while/body/_1/sequential_1839/simple_rnn_1088/while/simple_rnn_cell/Relu}}
	.  Registered:  <no registered kernels>

2024-09-27 22:54:00.249135: W tensorflow/core/grappler/utils/graph_view.cc:849] No registered '' OpKernel for CPU devices compatible with node {{node sequential_1839/simple_rnn_1089/while/body/_74/sequential_1839/simple_rnn_1089/while/simple_rnn_cell/Relu}}
	.  Registered:  <no registered kernels>

2024-09-27 22:54:00.250479: W tensorflow/core/grappler/utils/graph_view.cc:849] No registered '' OpKernel for CPU devices compatible with node {{node sequential_1839/simple_rnn_1090/while/body/_157/sequential_1839/simple_rnn_1090/while/simple_rnn_cell/Relu}}
	.  Registered:  <no registered kernels>

2024-09-27 22:54:00.350871: E tensorflow/core/grappler/optimizers/tfg_optimizer_hook.cc:135] tfg_optimizer{any(tfg-consolidate-attrs,tfg-toposort,tfg-shape-inference{graph-version=0},tfg-prepare-attrs-export)} failed: INVALID_ARGUMENT: Node sequential_1839/simple_rnn_1090/while/body/_157/sequential_1839/simple_rnn_1090/while/simple_rnn_cell/Relu has an empty op name
	when importing GraphDef to MLIR module in GrapplerHook
2024-09-27 22:54:00.426924: E tensorflow/core/grappler/optimizers/tfg_optimizer_hook.cc:135] tfg_optimizer{any(tfg-consolidate-attrs,tfg-functional-to-region,tfg.func(tfg-cf-sink),tfg-region-to-functional{force-control-capture=true},tfg-lift-legacy-call,symbol-privatize{},symbol-dce,tfg-prepare-attrs-export)} failed: INVALID_ARGUMENT: Node sequential_1839/simple_rnn_1088/while/body/_1/sequential_1839/simple_rnn_1088/while/simple_rnn_cell/Relu has an empty op name
	when importing GraphDef to MLIR module in GrapplerHook
2024-09-27 22:54:00.429152: E tensorflow/core/grappler/optimizers/tfg_optimizer_hook.cc:135] tfg_optimizer{any(tfg-consolidate-attrs,tfg-functional-to-region,tfg.func(tfg-cf-sink),tfg-region-to-functional{force-control-capture=true},tfg-lift-legacy-call,symbol-privatize{},symbol-dce,tfg-prepare-attrs-export)} failed: INVALID_ARGUMENT: Node sequential_1839/simple_rnn_1088/while/body/_1/sequential_1839/simple_rnn_1088/while/simple_rnn_cell/Relu has an empty op name
	when importing GraphDef to MLIR module in GrapplerHook
2024-09-27 22:54:00.433952: W tensorflow/core/common_runtime/optimize_function_graph_utils.cc:615] Ignoring multi-device function optimization failure: INVALID_ARGUMENT: Node 'sequential_1839/simple_rnn_1088/while/body/_1/sequential_1839/simple_rnn_1088/while/simple_rnn_cell/Relu' does not specify an operation

1/1 [==============================] - ETA: 0s
1/1 [==============================] - 0s 492ms/step
[I 2024-09-27 22:54:02,641] Trial 30 finished with value: 0.2889165974299113 and parameters: {'window_size': 6, 'batch_size': 64, 'network_type': 'RNN', 'num_layers': 3, 'num_neurons': 128, 'learning_rate': 0.01, 'dropout_rate': 0.2}. Best is trial 13 with value: 0.08461090976313543.

1/1 [==============================] - ETA: 0s
1/1 [==============================] - 0s 167ms/step
[I 2024-09-27 22:54:05,123] Trial 31 finished with value: 0.08416931684393632 and parameters: {'window_size': 2, 'batch_size': 64, 'network_type': 'RNN', 'num_layers': 1, 'num_neurons': 128, 'learning_rate': 0.01, 'dropout_rate': 0.1}. Best is trial 31 with value: 0.08416931684393632.

1/1 [==============================] - ETA: 0s
1/1 [==============================] - 0s 229ms/step
[I 2024-09-27 22:54:09,341] Trial 32 finished with value: 0.09059233625311602 and parameters: {'window_size': 2, 'batch_size': 64, 'network_type': 'RNN', 'num_layers': 1, 'num_neurons': 128, 'learning_rate': 0.01, 'dropout_rate': 0.1}. Best is trial 31 with value: 0.08416931684393632.

1/1 [==============================] - ETA: 0s
1/1 [==============================] - 0s 200ms/step
[I 2024-09-27 22:54:12,162] Trial 33 finished with value: 0.2124843805212724 and parameters: {'window_size': 2, 'batch_size': 64, 'network_type': 'RNN', 'num_layers': 1, 'num_neurons': 128, 'learning_rate': 0.01, 'dropout_rate': 0.1}. Best is trial 31 with value: 0.08416931684393632.

1/1 [==============================] - ETA: 0s
1/1 [==============================] - 1s 511ms/step
[I 2024-09-27 22:54:18,121] Trial 34 finished with value: 0.1952226727990543 and parameters: {'window_size': 4, 'batch_size': 32, 'network_type': 'RNN', 'num_layers': 3, 'num_neurons': 128, 'learning_rate': 0.01, 'dropout_rate': 0.1}. Best is trial 31 with value: 0.08416931684393632.

1/1 [==============================] - ETA: 0s
1/1 [==============================] - 0s 210ms/step
[I 2024-09-27 22:54:21,714] Trial 35 finished with value: 0.1319062268106561 and parameters: {'window_size': 2, 'batch_size': 64, 'network_type': 'GRU', 'num_layers': 1, 'num_neurons': 128, 'learning_rate': 0.01, 'dropout_rate': 0.2}. Best is trial 31 with value: 0.08416931684393632.

1/1 [==============================] - ETA: 0s
1/1 [==============================] - 0s 209ms/step
[I 2024-09-27 22:54:24,743] Trial 36 finished with value: 2.6445665835698446 and parameters: {'window_size': 6, 'batch_size': 64, 'network_type': 'LSTM', 'num_layers': 1, 'num_neurons': 128, 'learning_rate': 0.01, 'dropout_rate': 0.1}. Best is trial 31 with value: 0.08416931684393632.

1/1 [==============================] - ETA: 0s
1/1 [==============================] - 0s 419ms/step
[I 2024-09-27 22:54:30,261] Trial 37 finished with value: 0.1340325067419755 and parameters: {'window_size': 2, 'batch_size': 64, 'network_type': 'RNN', 'num_layers': 3, 'num_neurons': 64, 'learning_rate': 0.01, 'dropout_rate': 0.1}. Best is trial 31 with value: 0.08416931684393632.

1/1 [==============================] - ETA: 0s
1/1 [==============================] - 0s 263ms/step
[I 2024-09-27 22:54:33,209] Trial 38 finished with value: 1.3432786491057453 and parameters: {'window_size': 4, 'batch_size': 32, 'network_type': 'LSTM', 'num_layers': 1, 'num_neurons': 32, 'learning_rate': 0.01, 'dropout_rate': 0.3}. Best is trial 31 with value: 0.08416931684393632.

1/1 [==============================] - ETA: 0s
1/1 [==============================] - 0s 288ms/step
[I 2024-09-27 22:54:37,039] Trial 39 finished with value: 0.0952457181528995 and parameters: {'window_size': 2, 'batch_size': 64, 'network_type': 'RNN', 'num_layers': 2, 'num_neurons': 128, 'learning_rate': 0.01, 'dropout_rate': 0.2}. Best is trial 31 with value: 0.08416931684393632.

1/1 [==============================] - ETA: 0s
1/1 [==============================] - 1s 817ms/step
[I 2024-09-27 22:54:44,627] Trial 40 finished with value: 0.26842123661041256 and parameters: {'window_size': 6, 'batch_size': 16, 'network_type': 'LSTM', 'num_layers': 3, 'num_neurons': 32, 'learning_rate': 0.01, 'dropout_rate': 0.1}. Best is trial 31 with value: 0.08416931684393632.

1/1 [==============================] - ETA: 0s
1/1 [==============================] - 0s 180ms/step
[I 2024-09-27 22:54:47,474] Trial 41 finished with value: 0.09782905247336941 and parameters: {'window_size': 2, 'batch_size': 64, 'network_type': 'RNN', 'num_layers': 1, 'num_neurons': 128, 'learning_rate': 0.01, 'dropout_rate': 0.1}. Best is trial 31 with value: 0.08416931684393632.

1/1 [==============================] - ETA: 0s
1/1 [==============================] - 0s 194ms/step
[I 2024-09-27 22:54:50,475] Trial 42 finished with value: 0.10963833251752353 and parameters: {'window_size': 2, 'batch_size': 64, 'network_type': 'RNN', 'num_layers': 1, 'num_neurons': 128, 'learning_rate': 0.01, 'dropout_rate': 0.1}. Best is trial 31 with value: 0.08416931684393632.

1/1 [==============================] - ETA: 0s
1/1 [==============================] - 0s 173ms/step
[I 2024-09-27 22:54:53,203] Trial 43 finished with value: 0.0899484910964966 and parameters: {'window_size': 2, 'batch_size': 64, 'network_type': 'RNN', 'num_layers': 1, 'num_neurons': 128, 'learning_rate': 0.01, 'dropout_rate': 0.1}. Best is trial 31 with value: 0.08416931684393632.

1/1 [==============================] - ETA: 0s
1/1 [==============================] - 0s 173ms/step
[I 2024-09-27 22:54:55,937] Trial 44 finished with value: 0.1477208142561071 and parameters: {'window_size': 4, 'batch_size': 64, 'network_type': 'RNN', 'num_layers': 1, 'num_neurons': 128, 'learning_rate': 0.01, 'dropout_rate': 0.1}. Best is trial 31 with value: 0.08416931684393632.

1/1 [==============================] - ETA: 0s
1/1 [==============================] - 0s 213ms/step
[I 2024-09-27 22:54:58,965] Trial 45 finished with value: 0.10615619508843674 and parameters: {'window_size': 2, 'batch_size': 64, 'network_type': 'GRU', 'num_layers': 1, 'num_neurons': 128, 'learning_rate': 0.01, 'dropout_rate': 0.1}. Best is trial 31 with value: 0.08416931684393632.

1/1 [==============================] - ETA: 0s
1/1 [==============================] - 0s 160ms/step
[I 2024-09-27 22:55:02,273] Trial 46 finished with value: 0.15743584607776842 and parameters: {'window_size': 2, 'batch_size': 32, 'network_type': 'RNN', 'num_layers': 1, 'num_neurons': 64, 'learning_rate': 0.01, 'dropout_rate': 0.1}. Best is trial 31 with value: 0.08416931684393632.

1/1 [==============================] - ETA: 0s
1/1 [==============================] - 0s 234ms/step
[I 2024-09-27 22:55:04,741] Trial 47 finished with value: 0.10522229967619244 and parameters: {'window_size': 2, 'batch_size': 64, 'network_type': 'RNN', 'num_layers': 1, 'num_neurons': 128, 'learning_rate': 0.01, 'dropout_rate': 0.1}. Best is trial 31 with value: 0.08416931684393632.

1/1 [==============================] - ETA: 0s
1/1 [==============================] - 0s 173ms/step
[I 2024-09-27 22:55:11,050] Trial 48 finished with value: 0.6433750507204156 and parameters: {'window_size': 2, 'batch_size': 64, 'network_type': 'RNN', 'num_layers': 1, 'num_neurons': 32, 'learning_rate': 0.0001, 'dropout_rate': 0.1}. Best is trial 31 with value: 0.08416931684393632.

1/1 [==============================] - ETA: 0s
1/1 [==============================] - 0s 213ms/step
[I 2024-09-27 22:55:13,984] Trial 49 finished with value: 1.4632905397415161 and parameters: {'window_size': 4, 'batch_size': 64, 'network_type': 'LSTM', 'num_layers': 1, 'num_neurons': 64, 'learning_rate': 0.01, 'dropout_rate': 0.3}. Best is trial 31 with value: 0.08416931684393632.

1/1 [==============================] - ETA: 0s
1/1 [==============================] - 0s 387ms/step
[I 2024-09-27 22:55:18,666] Trial 50 finished with value: 0.1139579882872732 and parameters: {'window_size': 2, 'batch_size': 16, 'network_type': 'RNN', 'num_layers': 2, 'num_neurons': 16, 'learning_rate': 0.01, 'dropout_rate': 0.1}. Best is trial 31 with value: 0.08416931684393632.

1/1 [==============================] - ETA: 0s
1/1 [==============================] - 0s 173ms/step
[I 2024-09-27 22:55:21,894] Trial 51 finished with value: 0.0937470908917879 and parameters: {'window_size': 2, 'batch_size': 64, 'network_type': 'RNN', 'num_layers': 1, 'num_neurons': 128, 'learning_rate': 0.01, 'dropout_rate': 0.1}. Best is trial 31 with value: 0.08416931684393632.

1/1 [==============================] - ETA: 0s
1/1 [==============================] - 0s 173ms/step
[I 2024-09-27 22:55:24,234] Trial 52 finished with value: 0.2161785634693347 and parameters: {'window_size': 2, 'batch_size': 64, 'network_type': 'RNN', 'num_layers': 1, 'num_neurons': 128, 'learning_rate': 0.01, 'dropout_rate': 0.1}. Best is trial 31 with value: 0.08416931684393632.

1/1 [==============================] - ETA: 0s
1/1 [==============================] - 0s 160ms/step
[I 2024-09-27 22:55:27,055] Trial 53 finished with value: 0.21104002822072887 and parameters: {'window_size': 2, 'batch_size': 64, 'network_type': 'RNN', 'num_layers': 1, 'num_neurons': 128, 'learning_rate': 0.01, 'dropout_rate': 0.1}. Best is trial 31 with value: 0.08416931684393632.

1/1 [==============================] - ETA: 0s
1/1 [==============================] - 0s 173ms/step
[I 2024-09-27 22:55:29,390] Trial 54 finished with value: 0.11507841838033576 and parameters: {'window_size': 2, 'batch_size': 64, 'network_type': 'RNN', 'num_layers': 1, 'num_neurons': 128, 'learning_rate': 0.01, 'dropout_rate': 0.1}. Best is trial 31 with value: 0.08416931684393632.

1/1 [==============================] - ETA: 0s
1/1 [==============================] - 0s 160ms/step
[I 2024-09-27 22:55:32,006] Trial 55 finished with value: 0.13807228369461863 and parameters: {'window_size': 2, 'batch_size': 64, 'network_type': 'RNN', 'num_layers': 1, 'num_neurons': 128, 'learning_rate': 0.01, 'dropout_rate': 0.1}. Best is trial 31 with value: 0.08416931684393632.

1/1 [==============================] - ETA: 0s
1/1 [==============================] - 0s 164ms/step
[I 2024-09-27 22:55:34,512] Trial 56 finished with value: 0.11306181952827855 and parameters: {'window_size': 2, 'batch_size': 64, 'network_type': 'RNN', 'num_layers': 1, 'num_neurons': 16, 'learning_rate': 0.01, 'dropout_rate': 0.1}. Best is trial 31 with value: 0.08416931684393632.

1/1 [==============================] - ETA: 0s
1/1 [==============================] - 0s 173ms/step
[I 2024-09-27 22:55:37,206] Trial 57 finished with value: 0.13642772880353427 and parameters: {'window_size': 2, 'batch_size': 64, 'network_type': 'RNN', 'num_layers': 1, 'num_neurons': 64, 'learning_rate': 0.01, 'dropout_rate': 0.1}. Best is trial 31 with value: 0.08416931684393632.

1/1 [==============================] - ETA: 0s
1/1 [==============================] - 0s 173ms/step
[I 2024-09-27 22:55:39,621] Trial 58 finished with value: 0.10265629547520688 and parameters: {'window_size': 2, 'batch_size': 64, 'network_type': 'RNN', 'num_layers': 1, 'num_neurons': 128, 'learning_rate': 0.01, 'dropout_rate': 0.2}. Best is trial 31 with value: 0.08416931684393632.

1/1 [==============================] - ETA: 0s
1/1 [==============================] - 1s 520ms/step
[I 2024-09-27 22:55:45,876] Trial 59 finished with value: 0.3624695714950562 and parameters: {'window_size': 6, 'batch_size': 64, 'network_type': 'GRU', 'num_layers': 3, 'num_neurons': 16, 'learning_rate': 0.01, 'dropout_rate': 0.1}. Best is trial 31 with value: 0.08416931684393632.

1/1 [==============================] - ETA: 0s
1/1 [==============================] - 0s 161ms/step
[I 2024-09-27 22:55:49,223] Trial 60 finished with value: 0.18106408573451793 and parameters: {'window_size': 2, 'batch_size': 16, 'network_type': 'RNN', 'num_layers': 1, 'num_neurons': 32, 'learning_rate': 0.01, 'dropout_rate': 0.3}. Best is trial 31 with value: 0.08416931684393632.

1/1 [==============================] - ETA: 0s
1/1 [==============================] - 0s 267ms/step
[I 2024-09-27 22:55:52,398] Trial 61 finished with value: 0.13129436347359105 and parameters: {'window_size': 2, 'batch_size': 64, 'network_type': 'RNN', 'num_layers': 1, 'num_neurons': 16, 'learning_rate': 0.01, 'dropout_rate': 0.1}. Best is trial 31 with value: 0.08416931684393632.

1/1 [==============================] - ETA: 0s
1/1 [==============================] - 0s 187ms/step
[I 2024-09-27 22:55:56,279] Trial 62 finished with value: 0.08596369929062693 and parameters: {'window_size': 2, 'batch_size': 64, 'network_type': 'RNN', 'num_layers': 1, 'num_neurons': 16, 'learning_rate': 0.01, 'dropout_rate': 0.1}. Best is trial 31 with value: 0.08416931684393632.

1/1 [==============================] - ETA: 0s
1/1 [==============================] - 0s 214ms/step
[I 2024-09-27 22:55:59,814] Trial 63 finished with value: 0.19900074522118819 and parameters: {'window_size': 2, 'batch_size': 64, 'network_type': 'RNN', 'num_layers': 1, 'num_neurons': 16, 'learning_rate': 0.01, 'dropout_rate': 0.1}. Best is trial 31 with value: 0.08416931684393632.

1/1 [==============================] - ETA: 0s
1/1 [==============================] - 0s 187ms/step
[I 2024-09-27 22:56:02,735] Trial 64 finished with value: 0.1178155534643876 and parameters: {'window_size': 2, 'batch_size': 64, 'network_type': 'RNN', 'num_layers': 1, 'num_neurons': 16, 'learning_rate': 0.01, 'dropout_rate': 0.1}. Best is trial 31 with value: 0.08416931684393632.

1/1 [==============================] - ETA: 0s
1/1 [==============================] - 0s 293ms/step
[I 2024-09-27 22:56:06,550] Trial 65 finished with value: 0.09479067832545231 and parameters: {'window_size': 2, 'batch_size': 64, 'network_type': 'RNN', 'num_layers': 2, 'num_neurons': 16, 'learning_rate': 0.01, 'dropout_rate': 0.1}. Best is trial 31 with value: 0.08416931684393632.

1/1 [==============================] - ETA: 0s
1/1 [==============================] - 0s 173ms/step
[I 2024-09-27 22:56:09,097] Trial 66 finished with value: 0.14061055690363836 and parameters: {'window_size': 2, 'batch_size': 32, 'network_type': 'RNN', 'num_layers': 1, 'num_neurons': 64, 'learning_rate': 0.01, 'dropout_rate': 0.1}. Best is trial 31 with value: 0.08416931684393632.

1/1 [==============================] - ETA: 0s
1/1 [==============================] - 0s 173ms/step
[I 2024-09-27 22:56:11,792] Trial 67 finished with value: 0.11533481743461209 and parameters: {'window_size': 2, 'batch_size': 64, 'network_type': 'RNN', 'num_layers': 1, 'num_neurons': 128, 'learning_rate': 0.01, 'dropout_rate': 0.1}. Best is trial 31 with value: 0.08416931684393632.

1/1 [==============================] - ETA: 0s
1/1 [==============================] - 0s 173ms/step
[I 2024-09-27 22:56:14,620] Trial 68 finished with value: 0.12762934370601878 and parameters: {'window_size': 4, 'batch_size': 64, 'network_type': 'RNN', 'num_layers': 1, 'num_neurons': 16, 'learning_rate': 0.01, 'dropout_rate': 0.1}. Best is trial 31 with value: 0.08416931684393632.

1/1 [==============================] - ETA: 0s
1/1 [==============================] - 0s 280ms/step
[I 2024-09-27 22:56:17,728] Trial 69 finished with value: 0.23354662287862676 and parameters: {'window_size': 2, 'batch_size': 64, 'network_type': 'LSTM', 'num_layers': 1, 'num_neurons': 128, 'learning_rate': 0.01, 'dropout_rate': 0.1}. Best is trial 31 with value: 0.08416931684393632.

1/1 [==============================] - ETA: 0s
1/1 [==============================] - 0s 202ms/step
